,author,content,description,publishedAt,source,title,url,urlToImage,relevancy
64,The Hindu,"Perpetual Winning, Furious N Fast and Tommaso caught the eye when the horses were exercised here on Thursday (Nov. 22) morning. Inner sand: 600m: Flying Dragon (Ayyar) 38.5. Moved freely. Perfect Star (Bhawani) 42. Easy. 2/y/o Princess Avika (D.A. Naik), Pric… [+2987 chars]","Perpetual Winning, Furious N Fast and Tommaso caught the eye when the horses were exercised here on Thursday (Nov. 22) morning.Inner sand:600m: Flying Dragon (Ayyar) 38.5. Moved freely. Perfect Star (",2018-11-22T11:53:58Z,"{'id': 'the-hindu', 'name': 'The Hindu'}","Perpetual Winning, Furious N Fast and Tommaso catch the eye",https://www.thehindu.com/sport/races/perpetual-winning-furious-n-fast-and-tommaso-catch-the-eye/article25566931.ece,https://www.thehindu.com/static/theme/default/base/img/og-image.jpg,110
65,Joseph Young,,"Over the past 24 hours, the crypto market has lost about $4 billion of its valuation against the US dollar. Major cryptocurrencies like Bitcoin (BTC), Bitcoin Cash (BCH), Ethereum (ETH), and Ripple (XRP) extended their losses by 2 to 8 percent. The price of B…",2018-11-22T11:56:46Z,"{'id': 'crypto-coins-news', 'name': 'Crypto Coins News'}",Crypto Market Continues Slow Bleed Out But Tokens Record 20% Gains,https://www.ccn.com/crypto-market-continues-slow-bleed-out-but-tokens-record-20-gains/,,25
66,Martin Young,"When a blockchain forks, the new chain is often seen as an improvement over the existing one. The loyalties of the developers and crypto communities may be divided, but failure to come to consensus will result in a forked chain. Stress Test Breaks BSV This is… [+2951 chars]","When a blockchain forks, the new chain is often seen as an improvement over the existing one. The loyalties of the developers and crypto communities may be divided, but failure to come to consensus will result in a forked chain. Stress Test Breaks BSV This is…",2018-11-22T12:00:58Z,"{'id': None, 'name': 'Newsbtc.com'}",Forking Bitcoin Cash Fracas Caused More Harm Than Good to Crypto,https://www.newsbtc.com/2018/11/22/forking-bitcoin-cash-fracas-caused-more-harm-than-good-to-crypto/,https://www.newsbtc.com/wp-content/uploads/2018/02/Bitcoin_Cash_Price_BCH_USD2.jpg,58
67,Martin Beltov,"Scan Your System for Malicious Files Threats such as Delphimorix may be persistent on your system. They tend to re-appear if not fully deleted. A malware removal tool like SpyHunter will help you to remove malicious programs, saving you the time and the strug… [+12543 chars]",The Delphimorix virus is a new generic ransomware that appears to include elements from several different families of threats. It is probably a custom creation or order made by an unknown hacker or criminal group. We anticipate that as such it can be updated …,2018-11-22T12:09:00Z,"{'id': None, 'name': 'Sensorstechforum.com'}",Delphimorix Virus – How to Remove It (+Restore Encrypted Files),https://sensorstechforum.com/delphimorix-virus-remove/,https://sensorstechforum.com/wp-content/uploads/2018/11/Delphimorix-virus-image-sensorstechforum-com.jpg,118
68,"Anthony Cuthbertson, Anthony Cuthbertson","The annual shopping bonanza that is Black Friday is almost here, and for the sixth year in a row it's also coming to holders of the cryptocurrency bitcoin. The unofficial start to the Christmas shopping period comes at a turbulent time for bitcoin, coming at … [+6208 chars]","Cryptocurrency exchanges hold bitcoin giveaways, while merchants list exclusive deals fro people paying in digital currency",2018-11-22T12:20:00Z,"{'id': 'independent', 'name': 'Independent'}",Bitcoin Black Friday 2018: Deals and giveaways spread online as cryptocurrency hits 12-month low,https://www.independent.co.uk/life-style/gadgets-and-tech/news/bitcoin-black-friday-2018-best-deals-giveaways-online-cryptocurrency-a8646491.html,https://static.independent.co.uk/s3fs-public/thumbnails/image/2018/10/31/13/bitcoin-birthday-explainer-.jpg,103
69,Reuters,"Get breaking news alerts and special reports. The news and stories that matter, delivered weekday mornings. SUBSCRIBE Nov. 22, 2018 / 12:23 PM GMT JERUSALEM An Israeli-American man was sentenced to 10 years in prison in Israel on Thursday for making about 2,0… [+2500 chars]","An Israeli-American man was sentenced to 10 years in prison in Israel on Thursday for making about 2,000 hoax bomb threats that forced evacuations of U.S. Jewish community centers.",2018-11-22T12:23:27Z,"{'id': 'nbc-news', 'name': 'NBC News'}",U.S.-Israeli man sentenced to 10 years over anti-Semitic bomb threats,https://www.nbcnews.com/news/world/u-s-israeli-man-sentenced-10-years-over-anti-semitic-n939281,https://media4.s-nbcnews.com/j/newscms/2017_12/1942381/jcc-ejo-032317_3e076b1e8e8864bfcb39e592dad803dd.1200;630;7;70;5.jpg,127
70,Mark O'Byrne,"Is Brexit a Massive Threat to Globalisation? As Theresa May heads back to Brussels today in a last ditch effort to renegotiate her Brexit deal in order to get it passed through the British Parliament, we take a look not just at the current state of DIS-unity … [+4763 chars]","Is Brexit a Massive Threat to Globalisation? As Theresa May heads back to Brussels today in a last ditch effort to renegotiate her Brexit deal in order to get it passed through the British Parliament, we take a look not … Read more › <!-- end of.read-more -->",2018-11-22T12:28:45Z,"{'id': None, 'name': 'Maxkeiser.com'}",Is Brexit a Massive Threat to Globalisation?,https://www.maxkeiser.com/2018/11/is-brexit-a-massive-threat-to-globalisation/,,92
71,Tyler Durden,"S&amp;P futures slumped into the red, following a drop in European stocks while Asian shares traded mixed in a subdued day of trading thanks to Thanksgiving holiday; the big moves were in FX where the pound jumped, the euro strengthened and the dollar slumped… [+13007 chars]","S&P futures slumped into the red, following a drop in European stocks while Asian shares traded mixed in a subdued day of trading thanks to Thanksgiving holiday; the big moves were in FX where the pound jumped, the euro strengthened and the dollar slumped aft…",2018-11-22T12:47:01Z,"{'id': None, 'name': 'Zerohedge.com'}","Global Markets Slide In Thin Trading, Pound Soars On Post-Brexit Agreement",https://www.zerohedge.com/news/2018-11-22/global-markets-slide-thin-trading-pound-soars-post-brexit-agreement,https://www.zerohedge.com/sites/default/files/styles/max_650x650/public/2018-11/trader%20sleeping%20%282%29.JPG?itok=nVPgWdlS,130
72,,"Officials from the city of Valdez, Alaska have admitted last week to paying $26,623.97 to hackers after the city's IT network was crippled by a ransomware infection in July. ""Valdez Police Department [...] reached out through our law enforcement channels for … [+4264 chars]","#1237775: City of Valdez, Alaska admits to paying off ransomware infection. Officials from the city of Valdez, Alaska have admitted last week to paying $26,623.97 to hackers after the city's IT network was crippled by a ransomware infection in July. ""Valdez P…",2018-11-22T12:59:00Z,"{'id': None, 'name': 'Brica.de'}","City of Valdez, Alaska admits to paying off ransomware infection",https://brica.de/alerts/alert/public/1237775/city-of-valdez-alaska-admits-to-paying-off-ransomware-infection/,,113
73,Frere Enterprises,"PETALUMA, Calif., Nov. 22, 2018 /PRNewswire/ -- It may be possible to find an opportunity within a market by studying the history of that market. FinTech is currently experiencing a financial boom and many entrepreneurs may want to be a part of that boom, but… [+4435 chars]","PETALUMA, Calif., Nov. 22, 2018 /PRNewswire/ -- It may be possible to find an opportunity within a market by studying the history of that market. FinTech is currently experiencing a financial boom and many entrepreneurs may want to be a part of that boom, but…",2018-11-22T13:00:00Z,"{'id': None, 'name': 'Prnewswire.com'}",Frere Enterprises: Key Opportunities for Entrepreneurs Found in FinTech History,https://www.prnewswire.com/news-releases/frere-enterprises-key-opportunities-for-entrepreneurs-found-in-fintech-history-300754583.html,https://mma.prnewswire.com/media/788439/Frere_Enterprises.jpg?p=facebook,117
74,Martin Young,"Back in the days of the Wild West, gold prices would dictate the profitability of prospecting and mining. Around 150 years later not much has changed with regards to the economics of mining, however the commodity is a little different now. Bitcoin has had its… [+2462 chars]","Back in the days of the Wild West, gold prices would dictate the profitability of prospecting and mining. Around 150 years later not much has changed with regards to the economics of mining, however the commodity is a little different now. Flagship Mining Rig…",2018-11-22T13:00:16Z,"{'id': None, 'name': 'Newsbtc.com'}",Profits Plunge With Prices as Bitcoin Mining Rigs Go Dark,https://www.newsbtc.com/2018/11/22/profits-plunge-with-prices-as-bitcoin-mining-rigs-go-dark/,https://www.newsbtc.com/wp-content/uploads/2018/05/bitcoinmining2.jpg,55
75,,"PETALUMA, Calif., Nov. 22, 2018 /PRNewswire/ -- It may be possible to find an opportunity within a market by studying the history of that market. FinTech is currently experiencing a financial boom and many entrepreneurs may want to be a part of that boom, but… [+4731 chars]","PETALUMA, Calif., Nov. 22, 2018 /PRNewswire/ -- It may be possible to find an opportunity within a market by studying the history of that market. FinTech is currently experiencing a financial boom and many entrepreneurs may want to be a part of that boom, but…",2018-11-22T13:00:25Z,"{'id': None, 'name': 'Sys-con.com'}",Frere Enterprises: Key Opportunities for Entrepreneurs Found in FinTech History,http://news.sys-con.com/node/4349642,,132
76,Ian Sherr,"For generations, the president of the United States has ushered in the holiday season by pardoning a turkey, saving it from the Thanksgiving dinner table. Unfortunately for the tech industry, there's no saving its turkeys. The list of tech screwups, blunders … [+9269 chars]","The tech industry has had so many screwups this year, it's hard to keep track. But with CNET's 2018 edition of Tech Turkeys, we're gonna try.",2018-11-22T13:00:59Z,"{'id': None, 'name': 'Cnet.com'}","Facebook's Zuckerberg, Elon Musk and bitcoin: The biggest Tech Turkeys of 2018 - CNET",https://www.cnet.com/news/facebooks-zuckerberg-elon-musk-and-bitcoin-the-biggest-tech-turkeys-of-2018/,https://cnet2.cbsistatic.com/img/paOxTqE6fpKtdyZoEwrpSw32kic=/724x407/2018/11/14/ff17124a-1e3b-4eb9-a43c-63ed2babbd87/gettyimages-625462846.jpg,3
77,,"Those wanting to get Phoronix Premium to enjoy ad-free browsing and multi-page article viewing on a single page can do so for just $25 USD, a nearly 30% savings! Or there's an even better deal if you want lifetime access. The annual rate of Phoronix Premium t… [+2177 chars]","Those wanting to get Phoronix Premium to enjoy ad-free browsing and multi-page article viewing on a single page can do so for just $25 USD, a nearly 30% savings! Or there's an even better deal if you want lifetime access...",2018-11-22T13:14:45Z,"{'id': None, 'name': 'Phoronix.com'}",Black Friday Deal: Go Premium While Supporting Linux Hardware Reviews & Open-Source News,https://www.phoronix.com/scan.php?page=news_item&px=Premium-Black-Friday-2018&utm_source=feedburner&utm_medium=feed&utm_campaign=Feed%3A+Phoronix+%28Phoronix%29,,32
78,,"By Insikt Group on November 20, 2018 Scope Note : To create the following actor profile, Insikt Group used OSINT, Recorded Future data, and dark web analysis to identify the contact information, alternative aliases, and TTPs used by the actor tessa88. This pr… [+13312 chars]","Insikt Group analyzed underground forum discussions and discovered images of the individual behind notorious hacker tessa88, revealing their true identity.",2018-11-22T13:15:23Z,"{'id': None, 'name': 'Recordedfuture.com'}",Unmasking Notorious Hacker Tessa88,https://www.recordedfuture.com/tessa88-identity-revealed/,https://www.recordedfuture.com/assets/default-social-media-card.png,11
79,Abhinav28,"Drogi Wykopowiczu w zaczonym linku do Polityki Prywatnoci przypominamy podstawowe informacje z zakresu przetwarzania danych osobowych dostarczanych przez Ciebie podczas korzystania z naszego serwisu. Zamykajc ten komunikat (klikajc w przycisk X), potwierdzasz… [+47 chars]",A blog about hacking cracking concepts with tutorials including carding free bitcoin mining hacking whatsapp Phishing methods and tutorials by abhinav,2018-11-22T13:17:36Z,"{'id': None, 'name': 'Wykop.pl'}",Hacking knowledge,https://www.wykop.pl/link/4657353/hacking-knowledge/,"https://www.wykop.pl/cdn/c3397993/link_etz5G9cYcFir8jUB9nLZuTt24KyYXwWO,w1200h627.jpg",97
80,Anonymous Coward,"... when fits of creativity run strong, more than one programmer or writer has been known to abandon the desktop for the more spacious floor. -- Fred Brooks","Bitcoin has been one of the most common trends in today&rsquo;s world. Since last year it has been the talk of investment news, as it rose up as one of the easiest scheme to get rich. There was a new currency that took the world by storm and was on the verge …",2018-11-22T13:20:30Z,"{'id': None, 'name': 'Slashdot.org'}",Getting the Bitcoin- A better investment,https://slashdot.org/submission/8874512/getting-the-bitcoin--a-better-investment,,116
81,Cointelegraph By William Suberg,,French authorities are sending mixed signals about the legitimacy of an agreement to sell Bitcoin at tobacco kiosks from January 2019.,2018-11-22T13:24:00Z,"{'id': None, 'name': 'Cointelegraph.com'}",France: Central Bank Does Not Endorse Plans for Tobacco Shops to Sell Bitcoin,https://cointelegraph.com/news/france-central-bank-does-not-endorse-plans-for-tobacco-shops-to-sell-bitcoin,https://images.cointelegraph.com/images/740_aHR0cHM6Ly9zMy5jb2ludGVsZWdyYXBoLmNvbS9zdG9yYWdlL3VwbG9hZHMvdmlldy9jNDNmYzk1NzcwMmI2MDFjMzIwOGNhMmM0MTliYmY3Ni5qcGc=.jpg,28
82,feedfeeder,"... when fits of creativity run strong, more than one programmer or writer has been known to abandon the desktop for the more spacious floor. -- Fred Brooks","The tech industry has had so many screwups this year, it's hard to keep track. But with CNET's 2018 edition of Tech Turkeys, we're gonna try.",2018-11-22T13:32:28Z,"{'id': None, 'name': 'Slashdot.org'}","Facebook's Zuckerberg, Elon Musk and bitcoin: The biggest Tech Turkeys of 2018 - CNET",https://slashdot.org/firehose.pl?op=view&amp;id=104431392,,125
83,Mix,"It appears hackers were able to seize control of the email address of cryptocurrency exchange desk Uphold and blast its users with a link to a Bitcoin BTC giveaway scam. Scammers sent links to a phishing campaign, designed to dupe naive investors out of their… [+2322 chars]","It appears hackers were able to seize control of the email address of cryptocurrency exchange desk Uphold – and blast its users with a link to a Bitcoin giveaway scam. Scammers sent links to a phishing campaign, designed to dupe naive investors out of their c…",2018-11-22T13:41:41Z,"{'id': 'the-next-web', 'name': 'The Next Web'}",Don’t fall for the Black Friday-themed Bitcoin giveaway scams,https://thenextweb.com/hardfork/2018/11/22/black-friday-bitcoin-giveaway-scam/,https://img-cdn.tnwcdn.com/image/hardfork?filter_last=1&fit=1280%2C640&url=https%3A%2F%2Fcdn0.tnwcdn.com%2Fwp-content%2Fblogs.dir%2F1%2Ffiles%2F2018%2F11%2Fblack-friday-bitcoin-giveaway-scam-cryptocurrency-exhcange-uphold.jpg&signature=cfe9ddae6753172361f4df278e3433d1,2
84,,Don’t fall for the Black Friday-themed Bitcoin giveaway scams,Don’t fall for the Black Friday-themed Bitcoin giveaway scams,2018-11-22T13:43:51Z,"{'id': 'the-next-web', 'name': 'The Next Web'}",Don’t fall for the Black Friday-themed Bitcoin giveaway scams,http://cc.thenextweb.com/post/180376907640/httpsthenextwebcomhardfork20181122black-friday,https://66.media.tumblr.com/266d10115d58ceb86f5a4572e7d517da/tumblr_pilkt3AdS21qejjfeo1_1280.jpg,91
85,"Justin McQueen, Analyst, Justin McQueen","MARKET DEVELOPMENT – GBP SOARS, EURO RESILIENT, USD SOFTER GBP : The Pound is the clear outperformer in today’s session, which initially soared to one-week highs above 1.29, following reports that the EU-UK have agreed on future ties post Brexit. However, GBP… [+2958 chars]","The Pound is the clear outperformer in today’s session, which initially soared to one-week highs above 1.29, following reports that the EU-UK have agreed on future ties post Brexit.",2018-11-22T13:45:00Z,"{'id': None, 'name': 'Dailyfx.com'}","GBP Soars, Euro Resilient, while USD Softens - US Market Open",https://www.dailyfx.com/forex/fundamental/daily_briefing/daily_pieces/us_am_briefing/2018/11/22/GBP-Soars-Euro-Resilient-while-USD-Softens--US-Market-Open.html,,128
86,Berminal - The Crypto News Platform,"After rebounding from a new low yesterday, the crypto market is in red today. However, the loss is very minimal. In fact, the top 20 cryptocurrencies are down by less than 5%, except for Bitcoin Cash which is down by nearly 8%. Bitcoin Cash ABC made a controv… [+2608 chars]","The State of The Market — November 22, 2018
BTC: $4,502.02 (-2.06%)
XRP: $0.437498 (-1.55%)
ETH: $132.47 (-3.10%)",2018-11-22T13:51:33Z,"{'id': None, 'name': 'Hackernoon.com'}","Saudi Arabia To Launch Its Own Crypto Next Year, And Circle’s Auditor Attests USDC Is Fully Backed",https://hackernoon.com/saudi-arabia-to-launch-its-own-crypto-next-year-and-circles-auditor-attests-usdc-is-fully-backed-24f03bcc6f92,https://cdn-images-1.medium.com/max/1200/1*tQrDGxW9maNY-eMW-vlR1w.jpeg,89
87,David Canellis,"The French confederation of tobacconists is hellbent on allowing tobacco stores (tabacs) across the country sell special coupons for Bitcoin BTC and Ethereum, as a way of keeping up with the times. Announced suddenly via local media, confederation president P… [+1723 chars]","The French confederation of tobacconists is hellbent on allowing tobacco stores (tabacs) across the country sell special coupons for Bitcoin and Ethereum, as a way of keeping up with the times. Announced suddenly via local media, confederation president Phili…",2018-11-22T13:51:36Z,"{'id': 'the-next-web', 'name': 'The Next Web'}",French tabacs introduce questionable plan to sell Bitcoin coupons,https://thenextweb.com/hardfork/2018/11/22/bitcoin-french-tobacconists/,https://img-cdn.tnwcdn.com/image/hardfork?filter_last=1&fit=1280%2C640&url=https%3A%2F%2Fcdn0.tnwcdn.com%2Fwp-content%2Fblogs.dir%2F1%2Ffiles%2F2018%2F10%2Ffrench-agent-leaks-bitcoin-dark-web-blockchain-illegal-croissant.png&signature=f65c196e5f3c9f68e8081c605622894f,1
88,,French tabacs introduce questionable plan to sell Bitcoin coupons,French tabacs introduce questionable plan to sell Bitcoin coupons,2018-11-22T13:53:56Z,"{'id': 'the-next-web', 'name': 'The Next Web'}",French tabacs introduce questionable plan to sell Bitcoin...,http://cc.thenextweb.com/post/180377101395/httpsthenextwebcomhardfork20181122bitcoin-frenc,https://66.media.tumblr.com/773049d5191422d9248e2403c671bc13/tumblr_pill9wjrPp1qejjfeo1_1280.png,88
89,Jimmy Aki,Brooklyn-based startup Snark.art has launched its blockchain laboratory to tokenize creative artworks of artists. The startup is kicking off with a partnership with acclaimed artist Eve Sussman whose project 89 seconds Atomized will be tokenized on the blockc… [+3329 chars],Brooklyn-based startup Snark.art has launched its blockchain laboratory to tokenize creative artworks of artists. The startup is kicking off with a partnership with acclaimed artist Eve Sussman whose project 89 seconds Atomized will be tokenized on the blockc…,2018-11-22T13:56:27Z,"{'id': None, 'name': 'Bitcoinmagazine.com'}",Snark.art Launches Blockchain Laboratory for Tokenizing Artworks,https://bitcoinmagazine.com/articles/snarkart-launches-blockchain-laboratory-tokenizing-artworks/,https://fs.bitcoinmagazine.com/img/images/snarkart.max-800x800.jpg,63
90,Alexandra Ma,,"Many people have used Instagram to post photos of the devastating wildfires in Northern and Southern California, which have left at least 84 people dead. Many Instagram influencers have used hashtags related to the event to promote unrelated products. Using k…",2018-11-22T14:00:29Z,"{'id': 'business-insider', 'name': 'Business Insider'}",Instagram influencers are using hashtags about the devastating California wildfires to promote products,https://www.businessinsider.com/instagram-influencers-hashtag-california-wildfires-to-promote-products-2018-11,https://amp.businessinsider.com/images/5be9b83466be50146846c96a-1920-960.jpg,8
91,Nick Chong,"Since the crypto industry’s monumental rise to prominence on a planetary stage, pundits and consumers alike have sought to predict where Bitcoin (BTC), a mechanism to achieve financial freedom, is bearing. While some have succeeded, by luck or other means, ot… [+3453 chars]","Since the crypto industry’s monumental rise to prominence on a planetary stage, pundits and consumers alike have sought to predict where Bitcoin (BTC), a mechanism to achieve financial freedom, is bearing. While some have succeeded, by luck or other means, ot…",2018-11-22T14:00:34Z,"{'id': None, 'name': 'Newsbtc.com'}","Price Predictions Roam Free As Bitcoin Stabilizes Above $4,500",https://www.newsbtc.com/2018/11/22/price-predictions-roam-free-as-bitcoin-stabilizes-above-4500/,https://www.newsbtc.com/wp-content/uploads/2018/11/bitcoinprices.jpg,59
92,Michaelangelo Conte | The Jersey Journal,"JERSEY CITY -- Bayonne and Police Chief Robert Geisler have released a list of safety tips for the holiday season, an opportune time for burglars and thieves to commit crimes while homes are full of gifts and stores are full of shoppers When shopping online, … [+2602 chars]",Bayonne has released a list of tips to avoid being victimized by thieves and fraudsters during the holiday season.,2018-11-22T14:07:25Z,"{'id': None, 'name': 'Nj.com'}",Bayonne issues tips to avoid being victimized during the holidays,https://www.nj.com/hudson/index.ssf/2018/11/bayonne_issues_tips_to_avoid_being_victimized_duri.html,http://static.advance.net/static/njo/static/img/logos/logo_fb.jpg,90
93,Reuters,"An Israeli-American man was sentenced Thursday to 10 years in prison in Israel for making about 2,000 hoax bomb threats that forced evacuations of U.S. Jewish community centres and caused planes to make emergency landings. The threats, by phone and email, wer… [+2875 chars]","An Israeli-American man was sentenced to 10 years in prison in Israel on Thursday for making about 2,000 hoax bomb threats that forced evacuations of U.S. Jewish community centres and planes to make emergency landings.",2018-11-22T14:22:53Z,"{'id': 'cbc-news', 'name': 'CBC News'}","Teen who made threats to Jewish centres, airports around the world is sentenced to prison",https://www.cbc.ca/news/world/prison-sentence-bomb-threats-1.4915943,https://i.cbc.ca/1.4915977.1542893677!/fileImage/httpImage/image.jpg_gen/derivatives/16x9_620/israel-us-bomb-threats.jpg,67
94,Marianna,"Minutes of The Bitcoin Foundation Board Meeting held on October 16, 2018 Present: Bobby Lee Brock Pierce (Chairman) Bruce Fenton Llew Claasen (Executive Director) Michael Perklin Vinny Lingham Absent: None Approval of the agenda The agenda for the meeting was… [+3894 chars]","Minutes of The Bitcoin Foundation Board Meeting held on October 16, 2018 Present: Bobby Lee Brock Pierce (Chairman) Bruce Fenton Llew Claasen (Executive Director) Michael Perklin Vinny Lingham Absent: None Approval of the agenda The agenda for the meeting was…",2018-11-22T14:31:09Z,"{'id': None, 'name': 'Bitcoinfoundation.org'}",10.16.18 Minutes of Regular Meeting of the Board of Directors of The Bitcoin Foundation,https://bitcoinfoundation.org/10-16-18-minutes-of-regular-meeting-of-the-board-of-directors-of-the-bitcoin-foundation/,https://bitcoinfoundation.org/wp-content/uploads/2017/01/page-1@2x.png,38
95,Yogita Khatri,"The Norwegian government has scrapped a power subsidy currently granted to bitcoin miners. According to a report from local news outlet Aftenposten, in its state budget, the government said that cryptocurrency miners in the country will have to pay normal ele… [+2000 chars]","The Norwegian government has scrapped a subsidy on electricity tax for cryptocurrency miners in its state budget, a report says.",2018-11-22T14:35:15Z,"{'id': None, 'name': 'Coindesk.com'}",Norway Ends Power Tax Subsidy for Bitcoin Miners,https://www.coindesk.com/norway-ends-power-tax-subsidy-for-bitcoin-miners,https://www.coindesk.com/wp-content/uploads/2018/11/shutterstock_566474158.jpg,16
96,Jimmy Aki,"MV Index Solutions (MVIS), a subsidiary of investment management firm VanEck, has announced the launch of MVIS Bitcoin U.S. OTC Spot Index (MVBTCO), a bitcoin-based index and the first one that monitors the performance of bitcoin across established over-the-c… [+2700 chars]","MV Index Solutions (MVIS), a subsidiary of investment management firm VanEck, has announced the launch of MVIS Bitcoin U.S. OTC Spot Index (MVBTCO), a bitcoin-based index and the first one that monitors the performance of bitcoin across established over-the-c…",2018-11-22T14:35:40Z,"{'id': None, 'name': 'Bitcoinmagazine.com'}",VanEck Subsidiary MVIS Launches Bitcoin OTC Index,https://bitcoinmagazine.com/articles/vaneck-subsidiary-mvis-launches-bitcoin-otc-index/,https://fs.bitcoinmagazine.com/img/images/MVIS_platform.max-800x800.jpg,15
