,author,content,description,publishedAt,source,title,url,urlToImage,relevancy
0,,It takes approximately the same amount of energy to mine a dollars worth of cryptocurrency as it does to mine a dollars worth of certain metals. Cryptocurrencies such as Bitcoin have raised environmental concerns because mining virtual coins requires energy-i… [+925 chars],"Woodland birds flee, leaving only a handful of species that thrive in degraded habitat.",2018-11-22T00:00:00Z,"{'id': None, 'name': 'Nature.com'}",A Thai dam devastates a rainforest and its birdlife,https://www.nature.com/articles/d41586-018-07489-5?utm_source=feedburner&utm_medium=feed&utm_campaign=Feed%3A+nature%2Frss%2Fcurrent+%28Nature+-+Issue%29,https://media.nature.com/lw1024/magazine-assets/d41586-018-07489-5/d41586-018-07489-5_16272796.jpg,5
1,,It takes approximately the same amount of energy to mine a dollars worth of cryptocurrency as it does to mine a dollars worth of certain metals. Cryptocurrencies such as Bitcoin have raised environmental concerns because mining virtual coins requires energy-i… [+925 chars],"Woodland birds flee, leaving only a handful of species that thrive in degraded habitat.",2018-11-22T00:00:00Z,"{'id': None, 'name': 'Nature.com'}",A Thai dam devastates a rainforest and its birdlife,https://www.nature.com/articles/d41586-018-07489-5,https://media.nature.com/lw1024/magazine-assets/d41586-018-07489-5/d41586-018-07489-5_16272796.jpg,6
2,Bithumb,"Bithumb plans to return 50% of the transaction fee for users that make transactions of more than 700 million KRW and less than 1 billion KRW, and 70% for those who make transactions of more than 1 billion KRW. In addition, Bithumb also plans to give out 1 mil… [+1516 chars]","Transaction Fee Return Benefit for Cryptocurrency Transactions of 700 million KRW or More during the Event Period SEOUL, South Korea, Nov. 21, 2018 /PRNewswire/ -- The global cryptocurrency exchange Bithumb is holding the ""Triple Seven"" event to repay foreign…",2018-11-22T00:00:00Z,"{'id': None, 'name': 'Prnewswire.com'}",Bithumb Holds a Payback Event of Up to 70% of Transaction Fee for Foreign Users,https://www.prnewswire.com/news-releases/bithumb-holds-a-payback-event-of-up-to-70-of-transaction-fee-for-foreign-users-300754066.html,https://mma.prnewswire.com/media/787438/Bithumb_Triple_Seven.jpg?p=facebook,115
3,,"Transaction Fee Return Benefit for Cryptocurrency Transactions of 700 million KRW or More during the Event Period SEOUL, South Korea, Nov. 21, 2018 /PRNewswire/ -- The global cryptocurrency exchange Bithumb is holding the ""Triple Seven"" event to repay foreign… [+2509 chars]",Transaction Fee Return Benefit for Cryptocurrency Transactions of 700 million KRW or More during the Event Period read more,2018-11-22T00:00:23Z,"{'id': None, 'name': 'Sys-con.com'}",Bithumb Holds a Payback Event of Up to 70% of Transaction Fee for Foreign Users,http://news.sys-con.com/node/4349574,,133
4,,"SPORTS BETTING R.I. casino to allow sports betting beginning Monday Rhode Island will officially become the first New England state where sports betting is legal on Monday, when the Twin River Casino in Lincoln, R.I., opens its sports books for the first time… [+7048 chars]",Nine stories you may have missed Wednesday from the world of business.,2018-11-22T00:12:49Z,"{'id': None, 'name': 'Bostonglobe.com'}",Rhode Island casino to allow sports betting beginning Monday,https://www.bostonglobe.com/business/talking-points/2018/11/21/rhode-island-casino-allow-sports-betting-beginning-monday/RSbWXYMI9CI0DW1XzRJ1JO/story.html,//c.o0bg.com/rw/SysConfig/WebPortal/BostonGlobe/Framework/images/logo-bg.jpg,52
5,Paul Roberts,"Mired under heavy debts, GigaWatt, one of the earliest players in Central Washington's bitcoin boom, has filed for bankruptcy protection, the latest in casualty in an industry hammered by falling prices. For cryptocurrency pioneer GigaWatt, the hits just keep… [+4501 chars]","Mired under heavy debts, GigaWatt, one of the earliest players in Central Washington's bitcoin boom, has filed for bankruptcy protection, the latest in casualty in an industry hammered by falling prices.",2018-11-22T00:14:50Z,"{'id': None, 'name': 'Seattletimes.com'}",Washington bitcoin pioneer seeks Chapter 11 protection,https://www.seattletimes.com/business/washington-bitcoin-pioneer-seeks-chapter-11-protection/,https://static.seattletimes.com/wp-content/uploads/2018/11/11212018_bitcoin-pioneer_122043-1200x630.jpg,82
6,Ben Werdmüller,"If I participated in public markets at all (I don't), I might have gleefully shorted Facebook's stock already. But it looks like it's too late for that to be as effective as it might have been. As Fred Wilson pointed out today : Apple is down almost 25% in th… [+3061 chars]","If I participated in public markets at all (I don't), I might have gleefully shorted Facebook's stock already. But it looks like it's too late for that to be as effective as it might have been. As Fred Wilson pointed out today : Apple is down almost 25% in th…",2018-11-22T00:16:04Z,"{'id': None, 'name': 'Werd.io'}",The Tech Correction,https://werd.io/2018/the-tech-correction,https://werd.io/file/5bf59cf1d3c9b263814dddf2,123
7,Joseph Young,"Over the past week, the price of Bitcoin has dropped by more than 35 percent, and the majority of analysts in the crypto space have shared the sentiment that the crash was triggered by the contentious hard fork of Bitcoin Cash. According to Bart Smith, the he… [+3248 chars]","Over the past week, the price of Bitcoin has dropped by more than 35 percent, and the majority of analysts in the crypto space have shared the sentiment that the crash was triggered by the contentious hard fork of Bitcoin Cash. According to Bart Smith, the he…",2018-11-22T00:55:10Z,"{'id': 'crypto-coins-news', 'name': 'Crypto Coins News'}",Susquehanna Exec: Bakkt and Fidelity Could Solve Bitcoin’s Liquidity Issue,https://www.ccn.com/susquehanna-exec-bakkt-and-fidelity-could-solve-bitcoins-liquidity-issue/,https://www.ccn.com/wp-content/uploads/2018/10/glass-of-water-bitcoin-sidechain-liquid-cryptocurrency.jpg,26
8,"Panos Mourdoukoutas, Contributor, Panos Mourdoukoutas, Contributor https://www.forbes.com/sites/panosmourdoukoutas/","Share to facebook Share to twitter Share to linkedin Bitcoin could be heading down to $2,000 or up to $10,000, depending on the forecasting model applied to estimate the digital currencys intrinsic or fair value. Bitcoin has been falling fast, very fast, brea… [+5957 chars]","Bitcoin could be heading down to $2,000 or up to $10,000, depending on the forecasting model applied to estimate the digital currency’s “intrinsic” or “fair” value.",2018-11-22T00:56:00Z,"{'id': None, 'name': 'Forbes.com'}","What's Next For Bitcoin Prices -- $2,000 Or $10,000?",https://www.forbes.com/sites/panosmourdoukoutas/2018/11/21/whats-next-for-bitcoin-prices-2000-or-10000/,https://thumbor.forbes.com/thumbor/600x315/https%3A%2F%2Fspecials-images.forbesimg.com%2Fdam%2Fimageserve%2F1065948772%2F960x0.jpg%3Ffit%3Dscale,13
9,Tony Spilotro,"Last year, as early cryptocurrency adopters sat down to Thanksgiving dinner with their families, they spoke of the newfound fortune theyd earned from investing in the emerging asset class, and in particular Bitcoin. Since then, it has reached new all-time hig… [+3122 chars]","Last year, as early cryptocurrency adopters sat down to Thanksgiving dinner with their families, they spoke of the newfound fortune they’d earned from investing in the emerging asset class, and in particular Bitcoin. Since then, it has reached new all-time hi…",2018-11-22T01:00:58Z,"{'id': None, 'name': 'Newsbtc.com'}",A Bitcoin Thanksgiving: Looking Back on a Wild One-Year Ride,https://www.newsbtc.com/2018/11/22/a-bitcoin-thanksgiving-looking-back-on-a-wild-one-year-ride/,https://www.newsbtc.com/wp-content/uploads/2018/11/Bitcoin-Thanksgiving.jpg,43
10,Bloomberg,Sydney: Stocks in Asia got some reprieve from the recent sell-off after a modest rebound in technology and energy shares underpinned gains in U.S. equities. The dollar slipped and Treasuries steadied as debate about the Federal Reserve softening its stance on… [+2224 chars],"Asian stock benchmarks moved up in Japan and Australia, while futures pointed to gains in Hong Kong after most major US indexes closed higher in light pre-Thanksgiving trading",2018-11-22T01:59:27Z,"{'id': None, 'name': 'Livemint.com'}",Asian stocks steady after Wall Street gains,https://www.livemint.com/Money/rhIKZ6Ktdlewk0A02Dr89I/Asian-stocks-steady-after-Wall-Street-gains.html,https://www.livemint.com/rf/Image-621x414/LiveMint/Period2/2018/11/23/Photos/Processed/asianstocks-kzNH--621x414@LiveMint.jpg,96
11,Dalmas Ngetich,"Though there was a bit of stability yesterday, the decline would continue. First we expect BTC/USD to pull back ideally towards the $5,000–$5,500 before bear trend resumes. As we have seen, price drops are affecting chip-set manufacturers, investors and crypt… [+3803 chars]","Though there was a bit of stability yesterday, the decline would continue. First we expect BTC/USD to pull back ideally towards the $5,000–$5,500 before bear trend resumes. As we have seen, price drops are affecting chip-set manufacturers, investors and crypt…",2018-11-22T02:00:23Z,"{'id': None, 'name': 'Newsbtc.com'}",BTC/USD Price Analysis: Bitcoin Payments Drop while Lightning Network Capacity Increase,https://www.newsbtc.com/2018/11/22/btc-usd-price-analysis-bitcoin-payments-lightning-network-capacity/,https://www.newsbtc.com/wp-content/uploads/2018/08/techanalysis-btc9.jpg,47
12,Cointelegraph By Ana Alexandre,,CryptoOracle partner Lou Kerner said that strong cryptocurrencies should be viewed like the big companies that came out on top after the dot-com bubble.,2018-11-22T02:06:00Z,"{'id': None, 'name': 'Cointelegraph.com'}",Crypto Venture Capital Exec Compares Bitcoin to Post Dot-Com Bubble Amazon,https://cointelegraph.com/news/crypto-venture-capital-exec-compares-bitcoin-to-post-dot-com-bubble-amazon,https://images.cointelegraph.com/images/740_aHR0cHM6Ly9zMy5jb2ludGVsZWdyYXBoLmNvbS9zdG9yYWdlL3VwbG9hZHMvdmlldy9jNmQ3MmZhNjZhOTNlYmQ0ZGQxY2M2ZDYxYzJlYWVmNS5qcGc=.jpg,41
13,Duncan Riley,"Just when the damaging infighting between rival Bitcoin Cash factions couldn’t get any worse, both forked versions of the bitcoin spin-off have suffered from various technical issues. The first act in what is starting to appear like a poorly planned out circu… [+3249 chars]","Just when the damaging infighting between rival Bitcoin Cash factions couldn’t get any worse, both forked versions of the bitcoin spin-off have suffered from various technical issues. The first act in what is starting to appear like a poorly planned out circu…",2018-11-22T02:13:19Z,"{'id': None, 'name': 'Siliconangle.com'}",Both forked versions of Bitcoin Cash suffer significant problems as circus continues,https://siliconangle.com/2018/11/21/forked-versions-bitcoin-cash-suffer-significant-problems-circus-continues/,https://d15shllkswkct0.cloudfront.net/wp-content/blogs.dir/1/files/2018/11/bitcoincashclowns.jpg,114
14,Getty Images,"US stocks climbed with tech rallying, as the steep losses from Tuesday’s session got a haircut. Treasuries rose and the dollar fell amid speculation the Federal Reserve may soften its stance on raising interest rates. All major equity benchmarks were higher, … [+2850 chars]",Trading was lighter than normal in the pre-Thanksgiving session.,2018-11-22T02:17:19Z,"{'id': 'the-times-of-india', 'name': 'The Times of India'}",Tech surge after steep decline paces stocks rally,https://economictimes.indiatimes.com/markets/stocks/news/tech-surge-after-steep-decline-paces-stocks-rally/articleshow/66743858.cms,"https://img.etimg.com/thumb/msid-66743857,width-1070,height-580,imgsize-586699,overlay-etmarkets/photo.jpg",99
15,"David Cottle, Analyst, David Cottle",The Nikkei 225 continues to retreat The process was halted by a modest bounce this week However a key support zone is very near and will probably be revisited Get trading hints and join our analysts for interactive live coverage of all major economic data at … [+2229 chars],"The Nikkei 225 has retreated sharply and quickly from its multi-decade highs of 2018. The bulls seem to have forced a pause, but it may not last",2018-11-22T02:23:00Z,"{'id': None, 'name': 'Dailyfx.com'}",Nikkei 225 Technical Analysis: Bulls Hold Line Above Key Prop,https://www.dailyfx.com/forex/technical/home/analysis/jpn225/2018/11/22/Nikkei-225-Technical-Analysis-Bulls-Hold-Line-Above-Key-Prop-.html,,107
16,Dalmas Ngetich,"Earlier, Jihan Wu had warned that re-deploying hash rate from Bitcoin network to support Bitcoin Cash ABC could lead to a massive sell off across the market more so in BTC. We are already seeing that print and as BCH/USD prices drop days after forking, Giga W… [+3229 chars]","Earlier, Jihan Wu had warned that re-deploying hash rate from Bitcoin network to support Bitcoin Cash ABC could lead to a massive sell off across the market more so in BTC. We are already seeing that print and as BCH/USD prices drop days after forking, Giga W…",2018-11-22T02:30:58Z,"{'id': None, 'name': 'Newsbtc.com'}",BCH/USD Price Analysis: Bitcoin Cash Wars Force Giga Watt to File for Bankruptcy,https://www.newsbtc.com/2018/11/22/bch-usd-price-analysis-bitcoin-cash-wars-force-giga-watts-bankruptcy/,https://www.newsbtc.com/wp-content/uploads/2018/08/techanalysis-bch5.jpg,40
17,Gab,"Skip to comments. DIGITAL GULAG - Gab NOW De-Platformed by BitPay... Gab Posted on 11/21/2018 6:34:23 PM PST by gaijin TOPICS: Chit/Chat KEYWORDS: 1stamendment ; censorship ; fang I thought GAB cleaned things up quite a bit. I think that now, too. I think Ann… [+735 chars]",,2018-11-22T02:34:23Z,"{'id': None, 'name': 'Freerepublic.com'}",DIGITAL GULAG - Gab NOW De-Platformed by BitPay...,https://www.freerepublic.com/focus/f-chat/3707683/posts,,94
18,AFP,"By Lionel Laurent Bitcoin turns 10 this year, but there’s not much to celebrate. Its price has tumbled to near $4,000, down 30 percent in a month, 50 per cent in six months and almost 80 per cent since December. The crypto-currency experts, who clearly didn’t… [+3273 chars]",About $700 billion has been wiped from the value of digital money since January.,2018-11-22T02:54:35Z,"{'id': 'the-times-of-india', 'name': 'The Times of India'}",Jamie Dimon and Warren Buffett have the last laugh on bitcoin,https://economictimes.indiatimes.com/markets/stocks/news/jamie-dimon-and-warren-buffett-have-the-last-laugh-on-bitcoin/articleshow/66744160.cms,"https://img.etimg.com/thumb/msid-66744156,width-1070,height-580,imgsize-438101,overlay-etmarkets/photo.jpg",70
19,DigitalSurge,All trademarks are owned by their respective owners. OzBargain is an independent community website which has no association with nor endorsement by the respective trademark owners. Copyright © 2006-2018 OzBargain ABN: 26 144 073 772,"Hi All, We would like to give away $10 worth of Bitcoin to anyone that creates a free account and makes a Bitcoin purchase of $100 or more. To redeem: Create a free account on https://digitalsurge.com.au Verify your account Make a purchase of $100 or more Sen…",2018-11-22T02:54:43Z,"{'id': None, 'name': 'Ozbargain.com.au'}",Free $10 worth of Bitcoin when you make a purchase of $100 or more (limit 1 per customer),https://www.ozbargain.com.au/node/418449,https://files.ozbargain.com.au/n/49/418449x.jpg?h=98e7aab2,22
20,Samantha Chang,"The University of Tokyo began offering a blockchain course at its graduate engineering school, thanks to an $800,000 donation from a consortium that includes the Ethereum Foundation and Japanese banking juggernaut Sumitomo Mitsui. The class called the “Blockh… [+3369 chars]","The University of Tokyo began offering a blockchain course at its graduate engineering school, thanks to an $800,000 donation from a consortium that includes the Ethereum Foundation and Japanese banking juggernaut Sumitomo Mitsui. The class — called the “Bloc…",2018-11-22T03:05:18Z,"{'id': 'crypto-coins-news', 'name': 'Crypto Coins News'}",University of Tokyo Launches Blockchain Course with Ethereum Foundation Backing,https://www.ccn.com/university-of-tokyo-launches-blockchain-course-with-ethereum-foundation-backing/,https://www.ccn.com/wp-content/uploads/2017/10/Tokyo-stores-street.jpg,73
21,Zheping Huang,"When the price of gold tanks, miners get hurt. It is the same story in the wild world of cryptocurrencies. Prices of Bitcoin, the world’s leading digital currency, have tumbled nearly 30% in the past week and hit a 13-month low of about US$4,500 (RM18,800), a… [+4503 chars]","Bitcoin prices fell nearly 30% over the past week, hitting a 13-month low of about US$4,500 (RM18,800).",2018-11-22T04:00:00Z,"{'id': None, 'name': 'Thestar.com.my'}","As Bitcoin prices fall, mining crypto is no longer profitable for many",http://www.thestar.com.my/tech/tech-news/2018/11/22/as-bitcoin-prices-fall-mining-cryptocurrencies-is-no-longer-profitable-for-many/,https://www.thestar.com.my/~/media/online/2018/11/22/02/01/asbitcoinpricesfallminingcryptocurrenciesisnolongerprofitableformany.ashx/?w=620&h=413&crop=1&hash=DDECD2A665A5504940750983487DEA973FA9665F,126
22,Aayush Jindal,Key Highlights ETH price slowly recovered and moved above the $130 and $132 resistances against the US Dollar. Yesterdays major bearish trend line was breached with resistance at $132 on the hourly chart of ETH/USD (data feed via Kraken). The pair is likely t… [+1685 chars],Key Highlights ETH price slowly recovered and moved above the $130 and $132 resistances against the US Dollar. Yesterday’s major bearish trend line was breached with resistance at $132 on the hourly chart of ETH/USD (data feed via Kraken). The pair is likely …,2018-11-22T04:28:47Z,"{'id': None, 'name': 'Newsbtc.com'}",Ethereum Price Analysis: ETH/USD Signaling Positive Bias Above $130,https://www.newsbtc.com/2018/11/22/ethereum-price-analysis-eth-usd-signaling-positive-bias-above-130/,https://www.newsbtc.com/wp-content/uploads/2018/08/techanalysis-eth4.jpg,78
23,Emilio Janus,"The energy costs of bitcoin mining are often cited as canceling out the. We must also consider the savings made, in avoiding some of the hidden costs of the alternative. Gold Standard Critics of gold originally made the same arguments that the mining and stor… [+2166 chars]","The energy costs of bitcoin mining are often cited as canceling out the. We must also consider the savings made, in avoiding some of the hidden costs of the alternative. Gold Standard Critics of gold originally made the same arguments — that the mining and st…",2018-11-22T05:00:06Z,"{'id': None, 'name': 'Bitcoinist.com'}",The Hidden Benefits of Bitcoin Mining,https://bitcoinist.com/the-hidden-benefits-of-bitcoin-mining/,https://bitcoinist.com/wp-content/uploads/2018/08/Cryptocurrency-Mining.jpg,60
24,Edan Yago,"Edan Yago is the founder of CementDAO, an effort to bring together stablecoins into a unified ecosystem. He previously was the CEO and co-founder of software firm Epiphyte and helped set up the industry associations DATA and the Stablecoin Foundation. The vie… [+6313 chars]","The SEC would like to establish jurisdiction over crypto assets but this is only appropriate where there are legally enforceable contracts between legal entities, argues Edan Yago.",2018-11-22T05:00:21Z,"{'id': None, 'name': 'Coindesk.com'}",There Is No ‘Bitcoin’: What the SEC Doesn’t Get About Cryptocurrency,https://www.coindesk.com/there-is-no-bitcoin-what-the-sec-doesnt-get-about-cryptocurrency,https://www.coindesk.com/wp-content/uploads/2017/01/darts-target-miss.jpg,21
25,Mihai Matei,"According to a recent Digitimes report citing HTC, the Taiwanese tech company has no plans to quit the smartphone market, despite recent speculations suggesting otherwise. Reportedly, HTC believes that the worlds of VR and mobile devices are intertwined and V… [+3419 chars]","According to a recent Digitimes report citing HTC, the Taiwanese tech company has no plans to quit the smartphone market, despite recent speculations suggesting otherwise. Reportedly, HTC believes that the worlds of VR and mobile",2018-11-22T06:02:00Z,"{'id': None, 'name': 'Androidheadlines.com'}","HTC Won't Quit Smartphones, New Models Coming Soon",https://www.androidheadlines.com/2018/11/htc-not-quitting-smartphones.html,https://cdn.androidheadlines.com/wp-content/uploads/2018/10/AH-New-Logo-HTC-U12-2018-05.jpg,81
26,,"SINGAPORE: The police and DBS Bank warned on Thursday (Nov 22) of a resurgence in phishing SMSes purportedly sent by DBS or POSB. In the last two months, more than 50 people have reported falling victim to the scam, said the police and DBS Bank in a joint new… [+2296 chars]","SINGAPORE: The police and DBS Bank warned on Thursday (Nov 22) of a resurgence in phishing SMSes purportedly sent by DBS or POSB. In the last two months, more than 50 people have reported falling victim to the scam, said the police and DBS Bank in a joint new…",2018-11-22T06:18:26Z,"{'id': None, 'name': 'Channelnewsasia.com'}",More than 50 DBS customers fell for phishing SMSes in last two months,https://www.channelnewsasia.com/news/singapore/phishing-scam-dbs-posb-customers-fake-sms-police-10957456,http://www.channelnewsasia.com/image/10957734/16x9/991/557/b781e5801f280476a472565e283b4e25/WA/phishing-smses-screengrabs-dbs.png,20
27,"David Cottle, Analyst, David Cottle",Asian Stocks Talking Points: Regional bourses put in a mixed performance Chinese stocks were the standout laggards The US Dollar slipped a little as overall risk appetite held up Find out what retail foreign exchange investors make of your favorite currency’s… [+2427 chars],Asian stock markets were mostly stronger as the US Thanksgiving break approached. Chinese mainboards bucked the trend as trade–deal hopes seemed to recede,2018-11-22T06:19:00Z,"{'id': None, 'name': 'Dailyfx.com'}","Asian Stocks Mixed, Chinese Mainboards Sag On Trade Worries",https://www.dailyfx.com/forex/market_alert/2018/11/22/Asian-Stocks-Mixed-Thanksgiving.html,,122
28,The Balance of Trade,"Market Intro Global stocks ( VGK, ACWI, SPY ) took the opportunity to recoup after a couple rough weeks as Americans head to the Thanksgiving table. Weakness in Apple (NASDAQ: AAPL ) may have played a role in US stocks giving up most of the days gains, but at… [+4133 chars]","European stocks closed higher, even as the EU opened disciplinary procedures against Italy. If the FANGs can settle and/or decouple, then a nice rally into year",2018-11-22T06:26:30Z,"{'id': None, 'name': 'Seekingalpha.com'}","Market Volatility Bulletin: Stocks Attempt A Recovery, But Settle Flat",https://seekingalpha.com/article/4224027-market-volatility-bulletin-stocks-attempt-recovery-settle-flat,https://static2.seekingalpha.com/uploads/2018/11/48084227_15428515477883_rId17_thumb.jpg,48
29,Aayush Jindal,Key Highlights Ripple price is currently consolidating below the $0.4500 and $0.4600 resistances against the US dollar. There is a key contracting triangle formed with resistance at $0.4460 on the hourly chart of the XRP/USD pair (data source from Kraken). Th… [+1788 chars],Key Highlights Ripple price is currently consolidating below the $0.4500 and $0.4600 resistances against the US dollar. There is a key contracting triangle formed with resistance at $0.4460 on the hourly chart of the XRP/USD pair (data source from Kraken). Th…,2018-11-22T06:28:56Z,"{'id': None, 'name': 'Newsbtc.com'}",Ripple Price Analysis: XRP/USD Facing Key Resistance Near $0.4500,https://www.newsbtc.com/2018/11/22/ripple-price-analysis-xrp-usd-facing-key-resistance-near-0-4500/,https://www.newsbtc.com/wp-content/uploads/2018/06/ripple.jpg,85
30,Digital Gold Exchange (DGE),"SEOUL, South Korea, Nov. 22, 2018 /PRNewswire/ -- Digital Gold Exchange (DGE), the developer of TMTG coin, announced on Nov. 20 that it has entered into partnership with South Korea's leading medical group Regen on Nov. 12, to launch a cryptocurrency payment … [+2312 chars]","SEOUL, South Korea, Nov. 22, 2018 /PRNewswire/ -- Digital Gold Exchange (DGE), the developer of TMTG coin, announced on Nov. 20 that it has entered into partnership with South Korea's leading medical group Regen on Nov. 12, to launch a cryptocurrency payment …",2018-11-22T07:08:00Z,"{'id': None, 'name': 'Prnewswire.com'}",DGE Enters into Partnership with Regen Medical Group of Korea,https://www.prnewswire.com/news-releases/dge-enters-into-partnership-with-regen-medical-group-of-korea-300754605.html,/content/dam/prnewswire/common/prn_facebook_sharing_logo.jpg,120
31,,"SEOUL, South Korea, Nov. 22, 2018 /PRNewswire/ -- Digital Gold Exchange (DGE), the developer of TMTG coin, announced on Nov. 20 that it has entered into partnership with South Korea's leading medical group Regen on Nov. 12, to launch a cryptocurrency payment … [+2610 chars]","SEOUL, South Korea, Nov. 22, 2018 /PRNewswire/ -- Digital Gold Exchange (DGE), the developer of TMTG coin, announced on Nov. 20 that it has entered into partnership with South Korea's leading medical group Regen on Nov. 12, to launch a cryptocurrency payment …",2018-11-22T07:09:18Z,"{'id': None, 'name': 'Sys-con.com'}",DGE Enters into Partnership with Regen Medical Group of Korea,http://news.sys-con.com/node/4349595,,131
