,author,content,description,publishedAt,source,title,url,urlToImage,relevancy
97,David Hundeyin,"French cryptocurrency adoption and usage are set to receive a minor boost from next year, as the French Prudential Supervision and Resolution Authority ( ACPR ), a regulatory offshoot of the Banque de France has granted permission for tobacco shops in the cou… [+2922 chars]","French cryptocurrency adoption and usage are set to receive a minor boost from next year, as the French Prudential Supervision and Resolution Authority (ACPR), a regulatory offshoot of the Banque de France has granted permission for tobacco shops in the count…",2018-11-22T14:39:49Z,"{'id': 'crypto-coins-news', 'name': 'Crypto Coins News'}",French Tobacco Shops to Sell Bitcoin From 2019,https://www.ccn.com/french-tobacco-shops-to-sell-bitcoin-from-2019/,https://www.ccn.com/wp-content/uploads/2018/11/France-tobacco.jpg,24
98,Esther Kim,A sudden influx of nodes on Bitcoins Lightning Network (LN) has seen capacity increase to new all-time highs as the scaling solution is now handling over $2 million in BTC. Lightning’s Transformative Month Data from monitoring resource 1ML.com reveals the pas… [+1843 chars],A sudden influx of nodes on Bitcoin’s Lightning Network (LN) has seen capacity increase to new all-time highs as the scaling solution is now handling over $2 million in BTC. Lightning’s Transformative Month Data from monitoring resource 1ML.com reveals the pa…,2018-11-22T15:00:09Z,"{'id': None, 'name': 'Bitcoinist.com'}",Bitcoin Lightning Network Explodes To New Heights With $2M Capacity,https://bitcoinist.com/bitcoin-lightning-network-2m-capacity/,https://bitcoinist.com/wp-content/uploads/2018/11/shutterstock_1158426418.jpg,62
99,Cali Haan,"One-to-one replicas of the Trezor cryptocurrency hardware wallet have been found for sale on the Internet, says the company in a recent blog post, and using them, “…can be a severe threat to your security.” Trezor says these counterfeit devices are being sold… [+3572 chars]","Counterfeit Trezor Crypto Wallets Found. One-to-one replicas of the Trezor cryptocurrency hardware wallet have been found for sale on the Internet, says the company in a recent blog post, and using them, “…can be a severe threat to your security.” Trezor says…",2018-11-22T15:06:00Z,"{'id': None, 'name': 'Crowdfundinsider.com'}",Permalink to Counterfeit Trezor Crypto Wallets Found,https://www.crowdfundinsider.com/2018/11/141592-counterfeit-trezor-crypto-wallets-found/,https://cdn.crowdfundinsider.com/wp-content/uploads/2018/11/Trezor-Wallet.png,98
100,Joseph Young,"In the bull market of 2017, crypto investors paid more than $40,000 per Bitcoin (BTC) to purchase the dominant cryptocurrency. In the US market, a product called the Bitcoin Investment Trust (GBTC) offered by Grayscale Investment, a subsidiary of Digital Curr… [+2973 chars]","In the bull market of 2017, crypto investors paid more than $40,000 per Bitcoin (BTC) to purchase the dominant cryptocurrency. In the US market, a product called the Bitcoin Investment Trust (GBTC) offered by Grayscale Investment, a subsidiary of Digital Curr…",2018-11-22T15:54:25Z,"{'id': 'crypto-coins-news', 'name': 'Crypto Coins News'}","Investors in US Market Paid $39,000 to Buy Bitcoin at Peak Using GBTC",https://www.ccn.com/investors-in-us-market-paid-39000-to-buy-bitcoin-at-peak-using-gbtc/,https://www.ccn.com/wp-content/uploads/2018/05/Bitcoin-dollar-100.jpg,18
101,Chris Hauk,"Happy Thanksgiving everyone! While you’re waiting for your turkey to (finally) get cooked, check out these great Early Black Friday Deals! If you play it right, you’ll be able to sleep in tomorrow morning, because you’ll have your Black Friday shopping finish… [+31503 chars]","Happy Thanksgiving everyone! While you're waiting for your turkey to (finally) get cooked, check out these great Early Black Friday Deals! Read More...",2018-11-22T15:55:25Z,"{'id': None, 'name': 'Mactrast.com'}",MacTrast Deals: Early Black Friday Deal Roundup,https://www.mactrast.com/2018/11/mactrast-deals-early-black-friday-deal-roundup/,https://s4827.pcdn.co/wp-content/uploads/2018/11/EARLY_Black_Friday_Deals.jpg,102
102,Matt Burns,"Give the gift of organization this year. Bags are often ignored but are a critical part of anyone’s mobile gear. They’re the outward representations of our techie styles, and we put far too little thought into where we keep our most prized possessions. Here’s… [+7992 chars]","Give the gift of organization this year. Bags are often ignored but are a critical part of anyone’s mobile gear. They’re the outward representations of our techie styles, and we put far too little thought into where we keep our most prized possessions. Here’s…",2018-11-22T15:58:39Z,"{'id': 'techcrunch', 'name': 'TechCrunch'}",Gift Guide: 16 fantastic computer bags,http://techcrunch.com/2018/11/22/gift-guide-16-fantastic-computer-bags/,https://techcrunch.com/wp-content/uploads/2018/11/0A6KuGQw.png?w=753,134
103,,"Under increasing pressure about the serial management mishaps at Facebook, Mark Zuckerberg said he would not relinquish his title as chairman and that investors who wanted him to step down from the position and focus on being chief executive were misguided. (… [+4521 chars]","Under increasing pressure about the serial management mishaps at Facebook, Mark Zuckerberg said he would not relinquish his title as chairman and that investors who wanted him to step down from the position and focus on being chief executive were misguided.",2018-11-22T16:08:03Z,"{'id': 'the-economist', 'name': 'The Economist'}",Business this week,https://www.economist.com/the-world-this-week/2018/11/24/business-this-week,https://cdn.static-economist.com/sites/default/files/images/print-edition/20181124_WWP004_0.jpg,9
104,,The JSE closed weaker on Thursday after a relatively flat trading session as the local market anticipated the interest rate decision from the central bank. All the focus was on the South African Reserve Bank for the announcement of the interest rate decision … [+2390 chars],The central bank decided to hike the repo rate by 25 basis points from 6.50% to 6.75% as the bank sees inflationary pressures for 2019.,2018-11-22T16:27:48Z,"{'id': None, 'name': 'Fin24.com'}",Fin24.com | Flat trading session for the JSE as central bank raises rates,https://www.fin24.com/Markets/flat-trading-session-for-the-jse-as-central-bank-raises-rates-20181122,http://cdn.24.co.za/files/Cms/General/d/7960/947258a6eec8420ca7a230f81e31d2d0.jpg,111
105,alexmark,"By Bill Bonner BALTIMORE, MARYLAND Today will be an interesting day. After falling the last two days, stocks should bounce. And the futures market says they will. But now, we will see what the speculators are really thinking. Will they want to go away for a f… [+5988 chars]",,2018-11-22T16:36:50Z,"{'id': None, 'name': 'Investmentwatchblog.com'}","When This Happens, Buy Stocks",http://www.investmentwatchblog.com/when-this-happens-buy-stocks/,,109
106,Cointelegraph By Marie Huillet,,Norway has struck a blow to its domestic crypto mining industry by acting to end electricity subsidies for Bitcoin (BTC) mining facilities as of January 2019,2018-11-22T16:53:00Z,"{'id': None, 'name': 'Cointelegraph.com'}",Norway Withdraws Electricity Subsidies From Bitcoin Mining Farms,https://cointelegraph.com/news/norway-withdraws-electricity-subsidies-from-bitcoin-mining-farms,https://images.cointelegraph.com/images/740_aHR0cHM6Ly9zMy5jb2ludGVsZWdyYXBoLmNvbS9zdG9yYWdlL3VwbG9hZHMvdmlldy80OTQwNGE5MmUyMDIyMmViMzVjNmFiYmQxNmIwMTExZS5qcGc=.jpg,29
107,Tyler Durden,"Authored by Brandon Smith via Alt-Market.com, There are two kinds of globalist schemes : First, there are the schemes they spring on the public out of nowhere haphazardly in the hopes that the speed of the event along with some shock and awe will confuse the … [+10361 chars]","Authored by Brandon Smith via Alt-Market.com, There are two kinds of globalist schemes : First, there are the schemes they spring on the public out of nowhere haphazardly in the hopes that the speed of the event along with some shock and awe will confuse the …",2018-11-22T17:00:00Z,"{'id': None, 'name': 'Zerohedge.com'}",Did The IMF Reveal That Cryptocurrency Is The New World Order End-Game?,https://www.zerohedge.com/news/2018-11-22/did-imf-reveal-cryptocurrency-new-world-order-end-game,https://www.zerohedge.com/sites/default/files/styles/max_650x650/public/2018-11/phoenixeconomist.jpg?itok=zQb9vBsR,104
108,Esther Kim,"The controversy surrounding the Bitcoin Cash (BCH) hard fork is increasingly engulfing cryptocurrency exchange Kraken as the altcoins proponents take aim at its treatment of its two forks. Deposits, Withdrawals And Up To 30 Confirmations After BCH split into … [+2486 chars]","The controversy surrounding the Bitcoin Cash (BCH) hard fork is increasingly engulfing cryptocurrency exchange Kraken as the altcoin’s proponents take aim at its treatment of its two forks. Deposits, Withdrawals And Up To 30 Confirmations After BCH split into…",2018-11-22T17:00:42Z,"{'id': None, 'name': 'Bitcoinist.com'}","Kraken ‘Named’ in SEC Investigation, Calvin Ayre Claims as Bitcoin Cash Forks Go Live",https://bitcoinist.com/calvin-ayre-kraken-sec-bitcoin-cash/,https://bitcoinist.com/wp-content/uploads/2018/11/shutterstock_1212580375-980x613.jpg,65
109,Davit Babayan,"If central banks issue their own digital currencies, then it would destroy cryptocurrencies like Bitcoin, wrote Nouriel “Dr. Doom” Roubini in his latest column. The article, titled “ Why central bank digital currencies could destroy crypto,” saw the American … [+4174 chars]","If central banks issue their own digital currencies, then it would destroy cryptocurrencies like Bitcoin, wrote Nouriel “Dr. Doom” Roubini in his latest column. The article, titled “Why central bank digital currencies could destroy crypto,” saw the American e…",2018-11-22T17:00:53Z,"{'id': None, 'name': 'Newsbtc.com'}",Dr Doom Claims Central Bank Digital Currencies Could Destroy Crypto,https://www.newsbtc.com/2018/11/22/dr-doom-claims-central-bank-digital-currencies-could-destroy-crypto/,https://www.newsbtc.com/wp-content/uploads/2018/10/Nouriel-Roubini.jpg,54
110,Sam Jacobs,Australian crypto-copmany DigitalX has partnered up with US bank AmerX in a 50/50 joint venture. The JV entity aims to generate revenue by offering crypto advisory services and assisting in security token offerings. Shares in DigitalX have fallen by around 86… [+2418 chars],Australian crypto-copmany DigitalX has partnered up with US bank AmerX in a 50/50 joint venture. The JV entity aims to generate revenue by offering crypto advisory services and assisting in security token offerings. More »,2018-11-22T17:01:10Z,"{'id': None, 'name': 'Businessinsider.com.au'}",Australian crypto company DigitalX has entered into a joint venture with a US bank,https://www.businessinsider.com.au/australian-crypto-company-digitalx-join-venture-share-price-2018-11,https://edge.alluremedia.com.au/uploads/businessinsider/2018/11/btcc-640x360.jpg,86
111,Jimmy Aki,"Are you planning to do some shopping on Amazon this holiday season? If so, you can also support BitGive, the first registered 501(c)(3) nonprofit charity that uses the power of bitcoin to support some great philanthropic projects around the world. This year, … [+2112 chars]","Are you planning to do some shopping on Amazon this holiday season? If so, you can also support BitGive, the first registered 501(c)(3) nonprofit charity that uses the power of bitcoin to support some great philanthropic projects around the world. This year, …",2018-11-22T17:10:16Z,"{'id': None, 'name': 'Bitcoinmagazine.com'}",Here’s How You Can Get Amazon to Kick Some Cash to a Bitcoin Charity,https://bitcoinmagazine.com/articles/heres-how-you-can-get-amazon-kick-some-cash-bitcoin-charity/,https://fs.bitcoinmagazine.com/img/images/smile_bitgive.max-800x800.jpg,23
112,"Anthony Cuthbertson, Anthony Cuthbertson","Bitcoin mining operations in the US and China are facing closures after the plummeting price of bitcoin means they may no longer be profitable. The world's most valuable cryptocurrency is currently trading at around $4,500, having lost almost a third of its v… [+5324 chars]",Tens of thousands of mining rigs have been shut down in China,2018-11-22T17:12:15Z,"{'id': 'independent', 'name': 'Independent'}",Bitcoin price crash causes bankruptcy and mass cryptocurrency mine closures,https://www.independent.co.uk/life-style/gadgets-and-tech/news/bitcoin-price-crash-cryptocurrency-mining-bankrupt-china-bitmain-giga-watt-a8646821.html,https://static.independent.co.uk/s3fs-public/thumbnails/image/2018/11/22/14/istock-916553110.jpg,105
113,Press Release,"This is a paid-for submitted press release. CCN does not endorse, nor is responsible for any material included below and isnt responsible for any damages or losses connected with any products or services mentioned in the press release. CCN urges readers to co… [+2814 chars]","This is a paid-for submitted press release. CCN does not endorse, nor is responsible for any material included below and isn’t responsible for any damages or losses connected with any products or services mentioned in the press release. CCN urges readers to c…",2018-11-22T17:19:35Z,"{'id': 'crypto-coins-news', 'name': 'Crypto Coins News'}",MenaPay – The Stablecoin for Daily Payments,https://www.ccn.com/menapay-the-stablecoin-for-daily-payments/,https://www.ccn.com/wp-content/uploads/2018/11/image1-18.png,33
114,Lawrence Abrams,"A ransomware that has been distributed since the summer of 2018 has started to pick up steam in the latest variant. This new variant is currently being called Zorro Ransomware, but has also been called Aurora Ransomware in the past. It is not currently known … [+7531 chars]","A ransomware that has been distributed since the summer of 2018 has started to pick up steam in the latest variant. This new variant is currently being called Zorro Ransomware, but has also been called Aurora Ransomware in the past. [...]",2018-11-22T17:35:34Z,"{'id': None, 'name': 'Bleepingcomputer.com'}",Aurora / Zorro Ransomware Actively Being Distributed,https://www.bleepingcomputer.com/news/security/aurora-zorro-ransomware-actively-being-distributed/,https://www.bleepstatic.com/content/hl-images/2018/07/10/ransomware-header.jpg,76
115,Press Release,"This is a paid-for submitted press release. CCN does not endorse, nor is responsible for any material included below and isnt responsible for any damages or losses connected with any products or services mentioned in the press release. CCN urges readers to co… [+4891 chars]","This is a paid-for submitted press release. CCN does not endorse, nor is responsible for any material included below and isn’t responsible for any damages or losses connected with any products or services mentioned in the press release. CCN urges readers to c…",2018-11-22T17:40:57Z,"{'id': 'crypto-coins-news', 'name': 'Crypto Coins News'}",Leading Singapore Cryptocurrency Exchange ‘Tokenize Xchange’ Lists TKX Emblem and Acquires a Stake in Crowd Ventures,https://www.ccn.com/leading-singapore-cryptocurrency-exchange-tokenize-xchange-lists-tkx-emblem-and-acquires-a-stake-in-crowd-ventures/,https://www.ccn.com/wp-content/uploads/2018/11/tokenize.png,84
116,Joseph Young,"The hash power war between Bitcoin Cash (BCH) and Bitcoin Cash SV (BCHSV) ended with a one-sided victory for BCH. Prior to the hard fork on November 15, major cryptocurrency exchanges publicly expressed support towards the roadmap set forth by bitcoincash.org… [+3248 chars]","The hash power war between Bitcoin Cash (BCH) and Bitcoin Cash SV (BCHSV) ended with a one-sided victory for BCH. Prior to the hard fork on November 15, major cryptocurrency exchanges publicly expressed support towards the roadmap set forth by bitcoincash.org…",2018-11-22T17:59:20Z,"{'id': 'crypto-coins-news', 'name': 'Crypto Coins News'}",Why Major Crypto Exchanges are Granting Bitcoin Cash With BCH Ticker,https://www.ccn.com/why-major-crypto-exchanges-are-granting-bitcoin-cash-with-bch-ticker/,https://www.ccn.com/wp-content/uploads/2018/04/bitcoin-cash.jpg,19
117,Russell Campbell,"MATRIX AI Network (MAN) is a global open-source, public, intelligent blockchain-based distributed computing platform and operating system that combines artificial intelligence (AI) and blockchain. MATRIX AI Network was created to make blockchains faster, more… [+6711 chars]","MATRIX AI Network (MAN) is a global open-source, public, intelligent blockchain-based distributed computing platform and operating system that combines artificial intelligence (AI) and blockchain. MATRIX AI Network was created to make blockchains faster, more…",2018-11-22T18:00:04Z,"{'id': None, 'name': 'Bitrebels.com'}","MATRIX AI Network – An Easier, Faster, Safer Blockchain 3.0",http://www.bitrebels.com/business/matrix-ai-network-easier-faster-safer-blockchain/,http://www.bitrebels.com/wp-content/uploads/2018/11/matrix-cryptocurrency-review-header-image.jpg,100
118,johnu78,"Imam Khomeini Relief Foundation Logo Some of us when we think of Bitcoin we think of money, or PayPal. What we rarely think about is how Bitcoin can be used as a way for charities to obtain donations. Over the last several years there has been an increase in … [+1728 chars]","Some of us when we think of Bitcoin we think of money, or PayPal. What we rarely think about is how Bitcoin can be used as a way for charities to obtain donations. Over the last several years there has been an increase in charities around the world which acce…",2018-11-22T18:09:50Z,"{'id': None, 'name': 'Wordpress.com'}",Iranian Charity Receiving Bitcoin Donations,https://cointrader21.wordpress.com/2018/11/05/iranian-charity-receiving-bitcoin-donations/,https://cointrader21.files.wordpress.com/2018/11/logo-large.jpg,50
119,alexmark,"by jessefelder To achieve superior investment results, you have to hold non-consensus views regarding value, and they have to be right. Thats not easy The good news is that the prevalence of first level thinkers increases the returns available to second level… [+3625 chars]",,2018-11-22T18:18:26Z,"{'id': None, 'name': 'Investmentwatchblog.com'}",To Succeed In The Markets You Must Become A ‘Second Level Thinker’,http://www.investmentwatchblog.com/to-succeed-in-the-markets-you-must-become-a-second-level-thinker/,,87
120,Ricardo Esteves,"Lou Kerner, partner at venture capital firm CryptoOracle, admitted that investing in Bitcoin is not for the faint of heart, but that there are rewards for those who maintain a longer investment horizon. With fear taking over many cryptocurrency investors in r… [+2597 chars]","Lou Kerner, partner at venture capital firm CryptoOracle, admitted that investing in Bitcoin is not for the faint of heart, but that there are rewards for those who maintain a longer investment horizon. With fear taking over many cryptocurrency investors in r…",2018-11-22T18:30:57Z,"{'id': None, 'name': 'Newsbtc.com'}",CryptoOracle’s Kerner: Bitcoin Is the “Greatest Store of Value Ever Created”,https://www.newsbtc.com/2018/11/22/cryptooracles-kerner-bitcoin-is-the-greatest-store-of-value-ever-created/,https://www.newsbtc.com/wp-content/uploads/2018/11/Bitcoin-Laugh.jpg,46
121,David Hundeyin,"Ramit Sethi, author of the bestselling “ I Will Teach You to Be Rich ” has taken a swipe at crypto hodlers, suggesting that their investment strategy is fundamentally faulty because it is based on emotional identity instead of rational analysis. In his opinio… [+3841 chars]","Ramit Sethi, author of the bestselling “I Will Teach You to Be Rich” has taken a swipe at crypto hodlers, suggesting that their investment strategy is fundamentally faulty because it is based on emotional identity instead of rational analysis. In his opinion,…",2018-11-22T19:59:07Z,"{'id': 'crypto-coins-news', 'name': 'Crypto Coins News'}",Wealthbuilding Guru Says Bitcoin Hodlers Have a ‘Problematic Mindset’,https://www.ccn.com/wealthbuilding-guru-says-bitcoin-hodlers-have-a-problematic-mindset/,https://www.ccn.com/wp-content/uploads/2017/10/Bitcoin-man-hand.jpg,27
122,Osato Avan-Nomayo,"If the present cryptocurrency price drop is akin to the dot-com crash of 2000, then Lou Kerner believes Bitcoin will be the Amazon of the cryptocurrency era. The top-ranked virtual currency is currently down 77 percent from its mid-December all-time high. Hod… [+2217 chars]","If the present cryptocurrency price drop is akin to the dot-com crash of 2000, then Lou Kerner believes Bitcoin will be the Amazon of the cryptocurrency era. The top-ranked virtual currency is currently down 77 percent from its mid-December all-time high. ‘Ho…",2018-11-22T20:00:42Z,"{'id': None, 'name': 'Bitcoinist.com'}","Bitcoin Will Be the Amazon of Cryptocurrency, Says VC Advisor",https://bitcoinist.com/bitcoin-will-be-the-amazon-of-cryptocurrency-says-vc-advisor/,https://bitcoinist.com/wp-content/uploads/2017/06/amazon-cover.jpg,57
123,Jimmy Aki,"The Gibraltar Blockchain Exchange (GBX) has been granted a license from the Gibraltar Financial Services Commission (GFSC) required to operate a regulated blockchain exchange. The exchange was granted the Distributed Ledger Technology License Category 3, whic… [+2562 chars]","The Gibraltar Blockchain Exchange (GBX) has been granted a license from the Gibraltar Financial Services Commission (GFSC) required to operate a regulated blockchain exchange. The exchange was granted the Distributed Ledger Technology License Category 3, whic…",2018-11-22T20:44:59Z,"{'id': None, 'name': 'Bitcoinmagazine.com'}",Gibraltar's Regulator Grants Full License to the Gibraltar Blockchain Exchange,https://bitcoinmagazine.com/articles/gibraltars-regulator-grants-full-license-gibraltar-blockchain-exchange/,https://fs.bitcoinmagazine.com/img/images/GBX_approval.max-800x800.jpg,30
124,James Mickleboro,The crypto markets rebound looks to have run out of steam and the market is a sea of red again on Friday morning. This latest selling has reduced the value of the entire market by 1.2% over the last 24 hours to US$145.65 billion according to Coin Market Cap. … [+3131 chars],"The prices of Bitcoin, Ripple, Ethereum, and Bitcoin Cash have sunk lower after the crypto rebound ran out of steam...",2018-11-22T20:54:31Z,"{'id': None, 'name': 'Fool.com.au'}","Bitcoin, Ripple, Ethereum, and Bitcoin Cash sink lower after crypto rebound runs out of steam",https://www.fool.com.au/2018/11/23/bitcoin-ripple-ethereum-and-bitcoin-cash-sink-lower-after-crypto-rebound-runs-out-of-steam/,https://www.fool.com.au/wp-content/uploads/2018/04/Bitcoin-down-arrow-16.9.jpg,71
125,Barry Ritholtz,"“So in case the people around your table bought into crypto last year and didnt get out in time, it might be a good idea to treat the subject like politics, keep quiet and pass the gravy…”","Some good advice from the folks at Recode: “So in case the people around your table bought into crypto last year and didn’t get out in time, it might be a good idea to treat the subject like politics, keep quiet and pass the gravy…” Don’t be the jerk who brin…",2018-11-22T21:00:10Z,"{'id': None, 'name': 'Ritholtz.com'}",Cryptocurrency has no place at the table…,https://ritholtz.com/2018/11/cryptocurrency-has-no-place-at-the-table/,https://ritholtz.com/wp-content/uploads/2018/11/crypto.png,7
126,David Hundeyin,"It may have been elicited reactions varying from mild amusement to death threats, but Rebecca Black’s “Friday” released in 2011 certainly got eyeballs — more than 127 million at last count. Whether it was outraged cultural commentators, 4chan jesters, or curi… [+2514 chars]","It may have been elicited reactions varying from mild amusement to death threats, but Rebecca Black’s “Friday” released in 2011 certainly got eyeballs — more than 127 million at last count. Whether it was outraged cultural commentators, 4chan jesters, or curi…",2018-11-22T21:09:40Z,"{'id': 'crypto-coins-news', 'name': 'Crypto Coins News'}",What Year is it? Rebecca Black Parody Pumps Bitcoin Black Friday,https://www.ccn.com/what-year-is-it-rebecca-black-parody-pumps-bitcoin-black-friday/,https://www.ccn.com/wp-content/uploads/2018/11/rebecca-black-friday.jpg,36
127,Nick Chong,"As crypto has nosedived, mainstream financial media outlets, like Bloomberg and CNBC, have interestingly escalated their coverage of this juvenile market. While CNBC has evidently sensationalized Bitcoin’s dismal performance, circulating a Fast Money segment … [+3907 chars]","As crypto has nosedived, mainstream financial media outlets, like Bloomberg and CNBC, have interestingly escalated their coverage of this juvenile market. While CNBC has evidently sensationalized Bitcoin’s dismal performance, circulating a Fast Money segment …",2018-11-22T21:30:32Z,"{'id': None, 'name': 'Newsbtc.com'}",Gigantic Opportunities: Blockchain Capital Partner Touts Crypto Bullishness,https://www.newsbtc.com/2018/11/22/gigantic-opportunities-blockchain-capital-partner-touts-crypto-bullishness/,https://www.newsbtc.com/wp-content/uploads/2018/11/Crypto-Opportunities.jpg,66
