,author,content,description,publishedAt,source,title,url,urlToImage,relevancy
32,Aayush Jindal,Key Highlights Ethereum classic price declined towards the $5.00 support and recovered against the US dollar. There was a break above a key contracting triangle with resistance at $5.55 on the hourly chart of the ETC/USD pair (Data feed via Kraken). The pair … [+1683 chars],Key Highlights Ethereum classic price declined towards the $5.00 support and recovered against the US dollar. There was a break above a key contracting triangle with resistance at $5.55 on the hourly chart of the ETC/USD pair (Data feed via Kraken). The pair …,2018-11-22T07:30:22Z,"{'id': None, 'name': 'Newsbtc.com'}",Ethereum Classic Price Analysis: ETC/USD Could Recover Above $6.00,https://www.newsbtc.com/2018/11/22/ethereum-classic-price-analysis-etc-usd-could-recover-above-6-00/,https://www.newsbtc.com/wp-content/uploads/2018/04/techanalysis-etc2.jpg,79
33,https://www.dailymail.co.uk/debate/columnists/columnist-1071474/Simon-Lambert-for-Thisismoney.co.uk.html,"A year ago bitcoin began its astonishing run that mapped out one of the most striking bubbles of our times. Today, the price of the cryptocurrency is $4,445 some 46 per cent below where it stood this time last year. Thats a mighty fall, but it is what happene… [+2607 chars]","A year ago bitcoin began its astonishing run that mapped out one of the most striking bubbles of our times. It's now down 78% on its December 2017 peak, so what can we learn?",2018-11-22T07:31:09Z,"{'id': None, 'name': 'Thisismoney.co.uk'}",Five things we can learn from the bitcoin bubble:,https://www.thisismoney.co.uk/money/diyinvesting/article-6414951/Five-things-learn-bitcoin-bubble.html,https://i.dailymail.co.uk/1s/2018/11/21/17/6484760-0-image-a-16_1542822383764.jpg,80
34,Julio Gil-Pulgar,"Thousands of French tobacco shops will begin selling Bitcoin coupons from January 1, 2019 forward. Commonly known as “Tabacs,” the French corner stores will now offer crypto. Tobacco Shops Will Soon Sell Cryptocurrencies Throughout France 2018 will remain in … [+2875 chars]","Thousands of French tobacco shops will begin selling Bitcoin coupons from January 1, 2019 forward. Commonly known as “Tabacs,” the French corner stores will now offer crypto. Tobacco Shops Will Soon Sell Cryptocurrencies Throughout France 2018 will remain in …",2018-11-22T08:00:13Z,"{'id': None, 'name': 'Bitcoinist.com'}",French Tobacco Shops Authorized to Sell Bitcoin Starting January 2019,https://bitcoinist.com/french-tobacco-shops-authorized-to-sell-bitcoin-starting-january-2019/,https://bitcoinist.com/wp-content/uploads/2018/11/shutterstock_1160908672-e1542852975229.jpg,56
35,Aayush Jindal,"Key Points Bitcoin cash price recovered above $260, but it struggled near 100 hourly SMA against the US Dollar. This weeks key bearish trend line was beached with resistance at $260 on the hourly chart of the BCH/USD pair (data feed from Kraken). The pair is … [+1621 chars]","Key Points Bitcoin cash price recovered above $260, but it struggled near 100 hourly SMA against the US Dollar. This week’s key bearish trend line was beached with resistance at $260 on the hourly chart of the BCH/USD pair (data feed from Kraken). The pair is…",2018-11-22T08:28:33Z,"{'id': None, 'name': 'Newsbtc.com'}",Bitcoin Cash Price Analysis: BCH/USD Struggling To Surpass 100 SMA,https://www.newsbtc.com/2018/11/22/bitcoin-cash-price-analysis-bch-usd-struggling-to-surpass-100-sma/,https://www.newsbtc.com/wp-content/uploads/2018/04/techanalysis-bch.jpg,45
36,Bar Peleg,"An Israeli-American hacker who terrorized U.S. Jews with bomb threats was sentenced on Thursday to 10 years in prison. The 19-year old was charged with making thousands of bomb threats, including to a United States senator, as well as to airports, schools and… [+2131 chars]","The 19-year-old was charged with making thousands of bomb threats, including to a United States senator, as well as to airports, schools and Jewish centers in the U.S. in 2016 and early 2017",2018-11-22T08:50:59Z,"{'id': None, 'name': 'Haaretz.com'}",Israeli-American hacker who terrorized U.S. Jews with bomb threats jailed for 10 years,https://www.haaretz.com/israel-news/israeli-american-hacker-who-terrorized-u-s-jews-with-bomb-threats-gets-10-years-1.6677435,https://www.haaretz.com/polopoly_fs/1.5681208.1517835964!/image/1018316866.jpg_gen/derivatives/headline_1200x630/1018316866.jpg,121
37,Ricardo Esteves,SWIFT has announced a pilot program in partnership with MonetaGo to explore distributed ledger technology in its financial messaging service. The company’s Indian subsidiary will experiment the technology with local customers banks which will use a shared dis… [+2483 chars],SWIFT has announced a pilot program in partnership with MonetaGo to explore distributed ledger technology in its financial messaging service. The company’s Indian subsidiary will experiment the technology with local customers banks which will use a shared dis…,2018-11-22T09:00:42Z,"{'id': None, 'name': 'Newsbtc.com'}",SWIFT Partners With MonetaGO to Bring Blockchain to Indian Banking System,https://www.newsbtc.com/2018/11/22/swift-partners-with-monetago-to-bring-blockchain-to-indian-banking-system/,https://www.newsbtc.com/wp-content/uploads/2018/06/swift.jpg,68
38,"Nick Cawley, Analyst, Nick Cawley","Bitcoin (BTC) and Ripple (XRP): Prices, Charts and Analysis Cryptocurrency market continues to struggle with ‘dip buying’ absent. Further losses could accelerate due to fragile market conditions. Cryptocurrency Market’s Continued Weakness Bitcoin and Ripple -… [+2688 chars]","Cryptocurrencies continue to struggle to rally off their yearly-lows with trading ranges and turnover contracting. With support lacking, any sell-off could accelerate into further heavy losses.",2018-11-22T09:21:00Z,"{'id': None, 'name': 'Dailyfx.com'}","Bitcoin and Ripple Latest - Lacklustre Rebound, Lower Prices Ahead",https://www.dailyfx.com/forex/market_alert/2018/11/22/Bitcoin-and-Ripple-Latest-Lacklustre-Rebound-Lower-Prices-Ahead.html,,75
39,Aayush Jindal,"Key Points Bitcoin price is slowly recovering and it is currently placed above $4,400 against the US Dollar. There was a break above a short term contracting triangle with resistance at $4,480 on the hourly chart of the BTC/USD pair (data feed from Kraken). T… [+1726 chars]","Key Points Bitcoin price is slowly recovering and it is currently placed above $4,400 against the US Dollar. There was a break above a short term contracting triangle with resistance at $4,480 on the hourly chart of the BTC/USD pair (data feed from Kraken). T…",2018-11-22T09:30:07Z,"{'id': None, 'name': 'Newsbtc.com'}","Bitcoin Price Watch: BTC/USD Buyers Aim $4,950 In Short Term",https://www.newsbtc.com/2018/11/22/bitcoin-price-watch-btc-usd-buyers-aim-4950-in-short-term/,https://www.newsbtc.com/wp-content/uploads/2018/08/techanalysis-btc5.jpg,53
40,Alexandra Ma,"Many people have used Instagram to post photos of the devastating wildfires in Northern and Southern California, which have left at least 84 people dead. Many Instagram influencers have used hashtags related to the event to promote unrelated products. Using k… [+4392 chars]","Many people have used Instagram to post photos of the devastating wildfires in Northern and Southern California, which have left at least 84 people dead. More »",2018-11-22T09:33:09Z,"{'id': None, 'name': 'Businessinsider.com.au'}",Instagram influencers are using hashtags about the devastating California wildfires to promote products,https://www.businessinsider.com.au/instagram-influencers-hashtag-california-wildfires-to-promote-products-2018-11,https://edge.alluremedia.com.au/uploads/businessinsider/2018/11/fire-plane-640x360.jpg,106
41,Carly.Page@incisivemedia.com(Carly Page),"GOOGLE HAS OFFICIALLY introduced the Pixel 3 and Pixel 3 XL, both of which had precisely zero surprises in store. Given the huge number of leaks building up to Google's launch, there was little left for the firm to unveil. As expected, the flagship duo sport … [+30454 chars]","Firm could be shipping Verizon models by mistake,Phones ,google pixel 3,pixel,Google,smartphones,Android",2018-11-22T09:44:00Z,"{'id': None, 'name': 'Theinquirer.net'}","Pixel 3 XL release date, specs and price: Google shipping some units that can't be bootloader unlocked",https://www.theinquirer.net/inquirer/news/3033144/pixel-3-xl-price-release-date-specs-google-shipping-some-units-cant-be-bootloader-unlocked,http://www.theinquirer.net/w-images/d96c0345-04b3-46b6-ad46-d4d3c0439a2c/3/fill/DpE61O54AAzemC-370x229.jpg,129
42,Editorial Team,"The Swiss stock exchange has become the first regulated market to list a multi-crypto exchange traded product. The Amun ETP is based on the Amun HODL5 index, which includes the four top crypto currencies defined by market capitalisation: Bitcoin (BTC), Ethere… [+1453 chars]",The Swiss stock exchange has become the first regulated market to list a multi-crypto exchange traded product.,2018-11-22T09:56:00Z,"{'id': None, 'name': 'Finextra.com'}",SIX lists crypto-basket,https://www.finextra.com/newsarticle/32999/six-lists-crypto-basket?utm_medium=rss&utm_source=finextrafeed,https://www.finextra.com/finextra-images/top_pics/xl/5247.jpg,124
43,Martin Young,"Markets a licking wounds from yearly lows; altcoins clawing back a little. Cryptocurrency markets are flattening out and are not bouncing back. There has been a small recovery since the lowest level of the year a couple of days ago, but nothing significant en… [+1942 chars]","FOMO Moments Markets a licking wounds from yearly lows; altcoins clawing back a little. Cryptocurrency markets are flattening out and are not bouncing back. There has been a small recovery since the lowest level of the year a couple of days ago, but nothing s…",2018-11-22T10:00:03Z,"{'id': None, 'name': 'Newsbtc.com'}",Minimal Movement as Crypto Markets Find New Plateau,https://www.newsbtc.com/2018/11/22/minimal-movement-as-crypto-markets-find-new-plateau/,https://www.newsbtc.com/wp-content/uploads/2018/10/fomo2-flat.jpg,51
44,Yogita Khatri,"Tobacconists in France are reportedly going to be selling bitcoin to the public from New Year. According to France-based radio station Europe 1, tobacco retailers will be offering bitcoin vouchers in denominations of 50, 100 or 250 euros (around $57, $114 or … [+1541 chars]",Tobacconists in France are reportedly going to be selling bitcoin vouchers to the public from New Year.,2018-11-22T10:00:33Z,"{'id': None, 'name': 'Coindesk.com'}",French Tobacco Retailers to Sell Bitcoin From January,https://www.coindesk.com/french-tobacco-retailers-to-sell-bitcoin-from-january,https://www.coindesk.com/wp-content/uploads/2018/11/shutterstock_1062369620.jpg,12
45,Jesse Felder,"""To achieve superior investment results, you have to hold non-consensus views regarding value, and they have to be right. That's not easy The good news is that the prevalence of first level thinkers increases the returns available to second level thinkers. To… [+3525 chars]","To achieve superior investment results, you have to hold non-consensus views regarding value, and they have to be right. That's not easy… The good news is that",2018-11-22T10:12:01Z,"{'id': None, 'name': 'Seekingalpha.com'}","To Succeed In The Markets, You Must Become A 'Second Level Thinker'",https://seekingalpha.com/article/4224051-succeed-markets-must-become-second-level-thinker,https://static.seekingalpha.com/uploads/2018/11/22/saupload_ezDjb5zM-1.png,95
46,Jesse Felder,"""To achieve superior investment results, you have to hold non-consensus views regarding value, and they have to be right. That's not easy The good news is that the prevalence of first level thinkers increases the returns available to second level thinkers. To… [+3525 chars]","To achieve superior investment results, you have to hold non-consensus views regarding value, and they have to be right. That's not easy… The good news is that",2018-11-22T10:12:01Z,"{'id': None, 'name': 'Seekingalpha.com'}","To Succeed In The Markets, You Must Become A 'Second Level Thinker'",https://seekingalpha.com/article/4224051-succeed-markets-must-become-second-level-thinker,https://static.seekingalpha.com/uploads/2018/11/22/saupload_ezDjb5zM-1.png,31
47,Cointelegraph By William Suberg,,Coinbase plaintiffs launch fresh insider trading lawsuit less than one month after a judge throws out the original filing,2018-11-22T10:19:00Z,"{'id': None, 'name': 'Cointelegraph.com'}",Coinbase Faces Fresh Bitcoin Cash Insider Trading Lawsuit Following Initial Rejection,https://cointelegraph.com/news/coinbase-faces-fresh-bitcoin-cash-insider-trading-lawsuit-following-initial-rejection,https://images.cointelegraph.com/images/740_aHR0cHM6Ly9zMy5jb2ludGVsZWdyYXBoLmNvbS9zdG9yYWdlL3VwbG9hZHMvdmlldy83OTk0MTA2NTExNWYxY2EyZjJmZjA5YzIwOTcyZmQzYi5qcGc=.jpg,42
48,,"Torguard is one of the most reputable VPN's available and is very fast and reliable and included a router and 30GB encrypted email account. The router cost around £8 for UK delivery. Select 'Anonymous VPN' then 'Buy Now', Select 'Biennially' and use code BLAC… [+460 chars]",£47 - Torguard Torguard is one of the most reputable VPN's available and is very fast and reliable and included a router and 30GB encrypted email account. The...,2018-11-22T10:24:58Z,"{'id': None, 'name': 'Hotukdeals.com'}",115° - Code Online Now: TWO Years VPN + VPN Router + 30GB Encrypted Email for £47 @ TorGuard,https://www.hotukdeals.com/deals/code-online-now-two-years-vpn-vpn-router-30gb-encrypted-email-for-47-torguard-3112687,https://images.hotukdeals.com/threads/thread_full_screen/default/3112687_1.jpg,64
49,Chris O'Brien,"Tobacco shops are a staple of daily life across France, selling cigarettes, newspapers, magazines, and lottery tickets. But starting in January, these most traditional of merchants will take a plunge into the future by adding cryptocurrencies to their wares. … [+1900 chars]","The French Federation of Tobacco Vendors has approved plans for the country's 27,000 tobacco shops to sell Bitcoin and Ethereum to members.",2018-11-22T10:27:13Z,"{'id': None, 'name': 'Venturebeat.com'}",French tobacco shops will sell Bitcoin and Ethereum starting January 2019,https://venturebeat.com/2018/11/22/french-tobacco-shops-will-sell-bitcoin-and-ethereum-starting-january-2019/,https://venturebeat.com/wp-content/uploads/2018/06/coinage-CEO-market-bitcoin.jpg?fit=1920%2C1316&strip=all,0
50,Jasper Lawler,"The price of bitcoin has plunged by over a quarter in the past week. Tuesday (Nov 20 th ) saw bitcoin drop another 7% to below $4500, as it extended 14% losses from Monday. The most well-known crypto currency is trading at a one-year low. While it has been a … [+5133 chars]",The price of bitcoin has plunged by over a quarter in the past week. The most well-known cryptocurrency is trading at a one-year low. The crash came alongside p,2018-11-22T10:31:08Z,"{'id': None, 'name': 'Seekingalpha.com'}",7 Reasons Cryptocurrencies Could Have Further To Fall,https://seekingalpha.com/article/4224058-7-reasons-cryptocurrencies-fall,https://static.seekingalpha.com/uploads/2018/11/21/48061367-15428039383169646.png,14
51,Press Release,"This is a paid-for submitted press release. CCN does not endorse, nor is responsible for any material included below and isnt responsible for any damages or losses connected with any products or services mentioned in the press release. CCN urges readers to co… [+3078 chars]","This is a paid-for submitted press release. CCN does not endorse, nor is responsible for any material included below and isn’t responsible for any damages or losses connected with any products or services mentioned in the press release. CCN urges readers to c…",2018-11-22T10:51:42Z,"{'id': 'crypto-coins-news', 'name': 'Crypto Coins News'}",A New Era in Social Investing,https://www.ccn.com/a-new-era-in-social-investing/,https://www.ccn.com/wp-content/uploads/2018/11/icumul.png,72
52,,"Officials from the city of Valdez, Alaska have admitted last week to paying $26,623.97 to hackers after the city’s IT network was crippled by a ransomware infection in July. “Based on recommendations from several cyber-crimes specialists, the City engaged a s… [+478 chars]","Officials from the city of Valdez, Alaska have admitted last week to paying $26,623.97 to hackers after the city’s IT network was crippled by a ransomware infection in July. “Based on recommendations from several cyber-crimes specialists, the City engaged a s…",2018-11-22T10:58:00Z,"{'id': None, 'name': 'Threatbrief.com'}","City of Valdez, Alaska admits to paying off ransomware infection",https://threatbrief.com/city-of-valdez-alaska-admits-to-paying-off-ransomware-infection/,https://threatbrief.com/wp-content/uploads/2016/05/big-data.jpg,93
53,Marguerita M. Cheng,"Sometimes people group blockchain, bitcoin and cryptocurrency together and blend the terms, which can create confusion. The following article will help you to distinguish between the three and also point out the differences between blockchains and databases. … [+5860 chars]","The difference between the terms blockchain, bitcoin and cryptocurrency are often not entirely understood. Here's how to distinguish between the three.",2018-11-22T11:00:00Z,"{'id': None, 'name': 'Investopedia.com'}","Blockchain, Bitcoin and Crypto Explained",https://www.investopedia.com/advisor-network/articles/blockchain-bitcoin-and-crypto-explained/,https://i.investopedia.com/image/jpeg/1542726223384/blockchainbitcoincryptos.jpeg,37
54,Omkar Godbole,"Bitcoin’s (BTC) stalled recovery rally could kick off again if prices manage to beat new resistance above $4,600. The leading cryptocurrency by market valuation picked up a bid after hitting 14-month lows near $4,000 on Wednesday, possibly due to record overs… [+2412 chars]","Bitcoin's stalled recovery rally could kick off again if prices manage to beat new resistance above $4,600.",2018-11-22T11:01:22Z,"{'id': None, 'name': 'Coindesk.com'}",$4.6K: Bitcoin’s Price Revival Has a New Target,https://www.coindesk.com/4-6k-bitcoins-price-revival-has-a-new-target,https://www.coindesk.com/wp-content/uploads/2018/08/BTC-and-USD.jpg,49
55,Jeffrey Heller,"JERUSALEM (Reuters) - An Israeli-American man was sentenced to 10 years in prison in Israel on Thursday for making about 2,000 hoax bomb threats that forced evacuations of U.S. Jewish community centers and planes to make emergency landings. The threats, by ph… [+2364 chars]","An Israeli-American man was sentenced to 10 years in prison in Israel on Thursday for making about 2,000 hoax bomb threats that forced evacuations of U.S. Jewish community centers and planes to make emergency landings.",2018-11-22T11:15:27Z,"{'id': 'reuters', 'name': 'Reuters'}",U.S.-Israeli man sentenced in Israel over global bomb threats,https://www.reuters.com/article/us-israel-crime-threats-idUSKCN1NR160,https://s4.reutersmedia.net/resources_v2/images/rcom-default.png,17
56,Raywen Ong,"Picture from: Malaymail. Note, a bitcoin is not actually a physical coin. 30 individuals recently lodged a police report against a bitcoin investment scheme claiming that, collectively, they have lost over RM22 million. The investment scheme, fronted by a loc… [+1467 chars]","Picture from: Malaymail. Note, a bitcoin is not actually a physical coin. 30 individuals recently lodged a police report against a bitcoin investment scheme claiming that, collectively, they have lost over RM22 million. The investment scheme, fronted by a loc…",2018-11-22T11:16:00Z,"{'id': None, 'name': 'Soyacincau.com'}",30 individuals lose RM22 million over bitcoin scheme,https://www.soyacincau.com/2018/11/22/rm22-million-bitcoin-scheme/,https://www.soyacincau.com/wp-content/uploads/2018/11/fb-bitcoin.jpg,39
57,mkitchen,Vote now! Hedgeweek Global Awards 2019 Voting for the for the 2019 edition of the annual Hedgeweek Global Awards is now open. These prestigious awards recognise excellence among hedge fund managers and service providers around the world.,"Newsletter Items: Hedge fund redemptions surge to USD39.1bn in September MV Index Solutions launches Bitcoin US OTC Spot Index Jersey funds choosing Carey Olsen, according to new industry research SS&C GlobeOp Forward Redemption Indicator at 3.96 per cent for…",2018-11-22T11:19:17Z,"{'id': None, 'name': 'Hedgeweek.com'}",Hedgewire 22/11/18,https://www.hedgeweek.com/2018/11/22/hedgewire-221118,,101
58,RT,"Israeli-American Michael Ron David Kadar was found guilty in June of hundreds of counts of extortion, making terroristic threats, computer offenses, and money laundering, among other charges. He used a device to shield his IP address and disguise his voice, p… [+2016 chars]",The 20-year-old mastermind behind a terrifying spate of hoax bomb threats against Jewish institutions the world over between 2016 and 2017 has been sentenced to 10 years in prison. Read Full Article at RT.com,2018-11-22T11:29:01Z,"{'id': 'rt', 'name': 'RT'}","Jewish center bomb hoaxer given 10 years in prison for 2,000 threats worldwide",https://www.rt.com/news/444630-jewish-center-bomb-hoax/?utm_source=rss&utm_medium=rss&utm_campaign=RSS,https://cdni.rt.com/files/2018.11/article/5bf69274fc7e93e2618b45de.JPG,61
59,,"Israeli-American Michael Ron David Kadar was found guilty in June of hundreds of counts of extortion, making terroristic threats, computer offenses, and money laundering, among other charges. He used a device to shield his IP address and disguise his voice, p… [+2016 chars]",The 20-year-old mastermind behind a terrifying spate of hoax bomb threats against Jewish institutions the world over between 2016 and 2017 has been sentenced to 10 years in prison.,2018-11-22T11:29:01Z,"{'id': 'rt', 'name': 'RT'}","Jewish center bomb hoaxer given 10 years in prison for 2,000 threats worldwide",https://www.rt.com/news/444630-jewish-center-bomb-hoax/,https://cdni.rt.com/files/2018.11/article/5bf69274fc7e93e2618b45de.JPG,135
60,Nathaniel Popper,"San Francisco: The news on Wall Street this week has been bleak: sharp declines, fears of a bear market and high-flying technology stocks that suddenly took a tumble. Traditional stock investors may be taking a beating, but they should be glad they didn’t put… [+5685 chars]","As of Wednesday, the price of a Bitcoin had fallen about 25% in a week and was down more than 75% from its peak in December",2018-11-22T11:29:18Z,"{'id': None, 'name': 'Livemint.com'}",5 reasons Bitcoin prices are plunging again,https://www.livemint.com/Money/T7X83Aa1uI6pgKAttskG0N/5-reasons-Bitcoin-prices-are-plunging-again.html,https://www.livemint.com/rf/Image-621x414/LiveMint/Period2/2018/11/23/Photos/Processed/bitcoin-kjDG--621x414@LiveMint.jpg,69
61,David Canellis,"Two major South Korean cryptocurrency exchanges have been forced offline, after critical Amazon Web Services (AWS) servers suffered nationwide failure Thursday morning. AWS, one of the worlds widely used cloud services, was hit with major internal server fail… [+1601 chars]","Two major South Korean cryptocurrency exchanges have been forced offline, after critical Amazon Web Services (AWS) servers suffered nationwide failure Thursday morning. AWS, one of the world’s widely used cloud services, was hit with major internal server fai…",2018-11-22T11:31:51Z,"{'id': 'the-next-web', 'name': 'The Next Web'}",Amazon Web Services outage forces major cryptocurrency exchanges offline,https://thenextweb.com/hardfork/2018/11/22/amazon-server-failure-cryptocurrency/,https://img-cdn.tnwcdn.com/image/hardfork?filter_last=1&fit=1280%2C640&url=https%3A%2F%2Fcdn0.tnwcdn.com%2Fwp-content%2Fblogs.dir%2F1%2Ffiles%2F2018%2F11%2FBitcoin-South-Korea.jpg&signature=793ed32a6c210689568dce4cb83927c5,4
62,Tony,An Israeli court sentenced a teenager to 10 years in prison for making bomb threats targeting airports as well as Jewish Community Centres and schools in the U.S. from 2016 to 2017. Police arraign teenager for sexually abusing 7-year-old girl He was additiona… [+1141 chars],"An Israeli court sentenced a teenager to 10 years in prison for making bomb threats targeting airports as well as Jewish Community Centres and schools in the U.S. from 2016 to 2017. Continue reading Israeli sentenced 10 years for making, marketing bomb threat…",2018-11-22T11:41:19Z,"{'id': None, 'name': 'Vanguardngr.com'}","Israeli sentenced 10 years for making, marketing bomb threats",https://www.vanguardngr.com/2018/11/israeli-sentenced-10-years-for-making-marketing-bomb-threats/,https://www.vanguardngr.com/wp-content/uploads/2017/06/Suicide-bombers.jpg,77
63,All Things Vice,"I was blown away today to read the news that one of the Silk Road arrests, James Ellingson, aka “MarijuanaIsMyMuse” is apparently also the Silk Road user known as “redandwhite”. If my theory is right, redandwhite is one of the greatest scammers Silk Road ever… [+10620 chars]","I was blown away today to read the news that one of the Silk Road arrests, James Ellingson, aka “MarijuanaIsMyMuse” is apparently also the Silk Road user known as “redandwhite”. If my theory is right, redandwhite is one of the greatest scammers Silk Road ever…",2018-11-22T11:50:58Z,"{'id': None, 'name': 'Allthingsvice.com'}",The recently arrested “redandwhite”: one of Silk Road’s greatest nemeses,https://allthingsvice.com/2018/11/22/the-recently-arrested-redandwhite-one-of-silk-roads-greatest-nemeses/,https://allthingsvice.files.wordpress.com/2012/08/index.jpg,112
