,author,content,description,publishedAt,source,title,url,urlToImage,relevancy
253,,"Media playback is not supported on this device Archive: Louis Smith wins European Gymnastics Championship gold Two-time Olympic silver medallist Louis Smith has retired from gymnastics. The 29-year-old represented Great Britain at three Olympic Games, also wi… [+1649 chars]",Two-time Olympic silver medallist Louis Smith announces his retirement from gymnastics at the age of 29.,2018-11-08T09:16:27Z,"{'id': 'bbc-news', 'name': 'BBC News'}",Louis Smith: Olympic silver medallist retires from gymnastics aged 29,https://www.bbc.co.uk/sport/gymnastics/46129328,https://ichef.bbci.co.uk/onesport/cps/624/cpsprodpb/91DE/production/_104224373_gettyimages-589725114.jpg,2
254,,"It was fitting that the Los Angeles Lakers beat the Minnesota Timberwolves of all teams on Wednesday because their wildest stretch of the season to date -- and yes, this is taking into account the fists that flew against the Houston Rockets -- started just mo… [+5997 chars]",The veteran center made an immediate impact on the Lakers' defense and rebounding just a day after arriving from Phoenix.,2018-11-08T09:17:22Z,"{'id': None, 'name': 'Espn.com'}",Tyson Chandler gives the Lakers exactly what they needed in debut,http://www.espn.com/nba/story/_/id/25212412/tyson-chandler-makes-immediate-impact-los-angeles-lakers-debut,http://a2.espncdn.com/combiner/i?img=%2Fphoto%2F2018%2F1107%2Fr460573_1296x729_16%2D9.jpg,68
255,,"By Christina Okello An arms race is building between armed groups in the Central African Republic (CAR) and government forces, according to a new report by a US-based NGO. It warns that a build up in weapons could lead to an escalation in sectarian violence, … [+2669 chars]","[RFI] An arms race is building between armed groups in the Central African Republic (CAR) and government forces, according to a new report by a US-based NGO. It warns that a build up in weapons could lead to an escalation in sectarian violence, bloodier than …",2018-11-08T09:17:25Z,"{'id': None, 'name': 'Allafrica.com'}",Fears of Arms Race As Armed Groups Fight Government,https://allafrica.com/stories/201811080309.html,https://cdn07.allafrica.com/static/images/structure/aa-logo-rgba-no-text-128x128.png,942
256,,"Cast: Amitabh Bachchan, Aamir Khan, Katrina Kaif and Fatima Sana Shaikh Director: Vijay Krishna Acharya Rating: ** ""All that glitter is not gold"", Thugs of Hindostan has proved it right. When the trailer of this film was dropped everyone went crazy owing to t… [+3276 chars]",Thugs of Hindostan could have been better if the director has chosen to focus on writing rather than completely relying on the star value...,2018-11-08T09:21:30Z,"{'id': None, 'name': 'Santabanta.com'}",Thugs of Hindostan Review: It`s better to stay away from these thugs!,http://www.santabanta.com/bollywood/127812/thugs-of-hindostan-review-its-better-to-stay-away-from-these-thugs/,http://media.santabanta.com/newsite/cinemascope/feed/thugs-of-hindostan12.jpg,616
257,"Elisa Bray, Elisa Bray","While the sweetest, cheapest, solid milk chocolates might be enough to delight children, there is a whole world of advent calendars catering for adults, combining beautiful design and decadent contents. Every year the offerings seem to get bigger, more luxuri… [+7544 chars]",Guzzle the finest truffles and nibble on the cutest animal-shaped chocolates this Christmas,2018-11-08T09:22:00Z,"{'id': 'independent', 'name': 'Independent'}",13 best chocolate advent calendars for adults,https://www.independent.co.uk/extras/indybest/christmasgifts/advent-calendars/best-advent-calendars-for-adults-chocolate-luxury-a6720776.html,https://static.independent.co.uk/s3fs-public/thumbnails/image/2018/11/08/09/gails-holding.jpg,263
258,Alyson Footer,"TOKYO -- With nine Gold Glove Awards, two World Series rings and thousands of crouches behind the plate, Cardinals catcher Yadier Molina seemingly has done it all in a Hall of Fame-caliber career that, if he sticks to his plan to retire after 2020, will have … [+4268 chars]","TOKYO -- With nine Gold Glove Awards, two World Series rings and thousands of crouches behind the plate, Cardinals catcher Yadier Molina seemingly has done it all in a Hall of Fame-caliber career that, if he sticks to his plan to retire after 2020, will have …",2018-11-08T09:27:17Z,"{'id': None, 'name': 'Mlb.com'}",Elder statesman Yadi savoring 1st tour of Japan,https://www.mlb.com/news/yadier-molina-enjoying-mlb-tour-of-japan/c-300420772,https://securea.mlb.com/assets/images/1/3/4/300424134/cuts/960x540/cut.jpg,247
259,World Gold Council,"LONDON, November 8, 2018 /PRNewswire/ -- The World Gold Council today launched Goldhub, a market-leading source of data, insights and analytical tools aimed at helping investors understand gold's value as a strategic asset. (Logo: https://mma.prnewswire.com/m… [+3088 chars]","LONDON, November 8, 2018 /PRNewswire/ -- The World Gold Council today launched Goldhub, a market-leading source of data, insights and analytical tools aimed at helping investors understand gold's value as a strategic asset. (Logo:...",2018-11-08T09:30:00Z,"{'id': None, 'name': 'Prnewswire.com'}","World Gold Council Launches Definitive Platform for Gold Data, Analytics and Research",https://www.prnewswire.com/news-releases/world-gold-council-launches-definitive-platform-for-gold-data-analytics-and-research-885267912.html,https://mma.prnewswire.com/media/779630/World_Gold_Council_Logo.jpg?p=facebook,723
260,Euronews,"Champion FMX rider Tom Pages was captured in a spectacular drone doing a 360, a volt, a double back flip, and a bike flip on a man-made course in Girona, Spain. Pages, 33, is a four-time Red Bull X-Fighters champion as well as an X Games gold medallist. The t… [+159 chars]","Champion FMX rider Tom Pages was captured in a spectacular drone doing a 360, a volt, a double back flip, and a bike flip on a man-made course in Girona, Spain. Pages, 33, is a four-time Red Bull X-Fighters champion as well as an X Games gold medallist. The t…",2018-11-08T09:30:03Z,"{'id': None, 'name': 'Liveleak.com'}",Watch: When freestyle motocross meets drone filming,https://www.liveleak.com/view?t=kDm77_1541669403,https://cdn.liveleak.com/80281E/ll_a_u/2018/Nov/8/LiveLeak-dot-com-5be402284b763_13_thumb.jpg,989
261,Mark Emem,"A new paper indicates that the energy required to mine cryptocurrencies is more than what is consumed when excavating for metals of equivalent dollar value. In the paper which was published on November 5 by the Nature journal, researchers at the Cincinnati, O… [+3083 chars]","A new paper indicates that the energy required to mine cryptocurrencies is more than what is consumed when excavating for metals of equivalent dollar value. In the paper which was published on November 5 by the Nature journal, researchers at the Cincinnati, O…",2018-11-08T09:37:36Z,"{'id': 'crypto-coins-news', 'name': 'Crypto Coins News'}",Bitcoin Mining Consumes Over 3X the Energy of Gold Mining: Research,https://www.ccn.com/bitcoin-mining-consumes-over-3x-the-energy-of-gold-mining-research/,https://www.ccn.com/wp-content/uploads/2018/07/Bitcoin-vs-gold.jpg,134
262,"Rachel Tompkins, Rachel Tompkins","We spend approximately a third of our lives asleep. If only it was always dark when we tried to take a nap, and if only we were free from distractions. Sleep masks, however, can help. Going to sleep in the dark should help you drift off as bright lights suppr… [+10453 chars]","From silk designs to no-frills blackouts, these masks are almost guaranteed to help you sleep",2018-11-08T09:40:00Z,"{'id': 'independent', 'name': 'Independent'}",12 best eye masks,https://www.independent.co.uk/extras/indybest/fashion-beauty/womens-nightwear/best-sleep-masks-reviews-uk-travel-dry-eyes-a8095641.html,https://static.independent.co.uk/s3fs-public/thumbnails/image/2018/11/08/09/sleep-holding.jpg,515
263,Reuters Editorial,"TOKYO, Nov 8 (Reuters) - Japan’s Sumitomo Metal Mining Co Ltd posted a 52 percent jump in half-yearly pre-tax profit on Thursday but cut its full-year forecast, blaming lower-than-expected metal prices amid the U.S.-Sino trade spat, and reduced nickel output.… [+1942 chars]","Japan's Sumitomo Metal Mining Co Ltd posted a 52 percent jump in half-yearly pre-tax profit on Thursday but cut its full-year forecast, blaming lower-than-expected metal prices amid the U.S.-Sino trade spat, and reduced nickel output.",2018-11-08T09:47:05Z,"{'id': 'reuters', 'name': 'Reuters'}",Japan's Sumitomo Metal cuts FY profit forecast on lower metal prices,https://www.reuters.com/article/sumitomo-mtl-min-results-idUSL4N1XJ3WB,https://s4.reutersmedia.net/resources_v2/images/rcom-default.png,656
264,Carly.Page@incisivemedia.com(Carly Page),"APPLE HAS GOT fanbois hot under the collar with the unveiling of the iPhone XS, iPhone XS Max and iPhone XR. The iDevice trio had few surprises in store thanks to the huge number of leaks building up to Apple's launch event; the iPhone XS and XS Max pack 5.8i… [+36673 chars]","Report claims shonky PCBs are to blame for production cut,Phones ,iphone 11,Apple,iphone,smartphones,Intel,Qualcomm",2018-11-08T09:48:00Z,"{'id': None, 'name': 'Theinquirer.net'}","iPhone XS deals, price and specs: iPhone XR order cull due to 'quality issues'",https://www.theinquirer.net/inquirer/news/3021021/iphone-xs-deals-price-and-specs-iphone-xr-order-cull-due-to-quality-issues,http://www.theinquirer.net/w-images/466faac4-49ca-41de-bfb1-2df6446162d2/2/2018iPhones-370x229.png,788
265,Peter Kostadinov,"So, what is this telling us? Given that there is no contemporary Samsung flagship that's available in green or pink at the moment, it's highly likely that Samsung is low-key preparing us for the new colors that are to come. Of course, the more memorable of yo… [+847 chars]","Yesterday at the first day of Samsung's SDC'18 developers summit, the South Korean giant not only unveiled the new OneUI user interface, but also gave us a sneak peek at its intriguing foldable phone, which should come out in the... near future.",2018-11-08T09:50:00Z,"{'id': None, 'name': 'Phonearena.com'}",Did Samsung low-key hint that the Galaxy S10 will be available in green and pink?,https://www.phonearena.com/news/Samsung-Galaxy-S10-color-variants-green-pink-silver-black-blue_id110798?utm_source=feedburner&utm_medium=feed&utm_campaign=Feed%3A+phonearena%2FySoL+%28Phone+Arena+-+Latest+News%29,//i-cdn.phonearena.com/images/article/110798-two/Did-Samsung-low-key-hint-that-the-Galaxy-S10-will-be-available-in-green-and-pink.jpg,282
266,Peter Kostadinov,"So, what is this telling us? Given that there is no contemporary Samsung flagship that's available in green or pink at the moment, it's highly likely that Samsung is low-key preparing us for the new colors that are to come. Of course, the more memorable of yo… [+847 chars]","Yesterday at the first day of Samsung's SDC'18 developers summit, the South Korean giant not only unveiled the new OneUI user interface, but also gave us a sneak peek at its intriguing foldable phone, which should come out in the... near future. Well, aside f…",2018-11-08T09:50:00Z,"{'id': None, 'name': 'Phonearena.com'}",Did Samsung low-key hint that the Galaxy S10 will be available in green and pink?,https://www.phonearena.com/news/Samsung-Galaxy-S10-color-variants-green-pink-silver-black-blue_id110798,//i-cdn.phonearena.com/images/article/110798-two/Did-Samsung-low-key-hint-that-the-Galaxy-S10-will-be-available-in-green-and-pink.jpg,840
267,tech2 News Staff,"While the possibility of a PS4 version of PUBG is picking up steam, elsewhere Microsoft has taken some drastic steps to hold on to its PUBG audience on the Xbox One. Starting today, and this is true, you get PlayerUnknown's Battlegrounds for free on Xbox One.… [+1257 chars]","Starting today, and this is true, you get PlayerUnknown's Battlegrounds for free on Xbox One. The post PUBG currently available for free on Xbox One as possible PS4 launch looms large appeared first on Firstpost.",2018-11-08T09:52:19Z,"{'id': None, 'name': 'Firstpost.com'}",PUBG currently available for free on Xbox One as possible PS4 launch looms large,https://www.firstpost.com/tech/gaming/pubg-currently-available-for-free-on-xbox-one-as-possible-ps4-launch-looms-large-5519151.html,https://images.firstpost.com/wp-content/uploads/2018/10/PUBG-1280.jpg,338
268,Kevin Warwick,"During their mid-2000s heyday, Providence foursome Daughters fed off their own recklessness to the point that it became an inextricable part of their identity. Excellent example: I caught them on tour in (maybe) 2007 in Covington, Kentucky, with Louisville ha… [+2254 chars]","During their mid-2000s heyday, Providence foursome Daughters fed off their own recklessness to the point that it became an inextricable part of their identity. Excellent example: I caught them on tour in (maybe) 2007 in Covington, Kentucky, with Louisville ha…",2018-11-08T10:00:00Z,"{'id': None, 'name': 'Chicagoreader.com'}","After eight years away, a wiser—but still volatile—Daughters return with their best record yet",https://www.chicagoreader.com/chicago/after-eight-years-away-a-wiser-but-still-volatile-daughters-return-with-their-best-record-yet/Content?oid=62213829,https://media2.fdncms.com/chicago/imager/u/slideshow/62213808/daughters-2-teaser.jpg,431
269,The Impulsive Buy,"Here are some new seasonal products found on store shelves by your fellow readers. If you’ve tried any of them, share your thoughts in the comments. Skinny Pop White Chocolate Peppermint Kettle Corn (Spotted by Amy W at Walgreens.) Mrs. Thinsters Cookie Thins… [+1440 chars]","Here are some new seasonal products found on store shelves by your fellow readers. If you’ve tried any of them, share your thoughts in the comments. Skinny Pop White Chocolate Peppermint Kettle Corn (Spotted by Amy W at Walgreens.) Mrs. Thinsters Cookie Thins…",2018-11-08T10:00:00Z,"{'id': None, 'name': 'Theimpulsivebuy.com'}",SPOTTED ON SHELVES (SEASONAL EDITION) – 11/8/2018,https://www.theimpulsivebuy.com/wordpress/2018/11/08/spotted-on-shelves-seasonal-edition-11-8-2018/,https://www.theimpulsivebuy.com/wordpress/wp-content/uploads/2018/11/Skinny-Pop-White-Chocolate-Peppermint-Kettle-Corn.jpg,445
270,"Harris Perlman, CFA","Editor's note: Seeking Alpha is proud to welcome Harris Perlman, CFA as a new contributor. It's easy to become a Seeking Alpha contributor and earn money for your best investment ideas. Active contributors also get free access to the SA PRO archive. Click her… [+13009 chars]",The stock trades at less than 3x forward earnings. Investors have ignored the company due to earlier financial trouble and no sell-side coverage. Dramatic valua,2018-11-08T10:00:00Z,"{'id': None, 'name': 'Seekingalpha.com'}",Gran Colombia Gold: Extremely Deep-Value Gold Miner,https://seekingalpha.com/article/4216358-gran-colombia-gold-extremely-deep-value-gold-miner,https://static1.seekingalpha.com/uploads/2018/10/28/49827035-15407828602057338.png,181
271,"Robert Fisk, Robert Fisk","Rarely can history have dictated that the blood of three beheaded daughters should be injected into a vein of hope. The operation, I suppose, was self-administered by the stout little man with thick, matted hair sitting in front of me in an upper floor of the… [+38276 chars]",'I will never forget my daughters. I believe one day I will meet them and I am accountable to God and to them and they will ask me: what did you do for us?',2018-11-08T10:00:01Z,"{'id': 'independent', 'name': 'Independent'}",Izzeldin Abuelaish's three daughters were killed in Gaza – but he still clings to hope for the Middle East,https://www.independent.co.uk/voices/gaza-israel-palestine-middle-east-izzeldin-abuelaish-daughters-killed-hope-robert-fisk-a8621971.html,https://static.independent.co.uk/s3fs-public/thumbnails/image/2018/11/08/09/fisk-latest-canada-0.jpg,794
272,Kristen Doerer,"W hen Heather Hardy and Shelly Vincent met in the ring in New York Citys Madison Square Garden last month for the WBO featherweight title, there werent any measured jabs to start off the fight. They came out swinging. After all, they had no time to lose. Hard… [+7027 chars]",A lack of broadcast coverage has left female fighters underexposed and underpaid. But the Olympics and talented athletes have changed the status quo When Heather Hardy and Shelly Vincent met in the ring in New York City’s Madison Square Garden last month for …,2018-11-08T10:00:09Z,"{'id': 'the-guardian-au', 'name': 'The Guardian (AU)'}",'I was told this was impossible': the long fight to get women's boxing on TV,https://www.theguardian.com/sport/blog/2018/nov/08/womens-boxing-television-deals,https://i.guim.co.uk/img/media/41e42dec69e48c673f6e844086b3273a4f981348/0_21_5472_3283/master/5472.jpg?width=1200&height=630&quality=85&auto=format&fit=crop&overlay-align=bottom%2Cleft&overlay-width=100p&overlay-base64=L2ltZy9zdGF0aWMvb3ZlcmxheXMvdGctZGVmYXVsdC5wbmc&s=aea9875999a0d932b8116b06bc64d67f,51
273,Jon Waterman,"April 1910. High above their diggings in the mining district of Kantishna, three Alaskan prospectors stopped to catch their breath in the thin, subzero air of Americas highest peak. They had launched the most outrageous and difficult ascent in the early annal… [+9790 chars]","In 1910, four gold prospectors summited North America’s tallest mountain in a single day, using little more than donuts and rudimentary equipment. But were they telling the truth? April 1910. High above their diggings in the mining district of Kantishna, thre…",2018-11-08T10:00:10Z,"{'id': 'the-guardian-au', 'name': 'The Guardian (AU)'}",Chasing Denali: how four miners created one of climbing's greatest mysteries,https://www.theguardian.com/sport/2018/nov/08/chasing-denali-how-four-miners-created-one-of-climbings-greatest-mysteries,https://i.guim.co.uk/img/media/052adba122671b0c115e87a35c294a25ed7ceb8e/0_31_5612_3367/master/5612.jpg?width=1200&height=630&quality=85&auto=format&fit=crop&overlay-align=bottom%2Cleft&overlay-width=100p&overlay-base64=L2ltZy9zdGF0aWMvb3ZlcmxheXMvdGctZGVmYXVsdC5wbmc&s=de2965fcd14397f7cfa93c2b2d425121,28
274,https://www.facebook.com/DailyMailCeleb,"She boasts a successful career in the Hollywood industry, spanning over three decades. And Sharon Stone enjoyed a night off her work duties as she joined Keke Palmer at the Los Angeles premiere for Vertical Entertainment's Pimp film at Pacific Theatres on Wed… [+3945 chars]","The screen star, 60, enjoyed a night off her work duties as she joined Keke Palmer at the Los Angeles premiere for Vertical Entertainment's Pimp film at Pacific Theatres on Wednesday.",2018-11-08T10:00:24Z,"{'id': 'daily-mail', 'name': 'Daily Mail'}",Sharon Stone turns heads in yellow off-shoulder jumper as she joins Keke Palmer at film premiere,https://www.dailymail.co.uk/tvshowbiz/article-6366619/Sharon-Stone-turns-heads-yellow-shoulder-jumper-joins-Keke-Palmer-film-premiere.html,https://i.dailymail.co.uk/1s/2018/11/08/09/5921954-0-image-a-4_1541667934197.jpg,968
275,Jon Bailes and Luke Shaw,"When most games today focus on streamlined experiences that promote steady progress, theres something almost anachronistic about the roguelike, with its constant restarts and uneven level design. And yet its in this environment that the formula has blossomed … [+25931 chars]","When most games today focus on streamlined experiences that promote steady progress, there’s something almost anachronistic about the roguelike, with its constant restarts and uneven level design. And yet it’s in this environment that the formula has blossome…",2018-11-08T10:00:27Z,"{'id': None, 'name': 'Kotaku.com.au'}","Live, Die, Upgrade, Repeat: The Modern Roguelike",https://www.kotaku.com.au/2018/11/live-die-upgrade-repeat-the-modern-roguelike/,https://edge.alluremedia.com.au/m/k/2018/11/image-1-620x349-768x432.jpg,793
276,Steven Ewing,"The Maserati Levante was never supposed to have a V8. Like its Ghibli sedan sibling, Maserati's SUV was only slated to use V6 power, in 345- and 424-horsepower states of tune. But some crafty Italians decided to see if the Quattroporte GTS' 3.8-liter V8 could… [+8392 chars]",Maserati’s stylish Levante SUV gets some much-needed V8 power.,2018-11-08T10:00:55Z,"{'id': None, 'name': 'Cnet.com'}",2019 Maserati Levante GTS review: Heart of gold - Roadshow,https://www.cnet.com/roadshow/reviews/2019-maserati-levante-gts-3-8l-review/,https://cnet3.cbsistatic.com/img/pAcTkciZIRIRESwv6nGOOLEOngw=/2018/11/06/0c429855-f31d-4c4f-be4b-0d4a29f00cc1/ogi1-2019-maserati-levante-gts-001.jpg,41
277,,"South Africa's mining production for September decreased 1.8% year-on-year, Statistics South Africa announced on Thursday, with gold production falling by a fifth. Gold production for September 2018 was down 19% when compared to September 2017. This contribut… [+1077 chars]","South Africa's mining production for September decreased 1.8% year-on-year, according to Statistics South Africa, with gold production again shrinking.",2018-11-08T10:02:42Z,"{'id': None, 'name': 'Fin24.com'}",Fin24.com | Annual gold production falls by a fifth in September,https://www.fin24.com/Economy/South-Africa/annual-gold-production-falls-by-a-fifth-in-september-20181108,http://cdn.24.co.za/files/Cms/General/d/7765/b4b9112eb95b47f8b75cd143d6dd6f60.jpg,485
278,"Ramsha Vistro, Azeem Siddiqui, Entertainment Desk, Reuters, Entertainment Desk, Our Correspondent, News Desk, AFP, Reuters, Reuters","PHOTO: INDIA TODAY KARACHI: Bollywood stars Deepika Padukone and Ranveer Singh’s wedding festivities have already begun, kicking off with a traditional puja held in the former’s hometown last week. While there have been many speculations regarding the pair’s … [+2925 chars]",Actor has worn many of the ace designer's outfits in the past... The post 4 Sabyasachi pieces Deepika can take cue from appeared first on The Express Tribune.,2018-11-08T10:05:41Z,"{'id': None, 'name': 'Tribune.com.pk'}",4 Sabyasachi pieces Deepika can take cue from,https://tribune.com.pk/story/1842474/4-4-sabyasachi-pieces-deepika-can-take-cue/,https://c.tribune.com.pk/2018/11/deepika-1541585841.jpg,323
279,Surur,"You can now get Sandisk Ultra 256 GB microSD card for just $54.99, $23 less than its usual $78 price, from Amazon US. This is an A1-rated card, so it can load apps faster for a better smart... Deal Alert: Grab 6 months Xbox Live for only $24.99 Amazon is offe… [+2277 chars]",A growing thread on Reddit are complaining that their legitimate Windows 10 Pro installation is suddenly reverting to Windows 10 Home. One user writes: I am having the same problem. It’s even gone as far as my digital entitlement is gone from my Microsoft acc…,2018-11-08T10:07:24Z,"{'id': None, 'name': 'Mspoweruser.com'}",New Windows Activation issue as Windows 10 Pro becomes Windows 10 Home,https://mspoweruser.com/new-windows-activation-issue-as-windows-10-pro-becomes-windows-10-home/,https://mspoweruser.com/wp-content/uploads/2017/06/surface-pro-windows-10-s.jpg,60
280,,"[This unedited press release is made available courtesy of Gamasutra and its partnership with notable game PR-related resource GamesPress.] Seoul – Nov. 7, 2018 – Players around the world can now join the fight against evil and play as fan-favorite heroes in … [+4649 chars]","Seoul ndash; Nov. 7, 2018 ndash; Players around the world can now join the fight against evil and play as fan-favorite heroes in Power Rangers: All S",2018-11-08T10:09:00Z,"{'id': None, 'name': 'Gamasutra.com'}",POWER RANGERS: ALL STARS RPG AVAILABLE NOW,http://www.gamasutra.com/view/pressreleases/330276/POWER_RANGERS_ALL_STARS_RPG_AVAILABLE_NOW.php,http://img.deusm.com/informationweek/gamasutra_logobig2.png,965
281,,"[This unedited press release is made available courtesy of Gamasutra and its partnership with notable game PR-related resource GamesPress.] Seoul – Nov. 7, 2018 – Players around the world can now join the fight against evil and play as fan-favorite heroes in … [+4649 chars]","Seoul ndash; Nov. 7, 2018 ndash; Players around the world can now join the fight against evil and play as fan-favorite heroes in Power Rangers: All S",2018-11-08T10:09:00Z,"{'id': None, 'name': 'Gamasutra.com'}",POWER RANGERS: ALL STARS RPG AVAILABLE NOW,http://www.gamasutra.com/view/pressreleases/330277/POWER_RANGERS_ALL_STARS_RPG_AVAILABLE_NOW.php,http://img.deusm.com/informationweek/gamasutra_logobig2.png,964
282,,"[This unedited press release is made available courtesy of Gamasutra and its partnership with notable game PR-related resource GamesPress.] Seoul – Nov. 7, 2018 – Players around the world can now join the fight against evil and play as fan-favorite heroes in … [+4649 chars]","Seoul ndash; Nov. 7, 2018 ndash; Players around the world can now join the fight against evil and play as fan-favorite heroes in Power Rangers: All S",2018-11-08T10:09:00Z,"{'id': None, 'name': 'Gamasutra.com'}",POWER RANGERS: ALL STARS RPG AVAILABLE NOW,http://www.gamasutra.com/view/pressreleases/330278/POWER_RANGERS_ALL_STARS_RPG_AVAILABLE_NOW.php,http://img.deusm.com/informationweek/gamasutra_logobig2.png,963
