,author,content,description,publishedAt,source,title,url,urlToImage,relevancy
726,Eren Sengezer,US Dollar Index recovers to mid-96s in the NA session. The U.S. T-bond yields support the greenback. The Fed is not expected to deliver any surprises in the rate statement. Although the greenback suffered losses against its rivals following the midterm electi… [+1479 chars],US Dollar Index recovers to mid-96s in the NA session. The U.S. T-bond yields support the greenback. The Fed is not expected to deliver any surprises in the rate statement. Although the greenback suffered losses against its rivals following the midterm electi…,2018-11-08T18:22:04Z,"{'id': None, 'name': 'Fxstreet.com'}",Gold stays in red below $1230 as dollar gathers strength ahead of Fed,https://www.fxstreet.com/news/gold-stays-in-red-below-1230-as-dollar-gathers-strength-ahead-of-fed-201811081822,https://editorial.azureedge.net/images/Markets/Currencies/Crosses/XAUUSD/banknote-and-a-gold-bullion-53019984_Large.jpg,212
727,Shayan Ghosh,"Mumbai: Market turbulence has driven up borrowing costs at Manappuram Finance Ltd and the company expects it to rise further by up to 60 bps in the remaining part of this fiscal, said V.P. Nandakumar, the managing director and chief executive officer of the g… [+1801 chars]",Manappuram aims to reduce its gold loans as a share of total assets under management to 50% in the coming years,2018-11-08T18:22:30Z,"{'id': None, 'name': 'Livemint.com'}",Manappuram sees borrowing costs rising,https://www.livemint.com/Companies/EXoVV7KKDGmOgrusVEmJIP/Manappuram-sees-borrowing-costs-rising.html,https://www.livemint.com/rf/Image-621x414/LiveMint/Period2/2018/11/09/Photos/Processed/vpnandakumar-kn0H--621x414@LiveMint.jpg,372
728,WEEI,"The Bruins have been missing secondary offense on the ice and Timmy heads in the stands. When they host the Vancouver Canucks on Thursday at TD Garden theyll continue their search for goals from players not on their top line, but they wont have to look far to… [+2246 chars]","The Bruins have been missing secondary offense on the ice and “Timmy heads” in the stands. When they host the Vancouver Canucks on Thursday at TD Garden they'll continue their search for goals from players not on their top line, but they won't have to look fa…",2018-11-08T18:22:46Z,"{'id': None, 'name': 'Radio.com'}",Heady Canucks LW Schaller back to face Bruins,https://weei.radio.com/blogs/matt-kalman/former-boston-forward-tim-schaller-returns-canucks-face-bruins,https://s3.amazonaws.com/s3.weei.com/s3fs-public/USATSI_11487608_heinen_schaller.jpg,578
729,René,Der fantastische James Jean (u.a. Cover für die Fables -Comics) hat anlässlich des 90. Geburtstags von Minnie und Mickey Mouse und die Mickey: The True Original -Ausstellung in New York zwei großartige florale Remixe der Disney-Characters in Harz gegossen. Di… [+688 chars],Der fantastische James Jean (u.a. Cover für die Fables-Comics) hat anlässlich des 90. Geburtstags von Minnie und Mickey Mouse und die Mickey: The True Original-Ausstellung in New York zwei großartige florale Remixe der Disney-Characters in Harz gegossen. Die …,2018-11-08T18:25:54Z,"{'id': None, 'name': 'Nerdcore.de'}",James Jean does Minnie & Mickey,https://nerdcore.de/2018/11/08/james-jean-does-minnie-mickey/,https://nerdcore.de/wp-content/uploads/2018/11/minniemickey.jpg,117
730,Megan Jones,"A 23-year-old Aurora man was charged with 13 felonies after Aurora police said they seized eight weapons, $111,000 worth of narcotics, cash and jewelry from his home. Members of the police special operations group and Illinois Department of Corrections offici… [+1791 chars]","A 23-year-old Aurora man was charged with 13 felonies after Aurora police said they seized eight weapons, $111,000 worth of narcotics, cash and jewelry from his home. Members of the police special operations group and Illinois Department of Corrections offici…",2018-11-08T18:30:00Z,"{'id': None, 'name': 'Chicagotribune.com'}","Aurora man found with $111,000 worth of narcotics, police say",https://www.chicagotribune.com/suburbs/aurora-beacon-news/news/ct-abn-aurora-man-narcotics-st-1108-story.html,https://www.trbimg.com/img-5be48a8c/turbine/ct-abn-aurora-man-narcotics-st-1108,320
731,Lewis White,"You can now get Sandisk Ultra 256 GB microSD card for just $54.99, $23 less than its usual $78 price, from Amazon US. This is an A1-rated card, so it can load apps faster for a better smart... Deal Alert: Grab 6 months Xbox Live for only $24.99 Amazon is offe… [+2277 chars]","Battlefield V’s Origin Early Access isn’t supposed to start until tomorrow. That hasn’t stuck, and premium Origin Access subscribers are able to download and play the WW2 FPS right now. Anyone who is subscribed to the service can download Battlefield V throug…",2018-11-08T18:30:14Z,"{'id': None, 'name': 'Mspoweruser.com'}",Battlefield V is available now for Origin Access subscribers,https://mspoweruser.com/battlefield-v-is-available-now-for-origin-access-subscribers/,https://mspoweruser.com/wp-content/uploads/2018/05/battlefield-V-official-image.jpg,59
732,Dana Zepeda,"Image Source: Unsplash / Simon Rae It's been eight years since my son was born. Two-and-a-half years later, my husband and I were lucky enough to become parents for the second time to my daughter. And despite the chaos of those early years diaper blowouts, cl… [+3039 chars]","Image Source: Unsplash / Simon Rae It's been eight years since my son was born. Two-and-a-half years later, my husband and I were lucky enough to become parents for the second time to my daughter. And despite the chaos of those early years - diaper blowouts, …",2018-11-08T18:30:15Z,"{'id': None, 'name': 'Popsugar.com'}",Why I Took Just My Daughter on Vacation and Left My Son at Home,https://www.popsugar.com/moms/Why-You-Should-Take-Trips-Alone-Each-Your-Kids-45460443,https://media1.popsugar-assets.com/files/thumbor/-IZb7TjRPCQ-GB31oUMyaCVqzOE/fit-in/1200x630/filters:format_auto-!!-:strip_icc-!!-:fill-!white!-/2018/11/08/768/n/44235783/1c0718ea5be471ebf292c9.91771995_.jpg,864
733,Zach Honig,"The world’s most frequent flyer was hoping to hit the 20-million-mile mark on a single airline before 2018 was through as he shared on Instagram, Tom Stuker’s done just that, on United Flight 275 from Newark (EWR) to Los Angeles (LAX) Wednesday night, Nov. 7.… [+4212 chars]","The world’s most frequent flyer was hoping to hit the 20-million-mile mark on a single airline before 2018 was through — now, Tom Stuker’s done just that, on United Flight 275 from Newark (EWR) to Los Angeles (LAX) Wednesday night, Nov. 7. I met Tom on one of…",2018-11-08T18:30:21Z,"{'id': None, 'name': 'Thepointsguy.com'}",World’s Most Frequent Flyer Hits 20 Million Miles on United,http://thepointsguy.com/news/tom-stuker-20-million-united/,https://i1.wp.com/thepointsguy.com/wp-content/uploads/2018/11/IMG_7966.jpg?fit=800%2C456px&ssl=1,184
734,Robert Kiyosaki,Early gains on Wall Street fizzled and sent global stocks lower last week after reports that the U.S. is planning an additional $257 billion worth of tariffs on Chinese goods if upcoming talks between Presidents Donald Trump and Xi Jinping fail to end a trade… [+6548 chars],"This post The Lie Your Broker’s Been Telling You appeared first on Daily Reckoning. Warren Buffett, one of the greatest investors alive, says, “Diversification is a protection against ignorance.” Dallas Mavericks owner, Mark Cuban, said, “Diversification is f…",2018-11-08T18:30:39Z,"{'id': None, 'name': 'Dailyreckoning.com'}",The Lie Your Broker’s Been Telling You,https://dailyreckoning.com/the-lie-your-brokers-been-telling-you/,https://dailyreckoning.com/wp-content/uploads/2018/11/shutterstock_1075401557.jpg,756
735,Ross Dwyer,"Nike’s beloved Air Max 97 is no stranger to shimmering colors. After all, the two most iconic colorways of the 97 are the “Silver Bullet” and the “Metallic Gold,” so the two practically go hand-in-hand. Now, the Christian Tresser-designed classic has surfaced… [+710 chars]","Nike’s beloved Air Max 97 is no stranger to shimmering colors. After all, the two most iconic colorways of the 97 are the “Silver Bullet” and the “Metallic Gold,” so the two practically go hand-in-hand. Now, the Christian Tresser-designed classic has surfaced…",2018-11-08T18:30:44Z,"{'id': None, 'name': 'Sneakernews.com'}",This Kids-Only Air Max 97 Features Iridescent Uppers,https://sneakernews.com/2018/11/08/nike-air-max-97-gs-av3831-500-release-info/,https://sneakernews.com/wp-content/uploads/2018/11/nike-air-max-97-gs-av3831-500-5.jpg?w=1140,200
736,kkelley,Conceptual artist Jonathon Keats has a new large-scale millennium camera project that aims to capture the long-term effects of climate change at Lake Tahoethat is of course if his cameras can survive one thousand years. There are so many ways in which this wi… [+3763 chars],Technology Will these copper cameras survive climate change? The final images will be presented at an exhibition at Sierra Nevada College in 3018.,2018-11-08T18:30:57Z,"{'id': None, 'name': 'Popsci.com'}",These pinhole cameras are capturing 1000 year photos of Lake Tahoe,https://www.popsci.com/1000-year-climate-change-cameraa,https://www.popsci.com/sites/popsci.com/files/styles/opengraph_1_91x1/public/images/2018/11/pinhole-preparation.jpg?itok=AGLkjqY6,74
737,Alison Barretta,Kmart retail stores may be vanishing but that doesn’t mean its remaining brick-and-mortars and online storefront will be absent from this year’s Black Friday festivities. We now have our hands on the 12-page Kmart Black Friday ad. Head after the jump for all … [+2108 chars],Kmart retail stores may be vanishing but that doesn’t mean its remaining brick-and-mortars and online storefront will be absent from this year’s Black Friday festivities. We now have our hands on the 12-page Kmart Black Friday ad. Head after the jump for all …,2018-11-08T18:31:58Z,"{'id': None, 'name': '9to5toys.com'}","Kmart Black Friday ad: All-day doorbusters, 100% cashback, toys, more",https://9to5toys.com/2018/11/08/kmart-lives-black-friday-2018/,https://9to5toys.com/wp-content/uploads/sites/5/2018/11/bigkmart-e1541701519337.jpg?quality=82&strip=all,423
738,"Moor Insights and Strategy, Contributor, Moor Insights and Strategy, Contributor https://www.forbes.com/sites/moorinsights/","For all the promise and potential of the smart home, the category has always been a little like Jellodifficult to nail down and challenging to define. If you ask 10 consumers what it is, youll likely get 10 different answers. Some define a smart home as the s… [+15970 chars]",Analyst Mark N. Vena discusses retailers' role in marketing smart home products.,2018-11-08T18:32:00Z,"{'id': None, 'name': 'Forbes.com'}",Why The Smart Home Needs The Retail Channel,https://www.forbes.com/sites/moorinsights/2018/11/08/why-the-smart-home-needs-the-retail-channel/,https://thumbor.forbes.com/thumbor/600x315/https%3A%2F%2Fblogs-images.forbes.com%2Fmoorinsights%2Ffiles%2F2018%2F11%2Fbestbuy.png,341
739,"OTC Markets Group - News, Filings & Corporate Actions",,"Get Stock & Bond Quotes, Trade Prices, Charts, Financials and Company News & Information for OTCQX, OTCQB and Pink Securities.",2018-11-08T18:32:36Z,"{'id': None, 'name': 'Otcmarkets.com'}",Idaho Champion Gold Mines Canada Inc. (GLDRF: Grey Market) | Idaho Champion Intersects 4.80 Grams Per Tonne Gold Over 5.9 Meters In Highly Oxidized Zone At The Baner Project,https://www.otcmarkets.com/stock/GLDRF/news?id=209752,,693
740,,,"SCI COMMUN### Wildlife conservation

![Figure][1]</img>

PHOTO: ABESELOM ZERIT/ALAMY STOCK PHOTO

The U.S. Fish and Wildlife Service (FWS) must do a better job of protecting the endangered red wolf ( Canis rufus ), a federal judge ruled this week. The decisio…",2018-11-08T18:37:26Z,"{'id': None, 'name': 'Sciencemag.org'}",News at a glance,http://science.sciencemag.org/content/362/6415/622.full,http://science.sciencemag.org/content/362/6415/F1.medium.gif,187
741,Stephanie Pagones,"A homeless man was arrested for robbing and sexually assaulting a woman inside Inwood Hill Park, authorities said Thursday. Alian Puello, 18, was arrested Wednesday around 10 p.m. for the Monday evening attack on a 37-year-old woman, police said. The woman wa… [+694 chars]","A homeless man was arrested for robbing and sexually assaulting a woman inside Inwood Hill Park, authorities said Thursday. Alian Puello, 18, was arrested Wednesday around 10 p.m. for the Monday evening attack on a 37-year-old woman, police said. The woman wa…",2018-11-08T18:39:45Z,"{'id': None, 'name': 'Nypost.com'}",Suspect arrested for sexually assaulting woman at gunpoint in park,https://nypost.com/2018/11/08/suspect-arrested-for-sexually-assaulting-woman-at-gunpoint-in-park/,https://thenypost.files.wordpress.com/2018/11/inwood-suspect-index.jpg?quality=90&strip=all&w=1200,682
742,Mat Elfring,"November is here, and that means it's time to plan out your Black Friday shopping. Up until the actual event--on November 23--retailers will be revealing their huge deals for the holiday season. The first to show off their wares was Target, though that's quic… [+4583 chars]","November is here, and that means it's time to plan out your Black Friday shopping. Up until the actual event--on November 23--retailers will be revealing their huge deals for the holiday season. The first to show off their wares was Target, though that's quic…",2018-11-08T18:43:00Z,"{'id': None, 'name': 'Gamespot.com'}","Target Early Black Friday 2018 Ad Deals: TVs, Tech, And More",https://www.gamespot.com/articles/target-early-black-friday-2018-ad-deals-tvs-tech-a/1100-6462954/,https://static.gamespot.com/uploads/screen_kubrick/1562/15626911/3458159-untitled-5.jpg,667
743,,"""Get to your sections!” Angela screams. Ravenous humans howl. Our gate whines and rattles as they shake and pull, their grubby fingers like worms through the grating. I sit atop a tiny cabin roof made of hard plastic. My legs hang near the windows, and fleece… [+17607 chars]","Annual holiday supersale? Or zombie apocalypse? A tale of blood and bargains from a seductive, archly satiric new voice in American letters.",2018-11-08T18:43:00Z,"{'id': None, 'name': 'Esquire.com'}",Esquire Fiction: Friday Black by Nana Kwame Adjei-Brenyah,https://www.esquire.com/entertainment/books/a23695286/0060-0114-friday-black-november-2018/,"https://hips.hearstapps.com/hmg-prod.s3.amazonaws.com/images/esq110118fiction-lo-3-1-copy-1541697871.jpg?crop=1xw:0.758xh;center,top&resize=1200:*",928
744,,Agency Kuwait city: India’s teenage shooting sensation Saurabh Chaudhary continued his incredible run by claiming his fourth individual gold medal in as many months with a top finish in the 10m air pistol junior men’s event of the Asian Airgun Championship he… [+634 chars],News18 Sensational Saurabh claims gold at Asian Airgun Championship State Times Agency Kuwait city: India's teenage shooting sensation Saurabh Chaudhary continued his incredible run by claiming his fourth individual gold medal in as many months with a top fin…,2018-11-08T18:46:00Z,"{'id': None, 'name': 'Statetimes.in'}",Sensational Saurabh claims gold at Asian Airgun Championship - State Times,http://news.statetimes.in/sensational-saurabh-claims-gold-at-asian-airgun-championship/,http://news.statetimes.in/wp-content/uploads/2016/12/ST-LOGO.jpg,100
745,Terri Peters,"Sign up for our newsletter SUBSCRIBE Nov. 8, 2018 / 6:47 PM GMT / Source: TODAY When a newborn baby loses their umbilical cord stump, some parents save the dried tissue for their child's memory box and others throw it away. But there's a new way to preserve t… [+3011 chars]",Some parents are choosing to preserve their baby's umbilical cord stump with handmade jewelry pieces.,2018-11-08T18:47:36Z,"{'id': None, 'name': 'Today.com'}",Want to preserve baby's umbilical cord stump? There's a necklace for that,https://www.today.com/parents/parents-are-buying-jewelry-made-baby-s-umbilical-cord-t141611,https://media4.s-nbcnews.com/j/newscms/2018_45/1384431/umbilical-cord-jewelry-today-main-181108_0f32c539521da61eb866982101073969.1200;630;7;70;2.jpg,774
746,,"Browsing for a wardrobe for my baby daughters room, and came across this. Seems a bargain at £99 + £10 delivery for a Solid Oak Wardrobe. Available in Gold (natural) or Brown colour. The blurb:- The Marie range is made from Solid Hardwood Chinese Oak 3 hangin… [+333 chars]","£109 - Amazon Browsing for a wardrobe for my baby daughters room, and came across this. Seems a bargain at £99 + £10 delivery for a Solid Oak Wardrobe. Available...",2018-11-08T18:48:06Z,"{'id': None, 'name': 'Hotukdeals.com'}",145° - Solid Chinese Oak Wardrobe £109 at Amazon reduced from £639 @ Tutti Bambini UK,https://www.hotukdeals.com/deals/solid-chinese-oak-wardrobe-109-at-amazon-reduced-from-639-tutti-bambini-uk-3099453,https://images.hotukdeals.com/threads/thread_full_screen/default/3099453_1.jpg,314
747,The Associated Press,"BOGOTA, Colombia (AP) The widow of Pablo Escobar fell madly in love as a preteen with the man who would rise to be a ruthless drug lord, but she says she felt raped when at age 14 he forced her to have a clandestine abortion, and over time came to view him as… [+5428 chars]","BOGOTA, Colombia (AP) — The widow of Pablo Escobar fell madly in love as a preteen with the man who would rise to be a ruthless drug lord, but she says in a new book she felt raped when he forced her to have an abortion at age 14. Over time, she came to view …",2018-11-08T18:51:00Z,"{'id': None, 'name': 'Seattletimes.com'}",Pablo Escobar’s widow describes forced abortion in new book,https://www.seattletimes.com/nation-world/pablo-escobars-widow-describes-forced-abortion-in-new-book/,https://static.seattletimes.com/wp-content/uploads/2018/11/urn-publicid-ap-org-71de306ede7f4578a17eebc28a977430Colombia_Pablo_Escobar_Widow_98772-1200x630.jpg,513
748,"José M. Peralta, Marta G. Cavalcanti","Citation: Peralta JM, Cavalcanti MG (2018) Is POC-CCA a truly reliable test for schistosomiasis diagnosis in low endemic areas? The trace results controversy. PLoS Negl Trop Dis 12(11): e0006813. https://doi.org/10.1371/journal.pntd.0006813 Editor: Michael H.… [+10108 chars]",,2018-11-08T18:51:05Z,"{'id': None, 'name': 'Plos.org'}",Is POC-CCA a truly reliable test for schistosomiasis diagnosis in low endemic areas? The trace results controversy,https://journals.plos.org/plosntds/article?id=10.1371/journal.pntd.0006813,,948
749,"Adrienne Lamb,Rick Bremness","Arts and Culture All is Bright on 124 is back! The free festival is a celebration of winter and features entertainment, food trucks and activities for the kids. Head down to 124th Street Saturday between 4 and 8 p.m. Beautiful: the Carole King Musical continu… [+2102 chars]","Arts, culture, sports and honouring the service of Canadian soldiers. We're sharing events, festivals and more on in Edmonton this weekend.",2018-11-08T18:57:57Z,"{'id': 'cbc-news', 'name': 'CBC News'}",What to do this Remembrance Day weekend in Edmonton,https://www.cbc.ca/news/canada/edmonton/adrienne-lamb-weekend-event-edmonton-1.4894593,https://i.cbc.ca/1.4894754.1541544244!/fileImage/httpImage/image.jpg_gen/derivatives/16x9_620/all-is-bright-on-124.jpg,696
750,J. Bradford DeLong,"John Maynard Keynes (1923): A Tract on Monetary Reform"", pp. 80-82: ""[T]he [Quantity] Theory [of Money] has often been expounded on the further assumption that a mere change in the quantity of the currency cannot affect k, r, and k',—that is to say, in mathem… [+4138 chars]","**John Maynard Keynes** (1923): _[A Tract on Monetary Reform"", pp. 80-82](https://delong.typepad.com/sdj/2013/05/john-maynard-keynes-1923-a-tract-on-monetary-reform-pp-80-82.html)_: ""[T]he [Quantity] Theory [of Money] has often been expounded on the further a…",2018-11-08T18:58:29Z,"{'id': None, 'name': 'Bradford-delong.com'}","""In the Long Run We Are All Dead"" in Context...",https://www.bradford-delong.com/2018/11/in-the-long-run-we-are-all-dead-in-context.html,,113
751,Philip Hersh,"Bradie Tennell had awakened at 4 a.m., as usual, and arrived at the Twin Rinks Ice Pavilion in Chicagos northwest suburbs by 6 a.m., as usual. Now it was early afternoon, and the 2018 Olympic team event bronze medalist was on her sixth of seven 30-minute trai… [+12479 chars]","“I want to repeat as national champion and be on the podium at worlds,” Tennell said. “I want the skating world to see I am more than I was last year.”",2018-11-08T18:59:03Z,"{'id': None, 'name': 'Nbcsports.com'}","Bradie Tennell working to hammer home jumps, repeat national champion mentality",https://olympics.nbcsports.com/2018/11/08/bradie-tennell-working-to-hammer-home-jumps-repeat-national-champion-mentality/,https://nbcolympictalk.files.wordpress.com/2018/11/gettyimages-1052716772.jpg,958
752,FoxNews.com/Classics,"Skip to comments. Rare 1966 Shelby GT350H found in 'little old lady's garage' [Ford Mustang Hertz RentaCar] FoxNews.com/Classics ^ | Nov 8, 2018 | Gary Gastelu | Fox News Posted on 11/08/2018 10:59:13 AM PST by ETL Old rental cars often make the least appeali… [+9314 chars]","Old rental cars often make the least appealing used vehicles, but theres one very big exception to that rule: The 1966 Shelby GT350H. The Rent-a-Racer was a run of special edition cars built for Hertz by Carrol Shelby that were based on his high-performanc…",2018-11-08T18:59:13Z,"{'id': None, 'name': 'Freerepublic.com'}",Rare 1966 Shelby GT350H found in 'little old lady's garage' [Ford Mustang Hertz RentaCar],https://www.freerepublic.com/focus/f-chat/3704097/posts,,700
753,Amara Baptist,"PORTLAND, Ore. (November 8, 2018) The new Nike City Edition NBA game uniforms will be worn in competition by the Portland Trail Blazers on Sunday, November 11 when the team hosts the Boston Celtics. To further energize the on-court debut, the Trail Blazers ha… [+4239 chars]","PORTLAND, Ore. (November 8, 2018) – The new Nike “City Edition” NBA game uniforms will be worn in competition by the Portland Trail Blazers on Sunday, November 11 when the team hosts the Boston Celtics.  To further energize the on-court debut, the Trail Blaze…",2018-11-08T18:59:15Z,"{'id': None, 'name': 'Nba.com'}","Trail Blazers Release New ""City Edition"" Uniform with Blend of Basketball and Portland's Local Art Community",https://www.nba.com/blazers/story/2018/11/8/rip-city-edition-jersey-blends-basketball-and-local-art-community,https://www.nba.com/blazers/sites/blazers/files/20181106_ely_00373_0.jpg,969
754,Kate Thayer,"Plainfield District 202 Superintendent Lane Abrell apologized for a now-deleted photo on Twitter depicting him and other staff dressed in sombreros and ponchos and donning mustaches for Halloween. Abrell, who frequently tweets from an account that identifies … [+4217 chars]","Plainfield District 202 Superintendent Lane Abrell apologized for a now-deleted photo on Twitter depicting him and other staff dressed in sombreros and ponchos and donning mustaches for Halloween. Abrell, who frequently tweets from an account that identifies …",2018-11-08T19:00:00Z,"{'id': None, 'name': 'Chicagotribune.com'}","Plainfield superintendent apologizes after he and staff dressed in sombreros, ponchos and mustaches for Halloween",https://www.chicagotribune.com/lifestyles/ct-life-plainfield-school-administrators-mexican-costumes-20181108-story.html,https://www.trbimg.com/img-5be487e8/turbine/ct-life-plainfield-school-administrators-mexican-costumes-20181108,679
755,Mick Symons,"As homeowners, we've all been there at one point: out there in the blazing heat, screwing on the sprinkler, unwinding the hose — it's labor-intensive. But if you have a built-in sprinkler system, you can control everything right from your phone. All you need … [+3078 chars]","As homeowners, we've all been there at one point: out there in the blazing heat, screwing on the sprinkler, unwinding the hose — it's labor-intensive. But if you have a built-in sprinkler system, you can control everything right from your phone. All you need …",2018-11-08T19:00:02Z,"{'id': None, 'name': 'Imore.com'}",Don't worry with one of these smart irrigation systems,https://www.imore.com/best-smart-irrigation-systems,https://www.imore.com/sites/imore.com/files/styles/large/public/article_images/2016/02/rachio-social-graphic.jpg?itok=AFhwjC1k,405
756,Summer Hull,"From lounge access, to points, travel perks, Amex Offers and more, there are many very good reasons to have multiple American Express cards. You can organize those cards in your wallet at home however you’d like, but until recently, you couldn’t change how th… [+2739 chars]","From lounge access, to points, travel perks, Amex Offers and more, there are many very good reasons to have multiple American Express cards. You can organize those cards in your wallet at home however you’d like, but until recently, you couldn’t change how th…",2018-11-08T19:00:16Z,"{'id': None, 'name': 'Thepointsguy.com'}",Save Time: Amex Now Allows You to Select ‘Default Card’ Shown First at Login,http://thepointsguy.com/news/amex-select-default-card-at-login/,https://i0.wp.com/thepointsguy.com/wp-content/uploads/2018/11/zzzcropppedCard-Hub-Banner_NY-City-Cards-amex-business-platinum.jpg?fit=1268%2C719px&ssl=1,122
