,author,content,description,publishedAt,source,title,url,urlToImage,relevancy
248,Sputnik,"On this episode of Fault Lines, hosts Garland Nixon and Lee Stranahan talk about how the mainstream media manipulates reporting on events and pushes propaganda to fit establishment narratives. Media reporting about Syria, the United Kingdom, and European Unio… [+1813 chars]","On this episode of Fault Lines, hosts Garland Nixon and Lee Stranahan talk about how the mainstream media manipulates reporting on events and pushes propaganda to fit establishment narratives. Media reporting about Syria, the United Kingdom, and European Unio…",2018-11-28T08:32:00Z,"{'id': None, 'name': 'Sputniknews.com'}",Media Deceptions: How the Public is Being Played Around the World,https://sputniknews.com/radio_fault_lines/201811281070176826-media-deception-how-public-is-being-played/,https://cdn2.img.sputniknews.com/images/105261/36/1052613633.jpg,195
249,joythebaker,"This time of year I get all sorts of questions, usually from really thoughtful significant others eager to buy their baker-loves the best baking present they can for the holidays. It’s so sweet and thoughtful and I can’t help but think that it’s also motivate… [+4890 chars]","This time of year I get all sorts of questions, usually from really thoughtful significant others eager to buy their baker-loves the best baking present they can for the holidays. It’s so sweet and thoughtful and I can’t help but think that it’s also motivate…",2018-11-28T08:32:11Z,"{'id': None, 'name': 'Joythebaker.com'}",22 of the Best Gifts For Bakers!,http://joythebaker.com/2018/11/22-of-the-best-gifts-for-bakers/,,119
250,Julian Horsey,Microsoft has today revealed the free Xbox games that will be available to subscribers of the Xbox Games with Gold service during December 2018. During the month of December Xbox Live Gold members will receive four new free games. With two available on the Xb… [+1098 chars],Microsoft has today revealed the free Xbox games that will be available to subscribers of the Xbox Games with Gold service during December 2018. During the month of December Xbox Live Gold members will receive four new free games. With two available on the Xb…,2018-11-28T08:33:13Z,"{'id': None, 'name': 'Geeky-gadgets.com'}",Free Xbox games with Gold December 2018,https://www.geeky-gadgets.com/free-xbox-games-28-11-2018/,https://www.geeky-gadgets.com/wp-content/uploads/2018/11/Free-Xbox-games.jpg,87
251,https://www.facebook.com/DailyMail,"The Food and Drug Administration has warned consumers not to buy Rhino male enhancement products after a rise in reported health issues. The products, said to contain hidden drug ingredients, can cause medical problems including chest pain, severe headaches a… [+2468 chars]","The Rhino products are sold at gas stations and traded on eBay and Amazon while unapproved products have been found in international mail shipments to the U.S., according to the FDA.",2018-11-28T08:35:47Z,"{'id': 'daily-mail', 'name': 'Daily Mail'}","Men should avoid Rhino sexual enhancement pills, FDA warns",https://www.dailymail.co.uk/news/article-6437037/Men-avoid-Rhino-sexual-enhancement-pills-FDA-warns.html,https://i.dailymail.co.uk/1s/2018/11/28/08/6734856-0-image-a-8_1543393494200.jpg,810
252,New York Times,"Mexican drug lord Joaquin El Chapo Guzman. (Source: AP) His $10 million beach house sat along the coast in Acapulco. Moored offshore was the Chapito the yacht he named after himself. One of his ranches, in rural Guadalajara, Mexico, had tennis courts and pool… [+4879 chars]",The druglord used an expensive method to repatriate his profits: he flew the money back from the United States to Mexico in a fleet of private jets.,2018-11-28T08:36:07Z,"{'id': 'the-new-york-times', 'name': 'The New York Times'}","This Mexican druglord had a zoo, cash-filled jets and gave diamond watches to workers",https://www.nytimes.com/2018/11/27/nyregion/el-chapo-trial.html,https://images.indianexpress.com/2017/01/el-chapo-759.jpeg?w=759,560
253,Chris Cook,"Theres no creature of habit like a racehorse trainer and this reflection gives me hope that Might Bite can bounce back when we next see him and either win the King George or go close to it. Yes, he was disappointing in Saturdays Betfair Chase but it seems rel… [+3954 chars]",Nicky Henderson saw his fourth Betfair Chase favourite beaten at Haydock but history suggests there could be a sting in the tail There’s no creature of habit like a racehorse trainer and this reflection gives me hope that Might Bite can bounce back when we ne…,2018-11-28T08:36:21Z,"{'id': 'the-guardian-au', 'name': 'The Guardian (AU)'}",Talking Horses: Might Bite set to bounce back in the King George,https://www.theguardian.com/sport/2018/nov/28/talking-horses-might-bite-bounce-back-king-george-racing-tips,https://i.guim.co.uk/img/media/5cab9fbdb98b3fdcb4d1926df2ad180f23844345/0_143_3500_2100/master/3500.jpg?width=1200&height=630&quality=85&auto=format&fit=crop&overlay-align=bottom%2Cleft&overlay-width=100p&overlay-base64=L2ltZy9zdGF0aWMvb3ZlcmxheXMvdGctZGVmYXVsdC5wbmc&s=96f54ce2dc3c48fc9e95d79fe47a22ba,36
254,,"[This unedited press release is made available courtesy of Gamasutra and its partnership with notable game PR-related resource GamesPress.] 28 th November, 2018 – Richmond, UK: BANDAI NAMCO Entertainment Europe is pleased to announce a selection of new conten… [+2017 chars]","28th November, 2018 ndash; Richmond, UK: BANDAI NAMCO Entertainment Europe is pleased to announce a selection of new content, as part of 3 free updat",2018-11-28T08:38:00Z,"{'id': None, 'name': 'Gamasutra.com'}",FREE UPDATES BRING FESTIVE FEATURES TO DRAGON BALL FIGHTERZ FREE UPDATES BRING FESTIVE FEATURES TO DRAGON BALL FIGHTERZ,http://www.gamasutra.com/view/pressreleases/331668/FREE_UPDATES_BRING_FESTIVE_FEATURES_TO_DRAGON_BALL_FIGHTERZ_FREE_UPDATES_BRING_FESTIVE_FEATURES_TO_DRAGON_BALL_FIGHTERZ.php,http://img.deusm.com/informationweek/gamasutra_logobig2.png,990
255,,"[This unedited press release is made available courtesy of Gamasutra and its partnership with notable game PR-related resource GamesPress.] 28 th November, 2018 – Richmond, UK: BANDAI NAMCO Entertainment Europe is pleased to announce a selection of new conten… [+2017 chars]","28th November, 2018 ndash; Richmond, UK: BANDAI NAMCO Entertainment Europe is pleased to announce a selection of new content, as part of 3 free updat",2018-11-28T08:38:00Z,"{'id': None, 'name': 'Gamasutra.com'}",FREE UPDATES BRING FESTIVE FEATURES TO DRAGON BALL FIGHTERZ FREE UPDATES BRING FESTIVE FEATURES TO DRAGON BALL FIGHTERZ,http://www.gamasutra.com/view/pressreleases/331667/FREE_UPDATES_BRING_FESTIVE_FEATURES_TO_DRAGON_BALL_FIGHTERZ_FREE_UPDATES_BRING_FESTIVE_FEATURES_TO_DRAGON_BALL_FIGHTERZ.php,http://img.deusm.com/informationweek/gamasutra_logobig2.png,991
256,,"[This unedited press release is made available courtesy of Gamasutra and its partnership with notable game PR-related resource GamesPress.] 28 th November, 2018 – Richmond, UK: BANDAI NAMCO Entertainment Europe is pleased to announce a selection of new conten… [+2017 chars]","28th November, 2018 ndash; Richmond, UK: BANDAI NAMCO Entertainment Europe is pleased to announce a selection of new content, as part of 3 free updat",2018-11-28T08:38:00Z,"{'id': None, 'name': 'Gamasutra.com'}",FREE UPDATES BRING FESTIVE FEATURES TO DRAGON BALL FIGHTERZ FREE UPDATES BRING FESTIVE FEATURES TO DRAGON BALL FIGHTERZ,http://www.gamasutra.com/view/pressreleases/331666/FREE_UPDATES_BRING_FESTIVE_FEATURES_TO_DRAGON_BALL_FIGHTERZ_FREE_UPDATES_BRING_FESTIVE_FEATURES_TO_DRAGON_BALL_FIGHTERZ.php,http://img.deusm.com/informationweek/gamasutra_logobig2.png,992
257,PTI,"A sixth world title added to her cabinet, ace Indian boxer MC Mary Kom on Wednesday said she is now aiming for a gold in the Olympics. The 36-year-old is now the most successful boxer in the tournament's history with an overall tally of seven medals. ""I have … [+1486 chars]","International Business Times, India Edition Olympics gold my dream, training hard for it: Mary Kom International Business Times, India Edition A sixth world title added to her cabinet, ace Indian boxer MC Mary Kom on Wednesday said she is now aiming for a gol…",2018-11-28T08:39:14Z,"{'id': None, 'name': 'Ibtimes.co.in'}","Olympics gold my dream, training hard for it: Mary Kom - International Business Times, India Edition",https://www.ibtimes.co.in/olympics-gold-my-dream-training-hard-it-mary-kom-786639,https://data1.ibtimes.co.in/en/full/685771/mc-mary-kom.jpg,141
258,NDTVSports.com,"British women's hockey team star Samantha Quek has been in India for the past week, ahead of the Men's Hockey World Cup 2018 which gets underway on Wednesday. She will be a part of the official broadcast channel in India for the live coverage of the World Cup… [+1660 chars]",Samantha Quek was a member of the England women's hockey team which won the gold medal in the 2016 Olympics.,2018-11-28T08:39:23Z,"{'id': None, 'name': 'Ndtv.com'}",British Hockey Star In Tears After Seeing Her Image On Hospital Wall,https://sports.ndtv.com/hockey/hockey-world-cup-2018-british-hockey-star-samantha-quek-in-tears-after-seeing-her-painting-on-a-wall-1954632,https://c.ndtvimg.com/2018-11/7bap794g_samantha-quek_625x300_28_November_18.jpg,374
259,sarah waris,"With a flurry of medals and titles to her name, MC Mary Kom needs no introduction. As she became the first boxer in the history to clinch six World Championship Golds on Saturday, one could not help but admire her for the dedication and spirit she’s exhibited… [+3413 chars]","The Citizen (press release) Her Passion and Strength will be Mary Kom's Legacy The Citizen (press release) With a flurry of medals and titles to her name, MC Mary Kom needs no introduction. As she became the first boxer in the history to clinch six World Cham…",2018-11-28T08:42:58Z,"{'id': None, 'name': 'Thecitizen.in'}",Her Passion and Strength will be Mary Kom's Legacy - The Citizen (press release),https://www.thecitizen.in//index.php/en/newsdetail/index/11/15648/her-passion-and-strength-will-be-mary-koms-legacy,https://www.thecitizen.in/../NewsImages/articlepage/39b3e9f6ef8f427f2e498b52077054db.png,197
260,Alex Stumpf,"Anybody remember Jose Castillo ? On Monday, FanGraphs released their list of the top 35 Pirates prospects. While these compilations are a terrific tool and fun to read, there is always one nagging question: “how do these lists turn out?” Baseball prospects wr… [+4713 chars]","Anybody remember Jose Castillo? On Monday, FanGraphs released their list of the top 35 Pirates prospects.  While these compilations are a terrific tool and fun to read, there is always one nagging...",2018-11-28T08:44:21Z,"{'id': None, 'name': 'Bucsdugout.com'}",Bucco Breakfast: Revisiting The Top Prospects Of The 2000s,https://www.bucsdugout.com/2018/11/28/18115853/bucco-breakfast-revisiting-the-top-prospects-of-the-2000s,https://cdn.vox-cdn.com/thumbor/hak7zWK5Vaf7PDeALF25HynG5vM=/0x302:2728x1730/fit-in/1200x630/cdn.vox-cdn.com/uploads/chorus_asset/file/13585736/usa_today_10310456.jpg,912
261,https://www.facebook.com/DailyMailCeleb,Cheryl glittered in a gold glitzy suit worn over a skimpy bra as she launched her new Easilocks hair extensions range in London on Tuesday night. The 35-year-old posed for pictures at the chic Langham Hotel in her two-piece which has a slim-fit trouser shape … [+2091 chars],Cheryl glittered in a gold glitzy suit worn over a skimpy bra as she launched her new Easilocks hair extensions range in London on Tuesday night.,2018-11-28T08:45:02Z,"{'id': 'daily-mail', 'name': 'Daily Mail'}",Cheryl dazzles in gold glitzy suit worn over skimpy bra at Easilocks,https://www.dailymail.co.uk/tvshowbiz/article-6437113/Cheryl-dazzles-gold-glitzy-suit-worn-skimpy-bra-Easilocks.html,https://i.dailymail.co.uk/1s/2018/11/28/08/6736140-0-image-a-52_1543395161085.jpg,731
262,Adrian Diaconescu,"If youre still in the market for a solid high-end smartphone... from last year, theres actually no better time than right now to buy one at a great price from a top-rated eBay seller. With the Black Friday and Cyber Monday frenzy finally over, the factory unl… [+1372 chars]","You can save a lot of money on great unlocked phones like the Samsung Galaxy Note 8 after Black Friday and Cyber Monday too, thanks to top-rated eBay sellers like Never MSRP, which currently charges $499.99.",2018-11-28T08:52:00Z,"{'id': None, 'name': 'Phonearena.com'}",Unlocked Samsung Galaxy Note 8 hits new all-time low price on eBay after Cyber Monday,https://www.phonearena.com/news/unlocked-samsung-galaxy-note-8-ebay-deal-new-all-time-low-price_id111434?utm_source=feedburner&utm_medium=feed&utm_campaign=Feed%3A+phonearena%2FySoL+%28Phone+Arena+-+Latest+News%29,//i-cdn.phonearena.com/images/article/111434-two/Unlocked-Samsung-Galaxy-Note-8-hits-new-all-time-low-price-on-eBay-after-Cyber-Monday.jpg,429
263,Adrian Diaconescu,"If youre still in the market for a solid high-end smartphone... from last year, theres actually no better time than right now to buy one at a great price from a top-rated eBay seller. With the Black Friday and Cyber Monday frenzy finally over, the factory unl… [+1372 chars]","If you’re still in the market for a solid high-end smartphone... from last year, there’s actually no better time than right now to buy one at a great price from a top-rated eBay seller. With the Black Friday and Cyber Monday frenzy finally over, the factory u…",2018-11-28T08:52:00Z,"{'id': None, 'name': 'Phonearena.com'}",Unlocked Samsung Galaxy Note 8 hits new all-time low price on eBay after Cyber Monday,https://www.phonearena.com/news/unlocked-samsung-galaxy-note-8-ebay-deal-new-all-time-low-price_id111434,//i-cdn.phonearena.com/images/article/111434-two/Unlocked-Samsung-Galaxy-Note-8-hits-new-all-time-low-price-on-eBay-after-Cyber-Monday.jpg,209
264,"Jack Shepherd, Jack Shepherd","Coldplay are back and under a new band name. Parlophone records announced they had signed a mysterious group called Los Unidades on Wednesday (26 November), posting a blurred image of four people on Twitter. The image was tagged Y02LPAC81ODL, which fans soon … [+9574 chars]",The band have collaborated with Pharrell on the track 'E-Lo',2018-11-28T08:54:00Z,"{'id': 'independent', 'name': 'Independent'}",Coldplay release new song under new band name Los Unidades,https://www.independent.co.uk/arts-entertainment/music/news/coldplay-los-unidades-new-song-video-pharell-williams-e-lo-a8655476.html,https://static.independent.co.uk/s3fs-public/thumbnails/image/2016/08/31/08/coldplay.jpg,434
265,,"The Centre has named former Reserve Bank of India (RBI) governor Bimal Jalan to head an expert committee to review the central bank's economic capital framework (ECF), while RBI has suggested the name of former deputy governor Rakesh Mohan for the post, Busin… [+2256 chars]",The decision to form a panel to review the ECF was taken in the RBI board meeting held on November 19,2018-11-28T08:55:52Z,"{'id': None, 'name': 'Moneycontrol.com'}","RBI capital policy panel: Govt wants Bimal Jalan, RBI suggests Rakesh Mohan#39;s name",https://www.moneycontrol.com/news/business/rbi-capital-policy-panel-govt-wants-bimal-jalan-rbi-suggests-rakesh-mohans-name-3228921.html,https://static-news.moneycontrol.com/static-mcnews/2018/11/Reserve-bank-of-India-770x433.jpg,772
266,,"madmurd 1 m ago Condition:New: A brand-new, unused, unopened and undamaged item in Condition:New: A brand-new, unused, unopened and undamaged item in original retail packaging (where packaging is applicable). If the item comes direct from a manufacturer, it m… [+181 chars]",£254.15 - eBay recently bought an ipad for £299 and thought it was the best it was going to be. now i see this (mad) all colours available,2018-11-28T08:56:11Z,"{'id': None, 'name': 'Hotukdeals.com'}","177° - (from10am) APPLE 9.7"" iPad - 32 GB, Gold (2018) £254 @ currys / ebay",https://www.hotukdeals.com/deals/from10am-apple-97-ipad-32-gb-gold-2018-254-currys-ebay-3122941,https://images.hotukdeals.com/threads/thread_full_screen/default/3122941_1.jpg,240
267,FP Staff,"Prime Minister Narendra Modi came all guns blazing against Congress in the poll-bound state of Rajasthan on Wednesday, slamming the opposition party for perpetuating ""dynasty politics"". Neither you nor I was born with a silver spoon. Your parents or grandpare… [+2251 chars]","Hitting out at the Congress in Nagaur, Modi said, ""Those whose four generations have had no connect with the public cannot understand the pain of the common people. The post Rajasthan polls: ‘Neither you nor I was born with a silver spoon,’ Narendra Modi tell…",2018-11-28T08:57:01Z,"{'id': None, 'name': 'Firstpost.com'}","Rajasthan polls: ‘Neither you nor I was born with a silver spoon,’ Narendra Modi tells Nagaur, slams Congress’ dynasty politics",https://www.firstpost.com/india/rajasthan-polls-neither-you-nor-i-was-born-with-a-silver-spoon-narendra-modi-tells-nagaur-slams-congress-dynasty-politics-5630571.html,https://images.firstpost.com/wp-content/uploads/2018/11/PTI11_27_2018_000062B.jpg,421
268,,,Cheryl glittered in a gold glitzy suit worn over a skimpy bra as she launched her new Easilocks hair extensions range at Langham Hotel in London.,2018-11-28T08:58:24Z,"{'id': 'daily-mail', 'name': 'Daily Mail'}",Video: Cheryl flaunts glitzy gold suit as she launches hair extension range,https://www.dailymail.co.uk/video/tvshowbiz/video-1812782/Video-Cheryl-flaunts-glitzy-gold-suit-launches-hair-extension-range.html,https://i.dailymail.co.uk/1s/2018/11/28/09/6736486-0-image-m-12_1543395703059.jpg,774
269,Antonio Caronna,"Microsoft ha annunciato nelle scorse ore i Games With Gold di dicembre: Dragon Age 2 è il protagonista indiscusso della line-up di Xbox 360 e One, mentre sull'ammiraglia di Redmond arriveranno Q.U.B.E. 2, Never Alone e Mercenaries: Playground of Destruction (… [+4334 chars]","Qube 2 e Dragon Age 2 sono i Games With Gold di dicembre su Xbox One e 360, seguiti da Never Alone e da Mercenaries: Playground of the Destruction",2018-11-28T08:59:00Z,"{'id': None, 'name': 'Everyeye.it'}",Da Qube 2 a Dragon Age 2: I Games with Gold di dicembre 2018,https://www.everyeye.it/articoli/rubrica-da-qube-2-dragon-age-2-i-games-with-gold-dicembre-2018-41728.html,https://images.everyeye.it/img-articoli/da-qube-2-dragon-age-2-games-with-gold-dicembre-2018-v7-41728.jpg,246
270,Money Metals Exchange,"Global debt increased at the fastest rate at the beginning of 2018. In just one quarter, total global debt jumped by more than $8 trillion. That is quite surprising as total world debt rose by $22 trillion for the full year in 2017. Thus, the increase in glob… [+4849 chars]","Global debt increased at the fastest rate at the beginning of 2018. In just one quarter, total global debt jumped by more than $8 trillion. That is quite surpri",2018-11-28T08:59:02Z,"{'id': None, 'name': 'Seekingalpha.com'}",Global Debt Increase 2018 Vs. Gold Investment: Must See Charts,https://seekingalpha.com/article/4224994-global-debt-increase-2018-vs-gold-investment-must-see-charts,https://static2.seekingalpha.com/uploads/2018/11/28/saupload_estimated-global-debt-increase-vs-total-world-gold-investment-and-2018-production-value.jpg,620
271,Liz Moody,"If you've ever been scrolling through Instagram and been stopped in your tracks by a mug, you're not alone: One of the biggest advantages of the social media platform is the exposure it's offered to smaller ceramics artists, allowing consumers to reap the ben… [+2681 chars]",The most unique and meaningful holiday gifts you can buy.,2018-11-28T09:00:00Z,"{'id': None, 'name': 'Mindbodygreen.com'}",So THIS Is Where You Can Buy All Those Stunning Ceramics You See On Instagram,https://www.mindbodygreen.com/articles/where-to-buy-cool-ceramic-mugs-and-plates,"https://mindbodygreen-res.cloudinary.com/image/upload/c_crop,x_0,y_83,w_1650,h_927/c_fill,w_720,h_378,g_auto,q_85,fl_lossy,f_jpg/org/p5k0zfn1jjp08cgau.jpg",208
272,Krystal,"Christmas time is the perfect excuse to go over the top and decorate your home from top to bottom, which is why its one of our favorites. Keeping that in mind, we bring you fun and festive Christmas decorating ideas in order to this holiday season less stress… [+5268 chars]","Christmas time is the perfect excuse to go over the top and decorate your home from top to bottom, which is why its one of our favorites. Keeping that in mind, we bring you fun and festive Christmas decorating ideas in order to this holiday season less stress…",2018-11-28T09:00:07Z,"{'id': None, 'name': 'Trendir.com'}",Fun and Festive Christmas Decorating Ideas,https://www.trendir.com/festive-christmas-decorating-ideas/,https://cdn.trendir.com/wp-content/uploads/2018/11/christmas-layering.jpg,219
273,Kelly,"I don’t know if I’m the first person to tell you this, but 🎶IT’S THE HOLIDAY SEASON 🎶and I have never been more ready for anything in my life. Give me twinkly lights, give me all the Bublé (and bubbly), give me big ol’ wreaths and yards and yards of velvety… [+1456 chars]","I don’t know if I’m the first person to tell you this, but IT’S THE HOLIDAY SEASON and I have never The post The Everygirl’s 2018 Holiday Capsule Wardrobe + How to Style It appeared first on The Everygirl.",2018-11-28T09:00:51Z,"{'id': None, 'name': 'Theeverygirl.com'}",The Everygirl’s 2018 Holiday Capsule Wardrobe + How to Style It,http://theeverygirl.com/the-everygirls-2018-holiday-capsule-wardrobe/,http://cdn.theeverygirl.com/wp-content/uploads/2018/11/The-Everygirls-2018-Holiday-Capsule-Wardrobe-s.png,147
274,Money Metals Exchange,"While the debate on the dynamics of the gold market continues, at least the top gold miners' production cost provides us with a floor price. Or rather, a basic minimum price level. I get a good laugh when I read analysts suggesting that the gold price will fa… [+8266 chars]","While the debate on the dynamics of the gold market continues, at least the top gold miners' production cost provides us with a floor price. Or rather, a basic",2018-11-28T09:02:24Z,"{'id': None, 'name': 'Seekingalpha.com'}",Top Gold Miners' Production Cost Still Provides Floor In The Market Price,https://seekingalpha.com/article/4224995-top-gold-miners-production-cost-still-provides-floor-market-price,https://static2.seekingalpha.com/uploads/2018/11/28/saupload_homestake-minings-gold-production-cost-vs-market-price.jpg,37
275,PTI,"NEW DELHI: A sixth world title added to her cabinet, ace Indian boxer M C Mary Kom Wednesday said she is now aiming for a gold in the Olympics. The 36-year-old claimed her sixth gold at the world event, making her the most successful boxer in the tournament's… [+1588 chars]","The New Indian Express Olympics gold my dream, training hard for it: Mary Kom The New Indian Express Mary Kom won her world title in the 48kg category but for the Olympics, she will have to bulk up to the 51kg division. Share Via Email. Published: 28th Novemb…",2018-11-28T09:03:00Z,"{'id': None, 'name': 'Newindianexpress.com'}","Olympics gold my dream, training hard for it: Mary Kom - The New Indian Express",http://www.newindianexpress.com/sport/other/2018/nov/28/olympics-gold-my-dream-training-hard-for-it-mary-kom-1904420.html,http://images.newindianexpress.com/uploads/user/imagelibrary/2018/11/26/w600X390/PTI11_24_2018_000085B.jpg,151
276,Brad Stephenson,The long-awaited Geonosis update has begun to rollout to the Star Wars Battlefront II video game on PC and is expected to arrive on Microsoft’s Xbox One consoles in two hours at around 11:00 UTC. This update will be one of the biggest updates the game has rec… [+925 chars],The long-awaited Geonosis update has begun to rollout to the Star Wars Battlefront II video game on PC and is expected to arrive on Microsoft's Xbox One consoles in two hours at around 11:00 UTC. This update will be one of the biggest updates the game has rec…,2018-11-28T09:06:38Z,"{'id': None, 'name': 'Onmsft.com'}",Xbox One’s Star Wars Battlefront II video game gets Obi-Wan Kenobi & Geonosis today,https://www.onmsft.com/news/xbox-ones-star-wars-battlefront-ii-video-game-gets-obi-wan-kenobi-geonosis-today,https://www.onmsft.com/wp-content/uploads/2018/11/starwarsobiwan-1031x580.jpg,106
277,Olivia,"Picking a baby name is a huge decision. Every parent has specific things they do and don't like in a baby name. Some parent's love super new and trendy names, but others don't. If mom and dad love older names, this list has them covered! Many millennial mom's… [+12659 chars]","Picking a baby name is a huge decision. Every parent has specific things they do and don't like in a baby name. Some parent's love super new and trendy names, but others don't. If mom and dad love older names, this list has them covered!",2018-11-28T09:11:16Z,"{'id': None, 'name': 'Babygaga.com'}",20 90s Names That Millennial Moms Still Love,https://www.babygaga.com/20-90s-names-that-millennial-moms-still-love/,https://static3.babygagaimages.com/wordpress/wp-content/uploads/2018/11/Untitled-design-3-45.png,980
