,author,content,description,publishedAt,source,title,url,urlToImage,relevancy
496,Justin Kahn,,"Today only, as part of its Gold Box Deals of the Day, Amazon is offering up to 40% off Keter’s outdoor furniture and more. Starting from around $22, we are seeing everything from hundreds of dollars off storage sheds to discounts on outdoor all-weather patio …",2018-11-28T14:02:44Z,"{'id': None, 'name': '9to5toys.com'}","All-weather patio furniture from $22 at Amazon for today only: deck boxes, planters, more",https://9to5toys.com/2018/11/28/all-weather-patio-furniture-amazon/,https://9to5toys.com/wp-content/uploads/sites/5/2018/11/Outdoor-Patio-Storage-Garden-Bench-Deck-Box.jpg?quality=82&strip=all,311
497,FP Sports,"India are expected to face an uphill battle playing in front of the vociferous home support at the Kalinga Stadium at the 2018 Hockey World Cup. Despite being the most successful team in Olympic hockey with eight golds, India have won the World Cup only once,… [+14075 chars]",Take a look at the 18-man-squad for India's campaign in the 2018 Hockey World Cup. The post Hockey World Cup 2018: Profiling India’s 18-man squad for showpiece event in Bhubaneswar appeared first on Firstpost.,2018-11-28T14:03:05Z,"{'id': None, 'name': 'Firstpost.com'}",Hockey World Cup 2018: Profiling India’s 18-man squad for showpiece event in Bhubaneswar,https://www.firstpost.com/sports/hockey-world-cup-2018-profiling-indias-18-man-squad-for-showpiece-event-in-bhubaneswar-5633921.html,https://images.firstpost.com/wp-content/uploads/2018/11/Indian-hockey-team-Social.jpg,260
498,"Harriet Agerholm, Harriet Agerholm","More than 130 fires raging across northeast Australia pose a catastrophic threat to thousands of residents, authorities have warned. Thousands of people have been told to evacuate their homes and families have been urged to stay together as the fires continue… [+30565 chars]","'We have never been in this situation before,' says emergency services commissioner",2018-11-28T14:06:01Z,"{'id': 'independent', 'name': 'Independent'}",Queensland fire: Thousands of Australians told to flee homes as threat level raised to 'catastrophic',https://www.independent.co.uk/news/world/australasia/queensland-fire-latest-australia-catastrophic-thousands-evacuated-grace-a8655846.html,https://static.independent.co.uk/s3fs-public/thumbnails/image/2018/11/28/13/firefighters.jpg,749
499,Alvin aqua Blanco,"Source: Icon Sportswire / Getty That Washington NFL team just took another L without taking the field. The squad whose name is a racial slur just picked up Reuben Foster, the linebacker who was quickly cut by the San Francisco 49ers after he was arrested in T… [+1574 chars]","That Washington NFL team just took another L without taking the field. The squad whose name is a racial slur just picked up Reuben Foster, the linebacker who was quickly cut by the San Francisco 49ers after he was arrested in Tampa Bay for allegedly slapping …",2018-11-28T14:06:58Z,"{'id': None, 'name': 'Hiphopwired.com'}",Washington NFL Team Claims Alleged Woman Beater,https://hiphopwired.com/786826/washington-nfl-team-claims-alleged-woman-beater/,https://ionehiphopwired.files.wordpress.com/2018/11/15434137701839.jpg?quality=85&strip=all&w=560&h=320&crop=1,595
500,Lainey,"Dear Gossips, The National Board of Review announced its award winners yesterday. NBR isn’t always that great of an Oscar predictor; last year their Best Film was The Post, Best Actor and Best Actress were Tom Hanks and Meryl Streep, Willem Dafoe and Laurie M… [+1471 chars]","Dear Gossips, The National Board of Review announced its award winners yesterday. NBR isn’t always that great of an Oscar predictor; last year their Best Film was The Post, Best Actor and Best Actress were Tom Hanks and Meryl Streep, Willem Dafoe and Laurie M…",2018-11-28T14:09:52Z,"{'id': None, 'name': 'Laineygossip.com'}","Intro for November 28, 2018",https://www.laineygossip.com/crazy-rich-asians-named-best-ensemble-by-the-nbr-and-intro-for-november-28-2018/51406,http://www.laineygossip.com:80/Content/images/articles/michelle-yeoh-open-28nov18.JPG,474
501,"info@hypebeast.com (HYPEBEAST), HYPEBEAST","After teasing AMBUSH ‘s take on the Nike Air Max 180 recently, designer Yoon has now given an even better look at the upcoming collaborative release. In an Instagram post announcing the world launch details for the collaboration, Yoon revealed the mid-top sne… [+602 chars]","After teasing AMBUSH's take on the Nike Air Max 180 recently, designer Yoon has now given an even better look at the upcoming collaborative release. In an Instagram post announcing the world launch details for the collaboration, Yoon revealed the mid-top snea…",2018-11-28T14:09:52Z,"{'id': None, 'name': 'Hypebeast.com'}",Yoon Shares a Better Look at AMBUSH's Upcoming Nike Collaboration,https://hypebeast.com/2018/11/nike-yoon-ambush-180-closer-look-release-details,https://image-cdn.hypb.st/https%3A%2F%2Fhypebeast.com%2Fimage%2F2018%2F11%2Fnike-ambush-world-launch-event-details-0-tw.jpg?w=960&cbr=1&q=90&fit=max,29
502,Shabana Arif,"If you don't like that prospect, you'll be able to snap them up with real money. By Shabana Arif Red Dead Online players have worked out how long it takes to earn gold bars - and they're not ecstatic about it. The Red Dead Online beta has started rolling out,… [+2579 chars]",Red Dead Online players aren't happy about how long it takes to earn gold bars.,2018-11-28T14:13:27Z,"{'id': 'ign', 'name': 'IGN'}",Red Dead Online's Gold Bars Could Take up to 8 Hours to Earn,https://ca.ign.com/articles/2018/11/28/red-dead-onlines-gold-bars-could-take-up-to-8-hours-to-earn,https://assets1.ignimgs.com/2018/10/30/goldbarexploit-1280-1540933295575_1280w.jpg,3
503,Haresh Menghani,Note: All information on this page is subject to change. The use of this website constitutes acceptance of our user agreement. Please read our privacy policy and legal disclaimer. Trading foreign exchange on margin carries a high level of risk and may not be … [+1276 chars],"• The precious metal continued with its struggle to register any meaningful recovery and was seen oscillating in a narrow trading band, forming a rectangle on the 1-hourly chart. • Given the overnight bearish breakthrough the $1220 important horizontal suppor…",2018-11-28T14:14:45Z,"{'id': None, 'name': 'Fxstreet.com'}",Gold Technical Analysis: Set-up points to an extension of the overnight bearish breakdown,https://www.fxstreet.com/news/gold-technical-analysis-set-up-points-to-an-extension-of-the-overnight-bearish-breakdown-201811281414,https://editorial.azureedge.net/images/Markets/Commodities/Metals/Gold/gold-coins-on-a-weight-scale-gm173237086-20246712_Large.jpg,210
504,Heidi Stevens,"I brought my 9-year-old son to see A Christmas Carol at the Goodman Theatre last Sunday, and I spent a good chunk of the performance thinking of all the people who would do well to absorb its beautiful, timeless message of generositys triumph over greed. I sp… [+4614 chars]","I brought my 9-year-old son to see “A Christmas Carol” at the Goodman Theatre last Sunday, and I spent a good chunk of the performance thinking of all the people who would do well to absorb its beautiful, timeless message of generosity’s triumph over greed. I…",2018-11-28T14:15:00Z,"{'id': None, 'name': 'Chicagotribune.com'}","In 'A Christmas Carol,' a timely example of a niece who (lovingly) calls out her terrible uncle",https://www.chicagotribune.com/lifestyles/stevens/ct-life-stevens-wednesday-christmas-carol-be-the-niece-1127-story.html,https://www.trbimg.com/img-5bfea36f/turbine/ct-life-stevens-wednesday-christmas-carol-be-the-niece-1127,706
505,,"This month, Tanzania s government sent in the army. The deployment was not to repel an invading force or to crush a terrorist threat. The armys instructions were clear: buy cashew nuts. The intervention, which sent global cashew prices higher, was intended to… [+4427 chars]",The power relations of slavery are preserved by global commodity markets,2018-11-28T14:15:55Z,"{'id': 'financial-times', 'name': 'Financial Times'}",Africa exports its wealth for our enjoyment,https://www.ft.com/content/b8c20e7e-f270-11e8-ae55-df4bf40f9d0d,https://www.ft.com/__origami/service/image/v2/images/raw/http%3A%2F%2Fprod-upp-image-read.ft.com%2F38238b54-f30f-11e8-938a-543765795f99?source=next-opengraph&fit=scale-down&width=900,280
506,Kirsten Acuna,"Warning: There are some minor spoilers ahead for ""Spider-Man: Into the Spider-Verse."" "" Ralph Breaks the Internet "" may be breaking records at the box-office right now, but everyone will be talking about Sony Pictures Animation's ""Spider-Man"" movie come the h… [+10770 chars]","Warning: There are some minor spoilers ahead for ""Spider-Man: Into the Spider-Verse."" "" Ralph Breaks the Internet "" may be breaking records at the box-office right now, but everyone will be talking about Sony Pictures Animation's ""Spider-Man"" movie come the h…",2018-11-28T14:19:00Z,"{'id': None, 'name': 'Thisisinsider.com'}",Believe the hype — 'Spider-Man Into the Spider-Verse' is the best and most beautiful animated movie you'll see this year,https://www.thisisinsider.com/spider-man-into-the-spider-verse-review-2018-11,https://amp.businessinsider.com/images/5bfea43fbde70f514e0f4e1b-1920-960.jpg,143
507,Ying Hua,The top dog companies like Apple or Huawei are releasing flagship smartphones for pretty crazy prices recently and many of the customers are starting to question the need for such extreme priced models. After all is the $800 flagship really 4 times better tha… [+2941 chars],The top dog companies like Apple or Huawei are releasing flagship smartphones for pretty crazy prices recently and many of the customers are starting to question the need for such extreme priced models. After all is the $800 flagship really 4 times better tha…,2018-11-28T14:19:12Z,"{'id': None, 'name': 'Gizchina.com'}",OUKITEL U23 VS Huawei P20 Pro : duel with a $600+ price difference,https://www.gizchina.com/2018/11/28/oukitel-u23-vs-huawei-p20-pro-duel-with-a-600-price-difference/,https://img.gizchina.com/2018/11/OUKITEL-U23-sale-on-gearbest.jpg,592
508,"Cory Stieg, written by Cory Stieg","Now Reading 22 Trendy Gifts For Your Wellness-Obsessed Friend At a time when "" wellness culture "" dominates, it can be tough to keep up with all the cool health and wellness influencers and products out there. (Not to mention somewhat sketchy, since many ""hea… [+536 chars]","Most of us have a well-meaning friend who is always pushing the latest wellness trends that they saw on Instagram. Stick a jade egg in your vagina, have some bone broth, take this strange new workout class, and use this vibrating massage tool, they say. While…",2018-11-28T14:20:00Z,"{'id': None, 'name': 'Refinery29.com'}",What To Get Your Friend Who's Obsessed With The Wellness Scene,https://www.refinery29.com/en-us/2018/11/215244/wellness-gift-ideas,"https://s1.r29static.com//bin/entry/db6/0,0,2000,1050/x/2076573/image.png",455
509,Ryan Gaydos,"Bruce Springsteen revealed his battles with mental health issues in an interview published Tuesday. Springsteen, 69, told Esquire he began to worry about his own mental health when his father, Doug Springsteen, was diagnosed with schizophrenia before his deat… [+2802 chars]","Fox News Bruce Springsteen reveals mental health struggles: 'The wheels can come off a little bit' Fox News Bruce Springsteen revealed his battles with mental health issues in an interview published Tuesday. Springsteen, 69, told Esquire he began to worry abo…",2018-11-28T14:20:28Z,"{'id': 'fox-news', 'name': 'Fox News'}",Bruce Springsteen reveals mental health struggles: 'The wheels can come off a little bit' - Fox News,https://www.foxnews.com/entertainment/bruce-springsteen-reveals-mental-health-struggles-the-wheels-can-come-off-a-little-bit,https://static.foxnews.com/foxnews.com/content/uploads/2018/09/bruce20springsteen20AP.jpg,375
510,,"ANIMAL PLANET PREMIERES AKC NATIONAL CHAMPIONSHIP DOG SHOW PRESENTED BY ROYAL CANIN ON NEW YEAR'S DAY WITH A STAR-PACKED #TEAMDOG CELEBRATION New Year's Day Special to Feature Mario Lopez, Shawn Johnson and Others to Champion the Competitive Journey to Find O… [+5146 chars]","The AKC National Championship Presented by Royal Canin will feature thousands of dogs from around the world competing for various titles across multiple events and more than $150,000 in prize money, the largest in the world of dog shows.",2018-11-28T14:22:00Z,"{'id': None, 'name': 'Thefutoncritic.com'}",Animal Planet New Year's Day Special - AKC National Championship Dog Show Presented by Royal Canin,http://www.thefutoncritic.com/news/2018/11/28/animal-planet-new-years-day-special-akc-national-championship-dog-show-presented-by-royal-canin-458215/20181128animalplanet01/,,717
511,Monica Burton,"It should be common knowledge that when dining out in America, you tip your server. Sure, tipping is inherently exploitative, but as long as tipped minimum wages exist, you dont get to opt out. But how much? People are eating out more and more at restaurants … [+9806 chars]","What to tip at sit-down restaurants, coffee shops, counter-service cafes, bakeries, food trucks, and any other food-service situation — even when the gratuity is included.",2018-11-28T14:22:07Z,"{'id': None, 'name': 'Eater.com'}",The Definitive Guide to Tipping in Any Situation,https://www.eater.com/2018/11/28/18112819/tipping-in-america-guide-restaurants-how-much,https://cdn.vox-cdn.com/thumbor/7U1bIXSovqxLgagWT4cFqJymYrY=/0x77:2000x1124/fit-in/1200x630/cdn.vox-cdn.com/uploads/chorus_asset/file/13551237/TIP.1.daquino.jpg,671
512,,"Economy Jacksonville City Council votes to raise tax levy Unsurprisingly, growing pension costs were cited as the main driver of the increase. Pensions were up $364,000 this year. 2.4 percent of the 3.5 percent increase was necessary just to cover the police … [+4064 chars]",Jacksonville City Council votes to raise tax levy Norridge hikes property taxes by more than 35 percent to pay for pensions (Illinois) Pension board seeking to raise teacher retirement age in New Mexico 10 Cities Where Americans Are Deepest in Debt—but Still …,2018-11-28T14:22:10Z,"{'id': None, 'name': 'Peakprosperity.com'}","Daily Digest 11/28 - IL Hikes Property Taxes To Pay For Pensions, The Insect Apocalypse Is Here",https://www.peakprosperity.com/dailydigest/114577/daily-digest-1128-il-hikes-property-taxes-pay-pensions-insect-apocalypse-here,https://www.peakprosperity.com/sites/default/files/content/article/article-photo/wstryder_0.jpg,544
513,Michael Jolly,Editor's note: Seeking Alpha is proud to welcome Michael Jolly as a new contributor. It's easy to become a Seeking Alpha contributor and earn money for your best investment ideas. Active contributors also get free access to the SA PRO archive. Click here to f… [+9873 chars],"Roughly four years ago, Medusa began construction on an E15 service shaft which was intended to be used to transport men, equipment and ore from the Co-O mine.",2018-11-28T14:22:56Z,"{'id': None, 'name': 'Seekingalpha.com'}",A Bright Future For Medusa Mining?,https://seekingalpha.com/article/4225050-bright-future-medusa-mining,https://static.seekingalpha.com/uploads/2018/11/7/49828511-1541580859219499_origin.png,156
514,,"WOBURN, Mass.--( BUSINESS WIRE )-- Kaspersky Lab has released a new report on the global outbreak in malicious cryptocurrency mining that unfolded in 2018, which saw the number of crypto-mining attacks increase by more than 83 percent over the previous year. … [+4830 chars]","WOBURN, Mass.--(BUSINESS WIRE)--Kaspersky Lab has released a new report on the global outbreak in malicious cryptocurrency mining that unfolded in 2018.",2018-11-28T14:23:51Z,"{'id': None, 'name': 'Businesswire.com'}",Kaspersky Lab Finds 2018’s Malicious Crypto-Mining Fever Powered by Pirated Software and Content,https://www.businesswire.com/news/home/20181128005453/en/Kaspersky-Lab-Finds-2018%E2%80%99s-Malicious-Crypto-Mining-Fever,https://mms.businesswire.com/media/20181128005453/en/692502/23/20181128_Infographic_Malicious_Crypto_Miners_2018.jpg,587
515,,"SALT LAKE CITY &amp; BELLEVUE, Wash.--( BUSINESS WIRE )-- Sarcos ® Robotics, a global leader in robotic systems that augment, rather than replace, humans working in the industrial, public safety and military sectors, today announced a number of significant te… [+6607 chars]","SALT LAKE CITY & BELLEVUE, Wash.--(BUSINESS WIRE)-- #GuardianXO --Sarcos Achieves Unprecedented Power Performance, Overcoming Major Obstacle to Commercial Deployment of Full-Body, Powered Industrial Exoskeletons",2018-11-28T14:23:51Z,"{'id': None, 'name': 'Businesswire.com'}","Sarcos Achieves Unprecedented Power Performance, Overcoming Major Obstacle to Commercial Deployment of Full-Body, Powered Industrial Exoskeletons",https://www.businesswire.com/news/home/20181128005214/en/Sarcos-Achieves-Unprecedented-Power-Performance-Overcoming-Major,https://mms.businesswire.com/media/20181128005214/en/692561/23/srcs_072718_perspective_front_1.jpg,653
516,"Sara Coughlin, written by Sara Coughlin",,"Anxiety looks different in every person who lives with it and every person has their own way of managing it. But, if you have a friend who has anxiety, it's natural to want to do something that shows you're there to help them. Luckily, there are a few items y…",2018-11-28T14:25:00Z,"{'id': None, 'name': 'Refinery29.com'}",The Most Soothing Gifts To Give Your Anxious Friend,https://www.refinery29.com/en-us/anxiety-stress-gifts,"https://s3.r29static.com//bin/entry/bdb/0,0,2000,1050/x,80/2063657/image.jpg",456
517,"Diana Hembree, Contributor, Diana Hembree, Contributor https://www.forbes.com/sites/dianahembree/","Share to facebook Share to twitter Share to linkedin Cheese Board pizza Cheese Board Collective After The Cheese Board Collective turned 50, it invited the whole town of Berkeley over for free pizza, baked goods, ice cream and of course cheese. The long-await… [+23740 chars]","The popular worker-owned Cheese Board Collective of Berkeley, California, has been doing business for 50 years. But its impact goes well beyond world-class cheese, bread and pizza.",2018-11-28T14:26:00Z,"{'id': None, 'name': 'Forbes.com'}",How a Modest Berkeley Collective Became the Country's #1 Pizzeria,https://www.forbes.com/sites/dianahembree/2018/11/28/how-a-modest-berkeley-collective-became-the-countrys-1-pizzeria/,https://thumbor.forbes.com/thumbor/600x315/https%3A%2F%2Fblogs-images.forbes.com%2Fdianahembree%2Ffiles%2F2018%2F11%2FIMG_4518-1200x900.jpg,605
518,Justin Kahn,"Best Games/Apps Deals The best games and apps deals across all platforms: iPhone, iPad, Mac, Android, PlayStation 4, Xbox One, Nintendo Switch, Wii U, 3DS","In today’s best game deals, Microsoft is now offering Live Gold members BioShock: The Collection for just $15. However, Newegg has it for the same price with or without the Live membership. Regularly $30 in physical form at Amazon and elsewhere, this is the b…",2018-11-28T14:29:11Z,"{'id': None, 'name': '9to5toys.com'}","Today’s Best Game Deals: BioShock Collection $15, Battlefield V $30, more",https://9to5toys.com/2018/11/28/best-game-deals-bioshock-battlefield/,https://9to5toys.com/wp-content/uploads/sites/5/2016/06/bioshock_collection-new-01.jpg?quality=82&strip=all,312
519,"Justin McQueen, Analyst, Justin McQueen","MARKET DEVELOPMENT – GBP Outperforms, Crude Oil Back on the Decline GBP : The Pound is notably outperforming this morning, gaining some 0.3% against the greenback. However, resistance at 1.28 has capped further upside in the pair. In regard to the latest repo… [+3409 chars]","The Pound is notably outperforming this morning, gaining some 0.3% against the greenback. CAD at lowest level since June amid weaker oil prices and wider bond spreads.",2018-11-28T14:30:00Z,"{'id': None, 'name': 'Dailyfx.com'}","CAD at 5-Month Lows, Crude Oil Back on the Decline - US Market Open",https://www.dailyfx.com/forex/fundamental/daily_briefing/daily_pieces/us_am_briefing/2018/11/28/CAD-at-5-Month-Lows-Crude-Oil-Back-on-the-Decline---US-Market-Open.html,,787
520,Kevin Knezevic,"Pokemon Ultra Sun and Ultra Moon launched for 3DS back in November, marking the mainline series' swan song on Nintendo's dual-screen handheld. As it did for the original Sun and Moon versions, The Pokemon Company is continuing to support the pair in the month… [+8733 chars]","Pokemon Ultra Sun and Ultra Moon launched for 3DS back in November, marking the mainline series' swan song on Nintendo's dual-screen handheld. As it did for the original Sun and Moon versions, The Pokemon Company is continuing to support the pair in the month…",2018-11-28T14:30:00Z,"{'id': None, 'name': 'Gamespot.com'}",Pokemon Ultra Sun And Moon: All Free Pokemon Available Right Now,https://www.gamespot.com/articles/pokemon-ultra-sun-and-moon-all-free-pokemon-availa/1100-6456217/,https://static.gamespot.com/uploads/screen_kubrick/1578/15787979/3342260-7586428033-33155.jpg,650
521,Rebecca Fishbein,"Much to my surprise and my roommates consternation, I have somehow managed to work from home for an entire year. There are a lot of upsides to leading a laissez-faire life of couch-writing. I never have to commute, which is a true blessing, considering how of… [+13639 chars]","Much to my surprise and my roommates’ consternation, I have somehow managed to work from home for an entire year. There are a lot of upsides to leading a laissez-faire life of couch-writing. I never have to commute, which is a true blessing, considering how o…",2018-11-28T14:30:00Z,"{'id': None, 'name': 'Lifehacker.com'}",How to Work From Home Without Falling Into a Pit of Despair,https://lifehacker.com/how-to-work-from-home-without-falling-into-a-pit-of-des-1830536117,"https://i.kinja-img.com/gawker-media/image/upload/s--VBLQGc9i--/c_fill,fl_progressive,g_center,h_900,q_80,w_1600/du7slimvo7x7exdcdpae.jpg",86
522,Nick Tabor,"Even in defeat, Beto ORourke did a big favor to fellow Democrats all over Texas. A couple hundred thousand young people who might otherwise have skipped the election turned out to vote for the charismatic young liberal, and when they did, they also voted for … [+11777 chars]","Lina Hidalgo was elected to run a county with a $5 billion dollar budget, thanks to Beto and straight-ticket voting. And she has a plan.",2018-11-28T14:30:07Z,"{'id': 'new-york-magazine', 'name': 'New York Magazine'}",Can a 27-Year-Old Political Neophyte Run the Third-Largest County in America?,http://nymag.com/intelligencer/2018/11/can-a-27-year-old-neophyte-run-the-largest-county-in-texas.html?utm_source=feedburner&utm_medium=feed&utm_campaign=Feed%3A+nymag%2Fintelligencer+%28Daily+Intelligencer+-+New+York+Magazine%29,https://pixel.nymag.com/imgs/daily/intelligencer/2018/11/27/27-lina-hidalgo.w1200.h630.jpg,722
523,Robert-Jan Broer,"Exactly 10 years ago, in 2008, Glashütte Original introduced their PanoInverse XL watches. As you probably know, Glashütte Original is located in the watchmaking capital of Germany with the same name; Glashütte. This village, near Dresden, hosts a number of w… [+7363 chars]","Exactly 10 years ago, in 2008, Glashütte Original introduced their PanoInverse XL watches. As you probably know, Glashütte Original is located in the watchmaking capital of Germany with the same name; Glashütte. This village, near Dresden, hosts a number of w…",2018-11-28T14:30:16Z,"{'id': None, 'name': 'Fratellowatches.com'}",10 Years Of Glashütte Original’s PanoInverse – We Take A Look (Video Included),https://www.fratellowatches.com/glashutte-original-panoinverse/,https://production-fratellowatches.netdna-ssl.com/wp-content/uploads/2018/11/Glashutte-Original-PanoInverse.010.jpg,256
524,Mike,"(Sean M. Haffey/Getty) The 2018-19 free agent class has the potential to change the landscape of baseball. In Manny Machado and Bryce Harper, there are two 26-year-old mega-talents available for nothing but cash (and, in Harper’s case, a draft pick and intern… [+21782 chars]","The 2018-19 free agent class has the potential to change the landscape of baseball. In Manny Machado and Bryce Harper, there are two 26-year-old mega-talents available for nothing but cash (and, in Harper’s case, a draft pick and international bonus money), a…",2018-11-28T14:30:43Z,"{'id': None, 'name': 'Riveraveblues.com'}",Scouting the Free Agent Market: Manny Machado,http://riveraveblues.com/2018/11/scouting-free-agent-market-manny-machado-181361/,http://cdn.riveraveblues.com/wp-content/uploads/2018/11/Manny-Machado1-min.jpg,885
525,Niloofer Shaikh,"Dow +0.57% to 24,890.63. S&amp;P +0.45% to 2,694.37. Nasdaq +0.77% to 7,136.93. Treasurys: 30-year -0.06%. 10-yr -0.03%. 5-yr -0.02%. Commodities: Crude -0.78% to $51.16. Gold -0.08% to $1,218.90. Currencies: Euro -0.07% vs. dollar. Yen +0.1%. Pound -0.25%.","Dow +0.57% to 24,890.63. S&amp;P +0.45% to 2,694.37. Nasdaq +0.77% to 7,136.93. Treasurys: 30-year -0.06%. 10-yr -0.03%. 5-yr -0.02%. Commodities: Crude -0.78% to $51.16. Gold -0.08% to $1,218.90. Cu",2018-11-28T14:31:16Z,"{'id': None, 'name': 'Seekingalpha.com'}",At the open (11/28/2018),https://seekingalpha.com/news/3412787-open-11-28-2018,https://static3.seekingalpha.com/assets/og_image_192-59bfd51c9fe6af025b2f9f96c807e46f8e2f06c5ae787b15bf1423e6c676d4db.png,286
