,author,content,description,publishedAt,source,title,url,urlToImage,relevancy
508,"Jenna Milliner-Waddell, Contributor, Jenna Milliner-Waddell, Contributor https://www.forbes.com/sites/forbes-finds/people/millinerwaddellj/","Redesign your living room with this seasons hottest home decor selections all for a great price. Between Zara Homes Mid Season Sale, to West Elms price slashing on furniture and Crate and Barrels Get Cozy Sale theyve got everything you need to upgrade your li… [+11702 chars]","From stylish and functional coffee tables to chic accent tables, and comfy poufs and ottomans, you can instantly transform your space with just a few pieces that all happen to be on sale right now. Don’t waste any time and shop these savings today.",2018-11-08T15:00:00Z,"{'id': None, 'name': 'Forbes.com'}",Pre-Black Friday Deals To Help Decorate Your Living Room,https://www.forbes.com/sites/forbes-finds/2018/11/08/pre-black-friday-deals-to-help-decorate-your-living-room/,https://thumbor.forbes.com/thumbor/600x315/https%3A%2F%2Fblogs-images.forbes.com%2Fforbes-finds%2Ffiles%2F2018%2F11%2FWest-Elm-Mid-Century-Pop-Up-Storage-Coffee-Table.jpg,133
509,Robert Lloyd,"Earlier this year, I received an email that contained a link, which led me to a beautiful short film called the “The Passage,” which led me to the Lyric Hyperion Theatre in Silver Lake and the professional doorstep of Philip Burgers, aka Dr. Brown, teacher an… [+12268 chars]","Earlier this year, I received an email that contained a link, which led me to a beautiful short film called the “The Passage,” which led me to the Lyric Hyperion Theatre in Silver Lake and the professional doorstep of Philip Burgers, aka Dr. Brown, teacher an…",2018-11-08T15:00:00Z,"{'id': None, 'name': 'Latimes.com'}",Nomad by nature: Phil Burgers' Dr. Brown is not just clowning around,http://www.latimes.com/entertainment/tv/la-et-cm-phil-burgers-dr-brown-lyric-hyperion-20181108-story.html,https://www.latimes.com/resizer/qQxbAva-CDXQRr6NMd9VxJWWpvo=/1200x0/arc-anglerfish-arc2-prod-tronc.s3.amazonaws.com/public/S564VB4XIBEITIDIUE2FVLOG4Q.jpg,438
510,Eliza Thompson,"Despite all the zombie and witch theories making the rounds online, Riverdale has thus far remained a completely non-supernatural show. But even though the problems afflicting the town aren't paranormal, the dialogue occasionally veers into the realm of the s… [+8715 chars]","What, pray tell, is jingle jangle?",2018-11-08T15:00:00Z,"{'id': None, 'name': 'Cosmopolitan.com'}",A Complete Glossary of Every Important 'Riverdale' Term,https://www.cosmopolitan.com/entertainment/tv/a13029478/riverdale-glossary/,"https://hips.hearstapps.com/hmg-prod.s3.amazonaws.com/images/riverdale-glossary-1508178993.png?crop=1.00xw:1.00xh;0,0&resize=1200:*",633
511,Evolution Communications Agency,"LITTLETON, Colo., Nov. 8, 2018 /PRNewswire/ -- On Nov. 2, The Colorado Healthcare Communicators honored Evolution Communications Agency, LLC, at its annual Gold Leaf Awards, selecting two of the firm's successful 2017 media campaigns for recognition. Evolutio… [+2457 chars]","LITTLETON, Colo., Nov. 8, 2018 /PRNewswire/ -- On Nov. 2, The Colorado Healthcare Communicators honored Evolution Communications Agency, LLC, at its annual Gold Leaf Awards, selecting two of the firm's successful 2017 media campaigns for recognition. Evolutio…",2018-11-08T15:00:00Z,"{'id': None, 'name': 'Prnewswire.com'}",Evolution Communications Agency Honored by Colorado Healthcare Communicators' Gold Leaf Awards,https://www.prnewswire.com/news-releases/evolution-communications-agency-honored-by-colorado-healthcare-communicators-gold-leaf-awards-300746179.html,/content/dam/prnewswire/common/prn_facebook_sharing_logo.jpg,663
512,Buckle Me Baby Coats,"LONDONDERRY, N.H., Nov. 8, 2018 /PRNewswire/ -- Buckle Me Baby Coats is pleased to announce that they have been named a Gold Seal recipient of the Moms Choice Award for their innovative car seat safety coats. Buckle Me Baby Coats is currently available on Ama… [+1740 chars]","LONDONDERRY, N.H., Nov. 8, 2018 /PRNewswire/ -- Buckle Me Baby Coats is pleased to announce that they have been named a Gold Seal recipient of the Moms Choice Award for their innovative car seat safety coats. Buckle Me Baby Coats is currently available on Ama…",2018-11-08T15:00:00Z,"{'id': None, 'name': 'Prnewswire.com'}","Buckle Me Baby Coats, a Mompreneur Startup, Ends Winter Coat Danger For Parents",https://www.prnewswire.com/news-releases/buckle-me-baby-coats-a-mompreneur-startup-ends-winter-coat-danger-for-parents-300746163.html,/content/dam/prnewswire/common/prn_facebook_sharing_logo.jpg,684
513,nintendaan,,Battlezone Gold Edition - more Switch footage,2018-11-08T15:00:00Z,"{'id': None, 'name': 'Gonintendo.com'}",Battlezone Gold Edition - more Switch footage,https://gonintendo.com/stories/322254-battlezone-gold-edition-more-switch-footage,https://gonintendo.com/system/stories/promo_images/000/322/254/original/H2x1_NSwitchDS_BattlezoneGoldEdition_image1600w.jpg?1541690061,173
514,EQ Office,"CHICAGO, Nov. 8, 2018 /PRNewswire/ -- Willis Tower, owned and managed by EQ Office, the portfolio company wholly owned by Blackstone's real estate funds, is proud to announce that it has earned the Leadership in Energy and Environmental Design (LEED) Gold fro… [+7379 chars]","CHICAGO, Nov. 8, 2018 /PRNewswire/ -- Willis Tower, owned and managed by EQ Office, the portfolio company wholly owned by Blackstone's real estate funds, is proud to announce that it has earned the Leadership in Energy and Environmental Design (LEED) Gold fro…",2018-11-08T15:00:00Z,"{'id': None, 'name': 'Prnewswire.com'}",Willis Tower Receives LEED Certification for Sustainability Achievements,https://www.prnewswire.com/news-releases/willis-tower-receives-leed-certification-for-sustainability-achievements-300744211.html,https://mma.prnewswire.com/media/779972/EQ_Office_Logo.jpg?p=facebook,851
515,Dan Buffa,"Calm down before you blast me for the title. Today isn’t ginger-haired former player day, but I want to have some fun, because everyone is getting so serious due to the Blues’ 5-5-3 start and the election on Tuesday. No, I am not a St. Louis Blues Lounge trad… [+2842 chars]","Calm down before you blast me for the title. Today isn’t ginger-haired former player day, but I want to have some fun, because everyone is getting so serious due to the Blues’ 5-5-3 start and the...",2018-11-08T15:00:04Z,"{'id': None, 'name': 'Stlouisgametime.com'}",In a world...where Steve Ott is head coach of the St. Louis Blues,https://www.stlouisgametime.com/2018/11/8/18074664/in-a-world-where-steve-ott-is-head-coach-of-the-st-louis-blues,https://cdn.vox-cdn.com/thumbor/wADEdKXiKOzENeFtI0fGFRRzbjk=/0x371:5184x3085/fit-in/1200x630/cdn.vox-cdn.com/uploads/chorus_asset/file/13408109/499442358.jpg.jpg,852
516,James Drury,"Get the warriors together for a Big Night Out in London. Fancy dress optional. Photo: Sara Melhuish So you're organising a stag do? Forget ideas of heading abroad to eastern Europe, London is the best place to organise a pre-wedding event the groom and most i… [+6477 chars]",Lads lads lads. In London.,2018-11-08T15:00:06Z,"{'id': None, 'name': 'Londonist.com'}",Have The Ultimate Stag Do In London,https://londonist.com/london/things-to-do/have-the-ultimate-best-stag-do-in-london-quirky-sporty-booze-food-ideas-inspiration,https://assets.londonist.com/uploads/2018/11/i875/31886388522_921b7c2588_k.jpg,531
517,"Nashville Tennessean, Mike Organ, Nashville Tennessean","Players, parents and coaches protested the closing of A-Game Sportsplex in a parking lot at the Cool Springs Galleria before marching to A-Game. Franklin Sports Hall (Photo: Franklin Sports Hall) A-Game Sportsplex is back in business. The once-thriving 174,00… [+10616 chars]",The Franklin facility is back in business,2018-11-08T15:00:08Z,"{'id': None, 'name': 'Tennessean.com'}",A-Game Sportsplex is making a comeback as Franklin Sports Hall,https://www.tennessean.com/story/sports/2018/11/08/agame-sportsplex-franklin-sports-hall-mookie-betts/1902018002/?utm_source=google&utm_medium=amp&utm_campaign=speakable,"https://www.gannett-cdn.com/presto/2018/11/07/PNAS/be468565-5534-4005-a5a5-3b2d11fcb39f-franklin_hall.jpg?crop=1798,1011,x0,y0&width=3200&height=1680&fit=bounds",887
518,Hedgeye,If youre looking for a practical How To guide on using our Macro teams investment research covering everything from position sizing to balancing a portfolio of longs and shorts this one is for you. Below are some key takeaways from the recent webcast hosted b… [+8411 chars],Below are some key takeaways from a recent webcast hosted by CEO Keith McCullough and Senior Macro analyst Darius Dale. We think the U.S. economy slows in the f,2018-11-08T15:01:17Z,"{'id': None, 'name': 'Seekingalpha.com'}",The 2 Biggest Risks To Your Portfolio (Webcast),https://seekingalpha.com/article/4219812-2-biggest-risks-portfolio-webcast,https://static1.seekingalpha.com/uploads/2018/11/7/18346232-15415960006197963.png,538
519,"SCMP Reporter, SCMP Reporter","The South China Morning Post collected five prizes two gold, one silver and two bronze in three categories at the Asian Digital Media Awards in Hong Kong on Thursday. The newspaper bagged gold awards in the Best Digital News Start-up category, for its new pla… [+3160 chars]","The South China Morning Post collected five prizes – two gold, one silver and two bronze – in three categories at the Asian Digital Media Awards in Hong Kong on Thursday. The newspaper bagged gold awards in the Best Digital News Start-up category, for its new…",2018-11-08T15:01:42Z,"{'id': None, 'name': 'Scmp.com'}",Post takes home five prizes at Asian Digital Media Awards,https://www.scmp.com/news/hong-kong/society/article/2172377/post-takes-home-five-prizes-asian-digital-media-awards,https://cdn4.i-scmp.com/sites/default/files/styles/620x356/public/images/methode/2018/11/08/5e5cd5c0-e34a-11e8-9876-950c8650801f_image_hires_230136.JPG?itok=1pTr_l2u,240
520,Glenn Kenny,"I’m not one of those reviewers who likes a particular type of Coen Brothers movie more than another. As much as I revered the filmmakers’ knotty, relatively somber “ Inside Llewyn Davis,” I didn’t sit through “Hail Caesar” grumbling that I’d have preferred a … [+5822 chars]",What’s most bewitching throughout Scruggs is its sense of detail. Its meshing of formal discipline and screwed-down content sometimes give it the sense of a work that has been carefully and elaborately embroidered rather than photographed.,2018-11-08T15:02:48Z,"{'id': None, 'name': 'Rogerebert.com'}",The Ballad of Buster Scruggs,https://www.rogerebert.com/reviews/the-ballad-of-buster-scruggs-2018,https://static.rogerebert.com/uploads/review/primary_image/reviews/the-ballad-of-buster-scruggs-2018/homepage_buster-scruggs-2018.jpeg,967
521,ValueWalk,"Original Post Global Allocation Fund commentary for the month ended October 31, 2018 discussing safe investments during a market turmoil. October has been a carnage specially for equity markets. The starting point has been an acceleration in the ongoing proce… [+3706 chars]","Original Post Global Allocation Fund commentary for the month ended October 31, 2018 discussing safe investments during a market turmoil. October has been a car",2018-11-08T15:03:36Z,"{'id': None, 'name': 'Seekingalpha.com'}",Global Allocation October 2018 Letter - Safe Havens During A Market Turmoil,https://seekingalpha.com/article/4219815-global-allocation-october-2018-letter-safe-havens-market-turmoil,https://static.seekingalpha.com/uploads/2018/11/8/saupload_Global-Allocation-Fund-October-2018-1.jpg,369
522,,"Credit: Wake Forest University Small-scale gold mining has destroyed more than 170,000 acres of primary rainforest in the Peruvian Amazon in the past five years, according to a new analysis by scientists at Wake Forest University's Center for Amazonian Scient… [+3481 chars]","Small-scale gold mining has destroyed more than 170,000 acres of primary rainforest in the Peruvian Amazon in the past five years, according to a new analysis by scientists at Wake Forest University's Center for Amazonian Scientific Innovation (CINCIA).",2018-11-08T15:05:55Z,"{'id': None, 'name': 'Phys.org'}",Rainforest destruction from gold mining hits all-time high in Peru,https://phys.org/news/2018-11-rainforest-destruction-gold-all-time-high.html,https://3c1703fe8d.site.internapcdn.net/newman/gfx/news/2018/rainforestde.jpg,19
523,News and Review,"Skip to comments. The State of Jeffersons plan for a California divided News and Review ^ | Nov 8 2018 | News and Review Posted on 11/08/2018 7:06:42 AM PST by rintintin Jefferson separatist movement split off into a new, 51st state? Almost anywhere you drive… [+2971 chars]","Jefferson separatist movement split off into a new, 51st state? Almost anywhere you drive through Northern California, youll see green and gold signs, flags and banners heralding the arrival of the State of Jefferson, a separatist movement that nearly succee…",2018-11-08T15:06:42Z,"{'id': None, 'name': 'Freerepublic.com'}",The State of Jeffersons plan for a California divided,https://www.freerepublic.com/focus/f-news/3704016/posts,,570
524,John Hopewell,"Ema Edosio would be the first to admit she didn’t know what she was getting into when she decided to make her first feature film. “I had no idea how I was going to raise the money. I had no idea what the distribution strategy was going to be,” she said. “I ju… [+3421 chars]","Ema Edosio would be the first to admit she didn’t know what she was getting into when she decided to make her first feature film. “I had no idea how I was going to raise the money. I had no idea what the distribution strategy was going to be,” she said. “I ju…",2018-11-08T15:11:40Z,"{'id': None, 'name': 'Variety.com'}",Nigeria: Indie Helmers Left Behind by B.O. Boom,https://variety.com/2018/film/festivals/nigeria-indie-helmers-left-behind-b-o-boom-1203023108/,https://pmcvariety.files.wordpress.com/2018/11/the-delivery-boy-stills-father_.jpg?w=700&h=393&crop=1,143
525,Associated Press,"Welcome to the PHT Morning Skate, a collection of links from around the hockey world. Have a link you want to submit? Email us at phtblog@nbcsports.com. The Remembrance Day jerseys that the ECHL’s Brampton Beast will wear this Sunday are phenomenal. The Washi… [+2440 chars]",The U.S. is seeking its fourth straight title in the event.,2018-11-08T15:15:20Z,"{'id': None, 'name': 'Nbcsports.com'}",Brodt lifts US women past Canada in 4 Nations,https://nhl.nbcsports.com/2018/11/08/brodt-lifts-us-women-past-canada-in-4-nations/,https://nbcprohockeytalk.files.wordpress.com/2018/11/ap_18312076212658-e1541683297831.jpg?w=1200,677
526,Eric Song,"Black Friday 2018 is less than 1 month away so we've got the scoop on the best deals you can expect to see from Amazon, Walmart, Best Buy and more. Want more deals? Join the IGN Deals Newsletter. By Eric Song and IGN Staff Welcome to IGN's Daily Deals, your s… [+10614 chars]","Black Friday 2018 is less than 1 month away so we've got the scoop on the best deals you can expect to see from Amazon, Walmart, Best Buy and more.",2018-11-08T15:15:38Z,"{'id': 'ign', 'name': 'IGN'}",Black Friday 2018 Deals - What To Expect,https://ca.ign.com/articles/2018/11/08/black-friday-2018-what-to-expect,https://assets1.ignimgs.com/2018/10/24/black-friday-deals-1540411805773_1280w.jpg,329
527,Sputnik,"Earlier, Caracas indicated that it was looking to repatriate some 14 tons of gold bars back from the UK out of concern that the bullion may be affected by harsh US sanctions against the Latin American country. The Bank of England is refusing to release Venezu… [+2372 chars]","Earlier, Caracas indicated that it was looking to repatriate some 14 tons of gold bars back from the UK out of concern that the bullion may be affected by harsh US sanctions against the Latin American country. The Bank of … The post Bank of England Refuses Ve…",2018-11-08T15:18:03Z,"{'id': None, 'name': 'Globalresearch.ca'}",Bank of England Refuses Venezuela’s Request to Return $550 Million In Gold – Report,https://www.globalresearch.ca/bank-of-england-refuses-venezuelas-request-to-return-550-million-in-gold-report/5659271,https://www.globalresearch.ca/wp-content/uploads/2018/06/gold.png,103
528,Reuters Editorial,"Nov 8 (Reuters) - Canada’s main stock index remained flat on Thursday, as robust earnings by a handful of companies helped offset losses in energy shares. * At 9:40 a.m. ET (1440 GMT), the Toronto Stock Exchange’s S&amp;P/TSX Composite index was up 8.46 point… [+2125 chars]","Canada's main stock index remained flat on Thursday, as robust earnings by a handful of companies helped offset losses in energy shares.",2018-11-08T15:20:04Z,"{'id': 'reuters', 'name': 'Reuters'}",CANADA STOCKS-TSX flat as strong earnings help curb losses in energy stocks,https://www.reuters.com/article/canada-stocks-idUSL4N1XJ5FJ,https://s4.reutersmedia.net/resources_v2/images/rcom-default.png,657
529,https://www.dailymail.co.uk/home/search.html?s=&authornamef=Reuters,"Nov 8 (Reuters) - Canada's main stock index remained flat on Thursday, as robust earnings by a handful of companies helped offset losses in energy shares. * At 9:40 a.m. ET (1440 GMT), the Toronto Stock Exchange's S&amp;amp;P/TSX Composite index was up 8.46 p… [+2192 chars]","Nov 8 (Reuters) - Canada's main stock index remained flat on  Thursday, as robust earnings by a handful of companies helped  offset losses in energy shares.*...",2018-11-08T15:23:52Z,"{'id': 'daily-mail', 'name': 'Daily Mail'}",CANADA STOCKS-TSX flat as strong earnings help curb...,https://www.dailymail.co.uk/wires/reuters/article-6368099/CANADA-STOCKS-TSX-flat-strong-earnings-help-curb-losses-energy-stocks.html,https://i.dailymail.co.uk/i/pix/m_logo_636x382px.png,762
530,,,"The Food and Drug Administration is advising consumers not to purchase or use Gold Max Blue, a product promoted and sold for sexual enhancement on various websites, including www.goldmaxblue.com, and possibly in some retail stores.",2018-11-08T15:26:00Z,"{'id': None, 'name': 'Fda.gov'}",Public Notification: Gold Max Blue contains hidden drug ingredient,https://www.fda.gov/Drugs/ResourcesForYou/Consumers/BuyingUsingMedicineSafely/MedicationHealthFraud/ucm625365.htm,,648
531,Damien Wilde,"Xiaomi might have made waves in the Far East, but until now they haven’t officially been available in many Western nations. At the official UK launch of the brand, Xiaomi announced the global release of the powerhouse Xiaomi Mi 8 Pro and that it will be avail… [+2639 chars]","Xiaomi might have made waves in the Far East, but until now they haven’t officially been available in many Western nations. At the official UK launch of the brand, Xiaomi announced the global release of the powerhouse Xiaomi Mi 8 Pro and that it will be avail…",2018-11-08T15:26:01Z,"{'id': None, 'name': '9to5google.com'}","Xiaomi Mi 8 Pro goes official in UK for £499 w/ in-display fingerprint reader, Snapdragon 845",https://9to5google.com/2018/11/08/xiaomi-mi-8-pro-official-price-specs/,https://9to5google.com/wp-content/uploads/sites/4/2018/11/xiaomi_mi_8_pro.jpg?quality=82&strip=all&w=1200,224
532,,"BreachExchange mailing list archives HSBC now stands for Hapless Security, Became Compromised: Thousands of customer files snatched by crims From : Destry Winant &lt;destry () riskbasedsecurity com&gt; Date : Wed, 7 Nov 2018 04:11:28 -0600 https://www.theregi… [+3513 chars]",Posted by Destry Winant on Nov 08 https://www.theregister.co.uk/2018/11/06/hsbc_security_broken/ HSBC has admitted miscreants have probably made off with personal details of thousands of its online-banking customers. The bank submitted paperwork [PDF] to the …,2018-11-08T15:26:53Z,"{'id': None, 'name': 'Seclists.org'}","HSBC now stands for Hapless Security, Became Compromised: Thousands of customer files snatched by crims",https://seclists.org/dataloss/2018/q4/125,http://seclists.org/images/dataloss-img.png,918
533,1 EDI Source,"The partner network is focused on providing each client with the highest degree of integration services and software satisfaction and is designed to help partners grow their business. Partners in the program receive access to sales support, marketing, trainin… [+1911 chars]","SOLON, Ohio, Nov. 8, 2018 /PRNewswire/ -- 1 EDI Source has announced a new partner program and is quickly building a network of EDI, VAR, and ERP referral, reseller, cloud hosting and integration partners. With nearly 30 years as a B2B integration innovator a…",2018-11-08T15:27:00Z,"{'id': None, 'name': 'Prnewswire.com'}",1 EDI Source Launches New Partner Program,https://www.prnewswire.com/news-releases/1-edi-source-launches-new-partner-program-300746741.html,https://mma.prnewswire.com/media/586789/1EDISource_Logo.jpg?p=facebook,747
534,Press Trust of India,India’s teenage shooting sensation Saurabh Chaudhary continued his incredible run by claiming his fourth individual gold medal in as many months with a top finish in the 10m air pistol junior men’s event of the Asian Airgun Championship in Kuwait City on Thur… [+1355 chars],Hindustan Times Saurabh Chaudhary claims gold at Asian Airgun Championships Hindustan Times India's teenage shooting sensation Saurabh Chaudhary continued his incredible run by claiming his fourth individual gold medal in as many months with a top finish in t…,2018-11-08T15:27:00Z,"{'id': None, 'name': 'Hindustantimes.com'}",Saurabh Chaudhary claims gold at Asian Airgun Championships - Hindustan Times,https://www.hindustantimes.com/other-sports/saurabh-chaudhary-claims-gold-at-asian-airgun-championships/story-Y8rpcDQPHS7JKBzsp6TljL.html,https://www.hindustantimes.com/rf/image_size_960x540/HT/p2/2018/11/08/Pictures/asiad-2018-shooting_b713603e-e369-11e8-a684-a3b63261dee4.jpg,125
535,Courtney Gisriel,"Get Stuff We Love Subscribe to our newsletter. SUBSCRIBE Nov. 8, 2018 / 3:29 PM GMT / Source: TODAY Every week, Kathie Lee and Hoda share some of their favorite things with viewers, but we can never get enough. That's why we're thrilled to share a list of 13 … [+3283 chars]","Kathie Lee and Hoda share their favorite things every week, here are some of our favorite things that they've shared with us.",2018-11-08T15:29:00Z,"{'id': None, 'name': 'Today.com'}",13 of Kathie Lee and Hoda's favorite things for the holiday season,https://www.today.com/style/13-kathie-lee-hoda-s-favorite-things-holiday-season-t141577,https://media3.s-nbcnews.com/j/MSNBC/Components/Video/201811/tdy_style_klg_bobbie_favoritethings_181108_1920x1080.1200;630;7;70;2.jpg,645
536,Tess Wilson,"IKEA hacks are always fun, but this one resulted in a piece that looks more like a high-end mid-century modern credenza that would cost at least 10 times more than it actually did. This BESTÅ is about to truly live its best life. First, a little bit about how… [+2456 chars]","IKEA hacks are always fun, but this one resulted in a piece that looks more like a high-end mid-century modern credenza that would cost at least 10 times more than it actually did. This BESTÅ is about to truly live its best life. READ MORE »",2018-11-08T15:30:00Z,"{'id': None, 'name': 'Apartmenttherapy.com'}",Before and After: The Best IKEA BESTÅ Hack We've Seen in Ages,https://www.apartmenttherapy.com/ikea-besta-mid-century-modern-credenza-hack-photos-264140,"https://cdn.apartmenttherapy.info/image/fetch/q_60,w_1024,c_fit/https://s3.amazonaws.com/pixtruder/original_images/01fe829bf2d31a52199089b5383eb860015abd13",655
537,Rusty Blazenhoff,"It’s Columbus Day: a holiday slapped together to celebrate a raping, murdering, plunder-horny opportunist that’s been dead for hundreds of years. Columbus, Ohio? It was named after the gold loving bastard. Despite this, for the first time since the city’s fou… [+1626 chars]",Put some floating disembodied heads on your gift wrap this year with Gift Wrap My Face. They will make you wrapping paper custom made with your face on it... or someone else's. Here's what Abraham Lincoln looks like on some Christmas paper: And here's what I …,2018-11-08T15:30:09Z,"{'id': None, 'name': 'Boingboing.net'}",Custom gift wrap that has your (or someone else's) face on it,https://boingboing.net/2018/11/08/custom-gift-wrap-that-has-your.html,https://media.boingboing.net/wp-content/uploads/2018/11/Screen-Shot-2018-11-07-at-12.28.55-PM.png,10
538,Carlos Sagan,"""I don't think we can control what God controls."" Do you know who said that? This pendejo, hijo de puta : Ah, Texas GOP Rep. Lamar Smith, who has chaired the House Committee on Science, Space and Technology since 2013. You know, the one that oversees little a… [+4350 chars]","""I don't think we can control what God controls."" Do you know who said that? This pendejo, hijo de puta : Ah, Texas GOP Rep. Lamar Smith, who has chaired the House Committee on Science, Space and Technology since 2013. You know, the one that oversees little a…",2018-11-08T15:30:10Z,"{'id': None, 'name': 'Wonkette.com'}",House Science Committee Actually Gonna Do Some Science Now!,https://www.wonkette.com/im-shocked-shocked-to-find-that-science-will-be-going-on-in-the-house-committee-on-science-space-and-technology,https://wonkette-img.rbl.ms/simage/https%3A%2F%2Fassets.rbl.ms%2F18813133%2F1200x600.jpg/2000%2C2000/cczVJ9Dvt0vaFmZl/img.jpg,545
