,author,content,description,publishedAt,source,title,url,urlToImage,relevancy
0,"Anasuya Sengupta, Siko Bouterse, Kira Allmann","Left to right: Anasuya Sengupta, Siko Bouterse and Kira Allmann. Credits: Jasanpictures/CC BY-SA 4.0; Matthew Roth/CC BY-SA 3.0 In 2014, Grace Banu joined Sri Krishna College of Engineering and Technology in Sugunapuram, India, to study electrical engineering… [+9008 chars]","If the digital revolution is to democratize knowledge, it must include the voices of marginalized communities, say Anasuya Sengupta, Siko Bouterse and Kira Allmann.",2018-11-28T00:00:00Z,"{'id': None, 'name': 'Nature.com'}","Build an internet for, and from, us all",https://www.nature.com/articles/d41586-018-07506-7?utm_source=feedburner&utm_medium=feed&utm_campaign=Feed%3A+nature%2Frss%2Fcurrent+%28Nature+-+Issue%29,https://media.nature.com/lw1024/magazine-assets/d41586-018-07506-7/d41586-018-07506-7_16290002.jpg,128
1,"Hans Vanrompay, eva bladt, Wiebke Albrecht, Armand Béché, Marina Zakhozheva, Ana Sánchez-Iglesias, Luis M. Liz-Marzan, Sara Bals",If you are not the author of this article and you wish to reproduce material from it in a third party non-RSC publication you must formally request permission using Copyright Clearance Center. Go to our Instructions for using Copyright Clearance Center page f… [+2546 chars],"Nanoscale, 2018, Accepted Manuscript DOI : 10.1039/C8NR08376B, Paper Hans Vanrompay, eva bladt, Wiebke Albrecht, Armand Béché, Marina Zakhozheva, Ana Sánchez-Iglesias, Luis M. Liz-Marzan, Sara Bals A thorough understanding of the thermal stability and potenti…",2018-11-28T00:00:00Z,"{'id': None, 'name': 'Rsc.org'}",3D characterization of heat-induced morphological changes of Au nanostars by fast in-situ electron tomography,https://pubs.rsc.org/en/content/articlelanding/2018/nr/c8nr08376b,,309
2,,"- Let's take a look at a specific exploit. We're going to look at cross-site scripting, how we would actually carry something like this out, so we're going to go back into our lab, and we're going to be carrying out the attack from Kali Linux, and we'll be at… [+5588 chars]",CompTIA PenTest+ is the gold standard for professional penetration testers. The CompTIA PenTest+ (PT0-001) training series helps you prepare for the exam and refresh your knowledge on key objectives. This course explores attack methods for exploiting system v…,2018-11-28T00:00:00Z,"{'id': None, 'name': 'Linkedin.com'}",CompTIA PenTest+ (PT0-001): 4 Select Your Attacks (II),https://www.linkedin.com/learning/comptia-pentest-plus-pt0-001-4-select-your-attacks-ii,https://cdn.lynda.com/courses/789018-636789949776327686_338x600_thumb.jpg,396
3,"Bowen Zhu, Shu Gong, Wenlong Cheng",If you are not the author of this article and you wish to reproduce material from it in a third party non-RSC publication you must formally request permission using Copyright Clearance Center. Go to our Instructions for using Copyright Clearance Center page f… [+2546 chars],"Chem. Soc. Rev., 2019, Advance Article DOI : 10.1039/C8CS00609A, Review Article Bowen Zhu, Shu Gong, Wenlong Cheng This review covers the latest research progress of “softening” gold materials for various applications in elastronics. To cite this article befo…",2018-11-28T00:00:00Z,"{'id': None, 'name': 'Rsc.org'}",Softening gold for elastronics,https://pubs.rsc.org/en/content/articlelanding/2019/cs/c8cs00609a,,66
4,"Anasuya Sengupta, Siko Bouterse, Kira Allmann","Left to right: Anasuya Sengupta, Siko Bouterse and Kira Allmann. Credits: Jasanpictures/CC BY-SA 4.0; Matthew Roth/CC BY-SA 3.0 In 2014, Grace Banu joined Sri Krishna College of Engineering and Technology in Sugunapuram, India, to study electrical engineering… [+9008 chars]","If the digital revolution is to democratize knowledge, it must include the voices of marginalized communities, say Anasuya Sengupta, Siko Bouterse and Kira Allmann.",2018-11-28T00:00:00Z,"{'id': None, 'name': 'Nature.com'}","Build an internet for, and from, us all",https://www.nature.com/articles/d41586-018-07506-7,https://media.nature.com/lw1024/magazine-assets/d41586-018-07506-7/d41586-018-07506-7_16290002.jpg,131
5,,"- The Bash scripting environment is the first environment we're going to explore. If you do anything with any type of Linux environment, you're going to run into the Bash shell and likely run into the Bash scripts at some point. You see 'em all over the place… [+13796 chars]","Learn to use and analyze basic pen-testing scripts, while you study for the CompTIA PenTest+ certification exam—the gold standard for professional penetration testers. Scripting is an invaluable tool for pen testers, making their work repeatable, faster, and …",2018-11-28T00:00:00Z,"{'id': None, 'name': 'Linkedin.com'}",CompTIA PenTest+ (PT0-001): 6 Using Scripting in Pen Testing,https://www.linkedin.com/learning/comptia-pentest-plus-pt0-001-6-using-scripting-in-pen-testing,https://cdn.lynda.com/courses/789020-636789952880607348_338x600_thumb.jpg,392
6,"Arno Verlee, Thomas Heugebaert, Tom Van Der Meer, Pavel Kerchev, Frank Van Breusegem, Christian V. Stevens",If you are not the author of this article and you wish to reproduce material from it in a third party non-RSC publication you must formally request permission using Copyright Clearance Center. Go to our Instructions for using Copyright Clearance Center page f… [+2546 chars],"Org. Biomol. Chem., 2018, Accepted Manuscript DOI : 10.1039/C8OB02807A, Communication Arno Verlee, Thomas Heugebaert, Tom Van Der Meer, Pavel Kerchev, Frank Van Breusegem, Christian V. Stevens Pyrazoles are important heterocyclic compounds with a broad range …",2018-11-28T00:00:00Z,"{'id': None, 'name': 'Rsc.org'}","Domino reaction of a gold catalyzed 5-endo-dig cyclization and a [3,3]-sigmatropic rearrangement towards polysubstituted pyrazoles",https://pubs.rsc.org/en/content/articlelanding/2018/ob/c8ob02807a,,361
7,Elly Parsons,"‘When we are developing a perfume, I can just tell Maman: this smells too much of grandma’s soap in the kitchen, and she will know exactly what smell I am referring to. It also helps that my grandma has been buying the same products for 50 years…’. So muses B… [+3424 chars]","‘When we are developing a perfume, I can just tell Maman: this smells too much of grandma’s soap in the kitchen, and she will know exactly what smell I am referring to. It also helps that my grandma has been buying the same products for 50 years…’. So muses B…",2018-11-28T00:00:00Z,"{'id': None, 'name': 'Wallpaper.com'}",New French fragrance maison Ormaie references modernist design greats,https://www.wallpaper.com/lifestyle/ormaie-fragrance-launch,https://cdn.wallpaper.com/main/styles/fp_1540x944/s3/2018/11/00_ormaie16.jpg,410
8,,"The Super Smash Bros.™ Ultimate game for the Nintendo Switch ™ system is set to come out swinging on Dec. 7 with a huge roster of fighters, stages, items, and modes. Make sure you’re ready to play as soon as it’s released by pre-purchasing the digital version… [+1768 chars]","The Super Smash Bros. Ultimate game for the Nintendo Switch system is set to come out swinging on Dec. 7 with a huge roster of fighters, stages, items, and modes.  Make sure you're ready to play as soon as it's released by pre-purchasing the digital version o…",2018-11-28T00:00:00Z,"{'id': None, 'name': 'Nintendo.com'}","Earn Double Gold Points when you pre-purchase the digital version, plus more when you add the Fighters Pass",https://www.nintendo.com/whatsnew/detail/earn-double-gold-points-pre-purchase-the-digital-version-super-smash-bros-ultimate,,148
9,"Peng Gao, Abd Rashid Bin Mohd Yusoff, Mohammad Khaja Nazeeruddin","1. Gao, P., Grätzel, M. &amp; Nazeeruddin, M. K. Organohalide lead perovskites for photovoltaic applications. Energy Environ. Sci. 7, 24482463 (2014). One of the earliest and most comprehensive reviews on perovskite solar cells, in which the influence of cati… [+19041 chars]",Organic−inorganic metal halide perovskite solar cells possess high efficiency and low processing cost but suffer poor stability. Here Gao et al. review the recent progress on the 2D–3D mixed perovskites and suggest that greatly improved stability can be achie…,2018-11-28T00:00:00Z,"{'id': None, 'name': 'Nature.com'}",Dimensionality engineering of hybrid halide perovskite light absorbers,https://www.nature.com/articles/s41467-018-07382-9?utm_source=feedburner&utm_medium=feed&utm_campaign=Feed%3A+ncomms%2Frss%2Fcurrent+%28Nature+Communications+-+current%29,https://media.springernature.com/m685/springer-static/image/art%3A10.1038%2Fs41467-018-07382-9/MediaObjects/41467_2018_7382_Fig1_HTML.png,464
10,Marc Raimondi,"LOS ANGELES — Valentina Shevchenko trained at the same gym in Thailand as Joanna Jedrzejczyk, by chance, as they were both preparing for the Muay Thai world championships in 2007. Shevchenko beat Jedrzejczyk in the 2006 tournament. The two didn’t train or spa… [+4237 chars]","Despite Joanna Jedrzejczyk’s denials, Valentina Shevchenko believes her wins over Jedrzejczyk in Muay Thai are definitely having an effect on her.",2018-11-28T00:00:05Z,"{'id': None, 'name': 'Mmafighting.com'}",Valentina Shevchenko believes Muay Thai wins over Joanna Jedrzejczyk are ‘affecting her’,https://www.mmafighting.com/2018/11/27/18115305/valentina-shevchenko-believes-muay-thai-wins-over-joanna-jedrzejczyk-are-affecting-her,https://cdn.vox-cdn.com/thumbor/GFR8bLhgL3nKdZrreZjOfMysJ90=/0x0:1920x1005/fit-in/1200x630/cdn.vox-cdn.com/uploads/chorus_asset/file/12210917/009_Valentina_Shevchenko.jpg,533
11,Richard Kerr,"Credit card issuers are in the business of acquiring long-term customers. In an age where large welcome bonuses are driving acquisition costs up and customers keep shifting products, banks are trying to incentivize card holders to not only keep their product … [+13060 chars]","Credit card issuers are in the business of acquiring long-term customers. In an age where large welcome bonuses are driving acquisition costs up and customers keep shifting products, banks are trying to incentivize card holders to not only keep their product …",2018-11-28T00:00:08Z,"{'id': None, 'name': 'Thepointsguy.com'}",Credit Cards With Bonuses for Meeting Annual Spending Requirements,http://thepointsguy.com/guide/cards-bonuses-for-annual-spending/,https://i0.wp.com/thepointsguy.com/wp-content/uploads/2018/06/112029525.jpg?fit=1240%2C900px&ssl=1,84
12,OLIVIA CALDWELL,The International Cricket Council is pushing for women's cricket to be a part of the Commonwealth Games but has no plans to do the same for the men. The ICC announced this week that it had put in a bid to have women's T20 cricket at the 2022 Birmingham games.… [+2943 chars],The International Cricket Council is pushing for women's cricket to be a part of the Commonwealth Games but has no plans to do the same for the men.,2018-11-28T00:00:34Z,"{'id': None, 'name': 'Stuff.co.nz'}",Women's cricket Commonwealth Games bid put ahead of the men's by ICC,https://www.stuff.co.nz/sport/cricket/108909749/Womens-cricket-Commonwealth-Games-bid-put-ahead-of-the-mens-by-ICC,https://resources.stuff.co.nz/content/dam/images/1/s/i/p/m/s/image.related.StuffLandscapeSixteenByNine.1420x800.1subat.png/1543363234950.jpg,994
13,Associated Press,"ASHBURN, Va. The Washington Redskins claimed Reuben Foster off waivers Tuesday after the San Francisco 49ers released the linebacker following a domestic-violence arrest. The Redskins announced the move in a statement from senior vice president of player pers… [+1920 chars]","ASHBURN, Va. — The Washington Redskins claimed Reuben Foster off waivers Tuesday after the San Francisco 49ers released the linebacker following a domestic-violence arrest. The Redskins announced the move in a statement from senior vice president of player pe…",2018-11-28T00:00:42Z,"{'id': None, 'name': 'Nypost.com'}",Redskins claim Reuben Foster despite domestic-violence arrest,https://nypost.com/2018/11/27/redskins-claim-reuben-foster-despite-domestic-violence-arrest/,https://thenypost.files.wordpress.com/2018/11/reuben-foster-redskins-claim-release-domestic-violence.jpg?quality=90&strip=all&w=1200,854
14,"Mandy Zuo, Mandy Zuo","In the 1980s, they were used to publicise official campaigns such as the war on poverty. In recent years, they have been used to promote commercial products, from car brands to dietary supplements. Whether by the government or business, slogans on walls have … [+3563 chars]","In the 1980s, they were used to publicise official campaigns such as the war on poverty. In recent years, they have been used to promote commercial products, from car brands to dietary supplements. Whether by the government or business, slogans on walls have …",2018-11-28T00:01:57Z,"{'id': None, 'name': 'Scmp.com'}",From the one-child policy to online shopping: the catchphrases of 40 years of Chinese slogans,https://www.scmp.com/news/china/society/article/2171845/one-child-policy-online-shopping-catchphrases-40-years-chinese,https://cdn1.i-scmp.com/sites/default/files/styles/620x356/public/images/methode/2018/11/27/268c708e-e0ce-11e8-829d-1199cf0acfc4_image_hires_195555.JPG?itok=zdWGmYqZ,594
15,Aron A.,"The diamond certification from the RIAA is a rare milestone for any artists to get, especially in hip-hop. While there are a handful of rap albums that have reached been certified diamond, there seems to be a similar amount of songs that have also accomplishe… [+1097 chars]","Wiz Khalifa and Charlie Puth's 'See You Again' reaches a new peak by RIAA standards. The diamond certification from the RIAA is a rare milestone for any artists to get, especially in hip-hop. While there are a handful of rap albums that have reached been cert…",2018-11-28T00:02:04Z,"{'id': None, 'name': 'Hotnewhiphop.com'}","Wiz Khalifa Earns A Rare Diamond Certification For ""See You Again""",https://www.hotnewhiphop.com/wiz-khalifa-earns-a-rare-diamond-certification-for-see-you-again-news.65525.html,https://www.hotnewhiphop.com/image/620x412/cover/1543363089_d4cb883b0d96a67d89baf3f2a9e30bd0.jpg/607c8fcb94fe525cd4be0fce2beb3ac8/1543363089_13990264fffe31f5745ac668c018538b.jpg,394
16,https://www.facebook.com/bbcnews,"Image caption So long and thanks for all the fish? Dutch fisherman working in Urk Fresh plaice encased in crushed ice pour out of crates on to the stainless steel tables. ""Very worried of course about Brexit,"" says Barend Hakvoort, whose job it is to ensure t… [+5333 chars]","Many Dutch fisherman fish under UK flags, and a Brexit deal could jeopardise their livelihoods.",2018-11-28T00:08:21Z,"{'id': 'bbc-news', 'name': 'BBC News'}",Why Brexit could threaten Dutch fishing industry,https://www.bbc.co.uk/news/world-europe-46361999,https://ichef.bbci.co.uk/news/1024/branded_news/7473/production/_104511892_img_3492.jpg,586
17,https://www.facebook.com/bbcnews,"Image caption So long and thanks for all the fish? Dutch fisherman working in Urk Fresh plaice encased in crushed ice pour out of crates on to the stainless steel tables. ""Very worried of course about Brexit,"" says Barend Hakvoort, whose job it is to ensure t… [+5333 chars]","BBC News Why Brexit could threaten Dutch fishing industry BBC News Fresh plaice encased in crushed ice pour out of crates on to the stainless steel tables. ""Very worried of course about Brexit,"" says Barend Hakvoort, whose job it is to ensure the Netherlands'…",2018-11-28T00:10:34Z,"{'id': None, 'name': 'Bbc.com'}",Why Brexit could threaten Dutch fishing industry - BBC News,https://www.bbc.com/news/world-europe-46361999,https://ichef.bbci.co.uk/news/1024/branded_news/7473/production/_104511892_img_3492.jpg,338
18,,"Dear Editor, What is the purpose of life in Jamaica? Between life and material things, which is more important or should be more important? Haven't we heard this statement more than once: ""Life is more precious than silver and gold""? And I will add to it: It'… [+867 chars]","Dear Editor,What is the purpose of life in Jamaica? Between life and material things, which is more important or should be more important?Haven't we heard this statement more than once: ""Life is more precious than silver and gold""? And I will add to it: It's …",2018-11-28T00:12:34Z,"{'id': None, 'name': 'Jamaicaobserver.com'}",ONLINE READERS COMMENT: Does life have great value in Jamaica?,http://www.jamaicaobserver.com/latestnews/ONLINE_READERS_COMMENT:_Does_life_have_great_value_in_Jamaica%3F?profile=1470,http://www.jamaicaobserver.com/apps/pbcsi.dll/storyimage/JO/20181127/ARTICLE/181129709/AR/0/AR-181129709.jpg,435
19,JP Research,"Wheaton Precious Metals ( WPM ) provides financing for traditional miners of precious metals such as gold and palladium. In return, it receives a proportion of the miner's bounty of metal at a discounted price. While Q3 earnings came up slightly short, operat… [+4606 chars]","EPS missed expectations slightly. Attributable production of gold and silver beat estimates. Future guidance was reiterated, but management suggested they are l",2018-11-28T00:13:11Z,"{'id': None, 'name': 'Seekingalpha.com'}",Wheaton Precious Metals: Cloudy Earnings Have A Silver Lining,https://seekingalpha.com/article/4224937-wheaton-precious-metals-cloudy-earnings-silver-lining,https://static2.seekingalpha.com/images/marketing_images/stock_market/commodity_trading.jpeg,59
20,Chloe Hart,"Posted November 28, 2018 11:15:18 White water sensation Jessica Fox has been named the NSW Sports Athlete of the Year, capping off an incredible year for the world's best kayaker. Key points: Jessica Fox aiming to end Olympic gold medal drought at Tokyo 2020 … [+3465 chars]","White water sensation Jessica Fox is named the NSW Sports Athlete of the Year, capping off an incredible year for the world's best kayaker.",2018-11-28T00:15:18Z,"{'id': 'abc-news-au', 'name': 'ABC News (AU)'}",Fox clinches top NSW Sports gong after epic year in the kayak,https://www.abc.net.au/news/2018-11-28/jessica-fox-already-worlds-greatest-aims-to-dominate-kayaking/10561772,https://www.abc.net.au/news/image/10561582-16x9-700x394.jpg,193
21,Elizabeth Gurdus,"Huntington Bancshares Inc. : ""The regionals are not working for me. The regionals are not working. There are two that I like a lot. I like Citi[group], which is trading at tangible book [value] [CEO] Mike Corbat doing a great job and I like J.P. Morgan, where… [+1481 chars]","Jim Cramer fires off his answers to callers' stock questions, including a query on a regional banking play.",2018-11-28T00:18:00Z,"{'id': 'cnbc', 'name': 'CNBC'}",Cramer's lightning round: Citigroup and JP Morgan are my only bank stock picks,https://www.cnbc.com/2018/11/27/cramers-lightning-round-citigroup-jp-morgan-are-my-bank-stock-picks.html,https://fm.cnbc.com/applications/cnbc.com/resources/img/editorial/2014/10/14/102086255-mad-money-lightning.1910x1000.jpg,549
22,William D. Cohan,"At the very core of Shari Redstone’s burning desire to recombine CBS and Viacom—beyond the Les Moonves saga, a Delaware lawsuit, and a slew of boardroom defenestrations—is the question of whether her 95-year-old father, who communicates partly through an iPad… [+4484 chars]","In a new court filing, Redstone’s attorney asks to move up a trial that may effect the future of CBS and Viacom.",2018-11-28T00:20:01Z,"{'id': None, 'name': 'Vanityfair.com'}",“Deteriorating Health Condition”: Sumner Redstone’s Lawyer Turns Up the Heat as Shari’s Merger Fantasy Beckons,https://www.vanityfair.com/news/2018/11/sumner-redstone-health-condition-shari-merger,"https://media.vanityfair.com/photos/5bfddda8296c752cecdfdf8a/16:9/w_1200,h_630,c_limit/sumner-redstone-health.jpg",274
23,https://www.facebook.com/DailyMail,"A baby girl (pictured) was still alive when she was allegedly tossed in a river by her 48-year-old father A baby girl found dead on a Gold Coast beach was still alive when she was allegedly thrown into a river by her father, it can be revealed. An autopsy on … [+3530 chars]","Police sources told Daily Mail Australia the autopsy revealed the real cause of the infant's death, after speculation she may have been dead prior to entering the water.",2018-11-28T00:21:21Z,"{'id': 'daily-mail', 'name': 'Daily Mail'}","Gold Coast baby was alive when she 'was thrown into the water', autopsy revealed",https://www.dailymail.co.uk/news/article-6435781/Gold-Coast-baby-alive-thrown-water-autopsy-revealed.html,https://i.dailymail.co.uk/1s/2018/11/27/23/6721614-0-image-a-93_1543360962717.jpg,895
24,newsfeeds@nzherald.co.nz,"A Mori water rights claim wants to see the country's rivers and lakes treated as public goods instead of a ""free lunch"" to commercial interests. The Waitangi Tribunal is this week hearing the closing submissions into a claim over Mori rights to fresh water, f… [+5206 chars]","A Māori water rights claim wants to see the country's rivers and lakes treated as public goods instead of a ""free lunch"" to commercial interests. The Waitangi Tribunal is this week hearing the closing submissions into a claim...",2018-11-28T00:22:33Z,"{'id': None, 'name': 'Nzherald.co.nz'}","Crown has 'failed' to protect fresh water, independent body needed - NZ Māori Council",https://www.nzherald.co.nz/nz/news/article.cfm?c_id=1&objectid=12167660,https://www.nzherald.co.nz/resizer/8ycuIeTC2Z6jfZ-UI-XzWPtjGwU=/1200x0/smart/filters:quality(70)/arc-anglerfish-syd-prod-nzme.s3.amazonaws.com/public/W5XSWGXAHFF7ZP7DNUBZQUAUSI.jpg,806
25,,"ANCHORAGE, Alaska (AP) Alaska Gov. Bill Walker is releasing money to complete an environmental review of a road to the Ambler Mining District. Walker in December 2014 halted discretionary spending on six major state projects, citing low oil prices and a large… [+817 chars]","ANCHORAGE, Alaska (AP) — Alaska Gov. Bill Walker is releasing money to complete an environmental review of a road to the Ambler Mining District.",2018-11-28T00:26:29Z,"{'id': 'associated-press', 'name': 'Associated Press'}",Walker releases funds for review of Ambler mining access,https://apnews.com/27b0d785080a4c4da15120277001f28f,https://bloximages.newyork1.vip.townnews.com/roanoke.com/content/tncms/custom/image/00f1ee32-f2d0-11e6-9926-f7249dbfe53a.jpg,935
26,The Associated Press,"ANCHORAGE, Alaska (AP) Alaska Gov. Bill Walker is releasing money to complete an environmental review of a road to the Ambler Mining District. Walker in December 2014 halted discretionary spending on six major state projects, citing low oil prices and a large… [+602 chars]","ANCHORAGE, Alaska (AP) — Alaska Gov. Bill Walker is releasing money to complete an environmental review of a road to the Ambler Mining District. Walker in December 2014 halted discretionary spending on six major state projects, citing low oil prices and a lar…",2018-11-28T00:26:29Z,"{'id': None, 'name': 'Seattletimes.com'}",Walker releases funds for review of Ambler mining access,https://www.seattletimes.com/nation-world/walker-releases-funds-for-review-of-ambler-mining-access/,https://www.seattletimes.com/wp-content/themes/st_refresh/img/st-meta-facebook.png,248
27,save50,"C &amp; C or spend over $50 Metro free shipping (excludes ACT/TAS/NT). Same products currently is $84.99/24 bottles at Dan Murphys. https://www.danmurphys.com.au/product/DM_379039/brooklyn-lag... Product Details Straight out of New York, and now available in … [+711 chars]","C & C or spend over $50 Metro free shipping (excludes ACT/TAS/NT). Same products currently is $84.99/24 bottles at Dan Murphys. https://www.danmurphys.com.au/product/DM_379039/brooklyn-lag... Product Details Straight out of New York, and now available in Vint…",2018-11-28T00:30:09Z,"{'id': None, 'name': 'Ozbargain.com.au'}",Brooklyn Lager Bottle 24x355ml $39.99(WA/VIC/TAS)/$42.99(Rest of States)(Was$88.99) @ Vintage Cellars C & C/Spend >$50 Shipped,https://www.ozbargain.com.au/node/420867,https://files.ozbargain.com.au/n/67/420867.jpg?h=144380fc,263
28,Associated Press,"The Washington Redskins claimed Reuben Foster off waivers Tuesday after the San Francisco 49ers released the linebacker following a domestic violence arrest, though it's unclear if or when he'll suit up for them. The team announced the move in a statement fro… [+3601 chars]","The Washington Redskins claimed Reuben Foster off waivers Tuesday after the San Francisco 49ers released the linebacker following a domestic violence arrest, though it's unclear if or when he'll suit up for them. The team announced the move in a statement fro…",2018-11-28T00:35:00Z,"{'id': None, 'name': 'Latimes.com'}",Redskins claim Reuben Foster off waivers just days after his domestic violence arrest,https://www.latimes.com/sports/nfl/la-sp-redskins-foster-20181127-story.html,https://www.latimes.com/resizer/EkIKQ2_UY2s1kxdiBBloolnlZH8=/1200x0/arc-anglerfish-arc2-prod-tronc.s3.amazonaws.com/public/CKKG37TNNJEIDNVZ5YYDJKSABA.jpg,953
29,Madeline Ricchiuto,"Legacy of the First Blade is the first DLC for Assassins Creed Odyssey and will run as something of an episodic story expansion. The first episode of Legacy will release on December 4th across all platforms and introduces players to the assassin Darius, who w… [+1784 chars]",Legacy of the First Blade is the first DLC for Assassin’s Creed Odyssey and will run as something of an episodic... Read More The post Assassin’s Creed Odyssey: Legacy of the First Blade Details are Here appeared first on Bleeding Cool News And Rumors.,2018-11-28T00:40:13Z,"{'id': None, 'name': 'Bleedingcool.com'}",Assassin’s Creed Odyssey: Legacy of the First Blade Details are Here,https://www.bleedingcool.com/2018/11/27/assassins-creed-odyssey-legacy-of-the-first-blade-details-are-here/,https://www.bleedingcool.com/wp-content/uploads/2018/11/ACD_153_DLC1_DariusFight_1543279964-1200x628.jpg,308
