,author,content,description,publishedAt,source,title,url,urlToImage,relevancy
740,SA Transcripts,"EVINE Live Inc. (NASDAQ: EVLV ) Q3 2018 Results Earnings Conference Call November 29, 2018 8:30 AM ET Executives Michael Porter - VP, Finance and IR Robert Rosenblatt - CEO Anne Martin-Vachon - President Diana Purcel - EVP &amp; CFO Analysts Thomas Forte - D.… [+50016 chars]","EVINE Live Inc. (NASDAQ:EVLV) Q3 2018 Results Earnings Conference Call November 29, 2018, 08:30 AM ET Executives Michael Porter - VP, Finance and IR Robert Rose",2018-11-28T18:17:18Z,"{'id': None, 'name': 'Seekingalpha.com'}",EVINE Live Inc. (EVLV) CEO Robert Rosenblatt on Q3 2018 Results - Earnings Call Transcript,https://seekingalpha.com/article/4225135-evine-live-inc-evlv-ceo-robert-rosenblatt-q3-2018-results-earnings-call-transcript,https://static3.seekingalpha.com/assets/og_image_192-59bfd51c9fe6af025b2f9f96c807e46f8e2f06c5ae787b15bf1423e6c676d4db.png,875
741,Joe Gabriele,"Key: Rolling Thunder Entering their toughest stretch of the young season, the new-look Cavaliers have been undaunted dropping Philly and Houston in successive nights and giving the Timberwolves all they could handle on Monday evening at The Q. And the hits ke… [+6004 chars]","The Cavaliers look to get back on track after falling to Minnesota on Monday, and they'll have their work cut out for them in OKC against Russell Westbrook and the Thunder. Cavs.com has your five keys to victory.",2018-11-28T18:17:46Z,"{'id': None, 'name': 'Nba.com'}",Five Keys: Cavaliers at Thunder,https://www.nba.com/cavaliers/news/features/keys-thunder-181128,https://www.nba.com/cavaliers/sites/cavaliers/files/181128-keys-758.jpg,821
742,JC Suttun,"As a reward for keeping up their Xbox Live Gold subscription, members get two free Games with Gold a month to download for a limited time on both the Xbox One and Xbox 360. The titles range from older AAA blockbusters and cult indie hits to underrated gems an… [+2707 chars]",Dragon Age II and QUBE 2 feature in December's free games promotion,2018-11-28T18:17:49Z,"{'id': 'mirror', 'name': 'Mirror'}",Xbox Live Games with Gold: Xbox One and Xbox 360 free games for December 2018,https://www.mirror.co.uk/tech/xbox-games-gold-december-2018-13659020,https://i2-prod.mirror.co.uk/incoming/article13659508.ece/ALTERNATES/s1200/0_dragon-age-2-cover.jpg,979
743,Patrick Maguire,,"The Bank of England's forecasts show no Brexit scenario where the UK economy does not shrink – but don't expect it to shift the parliamentary numbers. "" data-adaptive-image-768-img="" "" data-adaptive-image-1024-img="" "" data-adaptive-image-max-img="" ""> A no-dea…",2018-11-28T18:18:24Z,"{'id': None, 'name': 'Newstatesman.com'}","Be afraid: A no-deal Brexit would mean a 2008-style recession, says Bank of England",https://www.newstatesman.com/politics/economy/2018/11/be-afraid-no-deal-brexit-would-mean-2008-style-recession-says-bank-england,https://www.newstatesman.com/sites/default/files/styles/nodeimage/public/blogs_2018/11/gettyimages-1066097856.jpg?itok=wz3g3qCW,908
744,louisamellor,"This review contains spoilers. Though created by novelist Eugene McCabe in 1992, Beth Winters makes a fine nineteenth century Romantic heroine. Shes grave, with a poetic soul and fixation on death and beauty. She lives among nature and reads John Keats. There… [+3750 chars]","Louisa Mellor Nov 28, 2018 From the creator of The Fall comes a symbolically rich Irish literary adaptation. Spoilers ahead… This review contains spoilers. See related Death And Nightingales: air date set for Jamie Dornan's BBC series 26 new British TV dramas…",2018-11-28T18:18:54Z,"{'id': None, 'name': 'Denofgeek.com'}",Death And Nightingales episode 1 review,https://www.denofgeek.com/uk/tv/death-and-nightingales/62066/death-and-nightingales-episode-1-review,https://cdn-static.denofgeek.com/sites/denofgeek/files/2018/11/16328946-low_res-death-nightingales-225e5a0.jpg,687
745,John Paul Tasker,Alberta Premier Rachel Notley said today her government is only weeks away from finalizing a purchase of rail cars to move oil and help close massive price gaps that have short-changed government coffers and Canadian oil producers. She also said she wants the… [+2558 chars],Alberta Premier Rachel Notley says her government is only weeks away from finalizing a purchase of rail cars to move oil and help close massive price gaps that have short-changed government coffers and Canadian oil producers — and she wants the federal Libera…,2018-11-28T18:20:25Z,"{'id': 'cbc-news', 'name': 'CBC News'}","Notley says Alberta will buy rail cars to move oil, wants Ottawa to chip in",https://www.cbc.ca/news/politics/notley-alberta-rail-cars-move-oil-trudeau-1.4923976,https://i.cbc.ca/1.4924013.1543428197!/cpImage/httpImage/image.jpg_gen/derivatives/16x9_620/alta-ndp-backbencher-20181105.jpg,326
746,,"(This is only the second draft of the book Worthless. Expect typos, plot holes, odd subplots and the occassionally wrongly named character, especially minor characters. It is made public only to give people a rough idea of how the final story will look) Chapt… [+20842 chars]","(This is only the second draft of the book Worthless. Expect typos, plot holes, odd subplots and the occassionally wrongly named character, especially minor characters. It is made public only to give people a rough idea of how the final story will look) Chapt…",2018-11-28T18:21:58Z,"{'id': None, 'name': 'Gamedev.net'}","Worthless, Chapter 6",https://www.gamedev.net/blogs/entry/2265853-worthless-chapter-6/,,819
747,Matías Salord,The yellow metal rose $10 in a few minutes boosted by a decline of the US dollar. Federal Reserve Chairman Powell mentioned the policy rate is just below neutral. Gold prices jumped following the release of Fed’s Chairman Powell that pushed the greenback shar… [+978 chars],The yellow metal rose $10 in a few minutes boosted by a decline of the US dollar. Federal Reserve Chairman Powell mentioned the policy rate is just below neutral. Gold prices jumped following the release of Fed’s Chairman Powell that pushed the greenback shar…,2018-11-28T18:22:37Z,"{'id': None, 'name': 'Fxstreet.com'}",Gold soars to $1226 as US dollar drops sharply,https://www.fxstreet.com/news/gold-soars-to-1226-as-us-dollar-drops-sharply-201811281822,https://editorial.azureedge.net/images/Markets/Commodities/Metals/Gold/safe-investment-gm147311616-17537479_Large.jpg,160
748,newsfeeds@nzherald.co.nz,"NEW YORK (AP) For Missy Elliott, being a good friend and listener turned into songwriting gold. Conversations with her girlfriends fueled a great deal of her songwriting, Elliott said, resulting in her turning those stories into smash hits, from Monica's ""So … [+494 chars]","NEW YORK (AP) — For Missy Elliott, being a good friend and listener turned into songwriting gold.Conversations with her girlfriends fueled a great deal of her songwriting, Elliott said, resulting in her turning those stories into...",2018-11-28T18:24:58Z,"{'id': None, 'name': 'Nzherald.co.nz'}",Missy Elliott on Songwriters Hall nod: 'I feel so blessed',https://www.nzherald.co.nz/entertainment/news/article.cfm?c_id=1501119&objectid=12168101,https://www.nzherald.co.nz/resources/assets/img/fallback-promo-image.png,740
749,Pradeep,"You can now get 42% discount on 12-month Xbox Game Pass membership from Amazon US. After the discount, it is available for just $69.99. With Xbox Game Pass membership, you can: Get unlimited... Deal: Get the new Microsoft Surface Go tablet with 8GB RAM and 12… [+2310 chars]","Microsoft today announced the release of Windows 10 Insider Preview Build 18290 (19H1) to Windows Insiders in the Fast ring. This build comes with new manual sync option for clock, more fluent design elements in Start and more. You can read the full list of n…",2018-11-28T18:27:55Z,"{'id': None, 'name': 'Mspoweruser.com'}",Bug fixes and known issues in Windows 10 Insider Build 18290,https://mspoweruser.com/bug-fixes-and-known-issues-in-windows-10-insider-build-18277-2bug-fixes-and-known-issues-in-windows-10-insider-build-18290/,https://mspoweruser.com/wp-content/uploads/2018/11/Windows-10-Build-18277.gif,69
750,Karen Marsala,"Instead of tossing your favorite fashion, home decor, or beauty magazines in one of several piles you've established strictly for this purpose, try placing them in an attractive magazine stand, for an eye-catching design statement. We all know how easy it is … [+1373 chars]","Instead of tossing your favorite fashion, home decor, or beauty magazines in one of several piles you've established strictly for this purpose, try placing them in an attractive magazine stand, for an eye-catching design statement. We all know how easy it is …",2018-11-28T18:30:00Z,"{'id': None, 'name': 'Apartmenttherapy.com'}",Proof You Should Stop Throwing Away Your Old Magazines,https://www.apartmenttherapy.com/stylish-magazine-racks-264808,"https://cdn.apartmenttherapy.info/image/fetch/q_60,w_1024,c_fit/https://s3.amazonaws.com/pixtruder/original_images/954e2828fcb2b91f835aae4b44e6b45a09914b60",750
751,"American Mint, LLC","MECHANICSBURG, Pa., Nov. 28, 2018 /PRNewswire/ -- American Mint, LLC President Kevin Sacher proudly announced the release of a brand new gold-layered coin to honor the 100 th anniversary of the end of World War Iwhich occurred on November 11, 1918and recogniz… [+1692 chars]","MECHANICSBURG, Pa., Nov. 28, 2018 /PRNewswire/ -- American Mint, LLC President Kevin Sacher proudly announced the release of a brand new gold-layered coin to honor the 100th anniversary of the end of World War I—which occurred on November 11, 1918—and recogni…",2018-11-28T18:30:00Z,"{'id': None, 'name': 'Prnewswire.com'}",American Mint Commemorates National Veterans and Military Families Month,https://www.prnewswire.com/news-releases/american-mint-commemorates-national-veterans-and-military-families-month-300757086.html,https://mma.prnewswire.com/media/560288/American_Mint_LLC.jpg?p=facebook,864
752,"Jacqueline Kilikita, written by Jacqueline Kilikita","Safer Manicures ""Consumers are becoming a lot more aware of what theyre putting in and on their bodies, and making more informed decisions when it comes to nails is only a positive thing,"" Quashie says. ""In the same way people are having an increasing amount … [+625 chars]","2018 has had its ups and downs, that's for sure, but it's been a great year for inventive manicure trends overall. Leopard print, negative space, and not-so-simple scribble reigned supreme in salons and, of course, on Instagram, prompting us to ditch the fail…",2018-11-28T18:30:00Z,"{'id': None, 'name': 'Refinery29.com'}",The 6 Nail-Art Trends Pros Predict Will Be Huge For 2019,https://www.refinery29.com/en-us/nail-art-designs-trends-2019,"https://s2.r29static.com//bin/entry/2dd/0,0,2000,1050/x,80/2080981/image.jpg",254
753,Darren Murph,"There’s nothing quite as exciting as a promotion that hands out more miles for doing the same amount of work. We’ve seen Delta, Southwest and even Starbucks introduce variants of this tactic in 2018, and now Emirates is following suit. Emirates Skywards membe… [+3815 chars]","There’s nothing quite as exciting as a promotion that hands out more miles for doing the same amount of work. We’ve seen Delta, Southwest and even Starbucks introduce variants of this tactic in 2018, and now Emirates is following suit. Emirates Skywards membe…",2018-11-28T18:30:23Z,"{'id': None, 'name': 'Thepointsguy.com'}",You Can Now Earn Emirates Skywards Gold Status With Just 1 Flight,http://thepointsguy.com/news/emirates-skywards-gold-with-1-flight/,https://i1.wp.com/thepointsguy.com/wp-content/uploads/2018/11/Emirates-A380-First-Class_WP-39.jpg?fit=1280%2C853px&ssl=1,18
754,ESPN,"Mexico will play a tune-up in Dallas ahead of the Gold Cup in June. The Mexico national team will play a match at AT&amp;T Stadium, home to the Dallas Cowboys, on June 9, 2019, just days before the start of the 2019 CONCACAF Gold Cup. The Mexico national team… [+917 chars]","Mexico will play a tune-up in Dallas ahead of the Gold Cup in June. The Mexico national team will play a match at AT&T Stadium, home to the Dallas Cowboys, on June 9, 2019, just days before the start of the 2019 CONCACAF Gold Cup.&nbsp; The Mexico national te…",2018-11-28T18:31:00Z,"{'id': None, 'name': 'Espnfc.com'}",Mexico to play friendly at AT&T Stadium in June as part of four-year deal with Dallas,http://www.espnfc.com/mexico/story/3711552/mexico-to-play-friendly-at-atandt-stadium-in-june-as-part-of-four-year-deal-with-dallas,http://a.espncdn.com/combiner/i/?img=/photo/2018/1114/r463709_1296x729_16-9.jpg&site=espnfc,812
755,Zintle Mahlati,"Mahlodi Samuel Muofhe, former adviser of then mineral resources minister Ngoako Ramatlhodi takes the stand at the state capture commission. Picture: Dimpho Maja/ African News Agency (ANA) Johannesburg - Former adviser in the department of mineral resources Ma… [+3122 chars]","Former adviser in the department of mineral resources Mahlodi Muofhe says Jacob Zuma wanted to appoint him as NPA boss, but he refused.",2018-11-28T18:31:00Z,"{'id': None, 'name': 'Iol.co.za'}","Zuma wanted Muofhe to head NPA but Jiba would call the shots, inquiry hears",https://www.iol.co.za/news/politics/zuma-wanted-muofhe-to-head-npa-but-jiba-would-call-the-shots-inquiry-hears-18303889,https://image.iol.co.za/image/1/process/620x349?source=https://inm-baobab-prod-eu-west-1.s3.amazonaws.com/public/inm/media/image/iol/2018/11/28/18303889/gr-st-state-capture3.jpg,925
756,Associated Press,"For Missy Elliott, being a good friend and listener turned into songwriting gold. Conversations with her girlfriends fueled a great deal of her songwriting, Elliott said, resulting in her turning those stories into smash hits, from Monica’s “So Gone,” a No. 1… [+3622 chars]","For Elliott, being a good friend and listener turned into songwriting gold.",2018-11-28T18:31:28Z,"{'id': None, 'name': 'Pagesix.com'}",Why Missy Elliott feels ‘so blessed’,https://pagesix.com/2018/11/28/why-missy-elliott-feels-so-blessed/,https://nyppagesix.files.wordpress.com/2015/01/super_bowl-missy_elliott_football_105223925-copy.jpg?quality=90&strip=all&w=1200,251
757,KYLE BUCHANAN,"Im thinking of four of our most notable Oscar contenders this year, which were made by black directors. That group includes two men whose films recently won best picture: the Moonlight director Barry Jenkins, who returns this year with the romantic drama If B… [+3005 chars]","Our new Carpetbagger columnist won’t ponder whether the Oscars matter. He knows they do — because as a snapshot of Hollywood, they also reflect so much more.",2018-11-28T18:32:40Z,"{'id': 'the-new-york-times', 'name': 'The New York Times'}","The Carpetbagger: Why Oscar Season Is Crazy, Frustrating and Still Essential",https://www.nytimes.com/2018/11/28/movies/oscar-season-academy-awards.html,https://static01.nyt.com/images/2018/11/29/arts/29carpetbagger/29carpetbagger-facebookJumbo.jpg,180
758,Todd Dills,"For owner-ops opting not to purchase health insurance during the current open enrollment period for both the federal and state health insurance exchanges ending December 15 for most for coverage that starts Jan. 1, there’s a significant difference this year a… [+6365 chars]","Affordable Care Act open-enrollment period extends through Dec. 15 (longer in some states). With time left, know that there are other options out there as a result of federal and private moves toward positive insurance-market change.",2018-11-28T18:32:59Z,"{'id': None, 'name': 'Overdriveonline.com'}","Health insurance options increasing for owner-ops, as open enrollment period enters final few weeks for exchange plans",https://www.overdriveonline.com/health-insurance-options-increasing-for-owner-ops-as-open-enrollment-period-enters-final-few-weeks-for-exchange-plans/,https://www.overdriveonline.com/wp-content/uploads/sites/8/2015/02/health_insurance-yes-no-web-825x550.jpg,873
759,Eddie Makuch,"One of the first things you do in Red Dead Online, the multiplayer mode for Red Dead Redemption 2, is create a character and snap a mugshot when you're finished. You might think it's odd that your character displays their hands so prominently in the mugshot, … [+1268 chars]","One of the first things you do in Red Dead Online, the multiplayer mode for Red Dead Redemption 2, is create a character and snap a mugshot when you're finished. You might think it's odd that your character displays their hands so prominently in the mugshot, …",2018-11-28T18:33:00Z,"{'id': None, 'name': 'Gamespot.com'}",Here's Why Red Dead 2 Online's Mugshots Include Your Hands,https://www.gamespot.com/articles/heres-why-red-dead-2-onlines-mugshots-include-your/1100-6463498/,https://static.gamespot.com/uploads/screen_kubrick/1179/11799911/3467949-screen+shot+2018-11-28+at+12.01.51+pm.png,462
760,Allie Joel,"In September, Asana was thrilled to be a Gold Sponsor at the Grace Hopper Celebration (GHC), a conference hosting a massive community of women technologists from different locations and backgrounds. The days were spent listening to panels, speakers, networkin… [+4923 chars]","In September, Asana was thrilled to be a Gold Sponsor at the Grace Hopper Celebration (GHC), a conference hosting a massive community of women technologists from different locations and backgrounds. The days were spent listening to panels, speakers, networkin…",2018-11-28T18:34:18Z,"{'id': None, 'name': 'Asana.com'}","Asana at Grace Hopper 2018: Inspiration, energy, and technology",https://blog.asana.com/2018/11/asana-grace-hopper-2018/,https://blog.asana.com/wp-content/post-images/GH12.jpg,882
761,,Ranveer Singh and Deepika Padukone have hosted a reception in Mumbai today and the pictures from the grand event have taken over the internet by storm. The couple looked extravagant in ivory gold ensembles. There's one more thing which proves that Ranveer is … [+482 chars],Ranveer Singh and Deepika Padukone have hosted a reception in Mumbai today and the pictures from the grand event have taken over the internet by storm. The couple looked extravagant in ivory gold ensembles.,2018-11-28T18:35:43Z,"{'id': 'the-times-of-india', 'name': 'The Times of India'}",Here's why Ranveer is the perfect son-in-law,https://timesofindia.indiatimes.com/entertainment/hindi/bollywood/news/ranveer-singh-is-the-perfect-son-in-law-as-opts-to-go-with-the-padukones-in-ivory-instead-of-the-bhavnanis-in-black/articleshow/66855541.cms,https://static.toiimg.com/photo/msid-66855645/66855645.jpg?466231,482
762,,"A Russian state bank appeared to give a $12bn loan to one of Africas poorest countries then claimed the stated payment to the Central African Republic was an accounting error. VTB, the Kremlins second-largest bank, said on Wednesday that a software error had … [+2142 chars]",VTB says mysterious payment to Central African Republic was software bug,2018-11-28T18:36:47Z,"{'id': 'financial-times', 'name': 'Financial Times'}",Kremlin bank blames error for $12bn African ‘loan’,https://www.ft.com/content/29de9bf2-f331-11e8-ae55-df4bf40f9d0d,https://www.ft.com/__origami/service/image/v2/images/raw/http%3A%2F%2Fprod-upp-image-read.ft.com%2Fe5dad020-f339-11e8-938a-543765795f99?source=next-opengraph&fit=scale-down&width=900,318
763,Jeff Carlisle,"LA Galaxy are close to naming Dennis te Kloese as their next GM, multiple sources have told ESPN FC. MLSSoccer.com was the first to report the news of their interest. One source indicated that a deal is expected to be finalised in the next few days. Te Klose … [+2093 chars]","ESPN FC's Serie A expert Gab Marcotti discusses the inner-workings of the deal that could see Zlatan Ibrahimovic go on loan to Milan. LA Galaxy are close to naming Dennis te Kloese as their next GM, multiple sources have told ESPN FC. MLSSoccer.com was the fi…",2018-11-28T18:37:00Z,"{'id': None, 'name': 'Espnfc.com'}",LA Galaxy nearing appointment of Dennis te Kloese as general manager - sources,http://www.espnfc.com/major-league-soccer/story/3711508/la-galaxy-nearing-appointment-of-dennis-te-kloese-as-general-manager-sources,http://a.espncdn.com/combiner/i/?img=/photo/2018/1107/r460465_1296x729_16-9.jpg&site=espnfc,217
764,Victor Deng,"More colorways of the ’90s-inspired Adidas Falcon shoes will be making its way to the market soon and who better to usher in the latest wave than Kylie Jenner, who took to social media to show off the latest offerings from the women’s exclusive dad shoe. Taki… [+1186 chars]",Kylie Jenner shows off new Adidas Falcon colorways releasing on Dec. 6.,2018-11-28T18:37:03Z,"{'id': None, 'name': 'Footwearnews.com'}",Kylie Jenner Teases New Colorways of These Dad Sneakers From Adidas,https://footwearnews.com/2018/focus/athletic-outdoor/kylie-jenner-adidas-falcon-colors-instagram-1202711561/,https://pmcfootwearnews.files.wordpress.com/2018/09/adidas-falcon-launch-la.jpg?w=1200,789
765,Shelli,Travel with Grant Advertiser Disclosure Sometimes procrastination is a good thing. But in my case Im still not sure. Ive had the American Express Premier Rewards Gold Card for many years. When the Amex Everyday credit card came on the scene I always meant to … [+3953 chars],Sometimes procrastination is a good thing. But in my case I’m still not sure. I’ve had the American Express Premier Rewards Gold Card for many years. When the Amex Everyday credit card came on the scene I always meant to get that card and give up my Amex Prem…,2018-11-28T18:37:18Z,"{'id': None, 'name': 'Boardingarea.com'}","Amex Gold Card Rebranded: To Keep or Not To Keep, That is the Question!",https://travelwithgrant.boardingarea.com/2018/11/28/amex-gold-card-rebranded-to-keep-or-not-to-keep-that-is-the-question-shelli/,,495
766,,"Added on November 29, 2018 Press Trust of india New Delhi, Nov 28: A sixth world title added to her cabinet, ace Indian boxer M C Mary Kom Wednesday said she is now aiming for a gold in the Olympics. The 36-year-old claimed her sixth gold at the world event, … [+1598 chars]","The Kashmir Images Newspaper Olympics gold my dream, training hard for it: Mary Kom The Kashmir Images Newspaper New Delhi, Nov 28: A sixth world title added to her cabinet, ace Indian boxer M C Mary Kom Wednesday said she is now aiming for a gold in the Olym…",2018-11-28T18:37:19Z,"{'id': None, 'name': 'Thekashmirimages.com'}","Olympics gold my dream, training hard for it: Mary Kom - The Kashmir Images Newspaper",http://thekashmirimages.com/2018/11/29/olympics-gold-my-dream-training-hard-for-it-mary-kom/,https://i0.wp.com/thekashmirimages.com/wp-content/uploads/2018/11/mary-kom-7596.jpg?fit=800%2C445,123
767,Staff Reporter,"Two youngsters involved in theft of cattle were apprehended by the sleuths of Central Crime Station of L.B. Nagar here on Wednesday. The accused -- Vislavath Bajender, 28, a farmer from Pothubanda Thanda in Kandukur mandal of Ranga Reddy, and Rathlavath Chinn… [+814 chars]",They are also accused of indulging in a series of incidents in Ibrahimpatnam,2018-11-28T18:39:54Z,"{'id': 'the-hindu', 'name': 'The Hindu'}",Two of Nalgonda held for livestock theft,https://www.thehindu.com/news/cities/Hyderabad/two-of-nalgonda-held-for-livestock-theft/article25617610.ece,https://www.thehindu.com/static/theme/default/base/img/og-image.jpg,743
768,Atrenne Integrated Solutions,"The award winning D2D-34S series supports the development-to-deployment program (D2D) life cycle, maximizing use of COTS components for development and demonstration with upgradeability for deployment, driving reduced risk, schedule and costs. This approach a… [+1191 chars]","BROCKTON, Mass., Nov. 28, 2018 /PRNewswire/ -- Atrenne Computing Solutions, a Celestica company, announced today that they received a gold award at the 2018 Military & Aerospace Electronics Innovators Awards for their D2D-34S ATR chassis. The Innovators Award…",2018-11-28T18:40:00Z,"{'id': None, 'name': 'Prnewswire.com'}",Atrenne Receives Military & Aerospace Electronics Gold Innovators Award,https://www.prnewswire.com/news-releases/atrenne-receives-military--aerospace-electronics-gold-innovators-award-300757095.html,https://mma.prnewswire.com/media/400475/Atrenne_Integrated_Solutions_Logo.jpg?p=facebook,815
769,Kelsey Garcia,"By looking at pictures, we think it's safe to assume Nicole Kidman was feeling her fun and flirty outfit at the 2018 ARIA Music Awards. The actress attended the Sydney, Australia award show to support her husband Keith Urban, who was hosting. Nicole hit the r… [+325 chars]","By looking at pictures, we think it's safe to assume Nicole Kidman was feeling her fun and flirty outfit at the 2018 ARIA Music Awards. The actress attended the Sydney, Australia award show to support her husband Keith Urban, who was hosting. Nicole hit the r…",2018-11-28T18:41:03Z,"{'id': None, 'name': 'Popsugar.com'}",Nicole Kidman Looks Like She Floated Off a Cloud in This Ethereal Feather Top,https://www.popsugar.com/fashion/Nicole-Kidman-Oscar-de-la-Renta-Feather-Top-2018-ARIA-Awards-45530340,https://media1.popsugar-assets.com/files/thumbor/L7r03Gzi5gH_wmG2P4SUIjIrf_I/fit-in/1200x630/filters:format_auto-!!-:strip_icc-!!-:fill-!white!-/2018/11/28/802/n/1922564/81099b425bfedb482e1c70.34446882_.jpg,236
