,author,content,description,publishedAt,source,title,url,urlToImage,relevancy
0,"Tomohiro Seki, Koh Kobayashi, Takaki Mashimo, Hajime Ito","Correction for A gold isocyanide complex with a pendant carboxy group: orthogonal molecular arrangements and hypsochromically shifted luminescent mechanochromism by Tomohiro Seki et al., Chem. Commun., 2018, 54, 1113611139.","Chem. Commun., 2018, Advance Article DOI : 10.1039/C8CC90488J, Correction Open Access &nbsp This article is licensed under a Creative Commons Attribution 3.0 Unported Licence. Tomohiro Seki, Koh Kobayashi, Takaki Mashimo, Hajime Ito To cite this article befor…",2018-11-08T00:00:00Z,"{'id': None, 'name': 'Rsc.org'}",Correction: A gold isocyanide complex with a pendant carboxy group: orthogonal molecular arrangements and hypsochromically shifted luminescent mechanochromism,https://pubs.rsc.org/en/content/articlelanding/2018/cc/c8cc90488j,,116
1,"Xiuhui Wang, Jing Zhang, Jingchao Li, Ying Chen, Yazhou Chen, Naoki Kawazoe, Guoping Chen",If you are not the author of this article and you wish to reproduce material from it in a third party non-RSC publication you must formally request permission using Copyright Clearance Center. Go to our Instructions for using Copyright Clearance Center page f… [+2546 chars],"J. Mater. Chem. B, 2018, Advance Article DOI : 10.1039/C8TB02325E, Paper Xiuhui Wang, Jing Zhang, Jingchao Li, Ying Chen, Yazhou Chen, Naoki Kawazoe, Guoping Chen Bifunctional composite scaffolds of gold nanorods and gelatin can ablate tumor cells and promote…",2018-11-08T00:00:00Z,"{'id': None, 'name': 'Rsc.org'}",Bifunctional scaffolds for the photothermal therapy of breast tumor cells and adipose tissue regeneration,https://pubs.rsc.org/en/content/articlelanding/2018/tb/c8tb02325e,,477
2,,"Nineteen fifty-six was a vintage year for design and pop culture. The gorgeous Aston Martin DBR1 racing car made its debut in Britains showrooms, Miles Davis recorded his jazz classic Round About Midnight, Aldous Huxleys visionary sci-fi work Brave New World … [+1877 chars]","Vacheron Constantin’s new FiftySix collection is inspired by a vintage year for design and pop culture. The gorgeous Aston Martin DBR1 racing car made its debut in Britain’s showrooms, Miles Davis recorded his jazz classic Round About Midnight, Aldous Huxley’…",2018-11-08T00:00:00Z,"{'id': None, 'name': 'Wallpaper.com'}",Vacheron Constantin’s FiftySix collection takes its cues from a smooth jazz aesthetic,https://www.wallpaper.com/w-bespoke/vacheron-constantin-fiftysix-watch-collection,https://cdn.wallpaper.com/main/vach_2.jpg,307
3,"Ademuyiwa, Siklos, St. Amand","Idris Ademuyiwa, Pierre Siklos, Samantha St. Amand 08 November 2018 Changes in central banks balance sheets are often used as an indicator of monetary policy stance. This column describes the challenges associated with using balance sheet data to analyse poli… [+10193 chars]",Changes in central banks’ balance sheets are often used as an indicator of monetary policy stance. This column describes the challenges associated with using balance sheet data to analyse policy. Data for 31 advanced and emerging economies reveal a potentiall…,2018-11-08T00:00:00Z,"{'id': None, 'name': 'Voxeu.org'}",Central bank balance sheets and monetary policy,https://voxeu.org/article/central-bank-balance-sheets-and-monetary-policy,https://voxeu.org/sites/default/files/image/FromMay2014/AdobeStock_3826597.jpeg,549
4,"Xiao Su, Akihiro Kushima, Cameron Halliday, Jian Zhou, Ju Li, T. Alan Hatton","Electrosorption of chromium The effectiveness of PVF as a heterogeneous, electrochemically mediated adsorbent for the removal of chromate from water was evaluated using uniform, nanostructured films of multiwalled carbon nanotubes (CNTs) and PVF prepared by a… [+19228 chars]","Chromium and arsenic are prevalent water pollutants, but their removal is currently limited by low selectivity. Here, the authors use redox-active metallopolymer electrodes based on poly(vinyl)ferrocene to selectively remove the two heavy metal oxyanions at c…",2018-11-08T00:00:00Z,"{'id': None, 'name': 'Nature.com'}",Electrochemically-mediated selective capture of heavy metal chromium and arsenic oxyanions from water,https://www.nature.com/articles/s41467-018-07159-0?utm_source=feedburner&utm_medium=feed&utm_campaign=Feed%3A+ncomms%2Frss%2Fcurrent+%28Nature+Communications+-+current%29,https://media.springernature.com/m685/springer-static/image/art%3A10.1038%2Fs41467-018-07159-0/MediaObjects/41467_2018_7159_Fig1_HTML.png,769
5,"Marisa Ingemi, By Marisa Ingemi","The Bruins unveiled their jerseys for the 2019 Winter Classic on Thursday morning for when the team faces the Blackhawks at Notre Dame on January 1. It's the Bruins third appearance in the event, hosting it at Fenway Park in 2010 against the Flyers and then a… [+907 chars]","The Bruins unveiled their jerseys for the 2019 Winter Classic on Thursday morning for when the team faces the Blackhawks at Notre Dame on January 1.It&#39;s the Bruins third appearance in the event, hosting it at Fenway Park in 2010 against the Flyers and the…",2018-11-08T00:00:00Z,"{'id': None, 'name': 'Bostonherald.com'}",Bruins unveil 2019 Winter Classic jerseys,http://www.bostonherald.com/sports/bruins/bruins_insider/2018/11/bruins_unveil_2019_winter_classic_jerseys,http://www.bostonherald.com/sites/default/files/styles/full/public/media/2018/11/08/adidasHockey%20x%20Boston%20WinterClassic_01_0.jpg?itok=jPEbgvCN,346
6,Bloomberg,"Josh Wingrove Thursday, November 08, 2018 (Bloomberg) -- It’s a rough time in Canada’s oil patch, and the energy industry is warning that Justin Trudeau is about to make it worse. The bottom has fallen out of Canadian heavy crude prices, with their discount r… [+4988 chars]","It's a rough time in Canada's oil patch, and the energy industry is warning that Justin Trudeau is about to make it worse.",2018-11-08T00:00:00Z,"{'id': None, 'name': 'Rigzone.com'}",Oil Groups Warn Trudeau's Reforms Will Make it Worse,https://www.rigzone.com/news/wire/oil_groups_warn_trudeaus_reforms_will_make_it_worse-08-nov-2018-157432-article/,https://images.rigzone.com/images/news/articles/157432_582x327.png,694
7,Samantha Rosen,"You know what they say: Sweet dreams are made of cheese, who am I to disa-brie? No truer statement in the English language exists, and now the NoMad Hotel in New York City is taking it one step further the trendy hotel will be bringing back its famous prix-fi… [+3231 chars]","You know what they say: Sweet dreams are made of cheese, who am I to disa-brie? No truer statement in the English language exists, and now the NoMad Hotel in New York City is taking it one step further — the trendy hotel will be bringing back its famous prix-…",2018-11-08T00:00:29Z,"{'id': None, 'name': 'Thepointsguy.com'}",A Trendy NYC Hotel Is Serving a Cheese Fondue Menu — But Only For a Limited Time,http://thepointsguy.com/news/a-trendy-nyc-hotel-is-serving-a-cheese-fondue-menu-but-only-for-a-limited-time/,https://i0.wp.com/thepointsguy.com/wp-content/uploads/2018/11/image.jpg?fit=768%2C431px&ssl=1,121
8,Rob Sylvan,Please Support Our Partners: Adobe Stock The marketplace where videographers and photographers make money with their video footage and still photographs. Become a contributor today! Illuminati Instruments Maker of the Illuminati meter that measures flash &amp… [+1622 chars],"Category: Outdoor Photographer: Erik Karole Photo: “Fall Feather” “Autumn carries more gold in its pocket than all the other seasons.” ― Jim Bishop Lovely color and a wonderful alternative way to show off those autumn colors. Simple, yet couldn’t be more perf…",2018-11-08T00:00:52Z,"{'id': None, 'name': 'Photofocus.com'}",Photographer of the Day: Erik Karole,https://photofocus.com/2018/11/07/photographer-of-the-day-erik-karole/,https://i0.wp.com/photofocus.com/wp-content/uploads/2018/11/eKarole_nov_2018_POTD.jpg?fit=1920%2C1080&ssl=1,84
9,lucky,"Introduction: The World’s Longest Flight, Via Ahmedabad Review: Etihad First Class 787 Washington To Abu Dhabi Review: Etihad VIP Room Abu Dhabi Airport Review: Etihad Business Class A320 Abu Dhabi To Ahmedabad Review: Hyatt Ahmedabad Review: Plaza Premium Lo… [+4762 chars]","Welcome to my next trip report, which will cover travel in Etihad first & business class, as well as travel in Singapore business class on the world's (new) longest flight. Singapore Airlines resumed the world's longest flight, between Singapore and Newark, a…",2018-11-08T00:03:37Z,"{'id': None, 'name': 'Onemileatatime.com'}","Introduction: The World’s Longest Flight, Via Ahmedabad",https://onemileatatime.com/worlds-longest-flight-trip-report/,https://onemileatatime.com/wp-content/uploads/2018/10/Singapore-A350-900ULR-2.jpg,305
10,Bill Baer,"The 2018 Defensive Player of the Year Awards were unveiled on Wednesday evening on MLB Network. The award, created in 2012, determines winners “using a formula that combines traditional defensive stats with advanced metrics, as well as the data logged by the … [+1088 chars]",The 2018 Defensive Player of the Year Awards were handed out on Wednesday. Among the winners were Matt Chapman and Mookie Betts.,2018-11-08T00:05:28Z,"{'id': None, 'name': 'Nbcsports.com'}","Matt Chapman, Mookie Betts among Defensive Players of the Year",https://mlb.nbcsports.com/2018/11/07/matt-chapman-mookie-betts-among-defensive-players-of-the-year/,https://nbchardballtalk.files.wordpress.com/2018/10/gettyimages-1052149354-e1539560099883.jpg?w=1200,291
11,https://www.facebook.com/DailyMail,"You might be surprised when I tell you I feel sorry for Pippa Middleton. Shes come in for a lot of flak for pushing her baby around in a £1,119 Bugaboo Fox Classic pram. I think thats unfair. I dont goggle at the price because a year ago I had to buy my babys… [+2914 chars]","Pippa Middleton received a lot of flak for pushing her baby around in a £1,119 Bugaboo Fox Classic pram. Collette Lyons revealed why she thinks it's unfair and how she chose her baby's pram.",2018-11-08T00:07:49Z,"{'id': 'daily-mail', 'name': 'Daily Mail'}","Would you pay £1,000 for Pippa’s posh pram?",https://www.dailymail.co.uk/femail/article-6365369/Would-pay-1-000-Pippas-posh-pram.html,https://i.dailymail.co.uk/1s/2018/11/07/23/5908130-0-image-a-47_1541635139677.jpg,813
12,Patrick Saunders,"If DJ LeMahieu has indeed played his final game in a Rockies uniform, the second baseman is departing with quite a legacy. Wednesday, LeMahieu was honored by Wilson as the best second baseman in the majors. It was the third time LeMahieu, 30, has won the awar… [+1484 chars]","If DJ LeMahieu has indeed played his final game in a Rockies uniform, the second baseman is departing with quite a legacy.",2018-11-08T00:11:44Z,"{'id': None, 'name': 'Denverpost.com'}",Rockies’ DJ LeMahieu wins Wilson award as majors’ best second baseman,https://www.denverpost.com/2018/11/07/dj-lemahieu-best-second-baseman-mlb-rockies/,https://www.denverpost.com/wp-content/uploads/2018/08/1017845794.jpg?w=1024&h=683,994
13,https://www.facebook.com/DailyMailCeleb,She has been working hard with her best friend Cheryl on her new record. But Nicola Roberts let her hair down on Wednesday night at the launch party to celebrate Warehouse collaborating with Fashion Week designer Ashish. Nicola wowed in a sequin skirt as she … [+1620 chars],Nicola Roberts let her hair down on Wednesday night at the launch party to celebrate Warehouse collaborating with Fashion Week designer Ashish alongside an equally glam Vanessa White.,2018-11-08T00:22:17Z,"{'id': 'daily-mail', 'name': 'Daily Mail'}",Nicola Roberts stuns in sequin skirt as she joins glam Vanessa White at Warehouse fashion bash,https://www.dailymail.co.uk/tvshowbiz/article-6365319/Nicola-Roberts-stuns-sequin-skirt-joins-glam-Vanessa-White-Warehouse-fashion-bash.html,https://i.dailymail.co.uk/1s/2018/11/08/00/5908766-0-image-a-114_1541635885070.jpg,941
14,,BENGALURU: BJP leader and mining baron G Janardhana Reddy has come under the police scanner for his alleged role in bailing out Syed Ahmed Fareed in an Enforcement Directorate (ED) case involving a Rs 600 crore chain-link investment fraud. Police said prelimi… [+2440 chars],BENGALURU: BJP leader and mining baron G Janardhana Reddy has come under the police scanner for his alleged role in “bailing out” Syed Ahmed Fareed in.,2018-11-08T00:23:42Z,"{'id': 'the-times-of-india', 'name': 'The Times of India'}",Janardhan Reddy under lens in Rs 600 cr investment fraud,https://timesofindia.indiatimes.com/city/bengaluru/janardhan-reddy-under-lens-in-rs-600-cr-investment-fraud/articleshow/66539658.cms,"https://static.toiimg.com/thumb/msid-66539733,width-1070,height-580,imgsize-1595389,resizemode-6,overlay-toi_sw,pt-32,y_pad-40/photo.jpg",689
15,Alan Rozich,"In 2001, an event occurred which indelibly and irrevocably seared the number 911 into the American national consciousness. This incident was, of course, the infamous September 11 attacks. As was the case in 2001, most Americans are not cognizant of an even gr… [+10467 chars]","In 2001, an event occurred which indelibly and irrevocably seared the number “911” into the American national consciousness. This incident was, of course, the infamous September 11.. Click headline for full article",2018-11-08T00:26:57Z,"{'id': None, 'name': 'Energycentral.com'}",The Hidden Realities of America’s Sustainability 911,https://www.energycentral.com/c/ec/hidden-realities-america%E2%80%99s-sustainability-911?utm_source=PANTHEON_STRIPPED&amp;utm_medium=PANTHEON_STRIPPED&amp;utm_campaign=PANTHEON_STRIPPED,,754
16,,"There's only a few more days left of Dragalia Lost 's second raid event, Kindness and Captivity, and if you're anything like me, you've already cleared all of the Endeavors and maxed out the Gold Emblem rewards. Even if you have done all of the high tier stuf… [+3777 chars]","There's only a few more days left of Dragalia Lost 's second raid event, Kindness and Captivity, and if you're anything like me, you've already cleared all of the Endeavors and maxed out the Gold Emblem rewards. [ Read more ]",2018-11-08T00:27:00Z,"{'id': None, 'name': '148apps.com'}",Dragalia Lost guide - How to Close Out Kindness and Captivity Properly,http://www.148apps.com/news/dragalia-lost-guide-how-to-close-out-kindness-and-captivity-properly/?utm_source=feedburner&utm_medium=feed&utm_campaign=Feed%3A+148apps+%28148Apps+Main%29,,163
17,,"There's only a few more days left of Dragalia Lost 's second raid event, Kindness and Captivity, and if you're anything like me, you've already cleared all of the Endeavors and maxed out the Gold Emblem rewards. Even if you have done all of the high tier stuf… [+3777 chars]","There's only a few more days left of Dragalia Lost 's second raid event, Kindness and Captivity, and if you're anything like me, you've already cleared all of the Endeavors and maxed out the Gold Emblem rewards. [ Read more ]",2018-11-08T00:27:00Z,"{'id': None, 'name': '148apps.com'}",Dragalia Lost guide - How to Close Out Kindness and Captivity Properly,http://www.148apps.com/news/dragalia-lost-guide-how-to-close-out-kindness-and-captivity-properly/,,420
18,JT Genter,"Want to see the latest flight deals as soon as theyre published? Follow The Points Guy on Facebook and Twitter, and subscribe to text message alerts from our deals feed, @ tpg_alerts. Airfare deals are typically only available on limited dates. We recommend y… [+4616 chars]","Want to see the latest flight deals as soon as they’re published? Follow The Points Guy on Facebook and Twitter, and subscribe to text message alerts from our deals feed, @tpg_alerts. Airfare deals are typically only available on limited dates. We recommend y…",2018-11-08T00:30:00Z,"{'id': None, 'name': 'Thepointsguy.com'}",Deal Alert: West Coast to Hong Kong From $474 Round-Trip,http://thepointsguy.com/deals/hong-kong-flights-474-roundtrip/,https://i0.wp.com/thepointsguy.com/wp-content/uploads/2018/08/GettyImages-533144790.jpg?fit=2121%2C1414px&ssl=1,72
19,Ryan Divish,"Zunino was selected as the top defensive catcher in all of baseball by Wilson. Mike Zunino wasn’t a finalist for the Rawling’s Gold Glove awards, but different baseball glove manufacturer honored his work behind the plate. On Wednesday, the Mariners’ catcher … [+1696 chars]",Zunino was selected as the top defensive catcher in all of baseball by Wilson.,2018-11-08T00:35:50Z,"{'id': None, 'name': 'Seattletimes.com'}",Mariners catcher Mike Zunino earns Wilson Defensive Player of the Year award for catchers,https://www.seattletimes.com/sports/mariners/mariners-catcher-mike-zunino-earns-wilson-defensive-player-of-the-year-award-for-catchers/,https://static.seattletimes.com/wp-content/uploads/2018/08/08102018_marin2_2037412-316x316.jpg,827
20,David K. Li,"Get breaking news alerts and special reports. The news and stories that matter, delivered weekday mornings. SUBSCRIBE Nov. 8, 2018 / 12:36 AM GMT President Donald Trump and Attorney General Jeff Sessions were once the closest of political allies. Then-U.S. Se… [+8238 chars]",President Trump and Jeff Sessions have a long and tortured political history.,2018-11-08T00:36:00Z,"{'id': 'nbc-news', 'name': 'NBC News'}",The up-and-down relationship between Sessions and Trump,https://www.nbcnews.com/politics/justice-department/down-relationship-between-jeff-sessions-donald-trump-n933711,https://media4.s-nbcnews.com/j/newscms/2018_45/2637741/181107-jeff-sessions-resign-trump-cs-403p_74f2359d7057267a185da59a83d098e8.1200;630;7;70;5.jpg,900
21,Will Martin,"Inflation in Venezuela hits an annual rate of 830,000% – and is likely to keep rising. A report published to the country’s Congress by a coalition of opposition parties said that the annual rate had almost doubled since in the month since the last report was … [+3220 chars]","Inflation in Venezuela hits an annual rate of 830,000% - and is likely to keep rising. A report published to the country's Congress by a coalition of opposition parties said that the annual rate had almost doubled since in the month since the last report was …",2018-11-08T00:36:32Z,"{'id': None, 'name': 'Businessinsider.com.au'}","Venezuela's inflation rate just hit 830,000% — and it's going to keep rising",https://www.businessinsider.com.au/venezuela-inflation-rate-hyperinflation-2018-11,https://static.businessinsider.com/image/5be41393b73c2866eb20767a-640.jpg,630
22,https://www.facebook.com/DailyMailCeleb,"She's never one to shy away from a skin-baring ensemble. And Chloe Sims was up to her old tricks on Wednesday night, as she attended the Woo Woo event at The Box in London. The 36-year-old TOWIE star flaunted her ample assets in a skintight snakeprint bodysui… [+2244 chars]",The 36-year-old TOWIE star flaunted her ample assets in a skintight snakeprint bodysuit as she joined her glamorous co-star Georgia Kousoulou at the bash.,2018-11-08T00:39:30Z,"{'id': 'daily-mail', 'name': 'Daily Mail'}",TOWIE's Chloe Sims joins Georgia Kousoulou at London party,https://www.dailymail.co.uk/tvshowbiz/article-6365485/TOWIEs-Chloe-Sims-joins-Georgia-Kousoulou-London-party.html,https://i.dailymail.co.uk/1s/2018/11/08/00/5910056-0-image-a-115_1541637544713.jpg,764
23,SA Transcripts,"Coty Inc. (NYSE: COTY ) Q1 2019 Earnings Conference Call November 7, 2018 8:00 AM ET Executives Camillo Pane Chief Executive Officer Analysts Lauren Lieberman Barclays Robert Ottenstein Evercore ISI Mark Astrachan Stifel Faiza Alwy Deutsche Bank Olivia Tong B… [+55553 chars]","Coty Inc. (NYSE:COTY) Q1 2019 Earnings Conference Call November 7, 2018 8:00 AM ET Executives Camillo Pane – Chief Executive Officer Analysts Lauren Lieberman –",2018-11-08T00:42:05Z,"{'id': None, 'name': 'Seekingalpha.com'}",Coty Inc. (COTY) CEO Camillo Pane on Q1 2019 Results - Earnings Call Transcript,https://seekingalpha.com/article/4219570-coty-inc-coty-ceo-camillo-pane-q1-2019-results-earnings-call-transcript,https://static3.seekingalpha.com/assets/og_image_192-59bfd51c9fe6af025b2f9f96c807e46f8e2f06c5ae787b15bf1423e6c676d4db.png,831
24,Stranger Things To Do Staff,"This year, Veterans Day (Sun Nov 11) not only honors US military personnel of the past and presentit's also the 100th anniversary of Armistice Day, the original name for Veterans Day, which was enacted in 1918 to mark the end of World War I and to promote pea… [+5134 chars]","Ways to Celebrate Veterans Day 2018 and the Armistice Centennial in Seattle. by Stranger Things To Do Staff This year, Veterans Day (Sun Nov 11) not only honors US military personnel of the past and present—it's also the 100th anniversary of Armistice Day, th…",2018-11-08T00:48:00Z,"{'id': None, 'name': 'Thestranger.com'}",Ways to Celebrate Veterans Day and the Armistice Centennial,https://www.thestranger.com/things-to-do/2018/11/07/35182828/16-ways-to-celebrate-veterans-day-2018-and-the-armistice-centennial-in-seattle,https://media2.fdncms.com/stranger/imager/u/large/35192454/image1.jpg,419
25,Erin Swenlin,"Lots of new BUY signals are appearing on the DecisionPoint Scoreboards in the short-term timeframe. This is good news for bulls, but I don't think they can breathe easy just yet. This rally reminds me of the last big rally we had in October that was not fuele… [+6449 chars]","Lots of new BUY signals are appearing on the DecisionPoint Scoreboards in the short-term timeframe. This is good news for bulls, but I don't think they can breathe easy just yet. This rally reminds me of the last big rally we had in October that was not fuele…",2018-11-08T00:48:50Z,"{'id': None, 'name': 'Stockcharts.com'}",DP Alert: Momentum Shift - New PMO BUY Signals on DP Scoreboards,http://stockcharts.com/articles/decisionpoint/2018/11/dp-alert-momentum-shift---new-pmo-buy-signals-on-dp-scoreboards.html,http://d.stockcharts.com/img/articles/2018/05/15253015040491908789231.png,856
26,https://www.facebook.com/DailyMailCeleb,"Oaks Day is all about the ladies. And Myer Ambassador Jennifer Hawkins, 34, certainly looked ladylike in a simply stunning ensemble for the races on Thursday. The former Miss Universe Australia showed off her statuesque frame in an elegant floral Alex Perry d… [+3219 chars]","Oaks Day is all about the ladies. And Myer Ambassador Jennifer Hawkins, 34, certainly looked ladylike in a simply stunning ensemble for the races on Thursday.",2018-11-08T00:49:39Z,"{'id': 'daily-mail', 'name': 'Daily Mail'}",Jennifer Hawkins and Rachael Finch stun in pastel and florals at Oaks Day,https://www.dailymail.co.uk/tvshowbiz/article-6365163/Jennifer-Hawkins-Rachael-Finch-stun-pastel-florals-Oaks-Day.html,https://i.dailymail.co.uk/1s/2018/11/08/00/5910350-0-image-a-34_1541638164360.jpg,917
27,https://www.facebook.com/DailyMail,"The owners of French bulldog that was found dead on the Gold Coast have demanded an autopsy be carried out. Two-year-old Frenchie, called Theo, went missing on Halloween, and was found dead three days later in a yard close to his home. Owners Kimberley Breece… [+3230 chars]",The owners of a beloved pet dog that went missing on the Gold Coast - and was found dead several days later - have demanded an autopsy be carried out.,2018-11-08T00:51:08Z,"{'id': 'daily-mail', 'name': 'Daily Mail'}",Owners of ‘dognapped’ French Bulldog Theo demand AUTOPSY to determine what happened to beloved pet,https://www.dailymail.co.uk/news/article-6365209/Owners-dognapped-French-Bulldog-Theo-demand-AUTOPSY-determine-happened-beloved-pet.html,https://i.dailymail.co.uk/1s/2018/11/08/00/5908884-0-image-a-2_1541635577661.jpg,829
28,Activist Post,"By Brandon Smith Over the past few weeks I received numerous requests from readers to publish my predictions on the outcome of the midterm elections, but I did not do so for a couple of reasons. First and foremost, I view the election process very differently… [+12246 chars]","Certain groups of people within the establishment, namely globalists, prefer that the public remain as divided as possible. For them, zealotry is an asset.",2018-11-08T00:51:23Z,"{'id': None, 'name': 'Activistpost.com'}",The Economy Does Not Care Who Won The Midterm Elections,https://www.activistpost.com/2018/11/the-economy-does-not-care-who-won-the-midterm-elections.html,https://www.activistpost.com/wp-content/uploads/2018/06/anthony_freda_studio-777.jpg,509
29,rawmeatcowboy,"The latest Japanese trailer for WarioWare Gold focuses in on both Dr. Crygor and Penny. The English version should be available sometime tomorrow. Until then, we think you'll be able to figure out what's up in the Japanese version!","The latest Japanese trailer for WarioWare Gold focuses in on both Dr. Crygor and Penny. The English version should be available sometime tomorrow. Until then, we think you'll be able to figure out what's up in the Japanese version!",2018-11-08T01:00:00Z,"{'id': None, 'name': 'Gonintendo.com'}",WarioWare Gold - Dr. Crygor and and Penny trailer,https://gonintendo.com/stories/322199-warioware-gold-dr-crygor-and-and-penny-trailer,https://gonintendo.com/system/stories/promo_images/000/322/199/original/maxresdefault_%284%29.jpg?1541639045,206
