publish_datetime,content,href,publish_timestr,summarize,title
2019-02-07,"OSLO (Reuters) - Oil firm DNO is looking to buy more assets after its recent takeover of London-listed Faroe Petroleum to further expand its North Sea presence. Oslo-listed DNO, which produces most of its oil in the Kurdistan region of Iraq, clinched a hostile takeover bid for London-based Faroe Petroleum, valuing Faroe at 634 million pounds, in January.  “We would like to have another Faroe Petroleum under our belt,” DNO’s executive chairman Bijan Mossavar-Rahmani told Reuters, adding that he was speaking in terms of asset size. Potential “bolt-on acquisitions” included buying extra stakes in the licenses where DNO already operates or swapping assets near its hubs, Mossavar-Rahmani said.   DNO said Faroe puts it among the top five companies by production licenses held on the Norwegian continental shelf. Norway was a sellers’ market with oil and gas assets fully priced, Mossavar-Rahmani said. “But our advantage is that we are sitting at a table with the top players now,” he said, adding that he was “already getting calls from executives from top Norwegian players wanting to speak about assets swaps or other deals”. DNO has not yet decided what to do with Faroe’s holdings on the UK continental shelf (UKCS).  “We are still in very early stages, but we hope that there are some opportunities there as well,” Mossavar-Rahmani said.  DNO posted a higher-than-expected fourth quarter operating profit of $230 million, up from $25.7 million a year before and beating a $68.5 million forecast in a Reuters poll of analysts. The earnings increase came as a result of a change in revenue recognition criteria.  The move did not impact its cash flow reporting, though, with quarterly free cash flow of $111 million also beating expectations, analysts at Sparebank 1 Markets said. Last September, DNO’s board decided to pay an annual dividend of 434 million Norwegian crowns, its first in 13-years, in two tranches of 0.2 crowns per share, one in March 2019.  Mossavar-Rahmani told a news conference he hoped that the dividend programme will be extended beyond March, but declined to speculated about a potential size as it also has to consider capital and exploration spending needs.  DNO said it would lift its total spending, including exploration, by $420 million in 2019, up 40 percent from last year as it planned a record drilling programme, including up to 20 wells in Kurdistan and 5 to 10 wells in Norway. Its working interest production stood at 91,570 barrels of oil equivalent per day (boepd) in the fourth-quarter, up from 77,232 boepd from a year ago, helped by the ramp-up of output from its Peshkabir field in Kurdistan. DNO said it would publish pro-forma results and its 2019 investment programme later this month and in March. Its shares were up 1.1 percent by 1419 GMT, outperforming the wider European oil and gas index, which was down 0.8 percent.                 Editing by Gwladys Fouche, Dale Hudson and Alexander Smith",https://uk.reuters.com/article/dno-results/update-3-oil-firm-dno-trawling-for-north-sea-assets-after-faroe-idUKL5N20216X,07 Feb 2019,"* DNO chairman ""hopes"" dividend payments to continue
(Recasts with executive chairman interview, updates share
price)",UPDATE 3-Oil firm DNO trawling for North Sea assets after Faroe
2019-02-07,"(Repeats to more subscribers, no changes to headline or text) By Jennifer Hiller HOUSTON, Feb 7 (Reuters) - Chevron Corp plans to set greenhouse gas emissions targets and tie executive compensation and rank-and-file bonuses to the reductions, the oil major said in its latest climate report released on Thursday. The move is a first for a U.S. oil major and focuses on the company’s oil fields. More investors have been pressuring San Ramon, Calif.-based Chevron and other big oil companies to reduce emissions that contribute to climate change. Chevron said that by 2023, it will reduce its methane and flaring intensity by 25 percent to 30 percent from 2016 levels, and said the goal would be added to the scorecard that determines incentive pay for around 45,000 employees. “It’s about the mindset and the culture of the company,” said Chevron Vice President Mark Nelson, noting that including most of its global workforce would “harness” ideas from all employees. Among other oil companies, London-based BP and France’s Total have set short-term targets on reducing carbon dioxide emissions from to their own operations. Royal Dutch Shell in December announced it would link executive compensation to reducing carbon dioxide emissions starting in 2020, including so-called Scope 3 emissions from fuels sold to customers around the world. Chevron’s report said it does not support establishing Scope 3 targets. Exxon’s latest climate report, published on Tuesday, includes a goal of reducing methane emissions from operations by 15 percent and flaring by 25 percent by 2020 compared with 2016 levels, as well as reducing greenhouse gas intensity at its Canadian oil sands facilities by 10 percent by 2023. Chevron’s target aims to reduce emissions and flaring as a percentage of production, but does not set a goal for total emissions - a measure that activist investors prefer. The targets will apply to Chevron’s operations as well as joint ventures or assets it has a stake in but does not operate itself, the company said. Methane, the main component of natural gas, is colorless and odorless, and has more than 80 times the heat trapping potential of carbon dioxide in the first 20 years after it escapes into the atmosphere, scientists say. Methane can leak from oilfield equipment and pipelines, or is flared or vented during maintenance work, and when new oil wells are added in areas that don’t have natural gas pipelines. (Reporting by Jennifer Hiller; Editing by David Gregorio)",https://uk.reuters.com/article/chevron-carbon/rpt-chevron-ties-executive-pay-to-methane-and-flaring-reduction-targets-idUKL1N2020RA,07 Feb 2019,"Chevron Corp plans to set
greenhouse gas emissions targets and tie executive compensation
and rank-and-file bonuses to the reductions, the oil major said
in its latest climate report released on Thursday.",RPT-Chevron ties executive pay to methane and flaring reduction targets
2019-02-07,"LONDON (Reuters) - Shares in British oil services firm Petrofac slumped almost 30 percent on Thursday after a former senior executive pleaded guilty to 11 counts of bribery in relation to oil deals in Iraq and Saudi Arabia. Britain’s Serious Fraud Office said David Lufkin, a former global head of sales for Petrofac, was convicted over what the prosecutor called corrupt attempts by Petrofac to secure deals, via agents, worth more than $730 million (566 million pounds) in Iraq and more than $3.5 billion in Saudi Arabia. The 51-year-old Briton will be sentenced at a later date. His lawyer did not immediately respond to a request for comment. Petrofac said a number of Petrofac individuals and entities were alleged to have acted “with the individual concerned”, although no current board member of Petrofac Ltd was alleged to have been involved and there had been no further charges. “The SFO has chosen to bring charges against a former employee of a subsidiary company,” Petrofac Chairman René Médori said in a statement.  “It has deliberately not chosen to charge any group company or any other officer or employee. In the absence of any charge or credible evidence, Petrofac intends as a matter of policy to stand by its employees.” Petrofac’s shares pared some of their losses to stand 27.64 percent down by 1430 GMT, their lowest level in around 12 months. The shares earlier posted their steepest daily fall since May 2017. The SFO said it was continuing its investigation into Petrofac’s use of agents in jurisdictions including Iraq and Saudi Arabia. The projects named in the SFO statement in relation to Petrofac payments to agents include engineering contracts for the Petro Rabigh petrochemical plant, partly owned by Saudi Aramco, and Aramco’s Jazan refinery in 2012. Another contract named by the SFO was a 2015 project awarded by state-run Aramco to Petrofac for work at its Fadhili gas plant.  Contracts mentioned by the SFO in Iraq relate to the Badra oilfield, which Russia’s Gazprom Neft is developing, and the Fao Terminal in 2012. Neither Aramco, Petro Rabigh nor Gazprom Neft are accused of any wrongdoing. Aramco declined to comment. Petro Rabigh, Iraq’s state oil marketer Somo, the Iraqi Oil Ministry and Gazprom Neft made no immediate comment. The SFO first said it had begun an investigation into Petrofac in 2017 as part of a wider probe into Monaco-based oil and gas consultancy Unaoil.  In February 2018, Petrofac said it expected its top management to be interviewed as part of the SFO probe. Additional reporting by Shadia Nasralla, Rania El Gamal, Olesya Astakhova, John Davison; Editing by Rachel Armstrong, Alexander Smith and Dale Hudson",https://uk.reuters.com/article/britain-petrofac/update-2-petrofac-shares-slump-after-ex-exec-pleads-guilty-to-bribery-idUKL5N202394,07 Feb 2019,"* Petrofac shares drop to lowest since June 2017
(Adds details, updates share drop)",UPDATE 2-Petrofac shares slump after ex-exec pleads guilty to bribery
2019-02-07,"* Quick start for a policy to hedge volume risks * Can cut risk capital costs as banks more comfortable * Price hedges, solar inclusion are next down the line By Vera Eckert ESSEN, Germany, Feb 7 (Reuters) - Munich Re aims to cover 1 gigawatt (GW) of wind power capacity this year with a new insurance product that allows turbine operators to hedge against revenue losses from volatile wind speeds, a project manager said on Thursday. The German insurer claims its product is unique because it uses an onsite machine to track real-time wind energy output, unlike similar products available that rely on satellite pictures or weather station forecasts, and will also cover yet-to-be built plants which do not have to build up a performance history first. “Having just launched the product, we see a lot of interest and hope to be insuring 1 GW this year worldwide (of existing and new wind power capacity),” project manager Ronny Bendlin Spuer told Reuters on the sidelines of the E-World fair in Essen, Germany. “We already hope to close a deal in the first half of 2019 with a 300 MW pilot wind park that has been operating for a couple of years and are in further advanced discussions as well,” he added. Germany has 53 GW of onshore wind capacity and 6 GW offshore but that is set to increase significantly as the country shifts to renewables and ends coal burning for power by 2038. Munich Re competes with Swiss Re and Nephila Capital/Allianz in providing wind power insurance coverage in Europe, Australia, the United States and Asia. The new product will allow operators to build insurance cover against fluctuations in output, on top of equipment maker warranties and property insurance. “It will help guarantee more even cash flows and thus improve the bankability of projects,” said Bendlin Spuer. He would not specify costs and savings for customers, saying that was very much project-dependent. Wind derivatives products on European exchanges have not taken off because there is no standardised, one-size-fits-all answer to individual producers’ dilemma. Big wind power operators can spread risks across locations at times of low wind, when single-site operators struggle. Munich Re, which reported a sharp drop in fourth quarter profit on Wednesday following a spate of natural catastrophes, expects hedging and a similar product could eventually be launched for producers of solar energy. (Reporting by Vera Eckert, editing by Susan Fenton)",https://uk.reuters.com/article/energy-eworld-wind/munich-re-encouraged-by-initial-demand-for-wind-power-hedge-product-idUKL5N1ZV6VJ,07 Feb 2019,"Munich Re aims
to cover 1 gigawatt (GW) of wind power capacity this year with a
new insurance product that allows turbine operators to hedge
against revenue losses from volatile wind speeds, a project
manager said on Thursday.",Munich Re encouraged by initial demand for wind power hedge product
2019-02-07,"LONDON (Reuters) - Policymakers and analysts who claim the outlook is “unusually uncertain” are normally overstating their own forecasting problem and understating the difficulties faced by their predecessors. The outlook always looks more certain in retrospect, when the outcome is known, and a causal chain can be constructed that makes it appear nearly inevitable, than it does in prospect, when multiple pathways look possible. Unusually uncertain is often a fancy way of saying “I don’t know” and concealing the limits of forecasting, which is often much less reliable than policymakers and analysts would like their audience to believe. But there are times when it is genuinely more difficult to predict what will happen in future, especially when systems approach turning points or inflection points. I am normally sceptical when policymakers and analysts say the outlook is unusually uncertain, but at the moment they may actually be justified in making that claim, with the economy delicately poised between moderation and recession, and hyper-sensitive to even small shocks that could nudge it towards either eventuality. In both the economy and the oil market, forecast accuracy deteriorates around cyclical turning points, which is why almost all forecasters missed the onset of the last recession in 2007 or the collapse in oil prices in 2008. For the same reason, most forecasters missed the slump in oil prices in the middle of 2014, the recovery in oil prices from early 2016, or the renewed fall in prices during late 2018. “The largest errors in forecasts of real and nominal GDP growth, inflation, and the unemployment rate, are made in the vicinity of business cycle and growth cycle turning points, particularly peaks,” wrote business cycle expert Victor Zarnowitz. “Many forecasts are overly influenced by the most recent events or developments; they rely on the persistence of local trends and are insufficiently cyclical in the sense that they miss the turns and underestimate recessions and recoveries.” “Leading indicators rarely miss major turns in economic activity, but they now and then err in giving false signals of recession or (less often) recovery” (“Business cycles: theory, history, indicators and forecasting”, Zarnowitz, 1992). However, even leading indicators may struggle to discriminate between a true turning point (where the cycle changes direction) and an inflection point (where the cycle continues in same direction but with a change of rate). In the vicinity of a turning point or an inflection, the economy and the oil market can become very sensitive to even small changes in conditions and sentiment, which contributes to the increased forecasting difficulty. The global economy and the oil market both now show clear signs of a slowdown. Every leading indicator tells the same story of a sharp loss of momentum in the second half of 2018 after strong growth in 2017. But all those indicators for the economy and the oil market are in a range that could be consistent with either an imminent recession or a renewed acceleration after a period of sluggish growth. With every indicator poised between a true turning point in the cycle or simply an inflection in the growth rate, there is no way to discriminate in advance. (Chartbook: tmsnrt.rs/2ULs8I8) The shape of the U.S. Treasury yield curve is one commonly employed leading indicator for predicting recessions in the United States. Based on the current shape of the yield curve, the Federal Reserve Bank of New York estimates there is a 24 percent probability the U.S. economy will be in recession in January 2020. The forecast probability of recession has more than doubled over the last year, and risen six times over the last two years, and is now unusually elevated. But the forecast probability is still well below the 40 percent hit in the run up to the recessions of 2007-2009, 2001, 1981-82 or 1980. The probability looks more like the elevated risk in 1990 (which turned into a recession) or 1996 and 1999 (which did not). Based on the yield curve, it is impossible to say whether the U.S. economy is heading for an end-of-cycle turning point or a temporary in-cycle slowdown. The U.S. equity market is similarly hovering uncertainly between an intra-cycle slowdown and an end-of-cycle turning point. The S&P 500 equity index is now down slightly over the last 12 months after strong year-on-year gains during 2017 and most of 2018. The flattening of equity prices is certainly consistent with a slowdown in the economic and corporate earnings outlook but is not yet at levels that preceded the recessions of 1990, 2001 or 2007. U.S. manufacturing surveys show a loss of momentum at the end of 2018 and the start of 2019, a warning sign, but the composite activity indicators are still well below the levels that preceded the last three recessions. Even the much-ballyhooed U.S. job market indicators are ambiguous. Non-farm employment is rising at around 1.8 percent per year, faster than the 1.5 percent reported 12 months earlier, but fairly slow compared with earlier expansions. If the U.S. economy is performing relatively well, most of the rest of the global economy is performing relatively poorly, but not so badly that we can confidently predicted a recession rather than a slowdown. China’s official purchasing managers’ index shows manufacturing activity has been losing momentum for the last year and actually contracted in December and January, but only slightly. Globally, purchasing managers’ indicators show new export orders have been losing momentum since the start of 2018 and have now fallen for five months in a row. But the declines in orders have been relatively small, so far, and could be consistent with an in-cycle slowdown such as 2015-2016 or 2011-2012 rather than a full recession like 2007-2009 or 2001. Air freight indicators also point to flat-lining or falling volumes in 2018 after strong growth in 2016 and 2017, but do not yet show the large falls associated with the last two recessions. Like the rest of the economy, the oil market appears to be poised uncertainly between the probability of a recession-induced supply surplus or a recovery-driven deficit. OPEC’s aggressive output cuts, coupled with U.S. sanctions on Iran and Venezuela, have offset the feared slowdown in oil consumption growth and eliminated much of the incipient surplus in 2019. Brent’s six-month calendar spread has returned close to flat, after collapsing from backwardation into contango during the fourth quarter, suggesting traders currently see the oil market close to balance this year. Brent spreads cycle between contango and backwardation as the oil market alternates between periods of over- and under-supply; they do not usually stay close to flat for very long. But the outlook is poised between fears about a recession-driven slowdown in consumption and concerns about supply losses from Iran and Venezuela as well as OPEC cuts and a possible slowdown in U.S. shale growth. The global economic outlook is the single biggest source of uncertainty for the oil market, and until that source of uncertainty is resolved or at least reduced, the oil outlook remains equally unclear.  John Kemp is a Reuters market analyst. The views expressed are his own. Related column: - No more geopolitical risks please (Reuters, Dec. 4, 2014)0) Editing by David Evans",https://uk.reuters.com/article/oil-economy-kemp/column-oil-and-economy-poised-between-growth-and-recession-kemp-idUKL5N2026NH,07 Feb 2019,"Policymakers and analysts who
claim the outlook is ""unusually uncertain"" are normally
overstating their own forecasting problem and understating the
difficulties faced by their predecessors.",COLUMN-Oil and economy poised between growth and recession: Kemp
2019-02-07,"BUDAPEST (Reuters) - The United States could help Hungary diversify away from Russian energy by encouraging ExxonMobil to proceed with long-stalled plans to develop the Domino-1 gas field in the Black Sea, Hungary’s foreign minister said. Foreign Minister Peter Szijjarto discussed diversification of Hungary’s natural gas imports with U.S. Secretary of Energy Rick Perry on Wednesday, the ministry said on Thursday. He asked Perry to do what he could to facilitate the start of production from Domino-1 which is controlled by Exxon and Romania’s Petrom, a subsidiary of Austrian firm OMV. Discovered off Romania in 2012 with estimated gas reserves of 1.5-3 trillion cubic feet, the companies have since sought greater clarity from Romanian authorities before developing the field. Exxon said in January it was continuing to evaluate the project, pinning its final investment decision on factors including “competitive and stable fiscal terms for existing offshore concessions for the duration of the agreements.” OMV Chief Executive Rainer Seele said on Wednesday that the company was in dialogue with the Romanian government over the project, which is expected to cost a billion euros. Szijjarto said it was in Hungary’s strategic interest that the consortium make the investment required to produce the gas and that Hungary has access to this new source of energy. Hungary could import the gas via a pipeline Romania is building from the Black Sea through an interconnector between the two countries, which will be capable of handling reverse flows, Szijjarto was quoted by the ministry as saying. In November, Perry called on Hungary and its neighbors to reject Russian gas pipelines which Washington says are being used to cement Moscow’s grip on central and eastern Europe. Import-reliant Hungary gets most of its gas from Russia and Russian firm Rosatom is involved in a 12.5-billion-euro expansion of Hungary’s Paks nuclear power plant, the country’s main domestic source of electricity. Last year Hungary agreed to buy 4 billion cubic meters of natural gas from Russia in 2020. Reporting by Gergely Szakacs; additional reporting by Kirsti Knolle in Vienna; editing by Jason Neely",https://uk.reuters.com/article/hungary-usa-gas/hungary-calls-on-u-s-to-spur-exxon-gas-project-in-black-sea-idUKL5N2024DE,07 Feb 2019,"The United States could help
Hungary diversify away from Russian energy by encouraging
ExxonMobil to proceed with long-stalled plans to develop
the Domino-1 gas field in the Black Sea, Hungary's foreign
minister said.",Hungary calls on U.S. to spur Exxon gas project in Black Sea
2019-02-07,"BERLIN, Feb 7 (Reuters) - Uniper said on Thursday it will stick to its contractual obligations concerning Russian gas export pipeline Nord Stream 2, adding that the outcome of an upcoming EU meeting would not affect the construction of the pipeline. “I firmly assume that the Nord Stream 2 project will be realised”, a spokesman of the energy group said. The European Union executive wants to extend its internal energy market laws to offshore gas pipelines to have a say over the new gas link under the Baltic Sea from Russia to Germany. In its current form, the project, fully owned by Russian state energy firm Gazprom, would not be compliant. Reporting by Tom Kaeckenhoff
Writing by Riham Alkousaa",https://uk.reuters.com/article/eu-gazprom-nordstream/uniper-says-eu-decision-on-nord-stream-2-wont-affect-pipeline-construction-idUKB4N1ZI02D,07 Feb 2019,"Uniper said on Thursday
it will stick to its contractual obligations concerning Russian
gas export pipeline Nord Stream 2, adding that the outcome of an
upcoming EU meeting would not affect the construction of the
pipeline.",Uniper says EU decision on Nord Stream 2 won't affect pipeline construction
