publish_datetime,content,href,publish_timestr,summarize,title
2019-01-14,"DETROIT (Reuters) - Fiat Chrysler Automobiles NV (FCHA.MI) (FCAU.N) is reviewing its investment plan for Italy after the country approved taxes on the purchase of larger gasoline and diesel cars, Chief Executive Officer Mike Manley said on Monday.  The carmaker said in late November it would spend more than 5 billion euros ($5.7 billion) on new models and engines in Italy over the next three years to try to make better use of factories and boost jobs and margins. In December, however, Italy approved measures to offer subsidies of up to 6,000 euros to buyers of new low-emission vehicles while introducing taxes on the larger gasoline and diesel cars. “It certainly means it needs to be reviewed again. It’s being reviewed at this moment,” Manley told journalists on the sidelines of the Detroit auto show. “Until that review is finished I can’t comment any further.” FCA’s Italian plans were intended to deliver on a strategy outlined by late boss Sergio Marchionne in June, when he committed to keep converting Italian plants to churn out higher-margin Alfa Romeos, Jeeps and Maseratis, as well as hybrid and electric vehicles, to protect jobs and lift profit. Manley said tariffs imposed by U.S. President Donald Trump’s administration on steel and aluminum imports would add between $300 million and $350 million in extra costs for FCA in 2019. He said the partial U.S. government shutdown over spending for a wall sought by Republican Trump on the U.S.-Mexican border has delayed final certification of one of FCA’s heavy-duty pickup trucks.  Pickup trucks are the one of most profitable segments in the auto industry and are a major profit driver for FCA as it battles for market share against General Motors Co (GM.N) and Ford Motor Co (F.N). “So I am concerned, clearly. Very concerned,” Manley said. “If it (the shutdown) continues it will have an impact on the launch of heavy duty.” “The earlier it can be resolved, clearly the better,” he added. Manley, who took the helm at the world’s seventh-largest carmaker last year after Marchionne’s sudden death, also said that FCA’s robotics business, Comau, and castings unit, Teksid, were not for sale at the moment.  “I’m focused on building value in those businesses. If I’m able to do that, that’s going to give me options in the future,” he said.  FCA last year agreed to sell its biggest parts maker, Magneti Marelli, to Japan’s Calsonic Kansei - owned by U.S. private equity firm KKR (KKR.N) - for 6.2 billion euros. That sparked renewed speculation that the smaller Comau and Teksid businesses could also go, especially after attracting interest from potential buyers in the past.   “One thing I learned in 2018: you should never say never,” Manley said. “Those businesses have value, there have been people that have talked to us about those businesses and I’ve been interested to hear what they have to say.” Reporting by Nick Carey in Detroit; Writing by Agnieszka Flak; Editing by David Goodman and Matthew Lewis",https://uk.reuters.com/article/autoshow-detroit-fiat-chrysler-italy/update-2-fca-reviewing-italy-plan-after-new-taxes-for-polluting-cars-idUKL8N1ZE5WE,14 Jan 2019,"Fiat Chrysler Automobiles NV
is reviewing its investment plan for Italy
after the country approved taxes on the purchase of larger
gasoline and diesel cars, Chief Executive Officer Mike Manley
said on Monday.",UPDATE 2-FCA reviewing Italy plan after new taxes for polluting cars
2019-01-14,"(Adds details, background) By Aidan Lewis CAIRO, Jan 14 (Reuters) - Israel will begin exporting natural gas to Egypt in a few months’ time, Energy Minister Yuval Steinitz said on Monday, a key step in the country’s plans to sell its expanding gas production abroad and bolster diplomatic ties. Steinitz did not give a specific target for initial exports, but said shipments would double after the huge Leviathan field in the eastern Mediterranean comes fully online in November. Steinitz said Israeli exports to Egypt were expected to reach 7 billion cubic meters annually over 10 years. About half the exports were expected to be used for Egypt’s domestic market and half to be liquefied for re-export, he said. Israel has discovered vast amounts of gas since the early 2000s, signing deals to export to Egypt and Jordan. Its production, currently around 10.5 billion cubic meters (bcm), is expected to more than double in 2020, rising to 27 bcm in 2021. In an interview on the sidelines of a regional gas forum in Cairo, Steinitz said Israel and Egypt had discussed how to extend cooperation on natural gas, including through exports. He also said Israel was hoping to sign a deal for the construction of the 2,000-kilometre (1,243-mile) East Med pipeline, which will cross from Israel and Cyprus into Greece and Italy, “in a few weeks’ time”. “Israel exporting natural gas to the Arab world and also to Europe — this is something that sounded like a dream or a fantasy just 10 or 15 years ago,” said Steinitz, the first energy minister to visit Egypt since the 2011 uprising there. The exports from Israel to Egypt will be made under a landmark $15 billion natural gas export deal announced in February 2018. In September, Israeli and Egyptian companies bought a 39 percent stake in the EMG pipeline, paving the way for the deal to begin. Partners in Israel’s Tamar and Leviathan offshore gas fields had said they would supply the private Egyptian company Dolphinus Holdings with around 64 billion cubic meters of gas over a decade as part of the deal. The agreement has stirred controversy in Egypt, which until a few years ago exported gas to Israel. Egypt is hoping to leverage its strategic location bridging Africa and Asia and its well-developed infrastructure to become a key trading and distribution centre for gas in the region and beyond. It has made a series of its own big discoveries in recent years, including Zohr, the largest gas field in the Mediterranean, but also needs to meet rapidly increasing domestic demand. Editing by Jan Harvey and Catherine Evans",https://uk.reuters.com/article/egypt-israel-energy/update-2-israel-will-begin-exporting-gas-to-egypt-in-a-few-months-time-energy-minister-idUKL8N1ZE51N,14 Jan 2019,"Israel will begin exporting
natural gas to Egypt in a few months' time, Energy Minister
Yuval Steinitz said on Monday, a key step in the country's plans
to sell its expanding gas production abroad and bolster
diplomatic ties.",UPDATE 2-Israel will begin exporting gas to Egypt in a few months' time - energy minister
2019-01-14,"(Reuters) - Newmont Mining Corp said on Monday it would buy smaller rival Goldcorp Inc for $10 billion, creating the world’s biggest gold producer in the face of dwindling easy-to-find reserves of the precious metal. The transaction, the biggest ever takeover in the gold sector according to Refinitiv, follows Barrick Gold Corp’s  agreement in September to buy Randgold Resources Ltd in a deal valued at $6.1 billion. “Combining forces will give us the sector’s best project pipeline and exploration portfolio,” Newmont Chief Executive Gary Goldberg said on a conference call with analysts. “These prospects translate to the gold sector’s largest reserve and resource base.” Vancouver-based Goldcorp’s Toronto-listed shares rose 7 percent to C$13.75 at 12:03 p.m. ET (1703 GMT). Newmont Mining’s shares were down about 8.8 percent at $31.83 in New York. In recent years, investor criticism over inadequate management of capital had largely kept gold companies focused on costs while dampening enthusiasm for acquisitions. But the need to bolster shrinking reserves and production and a rising gold price are now serving as catalysts for increased dealmaking. Spot gold prices are up 11.3 percent since an August trough, when they had declined 15 percent from a January 2018 peak. Newmont’s acquisition of Goldcorp could spark further consolidation in the industry, where too many gold companies are chasing too few assets, Michael Siperco from Macquarie Research said. He did not specify which companies are most likely to follow suit. The new company, to be called Newmont Goldcorp, is set to overtake current leader Barrick Gold’s annual production and will have mines in the Americas, Australia and Ghana. “This transaction is positive for Newmont, because it establishes it as the world’s leading gold producer with a deal that is accretive on nearly all key metrics,” analysts at Scotiabank wrote in a note.  The new company will be led by Newmont’s Goldberg. He will retire at the end of 2019, when Tom Palmer, Newmont’s chief operating officer, will take over as the CEO, the companies said. Denver, Colorado-based Newmont expects savings of $100 million a year. The combined company will sell $1 billion to $1.5 billion worth of assets over the next two years as part of the deal, mirroring a similar move by Barrick when it announced the Rangold acquisition. The new company is expected to produce 6-7 million ounces of gold annually over the next 10 years and beyond versus Barrick’s 2018 forecast of between 4.5 million and 5 million ounces. Newmont will offer 0.3280 of its share and $0.02 for each Goldcorp share. Based on Newmont’s Friday close, that translates to $11.46 per share, a premium of about 18 percent to Goldcorp’s Friday close on the New York Stock Exchange. nBw4JX5tpa] That remains below premiums paid in the last decade for gold deals, Credit Suisse analysts said in a note. The transaction is scheduled to close in the second quarter, the companies said. BMO Capital Markets, Citi and Goldman Sachs are working as financial advisors for Newmont, while Goldcorp has retained TD Securities and BofA Merrill Lynch as financial advisors, the companies said.  Reporting by John Benny in Bengaluru and Nichola Saminather in Toronto; Additional reporting by John Tilak in Toronto; Editing by Frances Kerry and Marguerita Choy",https://uk.reuters.com/article/goldcorp-ma-newmont-mining/update-5-newmont-takes-top-gold-producer-spot-with-10-bln-goldcorp-buy-idUKL3N1ZE30G,14 Jan 2019,"Newmont Mining Corp said on
Monday it would buy smaller rival Goldcorp Inc  for
$10 billion, creating the world's biggest gold producer in the
face of dwindling easy-to-find reserves of the precious metal.",UPDATE 5-Newmont takes top gold producer spot with $10 bln Goldcorp buy
2019-01-14,"GENEVA (Reuters) - Venezuela has launched a complaint at the World Trade Organization to challenge Colombia’s restrictions on the distribution of liquid fuels imported from Venezuela, a filing published by the WTO showed on Monday. Venezuela said Colombia was illegally discriminating against its fuel exports by imposing “a series of distribution and licensing measures, and product surcharges, market access measures and pricing policies” on Venezuelan fuel.  Colombia has 60 days to settle the dispute or Venezuela could ask the WTO to adjudicate, although the ability of the Geneva-based body to keep refereeing such disputes is in doubt due to a U.S. block on judicial appointments. Reporting by Tom Miles; Editing by Jan Harvey",https://uk.reuters.com/article/venezuela-colombia-wto/venezuela-goes-to-wto-to-contest-colombia-fuel-import-rules-idUKL8N1ZE618,14 Jan 2019,"Venezuela has launched a
complaint at the World Trade Organization to challenge
Colombia's restrictions on the distribution of liquid fuels
imported from Venezuela, a filing published by the WTO showed on
Monday.",Venezuela goes to WTO to contest Colombia fuel import rules
2019-01-14,"BRUSSELS (Reuters) - The European Commission is willing to accept a deal with producers of Argentine biodiesel to settle a long-running trade dispute over imports of the product into Europe. The Commission, which oversees trade policy in the 28-member European Union, said it had communicated to interested parties last week that it was willing to accept undertakings from producers that they would sell at a minimum price. “This would exclude these producers from possible anti-subsidy duties to be imposed by the European Commission, while restoring the level playing field for European producers,” a Commission spokesperson said by email on Monday. Those interested parties have until Friday Jan. 18 to comment on the proposal, with EU countries due to be consulted on the issue on Jan. 30. The deadline for definite duties, which are typically in place for five years, is Feb. 28. A lawyer representing one of the parties in the case said the Commission had not made clear what the minimum price would be, nor what potential volume would be allowed in. The scheme with a minimum price would mirror that used to allow Chinese solar panel producers to export to the bloc after a major dispute over alleged dumping that threatened to spiral into a trade war. For Argentine biodiesel, the Commission has proposed duties of between 25.0 and 33.4 percent depending on the companies, a document seen by Reuters in December showed. Exporters include the Argentine arms of Bunge Ltd (BG.N), Cargill Inc [CARG.UL] and Louis Dreyfus Corp [LOUDR.UL], as well as Molinos Rio de la Plata SA (MOLI.BA). “We would be willing to settle for a minimum value,” said Luis Zubizarreta, president of the Argentine Chamber of Biofuels (CARBIO). “There is a good dialogue (with the EU) and it seems like the way to benefit everyone,” Zubizarreta added. An Argentine industry source with knowledge of the relationships told Reuters that, if successful, the agreement would be implemented from February and last for “several years.”  The Commission began investigating Argentine, as well as Indonesian, biodiesel imports in 2012 following a request by EU producers of fuels made from vegetable and recycled oil. The EU case was based on export duties both countries impose on the raw material, soybeans for Argentina and palm oil for Indonesia. The EU view was that this gave an unfair advantage to biodiesel producers there, allowing them to sell at unfairly low prices. It imposed anti-dumping duties in 2013, but then had to remove most in March 2018 after successful challenges at the World Trade Organization and the European Court of Justice. The Commission opened its current anti-subsidy investigation a year ago. Reporting by Philip Blenkinsop; additional reporting by Maximilian Heath in Buenos Aires; writing by Cassandra Garrison; Editing by Mark Potter and Marguerita Choy",https://uk.reuters.com/article/eu-biodiesel-argentina/update-2-eu-ready-to-accept-deal-to-exempt-duties-on-argentine-biodiesel-idUKL8N1ZE4QW,14 Jan 2019,"The European Commission is
willing to accept a deal with producers of Argentine biodiesel
to settle a long-running trade dispute over imports of the
product into Europe.",UPDATE 2-EU ready to accept deal to exempt duties on Argentine biodiesel
2019-01-14,"JAKARTA (Reuters) - Two Indonesian F-16 fighter jets forced an Ethiopian Airlines cargo plane to land on Monday at an airport on Batam island after it had flown into Indonesian airspace without permission, an air force spokesman said. First Marshal Novyan Samyoga said in a statement the Boeing Co 777 cargo plane had been secured by air force personnel at Hang Nadim international airport on Batam, an island south of Singapore. The cargo flight ETH 3728 had been flying from the Ethiopian capital Addis Ababa to Hong Kong. Officials at Ethiopian Airlines said the plane had made an urgent unscheduled flight to drop an aircraft engine in Singapore for maintenance.  “(The plane) was crossing the Indonesian airspace in accordance with the ICAO Chicago Convention Article 5, by which a non-scheduled flight can overfly the airspace of a friendly country without prior permission,” the email from the airline read. Ethiopian Airlines had explained to Indonesia and the crew was now resting in a hotel before continuing their flight, the airline said. Reporting by Agustinus Beo Da Costa and Aaron Maasho in Addis Ababa; Writing by Ed Davies; Editing by Darren Schuettler",https://uk.reuters.com/article/indonesia-airlines-ethiopia/update-1-indonesian-jets-force-ethiopian-cargo-plane-to-land-over-airspace-breach-idUKL3N1ZE43Y,14 Jan 2019,"Two Indonesian F-16 fighter jets
forced an Ethiopian Airlines cargo plane to land on
Monday at an airport on Batam island after it had flown into
Indonesian airspace without permission, an air force spokesman
said.",UPDATE 1-Indonesian jets force Ethiopian cargo plane to land over airspace breach
2019-01-14,"(Updates with early U.S. markets activity, changes dateline, previous LONDON) * U.S. stocks down in late-morning trading * China Dec exports, imports unexpectedly drop * U.S. Treasury yields on most maturities slipped By Caroline Valetkevitch NEW YORK, Jan 14 (Reuters) - World stock indexes fell while the yen rose against the dollar on Monday after a shock contraction in Chinese trade reignited fears of a sharper slowdown in global growth and caused investors to sell riskier assets. Copper prices fell and the Australian and New Zealand dollars also declined following the China news, which added to worries that U.S. tariffs on Chinese goods were taking a toll on the world’s second-largest economy. “The biggest theme (in the market today) is risk-off,” said John Doyle, vice president of dealing and trading at Tempus, Inc. Data from China showed imports fell 7.6 percent year-on-year in December while analysts had predicted a 5-percent rise. Exports dropped 4.4 percent, confounding expectations for a 3-percent gain. For an interactive version of the following chart, click here tmsnrt.rs/2SRopIf. The United States and China - the world’s two largest economies - have been in talks for months to try and resolve their bitter trade war, with no signs of substantial progress. Adding to the gloom were weak industrial output numbers from the euro zone, which showed the largest fall in nearly three years. Softening demand has been felt around the world with sales of goods ranging from iPhones to automobiles slowing, prompting profit warnings from Apple among others. Trade-sensitive shares fell, including Boeing Co Caterpillar Inc, though U.S. stock investors also were on edge as the U.S. earnings season kicked off. “We’re seeing some cautiousness heading into the beginning of earnings season as people are worried about guidance and what companies are going to say, especially in relation to trade,” said Robert Pavlik, chief investment strategist and senior portfolio manager at SlateStone Wealth LLC in New York. The Dow Jones Industrial Average fell 139.63 points, or 0.58 percent, to 23,856.32, the S&P 500 lost 16.99 points, or 0.65 percent, to 2,579.27 and the Nasdaq Composite dropped 63.27 points, or 0.91 percent, to 6,908.21. Citigroup Inc shares were higher after the bank beat profit estimates as lower expenses offset a drop in quarterly revenue. The pan-European STOXX 600 index lost 0.38 percent and MSCI’s gauge of stocks across the globe shed 0.62 percent. U.S. Treasuries tracked the European bond market, but were little changed in late-morning U.S. trading. In the foreign exchange market, the Japanese yen, a safe-haven currency that benefits in times of geopolitical turmoil, strengthened against the U.S. dollar by 0.33 percent. The Australian dollar, which was down 0.24 percent, and kiwi dollar, which was down 0.12 percent. China is Australia’s largest trade partner. The prospect of slowing global growth also roiled some commodity markets. Industrial metals copper and aluminium lost ground in London and Shanghai. Three-month copper on the London Metal Exchange was bid down 0.9 percent at $5,888 a tonne after failing to trade in official rings, its lowest level in more than a week. Oil prices were down slightly. U.S. crude fell 0.54 percent to $51.31 per barrel. Brent crude, the international benchmark, fell 46 cents to $60.02 a barrel. Additional reporting by Kate Duguid in New York and Medha
Singh and Karin Strohecker
Editing by John Stonestreet and Nick Zieminski",https://uk.reuters.com/article/global-markets/global-markets-weak-china-trade-hits-world-stocks-causes-risk-off-trade-idUKL1N1ZE0TO,14 Jan 2019,"World stock indexes fell while
the yen rose against the dollar on Monday after a shock
contraction in Chinese trade reignited fears of a sharper
slowdown in global growth and caused investors to sell riskier
assets.","GLOBAL MARKETS-Weak China trade hits world stocks, causes risk-off trade"
2019-01-14,"(Recasts, updates throughout, adds comment, detail) LONDON, Jan 14 (Reuters) - Arabica coffee futures on ICE fell on Monday, pressured by a weaker Brazilian currency and renewed speculative selling, while sugar and cocoa were little changed. * March arabica coffee was down 1.75 cents, or 1.7 percent, at $1.0210 per lb by 1455 GMT. * Weighing on prices was a softer Brazilian real. A weaker currency in the top grower boosts local returns on dollar-traded goods like coffee, encouraging producers to hedge their supplies. * Dealers also said the market was correcting after last week’s run-up to a five-week peak, with speculative selling adding some pressure on Monday. * “It’s the last day of the index fund buying today and I think it’s had an influence,” said one European dealer, noting sellers were keen to take advantage of the window of opportunity. * Weakening chart signals also added pressure, after the market failed to hold above the 10-day moving average, dealers said. * “Technically, it felt like the move up last week probably caused a few people to get more negative about the market,” the dealer said. * March robusta coffee fell $14, or 0.9 percent, to $1,529 a tonne. * Coffee is a booming business for Western retailers but the farmers who grow the crop are facing a crisis, with arabica prices at their lowest for nearly 13 years. * March raw sugar was unchanged at 12.78 cents per lb. Last week, prices had their best weekly performance since early October although dealers said on Monday that the buying had petered out for now. * “The market consensus is that the system funds have been buying back shorts but are still net short,” Marex Spectron said in a report. * March white sugar fell $0.50, or 0.1 percent, to $344.40 a tonne, after earlier falling to $341.20. * Dealers said sentiment was somewhat dampened by signs of weak demand for spot supplies and lacklustre interest in taking delivery of the March contract. * Indonesia also said it may not import white sugar for household use in 2019 due to sufficient stocks and higher production, as three new sugar mills start operation this year. * May London cocoa fell 6 pounds, or 0.4 percent, to 1,722 pounds a tonne. * March New York cocoa fell $10, or 0.4 percent, to $2,346 a tonne. * Market participants were awaiting European cocoa grind data for the fourth quarter of 2018, due out on Wednesday, for fresh indications of demand. (Reporting by Ana Ionova; Editing by Mark Potter and Susan Fenton)",https://uk.reuters.com/article/global-softs/softs-arabica-coffee-slips-on-fund-selling-weaker-brazil-currency-idUKL8N1ZE4TN,14 Jan 2019,"Arabica coffee futures on ICE
fell on Monday, pressured by a weaker Brazilian currency and
renewed speculative selling, while sugar and cocoa were little
changed.","SOFTS-Arabica coffee slips on fund selling, weaker Brazil currency"
2019-01-14,"AMSTERDAM (Reuters) - Royal Dutch Shell and Dutch pension fund manager PGGM are considering a joint bid for Dutch energy company Eneco [ENECO.UL], which analysts estimate to be worth around 3 billion euros ($3.4 billion). The 53 municipalities that own Eneco, which is heavily invested in sustainable energy projects, said in December they will sell it via an auction later this year. Shell and PGGM, who gave no financial details, said they were looking for “a long term commitment” with Eneco, which is expected to appeal to energy companies that want to increase their exposure to renewable energy production. “We are determined to invest in sustainable energy, specifically in northwest Europe”, Shell and PGGM said in a letter to Eneco stakeholders.  The decision to sell Eneco in an auction ended a heated battle between its board and shareholders, who wanted to cash in on their stakes. The board had said it would prefer a stock market listing or partial sale that would ensure continuity as a renewables-oriented company.  Reporting by Bart Meijer, editing by Louise Heavens and Alexander Smith",https://uk.reuters.com/article/eneco-ma-shell/update-1-shell-teams-up-with-dutch-pension-fund-to-bid-for-eneco-idUKL8N1ZE4TU,14 Jan 2019,"Royal Dutch Shell
and Dutch pension fund manager PGGM are considering a joint bid
for Dutch energy company Eneco, which analysts
estimate to be worth around 3 billion euros ($3.4 billion).",UPDATE 1-Shell teams up with Dutch pension fund to bid for Eneco
2019-01-14,,https://uk.reuters.com/article/oil-korea-iran/s-korea-imports-no-iranian-crude-for-december-customs-idUKENNJ170SP,14 Jan 2019,"South Korea did not import crude oil from Iran in December, compared with 1.1 million tonnes imported a year ago, preliminary data from Korea Customs Service showed on Tuesday.
The world’s fifth-largest crude buyer imported a total 12.4 million tonnes of crude last month against 13.2 million  tonnes imported a year ago, the data also showed.
Final data for South Korea's crude oil imports last month will be published by state-run Korea National Oil Corp (KNOC) later the ",S.Korea imports no Iranian crude for December -customs
