publish_datetime,content,href,publish_timestr,summarize,title
2019-02-07,"MELBOURNE (Reuters) - Australia is on track to meet its carbon emissions target under the Paris Climate accord well before 2030, thanks to increasing growth in wind and solar power, a study has found, contradicting a report last month calling for sharper emissions cuts. With several big wind and solar farms opening over the past year and rapidly growing installation of rooftop solar panels,  Australia is adopting renewable energy faster per capita than the rest of the world, said a study published by Australian National University (ANU) researchers on Friday. The pipeline of new wind and solar systems is averaging about 6.3 gigawatts (GW) a year, the study showed. Based on the new renewable energy that has started in Australia since last June and is expected over the next few years, emissions will drop sharply from the power sector, offsetting possible increases from other sectors, such as transport and farms, the ANU researchers calculated.  Each extra gigawatt of renewables displaces about 2 million tonnes of carbon dioxide (CO2) equivalent emissions from coal-fired power, the study said, implying Australia’s pipeline of renewables would cut emissions by about 12 million to 13 million tonnes of CO2 equivalent a year. Assuming other sectors’ emissions grow by 2 million tonnes of CO2 equivalent a year, the net reduction would be about 10 million to 11 million tonnes a year, which would put Australia on track to meet its Paris target before 2030.  “By this time next year it’ll be quite obvious to everybody that something really surprising has happened in the greenhouse accounts,” said the study’s lead researcher, Andrew Blakers, an engineering professor. The additional Australian renewables equate to 250 watts per person a year, compared with about 50 watts per person for the European Union, Japan, China and the United States, the study said. “Australia is far and away the renewable energy superstar in terms of annual per capita deployment,” Blakers said. The study, based on data from Australia’s Clean Energy Regulator, was not commissioned by anyone, he said.  To meet Australia’s Paris Climate accord commitment to cut carbon emissions by 26 percent to 28 percent from 2005 levels by 2030, emissions would have to fall to between 430 million and 442 million tonnes of CO2 equivalent.  As of the end of 2017, emissions had risen to 553.7 million tonnes of CO2 equivalent, according to data from Australia’s National Greenhouse Gas Inventory. Extrapolating from that figure, the Organisation of Economic Cooperation and Development said last month Australia needed to cut emissions more sharply to meet its Paris target as the country remained heavily dependent on coal-fired power. Reporting by Sonali Paul; editing by Christian Schmollinger",https://uk.reuters.com/article/climate-change-australia-renewables/australia-will-easily-meet-paris-climate-accord-target-study-idUKL3N2020SW,07 Feb 2019,"Australia is on track to meet
its carbon emissions target under the Paris Climate accord well
before 2030, thanks to increasing growth in wind and solar
power, a study has found, contradicting a report last month
calling for sharper emissions cuts.",Australia will easily meet Paris climate accord target - study
2019-02-07,"(Updates with early European trading) * World shares down for second day, dollar powers up for fifth day * European bourse, euro hit by more weak German data * European Commission slashes Italy growth forecast * Asia ex-Japan shares tick up, Australia leads gains * Dollar holds gains as kiwi slides on jobs data By Marc Jones LONDON, Feb 7 (Reuters) - Mounting global growth worries thrust share markets into reverse on Thursday, while the dollar scored its longest winning run since a hot streak in early October that helped trigger a wave of worldwide ‘bear’ markets. Wall Street looked set to suffer back-to-back losses later after Europe had set the tone. Some poor earnings and weak data out of Germany ensured most of the main bourses were lower and kept MSCI’s main index of world stocks in the red for a second day too. The extent of the current slowdown in the global economy was highlighted as India unexpectedly cut its interest rates and the euro got hit to $1.1346 by Germany’s fourth consecutive drop in industrial output. That only compounded the 1.3 percent the euro has lost over the last week and the tailwind behind the dollar, which has risen every day since Friday’s strong U.S. jobs data. It has also recovered almost all the losses suffered after the Federal Reserve all but abandoned plans for more rate hikes last month. “Another day, another piece of terrible German data. EUR/USD risks a move to $1.1300,” said ING’s chief EMEA FX and interest rate strategist, Petr Krpata. Elsewhere the pound was struggling near $1.29 again after the Bank of England kept rates on hold, while gloomy jobs data saw New Zealand’s dollar suffer a similar flop as its Australian counterpart had seen the previous day. The kiwi slid to $0.6744, losing nearly 2 percent in the past 24 hours, as investors wagered on the risk of a cut in interest rates there. New Zealand’s central bank holds its first meeting of the year next week. Asian trading was still light overall though with China on holiday and no major economic data on the diary. MSCI’s broadest index of Asia-Pacific shares outside Japan added 0.1 percent as it rose to its highest since early October. The index has risen steadily since early January as the U.S. Federal Reserve changed its tune and emerging markets have surged more broadly after a torrid 2018. Australia’s benchmark stock index jumped 1.2 percent amid expectations of easy monetary policy after the central bank chief shifted away from his previous tightening bias. Japan’s Nikkei slipped 0.6 percent though and the caution quickly spread to Europe. London’s FTSE was the only major bourse clinging to positive territory, helped by a weak pound, whereas the rest were down at least 0.6 percent as were E-Mini futures for the S&P 500 and Dow. One of the day’s big surprises came from India where its central bank unexpectedly lowered interest rates to 6.25 percent to boost a slowing economy after a sharp slide in the inflation rate. Italian bonds were back under pressure with the European Commission slashing its 2019 growth forecast. Italy agreed a deficit target of 2.04 percent in December, averting a major fall-out with the EU, though this was based on a growth assumption of 1.0 percent. Slowing growth in Italy could make it harder for the country to remain within EU rules. However, Benjamin Schroeder, rates strategist at ING, said he did not expect the EU to demand more fiscal tightening from Italy, should its forecasts be reduced. “The EU has another thing to deal with — Brexit — and the other thing is do you want to infuse the campaign ahead of the parliamentary elections with this topic.” The next major trigger for markets will more likely be any breakthrough in the U.S.-Sino tariff talks when the two sides meet in Beijing next week. U.S. President Donald Trump offered little new to chew on in his State of the Union speech but Treasury Secretary Steven Mnuchin said on Wednesday he and other U.S. officials will aim to clinch a deal next week to avert a March 2 increase in U.S. tariffs on Chinese goods. Probably more pressing though for the U.S. markets is the threat of another government shutdown, Nick Twidale, an analyst at Rakuten Securities Australia said. “With both sides of the house standing firm on the contentious border wall issue at present and the deadline approaching swiftly on Feb 15 we could be back where we were just a few weeks ago.” The broad dollar gains put pressure on gold, which eased to $1,303.96 per ounce, slipping further from last week’s top of $1,326.30. Oil prices eased too after U.S. crude inventories rose and as production levels in the country held at record levels. Brent crude futures slipped 23 cents to $62.46. U.S. crude eased 19 cents to $53.82 a barrel. Additional Reporting by Wayne Cole and Swati Pandey in Sydney
and Virginia Furness and Tom Finn in London; Editing by Toby
Chopra",https://uk.reuters.com/article/global-markets/global-markets-shares-go-weak-as-data-disappoints-dollar-extends-power-surge-idUKL5N2025D0,07 Feb 2019,"* World shares down for second day, dollar powers up for
fifth day","GLOBAL MARKETS-Shares go weak as data disappoints, dollar extends power surge"
2019-02-07,"OSLO, Feb 7 (Reuters) - The Swedish government has dismissed the director general of state-owned power grid operator Svenska Kraftnat Ulla Sandborgh, replacing her with senior Finance Ministry official Lotta Medelius-Bredhe, the company said on Thursday. Sandborgh had been working for Svenska Kraftnat for nearly seven years, the last two as its top executive, her Linkedin profile shows. (Reporting by Lefteris Karagiannopoulos; Editing by Jan Harvey)",https://uk.reuters.com/article/sweden-grid-ceo/swedish-government-replaces-chief-of-electricity-grid-idUKL5N2024X3,07 Feb 2019,"The Swedish government has dismissed
the director general of state-owned power grid operator Svenska
Kraftnat Ulla Sandborgh, replacing her with senior Finance
Ministry official Lotta Medelius-Bredhe, the company said on
Thursday.",Swedish government replaces chief of electricity grid
2019-02-07,,https://uk.reuters.com/article/markets-distillates-asia/asia-distillates-gasoil-margins-hit-3-week-high-cash-discounts-narrow-idUKL3N2020O2,07 Feb 2019,"Asian refining margins for 10ppm gasoil rose to a three-week
high on Thursday as crude prices eased, while cash discounts for the industrial fuel narrowed on
hopes for tightening supply over the next couple of months.
    Traders returned to the market after the Lunar New Year holidays with firmer deals in the
physical market, while a drop in Singapore middle distillate inventories boosted expectations
for stronger fundamentals.
    Refining margins, or cracks, f","Asia Distillates-Gasoil margins hit 3-week high, cash discounts narrow"
2019-02-07,"(Repeats with no changes to headline or text) By Rod Nickel WINNIPEG, Manitoba, Feb 7 (Reuters) - Canada’s struggling oil industry is looking to what is known as partial upgrading technology to thin its sludge-like crude and squeeze more of it through congested pipelines. It is the latest effort by the Alberta provincial government to rescue an industry hurt last year by steep discounts for its oil, as production far exceeded pipeline capacity. The government has already forced output cuts, given subsidies to petrochemical plants and said it would invest in trains to move crude. Alberta in January announced a C$440 million loan guarantee for a C$2-billion partial upgrading facility planned by private company Value Creation. The Edmonton-area plant would turn 77,500 barrels per day (bpd) of diluted bitumen into medium crude oil and low-sulfur diesel, starting in 2022. Producing a medium grade would give the world’s fourth-largest producer more of a different type of crude to sell that does not compete with abundant U.S. light shale oil. Most of the oil produced in Canada is thick, heavy crude that comes from northern Alberta’s oil sands. Some is then put through a full upgrading process at great cost, turning that crude into synthetic light oil. Other heavy crude must be diluted with light oil - an extra expense - to travel through pipelines. “Our crude oil would have a tailor fit to refineries, so we would have no problem to find the market,” Value Creation Chief Executive Columba Yeung said in an interview. Partial upgrading is not yet done on a commercial scale anywhere. It removes sulfur and other impurities to create lighter grades of oil that do not require dilution to move through pipelines, lowering costs and making shipping more efficient. In 2018, the United States imported 2.4 million barrels of medium, sour crude per day, only 15 percent of which came from Canada, according to IHS Markit. “There’s a case to be made for product diversification,” said IHS Vice President Kevin Birn. The timing for partial upgrading comes with risks, however. Alberta’s New Democratic Party government is facing a tough spring election, and by the time the first upgrader is finished in 2022, additional pipeline capacity may be open, reducing the urgency to remove diluent from shipments to free up space. The opposition United Conservative Party would review the viability of any subsidized energy projects if it forms a government, said Prasad Panda, the party’s energy critic. Several pipelines in the works would raise Canada’s export capacity to 5.5 million bpd, creating a surplus of space until 2030, according to the Canadian Energy Research Institute. Yeung counters that additional pipelines would only enhance opportunities for partially upgraded oil to reach markets. Developers of a dozen partial upgrading technologies, including MEG Energy Corp, are undeterred, however, and hope Value Creation’s plant is only the first. Among the other companies grappling with ways to help alleviate Alberta’s problem is Calgary-based Fractal Systems, which intends to profit mainly by removing and reselling diluent from heavy crude. Field Upgrading has a tiny 10 bpd pilot plant that it hopes to scale up to 10,000 bpd by 2022 to produce low-sulfur heavy oil suitable for marine shipping. The technology produces fuel compliant with tougher shipping emission requirements that take effect next year, said co-founder Neil Camarta. “It’s really important that we get some of these technologies out of the lab and into development, because there’s potential there,” Camarta said. (Reporting by Rod Nickel in Winnipeg, Manitoba; Editing by Tom Brown)",https://uk.reuters.com/article/canada-crude-upgrading/rpt-partial-oil-upgrading-the-latest-fix-for-canadas-pipeline-problem-idUKL1N2011UO,07 Feb 2019,"Canada's struggling
oil industry is looking to what is known as partial upgrading
technology to thin its sludge-like crude and squeeze more of it
through congested pipelines.",RPT-Partial oil upgrading the latest fix for Canada's pipeline problem
2019-02-07,"(Repeats for additional clients with no changes to text) By Chris Prentice and A. Ananthalakshmi NEW YORK/KUALA LUMPUR, Feb 7 (Reuters) - In June, the High Seas tanker ship loaded up on ethanol in Texas and set off for Asia. Two months later - after a circuitous journey that included a ship-to-ship transfer and a stop in Malaysia - its cargo arrived in China, according to shipping data analyzed by Reuters and interviews with Malaysian and Chinese port officials. At the time, the roundabout route puzzled global ethanol traders and ship brokers, who called it a convoluted and costly way to get U.S. fuel to China. (MAP: tmsnrt.rs/2HP1ywa ) But the journey reflects a broader shift in global ethanol flows since U.S. President Donald Trump ignited a trade war with China last spring. Although China slapped retaliatory tariffs up to 70 percent on U.S. ethanol shipments, the fuel can still legally enter China tariff-free if it arrives blended with at least 40 percent Asian-produced fuel, according to trade rules established between China and the Association of Southeast Asian Nations (ASEAN), the regional economic and political body. In a striking example of how global commodity markets respond to government policies blocking free trade, some 88,000 tonnes of U.S. ethanol landed on Malaysian shores through November of last year - all since June, shortly after China hiked its tax on U.S. shipments. The surge follows years of negligible imports of U.S. ethanol to Malaysia. In turn, Malaysia has exported 69,000 tonnes of ethanol to China, the first time the nation has been an exporter of the fuel in at least three years, according to Chinese import data. Blending U.S. and Asian ethanol for the Chinese market undermines the intent of Beijing’s tariffs and helps struggling American ethanol producers by keeping a path open to a major export market that would otherwise be closed. “Global commodity markets are incredibly creative in finding ways to ensure willing sellers are able to meet the demands of willing buyers,” Geoff Cooper, head of the Renewable Fuels Association, said in a statement to Reuters. The group represents U.S. ethanol producers. In at least two cases examined by Reuters, including that of the High Seas, blending of U.S. ethanol cargoes with other products appeared to have occurred in Malaysia before the cargoes were shipped on to China, according to a Reuters analysis of shipping records and interviews with port officials. Chinese merchants including the state-backed oil company Unipec notified Chinese authorities about the unusual activity last summer - which represented competition they had not anticipated under the tariff scheme, according to two industry sources. Unipec’s parent company Sinopec did not respond to requests for comment. A spokesman for China’s General Administration of Customs declined to comment. Norazman Ayob, deputy secretary general of the Malaysian trade ministry, confirmed that Malaysia exported ethanol to China this year. The ministry was unable to confirm whether it had been mixed with U.S. fuel, he said, but noted such blending would be legal under the ASEAN-China pact. Malaysia has no track record of significant domestic ethanol production, so it is unclear where the ethanol blended with the U.S. product originates. Additional U.S. ethanol has flowed in unusual volumes to other destinations since Trump’s trade war began, including other ASEAN member nations the Philippines and Indonesia, according to shipping and trade data, though Reuters could not confirm its final destination. The High Seas cargo ship was among the first to engage in the rising U.S.-to-Malaysia ethanol trade, according to shipping data from financial information provider Refinitiv and bills of lading from the ports. It loaded 25,000 tonnes of ethanol in Texas City on June 23 and then another 10,000 tonnes in Beaumont on June 27. Some of the ethanol was produced by Green Plains Inc , one of America’s top ethanol producers. Green Plains spokesman Jim Stark confirmed the loading of the company’s product in Beaumont but said it could not confirm the cargo’s ultimate destination. At the time it left Texas, the shipment was owned by units of SOCAR Trading SA, the marketing arm of the State Oil Company of Azerbaijan Republic, according to the bills of lading. The shipment was initially destined for the Philippines. But after it crossed through the Panama Canal and reached the waters near Singapore in mid-August, the High Seas transferred its cargo to the QUDS, another tanker, according to the Refinitiv data. Vincent Mohy, general counsel for SOCAR, said that the firm sold all of the U.S. ethanol at the time of the transfer to the QUDS and that it made clear to the buyer the fuel originated in the United States. Mohy declined to name the buyer. The QUDS landed in the Malaysian port of Kuantan days later and took on another 12,074 tonnes of ethanol before heading to the Chinese port of Zhoushan and emptying its hold by the end of the month, according to the shipping data, a Chinese port official and two Malaysian port officials. According to one of the Kuantan port officials and a source in the Malaysian government, the cargo on the QUDS was sold by Malaysia’s Rich Greenergy Sdn Bhd to China’s Zhanjiang Industry Petrochemical Company Limited. Kelvin Shum, Rich Greenergy’s CEO, declined to comment, saying he had signed a non-disclosure agreement about the deal. Efforts to reach Zhanjiang were not successful. The convoluted voyage was replicated in at least one other case, that of the Maritime Tuntiga. That ship also carried Texas ethanol into Southeast Asia this summer, transferring its cargo into another vessel – the Taibah – near Singapore. Like the QUDS, the Taibah moved on to the port of Kuantan in Malaysia, picked up about 12,000 tonnes more ethanol, and then moved on to Zhoushan, according to the shipping data and the Kuantan port officials. Additional reporting by Dominique Patton, Meng Meng, and
Hallie Gu in Beijing and Michael Hirtzer in Chicago
Editing by Richard Valdmanis and Brian Thevenot",https://uk.reuters.com/article/usa-trade-ethanol/rpt-insight-long-strange-trip-how-u-s-ethanol-reaches-china-tariff-free-idUKL1N202016,07 Feb 2019,"In June, the High
Seas tanker ship loaded up on ethanol in Texas and set off for
Asia.","RPT-INSIGHT-Long, strange trip: How U.S. ethanol reaches China tariff-free"
2019-02-07,"MUMBAI/KOLKATA (Reuters) - India’s Reliance Industries will invest 100 billion rupees ($1.4 billion) in the eastern state of West Bengal, a part of which would fund the company’s new e-commerce venture, its chairman Mukesh Ambani said on Thursday. The energy and telecoms conglomerate, which already runs retail stores, has announced plans to diversify into e-commerce at a time when India’s new foreign investment curbs have dealt a blow to Amazon.com Inc and Walmart’s Flipkart. The investment announcements also come as a boost for the state’s chief minister, Mamata Banerjee, who has in recent weeks rallied regional parties and the main opposition Congress to forge an alliance to beat Prime Minister Narendra Modi in upcoming elections, which must be held by May.   Ambani’s so-called “new commerce” venture aims to connect small merchants with his retail network and warehouses, helping them better manage their inventory. It already has more than 500 retail stores in the state, selling everything from clothes to groceries, and the new plan would “increase manifold” its warehouse space in the next 24 months in West Bengal, he said. The new e-commerce platform “will bring win-win benefits to consumers, retailers and producers” and help 30 million small shopkeepers, Ambani said.  The billionaire businessman has been more vocal about his e-commerce plans after India in December imposed new restrictions on how foreign companies operate in the e-commerce sector. The new rules, which kicked in on Feb. 1, have disrupted product listings on Amazon.com’s India website. Addressing a business summit in West Bengal’s Kolkata city, Ambani also said he plans to expand the reach of his telecom services in the state and swiftly open a data centre which would be “as good as the ones in Silicon Valley”. “There is no area of the economy, governance or life which is untouched by the revolutionary potential of digital technologies,” Ambani said.  ($1 = 71.4050 Indian rupees) Editing by Aditya Kalra",https://uk.reuters.com/article/reliance-investment/ambani-to-invest-1-4-bln-in-indian-state-will-help-e-commerce-expansion-idUKL3N2021MY,07 Feb 2019,"* New initiative to connect shopkeepers with its retail
network","Ambani to invest $1.4 bln in Indian state, will help e-commerce expansion"
