publish_datetime,content,href,publish_timestr,summarize,title
2018-12-10,"LONDON (Reuters) - Global commodity trader Trafigura Group reported its lowest annual net profit in eight years on Monday as a drop in oil trading margins offset a strong performance by its metals and minerals division. Traded volumes at its metals division increased by 37 percent in the financial year that ended on Sept. 30, mainly in coal, which had a “surprisingly strong” year, the company said.  In oil trading, however, Trafigura said the oil structure shift to backwardation, whereby the front month price is higher then the next, compressed margins prompting a “major overhaul” of its books to reduce inventories and storage contracts.  Trafigura’s total earnings before interest, tax, depreciation and amortisation (EBITDA) for the financial year rose 8 percent to $1.7 billion (1.34 billion pounds), from 1.6 billion. Gross profit increased to $2.4 billion, from $2.2 billion a year earlier.  Net profit fell slightly to $873 million from a lacklustre $887 million in 2017 due to low oil volatility, already its lowest since 2010.  Revenues rose to $180.7 billion, from $136.7 billion in its 2017 financial year. Traded oil volumes grew to 5.8 million barrels per day (bpd) from just over 5.3 million bpd the previous year. Liquefied natural gas volumes rose to 9.9 million tonnes from 8.1 million tonnes.      “The largest component of profit was generated by the Metals and Minerals Trading division in one of its best years [...] Oil and Petroleum Products Trading’s contribution to gross profit fell by 10 percent to $1 billion as a result of the switch from the contango to backwardated oil pricing structure,” the Geneva-based company said in a statement.  Earlier this year the company tripled the size of its management committee and promoted Rob Gillon and Ben Luckock to run the oil division as co-heads alongside Executive Director Jose Larocca.  Ahead of new, cleaner shipping fuel rules being introduced by the International Maritime Organization (IMO) in 2020, Trafigura confirmed it had merged its middle distillates and fuel oil trading teams. It also set up a new bunkering team to develop new business as the fuel change is set to unnerve oil markets.  Trafigura’s adjusted debt to group equity fell below 1 from 1.24 as of Sept. 30 2017.  Share buybacks also fell to $528 million from $569 million.  The company is still paying departing founders, including the family of the late Claude Dauphin, but details on who was paid were not disclosed. The cost of capital increased sharply due to rising interest rates globally. Trafigura’s Chief Financial Officer Christopher Salmon said he expected this trend to continue in 2019.  “The sector has entered a period of consolidation around the very largest players – with banks, for example, becoming more selective in allocating liquidity,” Salmon said in the results.  Trafigura made $191 million on divesting a 50 percent stake in its subsidiary Impala Terminals to IFM Investors.  Impairments included $72 million with zinc, lead producer and smelter Nyrstar. Trafigura recently extended a credit facility worth $650 million to help Nyrstar’s debt situation. It also suffered a pretax loss of $57 million following the sale of a 20 percent stake in Buckeye Texas Partners LLC for $210 million.  Reporting By Julia Payne; Editing by Susan Fenton",https://uk.reuters.com/article/trafigura-results/oil-margin-pressure-takes-shine-off-trafiguras-annual-profits-idUKL8N1YE0W6,10 Dec 2018,"* Sets up shipping fuel team to develop business for IMO
2020",Oil margin pressure takes shine off Trafigura's annual profits
2018-12-10,"BAGHDAD, Dec 10 (Reuters) - Iraqi Oil Minister Thamer Ghadhban said on Monday he expected the fall in oil prices to stop and for prices to rise over time, adding that if OPEC had not cut production, prices would have reached $45-50 per barrel. Speaking at a ministry event in Baghdad, Ghadhban said the recent fall in Iraqi exports was not due to technical reasons, as Iraqi oil fields have high capacity, but rather because of weather conditions. (Reporting by Moayed Kenany; Writing by Ahmed Aboulenein; Editing by Mark Potter)",https://uk.reuters.com/article/iraq-oil/iraqi-oil-minister-expects-prices-to-rise-over-time-idUKB2N1SF02G,10 Dec 2018,"Iraqi Oil Minister Thamer
Ghadhban said on Monday he expected the fall in oil prices to
stop and for prices to rise over time, adding that if OPEC had
not cut production, prices would have reached $45-50 per barrel.",Iraqi oil minister expects prices to rise over time
2018-12-10,"SEOUL, Dec 10 (Reuters) - South Korean prosecutors have charged four people with illegally importing millions of dollars worth of North Korean coal in violation of international sanctions, by trying to disguise it as imports from Russia, a prosecutors’ office said on Monday. South Korea’s customs agency found in August that some firms had imported coal from North Korea in violation of U.N. resolutions aimed at choking off funding for its nuclear and ballistic missile programmes. The unidentified defendants were charged on Friday with bringing in North Korean coal and other material by “laundering the origin” through fake certificates of origin from Russian ports, after the old route for North Korean coal, through China, was blocked due to sanctions, the Daegu District Public Prosecutors Office said in a statement. “It appears that the defendants wanted profit from arbitrage, using the fact that the prices of North Korean coal and other materials are low due to their difficulty to be traded internationally,” the office said. One of the four, a 44-year-old woman, was arrested for bringing in some 28,962 tonnes of coal and 2,010 tonnes of pig iron from North Korea, worth about 4.3 billion won ($3.83 million) and 1.1 billion won respectively, between April-October 2017, the office said. South Korea’s Inter-Korean Exchange and Cooperation Act prohibits the import of North Korean products without special approval from the minister of unification. The woman was also charged with violating customs law by bringing in some 4,156 tonnes of coal briquettes from North Korea, worth about 800 million won, by falsifying customs records to say they were semi coke, the office said. The other three people, who are indicted without arrest, were found to have brought in, or abetted the import of, millions of dollars worth of North Korean coal, pig iron and, or, coal briquettes during that time, the office said. The U.N. Security Council banned North Korea’s sale of coal, iron, iron ore, lead, lead ore and seafood in August last year in a bid to cut by a third its $3 billion annual export income. It also capped North Korea’s import of crude oil and refined petroleum products in September. The United States has led the sanctions campaign to press North Korea to give up its nuclear and missile programmes, but there have been signs that the U.S. campaign for “maximum pressure” has lost steam since North Korea sought to improve relations with South Korea, China, and the United States. U.S. President Donald Trump met North Korean leader Kim Jong Un for an unprecedented summit in Singapore in June to discuss North Korea’s denuclearisation and the easing sanctions. . Trump said this month he expected to met Kim again in January or February. ($1 = 1,124.0000 won) (Reporting by Joyce Lee Editing by Robert Birsel)",https://uk.reuters.com/article/northkorea-southkorea-coal/s-korean-prosecutors-indict-four-for-importing-north-korean-coal-idUKL3N1YF2QS,10 Dec 2018,"South Korean prosecutors have
charged four people with illegally importing millions of dollars
worth of North Korean coal in violation of international
sanctions, by trying to disguise it as imports from Russia, a
prosecutors' office said on Monday.",S.Korean prosecutors indict four for importing North Korean coal
2018-12-10,,https://uk.reuters.com/article/malaysia-palmoil-mpob/update-2-malaysias-nov-palm-oil-inventories-climb-to-highest-in-nearly-two-decades-idUKL3N1YF210,10 Dec 2018,"Malaysia's palm oil stockpiles
at the end of November rose above 3 million tonnes as a steep
decline in exports boosted reserves, official data showed on
Monday.
    Palm oil stocks last month rose 10.5 percent from October to
3.007 million tonnes, industry regulator the Malaysian Palm Oil
Board (MPOB) said. The stockpiles are at the highest in at least
18 years, according to Refinitiv data going back that far
<",UPDATE 2-Malaysia's Nov palm oil inventories climb to highest in nearly two decades
2018-12-10,"LONDON, Dec 10 (Reuters) - Liquefied natural gas (LNG) tanker Seri Cemar is set to arrive at Britain’s Isle of Grain terminal on Dec. 11, according to Refinitiv Eikon shipping data. The tanker, with a capacity of 150,000 cubic metres, is coming from the U.S. LNG terminal Cove Point in Maryland. (Reporting by Sabina Zawadzki; Editing by Mark Potter)",https://uk.reuters.com/article/lng-britain-arrival/lng-tanker-seri-camar-to-arrive-in-britain-on-dec-11-idUKL8N1YF16C,10 Dec 2018,"Liquefied natural gas (LNG)
tanker Seri Cemar is set to arrive at Britain's Isle of Grain
terminal on Dec. 11, according to Refinitiv Eikon shipping data.",LNG tanker Seri Camar to arrive in Britain on Dec. 11
2018-12-10,"PARIS, Dec 10 (Reuters) - Violent protests in France over the last month will cost the country’s economy 0.1 percentage points in the final quarter, French Finance Minister Bruno Le Maire told RTL radio on Monday. President Emmanuel Macron will address the country later in the day as he seeks to placate “yellow vest” anti-government protesters who wreaked havoc in Paris this weekend. (Reporting by Richard Lough; editing by Sudip Kar-Gupta)",https://uk.reuters.com/article/france-protests-economy/french-protests-will-cut-q4-gdp-growth-by-0-1-points-le-maire-idUKP6N1VQ01N,10 Dec 2018,"Violent protests in France over
the last month will cost the country's economy 0.1 percentage
points in the final quarter, French Finance Minister Bruno Le
Maire told RTL radio on Monday.",French protests will cut Q4 GDP growth by 0.1 points - Le Maire
2018-12-10,"TOKYO (Reuters) - Hitachi Ltd (6501.T) shares rose as much as 2.9 percent on Monday after Japan’s TV Asahi reported the firm is considering scrapping its 3 trillion yen ($26.61 billion) nuclear project in Britain due to projections of further increases in construction costs. Hitachi’s Horizon Nuclear Power plans to build over 5 gigawatts of new nuclear capacity at two sites in Britain – the first at Wylfa Newydd in Wales. The project will be discussed at Hitachi’s board meeting on Tuesday, and a conclusion is likely to be made by the end of the business year through March, TV Asahi reported. Giving up the project would incur Hitachi a 270 billion yen loss, it said. A Hitachi spokesman declined to comment on the report when contacted by Reuters. Hitachi shares ended up 1 percent at 3,254 yen, compared with a 2.1 percent decline in the Nikkei share average .N225. Reporting by Hideyuki Sano and Daiki Iga; Editing by Stephen Coates and Christopher Cushing",https://uk.reuters.com/article/hitachi-nuclear/update-1-hitachi-shares-rise-after-report-it-is-considering-scrapping-britain-nuclear-project-idUKL3N1YF2B0,10 Dec 2018,"Hitachi Ltd shares rose
as much as 2.9 percent on Monday after Japan's TV Asahi reported
the firm is considering scrapping its 3 trillion yen ($26.61
billion) nuclear project in Britain due to projections of
further increases in construction costs.",UPDATE 1-Hitachi shares rise after report it is considering scrapping Britain nuclear project
2018-12-10,"NEW DELHI, Dec 10 (Reuters) - Top Indian gas importer Petronet LNG is looking to sign a deal in a year’s time to buy at least 1 million tonnes of U.S. natural gas annually for a period of up to 10 years, as it pushes to diversify its supply sources beyond the Middle East. As part of any deal, the firm could potentially take a stake in a U.S. liquefied natural gas (LNG) project, said Petronet’s managing director, Prabhat Singh. “The U.S. market is open compared to other markets where the state is (often) the controller of minerals,” Singh told Reuters late last week. “The U.S. offers lots of opportunities and we would like to explore that properly and make a venture (there),” he said. Petronet currently runs a 15 million tonnes per annum (mtpa) liquefied natural gas (LNG) regasification site at Dahej in the western state of Gujarat and a 5 mtpa plant at Kochi in southern India. It has long-term deals to buy 10 mtpa of LNG, with 8.5 mtpa of that coming from Qatar’s RasGas. Singh said Petronet was in talks with various companies including Tellurian Inc about a potential U.S. deal. Singh had said in November that Petronet and ONGC Videsh were jointly in talks to buy a stake in Tellurian’s proposed Driftwood project in Louisiana. “If the pricing is right then India has appetite for huge volumes,” he said last week. Natural gas accounts for about 6.5 percent of India’s overall energy needs, far lower than the global average. The government wants to lift that to 15 percent in the next few years. “The U.S. market is so developed that niche service providers are available on a shoestring budget, which means less overheads,” Singh said. A glut of natural gas in the United States in the wake of the rapid development of shale fields there has kept benchmark U.S. prices for LNG at almost half Asian levels. Meanwhile, Singh said Petronet was also in talks to invest in exploration and LNG projects in Qatar, as well as continuing to scout for opportunities in Bangladesh and Sri Lanka. Australia overtook Qatar as the world’s largest exporter of LNG for the first time in November, data from Refinitiv Eikon showed on Monday. Reporting by Nidhi Verma
Editing by Joseph Radford",https://uk.reuters.com/article/india-petronet/indias-petronet-looking-for-long-term-deal-to-buy-u-s-lng-idUKL4N1YC3RS,10 Dec 2018,"Top Indian gas importer
Petronet LNG is looking to sign a deal in a year's
time to buy at least 1 million tonnes of U.S. natural gas
annually for a period of up to 10 years, as it pushes to
diversify its supply sources beyond the Middle East.",India's Petronet looking for long-term deal to buy U.S. LNG
2018-12-10,"* MSCI Asia-Pacific index down 1.5 pct, Nikkei sheds 2.1 pct * European stocks expected to open significantly lower * Latest flare-up in US-China trade tensions take toll * Dollar drops broadly after soft US jobs data * Graphic: World FX rates in 2018 tmsnrt.rs/2egbfVh By Shinichi Saoshiro TOKYO, Dec 10 (Reuters) - Losses in global stock markets snowballed on Monday, with U.S. equity futures and Asian shares sliding on worries over slowing growth and fears that a rise in tensions between Washington and Beijing could torpedo chances of a trade deal. Spreadbetters expected European stocks to follow, with Britain’s FTSE seen dropping 0.7 percent, Germany’s DAX 1.1 percent and France’s CAC 1 percent. Traders returned from the weekend to face a growing wall of worry, with the world’s largest economies — the United States, China and Japan — all reporting weaker-than-expected data which pointed to moderating activity. Investors were also bracing for a Tuesday vote on British Prime Minister Theresa May’s European Union divorce deal, which looks set to be rejected by parliament, raising fears of a chaotic exit in March. S&P futures and Dow futures both fell 0.7 percent, suggesting more pressure on Wall Street later in the session as investors continue to dump riskier assets. MSCI’s broadest index of Asia-Pacific shares outside Japan slid 1.5 percent to a near three-week low. The Shanghai Composite Index retreated 0.6 percent. Australian stocks lost 2.2 percent, brushing the lowest level since December 2016, and South Korea’s KOSPI fell 1 percent. Japan’s Nikkei shed 2.1 percent. Data early in the session showed the economy contracted the most in over four years in the third quarter as companies cut capital spending amid uncertainty over global demand and trade tensions. U.S.-China trade negotiations need to reach a successful end by March 1 or Washington will impose new tariffs, U.S. Trade Representative Robert Lighthizer said on Sunday, clarifying that there is a “hard deadline” after a week of seeming confusion among President Donald Trump and his advisers. Markets were already reeling from news last week that Canadian officials had arrested the chief financial officer of Chinese smartphone maker Huawei for extradition to the United States. The arrest could throw up another hurdle to the resolution of a trade war between the world’s top two economies. Wall Street’s main indexes fell more than 2 percent on Friday in a broad sell-off, posting their largest weekly percentage drops since March. “The biggest concerns for equity markets currently is the U.S.-China trade conflict and the Huawei incident,” said Soichiro Monji, senior economist at Daiwa SB Investments in Tokyo. “The trade theme will preoccupy the markets through the 90-day truce period between the United States and China, waiting for any signs of concession between the parties.” Trump and Chinese President Xi Jinping early this month agreed to a temporary truce that delayed a planned Jan. 1. U.S. tariff hike while the two sides negotiate. “Eventually, because it is in both party’s interests, I think some deal will be struck but the process, I suspect, will have many hills and valleys that will impact the markets,” said Mark Grant, chief global strategist at B. Riley FBR Inc in Florida. While U.S. officials say the Huawei arrest was a legal matter and not linked to the trade dispute, the move is expected to complicate trade talks. “Even though President Trump said the incident will not derail the talks, the markets should not underestimate the nationalism hype which may create the hurdle for China to make concessions,” wrote strategists at OCBC Bank. The dollar was on the backfoot after Friday’s soft U.S. jobs report raised worries that economic growth has peaked and the Federal Reserve may pause its rate tightening cycle sooner than previously thought. On Friday, the U.S. Labor Department said public and private employers hired 155,000 workers in November, fewer than the 200,000 forecast by economists polled by Reuters, while the jobless rate held at a 49-year low of 3.7 percent. The dollar was down 0.3 percent at 112.42 yen and the euro added 0.5 percent to $1.1437. The dollar index against a basket of six major currencies dipped 0.1 percent to 96.424. Dollar weakness helped lift the pound 0.2 percent to $1.2752 , despite the looming Brexit vote in parliament. It had lost 0.5 percent on Friday. The Chinese yuan dipped following weak trade and inflation data over the weekend that added to worries about its slowing economy. China reported far weaker than expected November exports and imports, underscoring faltering global and domestic demand. The downbeat reading reinforced views that Beijing will have to roll out more support and stimulus soon to keep the economy from cooling too fast. Oil prices rose, extending gains from Friday when producer club OPEC and some non-affiliated producers agreed a supply cut of 1.2 million barrels per day (bpd) from January. Brent crude rose 0.6 percent to $62.01 per barrel. (Additional reporting by Jennifer Ablan in New York Editing by Shri Navaratnam and Kim Coghill)",https://uk.reuters.com/article/global-markets/global-markets-global-stocks-extend-slump-as-growth-worries-mount-idUKL3N1YF2B5,10 Dec 2018,"Losses in global stock markets
snowballed on Monday, with U.S. equity futures and Asian shares
sliding on worries over slowing growth and fears that a rise in
tensions between Washington and Beijing could torpedo chances of
a trade deal.
Spreadbetters expected European stocks to follow, with
Britain's FTSE seen dropping 0.7 percent, Germany's DAX
1.1 percent and France's CAC 1 percent.",GLOBAL MARKETS-Global stocks extend slump as  growth worries mount
2018-12-10,"* reuters://realtime/verb=Open/url=cpurl://apps.cp./Apps/econ-polls?RIC=INCPIY%3DECI retail inflation poll data * reuters://realtime/verb=Open/url=cpurl://apps.cp./Apps/econ-polls?RIC=INWPI%3DECI wholesale inflation poll data * reuters://realtime/verb=Open/url=cpurl://apps.cp./Apps/econ-polls?RIC=INIP%3DECI industrial output poll data * October industrial output data due at 1130 GMT on Wed, Dec 12 * November CPI data due at 1200 GMT on Wed, Dec 12 By Anisha Sheth BENGALURU, Dec 10 (Reuters) - Indian inflation is likely to have cooled to a 16-month low in November, according to a Reuters poll, as food and fuel prices fell, supporting the Reserve Bank of India’s decision to keep interest rates on hold at a policy meeting last week. The poll of 40 economists predicted retail inflation sank in November to 2.80 percent from October’s 3.31 percent. Forecasts in the poll, taken between Dec. 4-7, ranged between 2.26 percent and 4.00 percent. If the consensus is realised, the November data will not only mark inflation below the RBI’s medium-term target of 4 percent for a fourth straight month but also be the first time since July 2017 it was below 3 percent. “We expect headline CPI inflation to have slowed...during November in a broad-based manner. Food prices are likely to have continued to remain benign. Transportation costs are also estimated to have softened due to a fall in global crude oil prices,” said Shashank Mendiratta, India economist at ANZ. “Core inflation should have moderated alongside, reflecting easing demand-side pressures in the economy. The softer headline CPI print should provide comfort to the central bank.” Asia’s third-largest economy is slowing, dragged down by lower consumer spending and farm growth and that should also remove any pressure for an increase in interest rates. With energy and food prices, which account for a major chunk of India’s consumer price index basket, falling sharply, the trend of relatively stable inflation over the past two years is expected to continue. While falling food costs is good news for consumers, plunging prices of some vegetables, in a country with a chronic supply problem that is often exacerbated by unpredictable monsoons, is adding to the woes of farmers. The crash in farm prices led to tens of thousands of farmers protesting in the national capital last month, likely worrying for a government going to the polls in six months. Farm prices could rise if the government steps in to buy crops at higher prices, known as minimum support price (MSP), something economists had said could be inflationary. “The upside risk related to MSP has not materialized as anticipated,” said Tushar Arora, economist at HDFC Bank. Food inflation has eased recently, helped by bountiful crop supplies and sales of subsidised foodgrain to nearly two-thirds of India’s 1.3 billion population. “It is food prices that moves the needle on inflation,” said Arjun Nagarajan, economist at SBICAP Securities. “What we don’t know, is whether the demand slack is the dominant variable that is bringing food inflation down, or whether the supply glut is the dominant variable that is bringing it down. For now, it seems that the supply glut is the more dominant variable that is bringing the prices down.” Separately, the poll showed industrial output rose at an annual 5.7 percent pace in October, up from September’s 4.5 percent. It was boosted by infrastructure production - the output at eight core industries - which rose 4.8 percent from a year ago. (Polling by Khushboo Mittal and Anisha Sheth Editing by Jonathan Cable & Simon Cameron-Moore)",https://uk.reuters.com/article/india-economy-inflation/poll-india-inflation-likely-eased-in-nov-to-16-mth-low-idUKL4N1YC32W,10 Dec 2018,"* reuters://realtime/verb=Open/url=cpurl://apps.cp./Apps/econ-polls?RIC=INCPIY%3DECI
retail inflation poll data",POLL-India inflation likely eased in Nov to 16-mth low
