publish_datetime,content,href,publish_timestr,summarize,title
2018-12-10,"* Athens wants deadline extended to Jan. 7 - source * PPC selling 3 plants and a licence to build a new one * Athens wants coal-fired plants divestment wrapped up by Jan. 15 By Angeliki Koutantou ATHENS, Dec 10 (Reuters) - The European Commission has informally allowed Greece’s Public Power Corp. (PPC) to extend the deadline for binding bids for three coal-fired plants by three weeks, an energy ministry source said on Monday. Greece agreed to sell the plants under its latest international bailout, which ended in August. The source said potential bidders and advisors had requested that the deadline be delayed until after the Christmas holiday period to give them more time. PPC, which is 51 percent state-owned, has shortlisted all six investors interested in buying Meliti I and two other plants in Megalopoli on the Peloponnese peninsula, as well as a licence to build a new plant, Meliti II, in northern Greece. The deadline for the final bids had been set at Dec. 15, and it is not known if all six will submit bids. An energy ministry official told Reuters on condition of anonymity that Greece has sought EU Commission approval for the binding bids to be submitted by Jan. 7 and for any improved offers by Jan. 10. It aims to have concluded the divestment process by Jan. 15. The Commission has informally approved the request, the official said, and Athens is now waiting for official confirmation of the extension in writing. The EU Commission and PPC were not immediately available for comment. The tender is organised by PPC and overseen by the Commission, after a European court ruled that PPC had abused its dominant position in the coal market. The official said that a final round of talks between the EU Commission and investors on the terms of the sale would start on Monday. Another source close to the matter said that issues on the table would include a mechanism that would allow PPC and the new owner to share any profit or loss from the plants for a set period of time. Reporting by Angeliki Koutantou; Editing by Susan Fenton",https://uk.reuters.com/article/public-power-sale/greece-gets-informal-eu-approval-to-push-back-sale-of-coal-fired-plants-source-idUKL8N1YF2B1,10 Dec 2018,"* Athens wants coal-fired plants divestment wrapped up by
Jan. 15",Greece gets informal EU approval to push back sale of coal-fired plants -source
2018-12-10,"* Q4 GDP growth seen at 0.2 pct from 0.4 pct * Macron to address nation at 1900 GMT * Concessions from Macron would likely raise deficit * Graphic: impact of unrest on stocks tmsnrt.rs/2RDxLXu * Graphic: impact of unrest on French-German bond spread (Adds Printemps sales fall, analyst, graphic) By Richard Lough PARIS, Dec 10 (Reuters) - The anti-government protests convulsing France will slow growth to close to a standstill in the final quarter, the central bank said on Monday, complicating President Emmanuel Macron’s task of finding concessions to placate the “yellow vest” movement. The Bank of France on Monday forecast the euro zone’s number two economy would eke out growth of only 0.2 percent in the quarter from the previous three months, down from 0.4 percent in a previous estimate. Finance Minister Bruno Le Maire declined to give an estimate for 2018 growth but forecast the nationwide tumult would trim 0.1 percent of a point off of national output. His deputy projected growth would round out “closer to 1.5 percent”. The slow-down will be worrisome for Macron, who faces huge pressure on the streets to make further cuts to taxes and social security costs to bolster household spending power, while keeping France’s budget deficit below a European Union cap. The slowdown is a “reality for our businessmen, entrepreneurs, it’s the reality for those whose shops were vandalised, looted, in the most violent way,” Le Maire told RTL. “And it’s a reality too for our foreign investors.” Police used tear gas, water canon and horses to charge protesters hurling projectiles, torching cars and ransacking some shops, though they encountered less violence than the previous Saturday, when the capital encountered its worst violence since the 1968 student uprising. Upscale department store Printemps, which shut its flagship store in Paris on Saturday, typically one of the busiest days of the year ahead of Christmas, said it had suffered a 25 to 30 percent slump in sales since the unrest began. “There has been a colossal loss in sales and they won’t be recouped,” Pierre Pelarrey, who runs Printemps Haussmann, told Reuters. Nationwide, shopping centres saw a 17 fall in people passing through the doors, the CNCC grouping of mall operators said. In a sign of the perceived heightened risk of holding French debt, French government bond yields rose on Monday, pushing the French/German 10-year bond spread to its widest since May, at around 46 basis points in early trade. On the Paris bourse, airport operator ADP fell 0.8, while retailers Casino and FNAC Darty also headed south. Hotels company Accor initially traded down 0.7 percent before paring losses. Macron addresses the nation on Monday evening. The president has drawn criticism for his silence in public over the violence in Paris - opponents accuse him of turning the Elysee Palace into a bunker. Ministers hope he will placate the yellow vests, whose revolt poses the most formidable challenge to his 18-month administration to date. “Our country is deeply divided, between those who see that globalisation has benefited them and others who can’t make ends meet, who say ... globalisation is not an opportunity but a threat,” Le Maire told RTL. “It is the president’s role to unify the country.” The protests were born out of a backlash against the squeeze on the household budgets of hard-pressed middle class and blue-collar workers. But the movement has developed into a broader anti-Macron rebellion. The former investment banker is under pressure to respond to the demands of yellow vests for a higher minimum wage, lower taxes, and better retirement provisions, though more concessions will leave France in danger of breaching EU deficit rules. “The big picture is that the budget deficit will worsen and political problems will make cuts to spending hard,” said Rabobank rates strategist Lyn Graham-Taylor. The government’s latest estimates are for a budget deficit of 2.8 percent in 2019, just below the EU’s 3 percent cap - a target Macron has cast as critical to meet to cement his reformist credentials. Le Maire reiterated his desire to accelerate tax cuts but suggested he was not in favour of reinstating a tax on wealth — known as the ‘ISF’ — that Macron narrowed when he came into office, and which earned him the tag “president of the rich”. “Does the ISF help reduce poverty, reduce our debts, reduce public spending? No. If you want to hunt for money, go knocking on the doors of digital tech companies,” Le Maire said. Reporting by Richard Lough; additional reporting by Leigh
Thomasin Paris and Dhara Ranasinghe in London, Editing by Angus
MacSwan, Richard Balmforth",https://uk.reuters.com/article/france-protests-economy/update-3-yellow-vest-protests-stunt-french-growth-macron-under-pressure-idUKL8N1YF136,10 Dec 2018,* Graphic: impact of unrest on stocks https://tmsnrt.rs/2RDxLXu,"UPDATE 3-'Yellow vest' protests stunt French growth, Macron under pressure"
2018-12-10,"(Repeats with no changes to text. The opinions expressed here are those of the author, a columnist for Reuters.) By Clyde Russell LAUNCESTON, Australia, Dec 10 (Reuters) - The key concept in the wake of the decision to reduce crude oil output by OPEC and its allies is “balance”. It’s something everybody in the market says they want, but they all have different ideas of what it means and how to get there. Boiled down to the basics, both the Organization of the Petroleum Exporting Countries and the other producers, most notably Russia, are trying to do with the move to cut output by 1.2 million barrels per day (bpd) is achieve their vision of a balanced market. While what this means is not exactly spelled out in unambiguous terms, it’s assumed to mean that they want an oil price they believe to be “fair” and one that will allow them to meet their fiscal obligations as well as ensuring sufficient incentive for capital spending to maintain future output. What this means for the price of crude oil is less than certain, although it’s likely that OPEC and its allies will take the view that the $60.06 a barrel that Brent crude closed at the day before the Dec. 7 output deal was reached is too low. But it’s also apparent that in the current climate an oil price above $80 a barrel will result in fairly rapid demand destruction and rising output from producers outside the OPEC orbit. Brent reached a four-year high of $86.74 a barrel on Oct. 3, but a mere eight weeks later it had shed almost 34 percent of its value, hitting a trough of $57.50 on Nov. 28, the lowest level in a year. It’s that rapid plunge that led OPEC and its allies to conclude that the market was no longer in balance, and that output needed to be cut to return to the desired, but elusive, state. The market will now get to deliver its verdict on whether OPEC has once again baked a magic pudding that will allow crude prices to rise, but not so high that demand is threatened. The initial price action after the announcement of the deal was mildly positive for OPEC, with Brent jumping as much as $3.67 to $63.73 a barrel during trade on Dec. 7, but eventually it closed at $61.67, up 2.7 percent from the previous day. The nirvana of balance also means that OPEC, and in particular its largest producer and de facto leader Saudi Arabia, have to walk a series of political tightropes. The obvious one is also the most public, U.S. President Donald Trump, who is often criticised for changing his mind on issues, but has been remarkably consistent on one front, namely his desire for lower oil prices. It’s perhaps no surprise that Saudi Energy Minister Khalid al-Falih singled out U.S. energy companies as winners from the OPEC and allies deal, telling reporters at the meeting in Vienna on Dec. 7 that they were “breathing a sigh of relief”. This was perhaps a not-so-subtle attempt to stave off a blast from Trump on his favoured social media platform Twitter, by reminding him that the powerful U.S. energy lobby is no friend of his push for ever lower oil prices. The Saudis also have to manage their relationship with the United States carefully in the wake of the murder of Saudi dissident journalist Jamal Khashoggi at the kingdom’s consulate in October. Trump has said he is not convinced the Saudi crown prince ordered the murder, even as leaders of his own Republican Party make noises about imposing stiff sanctions on Saudi Arabia for the killing. A further complicating factor is Iran, which is exempt from the new output-cutting deal, and in theory living on borrowed time given the U.S. waivers on its oil exports are due to expire on April. Given the plethora of competing factors and influences, it would seem balance will be a difficult, if not impossible task in the crude oil market. But how will the success of this latest production cut be measured? If crude remains in a range between $60 and $80 a barrel in the run up to the expiry of the Iran export waivers, then it might be fair to argue that OPEC and its allies will have achieved what they wanted - a floor and a ceiling that everybody can live with. Editing by Joseph Radford",https://uk.reuters.com/article/column-russell-crude-opec/rpt-column-opec-and-its-allies-seek-the-nirvana-of-crude-oil-balance-russell-idUKL3N1YF1JG,10 Dec 2018,"The key concept in
the wake of the decision to reduce crude oil output by OPEC and
its allies is ""balance"". It's something everybody in the market
says they want, but they all have different ideas of what it
means and how to get there.","RPT-COLUMN-OPEC and its allies seek the nirvana of crude oil ""balance"": Russell"
2018-12-10,"DUBAI, Dec 10 (Reuters) - Saudi Arabia’s energy minister Khalid al-Falih said in a tweet he discussed the state of the oil market with U.S. Energy Secretary Rick Perry on Monday in Dhahran, Saudi Arabia. They also discussed technical cooperation, he added. (Reporting by Nafisa Eltahir; Editing by Mark Potter)",https://uk.reuters.com/article/oil-saudi-usa/saudi-energy-minister-says-he-discussed-oil-market-with-u-s-counterpart-idUKB2N1Y301S,10 Dec 2018,"Saudi Arabia's energy minister
Khalid al-Falih said in a tweet he discussed the state of the
oil market with U.S. Energy Secretary Rick Perry on Monday in
Dhahran, Saudi Arabia.",Saudi energy minister says he discussed oil market with U.S. counterpart
2018-12-10,"(Updates with Saudi Arabia, Polish presidency statements) KATOWICE, Poland, Dec 10 (Reuters) - Talks billed as the most important U.N. conference since the Paris 2015 deal on climate change began the crucial final week in the Polish city of Katowice, capital of the country’s Silesian coal mining district. The aim of the gathering is to meet an end-of-year deadline for agreeing a rule book on how to enforce action to limit further warming of the planet. Subscribers to Eikon can also find a Take-A-Look summary of Reuters coverage here: Below is a flavour of the mood around the event, held in a sprawl of temporary passageways and meeting rooms next to the “Spodek”, a flying-saucer-shaped sports and concert venue. Saudi Arabia issued a statement saying it recognised the efforts of the United Nations’ Intergovernmental Panel on Climate Change (IPCC) in producing scientific reports, the latest of which was published in October assessing the feasibility and importance of limiting warming to 1.5 degrees Celsius. However, it said there were gaps and uncertainties in the report which still needed further research. “The Kingdom of Saudi Arabia is hopeful that the IPCC 6th Assessment Report will address these gaps and challenges, and that a consensus to welcome it among all parties can be reached,” it said in a statement. On Saturday, parties failed to reach an agreement on whether to “note” or “welcome” the U.N. IPCC report published in October. Saudi Arabia, Russia, the United States and Kuwait were against welcoming the report and reference to the IPCC report was removed. Ministers from around 120 countries started to arrive at the conference and faced the task of breaking deadlocks and divisions to achieve the political compromises needed by the end of the week. The Polish presidency of the talks said a “significant amount of work” needed to be done to finish work on the rule book. If this outstanding work was not concluded by Tuesday, it would not be possible to conclude that by Friday, it said in a statement. Campaigners in Katowice said another weekend of the violent “yellow vests” protests in France showed why a just transition is needed when shaping energy transition policy. “When you look at the demands from the protests in France, it is not pitting climate policy against economic and social policy. It is saying (that) we need to respond to the anxieties people are feeling, the fear people are feeling,” said Camilla Born, senior policy advisor at E3G, a non-governmental organisation. French President Emmanuel Macron will address the country on Monday as he seeks to placate “yellow vest” anti-government protesters who wreaked havoc in Paris this weekend. A side event supported by the U.S. administration on Monday afternoon called “Innovative Technologies Spur Economic Dynamism” has been criticised by environmental groups and many countries. “Since taking office, this administration has proposed to roll back measures to cut methane leaks from oil and gas operations, made it easier for companies to dump coal ash into drinking water, and just days ago proposed easing carbon pollution rules for new coal-fired power plants,” said Dan Lashof, director, World Resources Institute US. “This sideshow in Poland would be laughable if the consequences of climate change weren’t so deadly serious,” he added. The event will feature Wells Griffith, senior director for energy at the National Security Council and Steve Winberg, assistant secretary at the department of energy. “Presentations at the event will show how innovation and investment have led to dramatically lower technology costs, reductions in all types of emissions, greater competitiveness, and access to affordable, modern energy services,” said a senior U.S. administration official. Reporting by Nina Chestney, Bate Felix and Agnieszka Barteczko
Editing by Matthew Mpoke Bigg and Susan Fenton",https://uk.reuters.com/article/climate-change-notebook/katowice-cop24-notebook-gaps-remain-in-climate-science-report-for-saudis-idUKL8N1YF321,10 Dec 2018,"Talks billed as the
most important U.N. conference since the Paris 2015 deal on
climate change began the crucial final week in the Polish city
of Katowice, capital of the country's Silesian coal mining
district.",Katowice COP24 Notebook: gaps remain in climate science report for Saudis
2018-12-10,"* US-China trade tensions flare again * European stocks open lower * Dollar drops after soft US jobs data * Graphic: World FX rates in 2018 tmsnrt.rs/2egbfVh (Updates prices) By Sujata Rao LONDON, Dec 10 (Reuters) - Losses on global stocks snowballed on Monday, with Wall Street set to follow Europe and Asia lower as fresh signs emerged that the U.S.-China trade spat was taking a deeper toll on world economic growth. Data from the world’s biggest economies — the United States, China, Japan and Germany — have all disappointed investors in recent days, and doubts are growing that Washington and Beijing will reach agreement before a 90-day trade ceasefire expires. Markets are also on edge after reports that the British parliament’s crucial vote on Prime Minister Theresa May’s Brexit deal will be delayed, sending sterling and UK stocks lower. “Another day, another reason to sell risk. Equity markets remain in a world of pain with everyone in search of a very elusive silver lining,” said Stephen Innes at brokerage OANDA MSCI’s all-country index has spent four weeks in the red, despite intermittent rallies fuelled by hopes of trade war detente. The index slipped 0.5 percent, while a pan-European index fell 0.7 percent by 1200 GMT. U.S. equity futures   were down 0.3 percent, suggesting more pressure on Wall Street later in the session. Last week’s arrest of the chief financial officer of Chinese smartphone maker Huawei for extradition to the United States was seen as putting up another hurdle to the resolution of a trade war between the world’s two biggest economies. U.S. trade representative Robert Lighthizer said Sunday there was a “hard deadline” to the 90-day trade ceasefire and without a successful end to talks by March 1, Washington would impose new tariffs on Chinese goods. “The trade theme will preoccupy the markets through the 90-day truce period between the United States and China, waiting for any signs of concession between the parties,” said Soichiro Monji, senior economist at Daiwa SB Investments in Tokyo. Following weak trade and inflation data on the weekend, China also posted far weaker-than-expected November exports and imports, reinforcing expectations Beijing will roll out more stimulus to prevent the economy cooling too fast. However, the yuan sagged to a one-week low after the weak data. “(The data) would suggest China woes go well beyond U.S. tariffs, given that China trade surplus to the U.S. was at a record level. One can only imagine the impact on China terms of trade if the U.S. follows through with a 25 percent tariff,” Innes of OANDA said. Japan posted the worst contraction in over four years in the third quarter as uncertainty over global demand and trade saw companies slashing capital spending. MSCI’s index of Asian equities outside Japan earlier slid to near three-week lows, Shanghai shares retreated 0.8 percent and Japan’s Nikkei shed 2.1 percent. Emerging-market stocks lost 1.5 percent. Asia’s data came after investors were spooked last week by below-forecast industrial output numbers in Germany and U.S. jobs data showing employers hired fewer workers than expected in November. The slowdown signs also have pummelled oil prices, which have slumped around 30 percent since early October. Brent futures fell 1.5 percent to $60.7 a barrel, reversing earlier modest gains triggered by a supply cut from OPEC and some non-affiliated producers. European investors were keeping their eyes on events in Britain and France. Sterling slumped to the lowest since June 2017 versus the dollar, after the BBC’s political editor quoted cabinet sources said May was pulling the vote, scheduled for Tuesday. Sterling slid half a percent to $1.2656 and extended losses versus the euro, trading down 0.7 percent at 90.18 pence - its weakest since early-September. Britain’s FTSE 250 equity index, sensitive to local economic developments tumbled 1 percent and investors scurried to buy British government bonds, with yields dropping five to seven basis points on the day. “There is still room for short-term political risk premium to be priced into pound which is currently worth of 2 percent based on our models. The downside to sterling is hence very clear,” ING Bank analysts told clients. The dollar inched off two-week lows against a basket of currencies, including sterling. Last week, the dollar posted its worst performance since August after the lacklustre jobs data convinced many that U.S. growth has peaked and the Federal Reserve will pause its rate tightening sooner than previously thought. French assets also came under pressure, with hotel and retail stocks suffering the fallout of four weekends of anti-government riots, which the finance minister said could curb economic growth by 0.1 percentage point. The yield premium investors demand to hold French bonds over German peers rose to the highest since May, before a 1900 GMT televised address by President Emmanuel Macron. Macron has been forced to row back on fuel tax increases and investors fear further concessions to placate protestors . Additional reporting by Shinichi Saoshiro in Tokyo, editing by
Larry King",https://uk.reuters.com/article/global-markets/global-markets-stock-selloff-snowballs-as-investors-price-in-slowing-world-economy-idUKL8N1YF2WN,10 Dec 2018,"* Graphic: World FX rates in 2018 http://tmsnrt.rs/2egbfVh
(Updates prices)",GLOBAL MARKETS-Stock selloff snowballs as investors price in slowing world economy
