publish_datetime,content,href,publish_timestr,summarize,title
2018-11-20,"(Repeats earlier story for wider readership with no change to text. The opinions expressed here are those of the author, a columnist for Reuters.) By Clyde Russell LAUNCESTON, Australia, Nov 20 (Reuters) - U.S. coal exporters have effectively lost a promising market in China since the imposition of tariffs as part of the ongoing trade dispute, but so far they have managed to find other buyers in Asia, chiefly India. China imposed a 25 percent tariff on imports of U.S. coal in August as part of its retaliation against tariffs on its exports implemented by the administration of President Donald Trump. Vessel-tracking and port data compiled by Refinitiv show that no coal from the United States was discharged in China in October, while two cargoes totalling 212,000 tonnes are being unloaded this month. However, both the cargoes being unloaded in November left the United States before the tariffs took effect on Aug. 23. While China isn’t the most important Asian buyer for U.S. coal, it had been growing in importance until this year. In the first 10 months of 2018, China imported 3.2 million tonnes of U.S. coal, which was down from 5.1 million for the same period last year. Much of the coal China buys from the United States is higher value coking coal, used in steel making, and it usually is at least double the price of thermal coal, used for power generation. The loss of the China market hasn’t been a devastating blow to U.S. coal exporters, as they have so far been able to find other buyers in Asia. India imported 13.5 million tonnes of coal from the United States in the first 10 months of the year, according to Refinitiv data, up 36 percent from the 9.9 million tonnes in the same period in 2017. Japan, Asia’s third-biggest coal importer behind China and India, bought 7.1 million tonnes from the United States in the January to October period, up from 6.2 million tonnes in the same period last year. Overall, Asia’s imports from the United States were 28.2 million tonnes in the first 10 months of the year, up 2.9 percent from the 25.3 million in the same period last year. That doesn’t sound like a poor outcome for U.S. coal exporters, but the data doesn’t reflect whether it has been relatively easy for U.S. coal miners to sell their product in Asia, or whether they have been offering discounts in order to stay competitive with the region’s powerhouse exporters, Australia and Indonesia. Since China stopped providing detailed customs data earlier this year, it’s been difficult to work out how much the country is paying for various coal imports by country of origin. However, data on the website of the U.S. Energy Information Administration shows that the average price of coking coal exports to China in the second quarter of this year was $129.96 a short tonne, equivalent to about $142.96 a metric tonne. For India, the price for U.S. coking coal exports was about $147.72 a metric tonne in the April to June period. For the same quarter, the price of coking coal futures on the Singapore Exchange, which are based on the Steel Index price for Australian cargoes, was between $182 and $200 a tonne. While the pricing doesn’t take into account any quality differentials or freight costs, it does nonetheless imply that U.S. coal exporters had to discount in order to sell into the Chinese market. There may also be some disturbing signs for U.S. coal exporters to India, with imports slowing in recent months. From a peak of 2.3 million tonnes in May, India’s imports of U.S. coal have trended lower, with October recording 1.05 million tonnes, according to the Refinitiv data. November may be slightly better, with the vessel-tracking data showing India’s imports of U.S. coal at around 1.19 million tonnes, but this is still well below the May peak. Overall, while it seems that U.S. coal exporters have been able to find markets in Asia to replace lost volumes to China, it may be at the cost of having to accept lower prices, and to become more reliant on sales to India, a country that has a government policy of reducing coal imports to zero. (Editing by Christian Schmollinger)",https://uk.reuters.com/article/column-russell-coal-usa/rpt-column-shut-out-of-china-u-s-coal-exporters-find-favour-in-india-for-now-russell-idUKL4N1XV2K2,20 Nov 2018,"U.S. coal
exporters have effectively lost a promising market in China
since the imposition of tariffs as part of the ongoing trade
dispute, but so far they have managed to find other buyers in
Asia, chiefly India.","RPT-COLUMN-Shut out of China, U.S. coal exporters find favour in India, for now: Russell"
2018-11-20,"OSLO (Reuters) - Oil markets are entering an unprecedented period of uncertainty due to geopolitical instability and a fragile global economy, the head of the International Energy Agency said on Tuesday. Concerned about an emerging production overhang similar to the one that led to a price slump in 2014, the Organisation of the Petroleum Exporting Countries is pushing for a supply cut of 1 million to 1.4 million barrels per day (bpd).  The United States restored sanctions targeting Iran’s oil sector in early November, cutting the country’s crude exports by close to 1 million bpd from a summer peak. Although Washington has pledged eventually to halt all of Iran’s global sales of crude oil, for now it has said eight buyers - China, India, South Korea, Japan, Italy, Greece, Taiwan and Turkey - can continue imports without penalty. “The U.S. decision on the Iranian sanction waivers took some of the players in the market by surprise,” the IEA’s Fatih Birol said in an interview on the sidelines of a conference organised by Norwegian energy company Equinor (EQNR.OL).   “As a result, what we see today is that markets are well supplied and the (oil) price went down by $20,” Birol said.  “But the global economy is still going through a very difficult time and is very fragile and ... we have very thin production capacity left in the world, in a world which is becoming more dangerous.”  Brent crude LCOc1 surged above $86 a barrel in October, mainly on worries about supply tightness due to the Iran sanctions. But since the waiver announcement, prices have fallen on concerns about oversupply, as well as a slowdown in global trade. Brent fetched around $66 a barrel on Tuesday. [O/R]    “We are entering an unprecedented period of uncertainty in oil markets,” Birol told the conference.  Birol reiterated his call on key producers to exercise “common sense” at OPEC’s policy meeting in December. Asked whether the oil price could overheat next year, Birol said it would depend on three factors.  “Despite the weak shape of the global economy, oil demand is still strong, spare production capacity is very thin and we do not know what the decision of the key producers in OPEC in December will be,” he said. Reporting by Nerijus Adomaitis; Editing by Gwladys Fouche, Kirsten Donovan and Dale Hudson",https://uk.reuters.com/article/oil-markets/update-1-oil-markets-heading-into-unprecedented-uncertainty-ieas-birol-idUKL8N1XV2QE,20 Nov 2018,"Oil markets are entering an
unprecedented period of uncertainty due to geopolitical
instability and a fragile global economy, the head of the
International Energy Agency said on Tuesday.",UPDATE 1-Oil markets heading into unprecedented uncertainty - IEA's Birol
2018-11-20,"PARIS, Nov 20 (Reuters) - France’s far-left CGT trade union has called for a two-day strike at Total’s refineries and petrochemical plants in France over pay and bonuses disputes. The union said the strike was set for Nov. 21 and Nov. 22 and could be extended if their demands were not met. Oil and gas major Total operates four of France’s seven refineries. (Reporting by Bate Felix; Editing by Sudip Kar-Gupta )",https://uk.reuters.com/article/total-refineries-strike/cgt-trade-union-calls-for-two-day-strike-at-total-refineries-in-france-idUKL8N1XV37V,20 Nov 2018,"France's far-left CGT trade union
has called for a two-day strike at Total's refineries
and petrochemical plants in France over pay and bonuses
disputes.",CGT trade union calls for two-day strike at Total refineries in France
2018-11-20,"LAUNCESTON, Australia (Reuters) - U.S. coal exporters have effectively lost a promising market in China since the imposition of tariffs as part of the ongoing trade dispute, but so far they have managed to find other buyers in Asia, chiefly India. China imposed a 25 percent tariff on imports of U.S. coal in August as part of its retaliation against tariffs on its exports implemented by the administration of President Donald Trump. Vessel-tracking and port data compiled by Refinitiv show that no coal from the United States was discharged in China in October, while two cargoes totalling 212,000 tonnes are being unloaded this month. However, both the cargoes being unloaded in November left the United States before the tariffs took effect on Aug. 23. While China isn’t the most important Asian buyer for U.S. coal, it had been growing in importance until this year. In the first 10 months of 2018, China imported 3.2 million tonnes of U.S. coal, which was down from 5.1 million for the same period last year. Much of the coal China buys from the United States is higher value coking coal, used in steel making, and it usually is at least double the price of thermal coal, used for power generation. The loss of the China market hasn’t been a devastating blow to U.S. coal exporters, as they have so far been able to find other buyers in Asia. India imported 13.5 million tonnes of coal from the United States in the first 10 months of the year, according to Refinitiv data, up 36 percent from the 9.9 million tonnes in the same period in 2017. Japan, Asia’s third-biggest coal importer behind China and India, bought 7.1 million tonnes from the United States in the January to October period, up from 6.2 million tonnes in the same period last year. Overall, Asia’s imports from the United States were 28.2 million tonnes in the first 10 months of the year, up 2.9 percent from the 25.3 million in the same period last year. That doesn’t sound like a poor outcome for U.S. coal exporters, but the data doesn’t reflect whether it has been relatively easy for U.S. coal miners to sell their product in Asia, or whether they have been offering discounts in order to stay competitive with the region’s powerhouse exporters, Australia and Indonesia. Since China stopped providing detailed customs data earlier this year, it’s been difficult to work out how much the country is paying for various coal imports by country of origin. However, data on the website of the U.S. Energy Information Administration shows that the average price of coking coal exports to China in the second quarter of this year was $129.96 a short tonne, equivalent to about $142.96 a metric tonne. For India, the price for U.S. coking coal exports was about $147.72 a metric tonne in the April to June period. For the same quarter, the price of coking coal futures on the Singapore Exchange, which are based on the Steel Index price for Australian cargoes, was between $182 and $200 a tonne. While the pricing doesn’t take into account any quality differentials or freight costs, it does nonetheless imply that U.S. coal exporters had to discount in order to sell into the Chinese market. There may also be some disturbing signs for U.S. coal exporters to India, with imports slowing in recent months. From a peak of 2.3 million tonnes in May, India’s imports of U.S. coal have trended lower, with October recording 1.05 million tonnes, according to the Refinitiv data. November may be slightly better, with the vessel-tracking data showing India’s imports of U.S. coal at around 1.19 million tonnes, but this is still well below the May peak. Overall, while it seems that U.S. coal exporters have been able to find markets in Asia to replace lost volumes to China, it may be at the cost of having to accept lower prices, and to become more reliant on sales to India, a country that has a government policy of reducing coal imports to zero. The opinions expressed here are those of the author, a columnist for Reuters.  Editing by Christian Schmollinger",https://uk.reuters.com/article/column-russell-coal-usa/column-shut-out-of-china-u-s-coal-exporters-find-favour-in-india-for-now-russell-idUKL4N1XV2FW,20 Nov 2018,"U.S. coal
exporters have effectively lost a promising market in China
since the imposition of tariffs as part of the ongoing trade
dispute, but so far they have managed to find other buyers in
Asia, chiefly India.","COLUMN-Shut out of China, U.S. coal exporters find favour in India, for now: Russell"
2018-11-20,"SHANGHAI (Reuters) - Glacier melt at major sites in western China is accelerating fast, Greenpeace said on Tuesday, prompting thousands to evacuate in recent months and underscoring the vulnerability to climate change in a “wake-up call” for the world. Satellite analysis showed that the rate of retreat at glaciers in China’s remote western regions had more than doubled, Greenpeace said, with the annual rate at the Tianshan Glacier No. 1 in Xinjiang rising from an average of 5,000 square meters between 1962 and 1986 to 10,600 square meters between 1986 and this year.    “This is a wake-up call for China and the world,” said Greenpeace’s climate and energy campaigner Liu Junyan. “Glaciers in China supply water to 1.8 billion people, and they’re melting, fast. In just the last few months, thousands of people have been evacuated from their homes due to threats of flooding.” Greenpeace has identified two major disasters caused by glacier melt this year, including the release of 25 million cubic meters of floodwater into the Yarkant river basin that forced the evacuation of residents in August. Researchers with the China Academy of Sciences said in September that glaciers in the Qinghai-Tibet plateau had shrunk 15 percent as a result of rising temperatures over the last 50 years. Temperatures in the region are rising faster than the global average, they said. China has pledged to bring carbon emissions to a peak by “around 2030” as part of its commitment to the 2015 Paris agreement, which aims to keep average global temperature increases to “well below” 2 degrees Celsius above the historical norm.  The Intergovernmental Panel on Climate Change (IPCC) warned in a report in October that high-altitude zones like the Tibetan plateau would be especially vulnerable if global temperature rises were not restricted to 1.5 degrees Celsius.     Another CAS study published in October said China was at risk of longer and more intense drought as well as more destructive flooding if global temperature rises were not limited to 1.5 degrees. Reporting by David Stanway; Editing by Nick Macfie",https://uk.reuters.com/article/climate-change-china/china-glacier-melt-speeds-up-in-wake-up-call-for-world-greenpeace-idUKL4N1XV2GG,20 Nov 2018,"Glacier melt at major sites in
western China is accelerating fast, Greenpeace said on Tuesday,
prompting thousands to evacuate in recent months and
underscoring the vulnerability to climate change in a ""wake-up
call"" for the world.","China glacier melt speeds up in ""wake-up call"" for world - Greenpeace"
2018-11-20,"WASHINGTON (Reuters) - The United States is considering adding Venezuela to its list of state sponsors of terrorism but no final decision has been made, a person familiar with the deliberations said on Monday. Adding Venezuela to the list could limit U.S. economic assistance and impose financial restrictions on a country already suffering from hyperinflation, mass migration and shortages of food and medicine. Discussions on the issue have moved forward in recent days with strong lobbying from Republican Senator Marco Rubio, who has long pressed the administration to take a tougher stand against the government of Venezuelan President Nicolas Maduro, the source said. A time frame for a decision on whether to add Venezuela to the terrorism list had not yet been determined, the source said. A U.S. official, speaking on condition of anonymity, said it would be a challenge for the Trump administration to provide concrete proof linking the Maduro government to terrorism if it decides to put Venezuela on the list. The four countries currently on the list - North Korea, Iran, Sudan and Syria - have been found to “have repeatedly provided support for acts of international terrorism.” Rubio and two other Republican senators sent a letter to Secretary of State Mike Pompeo in September urging him to name Venezuela a state sponsor of terrorism and accusing it of links to Lebanon’s Hezbollah militant group and the Revolutionary Armed Forces of Colombia, or FARC, but they offered no proof. The Trump administration has levied several rounds of sanctions against Maduro’s Socialist-led government since 2017, accusing it of undermining democracy. On Nov. 1, President Donald Trump signed an executive order aimed a disrupting Venezuela’s gold exports.  Venezuela’s Information Ministry did not immediately respond to a request for comment. Maduro, who denies limiting political freedoms, has said he is the victim of an “economic war” led by the United States. The Washington Post, which first reported that the Trump administration was considering the designation, said the U.S. State Department had been asking for feedback on the proposed move from various agencies in recent days. A State Department spokesperson said it “consistently and on an ongoing basis reviews available information and intelligence, from many sources, on possible state-level involvement in terrorism, evaluating all credible, verified, and corroborated information in its entirety.” The White House declined to comment. A senior U.S. official told Reuters earlier this month that the Trump administration was “looking at all potential avenues” to pressure Maduro’s government. “We believe his presidency to be illegitimate,” the official said, reiterating Washington’s rejection of the outcome of Venezuela’s elections earlier this year. Maduro won a new six-year term in May but his main rivals disavowed the election and alleged massive irregularities. “The regime really understands that the world is getting smaller for them. And that’s the kind of pressure that is needed to really change minds in the regime. The sanctions are having an effect,” the official said. Reporting by Matt Spetalnick; Additional reporting by Alexandra Ulmer in Washington anfd Luc Cohen in Caracas; Editing by Sandra Maler",https://uk.reuters.com/article/venezuela-usa/update-4-u-s-considers-adding-venezuela-to-terrorism-sponsors-list-source-idUKL2N1XV023,20 Nov 2018,"The United States is
considering adding Venezuela to its list of state sponsors of
terrorism but no final decision has been made, a person familiar
with the deliberations said on Monday.",UPDATE 4-U.S. considers adding Venezuela to terrorism sponsors list -source
2018-11-20,"WASHINGTON, Nov 19 (Reuters) - The Trump administration is preparing to add Venezuela to a U.S. list of state sponsors of terrorism, a move that would escalate Washington’s diplomatic struggle with the government of President Nicolas Maduro, The Washington Post said on Monday. The Post said the U.S. State Department had been asking for feedback on the proposed move from various agencies in recent days, but it said U.S. officials declined to say whether a final decision had been made about the designation. Reporting by David Alexander; Editing by Eric Beech",https://uk.reuters.com/article/venezuela-usa/u-s-preparing-to-add-venezuela-to-terrorism-sponsors-list-washington-post-idUKS0N1X3004,20 Nov 2018,"The Trump administration is
preparing to add Venezuela to a U.S. list of state sponsors of
terrorism, a move that would escalate Washington's diplomatic
struggle with the government of President Nicolas Maduro, The
Washington Post said on Monday.",U.S. preparing to add Venezuela to terrorism sponsors list -Washington Post
2018-11-20,"* OPEC, allies to meet on Dec. 6 to discuss supply cuts * Cuts would counter demand slowdown, surge in U.S. output By Henning Gloystein SINGAPORE, Nov 20 (Reuters) - Oil prices edged up on Tuesday as markets expected producer club OPEC to agree to supply cuts at their next meeting on Dec. 6, aimed at preventing oversupply amid slowing demand growth and a surge in output from the United States. U.S. West Texas Intermediate (WTI) crude futures, were at $57.32 per barrel at 0048 GMT, up 12 cents, or 0.2 percent from their last settlement. Front-month Brent crude oil futures had yet to trade. Reuters’ technical commodity analyst Wang Tao said on Tuesday Brent may rise into a range of $67.60 to $69.04 per barrel and WTI to $58.29 a barrel in the short-term. The Organization of the Petroleum Exporting Countries (OPEC), de facto led by Saudi Arabia, is pushing for the producer cartel and its allies to cut 1 million to 1.4 million barrels per day (bpd) of supply to adjust for a slowdown in demand growth and prevent oversupply. “Fundamentals over the next six months point to a recovery in oil prices following their sharp decline in October and early November,” BNP Paribas said. The French bank said this was due to “sizeable” losses in Iranian exports expected because of U.S. sanctions against Tehran and because of risks of disruptions in Venezuela and also Libya and Nigeria. “Meanwhile, producers are considering supply reductions in response and we expect OPEC to agree to a supply cut at its next official meeting on 6 December,” BNP said. The bank therefore said it expected Brent to recover to $80 per barrel before the year-end. “In 2019, we expect WTI to average $69 per barrel and Brent $76 per barrel,” BNP said. Despite the gains, crude prices remain almost a quarter below their recent peaks in early October, weighed down by surging supply and a slowdown in demand growth. This comes as supply in the United States is surging, with crude oil production C-OUT-T-EIA up by almost a quarter this year, to a record 11.7 million bpd. Reporting by Henning Gloystein; Editing by Kenneth Maxwell",https://uk.reuters.com/article/global-oil/oil-prices-edge-up-on-expected-opec-supply-cuts-idUKL4N1XV08N,20 Nov 2018,"Oil prices edged up on Tuesday
as markets expected producer club OPEC to agree to supply cuts
at their next meeting on Dec. 6, aimed at preventing oversupply
amid slowing demand growth and a surge in output from the United
States.",Oil prices edge up on expected OPEC supply cuts
