publish_datetime,content,href,publish_timestr,summarize,title
2019-01-14,"* Brent crude oil falls back below $60 per barrel * China reports slump in import-export data * Despite weak trade data, China oil imports hold above 10 mln bpd * OPEC-led supply cuts also provide oil with some support (Updates prices) By Henning Gloystein SINGAPORE, Jan 14 (Reuters) - Oil prices fell by 1 percent on Monday, with Brent crude slipping below $60 per barrel, after Chinese data showed weakening imports and exports in the world’s biggest trading nation and second-largest crude oil consumer. International Brent crude oil futures were at $59.88 per barrel at 0816 GMT, down 60 cents, or 1 percent from their last close. U.S. West Texas Intermediate (WTI) crude futures were down 59 cents, or 1.1 percent, at $51 a barrel. China’s overall exports fell by 4.4 percent in December from a year earlier, the biggest monthly drop in two years, official data showed on Monday, pointing to further weakening in the world’s second-largest economy. Imports also contracted, falling 7.6 percent, the biggest decline since July 2016. “Crude futures were back in the red as trading began for a fresh week in Asia, in tandem with most of the region’s stock markets ... (as) China early Monday reported a $351.76 billion trade surplus in dollar terms for 2018, the lowest since 2013,” said energy consultant Vandana Hari of Vanda Insights in a note. The weak data confirms a raft of indicators that have been pointing to an economic slowdown since the second half of 2018. “Producer price inflation has decelerated for six consecutive months, adding to other signs of cooling industrial activity (in China) amid weakening global demand,” ratings agency Moody’s said in a note. Traders said the data pulled down crude oil futures and Asian stock markets alike, which had both posted modest gains earlier on Monday. Economic research firm TS Lombard said oil prices were capped as “the world economy is now slowing ... limiting the scope for positive surprises in oil demand and hampering inventory reduction.” Ole Hansen, head of commodity strategy at Denmark’s Saxo Bank, said “the deterioration seen recently in forward-looking economic data from the U.S. to Europe and China” meant that the upside for crude oil futures was likely limited to $64 per barrel for Brent and for $55 for WTI. Despite the weak Chinese trade data, the country’s oil imports remained near record levels in December at 10.31 million barrels per day (bpd), holding above the 10 million bpd mark for the second month in a row, on stockbuilding by small independent refiners who were trying to use up annual quotas. Amid this strong demand from the world’s top oil importer, the Organization of the Petroleum Exporting Countries (OPEC) and some non-OPEC allies, including Russia, have been cutting supply since late 2018, providing crude prices some support. In the United States, drillers cut four oil rigs in the week to Jan. 11, bringing the total count down to 873 RIG-OL-USA-BHI, energy services firm Baker Hughes said in a weekly report on Friday. Reporting by Henning Gloystein in Singapore; Editing by
Christian Schmollinger and Tom Hogue",https://uk.reuters.com/article/global-oil/update-3-oil-falls-by-1-pct-on-china-trade-slump-although-crude-imports-remain-high-idUKL3N1ZE0ZW,14 Jan 2019,"* Despite weak trade data, China oil imports hold above 10
mln bpd","UPDATE 3-Oil falls by 1 pct on China trade slump, although crude imports remain high"
2019-01-14,"(Updates prices throughout, adds analyst quote, spreadbetters) * Asian stock markets : tmsnrt.rs/2zpUAr4 * MSCI ex-Japan skids 1 pct, Tokyo on public holiday * China’s Dec exports, imports fall, miss forecasts * Chinese shares in red, E-Minis stumble too By Swati Pandey SYDNEY, Jan 14 (Reuters) - Asian shares and U.S. stock futures skidded on Monday after a shock contraction in Chinese exports pointed to deepening cracks in the world’s second-biggest economy and raised fears of a sharper slowdown in global growth and corporate profits. E-minis for the S&P 500 declined 0.8 percent, in an indication of heightened risk aversion. Spreadbetters also pointed to a weak start for Europe while FTSE futures slipped 0.4 percent. Latest data from China showed imports fell 7.6 percent year-on-year in December when analysts had predicted a 5 percent rise while exports unexpectedly dropped 4.4 percent, confounding expectations for a 3 percent gain. The disappointing numbers reinforced fears U.S. tariffs on Chinese goods were starting to take a heavy toll on China’s cooling economy. Softening demand in China is already being felt around the world, with slowing sales of goods ranging from iPhones to automobiles, prompting profit warnings from the likes of Apple and Jaguar Land Rover. The Australian dollar, a key gauge of global risk sentiment and a liquid proxy for the Chinese yuan, toppled from Friday’s one-month peak of $0.7235 to $0.7186 after the dismal data. “We believe trade growth next year will slow significantly on huge uncertainty and high base,” Citi analysts wrote in a note, predicting China’s exports and imports to fall 5.1 percent and 6.8 percent respectively this year. “Significant uncertainty remains as to whether there could be a ‘deal’ after March 1,” they added. Those concerns sent MSCI’s broadest index of Asia-Pacific shares outside Japan sliding 1 percent from Friday’s 1-1/2 month top for its biggest single-day percentage drop since Jan. 2, with Chinese and Hong Kong shares the worst hit. Liquidity was generally light during Asian hours as Japan was on public holiday. Chinese shares were in the red, with the blue-chip index down 0.7 percent. Hong Kong’s Hang Seng index stumbled 1.5 percent while Australian shares reversed early gains to end mostly flat. Some analysts expect Monday’s trade data to provide impetus to Chinese authorities to resolve the trade dispute with Washington. “You could argue that the worse the numbers are the more incentive it provides to resolve the dispute,” Ray Attrill, forex strategist at National Australia Bank, told Reuters. “It also amplifies the extent to which they (Chinese policymakers) have to provide stimulus for the domestic economy,” Attrill added. The world’s two largest economies have been in talks for months now to try and resolve their bitter trade war, with no signs so far of any substantial progress in negotiations. Citi analysts said even with the rising probability for both sides to reach an agreement, the tariff and trade disruption appears to have already rippled through the global economy. “The regional trade growth appears to have slowed substantially after front-loading effect diminished,” they said. In the wake of the trade dispute, China’s policymakers have already pledged to step up support this year, following a raft of measures in 2018 including fast tracking infrastructure projects and cuts in banks’ reserve requirements and taxes. On the earnings front, U.S. banks are in sharp focus with quarterly results from Citigroup due Monday followed by JPMorgan Chase, Wells Fargo, Goldman Sachs and Morgan Stanley later in the week. Expectations are dour with profits for U.S. companies forecast to rise 6.4 percent, down from an Oct. 1 estimate of 10.2 percent and a big drop from 2018’s tax cut-fueled gain of more than 20 percent. Investor attention was also on the U.S. government shutdown, now in its 24th day, and with no resolution in sight. Further clouding the outlook, Britain faces a hugely uncertain path with a vote for a deal for its exit from the European Union due in the U.K. parliament on Tuesday. All these factors were at play last week when the main U.S. indices ended Friday little changed as investors reset positions ahead of key risk events. In currencies, the euro was subdued as it hit key technical levels following data from Italy on Friday that showed the euro zone’s third-largest economy was at risk of recession. The single currency was last at $1.1475. The dollar’s index, which measures the greenback against a basket of major currencies, edged 0.1 percent lower to 95.57 after two straight days of gains. In commodities, oil prices extended losses from Friday as investors worried about a global slowdown. U.S. crude fell 58 cents to $51.01 while Brent eased 68 cents to $59.80. Gold gained to inch towards a recent seven-month high of $1,298.42 an ounce. Editing by Shri Navaratnam",https://uk.reuters.com/article/global-markets/global-markets-asia-shares-us-stock-futures-hit-as-chinas-export-slump-jolts-investors-idUKL3N1ZE1YS,14 Jan 2019,"Asian shares and U.S. stock
futures skidded on Monday after a shock contraction in Chinese
exports pointed to deepening cracks in the world's
second-biggest economy and raised fears of a sharper slowdown in
global growth and corporate profits.","GLOBAL MARKETS-Asia shares, US stock futures hit as China's export slump jolts investors"
2019-01-14,"(Adds details, analyst comment, charts) * Dec crude imports 10.31 mln bpd, a touch below Nov record * 2018 imports up 10.1 pct vs 2017 on 846,600 bpd in growth * State refiners account for most of import growth * China fuel exports at record 58.64 mln T for 2018 * China oil imports surge: tmsnrt.rs/2SPHU3R * China gas imports at new high: tmsnrt.rs/2RGnnSd By Chen Aizhu SINGAPORE, Jan 14 (Reuters) - China’s crude oil imports in December surged nearly 30 percent from a year earlier to the second highest for a month on a daily basis, Reuters calculations of customs data showed on Monday. The surge was bolstered by year-end stockbuilding by small independent refiners trying to use up annual quotas and crude cargoes imported for tests on two new private refineries. December shipments into China, the world’s top crude oil buyer, were at 43.78 million tonnes, or 10.31 million barrels per day (bpd), holding above the 10 million bpd mark for the second straight month, and just a touch below the record of 10.43 million bpd in November, according to the data released by the General Administration of Chinese Customs. For the whole of 2018, China’s crude oil imports rose 10.1 percent versus the previous year to a record 461.9 million tonnes, or 9.24 million bpd. This makes China the top crude oil importer for the second year running, after it first overtook the United States on an annual basis in 2017. The 2018 growth represents an increase of 846,600 bpd - more than 2017’s net growth of 770,000 bpd - and roughly the size of consumption by the Netherlands or Turkey. Peak operations at giant state refiners during most of the first three quarters accounted for the bulk of the import growth, joined later by new purchasing from two privately-run mega refineries ahead of trial runs, said Seng-Yick Tee of consultancy SIA Energy. Strategic stockpiling at several state reserve sites that have just started up, such as Jinzhou in the north and Huizhou on China’s southern coast, also contributed to more shipments during the last few months of 2018 as China took advantage of steep falls in benchmark prices from mid-November, said Tee. Independent oil processors, sometimes called “teapots”, played a smaller role in 2018 than in previous years due to marginal increases in their import quotas and a new tax policy that pinched their appetite for overseas crude. “Unlike the previous two years when teapots led the incremental growth, state giants became the main drivers for last year’s growth,” said Tee. China also exported a record amount of refined fuel products last year at 58.64 million tonnes, up 12 percent from 2017, aided by a larger amount of government export quotas to relieve a growing domestic fuel surplus. Gas imports, including piped gas and liquefied natural gas (LNG) shipped in tankers, hit a record last month at 9.23 million tonnes, up 17 percent from the same month in 2017. The previous monthly record of 9.15 million tonnes came in November. The hefty imports were spurred by another year of strong demand growth for the cleaner-burning fuel as Beijing extended a campaign against smog by switching another 3 million of homes to gas from coal for winter heating. Imports for the year expanded 31.9 percent over 2017 to 90.39 million tonnes, holding the top spot among gas importers globally after overtaking that position from Japan as recently as October. For LNG alone, China retains its spot for the second year as the world’s No.2 buyer, behind Japan, after leapfrogging South Korea in 2017. In an effort to avert the supply crunch experienced in the 2017/18 winter, state energy firms stepped up their imports of LNG and build up stocks in underground storage. For details of December commodities trade (tonne = 7.3 barrels for crude oil) Reporting by Chen Aizhu; Editing by Tom Hogue",https://uk.reuters.com/article/china-economy-trade-crude/update-1-china-dec-crude-imports-at-2nd-highest-gas-imports-at-record-idUKL3N1ZA3GU,14 Jan 2019,"China's crude oil imports in
December surged nearly 30 percent from a year earlier to the
second highest for a month on a daily basis, Reuters
calculations of customs data showed on Monday.","UPDATE 1 -China Dec crude imports at 2nd highest, gas imports at record"
2019-01-14,"* Dec coal imports slump on government curbs * 2018 coal imports rise 3.4 pct despite intervention * Traders see low January shipments (Adds numbers, background) BEIJING, Jan 14 (Reuters) - China’s coal imports rose to 281.5 million tonnes in 2018, the highest annual figure in four years, customs data showed on Monday, despite a government push to cap shipments at last year’s level. Coal imports were 3.4 percent above 2017, data from the General Administration of Customs showed, even as December’s imports tumbled nearly 47 percent to 10.23 million tonnes. Traders and utilities cut back sharply on purchases at the end of the year following government signals, with utilities sitting on record coal stocks, pushing down domestic prices. Utilities had been told they needed to keep imports in 2018 below the prior year’s level, amid abundant domestic supplies and slowing electricity demand growth. China has also switched another 3.29 million households to gas heating this winter, according to Reuters calculations, more than last year, as Beijing continues to push the use of cleaner fuels to curb pollution. Traders expect imports of coal, used in China for power generation, heating and steelmaking, to remain low in January as the country continues to curb imports in order to boost domestic coal prices. Reporting by Meng Meng and Dominique Patton; Editing by
Christian Schmollinger and Richard Pullin",https://uk.reuters.com/article/china-economy-trade-coal/update-1-chinas-2018-coal-imports-at-four-year-high-despite-curbs-idUKL3N1ZE1K1,14 Jan 2019,"* Traders see low January shipments
(Adds numbers, background)",UPDATE 1-China's 2018 coal imports at four-year high despite curbs
2019-01-14,"(Updates prices throughout, adds analyst comment, Chinese data) * Asian stock markets : tmsnrt.rs/2zpUAr4 * MSCI ex-Japan skids 1 pct, Tokyo on public holiday * China’s Dec exports, imports fall, miss forecasts * Chinese shares in red, E-Minis stumbles too By Swati Pandey SYDNEY, Jan 14 (Reuters) - Asian shares and U.S. stock futures skidded on Monday after a shock contraction in Chinese exports pointed to deepening cracks in the world’s second-biggest economy and raised fears of a sharper slowdown in global growth and corporate profits. Latest data from China showed imports fell 7.6 percent year-on-year in December when analysts had predicted a 5 percent rise while exports unexpectedly dropped 4.4 percent, confounding expectations for a 3 percent gain. The disappointing numbers reinforced fears U.S. tariffs on Chinese goods were putting a big strain on China’s already cooling economy. The Australian dollar, a key gauge of global risk sentiment and a liquid proxy for the Chinese yuan, toppled from Friday’s one-month peak of $0.7235 to $0.7186 after the data. MSCI’s broadest index of Asia-Pacific shares outside Japan extended losses to notch a 1 percent decline from Friday’s 1-1/2 month top, with Chinese and Hong Kong shares the biggest losers. Liquidity was generally expected to be light during Asian hours as Japan was on public holiday. Chinese shares were in the red, with the blue-chip index down 0.8 percent. Hong Kong’s Hang Seng index stumbled 1.4 percent while Australian shares eased 0.2 percent after starting firm. E-minis for the S&P 500 declined 0.8 percent, in an indication of heightened risk aversion. “The data was very weak and it just adds to the incentives for the Chinese side to strike a trade deal with the U.S. in the coming weeks,” said Ray Attrill, forex strategist at National Australia Bank. “You could argue that the worse the numbers are the more incentive it provides to resolve the dispute.” Beijing and Washington have been in talks for months now to try and resolve their bitter trade war, with no signs so far of any substantial progress in negotiations. “It also amplifies the extent to which they (Chinese policymakers) have to provide stimulus for the domestic economy,” Attrill added. In the wake of the trade dispute, China’s policymakers have already pledged to step up support this year, following a raft of measures in 2018 including fast tracking infrastructure projects and cuts in banks’ reserve requirements and taxes. On the earnings front, U.S. banks are in sharp focus with quarterly results from Citigroup due Monday followed by JPMorgan Chase, Wells Fargo, Goldman Sachs and Morgan Stanley later in the week. Expectations are dour with profits for U.S. companies forecast to rise 6.4 percent, down from an Oct. 1 estimate of 10.2 percent and a big drop from 2018’s tax cut-fueled gain of more than 20 percent. Investor attention was also on the U.S. government shutdown, now in its 24th day, and with no resolution in sight. Further clouding the outlook, Britain faces a hugely uncertain path with a vote for a deal for its exit from the European Union due in the U.K. parliament on Tuesday. All these factors were at play last week when the main U.S. indices ended Friday little changed as investors reset positions ahead of key risk events. In currencies, the euro was subdued as it hit key technical levels following data from Italy on Friday that showed the euro zone’s third-largest economy was at risk of recession. The single currency was last at $1.1466. The dollar’s index, which measures the greenback against a basket of major currencies, edged 0.1 percent lower to 95.57 after two straight days of gains. In commodities, oil prices extended losses from Friday as investors worried about a global slowdown. U.S. crude fell 59 cents to $51 while Brent eased 65 cents to $59.83. Gold gained to inch towards a recent seven-month high of $1,298.42 an ounce. Editing by Shri Navaratnam",https://uk.reuters.com/article/global-markets/global-markets-asia-shares-us-stock-futures-slide-as-chinas-exports-slump-jolts-investors-idUKL3N1ZE1LZ,14 Jan 2019,"Asian shares and U.S. stock
futures skidded on Monday after a shock contraction in Chinese
exports pointed to deepening cracks in the world's
second-biggest economy and raised fears of a sharper slowdown in
global growth and corporate profits.","GLOBAL MARKETS-Asia shares, US stock futures slide as China's exports slump jolts investors"
2019-01-14,"BEIJING, Jan 14 (Reuters) - China’s coal imports rose to 281.5 million tonnes in 2018, the highest annually since 2014, data from the General Administration of Customs showed. Coal shipments last year rose 3.4 percent from 2017 despite government efforts over the past two years to reduce imports to boost domestic prices. Imports in December tumbled 46.6 percent to 10.23 million tonnes, customs data showed. Reporting by Meng Meng and Dominique Patton; Editing by
Christian Schmollinger",https://uk.reuters.com/article/china-economy-trade-coal/chinas-2018-coal-imports-at-four-year-high-despite-government-curbs-idUKB9N1W4028,14 Jan 2019,"China's coal imports rose to
281.5 million tonnes in 2018, the highest annually since 2014,
data from the General Administration of Customs showed.",China's 2018 coal imports at four-year high despite government curbs
2019-01-14,"(Updates prices throughout, adds Chinese shares, trade data, oil prices) * Asian stock markets : tmsnrt.rs/2zpUAr4 * MSCI ex-Japan skids 0.7 pct, Tokyo on public holiday * Chinese shares in red, E-Minis stumbles too * China released 2018 trade data but Dec figs still awaited * Investors expect volatility to increase this week By Swati Pandey SYDNEY, Jan 14 (Reuters) - Asian shares turned down on Monday as China trade data started trickling in and as investors looked to key corporate earnings later in the week to take the pulse of a cooling global economy. Partial data on trade from China showed dollar-denominated exports growth was the highest since 2011. Markets are still awaiting numbers for December due shortly. MSCI’s broadest index of Asia-Pacific shares outside Japan stumbled 0.7 percent after climbing to the highest since early December on Friday, with Chinese and Hong Kong shares the biggest losers. Liquidity was generally expected to be light during Asian hours as Japan was on public holiday. Chinese shares opened in the red, with the blue-chip index down 0.3 percent and Shanghai’s SSE Composite off 0.2 percent. Hong Kong’s Hang Seng index dropped 1.2 percent while Australian shares turned down after starting firm. E-minis for the S&P 500 too stumbled, in an indication of risk aversion. The trade data from China was the main focus, with recent signs Asia’s largest economy was losing momentum and the government was planning to lower its 2019 economic growth target. The Sino-U.S. tariff war has already disrupted trade flows for hundreds of billions of dollars worth of goods and roiled global markets. While the two countries have been in talks for months, few details have been provided of any progress made. Investors expect volatility to rise this week, “as some key issues that have been affecting market sentiment approach decision points,” said Nick Twidale, analyst at Rakuten Securities. “Expect sentiment to continue to dominate market direction with trades focussing closely on the news channels for the next twist in the various issues that are influencing the market.” On the earnings front, U.S. banks are in sharp focus with quarterly results from Citigroup due Monday followed by JPMorgan Chase, Wells Fargo, Goldman Sachs and Morgan Stanley later in the week. Expectations are dour with profits for U.S. companies forecast to rise 6.4 percent, down from an Oct. 1 estimate of 10.2 percent and a big drop from 2018’s tax cut-fueled gain of more than 20 percent. Investor attention was also on the U.S. government shutdown, now in its 24th day, and with no resolution in sight. Further clouding the outlook, Britain faces a hugely uncertain path with a vote for a deal for its exit from the European Union due in the U.K. parliament on Tuesday. All these factors were at play last week when the main U.S. indices ended Friday little changed as investors reset positions ahead of key risk events. The Australian dollar, a key gauge of global risk sentiment and a liquid proxy for the Chinese yuan, dipped 0.1 percent from a one-month top of $0.7235 set on Friday. Elsewhere, the euro was subdued as it hit key technical levels following data from Italy on Friday that showed the euro zone’s third-largest economy was at risk of recession. The single currency was last at $1.1475. The dollar’s index, which measures the greenback against a basket of major currencies, edged 0.1 percent lower to 95.57 after two straight days of gains. In commodities, oil prices extended losses from Friday as investors worried about a global slowdown. U.S. crude was down 19 cents at $51.4 while Brent eased 17 cents to $60.31. Gold gained to inch towards a recent seven-month high of $1,298.42 an ounce. Editing by Shri Navaratnam",https://uk.reuters.com/article/global-markets/global-markets-asian-shares-falter-from-1-1-2-mth-highs-markets-wary-about-china-data-idUKL3N1ZE1AL,14 Jan 2019,"Asian shares turned down on
Monday as China trade data started trickling in and as investors
looked to key corporate earnings later in the week to take the
pulse of a cooling global economy.","GLOBAL MARKETS-Asian shares falter from 1-1/2-mth highs, markets wary about China data"
