publish_datetime,content,href,publish_timestr,summarize,title
2018-11-20,"* MSCI Asia-Pacific index down 0.3 pct, Nikkei sheds 1 pct * Dollar sags after weak U.S. housing-related data * Long-term US yields hover near 7-week lows * Graphic: World FX rates in 2018 tmsnrt.rs/2egbfVh By Shinichi Saoshiro TOKYO, Nov 20 (Reuters) - Asian stock markets slipped on Tuesday, extending sharp overnight losses on Wall Street as technology firms bore the brunt of worries about slackening demand, while the dollar sagged after weak U.S. data further sapped confidence in the currency. MSCI’s broadest index of Asia-Pacific shares outside Japan dropped 0.3 percent. Australian stocks lost 0.7 percent and tech-heavy South Korean shares dropped 0.9 percent. In Seoul, Samsung Electronics fell 2.1 percent and SK Hynix Inc dropped 3 percent, while Japan’s Tokyo Electron was down 2.5 percent, Advantest lost 1.8 percent and Sony Corp shed 2.8 percent. Japan’s Nikkei was down 1 percent. Shares of Nissan Motor Co tumbled roughly 6 percent after its Chairman Carlos Ghosn was arrested on Monday for alleged financial misconduct and will be fired from the board this week. U.S. stocks came under heavy selling on Monday, with Nasdaq tumbling 3 percent, as investors dumped Apple, internet and other technology shares. Conflicting signals between the United States and China on their trade dispute added to caution. “The drop by U.S. stocks will cut short any attempt by equity markets to mount a sustained bounce. Investor sentiment has been subdued by lingering weakness in U.S. technology shares,” said Masahiro Ichikawa, senior strategist at Sumitomo Mitsui Asset Management in Tokyo. Worries of a peak in corporate earnings growth amid rising borrowing costs, slowing global economic momentum and international trade tensions triggered a shakeout in stocks over the past two months, with trillions of dollars worth of equity losses in a particularly torrid October month. In currencies, the dollar struggled at a near two-week low against a basket of currencies. The greenback was hit after data released on Monday showed U.S. home builder sentiment recorded its steepest one-month drop in over 4-1/2 years in November. The dollar had also been weighed down after Fed Vice Chair Richard Clarida and Dallas Fed President Robert Kaplan late last week raised concerns over a potential global slowdown. The U.S. currency has rallied strongly this year, buoyed by three Fed rate hikes and a robust economy, though some expect the bull run may be nearing an end. With long-term U.S. Treasury yields slipping to a seven-week low of 3.052 percent in the wake of weaker stocks and U.S. housing data, the dollar index against a basket of six major currencies hovered near 96.120, an 11-day low plumbed on Monday. The euro was little changed at $1.1455 after gaining 0.35 percent overnight. The dollar slipped to a three-week low of 112.40 yen and last traded at 112.48. U.S. crude futures gained 0.3 percent to $57.36, adding to the previous day’s gains, supported by a reported drawdown of U.S. oil inventories, potential European Union sanctions on Iran and possible OPEC production cuts. (Editing by Shri Navaratnam)",https://uk.reuters.com/article/global-markets/global-markets-asia-down-as-wall-st-knocked-by-tech-sell-off-dollar-sags-idUKL4N1XV03R,20 Nov 2018,"Asian stock markets slipped on
Tuesday, extending sharp overnight losses on Wall Street as
technology firms bore the brunt of worries about slackening
demand, while the dollar sagged after weak U.S. data further
sapped confidence in the currency.","GLOBAL MARKETS-Asia down as Wall St knocked by tech sell-off, dollar sags"
2018-11-20,"SEOUL/TOKYO (Reuters) - South Korean shipyards have boxed out their Japanese rivals from the market for building large ships carrying liquefied natural gas (LNG), winning all of the orders for the next three years worth more than $9 billion.  Three South Korean yards - Daewoo Shipbuilding & Marine Engineering (DSME) (042660.KS), Hyundai Heavy Industries (009540.KS) and Samsung Heavy Industries (010140.KS) - have won the more than 50 orders placed for new large-scale LNG tankers for delivery in the next three years, according to data from the companies and two tanker brokers. The bulging orderbook illustrates the dominance the South Korean yards have achieved over their competitors, especially in Japan. It is also sign of how the companies have rebounded from a sector-wide slump only two years ago and how they are positioned to command the sector in the future. “The demand for LNG carriers surged followed by increased global demand of LNG,” said Park Hyung-gun, vice president of DSME. “There is a bright outlook ahead for LNG demand and South Korean shipbuilders will be able to excel in the LNG market.” (Graphic: LNG tanker orders - tmsnrt.rs/2PXkwDu)  Including floating LNG storage and support vessels, ship brokerage Braemar estimates South Korean yards have bagged 78 percent of all LNG-related orders this year, with just 14 percent and 8 percent going to Japan and China, respectively.  A set of data collected by another ship broker, who did not want to be identified, showed all of this year’s orders for large LNG tankers went to South Korea, at a combined value of over $9 billion. The new ships will increase the global LNG fleet by around 10 percent. Dominating this segment is key for shipyards, as gas consumption outgrows that of other fuels such as oil or coal. The South Korean shipbuilders have outperformed their Japanese competitors this year with the equities for all three Korean firms rising while the Japanese builders are either flat or down. (Graphic: Shipyard stock market performance - tmsnrt.rs/2DlC5GE) With its dominance in new orders, this share will increase. Virtually all the LNG from new projects in the Russian Arctic, Papua New Guinea, Australia, the United States, East Africa or Qatar will be delivered on South Korean ships made near the cities of Busan and Ulsan on the country’s southern coast. DSME said it has received 12 orders for LNG tankers this year. Those orders are worth about $2.2 billion to the company, according to data from Daiwa Capital Markets.  LNG tanker orders this year have made up over half its business, DSME said, helping it recover from a near collapse in 2016/17, when its stocks were suspended amid one of the deepest shipping industry downturns on record. An official at Samsung Heavy, who did not wish to be identified, said “market conditions are improving” and the firm has received 11 LNG tanker orders this year, around 40 percent of its total book. Hyundai Heavy, which had its worst year ever in 2016, said LNG ship orders started rising in 2017. This year, they will account for 21 percent of its new orders between January and September, up from 14 percent over the same period in 2017, company data showed. Two-thirds of the global LNG vessels in service today were built in South Korea, according to Braemar, versus 22 percent from Japan, 7 percent from China, and the rest made in France, Spain and the United States. (Graphic: GRAPHIC: LNG tanker by type - tmsnrt.rs/2Pvpzf1) South Korea’s edge comes from its technological and service standards as well as investment into research and development.  DSME developed the world’s first ice-breaking LNG tankers and the company will deliver the eighth such ship, the Georgiy Brusilov, to Russia’s Arctic LNG producer Novatek (NVTK.MM) this month. Another six are under construction. Price is also a factor in South Korea’s success, with the country’s shipyards building LNG carriers for as low as $175 million, according to data from Daiwa.  Japanese ships, however, are above $200 million, according a ship broker in Asia and a European shipping manager. Further cementing South Korea’s grip, the LNG industry has shifted away from the Moss tanker design, identified by the four or five spherical tanks holding the fuel and named for the company that designed them in 1973.  Instead, customers are demanding Membrane-type vessels that leave less dead space within the ship’s hull. This efficiency allows a Q-Max vessel, the largest class of Membrane carrier, to load up to 260,000 cubic meters of LNG versus 182,000 cubic meters on the biggest Moss-type tanker.   “Ship designs are changing,” said Park Moo-hyun, an analyst at Hana Financial Investment in Seoul, with customers preferring the Membrane tankers.      “China and Japan are not well responding to the change... and this led to no orders (there)... and that’s why European shipowners are placing orders to South Koreans,” he added.         Braemar estimates 71 percent of the global LNG tanker fleet is made up of Membrane carriers, versus 22 percent Moss tankers, and 7 percent using other systems. This year, 93 large LNG carriers using the Membrane design were ordered versus only eight Moss style, according to Braemar.  A spokesman for Japan’s Mitsubishi Shipbuilding (7011.T) confirmed it has won no LNG carrier orders since 2015. A spokesman at Kawasaki Heavy Industries (7012.T) said the same. Japan Marine United last won an order in 2014. Japan contends, however, that South Korea began unfairly supporting the shipyards during the 2016 downturn, when the South Korean government paid out subsidies and gave credit to keep the companies alive and their hundreds of thousands of workers employed.  The country plans to file a complaint over the issue with the World Trade Organization (WTO), Japan’s Nikkei paper reported this month. Whoever dominates this market is set to reap large benefits. Global LNG demand is surging from new users in emerging markets and because of a huge gasification program in China. The fuel is set to become important for marine transport as the International Maritime Organization (IMO) will require shippers to use cleaner fuels from 2020. The rising thirst is being met by new production projects, especially in North America and Australia, which will require more ships to transport LNG to its customers. Korea’s shippers are confident they will be the ones to ship most of this gas. “I see the current cycle lasting for at least 10 years and South Korea is expected to keep dominating the LNG market. Rival countries can’t catch up in the short term given their engineering skills and proficiency,” said Hana Financial’s Park. Reporting by Jane Chung in SEOUL and Yuka Obayashi in TOKYO; additional reporting by Heekyong Yang in SEOUL and Aaron Sheldrick in TOKYO; Writing by Henning Gloystein; Editing by Christian Schmollinger",https://uk.reuters.com/article/lng-south-korea-shipping/focus-south-korean-shipbuilders-lock-on-lng-tanker-market-to-hold-for-years-idUKL8N1XQ0O5,20 Nov 2018,* Shipyard stock market performance: https://tmsnrt.rs/2DlC5GE,FOCUS -South Korean shipbuilders' lock on LNG tanker market to hold for years
