publish_datetime,content,href,publish_timestr,summarize,title
2019-01-14,"(Repeats to widen distribution) By Scott DiSavino Jan 14 (Reuters) - More U.S. coal-fired power plants were shut in President Donald Trump’s first two years than were retired in the whole of Barack Obama’s first term, despite the Republican’s efforts to prop up the industry to keep a campaign promise to coal-mining states. In total, more than 23,400 megawatts (MW) of coal-fired generation were shut in 2017-2018 versus 14,900 MW in 2009-2012, according to data from Reuters and the U.S. Energy Information Administration (EIA). Trump has tried to roll back rules on climate change and the environment adopted during the Obama administration to fulfill pledges to voters in states like West Virginia and Wyoming. But the second highest year for coal shutdowns was in Trump’s second year, 2018, at around 14,500 megawatts, following a peak at about 17,700 megawatts in 2015 under Obama. One megawatt can power about 1,000 U.S. homes. The number of U.S. coal plants has continued to decline every year since coal capacity peaked at just over 317,400 MW in 2011, and is expected to keep falling as consumers demand power from cleaner and less expensive sources of energy. Cheap natural gas and the rising use of renewable power like solar and wind have kept electric prices relatively low for years, making it uneconomic for generators to keep investing in older coal and nuclear plants. Generators said they plan to shut around 8,422 MW of coal-fired power and 1,500 MW of nuclear in 2019, while adding 10,900 MW of wind, 8,200 MW of solar and 7,500 MW of gas, according to Reuters and EIA data. The predictions come from estimates compiled by Thomson Reuters and U.S. Energy Information Administration data. For a graphic on U.S. coal shutdowns, see: tmsnrt.rs/2H1GQIO. Since taking office in January 2017, the Trump administration has announced its intention to leave the 2015 Paris Agreement on climate change and is relaxing Obama-era rules on emissions from power plants as it seeks to boost domestic production of oil, gas and coal. U.S. emissions of carbon dioxide, the main greenhouse gas, spiked in 2018 after falling for the previous three years as cold weather spurred gas demand for heating and the booming economy pushed planes and trucks to guzzle fuel, according to a study by Rhodium Group, an independent research group. After falling to 5,144 million tonnes in 2017, the lowest since 1992, the EIA projected U.S. energy-related carbon emissions will rise to 5,299 million tonnes in 2018. “There will be a limit to what increasingly cheap renewable power and continuously cheap natural gas can deliver with respect to emissions reductions,” said John Larsen, a director at Rhodium Group who leads the firm’s power sector research, noting the rising use of gas to produce power as coal plants shut. Natural gas emits about half the carbon as coal. The Trump administration has also tried to slow the retirement of coal and nuclear plants through a directive in 2017 from Energy Secretary Rick Perry to subsidize the aging units because they make the electric grid more resilient. That plan was bashed by advocates for gas, renewable power and consumers and unanimously rejected by the U.S. Federal Energy Regulatory Commission (FERC), led by former Chairman Kevin McIntyre. The plan could resurface now that Trump has a chance to replace McIntyre, who died on Jan. 2. Reporting by Scott DiSavino and Stephanie Kelly in New York
Editing by Sonya Hepinstall",https://uk.reuters.com/article/usa-trump-coal/rpt-graphic-president-trump-cant-stop-u-s-coal-plants-from-retiring-idUKL1N1ZE0HR,14 Jan 2019,"More U.S. coal-fired power plants were
shut in President Donald Trump's first two years than were
retired in the whole of Barack Obama's first term, despite the
Republican's efforts to prop up the industry to keep a campaign
promise to coal-mining states.",RPT-GRAPHIC-President Trump can't stop U.S. coal plants from retiring
2019-01-14,"BRASILIA (Reuters) - Brazil’s agriculture minister on Monday criticized supermodel Gisele Bundchen for saying Brazil is a deforester and said she will invite the supermodel to be an ambassador for the country’s efforts to supply the world with food while preserving nature. Minister Tereza Cristina Dias said on Twitter that Bundchen would receive the invitation soon, after striking out at her in a radio interview. “Sorry, Gisele Bundchen, you should be our ambassador, to say that your country preserves, that your country is on the global vanguard of preservation, and don’t come here saying bad things about Brazil without knowledge of the facts,” Dias told Sao Paulo’s Jovem Pan radio station earlier on Monday. Press representatives for Bundchen did not immediately respond to request for comment. Recruiting the supermodel as a spokeswoman for sustainability would be a major public relations coup for the government of right-wing President Jair Bolsonaro, which took power Jan. 1, by bringing onboard a critic of his predecessor’s moves to loosen environmental protections. Bundchen, who is married to U.S. football star Tom Brady,  twice squared off with former President Michel Temer on social media over policies to shrink or eliminate protected areas of the Amazon. Temer ultimately reversed himself in both cases, responding directly to her by Twitter in one instance after vetoing rules that would have reduced the size of the Jamanxim national forest in Brazil’s Amazon rainforest. Environmentalists have blasted the new Bolsonaro government, warning that it may broadly roll back environmental protections.  Bolsonaro has said he wants to end an “industry” of environmental fines, which activists say is a major tool for ensuring rules are followed. He has also suggested Brazil could exit the Paris Agreement on climate change. Dias’ tweet followed on the radio interview in which she cited government statistics that Brazil has preserved roughly two-thirds of its native vegetation as evidence of the country’s accomplishments in conservation. Reporting by Jake Spring and Ana Mano; Editing by Steve Orlofsky",https://uk.reuters.com/article/brazil-agriculture-supermodel/brazil-minister-blasts-supermodel-bundchen-invites-her-to-be-environment-envoy-idUKL3N1ZE3L9,14 Jan 2019,"Brazil's agriculture minister
on Monday criticized supermodel Gisele Bundchen for saying
Brazil is a deforester and said she will invite the supermodel
to be an ambassador for the country's efforts to supply the
world with food while preserving nature.","Brazil minister blasts supermodel Bundchen, invites her to be environment envoy"
2019-01-14,"* U.S. talks with Doha to supply Germany with LNG -official * Qatar to invest $20 bln in U.S. LNG terminal, energy assets * U.S. warns German firms of sanctions over Russian pipeline * Talks with Riyadh, Kuwait over Neutral Zone oil resumption By Rania El Gamal and Eric Knecht DUBAI/DOHA, Jan 14 (Reuters) - The United States wants Qatar, the world’s top liquefied natural gas supplier, to challenge Russia’s gas dominance in Europe, a U.S. administration official said on Monday. Deputy U.S. Energy Secretary Dan Brouillette told Reuters that the United States is talking with Doha about supplying Europe with LNG as it wants Germany and other countries to import Qatari and U.S. gas rather than from Russia, which now accounts for 60 percent of German gas imports. The United States has warned German companies about possible sanctions over the Nord Stream 2 pipeline under construction which will double Russia’s export capacity to Germany via the Baltic Sea.. Germany is Europe’s biggest energy consumer. Brouillette, speaking in Doha, said he had discussed the issue with Qatar’s Minister of State for Energy Affairs Saad al-Kaabi, who is also chief executive of Qatar Petroleum (QP). “We are talking to Minister Kaabi here about other markets, specifically Europe, to the extent that we can talk to the Qataris about supplying European markets with natural gas,” he said in an interview. “They are very much interested in that and so are we – it’s very connected to deliberations with others we have around Nord Stream 2.” He said Nord Stream 2 gas pipeline would increase the dependency of Germany and Europe on Russian gas, but that Germany had recently decided to help fund LNG import facilities that could offset that dependence. Kaabi told Reuters last month that QP is looking to invest at least $20 billion in the United States over the coming few years and he expected to make a final decision on its investment in the Golden Pass LNG terminal in Texas soon. QP is majority owner of the Golden Pass LNG terminal, with Exxon Mobil and ConocoPhillips holding smaller stakes. “The Qatari investments in the Golden Pass, and in the U.S. export facilities are very important to allow us to get that natural gas to Europe,” Brouillette said. U.S. President Donald Trump in July accused Germany of being a “captive” of Russia due to its energy reliance and urged it to halt work on the $11 billion Nord Stream 2 gas pipeline. Germany rejects this charge and says it is open to diversifying its energy sources but that sales will ultimately be determined on economic grounds. Brouillette acknowledged that LNG would cost more than piped gas but said that LNG supplies from Qatar and other countries would help diversify supply sources to Europe. “It is good for the national security of Europe,” he said. “Cheap gas comes at a high price of freedom.” In September, Qatar said it would invest 10 billion euros ($11.6 billion) to strengthen its ties with Germany over the next five years, including the possible creation of a LNG terminal. Brouilette also said that the U.S. is talking with both Saudi Arabia and Kuwait to encourage both Gulf allies to resolve a lingering issue over resuming oil production at jointly operated oilfields. The two OPEC countries halted output from the jointly run oilfields - Khafji and Wafra - in the so-called Neutral Zone more than three years ago, cutting some 500,000 barrels per day or 0.5 percent of global oil supply. “We have had some conversations with the Kuwaitis and the Saudis about this. My understanding is they made some progress on the offshore fields,” he said. “They were getting closer to resolving the matter.” (Editing by Jason Neely)",https://uk.reuters.com/article/usa-energy-gulf/u-s-wants-qatar-to-challenge-russian-gas-in-europe-u-s-official-idUKL8N1ZE1XG,14 Jan 2019,"* Qatar to invest $20 bln in U.S. LNG terminal, energy
assets",U.S. wants Qatar to challenge Russian gas in Europe -U.S. official
2019-01-14,"Jan 14 (Reuters) - Extreme volatility returned to U.S. natural gas futures on Monday, with the front-month up over 8 percent on forecasts for much colder weather and more heating demand than previously expected through the end of January. In their latest midday predictions, meteorologists said the weather would turn intensely cold starting Jan. 19 and remain frigid across much of the country through at least the end of January. Front-month gas futures for February delivery on the New York Mercantile Exchange were up 26.5 cents, or 8.6 percent, at $3.364 per million British thermal units at 7:23 a.m. EST (1223 GMT), their highest since Dec. 28. That puts the contract on track for its biggest daily percentage gain in almost four weeks. Reporting by Scott DiSavino
Editing by Chizu Nomiyama",https://uk.reuters.com/article/usa-natgas/u-s-natgas-futures-soar-8-pct-on-frigid-weather-through-late-jan-idUKL1N1ZE0BA,14 Jan 2019,"Extreme volatility returned to U.S.
natural gas futures on Monday, with the front-month up over 8
percent on forecasts for much colder weather and more heating
demand than previously expected through the end of January.",U.S. natgas futures soar 8 pct on frigid weather through late Jan.
2019-01-14,"LONDON, Jan 14 (Reuters) - Raw sugar futures on ICE fell on Monday as speculators took a breather from buying back short positions, while arabica coffee also slipped as the Brazilian real weakened. * March raw sugar was down 0.11 cents, or 0.9 percent, at 12.67 cents per lb by 1215 GMT. * Last week, prices posted their best weekly performance since October. However, dealers said the technical picture was weakened when the market failed to break above 13 cents. * Speculative activity also remained in focus, with participants trying to gauge fund positioning in the absence of Commitment of Trader reports due to the U.S. government shutdown. * “The market consensus is that the system funds have been buying back shorts but are still net short,” Marex Spectron said in a report. * Dealers said the market also continued to track energy prices as crude oil fell back again on Monday. * March white sugar fell $2.50, or 0.7 percent, to $342.40 a tonne. * Dealers said sentiment was somewhat dampened by signs of weak demand for spot supplies and lacklustre interest in taking delivery of the March contract. * Indonesia also said it may not import white sugar for household use in 2019 due to sufficient stocks and higher production, as three new sugar mills start operation this year. * Ukraine had produced 1.69 million tonnes of white sugar by Jan. 11 from 12.46 million tonnes of sugar beet, the Ukrtsukor sugar union said. * March arabica coffee fell 0.75 cents, or 0.7 percent, to $1.0310 per lb, weighed by a weaker Brazilian real. * A weaker currency in the top grower improves local returns on dollar-traded commodities like coffee, encouraging producers to hedge their supplies. * March robusta coffee was down $11, or 0.7 percent, at $1,532 a tonne. * Coffee is a booming business for Western retailers but the farmers who grow the crop are facing a crisis, with arabica prices at their lowest for nearly 13 years. * May London cocoa rose 4 pounds, or 0.2 percent, to 1,732 pounds a tonne. * March New York cocoa rose $3, or 0.1 percent, to $2,359 a tonne. * Market participants were awaiting European cocoa grind data for the fourth quarter of 2018, due out on Wednesday, for fresh indications of demand. (Reporting by Ana Ionova; Editing by Mark Potter)",https://uk.reuters.com/article/global-softs/softs-raw-sugar-slips-as-funds-step-back-arabica-coffee-also-falls-idUKL8N1ZE3BW,14 Jan 2019,"Raw sugar futures on ICE fell on
Monday as speculators took a breather from buying back short
positions, while arabica coffee also slipped as the Brazilian
real weakened.",SOFTS-Raw sugar slips as funds step back; arabica coffee also falls
2019-01-14,"* China’s Dec exports, imports tumble, miss forecasts * Auto stocks, luxury goods pull European shares down * Oil, copper weighed down by fears of slowing global growth * U.S. stock futures sharply lower ahead of earnings kickoff By Karin Strohecker and Ritvik Carvalho LONDON, Jan 14 (Reuters) - Global stock markets and commodities took a hit on Monday after a shock contraction in Chinese trade pointed to deepening cracks in the world’s second-largest economy and sparked fears of a sharper slowdown in global growth. Data from China showed imports fell 7.6 percent year-on-year in December while analysts had predicted a 5 percent rise. Exports dropped 4.4 percent, confounding expectations for a 3 percent gain. For an interactive version of the following chart, click here tmsnrt.rs/2SRopIf. The data reinforced fears U.S. tariffs on Chinese goods were starting to hit China’s cooling economy, while softening demand has been felt around the world with sales of goods ranging from iPhones to automobiles slowing, prompting profit warnings from Apple among others. Adding to the gloom were weak industrial output numbers from the euro zone, which posted their largest fall in nearly three years. The index of Europe’s leading 300 shares fell 0.9 percent by noon in London. Germany’s DAX and France’s CAC were down over half a percent and 0.9 percent respectively, with shares in European luxury goods companies and the automotive sector suffering some of the biggest declines. The falls in Europe followed hefty declines in Asia where MSCI’s broadest index of Asia-Pacific ex-Japan shares lost around 1 percent from Friday’s 1-1/2 month high - its biggest single-day percentage drop since Jan. 2. Chinese and Hong Kong shares suffered the worst hits. “December’s (China) trade data were soft, but the data for the preceding months were surprisingly strong and show exports to the US growing at a decent pace, which may reflect producers trying to front-run any future escalation in tariffs,” wrote Neil Shearing, group chief economist at Capital Economics in a note to clients. U.S. futures showed no let-up on the horizon, with Nasdaq e-mini futures pointing to falls over 1 percent for tech stocks while industrials looked set to open 0.9 percent softer. The prospect of slowing global growth also roiled commodity markets, with oil prices slipping over 1 percent . Industrial metals copper and aluminium lost ground in London and Shanghai. Safe-haven trades benefited from the equity pullback with U.S. 10-year Treasury yields falling to as low as 2.6690 percent - their lowest level in a week - while gold prices gained. The world’s two largest economies have been in talks for months to try and resolve their bitter trade war, with no signs of substantial progress. Some analysts expect China’s latest data to provide impetus to Beijing to resolve the trade dispute with Washington. Though Citi analysts said even with the rising probability for both sides to reach an agreement, the tariff and trade disruption appears to have already rippled through the global economy. “Regional trade growth appears to have slowed substantially after front-loading effect diminished,” they said. In light of the trade dispute, China’s policymakers have already pledged to step up support this year, following a raft of measures in 2018 including fast tracking infrastructure projects and cuts in banks’ reserve requirements and taxes. In currency markets, the yuan gave up some recent gains in both onshore and offshore trading. The Chinese currency had recorded its best week in more than a decade last week. However, this could change, said Tim Graf, head of macro strategy EMEA at State Street. “The weakness in the Chinese data is calling into question the recent strength of the renminbi,” said Graf. “The downside for dollar/Chinese yuan is limited and that has implications for the euro and the Aussie dollar.” The dollar index as measured against a basket of currencies nudged 0.1 percent lower to 95.558. The Australian dollar and New Zealand dollar - both gauges of global risk appetite - were both last down 0.3 percent. The euro was flat at $1.14710. Britain’s pound hit a seven-week high as Prime Minister Theresa May made last-ditch efforts to garner lawmakers’ support for her Brexit divorce deal, which looks almost certain to fail when it is put to a vote on Tuesday. For the U.S. trading day, banks will be in sharp focus as they kick off the earnings season. Quarterly results from Citigroup are due on Monday followed by JPMorgan Chase , Wells Fargo, Goldman Sachs and Morgan Stanley later this week. Expectations are downbeat with profits for U.S. companies forecast to rise 6.4 percent, down from an Oct. 1 estimate of 10.2 percent and a big drop from 2018’s tax cut-fuelled gain of more than 20 percent. Investor attention was also on the U.S. government shutdown, in its 24th day with no resolution in sight. Reporting by Karin Strohecker, additional reporting by Swati
Pandey in Sydney and Dhara Ranasinghe in London
Editing by Susan Fenton and John Stonestreet",https://uk.reuters.com/article/global-markets/global-markets-china-trade-shock-hits-global-stocks-commodities-idUKL8N1ZE3G7,14 Jan 2019,"Global stock markets and
commodities took a hit on Monday after a shock contraction in
Chinese trade pointed to deepening cracks in the world's
second-largest economy and sparked fears of a sharper slowdown
in global growth.","GLOBAL MARKETS-China trade shock hits global stocks, commodities"
2019-01-14,"JAKARTA, Jan 14 (Reuters) - Two Indonesian F-16 fighter jets forced an Ethiopian Airlines cargo plane to land on Monday at an airport on Batam island after it had flown into Indonesian airspace without permission, an air force spokesman said. Air force spokesman First Marshal Novyan Samyoga said in a statement the Boeing Co 777 cargo plane had been secured by air force personnel at Hang Nadim international airport on Batam, an island south of Singapore. The cargo flight ETH 3728 had been flying from the Ethiopian capital Addis Ababa to Hong Kong, Suwarso, head of Hang Nadim airport, said in a text message to Reuters. Officials at Ethiopian Airlines could not immediately be reached for comment. (Reporting by Agustinus Beo Da Costa Writing by Ed Davies Editing by Darren Schuettler)",https://uk.reuters.com/article/indonesia-airlines-ethiopia/indonesian-jets-force-ethiopian-cargo-plane-to-land-over-airspace-breach-idUKL3N1ZE35Q,14 Jan 2019,"Two Indonesian F-16 fighter jets
forced an Ethiopian Airlines cargo plane to land on
Monday at an airport on Batam island after it had flown into
Indonesian airspace without permission, an air force spokesman
said.",Indonesian jets force Ethiopian cargo plane to land over airspace breach
2019-01-14,"ABUJA (Reuters) - A court hearing to consider allegations that the head of Nigeria’s judiciary breached asset declaration rules was adjourned on Monday until Jan. 22, weeks ahead of a presidential election in which he could play a crucial role. Chief Justice Walter Onnoghen did not appear at the Code of Conduct Tribunal (CCT) hearing.   Nigeria’s judiciary plays a key role in election matters and has helped resolve disputes in past votes. That means Onnoghen or his successor could help decide the victor if results of the Feb. 16 poll are disputed in court. President Muhammadu Buhari, who was a military ruler in the early 1980s, is seeking a second term and is campaigning on his anti-corruption record. The conduct tribunal, which tries asset declaration misdemeanours, said in a statement on Saturday that Onnoghen would face six separate charges, but did not give further details. Onnoghen could not be reached for comment. Under Nigerian law, state officials must declare their assets before taking office and after they leave.  The court agreed that the chief justice was not properly served with a court summons because papers were served to his personal assistant and not Onnoghen himself.  “The case is adjourned to Tuesday 22nd January. Before then, the defendant would have been properly served,” said Danladi Umar, chairman of the Code of Conduct Tribunal. The charges stem from allegations made by Dennis Aghanya, who served as Buhari’s media aide between 2009 and 2011 and worked with the president in his now defunct Congress for Progressive Change (CPC) party.   The opposition People’s Democratic Party (PDP) said Buhari’s ruling party was plotting to destabilise the judiciary ahead of elections by seeking to remove Onnoghen, which they say could cause a constitutional crisis.  Buhari’s ruling All Progressives Congress (APC) party said it was committed to addressing corruption allegations and that the opposition’s claims were a “baseless conspiracy theory”.  Writing by Alexis Akwagyiram; Editing by Catherine Evans",https://uk.reuters.com/article/nigeria-politics/nigerias-top-judge-asset-declaration-trial-postponed-to-jan-22-idUKL8N1ZE2ST,14 Jan 2019,"A court hearing to consider
allegations that the head of Nigeria's judiciary breached asset
declaration rules was adjourned on Monday until Jan. 22, weeks
ahead of a presidential election in which he could play a
crucial role.",Nigeria's top judge asset declaration trial postponed to Jan.22
2019-01-14,,https://uk.reuters.com/article/asia-naphtha/asia-naphtha-gasoline-gasoline-returns-to-positive-zone-idUKL3N1ZE31Z,14 Jan 2019,"Asia's naphtha crack extended gains to reach a 1-1/2 week high
of $44.68 a tonne on Monday while the gasoline crack returned to the positive territory of 19
cents a barrel for the first time in nearly a week, supported by weaker feedstock crude oil
prices.
    - Naphtha trades were mostly muted following a string of purchases last week, mostly for
cargoes scheduled for second-half February delivery. 
    - Japan's Fuji Oil was one of those buyers that had bought",Asia Naphtha/Gasoline-Gasoline returns to positive zone
