publish_datetime,content,href,publish_timestr,summarize,title
2019-02-07,"(Updates with early European trading) * World shares down for second day, dollar powers up for fifth day * European bourse, euro hit by more weak German data * European Commission slashes Italy growth forecast * Asia ex-Japan shares tick up, Australia leads gains * Dollar holds gains as kiwi slides on jobs data By Marc Jones LONDON, Feb 7 (Reuters) - World shares ground to a halt on Thursday as the dollar scored its longest winning streak since a hot run in early October that helped set off a wave of global ‘bear’ markets. Some poor earnings and weak data out of Germany ensured Europe’s main bourses started lower and kept MSCI’s main index of world stocks heading for only its second two-day run of falls of the year so far. The extent of the current slowdown in the global economy was highlighted as India unexpectedly cut its interest rates and the euro got hit to $1.1346 by Germany’s fourth consecutive drop industrial output. That only compounded the 1.3 percent the euro has lost over the last week and the tailwind behind the dollar, which has risen every day since Friday’s strong U.S. jobs data. It has also recovered almost all the losses suffered after the Federal Reserve all but abandoned plans for more rate hikes last month. “Another day, another piece of terrible German data. EUR/USD risks a move to $1.1300,” said ING’s chief EMEA FX and interest rate strategist, Petr Krpata. Elsewhere the pound was struggling near $1.29 again ahead of a Bank of England meeting, while gloomy jobs data saw New Zealand’s dollar suffer a similar flop as its Australian counterpart had seen the previous day. The kiwi slid to $0.6744, losing nearly 2 percent in the past 24 hours, as investors wagered on the risk of a cut in interest rates there. The country’s central bank holds its first meeting of the year next week. Asian trading was still light overall though with China on holiday and no major economic data on the diary. MSCI’s broadest index of Asia-Pacific shares outside Japan added 0.1 percent as it rose to its highest since early October. The index has risen steadily since early January as the U.S. Federal Reserve changed its tune and emerging markets have surged more broadly after a torrid 2018. Australia’s benchmark stock index jumped 1.2 percent amid expectations of easy monetary policy after the country’s central bank chief shifted away from his previous tightening bias. Japan’s Nikkei slipped 0.6 percent though and the caution quickly spread to Europe. London’s FTSE was the only major bourse clinging to positive territory whereas the rest were down at least 0.2 percent as were E-Mini futures for the S&P 500 and Dow . One of the day’s big surprises came from India where its central bank unexpectedly lowered interest rates to 6.25 percent to boost a slowing economy after a sharp slide in the inflation rate. Italy’s bonds were back under pressure with the European Commission slashing its 2019 growth forecast. Italy agreed a deficit target of 2.04 percent in December, averting a major fall-out with the EU, though this was based on a growth assumption of 1.0 percent. Slowing growth in Italy could make it harder for the country to remain within EU rules. However, Benjamin Schroeder, rates strategist at ING, said he did not expect the EU to demand more fiscal tightening from Italy, should its forecasts be reduced. “The EU has another thing to deal with — Brexit — and the other thing is do you want to infuse the campaign ahead of the parliamentary elections with this topic.” The next major trigger for markets will more likely be any breakthrough in the U.S.-Sino tariff talks when the two sides meet in Beijing next week. U.S. President Donald Trump offered little new to chew on in his State of the Union speech but Treasury Secretary Steven Mnuchin said on Wednesday he and other U.S. officials will aim to clinch a deal next week to avert a March 2 increase in U.S. tariffs on Chinese goods. Probably more pressing though for the U.S. markets is the threat of another government shutdown, Nick Twidale, an analyst at Rakuten Securities Australia said. “With both sides of the house standing firm on the contentious border wall issue at present and the deadline approaching swiftly on Feb 15 we could be back where we were just a few weeks ago.” The broad dollar gains put pressure on gold, which eased to $1,303.96 per ounce, slipping further from last week’s top of $1,326.30. Oil prices eased too after U.S. crude inventories rose and as production levels in the country held at record levels. Brent crude futures slipped 23 cents to $62.46. U.S. crude eased 19 cents to $53.82 a barrel. Additional Reporting by Wayne Cole and Swati Pandey in Sydney
and Virginia Furness and Tom Finn in London; Editing by Toby
Chopra",https://uk.reuters.com/article/global-markets/global-markets-shares-go-weak-as-dollar-extends-power-surge-idUKL5N2023BS,07 Feb 2019,"* World shares down for second day, dollar powers up for
fifth day",GLOBAL MARKETS-Shares go weak as dollar extends power surge
2019-02-07,"MELBOURNE (Reuters) - Australian coal haulier Pacific National said on Thursday that one of its trains derailed near the Hunter Valley in New South Wales and that some services would be affected while repair work was carried out. The Hunter Valley is Australia’s top thermal coal-producing region and home to operations run by Yancoal, Glencore and Peabody Energy. There were no injuries, Pacific National said in an emailed statement, adding that the train had derailed in the early morning on Wednesday near the area of Baerami with the last six wagons coming off the tracks. “The regulator is currently onsite assessing the situation with the removal of the wagons and repairs to the track expected to commence after assessments have been completed,” the company said. Pacific National said rail services west of Mount Pleasant would be impacted while the work is being done.  The Australian Transport Safety Bureau said it was investigating the incident that caused damage to around 2 km (1.3 miles) of the train track.  The train had been travelling through a section of the network that was under a temporary speed restriction of 20 km per hour (13 miles per hour), which had been imposed to “mitigate risk due to a measured series of defects in the track,” the investigator said in a statement on its website. A Yancoal spokesman said that its Moolarben Coal complex  had been directly impacted by the train derailment but that it was too early to advise of any potential impact to customers, as it awaited confirmation of when haulage would restart. A Glencore spokesman referred Reuters to Pacific National. Representatives from Peabody were not immediately available to comment.    The incident is Australia’s third freight train derailment in as many months. BHP Group forced a train off its tracks in November after it ran away without its driver en route to the northwestern iron ore export hub of Port Hedland. In December, around 30 wagons in an empty iron ore train derailed around 700 km (438 miles) east of Perth after poor weather eroded part of the track. Reporting by Melanie Burton; additional reporting by Fergus Jensen in JAKARTA; editing by Kenneth Maxwell",https://uk.reuters.com/article/australia-train-derailment/update-2-australias-pacific-national-says-coal-train-derailed-service-impacted-idUKL3N2021DK,07 Feb 2019,"* Hunter Valley is Australia's top thermal coal-producing
region","UPDATE 2-Australia's Pacific National says coal train derailed, service impacted"
2019-02-07,"LONDON (Reuters) - Europe’s offshore wind capacity grew by 18 percent in 2018 as new wind farms came online and it is expected to rise further this year, industry group WindEurope said. Europe installed 2.6 gigawatts (GW) of new offshore wind energy in 2018, raising total capacity to 18.5 GW, WindEurope’s annual report on the industry shows. Britain and Germany accounted for 85 percent of the new capacity, adding 1.3 GW and 969 megawatts respectively. Another six offshore wind farms are currently under construction in Europe, the report said. In addition, another 12 new offshore wind projects reached a final investment decision stage last year, representing a further 4.2 GW of capacity and 10.3 billion euros of investment. “Offshore wind now represents 2 percent of all the electricity consumed in Europe. And with a big pipeline of projects under construction and development, this number will rise significantly,” WindEurope chief executive Giles Dickson said in a statement. “The technology keeps developing. The turbines keep getting bigger. And the costs keep falling. It’s now no more expensive to build offshore wind than it is to build coal or gas plants. And it’s a good deal cheaper than new nuclear,” he added. WindEurope has more than 400 members such as turbine manufacturers, component suppliers, wind energy developers and electricity suppliers. Reporting by Nina Chestney; editing by David Evans",https://uk.reuters.com/article/europe-wind/europes-offshore-wind-capacity-rose-18-pct-last-year-industry-group-idUKL5N202378,07 Feb 2019,"Europe's offshore wind capacity
grew by 18 percent in 2018 as new wind farms came online and it
is expected to rise further this year, industry group WindEurope
said.",Europe's offshore wind capacity rose 18 pct last year -industry group
2019-02-07,"PARIS (Reuters) - French oil and gas major Total has not made a decision on whether to bid for Dutch energy company Eneco, the firm’s chief executive Patrick Pouyanne said on Thursday. Total has been mentioned alongside others including Shell as vying for Eneco, which analysts estimate to be worth around 3 billion euros ($3.41 billion).     “We are in the Netherlands. We are one of the players. We have a marketing and services activity, we have a refining activity, so we know the Netherlands and it is true that we are willing to expand our electricity portfolio,” Pouyanne said.   Total is focused on completing and merging the activities of Belgium’s Lampiris, and French alternative power provider Direct Energie, which it bought for 1.7 billion last year. The French firm has said it plans to grow its retail electricity business with a target for at least 15 percent of the French retail gas and power market by 2022, or seven million customers in France and Belgium.  It has also said it was keen to enter other European markets.               “We are looking at various opportunities and we will see if this one is of interest for us,” Pouyanne said, adding that a decision has not been made. ($1 = 0.8808 euros) Reporting by Bate Felix; Editing by Jan Harvey and Alexander Smith",https://uk.reuters.com/article/total-eneco/update-1-frances-total-undecided-on-bid-for-dutch-energy-firm-eneco-idUKL5N20237E,07 Feb 2019,"French oil and gas major Total
has not made a decision on whether to bid for Dutch
energy company Eneco, the firm's chief executive
Patrick Pouyanne said on Thursday.",UPDATE 1-France's Total undecided on bid for Dutch energy firm Eneco
2019-02-07,"PARIS, Feb 7 (Reuters) - French oil and gas major Total has not made a decision on whether to bid for Dutch energy company Eneco, the firm’s chief executive Patrick Pouyanne said on Thursday. Total has been mentioned alongside other energy companies including Shell as those vying for the company, which analysts estimate to be worth around 3 billion euros ($3.41 billion). (Reporting by Bate Felix; Editing by Jan Harvey)",https://uk.reuters.com/article/total-eneco/total-has-not-made-a-decision-on-eneco-bid-ceo-idUKL5N20233B,07 Feb 2019,"French oil and gas major Total
has not made a decision on whether to bid for Dutch
energy company Eneco, the firm's chief executive
Patrick Pouyanne said on Thursday.",Total has not made a decision on Eneco bid - CEO
2019-02-07,"OSLO (Reuters) - TGS, a provider of seismic data for the oil industry, proposed a higher-than-expected dividend on Thursday as its quarterly earnings rose, though less than forecast, and saw demand for its services picking up this year.  The company said there were signs of strengthening demand in 2019 despite uncertainty related to factors such as U.S. onshore production, oil prices and exploration and production budgets. While oil companies have increased their exploration investments after years of cost cuts, recent crude price volatility has impacted their spending on seismic data. Seismic surveyors like TGS are a bellwether of oil companies’ appetite for conducting exploration for oil and gas deposits. “With the market fundamentals continuing to improve, they (oil companies) are likely to come under increasing pressure to replenish reserves and secure growing production in the longer-term,” TGS said in a statement. Earnings before interest and taxes (EBIT) rose to $68 million in the last quarter of 2018, from $51.6 million a year ago, but lagged market expectations of $77.8 million in a Reuters poll of analysts.    The company increased its quarterly dividend from $0.20 per share to $0.27 per share, higher than the $0.24 per share expected in the Reuters poll.  The company said it expected its investments in new multi-client surveys, data of which it can sell to a number of buyers, to rise 20 percent to $300 million in 2019. Commitments from buyers ahead of multi-client surveys, or pre-funding revenues, were expected to cover about 40-45 percent of the investments this year, it added.  Last year, TGS spending on new multi-client surveys totaled $250 million with pre-funding levels at 42 percent, compared with the previous guidance of $260 million and around 40 percent respectively. Its sales after seismic data is gathered, or so-called late sales, rose nearly 6 percent to $152 million in the fourth-quarter from a year ago. Unlike some of its competitors, such as PGS, TGS does not own seismic vessels and rents them. Last November, TGS announced a strategic partnership with Norway’s Axxis Geo Solutions (AGS) for multi-client ocean bottom node projects in the North Sea.  The technology allows surveyors to get a sharper image of sub-surface petroleum reservoirs, improving chances of making discoveries or increasing recovery from the producing fields. Writing by Michal Kahn, Editing by Nerijus Adomaitis/Terje Solsvik and Emelia Sithole-Matarise",https://uk.reuters.com/article/tgs-results/update-2-seismic-surveyor-tgs-boosts-dividend-sees-2019-demand-strengthening-idUKL5N20219R,07 Feb 2019,"* Multi-client surveys forecast up 20 pct in 2019
(Adds details, background, company statement)","UPDATE 2-Seismic surveyor TGS boosts dividend, sees 2019 demand strengthening"
2019-02-07,"(Updates to add details, context, quotes) MOSCOW, Feb 7 (Reuters) - Russian steelmaker MMK’s fourth quarter core earnings fell 9.3 percent year-on-year although it said earnings for 2018 as a whole were up 19 percent to a record $2.4 billion. “The decrease in revenue for the fourth quarter of 2018 was due to the fall in the average sale price of finished products against a backdrop of a seasonal decrease in sales of steel products,” MMK said in a statement. Shares in MMK were down 0.08 percent at 0804 GMT after it said fourth quarter earnings before interest, taxation, depreciation and amortisation (EBITDA) fell to $537 million, from $592 million in the fourth quarter of 2017. The steelmaker also blamed a growing cost of sales quarter-on-quarter, mainly due to higher prices of key raw materials. Although higher iron ore prices will affect results in the first quarter of 2019, this should be offset by a seasonal recovery in steel prices, it added. In general, 2019 should bring sufficient demand to maintain high capacity utilisation at MMK facilities, supported by high global steel consumption and restrictions on production in China, the company said. MMK said its net profit fell 35 percent year-on-year to $245 million, while fourth quarter free cash flow was $239 million. “Free cash flow beat our expectations by 54 percent... As a result, we anticipate MMK’s dividend yield should beat our expectations and have 3 percent dividend yield,” BCS Global Markets analyst Oleg Petropavlovsky said in a note. In November the firm, controlled by Russian businessman Viktor Rashnikov, recommended a third-quarter dividend payment of 2.114 roubles per share. It has not yet announced its fourth quarter dividend. MMK said its capital expenditure in 2018 as a whole was $860 million, meaning major investment projects were being implemented at a faster pace than initially envisaged. It expects its capex to remain unchanged in 2019. (Reporting by Maxim Rodionov and Vladimir Soldatkin; Writing by Polina Ivanova; editing by Jason Neely and Alexander Smith)",https://uk.reuters.com/article/mmk-results/update-1-russian-steelmaker-mmks-record-year-loses-shine-in-last-quarter-idUKL5N2021Y0,07 Feb 2019,"Russian steelmaker MMK's
fourth quarter core earnings fell 9.3 percent year-on-year
although it said earnings for 2018 as a whole were up 19 percent
to a record $2.4 billion.",UPDATE 1-Russian steelmaker MMK's record year loses shine in last quarter
2019-02-07,"LAGOS, Feb 7 (Reuters) - A judge has adjourned a Lagos court case between South African telecoms firm MTN Group and Nigeria’s attorney general over a $2 billion tax demand until Mar. 26, the court said on Thursday. MTN faces the demand from the country’s attorney general, a claim which the company has said is without merit. Nigeria handed MTN the tax bill in September, but the company said the attorney general had exceeded his powers in making the demand. (Reporting by Didi Akinyelure; Writing by Alexis Akwagyiram; Editing by Jan Harvey)",https://uk.reuters.com/article/mtn-group-nigeria/nigerian-court-adjourns-mtn-case-until-mar-26-idUKL0N1RH00U,07 Feb 2019,"A judge has adjourned a Lagos court
case between South African telecoms firm MTN Group and
Nigeria's attorney general over a $2 billion tax demand until
Mar. 26, the court said on Thursday.",Nigerian court adjourns MTN case until Mar. 26
2019-02-07,"PARIS, Feb 7 (Reuters) - French oil and gas major Total said it had made a significant gas condensate discovery after drilling its Brulpadda prospects on Block 11B/12B in the Outeniqua Basin, offshore South Africa. Total said the Brulpadda well encountered 57 meters of net gas condensate pay in Lower Cretaceous reservoirs. The well was deepened to a final depth of 3,633 meters and has also been successful. “With this discovery, Total has opened a new world-class gas and oil play and is well positioned to test several follow-on prospects on the same block,” Total’s senior vice president for exploration Kevin McLachlan said in a statement. Brulpadda is one of several highly anticipated exploration prospects for the year. Total has said the field could hold between 500 million to over 1 billion barrels of oil equivalent. Following the success of Brulpadda and confirmation of its potential, Total and its partners plan to acquire 3D seismic this year, followed by up to four exploration wells on the license, the company said. Total has a 45 percent working interest and is the operator of the Block 11B/12B which covers an area of 19,000 square kilometres. Other partners include Qatar Petroleum with a 25 percent stake, CNR International holds 20 percent and Main Street, a South African consortium 10 percent. (Reporting by Bate Felix; Editing by Sudip Kar-Gupta)",https://uk.reuters.com/article/total-exploration-discovery/oil-major-total-makes-significant-discovery-offshore-south-africa-idUKP6N1ZB01K,07 Feb 2019,"French oil and gas major Total
said it had made a significant gas condensate
discovery after drilling its Brulpadda prospects on Block
11B/12B in the Outeniqua Basin, offshore South Africa.",Oil major Total makes significant discovery offshore South Africa
2019-02-07,"Feb 7 (Reuters) - Britain’s regulator said on Thursday it would let energy suppliers raise the annual price cap by 117 pounds ($151.35) from April 1. Ofgem was tasked by parliament to set a limit after lawmakers said customers were being overcharged for electricity and gas. Prime Minister Theresa May had called the tariffs a “rip-off”. The cap for average annual consumption will rise to 1,254 pounds from 1,137 pounds. ($1 = 0.7730 pounds) (Reporting by Arathy S Nair in Bengaluru; Editing by Arun Koyyur)",https://uk.reuters.com/article/britain-energy-prices/british-energy-bills-to-rise-by-117-pounds-a-year-regulator-idUKL3N2021A3,07 Feb 2019,"Britain's regulator said on Thursday it
would let energy suppliers raise the annual price cap by 117
pounds ($151.35) from April 1.",British energy bills to rise by 117 pounds a year - regulator
