,author,content,description,publishedAt,source,title,url,urlToImage,relevancy
181,Tsetso Mihailov,"Scan Your System for Malicious Files Threats such as.impect Files Virus may be persistent. They tend to re-appear if not fully deleted. A malware removal tool like Combo Cleaner will help you to remove malicious programs, saving you the time and the struggle … [+9447 chars]",".impect Files Virus is actually ransomware, so it encrypts your files and opens a ransom note, with instructions inside it, about the compromised computer machine. The extortionists want you to pay a ransom fee for the alleged restoration of your data..",2018-11-14T17:09:00Z,"{'id': None, 'name': 'Sensorstechforum.com'}",.impect Files Virus – How to Remove,https://sensorstechforum.com/impect-files-virus-remove/,https://sensorstechforum.com/wp-content/uploads/2018/11/stf-impect-ransomware-virus-how-to-remove.jpg,227
182,Shawn King,Revue There was always something distasteful about Amazon's quest to find a home for its HQ2. Even when it November 13 · Issue #246 · View online There was always something distasteful about Amazons quest to find a home for its HQ2. Even when it seemed like i… [+9763 chars],"There was always something distasteful about Amazon's quest to find a home for its HQ2. Even when it seemed like it might be a fair fight, it was depressing to watch so many cities and towns prostrating themselves before a tech giant in hopes they would score…",2018-11-14T17:10:37Z,"{'id': None, 'name': 'Getrevue.co'}",Amazon misreads the room,https://www.getrevue.co/profile/caseynewton/issues/amazon-misreads-the-room-144903,https://s3.amazonaws.com/revue/issue_images/images/000/045/569/original/issue_image_14490320181114-4-1ljknn8jpg?1542156594,154
183,"Paul Flahive, Texas Public Radio","Rockdale, a small town in Texas, is the site of what could be the biggest bitmine operation in the country. As Texas Public Radio's Paul Flahive ( @paulflahive ) reports, the town is no stranger to booms and busts.","Rockland, a small town in Texas, is the site of what could be the biggest bitmine operation in the country. As Texas Public Radio’s Paul Flahive ( @paulflahive ) reports, the town is no stranger to booms and busts. Copyright 2018 NPR. To see more, visit http:…",2018-11-14T17:11:00Z,"{'id': None, 'name': 'Wbur.org'}",One Tiny Texas Town Hopes New Bitcoin Operation Can Turn Its Luck Around,http://www.wbur.org/hereandnow/2018/11/14/bitcoin-rockland-texas,https://d279m997dpfwgl.cloudfront.net/wp/2016/06/HereandNow-3000b.jpg,177
184,Independent.ie Business Desk,"""The market had been entering a wedge, with the volatility so low,"" said Charlie Hayter, founder of industry website Cryptocompare in London, referring a technical chart pattern. ""What you are seeing low is a breakout on the downside. Sometimes when things ha… [+246 chars]","Bitcoin fell to a more than one-year low, falling below a key support level of $6,000, with traders and analysts unclear on what caused the sudden drop in price.",2018-11-14T17:12:36Z,"{'id': None, 'name': 'Independent.ie'}",Bitcoin stumps analysts as currency falls to more than one-year low,https://www.independent.ie/business/technology/bitcoin-stumps-analysts-as-currency-falls-to-more-than-oneyear-low-37528897.html,https://www.independent.ie/business/article36706283.ece/ALTERNATES/h342/2018-02-22_bus_38741603_I1.JPG,217
185,Reuters Editorial,"NEW YORK (Reuters) - Bitcoin fell to a more than one-year low on Wednesday, falling below a key support level of $6,000, with traders and analysts unclear on what caused the sudden drop in price. “The market had been entering a wedge, with the volatility so l… [+551 chars]","Bitcoin fell to a more than one-year low on Wednesday, falling below a key support level of $6,000, with traders and analysts unclear on what caused the sudden drop in price.",2018-11-14T17:14:17Z,"{'id': 'reuters', 'name': 'Reuters'}","Bitcoin extends losses, drops to lowest in more than a year",https://www.reuters.com/article/us-crypto-currencies-bitcoin-idUSKCN1NJ2GY,https://s2.reutersmedia.net/resources/r/?m=02&d=20181114&t=2&i=1325379371&w=1200&r=LYNXNPEEAD1MD,35
186,Beautyon,"Bitcoin is a very new technology, even though the concept that it brings to life is decades old. The double spending problem has been solved; this means that it is possible to use a digital certificate to stand in the place of money and be sure that no one el… [+11323 chars]","Bitcoin is a very new technology, even though the concept that it brings to life is decades old. The double spending problem has been…",2018-11-14T17:17:34Z,"{'id': None, 'name': 'Hackernoon.com'}",Why the Price of Bitcoin Doesn’t Matter,https://hackernoon.com/why-the-price-of-bitcoin-doesnt-matter-64cb35528f63,https://cdn-images-1.medium.com/max/1200/1*ktdHgUmIc9-2Kg0RfBg_Uw.png,153
187,Agencies,"International Monetary Fund Managing Director Christine Lagarde said central banks should look into issuing digital currencies. “Various central banks around the world are seriously considering these ideas,” Lagarde said in Singapore on Wednesday. “While the … [+1474 chars]",Economies around the world are becoming increasingly cashless as credit and debit cards or even mobile phone apps are used as modes of payment,2018-11-14T17:20:00Z,"{'id': None, 'name': 'Business-standard.com'}",Central banks should consider issuing digital currencies: IMF chief,https://www.business-standard.com/article/international/central-banks-should-consider-issuing-digital-currencies-imf-chief-118111401553_1.html,https://bsmedia.business-standard.com/_media/bs/img/article/2018-08/16/full/1534432354-911.jpg,207
188,Nikhilesh De,"The New York State Department of Financial Services (DFS) has just issued a new BitLicense to the New York Digital Investment Group (NYDIG), allowing it to offer crypto-related services in the Empire State. According to a press release Wednesday, DFS has gran… [+1467 chars]","New York's latest BitLicense has been granted to the New York Digital Investment Group, along with a limited purpose trust charter.",2018-11-14T17:20:33Z,"{'id': None, 'name': 'Coindesk.com'}",New York Regulators Have Granted Their 14th Crypto License,https://www.coindesk.com/ny-financial-services-new-york-digital-investment-group-bitlicense,https://www.coindesk.com/wp-content/uploads/2017/07/NYC.jpg,41
189,"Dr Shane Oliver, AMP Capital",A few months ago Reserve Bank Governor Phillip Lowe provided four common sense points we should all keep in mind regarding borrowing to finance a home. (The Governors speech can be found here ). I thought they made sense and so summarised them in a tweet to w… [+10646 chars],A few months ago Reserve Bank Governor Phillip Lowe provided four common sense points we should all keep in mind regarding borrowing to finance a home. More »,2018-11-14T17:22:50Z,"{'id': None, 'name': 'Businessinsider.com.au'}","13 tips for managing your personal finances better, according to one of Australia's top economists",https://www.businessinsider.com.au/tips-for-managing-personal-finances-2018-11,https://edge.alluremedia.com.au/uploads/businessinsider/2017/08/stress-computer-640x360.jpg,240
190,Tamer Sameeh,"Black hat hackers, and cyber-criminals are far more sagacious than most of us think. They are no longer script kiddies who are showing off their hacking skills to impress their social circles, but highly professional businessmen who are working meticulously h… [+10412 chars]",Table (1) Dead cryptomarkets with the dates of the data retrieved for this research. The reflexive notes included screenshots and observational points of active marketplaces. Ransomwares listed from active darknet marketplaces were also stored in spreadsheets…,2018-11-14T17:23:00Z,"{'id': None, 'name': 'Deepdotweb.com'}",Research: How ransomware and hacking services are sold on darknet marketplaces,https://www.deepdotweb.com/2018/11/14/research-how-ransomware-and-hacking-services-are-sold-on-darknet-marketplaces/,https://www.deepdotweb.com/wp-content/uploads/2018/11/customisable-ransomware-2-png-617x330.png,228
191,jrohio2,,https://bitchute.info/bitchutes-immediate-removal-from-paypal/ Support my work via donation: Patreon: https://www.patreon.com/Styxhexenhammer666 Bitcoin: 17q...,2018-11-14T17:29:34Z,"{'id': None, 'name': '12160.info'}","FK YOU PAYPAL: Paypal Deplatforms Bitchute, Bending to Pressure from Busybodies and Far Left",http://12160.info/video/paypal-deplatforms-bitchute-bending-to-pressure-from-busybodies,http://api.ning.com:80/files/*9H5-OwBmVLORRqWbQmHf-aBcKlH*V0ktvztaaTlnxQlFvRYz0GOtOVA8Itzl7HkGA0DogEWER*RIYmTGtque4cmZr*xHxRR/2104442650.jpeg,116
192,Allen Scott,"Bitcoin price finally broke through $6,000 support, falling as low as $5,500 with the price still volatile at press time. Bitcoin Price Hits 2018 Low As Bitcoin (BTC) price has flatlined as of late, one could say that it was a welcome sight to have some actio… [+1341 chars]","Bitcoin price finally broke through $6,000 support, falling as low as $5,500 with the price still volatile at press time. Bitcoin Price Hits 2018 Low As Bitcoin (BTC) price has flatlined as of late, one could say that it was a welcome sight to have some actio…",2018-11-14T17:30:25Z,"{'id': None, 'name': 'Bitcoinist.com'}",Bitcoin Price Hits 2018 Low Amid Cries of ‘Capitulation’,https://bitcoinist.com/bitcoin-price-today-2018-low/,https://bitcoinist.com/wp-content/uploads/2018/11/shutterstock_256962580-980x613.jpg,92
193,,"About This Page This is a Techmeme archive page. It shows how the site appeared at 12:40 PM ET, November 14, 2018. The most current version of the site as always is available at our home page. To view an earlier snapshot click here and then modify the date in… [+252 chars]","Kate Rooney / CNBC : Bitcoin dropped to $5,650, its lowest level in over a year, as other major cryptocurrencies fell 10%+; total crypto market has dropped by $15B in 24 hours — - Bitcoin fell more than 7 percent Wednesday, a new low for the year, after a rel…",2018-11-14T17:35:02Z,"{'id': None, 'name': 'Techmeme.com'}","Bitcoin dropped to $5,650, its lowest level in over a year, as other major cryptocurrencies fell 10%+; total crypto market has dropped by $15B in 24 hours (Kate Rooney/CNBC)",https://www.techmeme.com/181114/p26,http://fm.cnbc.com/applications/cnbc.com/resources/img/editorial/2018/09/06/105435011-1536201301773gettyimages-1030734204.530x298.jpeg?v=1536201364,11
194,Berminal - The Crypto News Platform,"Today the cryptocurrency market crashed and analysts will probably spend the rest of the week attempting to determine the sources responsible for the turmoil. At the time of writing, Bitcoin is down 7.76% and trades at a new 3-month low below $6,000. Ethereum… [+2551 chars]","The State of The Market — November 14, 2018
BTC: $5,877.75 (-7.76%)
ETH: $184.87 (-11.62%)
XRP: $0.4488 (-13.63%)",2018-11-14T17:37:31Z,"{'id': None, 'name': 'Hackernoon.com'}","Bitcoin Drops Below $6,000 as the Crypto Market Sharply Corrects Ahead of the Bitcoin Cash Hard…",https://hackernoon.com/bitcoin-drops-below-6-000-as-the-crypto-market-sharply-corrects-ahead-of-the-bitcoin-cash-hard-ec90ae9dbe65,https://cdn-images-1.medium.com/max/1200/1*p7lU2DNDYgAhZC5Xq7lFPw.png,147
195,"Ivan Kan, Co-Founder of Crowdcreate","An Initial Coin Offering, also commonly referred to as an ICO, is a fundraising mechanism in which new projects sell their underlying crypto tokens in exchange for bitcoin and ether. It is somehow similar to an Initial Public Offering (IPO) in which investors… [+17069 chars]","An Initial Coin Offering, also commonly referred to as an ICO, is a fundraising mechanism in which new projects sell their underlying…",2018-11-14T17:40:21Z,"{'id': None, 'name': 'Hackernoon.com'}",Top 30+ STO Security Token Offering Marketing Agencies,https://hackernoon.com/top-30-sto-security-token-offering-marketing-agencies-529a97ca07d6,https://cdn-images-1.medium.com/max/1200/1*E-F6cVa5mIYK71uDvblrvw.jpeg,226
196,"Ashley May, USA TODAY","If NASA is able to overcome huge technological and medical hurdles, the agency believes it could send humans to Mars in about 25 years. About 25 years is how long it could take for NASA to send humans to Mars, officials said Tuesday. That's only if the space … [+2199 chars]","Humans might be on Mars in 25 years, NASA says",2018-11-14T17:46:28Z,"{'id': None, 'name': 'King5.com'}","Humans could be heading to Mars in 25 years, NASA says",https://www.king5.com/article/news/nation-now/humans-could-be-heading-to-mars-in-25-years-nasa-says/465-fb416657-67e6-4c51-b623-46e5c9a802af,https://media.king5.com/assets/GANNETT/images/94e11ff1-05c9-4a26-b745-63d6c154c9a4/94e11ff1-05c9-4a26-b745-63d6c154c9a4_1140x641.jpg,270
197,Urowayino Warami,"By Dayo Adesulu While the Central Bank of Nigeria is still thinking whether to accept cryptocurrency as a legal tender or not, the Managing Director, International Monetary Fund (IMF), Christine Lagarde has urged central banks globally to consider issuing dig… [+3624 chars]","While the Central Bank of Nigeria is still thinking whether to accept cryptocurrency as a legal tender or not, the Managing Director, International Monetary Fund (IMF), Christine Lagarde has urged central banks globally to consider issuing digital currency to…",2018-11-14T17:47:42Z,"{'id': None, 'name': 'Vanguardngr.com'}",Cryptocurrency: IMF Managing Director urges world central banks to issue digital currency,https://www.vanguardngr.com/2018/11/cryptocurrency-imf-managing-director-urges-world-central-banks-to-issue-digital-currency/,https://www.vanguardngr.com/wp-content/uploads/2011/06/Christine-Lagarde.jpg,132
198,,The JSE closed softer on Wednesday following a session where the index was trading mostly in the red. The All-Share index was set for some significant volatility as Tencent Holdings released its 3rd quarter earnings earlier on. The earnings from Tencent Holdi… [+2297 chars],The JSE closes softer after trading mostly in the red,2018-11-14T17:52:24Z,"{'id': None, 'name': 'Fin24.com'}",Fin24.com | JSE closes weaker as Tencent releases 3Q earnings,https://www.fin24.com/Markets/Equities/jse-closes-weaker-as-tencent-releases-its-3q-earnings-20181114,http://cdn.24.co.za/files/Cms/General/d/7408/a107fc71d4a7466eb85f082552da6a2b.jpg,206
199,Olga Kharif,"(Bloomberg) -- Bitcoin tumbled below $6,000 for the first time since August and reached the lowest level in over a year, breaking the recent stretch of tranquility exhibited by the notoriously volatile digital alternative to cash. The world’s largest cryptocu… [+1048 chars]",The decline marked a break in the recent stretch of tranquility exhibited by the notoriously volatile digital alternative to cash.,2018-11-14T17:54:32Z,"{'id': None, 'name': 'Bostonglobe.com'}","Bitcoin calm shattered as price dives below $6,000 to lowest level in over a year",https://www.bostonglobe.com/business/2018/11/14/bitcoin-calm-shattered-price-dives-below-lowest-level-over-year/U8t8bR0qqvOOj2u2IgUMvK/story.html,https://www.bostonglobe.com/rf/image_585w/Boston/2011-2020/2018/11/14/BostonGlobe.com/Business/Images/AFP_1A51XS.jpg,69
200,Daniel Friedman,"Matthew Whitaker at a Justice Department roundtable on August 29, 2018. Chip Somodevilla/Getty Images Looking for news you can trust? Subscribe to our free newsletters. In November 2014, a Miami Beach-based firm, World Patent Marketing, announced the marketin… [+7917 chars]","In November 2014, a Miami Beach-based firm, World Patent Marketing, announced the “marketing launch” of a “MASCULINE TOILET,” which boasted a specially designed bowl to help “well-endowed men” avoid unwanted contact with porcelain or water. “The average male …",2018-11-14T17:54:44Z,"{'id': None, 'name': 'Motherjones.com'}",The Acting Attorney General Helped an Alleged Scam Company Hawk Bizarre Products,https://www.motherjones.com/politics/2018/11/the-acting-attorney-general-helped-an-alleged-scam-company-hawk-bizarre-products/,https://www.motherjones.com/wp-content/uploads/2018/11/GettyImages-1025296052.jpg?w=1200&h=630&crop=1,260
201,Jonathan Garber,,"Bitcoin was trading down 9% Wednesday, at its lowest level in over a year. The selling comes as traders ready for a hard fork in rival bitcoin cash. Watch bitcoin trade live. Bitcoin was getting demolished Wednesday, down more than 10% and at its lowest level…",2018-11-14T17:57:00Z,"{'id': 'google-news', 'name': 'Google News'}",Bitcoin tumbles to its lowest level in over a year,http://feedproxy.google.com/~r/typepad/alleyinsider/silicon_alley_insider/~3/jhiweTUNeEE/bitcoin-price-tumbles-to-lowest-level-in-over-a-year-2018-11-1027727051,,12
202,Jonathan Garber,"Markets Insider Bitcoin was getting demolished Wednesday, down more than 10% and at its lowest level in over a year. The world's largest cryptocurrency touched a low of $5,550 a coin, it weakest since October 2017, as widespread selling wreaked havoc on the c… [+1015 chars]","Bitcoin was trading down 9% Wednesday, at its lowest level in over a year. The selling comes as traders ready for a hard fork in rival bitcoin cash. Watch bitcoin trade live. Bitcoin was getting demolished Wednesday, down more than 10% and at its lowest level…",2018-11-14T17:57:00Z,"{'id': 'business-insider', 'name': 'Business Insider'}",Bitcoin tumbles to its lowest level in over a year,https://markets.businessinsider.com/currencies/news/bitcoin-price-tumbles-to-lowest-level-in-over-a-year-2018-11-1027727051,https://static5.businessinsider.com/image/5bec60b8beb67079644e0653-883/screen-shot-2018-11-14-at-123249-pm.png,51
203,Jonathan Garber,,"Bitcoin was trading down 9% Wednesday, at its lowest level in over a year. The selling comes as traders ready for a hard fork in rival bitcoin cash. Watch bitcoin trade live. Bitcoin was getting demolished Wednesday, down more than 10% and at its lowest level…",2018-11-14T17:57:00Z,"{'id': 'business-insider', 'name': 'Business Insider'}",Bitcoin tumbles to its lowest level in over a year,https://www.businessinsider.com/bitcoin-price-tumbles-to-lowest-level-in-over-a-year-2018-11,,15
204,johnu78,"Azadi Tower in Tehran It seems there’s no end in sight to the US economic pressure being levied against Iran. In addition to the second wave of US sanctions which took effect on November 5th, the US government has tried several different ways to undermine or … [+1574 chars]","It seems there’s no end in sight to the US economic pressure being levied against Iran. In addition to the second wave of US sanctions which took effect on November 5th, the US government has tried several different ways to undermine or limit Iranian oil sale…",2018-11-14T18:03:28Z,"{'id': None, 'name': 'Wordpress.com'}",Bitcoin Could Help Mitigate Iran’s Oil Selling Problem,https://cointrader21.wordpress.com/2018/11/14/bitcoin-could-help-mitigate-irans-oil-selling-problem/,https://cointrader21.files.wordpress.com/2018/11/azadi-tower.jpg,122
205,newsfeeds@nzherald.co.nz,"Craig Wright, the self-proclaimed inventor of Bitcoin under the pseudonym Satoshi Nakamoto, is poised to win a fight that will likely lead to the creation of another version of Bitcoin Cash, the original offshoot of the biggest cryptocurrency. A group headed … [+3069 chars]","Craig Wright, the self-proclaimed inventor of Bitcoin under the pseudonym Satoshi Nakamoto, is poised to win a fight that will likely lead to the creation of another version of Bitcoin Cash, the original offshoot of the biggest cryptocurrency.A...",2018-11-14T18:07:00Z,"{'id': None, 'name': 'Nzherald.co.nz'}",Bitcoin founder vs 'Bitcoin Jesus': legal battle turns personal,https://www.nzherald.co.nz/business/news/article.cfm?c_id=3&objectid=12160375,https://www.nzherald.co.nz/resizer/-bJdaDF6NFjeuj79SrKnTRjZTII=/1200x0/smart/filters:quality(70)/arc-anglerfish-syd-prod-nzme.s3.amazonaws.com/public/POGQGJ2ERFENTLRGTKYOYH4KZY.jpg,158
206,"Olga Kharif, Bloomberg","Portland: Bitcoin tumbled below $6,000 for the first time since August and reached the lowest level in over a year, breaking the recent stretch of tranquility exhibited by the notoriously volatile digital alternative to cash. The world’s largest cryptocurrenc… [+1689 chars]","Bitcoin dropped as low as $5,549, the least since October 2017, or just before the surge in demand that pushed its price to almost $20,000 in December",2018-11-14T18:08:37Z,"{'id': None, 'name': 'Livemint.com'}","Bitcoin falls below $6,000 to lowest level in over a year",https://www.livemint.com/Industry/tbkasqyq9lBB12o0gTURsI/Bitcoin-falls-below-6000-to-lowest-level-in-over-a-year.html,https://www.livemint.com/rf/Image-621x414/LiveMint/Period2/2018/11/15/Photos/Processed/bitcoin1-kEbH--621x414@LiveMint.jpg,136
207,Cointelegraph By Helen Partz,,Top global exchange OKEx has announced early delivery of Bitcoin Cash futures contracts immediately after trading stop time today,2018-11-14T18:11:00Z,"{'id': None, 'name': 'Cointelegraph.com'}",OKEx Notes Early Delivery of BCH Futures After Trading Stop to Avoid Market Manipulation,https://cointelegraph.com/news/okex-notes-early-delivery-of-bch-futures-after-trading-stop-to-avoid-market-manipulation,https://images.cointelegraph.com/images/740_aHR0cHM6Ly9zMy5jb2ludGVsZWdyYXBoLmNvbS9zdG9yYWdlL3VwbG9hZHMvdmlldy8wYzk5MGFkZTQxZTBmYzhkMDg3NWYzZTdiYWJmODJiNC5qcGc=.jpg,64
208,Terry Flores,"Doing good for humankind while making bank at the box office can be tricky business, but producer Scott Budnick ’s activist content company One Community has received millions of dollars in fresh financing and kicked off development on an action thriller with… [+3966 chars]","Doing good for humankind while making bank at the box office can be tricky business, but producer Scott Budnick’s activist content company One Community has received millions of dollars in fresh financing and kicked off development on an action thriller with …",2018-11-14T18:15:26Z,"{'id': None, 'name': 'Variety.com'}",Scott Budnick’s One Community Aims to Make a Difference With Activist Content,https://variety.com/2018/biz/news/producer-scott-budnick-1203026953/,https://pmcvariety.files.wordpress.com/2018/11/scott-budnick.jpg?w=700&h=393&crop=1,262
209,,"I Wrote my Own Ransomware; did not make 1 iota of a Bitcoin by Thomas Fischer 2016 saw a substantial rise in ransomware attacks and in some cases the return of some favourites with Cryptowall, CTB-LOCKER and TeslaCrypt being some of the most popular. The volu… [+1099 chars]","I Wrote my Own Ransomware; did not make 1 iota of a Bitcoin. by Thomas Fischer. 2016 saw a substantial rise in ransomware attacks and in some cases the return of some favourites with Cryptowall, CTB-LOCKER and TeslaCrypt being some of the most popular.",2018-11-14T18:17:00Z,"{'id': 'reddit-r-all', 'name': 'Reddit /r/all'}",u/0xKaishakunin,https://www.reddit.com/user/0xKaishakunin,,189
210,Colin Harper,"Bitmain has denied reports that its CEO Jihan Wu was ousted as the mining firms board director while confirming that the board has undergone restructuring. Setting the record straight, Nishant Sharma, international marketing manager of Bitmain Technologies Li… [+1637 chars]","Bitmain has denied reports that its CEO Jihan Wu was ousted as the mining firm’s board director while confirming that the board has undergone restructuring. Setting the record straight, Nishant Sharma, international marketing manager of Bitmain Technologies L…",2018-11-14T18:26:14Z,"{'id': None, 'name': 'Bitcoinmagazine.com'}","“Bitmain Is Restructuring,” But Jihan Wu Still a Board Director: Source",https://bitcoinmagazine.com/articles/bitmain-restructuring-jihan-wu-still-board-director-source/,https://fs.bitcoinmagazine.com/img/images/jihan_not_out.max-800x800.jpg,42
211,Rick D.,"San Francisco-based cryptocurrency startup Coinbase has had a spectacular couple of years. A recent funding round valued the firm at $8 billion, making its CEO, Brian Armstrong, worth $1.3 billion. Coinbase Expanding into All Areas of Cryptocurrency For many … [+3586 chars]","San Francisco-based cryptocurrency startup Coinbase has had a spectacular couple of years. A recent funding round valued the firm at $8 billion, making its CEO, Brian Armstrong, worth $1.3 billion. Coinbase Expanding into All Areas of Cryptocurrency For many …",2018-11-14T18:30:43Z,"{'id': None, 'name': 'Newsbtc.com'}","How Brian Armstrong, CEO of Coinbase, Became a Crypto Billionaire",https://www.newsbtc.com/2018/11/14/how-brian-armstrong-ceo-of-coinbase-became-a-crypto-billionaire/,https://www.newsbtc.com/wp-content/uploads/2018/11/Coinbase-Brian-Armstrong.jpg,181
212,,Ultra mode displays 3 times the news on this page. This view is reserved for Pro members. Click here to join → Manchester attack: Salman Abedi's brother 'to be extradited this year' Horse Found Shivering Uncontrollably Survives California Wildfire by Hiding i… [+11303 chars],"The Internet on one page. Successor of Popurls, the mother of news aggregators. By @thomas",2018-11-14T18:37:07Z,"{'id': None, 'name': 'Hvper.com'}", Jimmy Kimmel Tricks Trump Fans Into Believing He's Deporting Statue Of Liberty via Hvper.com,http://www.hvper.com/?ref=feed_551ac29e76fb24eb209d70ffd1756160,http://www.hvper.com/static/img/og_09.png,133
213,,Ultra mode displays 3 times the news on this page. This view is reserved for Pro members. Click here to join → Manchester attack: Salman Abedi's brother 'to be extradited this year' Horse Found Shivering Uncontrollably Survives California Wildfire by Hiding i… [+11303 chars],"The Internet on one page. Successor of Popurls, the mother of news aggregators. By @thomas",2018-11-14T18:37:07Z,"{'id': None, 'name': 'Hvper.com'}"," A Study Reveals The Best US Cities To Live In For $55,000 Per Year via Hvper.com",http://www.hvper.com/?ref=feed_a09f228b167db63be8276d885ff6a4a6,http://www.hvper.com/static/img/og_09.png,135
