,author,content,description,publishedAt,source,title,url,urlToImage,relevancy
61,"adam@letstalkbitcoin.com (The LTB Network), The LTB Network",On today's show we're very honored to have Jim Cantrell Co-founder of Space-X and Vector Space. Jim's son is Colin Cantrell creator of Nexus Earth which is where Jim draws his interest in crypto. Jim gives his account of the private space industry and where c… [+1094 chars],On today's show we're very honored to have Jim Cantrell Co-founder of Space-X and Vector Space. Jim's son is Colin Cantrell creator of Nexus Earth which is where Jim draws his interest in crypto. Jim gives his account of the private space industry and where c…,2018-10-12T11:33:00Z,"{'id': None, 'name': 'Letstalkbitcoin.com'}",The Crypto Show: Space-X Co-founder Jim Cantrell & David Johnston Of Factom,https://letstalkbitcoin.com/blog/post/the-crypto-show-space-x-co-founder-jim-cantrell-david-johnston-of-factom?utm_source=feedburner&utm_medium=feed&utm_campaign=Feed%3A+TheDailyBitcoinShow+%28Let%27s+Talk+Bitcoin+Network+Feed%29,,62
62,Mark Emem,"The alleged mastermind of the bitcoin fraud scheme which saw a Finnish investor lose 5,564 bitcoins in Thailand has been arrested. Prinya Jaravijit, who is the principal suspect in swindling Finnish national Aarni Otava Saarimma out of bitcoin worth 797 milli… [+2856 chars]","The alleged mastermind of the bitcoin fraud scheme which saw a Finnish investor lose 5,564 bitcoins in Thailand has been arrested. Prinya Jaravijit, who is the principal suspect in swindling Finnish national Aarni Otava Saarimma out of bitcoin worth 797 milli…",2018-10-12T11:36:27Z,"{'id': 'crypto-coins-news', 'name': 'Crypto Coins News'}",Thailand Police Arrest Prime Suspect of $24 Million Bitcoin Fraud Scheme,https://www.ccn.com/thailand-police-arrest-prime-suspect-of-24-million-bitcoin-fraud-scheme/,https://www.ccn.com/wp-content/uploads/2018/08/Thailand-Police-Cap.jpg,18
63,Press Release,"This is a paid-for submitted press release. CCN does not endorse, nor is responsible for any material included below and isnt responsible for any damages or losses connected with any products or services mentioned in the press release. CCN urges readers to co… [+3908 chars]","This is a paid-for submitted press release. CCN does not endorse, nor is responsible for any material included below and isn’t responsible for any damages or losses connected with any products or services mentioned in the press release. CCN urges readers to c…",2018-10-12T11:36:31Z,"{'id': 'crypto-coins-news', 'name': 'Crypto Coins News'}",Alexander Elbanna Makes History with His Launch of Digital World Exchange,https://www.ccn.com/alexander-elbanna-makes-history-with-his-launch-of-digital-world-exchange/,https://www.ccn.com/wp-content/uploads/2018/10/digital.jpg,71
64,Mark O'Byrne,"Gold’s Best Day In 2 Years Sees 2.5 Percent Gain As Global Stocks Sell Off – This Weeks Golden Nuggets News, Commentary, Charts and Videos You May Have Missed Here is our Friday digest of the important news, commentary, charts and videos we were informed by t… [+4685 chars]","Gold’s Best Day In 2 Years Sees 2.5 Percent Gain As Global Stocks Sell Off – This Week’s Golden Nuggets News, Commentary, Charts and Videos You May Have Missed Here is our Friday digest of the important news, commentary, charts … Read more › <!-- end of.read-…",2018-10-12T11:55:42Z,"{'id': None, 'name': 'Maxkeiser.com'}",Gold’s Best Day In 2 Years Sees 2.5 Percent Gain As Global Stocks Sell Off,https://www.maxkeiser.com/2018/10/golds-best-day-in-2-years-sees-2-5-percent-gain-as-global-stocks-sell-off/,,105
65,"Nick Cawley, Analyst, Nick Cawley","Bitcoin (BTC) Price Analysis A tepid dead-cat bounce at best. Negative signals all over the chart. Bitcoin Price Action - Lower for Longer Confirmation After Thursday’s heavy sell-off across the cryptocurrency market, market leader Bitcoin continues to strugg… [+1959 chars]","A lack of any bounce back after recent heavy losses confirms that Bitcoin’s outlook remains negative, with the daily chart looking increasingly ominous.",2018-10-12T12:00:00Z,"{'id': None, 'name': 'Dailyfx.com'}",Bitcoin (BTC) Price Breakdown Signals Further Losses,https://www.dailyfx.com/forex/market_alert/2018/10/12/Bitcoin-BTC-Price-Breakdown-Signals-Further-Losses-.html,,77
66,,"NASHUA, N.H., Oct. 12, 2018 /PRNewswire-PRWeb/ -- Today, CoinText.io, a wallet to transact cryptocurrency using SMS messages, introduced a new ""BUY"" command that enables users to spend Bitcoin Cash (BCH) at any retailer that uses BitPay to process bitcoin pay… [+2202 chars]","NASHUA, N.H., Oct. 12, 2018 /PRNewswire-PRWeb/ -- Today, CoinText.io, a wallet to transact cryptocurrency using SMS messages, introduced a new ""BUY"" command that enables users to spend Bitcoin Cash (BCH) at any retailer that uses BitPay to process bitcoin pay…",2018-10-12T12:00:27Z,"{'id': None, 'name': 'Sys-con.com'}","CoinText Adds ""BUY"" Feature to Pay For BitPay Invoices Over SMS",http://news.sys-con.com/node/4330703,,155
67,Eillie Anzilotti,"In 1903, an American entrepreneur, Charles Boettcher, founded the Great Western Sugar Company in Colorado, and opened two beet sugar refineries outside of Denver. Over the course of the 20th century, the company expanded, adding more facilities in Wyoming, Mo… [+9272 chars]","Fast Company Why the cooperative model needs to be at the heart of our new economy Fast Company In 1903, an American entrepreneur, Charles Boettcher, founded the Great Western Sugar Company in Colorado, and opened two beet sugar refineries outside of Denver. …",2018-10-12T12:02:08Z,"{'id': None, 'name': 'Fastcompany.com'}",Why the cooperative model needs to be at the heart of our new economy - Fast Company,https://www.fastcompany.com/90249347/why-the-cooperative-model-needs-to-be-at-the-heart-of-our-new-economy,"https://images.fastcompany.net/image/upload/w_1280,f_auto,q_auto,fl_lossy/wp-cms/uploads/2018/10/p-2-90249347-why-the-cooperative-model-needs-to-be-at-the-heart-of-our-new-economy.jpg",169
68,Tyler Durden,"Oh how the mighty have fallen... Seven months after he angrily quit the Trump Administration in protest over President Trump's tariff plans, former Goldman Sachs President Gary Cohn has broken his silence to announce his first big career move since leaving th… [+3135 chars]","Oh how the mighty have fallen... Seven months after he angrily quit the Trump Administration in protest over President Trump's tariff plans, former Goldman Sachs President Gary Cohn has broken his silence to announce his first big career move since leaving th…",2018-10-12T12:06:43Z,"{'id': None, 'name': 'Zerohedge.com'}",How The Mighty Have Fallen: Gary Cohn Joins Blockchain Startup 7 Months After Leaving White House,https://www.zerohedge.com/news/2018-10-12/gary-cohn-joins-blockchain-startup-7-months-after-leaving-white-house,https://www.zerohedge.com/sites/default/files/styles/max_650x650/public/2018-10/2018.10.12cohn.JPG?itok=VR0Jl_J_,143
69,Anthony Noto,,"To keep readers up-to-date on the latest price fluctuations and trends pertaining to cryptocurrencies, we here at New York Business Journal compile a list of the week's top stories each Friday. Peruse the listicle below for the headlines you might have missed…",2018-10-12T12:11:31Z,"{'id': None, 'name': 'Bizjournals.com'}","Bitcoin review: Crypto hacking gets worse, UAE plans new ICO rules",https://www.bizjournals.com/newyork/news/2018/10/12/bitcoin-review-crypto-hacking-gets-worse-uae-plans.html?ana=RSS&s=article_search&utm_source=feedburner&utm_medium=feed&utm_campaign=Feed%3A+industry_7+%28Industry+Technology%29,,104
70,"Andrew Gazdecki, CommunityVoice, Andrew Gazdecki, CommunityVoice https://www.forbes.com/sites/forbestechcouncil/people/andrewgazdecki1/","Share to facebook Share to twitter Share to linkedin Blockchain is often touted as a secure way of storing information, but just how secure is it? While nothing is 100% secure, blockchain is designed to be immutable, tamper-proof and democratic. It achieves t… [+12136 chars]","While nothing is 100% secure, blockchain is designed to be immutable, tamper-proof and democratic.",2018-10-12T12:15:00Z,"{'id': None, 'name': 'Forbes.com'}",How Secure Is Blockchain Technology?,https://www.forbes.com/sites/forbestechcouncil/2018/10/12/how-secure-is-blockchain-technology/,https://thumbor.forbes.com/thumbor/600x315/https%3A%2F%2Fblogs-images.forbes.com%2Fforbestechcouncil%2Ffiles%2F2018%2F10%2Fcanva-photo-editor-20-1-500x500.png,14
71,The Hindu,"The five-year-old gelding Raees should make amends in the Suresh Mahindra Trophy, the feature event of Saturdays (Oct. 13) races. False rails will be announced one hour before the start of the first race. 1. HILLS AND STARS PLATE (1,600m), Cl. IV, rated 20 to… [+4430 chars]","The five-year-old gelding Raees should make amends in the Suresh Mahindra Trophy, the feature event of Saturday’s (Oct. 13) races. False rails will be",2018-10-12T12:17:03Z,"{'id': 'the-hindu', 'name': 'The Hindu'}",Raees for Suresh Mahindra Trophy,https://www.thehindu.com/sport/races/raees-for-suresh-mahindra-trophy/article25205537.ece,https://www.thehindu.com/static/theme/default/base/img/og-image.jpg,132
72,David Hundeyin,"Ethereum co-founder, Vitalik Buterin has thrown shade on prominent economist and cryptocurrency skeptic Nouriel Roubini, in response to Roubini’s earlier statements calling him a “dictator” and describing decentralization in Crypto as a “myth”. In a tweet, Bu… [+3403 chars]","Ethereum co-founder, Vitalik Buterin has thrown shade on prominent economist and cryptocurrency skeptic Nouriel Roubini, in response to Roubini’s earlier statements calling him a “dictator” and describing decentralization in Crypto as a “myth”. In a tweet, Bu…",2018-10-12T12:27:52Z,"{'id': 'crypto-coins-news', 'name': 'Crypto Coins News'}",Ethereum Founder Vitalik Buterin Throws Shade at Bitcoin Bashing Economist,https://www.ccn.com/ethereum-founder-vitalik-buterin-throws-shade-at-bitcoin-bashing-economist/,https://www.ccn.com/wp-content/uploads/2014/06/Vitalik-Buterin-ghash-51-attack.jpg,28
73,Press Trust of India,"/ -- On September 30th, the team at DATx, a blockchain project focused on building industry infrastructure, announced the addition of cross-chain interoperability functionality to the DATxChain (Decentralized Application Transformational Chain), the DATx publ… [+4592 chars]","/ -- On September 30th, the team at DATx, a blockchain project focused on building industry infrastructure, announced the addition of cross-chain interoperability functionality to the DATxChain (Decentralized Application Transformational Chain), the DATx publ…",2018-10-12T12:30:18Z,"{'id': None, 'name': 'Business-standard.com'}",DATx Establishes Cross-Chain Hub for the Blockchain Industry,https://www.business-standard.com/article/pti-stories/datx-establishes-cross-chain-hub-for-the-blockchain-industry-118101200838_1.html,https://bsmedia.business-standard.com/_media/bs/img/article/default/1181012/full-118101200838.jpg,115
74,Davit Babayan,"Investment consultation firm Pension Partners released an index listing the worst performing cryptocurrencies in 2018. Qtum, a cryptocurrency-backed hybrid blockchain platform, suffered a maximum 93.9 percent loss by Q3 2018. A high marketing pitch, which pro… [+3207 chars]","Investment consultation firm Pension Partners released an index listing the worst performing cryptocurrencies in 2018. Qtum, a cryptocurrency-backed hybrid blockchain platform, suffered a maximum 93.9 percent loss by Q3 2018. A high marketing pitch, which pro…",2018-10-12T12:30:51Z,"{'id': None, 'name': 'Newsbtc.com'}",These Tokens are the Worst Performing Crypto in 2018: Factors and Trends,https://www.newsbtc.com/2018/10/12/these-tokens-are-the-worst-performing-crypto-in-2018-factors-and-trends/,https://s3.amazonaws.com/main-newsbtc-images/2018/10/12112639/shutterstock_1017688288.jpg,63
75,Tsetso Mihailov,"Scan Your System for Malicious Files Threats such as Scrabber may be persistent on your system. They tend to re-appear if not fully deleted. A malware removal tool like SpyHunter will help you to remove malicious programs, saving you the time and the struggle… [+9873 chars]",This article will aid you remove Scrabber ransomware efficiently. Follow the ransomware removal instructions at the end. Scrabber is the name of a ransomware cryptovirus. The ransomware is a variant of HiddenTear and is written to append the extension.junked …,2018-10-12T12:36:00Z,"{'id': None, 'name': 'Sensorstechforum.com'}",Remove Scrabber Ransomware (.junked Extension),https://sensorstechforum.com/remove-scrabber-ransomware-junked-extension/,https://sensorstechforum.com/wp-content/uploads/2018/10/stf-scrabber-ransomware-virus-desktop-background-ransomware-instructions.png,152
76,,"A new sextortionist scam is using spoofing techniques to trick users into thinking that digital attackers have compromised their email accounts. As reported by Bleeping Computer, an attack email belonging to this ploy attempts to lure in a user with the subje… [+1820 chars]","A new sextortionist scam is using spoofing techniques to trick users into thinking that digital attackers have compromised their email accounts. As reported by Bleeping Computer, an attack email belonging to this ploy attempts to lure in a user with the subje…",2018-10-12T12:37:00Z,"{'id': None, 'name': 'Tripwire.com'}",New Sextortionist Scam Uses Email Spoofing Attack to Trick Users,https://www.tripwire.com/state-of-security/security-data-protection/sextortionist-scam-uses-email-spoofing-attack-to-trick-users/,https://www.tripwire.com/state-of-security/wp-content/uploads/sites/3/Tripwire-Security-News-800x450d-with_logo_c.jpg,113
77,Aaron Hankin,"Bitcoin prices are holding above $6,000 on Friday after a 24-hour selloff saw the price of the worlds largest digital currency trade perilously close to the crucial support level. A single bitcoin BTCUSD, +0.32% was last going for $6,234.10, up 0.1% since Thu… [+1917 chars]","Bitcoin prices are holding above $6,000 Friday, after a 24-hour selloff saw the price of the world’s largest digital currency trade perilously close to the crucial support level.",2018-10-12T12:42:16Z,"{'id': None, 'name': 'Marketwatch.com'}","CryptoWatch: Bitcoin holds above $6,000, set for third consecutive weekly loss",https://www.marketwatch.com/story/bitcoin-holds-above-6000-set-for-third-consecutive-weekly-loss-2018-10-12,http://s.marketwatch.com/public/resources/MWimages/MW-GC195_gsbitc_ZG_20180122120730.jpg,4
78,Anne Currie,"Key Takeaways The recently launched ""Sustainable Servers"" petition and whitepaper encourages tech to demonstrate basic care for human welfare by running every server off renewable power by 2024 - an achievable goal with simple steps to get there. We all need … [+9146 chars]",This year at QCon London and the Coed:Ethics Conference we started to talk about what it means to be an ethical technologist. The running theme of both conferences was taking care. Who should do that? Everyone. From shareholders to individual developers to im…,2018-10-12T12:49:00Z,"{'id': None, 'name': 'Infoq.com'}",Article: Ethics - What Next?,https://www.infoq.com/articles/ethics-next,https://res.infoq.com/articles/ethics-next/en/headerimage/ethics-next-1539153506705.jpg,159
79,Kate Rooney,"Former White House Economic adviser Gary Cohn is finally unveiling his next career move: Blockchain. div &gt; div.group &gt; p:first-child""&gt; Cohn, who left the Trump administration in March, will join start-up Spring Labs as an adviser, the company announc… [+2508 chars]",Former White House Economic adviser Gary Cohn will join blockchain start-up Spring Labs.,2018-10-12T12:50:00Z,"{'id': 'cnbc', 'name': 'CNBC'}",Former White House Economic Adviser Gary Cohn joins blockchain start-up,https://www.cnbc.com/2018/10/12/former-white-house-economic-adviser-gary-cohn-joins-blockchain-startup.html,https://fm.cnbc.com/applications/cnbc.com/resources/img/editorial/2018/05/21/105221125-GettyImages-935039774.1910x1000.jpg,122
80,,Credit: Marc Freestone/The Conversation Leek orchids don't have many friends. Maybe it's because they lack the drop-dead gorgeous looks of many of their fellow family members. Or perhaps it's because they're always the first to leave the party: as soon as she… [+5340 chars],"Leek orchids don't have many friends. Maybe it's because they lack the drop-dead gorgeous looks of many of their fellow family members. Or perhaps it's because they're always the first to leave the party: as soon as sheep or weeds encroach on their territory,…",2018-10-12T12:50:01Z,"{'id': None, 'name': 'Phys.org'}","Leek orchids are beautiful, endangered and we have no idea how to grow them",https://phys.org/news/2018-10-leek-orchids-beautiful-endangered-idea.html,https://3c1703fe8d.site.internapcdn.net/newman/gfx/news/hires/2018/leekorchidsa.jpg,138
81,Joseph Young,"Within a period of 24 hours, from October 11 to 12, the valuation of the crypto market has declined from $217 billion to $201 billion. The 7 percent decline in the valuation of the crypto market was triggered by a sudden drop in the price of Bitcoin from $6,6… [+3263 chars]","Within a period of 24 hours, from October 11 to 12, the valuation of the crypto market has declined from $217 billion to $201 billion. The 7 percent decline in the valuation of the crypto market was triggered by a sudden drop in the price of Bitcoin from $6,6…",2018-10-12T13:14:56Z,"{'id': 'crypto-coins-news', 'name': 'Crypto Coins News'}","Crypto Market Erases $16 Billion in 24 Hours, Can Bitcoin Swiftly Rebound?",https://www.ccn.com/crypto-market-erases-16-billion-in-24-hours-can-bitcoin-swiftly-rebound/,https://www.ccn.com/wp-content/uploads/2018/09/bitcoin-3.jpg,24
82,,"BreachExchange mailing list archives WannaCry cost the NHS £92 million, report estimates From : Destry Winant &lt;destry () riskbasedsecurity com&gt; Date : Thu, 11 Oct 2018 20:43:30 -0500 http://www.itpro.co.uk/wannacry/32103/wannacry-cost-the-nhs-92-million… [+4715 chars]",Posted by Destry Winant on Oct 12 http://www.itpro.co.uk/wannacry/32103/wannacry-cost-the-nhs-92-million-report-estimates An update to an earlier DHSC report estimates that £19 million was lost in patient care alone The Department of Health and Social Care ha…,2018-10-12T13:17:20Z,"{'id': None, 'name': 'Seclists.org'}","WannaCry cost the NHS £92 million, report estimates",https://seclists.org/dataloss/2018/q4/45,http://seclists.org/images/dataloss-img.png,144
83,Shoshanna Delventhal,"Investors may have to wait until earnings season comes into full swing before the global markets reverse their most recent plunge, according to one market watcher and as outlined by CNBC. Wells Fargo analyst Christopher Harvey wrote a note following this week… [+1777 chars]","""If you can be patient and withstand some further pain, we think there will be better levels to de-risk or reposition for the future,"" wrote Wells Fargo.",2018-10-12T13:25:00Z,"{'id': None, 'name': 'Investopedia.com'}",Market ‘Tailspin’ to Last Another 1-2 Weeks: Wells,https://www.investopedia.com/news/market-tailspin-last-another-12-weeks-wells/,https://i.investopedia.com/image/jpeg/1539350409762/stock_exchange_shutterstock_310402643.jpg,79
84,Nikhilesh De,"Investors will soon be able to trade litecoin on the Winklevoss brothers-founded cryptocurrency exchange Gemini. The exchange announced Friday that it would soon enable deposits and trading for litecoin (LTC), adding the early bitcoin spin-off to its existing… [+2034 chars]","Winklevoss-founded crypto exchange Gemini is adding litecoin trading in the coming week, with permission from the NYDFS.",2018-10-12T13:25:49Z,"{'id': None, 'name': 'Coindesk.com'}",Gemini Adds Litecoin Trading With New York Watchdog Approval,https://www.coindesk.com/gemini-adds-litecoin-trading-with-new-york-watchdog-approval/,https://media.coindesk.com/uploads/2018/10/ltc.jpg,8
85,Evan Maslennikov,The Crypto Hype Train of 2017 made a lot of people rich but left even more people poor and looking for a tax attorney. Youve heard the story. But what nobodys told you is that the Crypto Industry is still a goldmine for hard-working marketers willing to dig f… [+13124 chars],The Crypto Hype Train of 2017 made a lot of people rich but left even more people poor and looking for a tax attorney. You’ve heard the…,2018-10-12T13:26:21Z,"{'id': None, 'name': 'Hackernoon.com'}",The Nails and Fails of Crypto Affiliate Marketing in 2018,https://hackernoon.com/the-nails-and-fails-of-crypto-affiliate-marketing-in-2018-bdb9aa78d004,https://cdn-images-1.medium.com/max/1200/1*uHyWDnfmGi1TIxaTxVC6jg.jpeg,107
86,CoinDNA,"After dropping hard yesterday, the crypto markets have not seen any bounce yet. The Top 100 crypto board is actually a mix of red and with some greens but there are no big changes to the coins and tokens. The market capitalization is in almost the same level … [+2599 chars]","After dropping hard yesterday, the crypto markets have not seen any bounce yet. The Top 100 crypto board is actually a mix of red and with…",2018-10-12T13:41:00Z,"{'id': None, 'name': 'Hackernoon.com'}","Friday Still In The Reds, Crypto Markets Back To Waiting Game",https://hackernoon.com/friday-still-in-the-reds-crypto-markets-back-to-waiting-game-faedab702ee8,https://cdn-images-1.medium.com/max/1200/0*iFn796iCn3UNLciW,111
87,"Justin McQueen, Analyst, Justin McQueen","MARKET DEVELOPMENT – USD RECOUPS LOSSES, EUR AND GBP SLIP USD: After the largest intra-day drop since September 20th, the US Dollar has seen a slight reprieve, while FOMC rate projections have also remained relatively stable despite the sell-off in equity mar… [+2450 chars]","After the largest intra-day drop since September 20th, the US Dollar has seen a slight reprieve, while FOMC rate projections have also remained relatively stable despite the sell-off in equity markets",2018-10-12T13:46:00Z,"{'id': None, 'name': 'Dailyfx.com'}","US Dollar Eyes Key Level, GBP and EUR Dip - US Market Open",https://www.dailyfx.com/forex/market_alert/2018/10/12/US-Dollar-Eyes-Key-Level-GBP-and-EUR-Dip---US-Market-Open.html,,114
88,David Canellis,,"A keen-eyed cryptocurrency enthusiast has just discovered a neat ‘easter egg’ buried deep inside Bitcoin’s code, dating back to the birth of the blockchain. We all know Satoshi Nakamoto referenced the Times headline – Chancellor on brink of second bailout for…",2018-10-12T13:48:46Z,"{'id': 'google-news', 'name': 'Google News'}",Someone just found a 10-year-old Bitcoin easter egg,http://feedproxy.google.com/~r/TheNextWeb/~3/1-pw2WACjUk/,,0
89,David Canellis,"A keen-eyed cryptocurrency enthusiast has just discovered a neat easter egg buried deep inside Bitcoins code, dating back to the birth of the blockchain. We all know Satoshi Nakamoto referenced the Times headline Chancellor on brink of second bailout for bank… [+2061 chars]","A keen-eyed cryptocurrency enthusiast has just discovered a neat ‘easter egg’ buried deep inside Bitcoin’s code, dating back to the birth of the blockchain. We all know Satoshi Nakamoto referenced the Times headline – Chancellor on brink of second bailout for…",2018-10-12T13:49:37Z,"{'id': 'the-next-web', 'name': 'The Next Web'}",Someone just found a 10-year-old Bitcoin easter egg,https://thenextweb.com/hardfork/2018/10/12/bitcoin-easter-egg/,https://img-cdn.tnwcdn.com/image/hardfork?filter_last=1&fit=1280%2C640&url=https%3A%2F%2Fcdn0.tnwcdn.com%2Fwp-content%2Fblogs.dir%2F1%2Ffiles%2F2018%2F10%2Fnakamotoeaster-1.jpg&signature=34a0a34fd75561ffe98926473f09cc71,154
90,Shoshanna Delventhal,"This week's sell-off, in which both the Dow Jones Industrial Average (DJIA) index and the S&amp;P 500 suffered their worst two-day loss in over eight months, disproportionately weighed on America's red-hot technology stocks. Investors' fears regarding tighten… [+1889 chars]","While the top tech analyst turned venture capitalist expects more short-term weakness in large-cap tech, he remains bullish on the sector overall.",2018-10-12T13:52:00Z,"{'id': None, 'name': 'Investopedia.com'}",Tech Stocks to Fall Another 5%: Gene Munster,https://www.investopedia.com/news/tech-stocks-fall-another-5-gene-munster/,https://i.investopedia.com/image/jpeg/1539352079742/stock_chart_shutterstock_413623147.jpg,91
91,Wilma Woo,"The US senator and potential presidential contender who suggested cryptocurrency hurt American families repeated concerns about the industry on October 11, saying it was easy to steal. Warren Argues For Consumer Protection ‘Balance’ In a Senate Banking Commit… [+1886 chars]","The US senator and potential presidential contender who suggested cryptocurrency “hurt” American families repeated concerns about the industry on October 11, saying it was “easy to steal.” Warren Argues For Consumer Protection ‘Balance’ In a Senate Banking Co…",2018-10-12T14:00:20Z,"{'id': None, 'name': 'Bitcoinist.com'}","‘Nurture Productive Aspects Of Cryptocurrency,’ US Presidential Hopeful Tells Senate",https://bitcoinist.com/nurture-productive-aspects-of-cryptocurrency-us-presidential-hopeful-tells-senate/,https://bitcoinist.com/wp-content/uploads/2018/10/shutterstock_503959990.jpg,101
