,author,content,description,publishedAt,source,title,url,urlToImage,relevancy
119,Coinmine,"""Crypto is not just about buying and selling magical internet coins,"" says Farb Nivi, co-founder and CEO of Coinmine. ""It's about people combining computation to decentralize the world's money and information from the hands of a few and into the hands of the … [+3229 chars]","LOS ANGELES, Nov. 14, 2018 /PRNewswire/ -- Today, Coinmine launches to simplify and automate the complex process of making and maintaining crypto hardware and wallets. With a sleek crypto device and mobile app, Coinmine makes it easy for anyone to power the c…",2018-11-14T14:00:00Z,"{'id': None, 'name': 'Prnewswire.com'}","Coinmine Launches to Make Crypto Easy, Backed by Industry Titans",https://www.prnewswire.com/news-releases/coinmine-launches-to-make-crypto-easy-backed-by-industry-titans-300750160.html,https://mma.prnewswire.com/media/784339/Coinmine_Logo.jpg?p=facebook,183
120,Sam Dean,"When there's a gold rush, sell picks and shovels. When there's a cryptocurrency rush, the same wisdom may well hold. That’s the thinking behind a Los Angeles start-up that’s trying to make mining for cryptocurrency as easy as plugging in a PlayStation. Coinmi… [+5703 chars]","When there's a gold rush, sell picks and shovels. When there's a cryptocurrency rush, the same wisdom may well hold. That’s the thinking behind a Los Angeles start-up that’s trying to make mining for cryptocurrency as easy as plugging in a PlayStation. Coinmi…",2018-11-14T14:00:00Z,"{'id': None, 'name': 'Latimes.com'}","For $799 and a jump in the electric bill, anyone can mine cryptocurrency",http://www.latimes.com/ct-biz-coinmine-cryptocurrency-at-home-20181114-story.html,https://www.latimes.com/resizer/G81KxIXRhgt46ix5BPq2QsWQ9SE=/1200x0/arc-anglerfish-arc2-prod-tronc.s3.amazonaws.com/public/UILJSYSRVJEYJP7BWVIBLXXDMU.jpg,100
121,Sam Dean,"When there's a gold rush, sell picks and shovels. When there's a cryptocurrency rush, the same wisdom may well hold. Thats the thinking behind a Los Angeles start-up thats trying to make mining for cryptocurrency as easy as plugging in a PlayStation. Coinmine… [+5687 chars]","When there's a gold rush, sell picks and shovels. When there's a cryptocurrency rush, the same wisdom may well hold. That’s the thinking behind a Los Angeles start-up that’s trying to make mining for cryptocurrency as easy as plugging in a PlayStation. Coinmi…",2018-11-14T14:00:00Z,"{'id': None, 'name': 'Chicagotribune.com'}","For $799 and a jump in the electric bill, anyone can mine cryptocurrency",https://www.chicagotribune.com/business/ct-biz-coinmine-cryptocurrency-at-home-20181114-story.html,https://www.trbimg.com/img-5bec34e9/turbine/ct-biz-coinmine-cryptocurrency-at-home-20181114,261
122,Sam Dean,"When there's a gold rush, sell picks and shovels. When there's a cryptocurrency rush, the same wisdom may well hold. That’s the thinking behind a Los Angeles start-up that’s trying to make mining for cryptocurrency as easy as plugging in a PlayStation. Coinmi… [+5575 chars]","When there's a gold rush, sell picks and shovels. When there's a cryptocurrency rush, the same wisdom may well hold. That’s the thinking behind a Los Angeles start-up that’s trying to make mining for cryptocurrency as easy as plugging in a PlayStation. Coinmi…",2018-11-14T14:00:00Z,"{'id': None, 'name': 'Latimes.com'}","For $799 and a jump in the electric bill, anyone can mine cryptocurrency",http://www.latimes.com/business/technology/la-fi-tn-coinmine-launch-20181114-story.html,https://www.latimes.com/resizer/G81KxIXRhgt46ix5BPq2QsWQ9SE=/1200x0/arc-anglerfish-arc2-prod-tronc.s3.amazonaws.com/public/UILJSYSRVJEYJP7BWVIBLXXDMU.jpg,101
123,Brady Dale,"Try as startups might, crypto mining hasn’t yet had an everyman device. Smart money, however, is betting that will change at the hands of a new company called Coinmine. Announced Wednesday, the startup is revealing its first product, the Coinmine One, a hardw… [+8372 chars]","A new firm called Coinmine has announced a device aimed at enthusiasts who'd like to mine crypto, but don't want to learn a new technical skill set.",2018-11-14T14:00:11Z,"{'id': None, 'name': 'Coindesk.com'}",The $799 Coinmine One Will Look Like an Xbox and Mint Crypto Money,https://www.coindesk.com/the-799-coinmine-one-will-look-like-an-xbox-and-mint-crypto-money,https://www.coindesk.com/wp-content/uploads/2018/11/COINMINE13236.jpg,170
124,Emilio Janus,"Head of the International Monetary Fund, Christine Lagarde, said that central banks should consider issuing state-backed digital currency. The IMF head gave her advice during a speech delivered at the Singapore Fintech Festival. Digital or Crypto? In the spee… [+3213 chars]","Head of the International Monetary Fund, Christine Lagarde, said that central banks should consider issuing state-backed digital currency. The IMF head gave her advice during a speech delivered at the Singapore Fintech Festival. Digital or Crypto? In the spee…",2018-11-14T14:00:12Z,"{'id': None, 'name': 'Bitcoinist.com'}",IMF’s Lagarde Says It’s Time to Consider State-Issued Digital Currencies,https://bitcoinist.com/imf-lagarde-state-digital-currencies/,https://bitcoinist.com/wp-content/uploads/2018/11/shutterstock_185321012-980x613.jpg,185
125,Jeff John Roberts,"Until a few years ago, you could mine Bitcoin with a laptop. Today, the process is more like running a factory: it requires specialized chips, hot and noisy mining rigs, and enough electricity to power a small city. That’s why the arrival of a device called t… [+2986 chars]","Coinmine One, which sells for $799,  is being pitched as an easy-to-use home mining system you can control with an app.",2018-11-14T14:00:21Z,"{'id': 'fortune', 'name': 'Fortune'}",Coinbase-backed Startup Launches $799 Home Crypto Miner,http://fortune.com/2018/11/14/coinmine-crypto-mining/,https://fortunedotcom.files.wordpress.com/2018/11/white-coinmine-2.jpg,150
126,Nick Chong,"Since crypto’s recent lull, optimistic industry insiders have claimed that cryptocurrency investors, whether from retail or institutional backgrounds, have continued to purchase Bitcoin (BTC) en-masse and on the cheap. Although this sentiment has been nothing… [+3926 chars]","Since crypto’s recent lull, optimistic industry insiders have claimed that cryptocurrency investors, whether from retail or institutional backgrounds, have continued to purchase Bitcoin (BTC) en-masse and on the cheap. Although this sentiment has been nothing…",2018-11-14T14:00:35Z,"{'id': None, 'name': 'Newsbtc.com'}",Bitcoin Unspent Transaction Output Accumulation Could Signal Crypto’s Next Bull Run,https://www.newsbtc.com/2018/11/14/bitcoin-unspent-transaction-output-accumulation-could-signal-cryptos-next-bull-run/,https://www.newsbtc.com/wp-content/uploads/2018/10/Abra-Index-Token.jpg,111
127,Angela,"When Lolli launched in August, co-founder Alex Adelman wrote, Over 60% of Americans have heard of bitcoin, but very few actually own any. For all of us in the tech bubble, this is a good reminder of the relative inaccessibility of cryptocurrency. Many of us h… [+2584 chars]","When Lolli launched in August, co-founder Alex Adelman wrote, “Over 60% of Americans have heard of bitcoin, but very few actually own any.” For all of us in the tech bubble, this is a good reminder of the relative inaccessibility of cryptocurrency. Many of us…",2018-11-14T14:00:55Z,"{'id': None, 'name': 'Versionone.vc'}",Announcing our investment in Lolli – Bitcoin for everyone!,https://versionone.vc/announcing-lolli/,https://s0.wp.com/i/blank.jpg,47
128,Cointelegraph By Ana Berman,,"Police in Tokyo arrest eight suspects that were allegedly involved in a crypto pyramid scheme that lured about $68.4 million in cash and Bitcoin from 6,000 people",2018-11-14T14:01:00Z,"{'id': None, 'name': 'Cointelegraph.com'}",Japan: Tokyo Police Arrest 8 Men Allegedly Involved in $68 Million Crypto Pyramid Scheme,https://cointelegraph.com/news/japan-tokyo-police-arrest-8-men-allegedly-involved-in-68-million-crypto-pyramid-scheme,https://images.cointelegraph.com/images/740_aHR0cHM6Ly9zMy5jb2ludGVsZWdyYXBoLmNvbS9zdG9yYWdlL3VwbG9hZHMvdmlldy9jMTBlZjU5MmE5NzZkODlhZDU1NDc4ZDljMTk2YjQ2Zi5qcGc=.jpg,68
129,Scharon Harding,"Credit: Coinmine Cryptomining growth has always been hindered by the excessive hardware and power requirements it holds. And more recently, a discouraging crypto crash has left many questioning the future of cryptocurrencys value. But Coinmine is seeking to b… [+2478 chars]","Coinmine is a new device and companion app that lets you cryptomine Ethereum, Monero and Zcash without building your own system.",2018-11-14T14:02:06Z,"{'id': None, 'name': 'Tomshardware.com'}",New Plug-and-Go Hardware and App Are All You Need to Cryptomine,"https://www.tomshardware.com/news/coinmine-one-cryptomining-hardware-software-cryptocurrency,38061.html",https://img.purch.com/o/aHR0cDovL21lZGlhLmJlc3RvZm1pY3JvLmNvbS9KLzMvODEwNjg3L29yaWdpbmFsL1doaXRlLUNvaW5taW5lLTIuanBn,37
130,"Lizzie Dearden, Lizzie Dearden","Tommy Robinson is planning to go on a speaking tour of Australia where followers would pay almost A$1,000 for a private dinner with him even though it is unclear whether he will be allowed into the country. Australia get ready, the anti-Islam activist posted … [+5597 chars]",Unclear whether anti-Islam activist will be granted visa after Washington trip cancelled,2018-11-14T14:03:43Z,"{'id': 'independent', 'name': 'Independent'}","Tommy Robinson plans Australia speaking tour charging up to A$1,000 a ticket",https://www.independent.co.uk/news/uk/home-news/tommy-robinson-latest-tour-australia-speaking-us-washington-jail-court-islam-a8633406.html,https://static.independent.co.uk/s3fs-public/thumbnails/image/2018/11/05/10/Tommy-Robinson.jpg,156
131,,Bad news: 1-877-KARS4KIDS had a data breach. Worse news: now youll have that awful jingle stuck in your head all day. The New Jersey-based charity has plagued the American airwaves for years with the most hated jingle to try to get consumers to trade in their… [+1956 chars],#1236793: 1-877-KARS4KIDS had a data breach. Bad news: 1-877-KARS4KIDS had a data breach. Worse news: now you’ll have that awful jingle stuck in your head all day. The New Jersey-based charity has plagued the American airwaves for years with the “most hated” …,2018-11-14T14:07:00Z,"{'id': None, 'name': 'Brica.de'}",1-877-KARS4KIDS had a data breach,https://brica.de/alerts/alert/public/1236793/1-877-kars4kids-had-a-data-breach/,,213
132,,"XYO Network, the technology bringing blockchain to the real world, today announced its first annual Spatial Summit event was a major success. The oversubscribed event brought together more than 700 blockchain, business and technology partners, and community m… [+4184 chars]","XYO Network, the technology bringing blockchain to the real world, today announced its first annual Spatial Summit event was a major success. The oversubscribed event brought together more than 700 blockchain, business and technology partners, and community m…",2018-11-14T14:07:11Z,"{'id': None, 'name': 'Sys-con.com'}","Inaugural Spatial Summit by XYO Network a Blow-Out Success, Drawing More than 700 Global Attendees to San Diego",http://news.sys-con.com/node/4346395,,269
133,,"XYO Network, the technology bringing blockchain to the real world, today announced its first annual Spatial Summit event was a major success. The oversubscribed event brought together more than 700 blockchain, business and technology partners, and community m… [+4184 chars]","XYO Network, the technology bringing blockchain to the real world, today announced its first annual Spatial Summit event was a major success. The oversubscribed event brought together more than 700 blockchain, business and technology partners, and community m…",2018-11-14T14:07:11Z,"{'id': None, 'name': 'Sys-con.com'}","Inaugural Spatial Summit by XYO Network a Blow-Out Success, Drawing More than 700 Global Attendees to San Diego",http://businesswire.sys-con.com/node/4346395,,265
134,Justine Landis Hanley,"Scammers are most commonly asking taxpayers to make payments into a Bitcoin ATM, rather than via iTunes vouchers, the ATO said based on reports. ""Our advice is simple the ATO will never ask you to make a payment into an ATM or via gift or pre-paid cards such … [+1737 chars]","Australians have reported more than 28,000 scam attempts to the and paid almost $1 million to scammers since July 1, according to the Australian Taxation Office. The ATO on Tuesday warned taxpayers to be on ""high-alert"" for scams, as the official November 21 …",2018-11-14T14:09:00Z,"{'id': None, 'name': 'Smh.com.au'}","Almost $1 million paid to scammers since July, says ATO",https://www.smh.com.au/business/consumer-affairs/almost-1-million-paid-to-scammers-since-july-says-ato-20181114-p50g30.html,"https://static.ffx.io/images/$zoom_0.53,$multiply_1,$ratio_1.777778,$width_1059,$x_0,$y_0/t_crop_custom/w_800/t_sharpen,q_auto,f_auto/9d050191a9b63d72fbf2077a2812299f4c75794a",214
135,Douglas Charles,"Pixabay / GQ Mexico (YouTube) The internet is a very big place. Sure, it makes the world smaller, but the internet itself is gigantic. There is no way for anyone to be able to navigate it and see all of the content that is produced on a daily basis. Heck, we … [+1290 chars]","We can't cover every story, so rather than just pretend these things didn't happen, we share. Enjoy today's best links on the internet.",2018-11-14T14:17:53Z,"{'id': None, 'name': 'Brobible.com'}","Your Morning Cup Of Internet: Body Transformations, Bitcoin Scam, Jalen Ramsey, Charlotte McKinney",https://brobible.com/culture/article/todays-best-links-internet-111418/,https://brobible.files.wordpress.com/2018/11/todays-best-links-internet-111418.jpg?quality=90&w=650,119
136,https://www.facebook.com/techaeris,"The views expressed in this post are those of Opinion Blockchain and do not represent Techaeris or its staff. Whether youre an investor or an intrigued bystander watching the fluctuations Bitcoin has had over the past six months, there is no denying the impor… [+2087 chars]","The views expressed in this post are those of Opinion Blockchain and do not represent Techaeris or its staff. Whether you’re an investor or an intrigued bystander watching the fluctuations Bitcoin has had over the past six months, there is no denying the impo…",2018-11-14T14:18:00Z,"{'id': None, 'name': 'Techaeris.com'}",[Infographic] How the blockchain will rebuild the world,https://techaeris.com/2018/05/09/how-the-blockchain-will-rebuild-world/,https://techaeris.com/wp-content/uploads/2018/05/1-blockchain-1000x543.jpg,191
137,Nia Warfield,"div &gt; div.group &gt; p:first-child""&gt; The "" Fast Money "" traders shared their first moves for the market open. Tim Seymour was a buyer of JPMorgan Brian Kelly was a buyer of Dunkin' Brands Steve Grasso was a buyer of Alibaba Guy Adami was a buyer of Clev… [+1577 chars]","The ""Fast Money"" traders share their first moves for the market open.",2018-11-14T14:19:00Z,"{'id': 'cnbc', 'name': 'CNBC'}","Your first trade for Wednesday, November 14",https://www.cnbc.com/2018/11/14/your-first-trade-for-wednesday-november-14.html,https://fm.cnbc.com/applications/cnbc.com/resources/img/editorial/2017/01/27/104245575-final-trade-logo.1910x1000.jpg,98
138,Davit Babayan,"Today is a tough day for cryptocurrencies. A large-scale selloff action has erased over $8 billion off the crypto market. The total market capitalization is $205 billion at the press time, down from $213 billion from yesterday. The market has a record of reco… [+3888 chars]","Today is a tough day for cryptocurrencies. A large-scale selloff action has erased over $8 billion off the crypto market. The total market capitalization is $205 billion at the press time, down from $213 billion from yesterday. The market has a record of reco…",2018-11-14T14:23:26Z,"{'id': None, 'name': 'Newsbtc.com'}","Crypto Market Loses over $8 Billion in Market-Wide Selloff, Intense Downtrend",https://www.newsbtc.com/2018/11/14/crypto-market-loses-over-8-billion-in-market-wide-selloff-intense-downtrend/,https://www.newsbtc.com/wp-content/uploads/2018/11/shutterstock_570625687.jpg,106
139,"Aaron Pressman, Clay Chandler","Going, going, gone. The latest federal auction of airwave licenses suitable for 5G networks kicks off today. Much of the 28 GHz band is already owned by Verizon but what’s left, spread across over 1,500 counties, goes up for sale by the Federal Communications… [+2592 chars]",The trade war between the U.S. and China could crash stock markets in both countries if President Trump and Chinese leaders don't blink.,2018-11-14T14:24:33Z,"{'id': 'fortune', 'name': 'Fortune'}",Data Sheet—Growing Dangers to Stocks From the U.S.-China Trade Conflict,http://fortune.com/2018/11/14/data-sheet-china-trump-trade-stock-market/,https://fortunedotcom.files.wordpress.com/2018/11/gettyimages-1061378684-e1542204155770.jpg,193
140,"USA TODAY, Ashley May, USA TODAY","NASA just announced bold plans to send humans to the moon (and beyond) for the first time in nearly 50 years. Buzz60 If NASA is able to overcome huge technological and medical hurdles, the agency believes it could send humans to Mars in about 25 years. (Photo… [+2243 chars]","There's a lot to overcome, but NASA officials said Tuesday that a human mission to Mars could happen within 25 years.",2018-11-14T14:28:02Z,"{'id': 'usa-today', 'name': 'USA Today'}","Humans could be heading to Mars in 25 years, NASA says",https://www.usatoday.com/story/news/nation-now/2018/11/14/nasa-humans-space-travel-mars-25-years/1997627002/?utm_source=google&utm_medium=amp&utm_campaign=speakable,"https://www.gannett-cdn.com/presto/2018/11/14/USAT/9de322a9-ee71-4676-8a29-60fe098b30b1-XXX_XXX_xx90_mars_1030.JPG?crop=6999,3920,x0,y1259&width=3200&height=1680&fit=bounds",16
141,"Justin McQueen, Analyst, Justin McQueen","MARKET DEVELOPMENT – GBP VOLATILITY CONTINUES, EUR RESILIENT DESPITE GERMAN GDP CONTRACTION GBP : Volatility is here to stay for the Pound with O/n vols via options suggesting break-evens of 148pips, while 1-week vols are implying a break-even of 228pips. Hea… [+2105 chars]","Volatility is here to stay for the Pound with headline risk remaining elevated. EUR dismisses German GDP contraction, while timely OPEC sources lift oil prices.",2018-11-14T14:30:00Z,"{'id': None, 'name': 'Dailyfx.com'}","EUR Resilient Despite German Slowdown, OPEC Inspires Oil Bounce - US Market Open",https://www.dailyfx.com/forex/fundamental/daily_briefing/daily_pieces/us_am_briefing/2018/11/14/EUR-Resilient-Despite-German-Slowdown-OPEC-Inspires-Oil-Bounce---US-Market-Open.html,,251
142,Taylor Pearson,"In 1994, Nick Szabo, a legal scholar and computer scientist, coined the term smart contract to describe the ability to embed contracts, a legal construct, into computer code. With the emergence of a blockchain ecosystem, the excitement around smart contracts … [+31582 chars]","In 1994, Nick Szabo, a legal scholar and computer scientist, coined the term “smart contract” to describe the ability to embed contracts, a legal construct, into computer code. With the emergence of a blockchain ecosystem, the excitement around smart contract…",2018-11-14T14:30:26Z,"{'id': None, 'name': 'Business2community.com'}",Will Smart Contracts Eat the World?,https://www.business2community.com/strategy/will-smart-contracts-eat-the-world-02138916,https://cdn.business2community.com/wp-content/uploads/2018/11/smartcontracts-900x361.jpg,162
143,,"BreachExchange mailing list archives 1-877-KARS4KIDS had a data breach From : Destry Winant &lt;destry () riskbasedsecurity com&gt; Date : Wed, 14 Nov 2018 01:59:39 -0600 https://techcrunch.com/2018/11/13/kars4kids-data-breach/ Bad news: 1-877-KARS4KIDS had a… [+2397 chars]",Posted by Destry Winant on Nov 14 https://techcrunch.com/2018/11/13/kars4kids-data-breach/ Bad news: 1-877-KARS4KIDS had a data breach. Worse news: now you’ll have that awful jingle stuck in your head all day. The New Jersey-based charity has plagued the Amer…,2018-11-14T14:42:43Z,"{'id': None, 'name': 'Seclists.org'}",1-877-KARS4KIDS had a data breach,https://seclists.org/dataloss/2018/q4/142,http://seclists.org/images/dataloss-img.png,219
144,,"LONDON, Nov. 14, 2018 /PRNewswire-PRWeb/ -- Trendalyze Inc. and the Bitfury Group today announced plans to integrate Bitfury's Crystal blockchain analytics service into Trendalyze, a micro-trends analytics, monitoring, prediction and search platform. Bitfury,… [+3665 chars]","LONDON, Nov. 14, 2018 /PRNewswire-PRWeb/ -- Trendalyze Inc. and the Bitfury Group today announced plans to integrate Bitfury's Crystal blockchain analytics service into Trendalyze, a micro-trends analytics, monitoring, prediction and search platform. read more",2018-11-14T15:00:31Z,"{'id': None, 'name': 'Sys-con.com'}",Bitfury and Trendalyze to Integrate Crystal Blockchain Analytics,http://news.sys-con.com/node/4346490,,245
145,Wendy Zamora,"Last quarter brought with it a maddening number of political ads, shocking and divisive news stories on climate change and gun laws, and mosquitoes. We hate mosquitoes. In related unpleasant news, it also apparently ushered in an era of banking Trojans that, … [+8411 chars]","There’s a newer, more sophisticated banking Trojan in town attempting to penetrate business networks and giving Emotet a run for its money. And its name is TrickBot. Learn how this threat is giving organizations a run for their money. Categories: 101 Business…",2018-11-14T15:00:37Z,"{'id': None, 'name': 'Malwarebytes.com'}",TrickBot takes over as top business threat,https://blog.malwarebytes.com/101/2018/11/trickbot-takes-top-business-threat/,https://blog.malwarebytes.com/wp-content/uploads/2018/11/shutterstock_1021555810.jpg,178
146,Martin Young,"The cryptocurrency industry is still in its infancy, or so we keep being told. That infancy, or childishness, is often revealed on the crypto-spheres primary tool for communication, Twitter. No greater example has been seen than the recent battles between riv… [+3992 chars]","The cryptocurrency industry is still in its infancy, or so we keep being told. That infancy, or childishness, is often revealed on the crypto-sphere’s primary tool for communication, Twitter. No greater example has been seen than the recent battles between ri…",2018-11-14T15:00:57Z,"{'id': None, 'name': 'Newsbtc.com'}","BCH Fight: Bitcoin Cash Bashing Heats Up, Rivals Duke it Out Ahead of Hard Fork",https://www.newsbtc.com/2018/11/14/forking-around-bitcoin-cash-bashing-heats-up-as-rivals-duke-it-out/,https://www.newsbtc.com/wp-content/uploads/2018/11/bch-fight.jpg,83
147,Leigh Cuen,"One of the bitcoin communitys most beloved veterans just got a promotion. Revealed exclusively to CoinDesk, Casa has elevated Jameson Lopp to CTO eight months after he joined the crypto custody solutions startup as an infrastructure engineer. In this newly-cr… [+3806 chars]",Casa has boosted Jameson Lopp to CTO eight months after he joined the crypto custody solutions startup as an infrastructure engineer.,2018-11-14T15:01:15Z,"{'id': None, 'name': 'Coindesk.com'}",Bitcoin Veteran Jameson Lopp Named CTO of Crypto Startup Casa,https://www.coindesk.com/crypto-casa-bitcoin-jameson-lopp,https://www.coindesk.com/wp-content/uploads/2018/11/Jameson-Lopp.jpg,36
148,Gerelyn Terzo,"Despite their harsh exterior, banks have been quietly preparing for a world that involves cryptocurrencies. Bank of America has most recently secured a patent for a cryptocurrency aggregation system, one in which big companies store customers’ crypto deposits… [+3038 chars]","Despite their harsh exterior, banks have been quietly preparing for a world that involves cryptocurrencies. Bank of America has most recently secured a patent for a cryptocurrency aggregation system, one in which big companies store customers’ crypto deposits…",2018-11-14T15:01:33Z,"{'id': 'crypto-coins-news', 'name': 'Crypto Coins News'}",Bank of America Could Store Crypto Deposits for Big Companies,https://www.ccn.com/bank-of-america-could-store-crypto-deposits-for-big-companies/,https://www.ccn.com/wp-content/uploads/2018/02/Bank-of-America.jpg,115
149,Editorial Team,"IDG Capital, Matrix Partners and Neo Global Capital, industry leaders in technology and venture capital investments, jointly announced today a partnership with Singapore-based international cryptocurrency platform KuCoin, to bring cryptocurrency trading into … [+5898 chars]","IDG Capital, Matrix Partners and Neo Global Capital, industry leaders in technology and venture capital investments, jointly announced today a partnership with Singapore-based international cryptocurrency platform KuCoin, to bring cryptocurrency trading into …",2018-11-14T15:08:00Z,"{'id': None, 'name': 'Finextra.com'}","IDG Capital, Matrix Partners, and Neo Global Capital invest $20m into KuCoin",https://www.finextra.com/pressarticle/76384/idg-capital-matrix-partners-and-neo-global-capital-invest-20m-into-kucoin?utm_medium=rss&utm_source=finextrafeed,https://www.finextra.com/finextra-images/site/toplogo/finextralogo.png,236
