,author,content,description,publishedAt,source,title,url,urlToImage,relevancy
0,,The Australian Taxation Office (ATO) has warned of increasing numbers of scammers spoofing phone numbers from its switchboard in an effort to make fake calls appear legitimate. Scammers who pose as ATO staff typically attempt to secure payments of debts that … [+1336 chars],This time its switchboard is being spoofed.,2018-10-12T00:54:13Z,"{'id': None, 'name': 'Itnews.com.au'}",ATO issues third scam watch alert in four months,https://www.itnews.com.au/news/ato-issues-third-scam-watch-alert-in-four-months-513847,https://i.nextmedia.com.au/News/liar_phone_call_scam.jpg,137
1,Mark Emem,"Robinhood is now in Ohio bringing the number of states that the cryptocurrency and stocks trading app is currently available in to 25. In a tweeted statement, the trading startup indicated that Ohioans can now trade various cryptocurrencies commission-free on… [+3563 chars]","Robinhood is now in Ohio bringing the number of states that the cryptocurrency and stocks trading app is currently available in to 25. In a tweeted statement, the trading startup indicated that Ohioans can now trade various cryptocurrencies commission-free on…",2018-10-12T01:00:42Z,"{'id': 'crypto-coins-news', 'name': 'Crypto Coins News'}","Halfway Milestone: Crypto Trading App Robinhood Launches in U.S. State #25, Ohio",https://www.ccn.com/halfway-milestone-crypto-trading-app-robinhood-launches-in-u-s-state-25-ohio/,https://www.ccn.com/wp-content/uploads/2018/08/USA-flag.jpeg,40
2,Duncan Riley,"Cryptocurrency prices plunged overnight, following in the footsteps of a correction of share markets Wednesday as market uncertainty spread to digital assets. Bitcoin led the red ink, dropping by as much as seven percent to be trading at its lowest price sinc… [+3289 chars]","Cryptocurrency prices plunged overnight, following in the footsteps of a correction of share markets Wednesday as market uncertainty spread to digital assets. Bitcoin led the red ink, dropping by as much as seven percent to be trading at its lowest price sinc…",2018-10-12T01:07:32Z,"{'id': None, 'name': 'Siliconangle.com'}",Cryptocurrencies plunge as market uncertainty spreads to digital assets,https://siliconangle.com/2018/10/11/cryptocurrencies-plunge-market-uncertainty-spreads-digital-assets/,https://d15shllkswkct0.cloudfront.net/wp-content/blogs.dir/1/files/2018/10/bitcoindown.jpg,151
3,Henry Cooke,"Prime Minister Jacinda Ardern's office has reported a series of Facebook ads using her image to sell cryptocurrency as fake news. The ads were targeted specifically at Kiwis and pointed readers to a website dressed up to look like CNN, with a fake news story … [+2326 chars]",Prime Minister Jacinda Ardern's office has reported a series of Facebook ads using her image to sell cryptocurrency as fake news.,2018-10-12T02:22:18Z,"{'id': None, 'name': 'Stuff.co.nz'}",Fake news site uses Prime Minister Jacinda Ardern to promote bitcoin,https://www.stuff.co.nz/national/politics/107764555/Fake-news-site-uses-Prime-Minister-Jacinda-Ardern-to-promote-bitcoin,https://resources.stuff.co.nz/content/dam/images/1/s/6/p/g/f/image.related.StuffLandscapeSixteenByNine.1420x800.1s5rnv.png/1539311625991.png,50
4,Shobhit Seth,"In an industry shocker, the Securities and Exchange Commission (SEC) denied the Winklevoss Twins' request to launch a Bitcoin ETF. This surely comes as a blow to the twins, most famous for their claim to having originated the idea for Facebook, Inc. (FB) and … [+3800 chars]",The Bitcoin world was stunned by the SEC's decision not to approve the Winklevoss Bitcoin ETF.,2018-10-12T02:51:00Z,"{'id': None, 'name': 'Investopedia.com'}",SEC Denies Winklevoss Bid to Launch Bitcoin ETFs in Surprise Upset,https://www.investopedia.com/articles/investing/073015/bitcoin-etfs-how-do-they-work.asp,https://i.investopedia.com/dimages/graphics/shutterstock_167010449.jpg,32
5,Tyler Bernath,"The team over at MyDigitalSSD has been hard at work for years delivering high-end performance in storage solutions without the inflation of a big-name brand, after all it's their ""motto."" That said, I never thought they would venture into Thunderbolt solution… [+3352 chars]","The team over at MyDigitalSSD has been hard at work for years delivering high-end performance in storage solutions without the inflation of a big-name brand, after all it's their ""motto."" That said, I never thought they would venture into Thunderbolt solution…",2018-10-12T03:00:04Z,"{'id': None, 'name': 'Tweaktown.com'}",MyDigitalSSD Pocket Vault Express Review,https://www.tweaktown.com/reviews/8761/mydigitalssd-pocket-vault-express-review/index.html,https://imagescdn.tweaktown.com/content/8/7/8761_02_mydigitalssd-pocket-vault-express-review_full.jpg,126
6,Wolfie Zhao,"Bithumb, currently the largest cryptocurrency exchange in South Korea by trading volume, just confirmed it has sold more than 38 percent of its total ownership to a blockchain consortium based in Singapore, for 400 billion won, or $350 million. As reported by… [+1678 chars]","Bithumb, the largest crypto exchange in South Korea by trading volume, just confirmed it has sold over 38 percent of its shares for $350 million.",2018-10-12T03:23:26Z,"{'id': None, 'name': 'Coindesk.com'}",Korea's Largest Bitcoin Exchange Sells Stake in $350 Million Deal,https://www.coindesk.com/koreas-largest-bitcoin-exchange-sold-in-350-million-deal/,https://media.coindesk.com/uploads/2018/08/Bithumb-by-Dan-P-3-e1539313204588.jpg,10
7,The Freedonia Cooperative,"The stock of CRISPR Therapeutics (NASDAQ: CRSP ) was trending downward until the recent announcement that a vital clinical hold has been lifted. The announcement saw shares bounce back up +3%, even on a rough macro market day. Still, the stock has a long way … [+4671 chars]","CRISPR Therapeutics got some good news this week with a clinical hold lifted, but it has a long way to go to make up for the share performance of late. An earni",2018-10-12T03:27:33Z,"{'id': None, 'name': 'Seekingalpha.com'}","Long-Term Outlook For CRISPR Therapeutics: October 11, 2018",https://seekingalpha.com/article/4211225-long-term-outlook-crispr-therapeutics-october-11-2018,https://static1.seekingalpha.com/uploads/2018/10/11/2346101-1539271702977728.png,76
8,Sarah Jenn,"Bitcoin Price Key Highlights Bitcoin price also broke below the longer-term triangle support and is aiming lower. This follows a short-term triangle consolidation break, signaling that further losses are underway. Price is now closing in on a couple of suppor… [+1579 chars]","Bitcoin Price Key Highlights Bitcoin price also broke below the longer-term triangle support and is aiming lower. This follows a short-term triangle consolidation break, signaling that further losses are underway. Price is now closing in on a couple of suppor…",2018-10-12T03:32:24Z,"{'id': None, 'name': 'Newsbtc.com'}",Bitcoin (BTC) Price Watch: Just a Few Support Zones Left,https://www.newsbtc.com/2018/10/12/bitcoin-btc-price-watch-just-a-few-support-zones-left/,https://s3.amazonaws.com/main-newsbtc-images/2018/08/23144810/techanalysis-btc7-bearish.jpg,33
9,,,"Olga Kharif / Bloomberg : Study: Bitcoin daily transactions fell from ~360K in late 2017 to ~230K in Sept. 2018; transaction values fell from $3.7B+ to below $670M in the same period — - Declining daily transaction volume, values seen as negative — Quarter-ov…",2018-10-12T03:40:16Z,"{'id': None, 'name': 'Techmeme.com'}",Study: Bitcoin daily transactions fell from ~360K in late 2017 to ~230K in Sept. 2018; transaction values fell from $3.7B+ to below $670M in the same period (Olga Kharif/Bloomberg),https://www.techmeme.com/181011/p31,http://assets.bwbx.io/images/users/iqjWHBFdfxIU/ipBbmVr0K4C4/v5/640x-1.jpg,6
10,David Floyd,"Distributed though it may be, the EOS community has fought hard to remain united. As of June, two rival groups were briefly in competition to launch the official EOS blockchain (or mainnet) using code released by the company behind the protocol, Block.One. Th… [+10163 chars]",English or Mandarin? Telegram or WeChat? EOS is finding governance isn't just about code.,2018-10-12T04:04:11Z,"{'id': None, 'name': 'Coindesk.com'}",EOS' Grand Governance Experiment Has a New Enemy: China's Great Firewall,https://www.coindesk.com/eos-grand-governance-experiment-has-a-new-enemy-chinas-great-firewall/,https://media.coindesk.com/uploads/2018/10/shutterstock_116542702-e1539117782291.jpg,49
11,Joe Whitworth,"Food safety, plastic packaging and blockchain were key topics discussed at an industry event this past week. The Future Food Conference was hosted by the British Standards Institution (BSI) in London, United Kingdom. In opening remarks, Richard Werran, BSI di… [+6175 chars]","Food safety, plastic packaging and blockchain were key topics discussed at an industry event this past week. The Future Food Conference was hosted by the British Standards Institution (BSI) in London, United Kingdom. In opening remarks, Richard Werran, BSI di…",2018-10-12T04:04:22Z,"{'id': None, 'name': 'Foodsafetynews.com'}",Experts discuss food safety and blockchain at BSI event,https://www.foodsafetynews.com/2018/10/experts-discuss-food-safety-and-blockchain-at-bsi-event/,https://www.foodsafetynews.com/files/2018/10/BSI-1.jpg,120
12,Aayush Jindal,Key Points Bitcoin cash price extended losses and broke the $440 swing low against the US Dollar. There is a key declining channel in place with resistance at $440 on the hourly chart of the BCH/USD pair (data feed from Kraken). The pair is likely to extend l… [+1553 chars],Key Points Bitcoin cash price extended losses and broke the $440 swing low against the US Dollar. There is a key declining channel in place with resistance at $440 on the hourly chart of the BCH/USD pair (data feed from Kraken). The pair is likely to extend l…,2018-10-12T04:28:15Z,"{'id': None, 'name': 'Newsbtc.com'}",Bitcoin Cash Price Analysis: BCH/USD Bears Eyeing $400,https://www.newsbtc.com/2018/10/12/bitcoin-cash-price-analysis-bch-usd-bears-eyeing-400/,https://s3.amazonaws.com/main-newsbtc-images/2018/04/17074915/techanalysis-bch3.jpg,41
13,"Marc Freestone, PhD Candidate, Australian National University","Marc Freestone/The Conversation Sign up to Beating Around the Bush, a series that profiles native plants: part gardening column, part dispatches from country, entirely Australian. Leek orchids don’t have many friends. Maybe it’s because they lack the drop-dea… [+5845 chars]",Scientists are racing against the clock to figure out how to propagate the rare leek orchid before it goes extinct.,2018-10-12T04:32:11Z,"{'id': None, 'name': 'Theconversation.com'}","Leek orchids are beautiful, endangered and we have no idea how to grow them",http://theconversation.com/leek-orchids-are-beautiful-endangered-and-we-have-no-idea-how-to-grow-them-103224,https://images.theconversation.com/files/240355/original/file-20181012-154577-tpefju.png?ixlib=rb-1.1.0&rect=0%2C0%2C3000%2C1500&q=45&auto=format&w=1356&h=668&fit=crop,109
14,Arunkumar Krishnakumar,"May be you are tired seeing the Petro saga unfold and spam your social media feeds. May be you are thinking, there you go, the joke of the decade. May be you are angry that the PR nightmare that has affected Cryptos is getting worse with this. I must confess,… [+3161 chars]","May be you are tired seeing the Petro saga unfold and spam your social media feeds. May be you are thinking, there you go, the joke of the decade. May be you are angry that the PR nightmare that has affected Cryptos is getting worse with this. I must confess,…",2018-10-12T05:00:28Z,"{'id': None, 'name': 'Dailyfintech.com'}",Venezuela’s Petro: Does Blockchain deserve this?,https://dailyfintech.com/2018/10/12/venezuelas-petro-does-blockchain-deserve-this/,https://fintech4us.files.wordpress.com/2018/10/petro.jpg,106
15,Arjun Kharpal,"It's not clear there was a catalyst that sparked the selling over Thursday and Friday, but financial markets around the world saw big declines. There's also been a lot of negative sentiment toward cryptocurrencies from important financial institutions and maj… [+1063 chars]","The sell-off in cryptocurrencies was led by XRP and ethereum, which both dropped sharply, while bitcoin stabilized.",2018-10-12T05:01:00Z,"{'id': 'cnbc', 'name': 'CNBC'}",Cryptocurrencies continue plunge with another $6 billion of value wiped out in a day,https://www.cnbc.com/2018/10/12/bitcoin-price-cryptocurrency-market-drops-as-xrp-ethereum-plunge.html,https://fm.cnbc.com/applications/cnbc.com/resources/img/editorial/2018/02/20/105018160-GettyImages-919078630.1910x1000.jpg,92
16,"David Cottle, Analyst, David Cottle",Asian Stocks Talking Points: Asian stocks were mixed Friday despite more large US market falls The US Dollar came under initial pressure too but pared losses Many investors remain hopeful that recent falls have been merely corrective Find out what retail fore… [+2250 chars],Asian stocks didn’t fare too badly on Friday considering the terrible US curtain raiser they started with. A rise in US stock futures kept hopes alive,2018-10-12T05:05:00Z,"{'id': None, 'name': 'Dailyfx.com'}","Asian Stocks Mixed Despite Wall St Rout, US Futures In Focus",https://www.dailyfx.com/forex/market_alert/2018/10/12/Asian-Stocks-Mxed-Despite-Wall-St-Rout-US-Futures-Eyed.html,,160
17,"Sean O'Neill, Skift",Each week we round up travel startups that have recently received or announced funding. Please email Travel Tech Editor Sean O'Neill at so@skift.com if you have funding news. The total funding publicized this week was more than $58 million. &gt;&gt; Stay Alfr… [+3521 chars],"The total funding publicized this week was more than $58 million. >>Stay Alfred, a short-term apartment rental startup, has raised $47 million in a Stay Alfred, a short-term apartment rental startup, has raised $47 million in a Series B round. Nine Four Ventu…",2018-10-12T05:30:00Z,"{'id': None, 'name': 'Skift.com'}",Stay Alfred Raises $47 Million for Serviced Rentals: Travel Startup Funding This Week,https://skift.com/2018/10/12/stay-alfred-raises-47-million-for-serviced-rentals-travel-startup-funding-this-week/,https://skift.com/wp-content/uploads/2018/10/stay-alfred-travel-apartment.jpg,147
18,Nick Chong,"For the first time in a blue moon, crypto startup Coinbase recently saw one of its executives exit company doors, so to speak. Although some greeted this announcement with pessimism, insiders claim that the executive in question is poised to continue his imme… [+3480 chars]","For the first time in a blue moon, crypto startup Coinbase recently saw one of its executives exit company doors, so to speak. Although some greeted this announcement with pessimism, insiders claim that the executive in question is poised to continue his imme…",2018-10-12T05:30:14Z,"{'id': None, 'name': 'Newsbtc.com'}","Former Coinbase Executive Joins Bakkt Amid Crypto Futures Launch, Massive Anticipation",https://www.newsbtc.com/2018/10/12/former-coinbase-executive-joins-bakkt-amid-crypto-futures-launch-massive-anticipation/,https://s3.amazonaws.com/main-newsbtc-images/2018/10/12042745/shutterstock_1106325080.jpg,67
19,Neil Mathew,"There is no question that the entire cryptocurrency sector is in a bear market, with many cryptocurrencies losing over 50% of their value. However, this certainly hasnt prevented individuals from becoming very wealthy through cryptocurrency-related ventures. … [+2665 chars]","There is no question that the entire cryptocurrency sector is in a bear market, with many cryptocurrencies losing over 50% of their value. However, this certainly hasn’t prevented individuals from becoming very wealthy through cryptocurrency-related ventures.…",2018-10-12T06:11:03Z,"{'id': 'crypto-coins-news', 'name': 'Crypto Coins News'}","Crypto Billionaires Among China’s Wealthiest, Despite Bear Market",https://www.ccn.com/crypto-billionaires-among-chinas-wealthiest-despite-bear-market/,https://www.ccn.com/wp-content/uploads/2017/09/Bitcoin-gold-coin-china-flag.jpg,42
20,Aayush Jindal,Key Highlights ETH price declined further and traded towards the $180 level against the US Dollar. There was a break below a key contracting triangle with support at $194 on the hourly chart of ETH/USD (data feed via Kraken). The pair traded as low as $184.15… [+1626 chars],Key Highlights ETH price declined further and traded towards the $180 level against the US Dollar. There was a break below a key contracting triangle with support at $194 on the hourly chart of ETH/USD (data feed via Kraken). The pair traded as low as $184.15…,2018-10-12T06:28:17Z,"{'id': None, 'name': 'Newsbtc.com'}",Ethereum Price Analysis: ETH/USD Upsides Capped Near $198,https://www.newsbtc.com/2018/10/12/ethereum-price-analysis-eth-usd-upsides-capped-near-198/,https://s3.amazonaws.com/main-newsbtc-images/2018/08/23151239/techanalysis-eth7-bearish.jpg,97
21,Venkatesh Rao,"We experience and navigate the world in packs. Families ride in cars together. Groups of coworkers take elevators together. Dating couples go to movies in pairs. The pack is a unit, the unit, of operational coordination and everyday problem solving in human l… [+21555 chars]","We experience and navigate the world in packs. Families ride in cars together. Groups of coworkers take elevators together. Dating couples go to movies in pairs. The pack is a unit, the unit, of operational coordination and everyday problem solving in human l…",2018-10-12T06:36:37Z,"{'id': None, 'name': 'Ribbonfarm.com'}",Pack Experience,https://www.ribbonfarm.com/2018/10/11/pack-experience/,https://206hwf3fj4w52u3br03fi242-wpengine.netdna-ssl.com/wp-content/uploads/2018/10/packex.png,129
22,Lawrence Abrams,Sextortion scams are when an attacker sends emails to people stating that their computer is hacked and that the attackers have been recording the screen and webcam as the user visits adult sites. The scammers then blackmail the recipients by stating they will… [+5887 chars],A new sextortion campaign is underway that is pretending to have access to the target's email account by spoofing the sender of the scam email to be the same email as the victim. [...],2018-10-12T07:00:00Z,"{'id': None, 'name': 'Bleepingcomputer.com'}",New Sextortion Scam Pretends to Come from Your Hacked Email Account,https://www.bleepingcomputer.com/news/security/new-sextortion-scam-pretends-to-come-from-your-hacked-email-account/,https://www.bleepstatic.com/content/hl-images/2018/10/11/scam-header.jpg,59
23,Aayush Jindal,Key Highlights Ripple price declined further and traded towards the $0.3600 support zone against the US dollar. There is a monster bearish trend line in place with resistance near $0.4290 on the hourly chart of the XRP/USD pair (data source from Kraken). The … [+1706 chars],Key Highlights Ripple price declined further and traded towards the $0.3600 support zone against the US dollar. There is a monster bearish trend line in place with resistance near $0.4290 on the hourly chart of the XRP/USD pair (data source from Kraken). The …,2018-10-12T07:30:29Z,"{'id': None, 'name': 'Newsbtc.com'}",Ripple Price Analysis: XRP/USD Could Correct To $0.4290 Before Lower,https://www.newsbtc.com/2018/10/12/ripple-price-analysis-xrp-usd-could-correct-to-0-4290-before-lower/,https://s3.amazonaws.com/main-newsbtc-images/2018/04/17064020/techanalysis-xrp2.jpg,89
24,Davit Babayan,Global economist Nouriel Roubini expressed his rage against Bitcoin and blockchain while displaying his profound lack of understanding in the field. A Political Rap against Crypto Roubini was present at an informational hearing round Exploring the Cryptocurre… [+3555 chars],Global economist Nouriel Roubini expressed his rage against Bitcoin and blockchain while displaying his profound lack of understanding in the field. A Political Rap against Crypto Roubini was present at an informational hearing round “Exploring the Cryptocurr…,2018-10-12T07:38:05Z,"{'id': None, 'name': 'Newsbtc.com'}","Nouriel Roubini Tries to Attack Bitcoin by Saying Fees Cost $55, Fails",https://www.newsbtc.com/2018/10/12/nouriel-roubini-tries-to-attack-bitcoin-by-saying-fees-cost-55-fails/,https://s3.amazonaws.com/main-newsbtc-images/2018/10/12073729/shutterstock_255072133.jpg,52
25,Jimmy Aki,"In a move that clearly shows the government’s resolve to encourage investments in cryptocurrencies, Switzerland’s financial markets regulator has opened the floodgates for institutional participation in cryptocurrencies. Zug-based Crypto Finance AG subsidiary… [+2453 chars]","In a move that clearly shows the government’s resolve to encourage investments in cryptocurrencies, Switzerland’s financial markets regulator has opened the floodgates for institutional participation in cryptocurrencies. Zug-based Crypto Finance AG subsidiary…",2018-10-12T07:40:27Z,"{'id': 'crypto-coins-news', 'name': 'Crypto Coins News'}",Crypto Funds Gets Greenlight from Swiss Financial Markets Regulator,https://www.ccn.com/crypto-funds-gets-greenlight-from-swiss-financial-markets-regulator/,https://www.ccn.com/wp-content/uploads/2018/07/switzerland-ico-finma-cryptocurrency-crypto-valley-bitcoin-ethereum.jpg,70
26,,"Bithumb is the biggest virtual currency exchange in South Korea, which has emerged as one of the world's top Bitcoin markets A consortium led by a prominent Seoul plastic surgeon purchased a controlling stake in South Korea's largest cryptocurrency exchange, … [+1312 chars]","A consortium led by a prominent Seoul plastic surgeon purchased a controlling stake in South Korea's largest cryptocurrency exchange, reports said Friday.",2018-10-12T07:57:37Z,"{'id': None, 'name': 'Phys.org'}",Plastic surgeon buys top S. Korea Bitcoin exchange,https://phys.org/news/2018-10-plastic-surgeon-korea-bitcoin-exchange.html,https://3c1703fe8d.site.internapcdn.net/newman/gfx/news/2018/bithumbisthe.jpg,69
27,Eillie Anzilotti,"In 1903, an American entrepreneur, Charles Boettcher, founded the Great Western Sugar Company in Colorado, and opened two beet sugar refineries outside of Denver. Over the course of the 20th century, the company expanded, adding more facilities in Wyoming, Mo… [+9272 chars]","In a new book, journalist Nathan Schneider positions cooperative businesses as both radical and traditional–and says all businesses should move toward more democracy. In 1903, an American entrepreneur, Charles Boettcher, founded the Great Western Sugar Compan…",2018-10-12T08:00:06Z,"{'id': None, 'name': 'Fastcompany.com'}",Why the cooperative model needs to be at the heart of our new economy,https://www.fastcompany.com/90249347/why-the-cooperative-model-needs-to-be-at-the-heart-of-our-new-economy?partner=feedburner&utm_source=feedburner&utm_medium=feed&utm_campaign=Feed%3A+fastcoexist%2Ffeed+%28Co.Exist%29,"https://images.fastcompany.net/image/upload/w_1280,f_auto,q_auto,fl_lossy/wp-cms/uploads/2018/10/p-2-90249347-why-the-cooperative-model-needs-to-be-at-the-heart-of-our-new-economy.jpg",98
28,Eillie Anzilotti,"In 1903, an American entrepreneur, Charles Boettcher, founded the Great Western Sugar Company in Colorado, and opened two beet sugar refineries outside of Denver. Over the course of the 20th century, the company expanded, adding more facilities in Wyoming, Mo… [+9272 chars]","In 1903, an American entrepreneur, Charles Boettcher, founded the Great Western Sugar Company in Colorado, and opened two beet sugar refineries outside of Denver. Over the course of the 20th century, the company expanded, adding more facilities in Wyoming, Mo…",2018-10-12T08:00:06Z,"{'id': None, 'name': 'Fastcompany.com'}",Why the cooperative model needs to be at the heart of our new economy,https://www.fastcompany.com/90249347/why-the-cooperative-model-needs-to-be-at-the-heart-of-our-new-economy?partner=rss&utm_source=feedburner&utm_medium=feed&utm_campaign=Feed%3A+fastcolabs+%28Co.Labs%29,"https://images.fastcompany.net/image/upload/w_1280,f_auto,q_auto,fl_lossy/wp-cms/uploads/2018/10/p-2-90249347-why-the-cooperative-model-needs-to-be-at-the-heart-of-our-new-economy.jpg",142
29,Eillie Anzilotti,"In 1903, an American entrepreneur, Charles Boettcher, founded the Great Western Sugar Company in Colorado, and opened two beet sugar refineries outside of Denver. Over the course of the 20th century, the company expanded, adding more facilities in Wyoming, Mo… [+9272 chars]","In a new book, journalist Nathan Schneider positions cooperative businesses as both radical and traditional–and says all businesses should move toward more democracy. In 1903, an American entrepreneur, Charles Boettcher, founded the Great Western Sugar Compan…",2018-10-12T08:00:06Z,"{'id': None, 'name': 'Fastcompany.com'}",Why the cooperative model needs to be at the heart of our new economy,https://www.fastcompany.com/90249347/why-the-cooperative-model-needs-to-be-at-the-heart-of-our-new-economy?partner=feedburner&utm_source=feedburner&utm_medium=feed&utm_campaign=feedburner+fastcompany&utm_content=feedburner,"https://images.fastcompany.net/image/upload/w_1280,f_auto,q_auto,fl_lossy/wp-cms/uploads/2018/10/p-2-90249347-why-the-cooperative-model-needs-to-be-at-the-heart-of-our-new-economy.jpg",146
