,author,content,description,publishedAt,source,title,url,urlToImage,relevancy
30,Eillie Anzilotti,"In 1903, an American entrepreneur, Charles Boettcher, founded the Great Western Sugar Company in Colorado, and opened two beet sugar refineries outside of Denver. Over the course of the 20th century, the company expanded, adding more facilities in Wyoming, Mo… [+9272 chars]","In a new book, journalist Nathan Schneider positions cooperative businesses as both radical and traditional–and says all businesses should move toward more democracy. In 1903, an American entrepreneur, Charles Boettcher, founded the Great Western Sugar Compan…",2018-10-12T08:00:06Z,"{'id': None, 'name': 'Fastcompany.com'}",Why the cooperative model needs to be at the heart of our new economy,https://www.fastcompany.com/90249347/why-the-cooperative-model-needs-to-be-at-the-heart-of-our-new-economy?partner=feedburner&utm_source=feedburner&utm_medium=feed&utm_campaign=Feed%3A+fastcocreate%2Ffeed+%28Co.Create%29,"https://images.fastcompany.net/image/upload/w_1280,f_auto,q_auto,fl_lossy/wp-cms/uploads/2018/10/p-2-90249347-why-the-cooperative-model-needs-to-be-at-the-heart-of-our-new-economy.jpg",95
31,Eillie Anzilotti,"In 1903, an American entrepreneur, Charles Boettcher, founded the Great Western Sugar Company in Colorado, and opened two beet sugar refineries outside of Denver. Over the course of the 20th century, the company expanded, adding more facilities in Wyoming, Mo… [+9272 chars]","In 1903, an American entrepreneur, Charles Boettcher, founded the Great Western Sugar Company in Colorado, and opened two beet sugar refineries outside of Denver. Over the course of the 20th century, the company expanded, adding more facilities in Wyoming, Mo…",2018-10-12T08:00:06Z,"{'id': None, 'name': 'Fastcompany.com'}",Why the cooperative model needs to be at the heart of our new economy,https://www.fastcompany.com/90249347/why-the-cooperative-model-needs-to-be-at-the-heart-of-our-new-economy?partner=rss&utm_source=rss&utm_medium=feed&utm_campaign=rss+fastcompany&utm_content=rss,"https://images.fastcompany.net/image/upload/w_1280,f_auto,q_auto,fl_lossy/wp-cms/uploads/2018/10/p-2-90249347-why-the-cooperative-model-needs-to-be-at-the-heart-of-our-new-economy.jpg",118
32,Eillie Anzilotti,"In 1903, an American entrepreneur, Charles Boettcher, founded the Great Western Sugar Company in Colorado, and opened two beet sugar refineries outside of Denver. Over the course of the 20th century, the company expanded, adding more facilities in Wyoming, Mo… [+9272 chars]","In a new book, journalist Nathan Schneider positions cooperative businesses as both radical and traditional–and says all businesses should move toward more democracy. In 1903, an American entrepreneur, Charles Boettcher, founded the Great Western Sugar Compan…",2018-10-12T08:00:06Z,"{'id': None, 'name': 'Fastcompany.com'}",Why the cooperative model needs to be at the heart of our new economy,https://www.fastcompany.com/90249347/why-the-cooperative-model-needs-to-be-at-the-heart-of-our-new-economy?partner=feedburner&utm_source=feedburner&utm_medium=feed&utm_campaign=Feed%3A+fastcompany%2Fheadlines+%28Fast+Company%29,"https://images.fastcompany.net/image/upload/w_1280,f_auto,q_auto,fl_lossy/wp-cms/uploads/2018/10/p-2-90249347-why-the-cooperative-model-needs-to-be-at-the-heart-of-our-new-economy.jpg",166
33,Will Martin,"Stock markets in Europe and Asia are rallying on Friday after a fierce sell-off gripped global markets over the previous four days of trading. At the close in Asia, all major share indexes had pulled back at least some of their losses over the past week, alth… [+2780 chars]","Global markets rally on Friday, pausing after several days of aggressive selling. ""It’s a pause for breath, we’ve had a sharp drawdown and now the market has taken a breath,"" Kerry Craig, global market strategist at JPMorgan Asset Management said. Stocks in A…",2018-10-12T08:13:19Z,"{'id': 'business-insider', 'name': 'Business Insider'}",Global market sell-off halts with rallies in Asia and Europe,https://www.businessinsider.com/global-markets-sell-off-pauses-as-asia-and-europe-rally-2018-10,https://amp.businessinsider.com/images/597f4f6c4528e621008b5bd5-1920-960.jpg,5
34,Wolfie Zhao,"A fake news site has used the likeness of New Zealand Prime Minister Jacinda Ardern to promote articles on Facebook aimed to pump a crypto startup. Local media source Stuff reported Friday that several sponsored posts had recently emerged on Facebook, featuri… [+1644 chars]",A fake news site used images of New Zealand's prime minister in sponsored posts on Facebook to promote a bitcoin firm.,2018-10-12T08:20:30Z,"{'id': None, 'name': 'Coindesk.com'}",Fake News Site Used New Zealand Prime Minister to Pump Bitcoin Startup,https://www.coindesk.com/fake-news-site-used-new-zealand-prime-minister-to-pump-a-bitcoin-startup/,https://media.coindesk.com/uploads/2018/10/j.jpg,7
35,,"SEOUL: A consortium led by a prominent Seoul plastic surgeon purchased a controlling stake in South Korea's largest cryptocurrency exchange, reports said Friday (Oct 12). The hyper-wired South has emerged as one of the world's top Bitcoin markets, at one poin… [+1181 chars]","SEOUL: A consortium led by a prominent Seoul plastic surgeon purchased a controlling stake in South Korea's largest cryptocurrency exchange, reports said Friday (Oct 12). The hyper-wired South has emerged as one of the world's top Bitcoin markets, at one poin…",2018-10-12T08:25:34Z,"{'id': None, 'name': 'Channelnewsasia.com'}",Plastic surgeon buys top South Korea Bitcoin exchange,https://www.channelnewsasia.com/news/business/plastic-surgeon-buys-top-south-korea-bitcoin-exchange-10820798,http://www.channelnewsasia.com/image/10820796/16x9/991/557/c404c6cc8f77567db07e72e471422d9/eb/bithumb-is-the-biggest-virtual-currency-exchange-in-south-korea-which-has-emerged-as-one-of-the-world-s-top-bitcoin-markets-1539330401187-4.jpg,39
36,Aayush Jindal,Key Highlights ADA price declined sharply and broke the $0.0800 and $0.0740 support levels against the US Dollar (tethered). There is a key bearish trend line formed with resistance at $0.0750 on the hourly chart of the ADA/USD pair (data feed via Bittrex). T… [+1752 chars],Key Highlights ADA price declined sharply and broke the $0.0800 and $0.0740 support levels against the US Dollar (tethered). There is a key bearish trend line formed with resistance at $0.0750 on the hourly chart of the ADA/USD pair (data feed via Bittrex). T…,2018-10-12T08:28:19Z,"{'id': None, 'name': 'Newsbtc.com'}",Cardano Price Analysis: ADA/USD’s Support Turned Resistance At $0.080,https://www.newsbtc.com/2018/10/12/cardano-price-analysis-ada-usds-support-turned-resistance-at-0-080/,https://s3.amazonaws.com/main-newsbtc-images/2018/05/07074027/techanalysis-ada2.jpg,86
37,Lester Coleman,"This is a sponsored story. CCN urges readers to conduct their own research with due diligence into the company, product or service mentioned in the content below. WIZBL, a true dispersion ecosystem that optimizes transaction processes and verification speeds … [+4614 chars]","This is a sponsored story. CCN urges readers to conduct their own research with due diligence into the company, product or service mentioned in the content below. WIZBL, a true dispersion ecosystem that optimizes transaction processes and verification speeds …",2018-10-12T08:34:02Z,"{'id': 'crypto-coins-news', 'name': 'Crypto Coins News'}",Korean Entrepreneur Seizes Blockchain’s Promise to Benefit Humanity,https://www.ccn.com/korean-entrepreneur-seizes-blockchains-promise-to-benefit-humanity/,https://www.ccn.com/wp-content/uploads/2017/08/Blockchain-Integration.jpg,94
38,Oliver Russell,"Our energy system has not changed dramatically for over 100 years. Since the first power station was built in 1882, energy has been a one-way street. Power stations push energy through their vast distribution networks to us, the consumers. Then energy retaile… [+8851 chars]",Current infrastructure is desperate for innovation.,2018-10-12T08:46:02Z,"{'id': None, 'name': 'Hackernoon.com'}",Blockchain And Energy: Everything You Need To Know.,https://hackernoon.com/blockchain-and-energy-everything-you-need-to-know-2c56977614aa,https://cdn-images-1.medium.com/max/1200/1*sUif8A5X81bOpkLssOTbcg.jpeg,145
39,Samburaj Das,"South Koreas largest cryptocurrency exchange by trading volume, Bithumb, has seen a Singapore-based blockchain consortium become its majority owner in a $350 million deal. BTC Holdings Company, which was Bithumbs biggest stakeholder until Thursday with a 75.9… [+1765 chars]","South Korea’s largest cryptocurrency exchange by trading volume, Bithumb, has seen a Singapore-based blockchain consortium become its majority owner in a $350 million deal. BTC Holdings Company, which was Bithumb’s biggest stakeholder until Thursday with a 75…",2018-10-12T08:50:41Z,"{'id': 'crypto-coins-news', 'name': 'Crypto Coins News'}",$350 Million: Singapore Consortium Gains Majority Stake in Korea’s Biggest Bitcoin Exchange,https://www.ccn.com/350-million-singapore-consortium-gains-majority-stake-in-koreas-biggest-bitcoin-exchange/,https://www.ccn.com/wp-content/uploads/2018/10/Bithumb-stock.jpg,36
40,Agence France-Presse,,"SEOUL, South Korea – A consortium led by a prominent Seoul plastic surgeon purchased a controlling stake in South Korea's largest cryptocurrency exchange, reports said Friday, October 12. The hyper-wired South has emerged as one of the world's top Bitcoin mar…",2018-10-12T09:17:46Z,"{'id': None, 'name': 'Rappler.com'}",Plastic surgeon buys top South Korea Bitcoin exchange,https://www.rappler.com/technology/news/214165-plastic-surgeon-buys-controlling-stake-south-cryptocurrency-exchange-bithumb,https://assets.rappler.com/612F469A6EA84F6BAE882D2B94A4B421/img/3948DBE870A74360BE286CD23C9A90BE/bithumb-20181012.jpg,37
41,Aayush Jindal,"Key Points Bitcoin price formed a support base near $6,110 and recovered higher against the US Dollar. There was a break above a connecting bearish trend line with resistance at $6,195 on the hourly chart of the BTC/USD pair (data feed from Kraken). The pair … [+1768 chars]","Key Points Bitcoin price formed a support base near $6,110 and recovered higher against the US Dollar. There was a break above a connecting bearish trend line with resistance at $6,195 on the hourly chart of the BTC/USD pair (data feed from Kraken). The pair …",2018-10-12T09:28:41Z,"{'id': None, 'name': 'Newsbtc.com'}","Bitcoin Price Watch: BTC/USD Recovery Could Be Limited Near $6,315",https://www.newsbtc.com/2018/10/12/bitcoin-price-watch-btc-usd-recovery-could-be-limited-near-6315/,https://s3.amazonaws.com/main-newsbtc-images/2018/04/17062405/techanalysis-btc2.jpg,53
42,Ian Barker,"An increasing number of enterprises are considering pre-purchasing cryptocurrency in anticipation of potential ransomware attacks. But is this a valid risk-reduction strategy for enterprises? To get some views on this controversial issue, we spoke with Mike D… [+5541 chars]","An increasing number of enterprises are considering pre-purchasing cryptocurrency in anticipation of potential ransomware attacks. But is this a valid risk-reduction strategy for enterprises? To get some views on this controversial issue, we spoke with Mike D…",2018-10-12T09:56:42Z,"{'id': None, 'name': 'Betanews.com'}",Should businesses prepare for ransomware with a cryptocurrency stash? [Q&A],https://betanews.com/2018/10/12/ransomware-cryptocurrency-qa/,https://betanews.com/wp-content/uploads/2016/01/ransomware_keyboard_button_dollar-50x50.jpg,26
43,Wolfie Zhao,"A U.S. crime-fighting agency is urging domestic exchanges to help prevent the Iranian regime from using cryptocurrency to bypass economic sanctions. The Financial Crimes Enforcement Network (FinCEN) published an advisory Friday, stating that Iran's ""illicit a… [+2096 chars]",U.S. regulator FinCEN is urging domestic exchanges to prevent Iranians from using cryptocurrency to bypass economic sanctions.,2018-10-12T10:00:23Z,"{'id': None, 'name': 'Coindesk.com'}",FinCEN Blasts Iran's 'Malign' Use of Crypto to Bypass Economic Sanctions,https://www.coindesk.com/fincen-blasts-irans-use-of-crypto-to-bypass-economic-sanctions/,https://media.coindesk.com/uploads/2018/10/iran-e1539336869587.jpg,46
44,Martin Young,Markets are in pain and have not recovered; Only 0x is making progress today. There has been no notable recovery or bounce following yesterdays 15 billion dollar dump. Markets have remained low and are just over $200 billion total capitalization at the time o… [+2279 chars],FOMO Moments Markets are in pain and have not recovered; Only 0x is making progress today. There has been no notable recovery or bounce following yesterday’s 15 billion dollar dump. Markets have remained low and are just over $200 billion total capitalization…,2018-10-12T10:06:11Z,"{'id': None, 'name': 'Newsbtc.com'}",Cryptocurrency Market Update: 0x Surging on Coinbase Pro Listing,https://www.newsbtc.com/2018/10/12/cryptocurrency-market-update-0x-surging-on-coinbase-pro-listing/,https://s3.amazonaws.com/main-newsbtc-images/2018/07/02045629/fomo2-0x.jpg,75
45,,"Gary Cohn, Donald Trumps former top economic aide, is now an adviser to a blockchain start-up that hopes to use the nascent technology to overhaul the way banks share credit data. In one of his first public moves since leaving the White House earlier this yea… [+3874 chars]",Former Goldman Sachs president calls Spring Labs project a ‘unique opportunity’,2018-10-12T10:08:06Z,"{'id': 'financial-times', 'name': 'Financial Times'}",Ex-Trump adviser Gary Cohn joins blockchain start-up,https://www.ft.com/content/e06d14f8-cd56-11e8-9fe5-24ad351828ab,https://www.ft.com/__origami/service/image/v2/images/raw/http%3A%2F%2Fprod-upp-image-read.ft.com%2F89ebcba6-cd65-11e8-8d0b-a6539b949662?source=next-opengraph&fit=scale-down&width=900,66
46,AFP,"Bithumb is the biggest virtual currency exchange in South Korea, which has emerged as one of the world’s top Bitcoin markets (AFP pic) SEOUL: A consortium led by a prominent Seoul plastic surgeon purchased a controlling stake in South Korea’s largest cryptocu… [+1249 chars]","The BK consortium is an investment group led by Kim Byung-gun, a high-profile plastic surgeon who founded BK Plastic Surgery Hospital, a major clinic in Seoul that also has operations in Singapore.",2018-10-12T10:08:14Z,"{'id': None, 'name': 'Freemalaysiatoday.com'}",Plastic surgeon buys top S. Korea Bitcoin exchange,https://www.freemalaysiatoday.com/category/business/2018/10/12/plastic-surgeon-buys-top-s-korea-bitcoin-exchange/,https://s3media.freemalaysiatoday.com/wp-content/uploads/2018/10/FMT-KoreanbuysBitcoin120102018-AFP.jpg,58
47,"Davey Winder, Contributor, Davey Winder, Contributor https://www.forbes.com/sites/daveywinder/","There's a brilliant Dilbert cartoon where the pointy-haired boss asks Wally how his quantum computer project is doing and whether he can observe it, to which Wally replies 'that's a tricky question.' The pointy-haired boss could just as easily have been askin… [+14755 chars]","The time for the CISO to open Schrodinger's paradoxical box and start planning for a quantum-resilient security posture is already here. Unless they do, quantum computing will continue to  represent a simultaneous cybersecurity threat and opportunity.",2018-10-12T10:11:00Z,"{'id': None, 'name': 'Forbes.com'}",Schrodinger's Encryption: What The CISO Needs To Know About Quantum Cybersecurity,https://www.forbes.com/sites/daveywinder/2018/10/12/schrodingers-encryption-what-the-ciso-needs-to-know-about-quantum-cybersecurity/,https://thumbor.forbes.com/thumbor/600x315/https%3A%2F%2Fspecials-images.forbesimg.com%2Fdam%2Fimageserve%2F507298602%2F960x0.jpg%3Ffit%3Dscale,73
48,Leslie P. Norton,"Globalization has been especially challenged lately, as the U.S. and China engage in a trade war, the European Union sorts out Brexit, and the World Trade Organization court, the final arbiter of trade disputes, remains dangerously understaffed. We checked in… [+9950 chars]","Joseph Stiglitz, a professor at Columbia University, sat with Barron’s to discuss a range of problems he sees unfolding—an economic cold war with China, the breakup of the European Union, and more.",2018-10-12T10:15:02Z,"{'id': None, 'name': 'Barrons.com'}",Nobel Prize-Winning Economist Joseph Stiglitz on Why Globalization Is Under Threat,https://www.barrons.com/articles/nobel-prize-winning-economist-joseph-stiglitz-on-why-globalization-is-under-threat-1539339300,https://asset.barrons.com/public/resources/images/ON-CR432_1001_Q_G_20180925151846.jpg,123
49,Charlie Osborne,The GandCrab ransomware variant has been paired up with a crypter service to further enhance the malware's stealth capabilities. The malware has undergone a number of evolutions of late and the authors behind GandCrab appear to be constantly seeking out ways … [+3872 chars],The hacking agreement could result in the ransomware strain becoming more difficult to spot and analyze in the future.,2018-10-12T10:28:21Z,"{'id': None, 'name': 'Zdnet.com'}",GandCrab ransomware operators team up with crypter service,https://www.zdnet.com/article/gandcrab-ransomware-teams-up-with-crypter-service/,https://zdnet1.cbsistatic.com/hub/i/r/2018/10/12/181b2843-6401-4020-be8a-316ae9a0421b/thumbnail/770x578/d90729cb2d85d9fe4e5a828c6699a7b0/screen-shot-2018-10-12-at-09-01-56.png,81
50,Ryan Browne,"The cryptocurrency world is a ""stinking cesspool"" and is fundamentally worth nothing, according to Nouriel Roubini, the economist famed for predicting the 2008 financial crisis. div &gt; div.group &gt; p:first-child""&gt; In a series of tweets, Roubini said la… [+1415 chars]",Economist Nouriel Roubini said a recent sharp downturn in the prices of cryptocurrencies showed that nascent digital assets have poor fundamentals.,2018-10-12T10:30:00Z,"{'id': 'cnbc', 'name': 'CNBC'}","Roubini doubles down on criticisms of crypto, calls it a 'stinking cesspool that is in meltdown'",https://www.cnbc.com/2018/10/12/dr-doom-economist-nouriel-roubini-calls-crypto-stinking-cesspool.html,https://fm.cnbc.com/applications/cnbc.com/resources/img/editorial/2015/02/12/102421776-480531081.1910x1000.jpg,170
51,cchi@hubspot.com (Clifford Chi),"Bitcoin might be leading the crypto arms race right now, but Ethereum is charging right behind. As a software platform that issues the second largest cryptocurrency in the world and aims to create a decentralized version of the internet, Ethereum is a technol… [+5700 chars]","Bitcoin might be leading the crypto arms race right now, but Ethereum is charging right behind. As a software platform that issues the second largest cryptocurrency in the world and aims to create a decentralized version of the internet, Ethereum is a technol…",2018-10-12T11:00:00Z,"{'id': None, 'name': 'Hubspot.com'}",Everything You Need to Know About Ethereum,https://blog.hubspot.com/marketing/ethereum,https://blog.hubspot.com/hubfs/Ethereum.jpg?t=1539342673136#keepProtocol,3
52,Melanie Ehrenkranz,"If you received an email from hackers claiming they recorded you watching porn and will send all your data to your loved ones if you dont promptly pay up, take a beat. Its probably a scam. A Dutch journalist first spotted the sextortion scam in the Netherland… [+1836 chars]","If you received an email from “hackers” claiming they recorded you watching porn and will send all your data to your loved ones if you don’t promptly pay up, take a beat. It’s probably a scam. More »",2018-10-12T11:00:00Z,"{'id': None, 'name': 'Gizmodo.com.au'}",Don't Fall For This New Email Scam Threatening To Expose Your Porn Habits,https://www.gizmodo.com.au/2018/10/dont-fall-for-this-new-email-scam-threatening-to-expose-your-porn-habits/,"https://i.kinja-img.com/gawker-media/image/upload/c_lfill,w_768/v3ixqiue91cxdqzvbfhg.jpg",61
53,New York Post,"Three years ago, Inna Simone logged onto her computer, expecting to see her standard Microsoft desktop. What she encountered instead was unsettling. “Windows along a narrow bar at the screen’s bottom were minimized; they blinked nonstop and the computer made … [+4466 chars]","Three years ago, Inna Simone logged onto her computer, expecting to see her standard Microsoft desktop. What she encountered instead was unsettling.",2018-10-12T11:00:09Z,"{'id': 'fox-news', 'name': 'Fox News'}",How hackers can ransom your files for hundreds of dollars,https://www.foxnews.com/tech/hackers-steal-your-files,https://static.foxnews.com/foxnews.com/content/uploads/2018/09/komandokomandokomandopic3.jpg,168
54,Omkar Godbole,"After Thursday's range breakdown, the prospects of a deeper drop in BTC prices have increased, the price-volume analysis indicates. The leading cryptocurrency, which traded in a sideways manner since Sept. 22, fell sharply to a three-week low of $6,220 on Bit… [+3023 chars]","After Thursday's range breakdown, the prospects of a deeper drop in BTC prices have increased, the price-volume analysis indicates.",2018-10-12T11:10:02Z,"{'id': None, 'name': 'Coindesk.com'}",3 More Bitcoin Price Factors Suggest Bears Are in Charge,https://www.coindesk.com/3-more-bitcoin-price-factors-suggest-bears-are-in-charge/,https://media.coindesk.com/uploads/2018/06/bitcoins.jpg,12
55,,"Lady luck has struck for a second time this month at Australias favourite online casino, Fair Go Casino, after one player landed a monster $185k progressive jackpot win while playing poker. John D from Australia was playing a few hands of Caribbean Holdem Pok… [+1619 chars]","Lady luck has struck for a second time this month at Australia’s favourite online casino, Fair Go Casino, after one player landed a monster $185k progressive jackpot win while playing poker. read more",2018-10-12T11:13:03Z,"{'id': None, 'name': 'Sys-con.com'}",Fair Go Casino Player Hits $185K Jackpot,http://news.sys-con.com/node/4330676,,167
56,,"Lady luck has struck for a second time this month at Australias favourite online casino, Fair Go Casino, after one player landed a monster $185k progressive jackpot win while playing poker. John D from Australia was playing a few hands of Caribbean Holdem Pok… [+1619 chars]","Lady luck has struck for a second time this month at Australia’s favourite online casino, Fair Go Casino, after one player landed a monster $185k progressive jackpot win while playing poker. read more",2018-10-12T11:13:03Z,"{'id': None, 'name': 'Sys-con.com'}",Fair Go Casino Player Hits $185K Jackpot,http://businesswire.sys-con.com/node/4330676,,164
57,David Bisson,"A new sextortionist scam is using spoofing techniques to trick users into thinking that digital attackers have compromised their email accounts. As reported by Bleeping Computer, an attack email belonging to this ploy attempts to lure in a user with the subje… [+1623 chars]","A new sextortionist scam is using spoofing techniques to trick users into thinking that digital attackers have compromised their email accounts. As reported by Bleeping Computer, an attack email belonging to this ploy attempts to lure in a user with the subje…",2018-10-12T11:17:56Z,"{'id': None, 'name': 'Securityboulevard.com'}",New Sextortionist Scam Uses Email Spoofing Attack to Trick Users,https://securityboulevard.com/2018/10/new-sextortionist-scam-uses-email-spoofing-attack-to-trick-users/,https://securityboulevard.com/wp-content/uploads/2018/01/TwitterLogo-002.jpg,64
58,,"A consortium led by a prominent Seoul plastic surgeon purchased a controlling stake in South Korea's largest cryptocurrency exchange, reports said on Friday. The hyper-wired South has emerged as one of the world's top Bitcoin markets, at one point accounting … [+1315 chars]","A consortium led by a prominent Seoul plastic surgeon has purchased a controlling stake in South Korea's largest cryptocurrency exchange, according to reports.",2018-10-12T11:25:48Z,"{'id': None, 'name': 'Fin24.com'}",Fin24.com | Plastic surgeon buys top South Korea Bitcoin exchange,https://www.fin24.com/Companies/ICT/plastic-surgeon-buys-top-south-korea-bitcoin-exchange-20181012,http://cdn.24.co.za/files/Cms/General/d/7615/0947c77fd4a74214acd86ec29f1968a5.jpg,117
59,James Wesley Rawles,"Here are the latest news items and commentary on current economics news, market trends, stocks, investing opportunities, and the precious metals markets. We also cover hedges, derivatives, and obscura. And it bears mention that most of these items are from th… [+1924 chars]","Here are the latest news items and commentary on current economics news, market trends, stocks, investing opportunities, and the precious metals markets. We also cover hedges, derivatives, and obscura. And it bears mention that most of these items are from th…",2018-10-12T11:30:31Z,"{'id': None, 'name': 'Survivalblog.com'}",Economics & Investing For Preppers,https://survivalblog.com/economics-investing-preppers-208/,https://survivalblog.com/wp-content/uploads/2018/02/Bitcoin_5.jpg,68
60,,"Cryptocurrency may not seem like an obvious next step for Brazilian footballer Ronaldinho Gaúcho. But the former Barcelona star, who retired at the start of the year, has been busy promoting his own digital gold, the Ronaldinho Soccer Coin, to his 18m followe… [+5850 chars]",Sponsorship deals to promote initial coin offerings take off just as regulators crack down,2018-10-12T11:32:43Z,"{'id': 'financial-times', 'name': 'Financial Times'}",Football clubs dive into wild world of crypto,https://www.ft.com/content/284b9832-c7ce-11e8-ba8f-ee390057b8c9,https://www.ft.com/__origami/service/image/v2/images/raw/http%3A%2F%2Fprod-upp-image-read.ft.com%2Fded3a5ec-ce0c-11e8-8d0b-a6539b949662?source=next-opengraph&fit=scale-down&width=900,100
