,author,content,description,publishedAt,source,title,url,urlToImage,relevancy
0,Zia Ahmed Shaikh,©2018 C# Corner. All contents are copyright of their authors.,"I believe you all are aware of Blockchain and bitcoin. In this video, we will see the process of finding the number of blocks that have been mined so far.",2018-11-14T00:00:00Z,"{'id': None, 'name': 'C-sharpcorner.com'}",Bitcoin Block Height: How Many Blocks Have Been Mined So Far?,https://www.c-sharpcorner.com/article/bitcoin-block-height-how-many-blocks-have-been-mined-so-far/,https://www.c-sharpcorner.com/images/csharp-corner.png,192
1,Tony Spilotro,"The official, verified Twitter account of a leading U.S. retailer has been compromised by hackers, who are leveraging the account to steal cryptocurrencies from investors in an apparent giveaway scam. Target Hit: Hackers Infiltrate Verified Retailer Twitter A… [+3031 chars]","The official, verified Twitter account of a leading U.S. retailer has been compromised by hackers, who are leveraging the account to steal cryptocurrencies from investors in an apparent giveaway scam. Target Hit: Hackers Infiltrate Verified Retailer Twitter A…",2018-11-14T00:00:01Z,"{'id': None, 'name': 'Newsbtc.com'}","Target Twitter Account Hacked, Platform Defenseless Against Crypto Scammers",https://www.newsbtc.com/2018/11/14/target-twitter-account-hacked-platform-defenseless-against-crypto-scammers/,https://www.newsbtc.com/wp-content/uploads/2018/11/Twitter-Target.jpg,117
2,Samantha Chang,"Researchers at computer security firm McAfee Labs discovered a lethal new cryptojacking malware called “WebCobra,” which steals victims’ computing power to mine the cryptocurrencies Monero or Zcash secretly. The spike in cryptocurrency prices has inspired a n… [+3462 chars]","Researchers at computer security firm McAfee Labs discovered a lethal new cryptojacking malware called “WebCobra,” which steals victims’ computing power to mine the cryptocurrencies Monero or Zcash secretly. The spike in cryptocurrency prices has inspired a n…",2018-11-14T00:30:27Z,"{'id': 'crypto-coins-news', 'name': 'Crypto Coins News'}",‘WebCobra’: McAfee Spots Russian Malware Mining Monero and Zcash,https://www.ccn.com/webcobra-mcafee-spots-russian-malware-mining-monero-and-zcash/,https://www.ccn.com/wp-content/uploads/2018/04/Monero-coin.jpg,143
3,"Georgina Lee, Georgina Lee","Blazing a trail for virtual assets investment advisers looking to expedite the launch of funds in Hong Kong, Shanghai-based digital asset management firm Point95 Global said on Tuesday it plans to debut a multi-strategy crypto-quantitative fund in partnership… [+3448 chars]","Blazing a trail for virtual assets investment advisers looking to expedite the launch of funds in Hong Kong, Shanghai-based digital asset management firm Point95 Global said on Tuesday it plans to debut a multi-strategy crypto-quantitative fund in partnership…",2018-11-14T00:33:25Z,"{'id': None, 'name': 'Scmp.com'}",Shanghai-based cryptocurrency manager Point95 Global to launch quant hedge fund along with Hong Kong firm,https://www.scmp.com/business/article/2173021/shanghai-based-cryptocurrency-manager-point95-global-launch-quant-hedge,https://cdn3.i-scmp.com/sites/default/files/styles/620x356/public/images/methode/2018/11/13/779179c8-e6ed-11e8-bfde-9434090d4df7_image_hires_202334.JPG?itok=aYDG-CNT,203
4,David Hundeyin,"A number of high profile, verified Twitter accounts including retail giant Target and The Body Shop were hacked in what appears to be a coordinated campaign to promote yet another iteration of the now-ubiquitous crypto giveaway scam. A series of tweets by ver… [+3251 chars]","A number of high profile, verified Twitter accounts including retail giant Target and The Body Shop were hacked in what appears to be a coordinated campaign to promote yet another iteration of the now-ubiquitous crypto giveaway scam. A series of tweets by ver…",2018-11-14T00:33:43Z,"{'id': 'crypto-coins-news', 'name': 'Crypto Coins News'}",Twitter: Bitcoin Scammers Hack Retail Giant Target’s Verified Account,https://www.ccn.com/twitter-bitcoin-scammers-hack-retail-giant-targets-verified-account/,https://www.ccn.com/wp-content/uploads/2018/11/target-twitter-bitcoin-scam.jpg,57
5,"Harper Neidig, Olivia Beavers, Ali Breland and Jacqueline Thomsen","Welcome to Hillicon Valley, The Hill's newsletter detailing all you need to know about the tech and cyber news from Capitol Hill to Silicon Valley. Welcome! Follow the cyber team, Olivia Beavers (@olivia_beavers) and Jacqueline Thomsen (@jacq_thomsen), and th… [+14648 chars]","Welcome to Hillicon Valley, The Hill's newsletter detailing all you need to know about the tech and cyber news from Capitol Hill to Silicon Valley.Welcome! Follow the cyber team, Olivia Beavers (@olivi...",2018-11-14T00:34:08Z,"{'id': 'the-hill', 'name': 'The Hill'}","Hillicon Valley: Trump eyes staff shake-up | Amazon taps NYC, Northern Virginia for new offices | What it will mean for DC | Tech firms buck Trump on cyber pact | Defense official warns against hacking back",https://thehill.com/policy/technology/overnights/416531-hillicon-valley-rumors-swirl-around-kelly-departure-amazon,https://thehill.com/sites/default/files/trumpkelly_073018.jpg,258
6,,"John Lewis Will people in 2030 buy goods, get mortgages or hold their pension pots in bitcoin, ethereum or ripple rather than central bank issued currencies? I doubt it. Existing private cryptocurrencies do not seriously threaten traditional monies because th… [+9887 chars]","John Lewis Will people in 2030 buy goods, get mortgages or hold their pension pots in bitcoin, ethereum or ripple rather than central bank issued currencies? I doubt it.  Existing private cryptocur…",2018-11-14T00:51:13Z,"{'id': None, 'name': 'Bankunderground.co.uk'}",Seven deadly paradoxes of crytocurrency,https://bankunderground.co.uk/2018/11/13/the-seven-deadly-paradoxes-of-cryptocurrency/,https://bankunderground.files.wordpress.com/2018/11/banner-seven-deadly-paradoxes.jpg,7
7,Rick D.,"One of the cryptocurrency industry’s leading research groups, Diar, has announced that it will be expanding its coverage of the digital asset space going forward. Amongst the additional areas focused upon in future editions will be the Ethereum ecosystem, alo… [+2752 chars]","One of the cryptocurrency industry’s leading research groups, Diar, has announced that it will be expanding its coverage of the digital asset space going forward. Amongst the additional areas focused upon in future editions will be the Ethereum ecosystem, alo…",2018-11-14T01:00:38Z,"{'id': None, 'name': 'Newsbtc.com'}",Cryptocurrency Researchers Diar Expand Data Platform to Cover ETH and Stablecoins,https://www.newsbtc.com/2018/11/14/cryptocurrency-researchers-diar-expand-data-platform-to-cover-eth-and-stablecoins/,https://www.newsbtc.com/wp-content/uploads/2018/11/Diar.jpg,123
8,David Hundeyin,"Michigan’s campaign finance board has formally indicated that campaign donations made using cryptocurrency are not allowed in the state. In a November 8 letter addressed to Michigan state legislature candidate William Baker, who earlier made an inquiry on the… [+3222 chars]","Michigan’s campaign finance board has formally indicated that campaign donations made using cryptocurrency are not allowed in the state. In a November 8 letter addressed to Michigan state legislature candidate William Baker, who earlier made an inquiry on the…",2018-11-14T01:17:45Z,"{'id': 'crypto-coins-news', 'name': 'Crypto Coins News'}",No Coins for You! Michigan Bans Crypto Donations for Political Campaigns,https://www.ccn.com/no-coins-for-you-michigan-bans-crypto-donations-for-political-campaigns/,https://www.ccn.com/wp-content/uploads/2018/11/michigan-state-capitol-bitcoin-crypto-donations.jpg,65
9,Paige Leskin,"Google CEO Sundar Pichai. Beck Diefenbach/Reuters An official, verified Twitter account for Google's G Suite was hacked by scammers seeking to bilk innocent people out of their bitcoin making it the latest victim in a scourge that the social network can't qui… [+2530 chars]",Google CEO Sundar Pichai. Beck Diefenbach/Reuters. The official Twitter account for Google's G Suite was the latest to fall victim to a cryptocurrency giveaway scam on Twitter. The scam tried to convince people to send them bitcoin to be entered into a sweeps…,2018-11-14T01:21:00Z,"{'id': 'business-insider', 'name': 'Business Insider'}","An official Google account on Twitter was hacked by cryptocurrency scammers trying to convince people to send them bitcoin (GOOG, GOOGL)",http://uk.businessinsider.com/google-g-suite-twitter-cryptocurrency-bitcoin-scam-2018-11,http://static1.uk.businessinsider.com/image/5a5781327101ad2fd44c8cf9-1190-625/an-official-google-account-on-twitter-was-hacked-by-cryptocurrency-scammers-trying-to-convince-people-to-send-them-bitcoin.jpg,184
10,Jason Kwong,"With asset prices at record highs in developed markets and stocks trading at ludicrous valuations, has the modern global economy managed to shake off the shackles of finite economic growth and development? A German proverb goes, Bäume wachsen nicht in den Him… [+7321 chars]","With asset prices at record highs in developed markets and stocks trading at ludicrous valuations, has the modern global economy managed to shake off the shackles of finite economic growth and development? The post The next financial crisis could be an opport…",2018-11-14T01:29:51Z,"{'id': None, 'name': 'Luxuo.com'}",The next financial crisis could be an opportunity for cryptocurrencies,http://www.luxuo.com/the-lux-list/finance/the-next-financial-crisis-could-be-an-opportunity-for-cryptocurrencies.html,http://cdn.luxuo.com/2018/11/1_aGM0FyiFFr41OeVMHuI3LA.jpeg,176
11,Phillip Inman,"Governments should consider offering their own cryptocurrencies to prevent the systems becoming havens for fraudsters and money launderers, Christine Lagarde, head of the International Monetary Fund said referring to the fast-growing fintech industry. Lagarde… [+4437 chars]","Christine Lagarde praises rebel technology as ‘safe, cheap, and potentially semi-anonymous’ Governments should consider offering their own cryptocurrencies to prevent the systems becoming havens for fraudsters and money launderers, Christine Lagarde, head of …",2018-11-14T01:30:02Z,"{'id': 'the-guardian-au', 'name': 'The Guardian (AU)'}",IMF says governments could set up their own cryptocurrencies,https://www.theguardian.com/business/2018/nov/14/imf-says-governments-could-set-up-their-own-cryptocurrencies,https://i.guim.co.uk/img/media/ec7b957e7098f96302e6e560fb14518d029c887e/0_204_6123_3674/master/6123.jpg?width=1200&height=630&quality=85&auto=format&fit=crop&overlay-align=bottom%2Cleft&overlay-width=100p&overlay-base64=L2ltZy9zdGF0aWMvb3ZlcmxheXMvdGctZGVmYXVsdC5wbmc&s=69dc4ffaddc1e1159c105ace81ca940e,9
12,Aaron Hankin,The head of the International Monetary Fund believes its time for global central banks to explore the idea of a state-backed digital currency. I believe we should consider the possibility to issue digital currency. There may be a role for the state to supply … [+2716 chars],The head of the International Monetary Fund says Tuesday it’s time for global central banks to explore a state-backed digital currency.,2018-11-14T01:30:57Z,"{'id': None, 'name': 'Marketwatch.com'}","A central bank digital currency could be around the corner, if you believe the IMF",https://www.marketwatch.com/story/a-central-bank-digital-currency-could-be-around-the-corner-if-you-believe-the-imf-2018-11-13,http://s.marketwatch.com/public/resources/MWimages/MW-GY447_lagard_ZG_20181113114128.jpg,237
13,Bangkok Post Public Company Limited,"The Securities and Exchange Commission (SEC) has warned investors that Q Exchange Co Ltd is not a licensed cryptocurrency dealer and any investment made with the company might not be lawfully protected. The SEC said Q Exchange, which offers electronic money a… [+1812 chars]",The Securities and Exchange Commission (SEC) has warned investors that Q Exchange Co Ltd is not a licensed cryptocurrency dealer and any investment made with the company might not be lawfully protected.,2018-11-14T01:34:00Z,"{'id': None, 'name': 'Bangkokpost.com'}",SEC advises caution with Q Exchange,https://www.bangkokpost.com/business/finance/1575414/sec-advises-caution-with-q-exchange,https://www.bangkokpost.com/common/img/nopic4.jpg,118
14,,"November 14, 2018 As prepared for delivery Introduction Distinguished guests, ladies and gentlemen—good morning and thank you for the opportunity to participate in this important event. In Singapore, it is often windy. Winds here bring change, and opportunity… [+15390 chars]",,2018-11-14T01:51:01Z,"{'id': None, 'name': 'Imf.org'}",Winds of Change: The Case for New Digital Currency,https://www.imf.org/en/News/Articles/2018/11/13/sp111418-winds-of-change-the-case-for-new-digital-currency,,239
15,Reuters,"MEXICO CITY (Reuters) - Tesla co-founder Elon Musk and Mexico's tequila producers could be headed for a collision after the agave-based drink's industry group opposed the flamboyant billionaire's efforts to trademark an alcoholic drink dubbed ""Teslaquila."" On… [+2504 chars]","AP Tesla co-founder Elon Musk and Mexico's tequila producers may be at odds over the agave-based drink. The tequila industry opposed Musk's efforts to trademark an alcoholic drink dubbed ""Teslaquila."" Musk previously tweeted ""Teslaquila coming soon"" and attac…",2018-11-14T01:55:11Z,"{'id': 'business-insider', 'name': 'Business Insider'}",Elon Musk's 'Teslaquila' drink clashes with Mexican tequila industry,https://www.businessinsider.com/elon-musk-tequila-teslaquila-mexican-industry-2018-11,https://amp.businessinsider.com/images/5beb7d009e8c5375866bbd84-2732-1366.jpg,216
16,Esther Kim,"Bitcoins nascent mainnet implementation of the Lightning Network (LN) has reached a new milestone, passing 4,000 nodes for the first time. Lightning Handles $750K Data from monitoring resource 1ML confirms the latest growth of Bitcoin’s second layer designed … [+2074 chars]","Bitcoin’s nascent mainnet implementation of the Lightning Network (LN) has reached a new milestone, passing 4,000 nodes for the first time. Lightning Handles $750K Data from monitoring resource 1ML confirms the latest growth of Bitcoin’s second layer designed…",2018-11-14T02:00:01Z,"{'id': None, 'name': 'Bitcoinist.com'}","Lightning Network Passes 4000 Nodes, Reaches All-Time Capacity High",https://bitcoinist.com/lightning-network-4000-nodes-btc-today/,https://bitcoinist.com/wp-content/uploads/2018/11/shutterstock_436894048.jpg,145
17,Dalmas Ngetich,"Latest Bitcoin News Thing is, Bitcoin is just more than a medium of exchange. In 10 short years, the worlds most valuable coin has evolved from being a Cypherpunk thing to a medium of exchange and now it is a solid store of value. It has been so thanks to las… [+3505 chars]","Latest Bitcoin News Thing is, Bitcoin is just more than a medium of exchange. In 10 short years, the world’s most valuable coin has evolved from being a Cypherpunk thing to a medium of exchange and now it is a solid store of value. It has been so thanks to la…",2018-11-14T02:00:26Z,"{'id': None, 'name': 'Newsbtc.com'}","Bitcoin Price Analysis: BTC/USD Breakout above Resistance Trend Line, Buyers aim $7,200",https://www.newsbtc.com/2018/11/14/bitcoin-price-analysis-btc-usd-buyers-aim-7200/,https://www.newsbtc.com/wp-content/uploads/2018/08/techanalysis-btc5.jpg,75
18,Jack Morse,"Nothing says the future of finance like a good old-fashioned meltdown, and the upcoming bitcoin cash hard fork has that in spades. This is thanks, in no small part, to a man named Craig Wright. Wright, derisively known as ""Faketoshi"" for his dubious claim tha… [+3854 chars]","Nothing says the future of finance like a good old-fashioned meltdown, and the upcoming bitcoin cash hard fork has that in spades. This is thanks, in no small part, to a man named Craig Wright. Wright, derisively known as ""Faketoshi"" for his dubious claim tha…",2018-11-14T02:04:10Z,"{'id': 'mashable', 'name': 'Mashable'}","Bitcoin Cash is set to hard fork, and people are losing their cool",https://mashable.com/article/bitcoin-cash-hard-fork/,https://i.amz.mshcdn.com/KZfLODs7G4fsoCz1wJV-SAGQhCY=/1200x630/2018%2F11%2F14%2Fe1%2F370b7af2dcf84fb3afbe9b348f14cb4d.70c2d.jpg,0
19,David Hundeyin,"Blockchain technology will power a monumental shift in society from a “scarcity to an abundance mindset.” These were the words of Ethereum co-founder Joseph Lubin speaking last week at the Web Summit in Lisbon, Portugal. Lubin’s Blockchain Impact Theory Deliv… [+2743 chars]","Blockchain technology will power a monumental shift in society from a “scarcity to an abundance mindset.” These were the words of Ethereum co-founder Joseph Lubin speaking last week at the Web Summit in Lisbon, Portugal. Lubin’s Blockchain Impact Theory Deliv…",2018-11-14T02:15:44Z,"{'id': 'crypto-coins-news', 'name': 'Crypto Coins News'}",Ethereum is a Few Years from ‘Profound Decentralization’ — But That’s OK: Co-Founder Joseph Lubin,https://www.ccn.com/ethereum-is-a-few-years-from-profound-decentralization-but-thats-ok-co-founder-joseph-lubin/,https://www.ccn.com/wp-content/uploads/2018/09/joseph-lubin-ethereum-collision-conf-consensys-1024x682.jpg,113
20,"David Cottle, Analyst, David Cottle","Australian Dollar, China Data, Talking Points: The Australian Dollar wilted a little on news of disappointing Chinese retail sales The overall Chinese data picture was quite strong however The Aussie now looks toward its own key employment figures Fourth-quar… [+3346 chars]",The Australian Dollar didn’t move very far on Tuesday’s Chinese data dump in which retail sales underwhelmed and industrial production did not,2018-11-14T02:17:00Z,"{'id': None, 'name': 'Dailyfx.com'}","Australian Dollar Steady On Mixed China Data, Employment Up Next",https://www.dailyfx.com/forex/market_alert/2018/11/14/Australian-Dollar-Steady-On-Mixed-China-Data-Employment-Up-Next.html,,230
21,Cointelegraph By Ana Alexandre,,"The Twitter account of Google’s G Suite was reportedly breached to lure users into a 10,000 Bitcoin giveaway scam",2018-11-14T02:32:00Z,"{'id': None, 'name': 'Cointelegraph.com'}","Report: Google G Suite Twitter Account Compromised to Promote 10,000 Bitcoin Scam",https://cointelegraph.com/news/report-google-g-suite-twitter-account-compromised-to-promote-10-000-bitcoin-scam,https://images.cointelegraph.com/images/740_aHR0cHM6Ly9zMy5jb2ludGVsZWdyYXBoLmNvbS9zdG9yYWdlL3VwbG9hZHMvdmlldy9mZGQyNzEyOTZkMTU1MjdkZDUyNzllMTNmYTBiMTg0NS5qcGc=.jpg,62
22,Corbin Davenport,"Twitter has quite a few ongoing problems, but perhaps none of them are as amusing as the ever-constant cryptocurrency giveaway spam. For months, scammers have impersonated celebrities ( especially Elon Musk ) to trick people into giving them bitcoin, but some… [+651 chars]","Twitter has quite a few ongoing problems, but perhaps none of them are as amusing as the ever-constant cryptocurrency giveaway spam. For months, scammers have impersonated celebrities ( especially Elon Musk ) to trick people into giving them bitcoin, but some…",2018-11-14T02:44:52Z,"{'id': None, 'name': 'Androidpolice.com'}",Google's G Suite Twitter account briefly promoted a bitcoin giveaway scam,https://www.androidpolice.com/2018/11/13/googles-g-suite-twitter-account-briefly-promoted-bitcoin-giveaway/,https://www.androidpolice.com/wp-content/uploads/2018/10/Google-Logo-G-inside-of-hardware-store-728x485.jpg,225
23,,"Is Amazon About to Shock Bitcoin Investors? Dear Reader, If you're investing in Bitcoin or other cryptocurrencies... Or are simply planning to invest soon... You MUST click here and see this shocking information about Amazon. Simply put... Amazon is about to … [+355 chars]","Is Amazon About to Shock Bitcoin Investors? Dear Reader, If youre investing in Bitcoin or other cryptocurrencies... Or are simply planning to invest soon... You MUST click here and see this shocking information about Amazon. Simply put... Amazon is about to c…",2018-11-14T02:50:12Z,"{'id': None, 'name': 'Aweber.com'}",Is Amazon About to Shock Bitcoin Investors?,http://archive.aweber.com/qod/OAz1V/h/Is_Amazon_About_to_Shock_Bitcoin.htm,,232
24,,"HTC has reported net losses of NT$2.603 billion (US$84.26 million) for the third quarter of 2018, widening from a net loss of NT$2.1 billion seen a quarter earlier. EPS was negative NT$3.18 for the three-month period. The third-quarter 2018 loss was, neverthe… [+1138 chars]","HTC has reported net losses of NT$2.603 billion (US$84.26 million) for the third quarter of 2018, widening from a net loss of NT$2.1 billion seen a quarter earlier. EPS was negative NT$3.18 for the three-month period.",2018-11-14T02:55:32Z,"{'id': None, 'name': 'Digitimes.com'}",HTC sees losses widen in 3Q18,https://www.digitimes.com/news/a20181113VL203.html,,124
25,"Igor Shoifot, Julian Zegelman, Igor Shoifot, Julian Zegelman","Technology investment is big business in China. The countrys asset management sector is one of the worlds largest, crossing the 100 trillion yuan (US$14.3 trillion) mark last year, with Chinese venture capital firms putting over 1.2 trillion yuan into tech st… [+4741 chars]","Technology investment is big business in China. The country’s asset management sector is one of the world’s largest, crossing the 100 trillion yuan (US$14.3 trillion) mark last year, with Chinese venture capital firms putting over 1.2 trillion yuan into tech …",2018-11-14T04:15:48Z,"{'id': None, 'name': 'Scmp.com'}","In its embrace of blockchain, China is making up for lost time",https://www.scmp.com/comment/insight-opinion/hong-kong/article/2173005/its-embrace-blockchain-china-making-lost-time,https://cdn3.i-scmp.com/sites/default/files/styles/620x356/public/images/methode/2018/11/14/e3153764-e730-11e8-bfde-9434090d4df7_image_hires_112129.jpg?itok=45Y4hsvg,263
26,Aayush Jindal,Key Points Bitcoin cash price stayed above the $496 swing low and consolidated against the US Dollar. There was a break above a key bearish trend line with resistance at $510 on the hourly chart of the BCH/USD pair (data feed from Kraken). The pair struggled … [+1664 chars],Key Points Bitcoin cash price stayed above the $496 swing low and consolidated against the US Dollar. There was a break above a key bearish trend line with resistance at $510 on the hourly chart of the BCH/USD pair (data feed from Kraken). The pair struggled …,2018-11-14T04:28:56Z,"{'id': None, 'name': 'Newsbtc.com'}",Bitcoin Cash Price Analysis: BCH/USD Consolidating Near $500,https://www.newsbtc.com/2018/11/14/bitcoin-cash-price-analysis-bch-usd-consolidating-near-500/,https://www.newsbtc.com/wp-content/uploads/2018/08/techanalysis-bch6.jpg,109
27,Samburaj Das,"Tuesday Market Snapshot Asset Current Value Daily Change S&amp;P 500 2,737 0.27% DAX 30 11,381 0.49% WTI Crude Oil 59.10 0.41% GOLD 1,203 0.20% Bitcoin 6,291 -0.42% EUR/USD 1.1265 0.42% After yesterdays equity selloff and Dollar rally today we are seeing a co… [+4198 chars]","By Dmitriy Gurkovskiy, Chief Analyst at RoboMarkets The most interesting event this month in the US is the famous Black Friday, the day of large discounts, which is on Nov 23. On this day, Americans make 45% of all their annual purchases. The US economy is do…",2018-11-14T04:51:24Z,"{'id': None, 'name': 'Hacked.com'}",(+) Black Friday: How to Capitalize on It,https://hacked.com/black-friday-how-to-cap-on-it/,https://hacked.com/wp-content/uploads/2018/11/blackfriday-1000x600.jpg,163
28,Eustace Cryptus,A recent hack involving the Twitter of retailer Target has wise investors doubling down on too-good-to-be-true offers. Target Becomes the Target The cryptocurrency community is no stranger to hacks and scams and most hodlers are wise enough to steer clear of … [+2324 chars],A recent hack involving the Twitter of retailer Target has wise investors doubling down on too-good-to-be-true offers. Target Becomes the Target The cryptocurrency community is no stranger to hacks and scams and most hodlers are wise enough to steer clear of …,2018-11-14T05:00:37Z,"{'id': None, 'name': 'Bitcoinist.com'}",Target Twitter Account Hacked by Bitcoin Scammers,https://bitcoinist.com/target-twitter-account-hacked-by-bitcoin-scammers/,https://bitcoinist.com/wp-content/uploads/2018/11/shutterstock_636659395-e1542167692669.jpg,108
29,info@tabnak.ir,"Reports coming out of Venezuela point to an imminent unveiling of the nation’s proprietary oil-backed cryptocurrency, dubbed Petro, to the Organization of Petroleum Exporting Countries (OPEC) to be used as a unit of account for oil. Local news outlet Telesur,… [+4485 chars]","Reports coming out of Venezuela point to an imminent unveiling of the nation’s proprietary oil-backed cryptocurrency, dubbed Petro, to the Organization of Petroleum Exporting Countries (OPEC) to be used as a unit of account for oil. Local news outlet Telesur,…",2018-11-14T05:14:41Z,"{'id': None, 'name': 'Tabnak.ir'}",Venezuela’s Petro and Iran’s Crypto Token to Launch Soon,https://www.tabnak.ir/fa/news/851569/venezuela’s-petro-and-iran’s-crypto-token-to-launch-soon,,107
