,author,content,description,publishedAt,source,title,url,urlToImage,relevancy
60,David Canellis,"In what could be one of the strangest milestones in cryptocurrency history, Bitcoin BTC is now the preferred payment method of Australian tax scammers, surpassing iTunes vouchers for the first time. The Australian Tax Office (ATO) has fielded reports of over … [+1564 chars]","In what could be one of the strangest milestones in cryptocurrency history, Bitcoin is now the preferred payment method of Australian tax scammers, surpassing iTunes vouchers for the first time. The Australian Tax Office (ATO) has fielded reports of over 28,0…",2018-11-14T10:02:40Z,"{'id': 'the-next-web', 'name': 'The Next Web'}",Bitcoin beats iTunes vouchers as preferred payment for Australian scammers,https://thenextweb.com/hardfork/2018/11/14/australia-tax-scammers-bitcoin/,https://img-cdn.tnwcdn.com/image/hardfork?filter_last=1&fit=1280%2C640&url=https%3A%2F%2Fcdn0.tnwcdn.com%2Fwp-content%2Fblogs.dir%2F1%2Ffiles%2F2018%2F10%2Fmelbourne-btm-batm-bitcoin-atm-scam-50000-blockchain-cryptocurrency.jpg&signature=fa5fd24d03684f400e2173d46a95942f,3
61,Sam Jacobs,"Good morning. To the scoreboard: Dow: 25,081.31 -205.18 (-0.81%) S&amp;P 500: 2,702.28 -19.90 (-0.73%) AUD/USD: 0.7239 +0.0008 (+0.11%) ASX200 SPI futures (December contracts): 5,745 (+5) 1. It’s jobs day: Continued strength in the labour market is of critica… [+2094 chars]","Good morning. To the scoreboard: Dow: 25,081.31 -205.18 (-0.81%) S&P 500: 2,702.28 -19.90 (-0.73%) AUD/USD: 0.7239 +0.0008 (+0.11%) ASX200 SPI futures (December contracts): 5,751 (+11) More »",2018-11-14T10:04:36Z,"{'id': None, 'name': 'Businessinsider.com.au'}",6 things Australian traders will be talking about this morning,https://www.businessinsider.com.au/6-things-australian-traders-will-be-talking-about-this-morning-v8-2018-11,https://edge.alluremedia.com.au/uploads/businessinsider/2018/11/wake-640x360.jpg,202
62,,"opinion By Jens Ischebeck With the birth of the internet age, international banking and in the near future, cryptocurrency adoption, sending much-needed finances to Africa is easier, faster and safer than ever. Whether you've come to the Western world from Af… [+9285 chars]","[Observer] With the birth of the internet age, international banking and in the near future, cryptocurrency adoption, sending much-needed finances to Africa is easier, faster and safer than ever.",2018-11-14T10:05:48Z,"{'id': None, 'name': 'Allafrica.com'}",Africa: Sending Money Back Home to Africa - 5 Top Apps,https://allafrica.com/stories/201811140384.html,https://cdn07.allafrica.com/static/images/structure/aa-logo-rgba-no-text-128x128.png,222
63,Jonathan Garber,"US equity markets fell for a fifth straight day. The major averages pared their losses after Prime Minister Theresa May said in a statement that her Cabinet backed her Brexit plan. Apple shares slid into a bear market, down more than 20% from their October pe… [+2449 chars]",US equity markets fell for a fifth straight day. The major averages pared their losses after Prime Minister Theresa May said in a statement that her Cabinet backed her Brexit plan. More »,2018-11-14T10:07:00Z,"{'id': None, 'name': 'Businessinsider.com.au'}",Stocks slides as Apple enters a bear market,https://www.businessinsider.com.au/stock-market-news-dow-falls-206-points-apple-enters-bear-market-2018-11,https://static.businessinsider.com/image/5bd9c1abf556fc3021645116-640.jpg,194
64,Matthew Beedham,"Swedens northernmost county opened its arms to two cryptocurrency mining firms earlier this year but it might now be regretting the decision. The county of Norrbotten, Sweden is playing host to a cryptocurrency mining mystery. Two cryptocurrency mining operat… [+1829 chars]","Sweden’s northernmost county opened its arms to two cryptocurrency mining firms earlier this year – but it might now be regretting the decision. The county of Norrbotten, Sweden is playing host to a cryptocurrency mining mystery. Two cryptocurrency mining ope…",2018-11-14T10:16:11Z,"{'id': 'the-next-web', 'name': 'The Next Web'}",International Bitcoin miners vanish after stacking up $1.5M debt in Sweden,https://thenextweb.com/hardfork/2018/11/14/cryptocurrency-miners-unpaid-debt-sweden/,https://img-cdn.tnwcdn.com/image/hardfork?filter_last=1&fit=1280%2C640&url=https%3A%2F%2Fcdn0.tnwcdn.com%2Fwp-content%2Fblogs.dir%2F1%2Ffiles%2F2018%2F11%2Fsweden-miners-debt-bills-unpaid-cryptocurrency-mining-blockchain-NGDC-chasquitech.jpg&signature=3225c1de294c89940ae7a8c2c3dffa1e,244
65,Press Release,"This is a paid-for submitted press release. CCN does not endorse, nor is responsible for any material included below and isnt responsible for any damages or losses connected with any products or services mentioned in the press release. CCN urges readers to co… [+4929 chars]","This is a paid-for submitted press release. CCN does not endorse, nor is responsible for any material included below and isn’t responsible for any damages or losses connected with any products or services mentioned in the press release. CCN urges readers to c…",2018-11-14T10:42:00Z,"{'id': 'crypto-coins-news', 'name': 'Crypto Coins News'}","New Partnerships, Milestones and Developments, Hada DBank Moves Forward",https://www.ccn.com/new-partnerships-milestones-and-developments-hada-dbank-moves-forward/,https://www.ccn.com/wp-content/uploads/2018/11/hadadbank.png,165
66,,,"ALBANY, New York, November 14, 2018 /PRNewswire/ -- The global cryptocurrency market has limited number of players as the market is in its nascent stage, observes Transparency Market Research. Since last few years, Bitcoin was ruling in the global market, as …",2018-11-14T11:00:00Z,"{'id': None, 'name': 'Prnewswire.com'}",Cryptocurrency Market to Reach US$6.70 bn by 2025; Absence of Third-Party Intermediary Triggers Demand - TMR,https://www.prnewswire.com:443/news-releases/cryptocurrency-market-to-reach-us-6-70-bn-by-2025-absence-of-third-party-intermediary-triggers-demand-tmr-810074025.html,,209
67,Transparency Market Research,"ALBANY, New York, November 14, 2018 /PRNewswire/ -- The global cryptocurrency market has limited number of players as the market is in its nascent stage, observes Transparency Market Research. Since last few years, Bitcoin was ruling in the global market, as … [+6151 chars]","ALBANY, New York, November 14, 2018 /PRNewswire/ -- The global cryptocurrency market has limited number of players as the market is in its nascent stage, observes Transparency Market Research. Since last few years, Bitcoin was ruling in the global market, as …",2018-11-14T11:00:00Z,"{'id': None, 'name': 'Prnewswire.com'}",Cryptocurrency Market to Reach US$6.70 bn by 2025; Absence of Third-Party Intermediary Triggers Demand - TMR,https://www.prnewswire.com/news-releases/cryptocurrency-market-to-reach-us-6-70-bn-by-2025-absence-of-third-party-intermediary-triggers-demand-tmr-831695354.html,https://mma.prnewswire.com/media/664869/Transparency_Market_Research_Logo.jpg?p=facebook,224
68,Casey Newton,"There was always something distasteful about Amazon’s quest to find a home for its HQ2. Even when it seemed like it might be a fair fight, it was depressing to watch so many cities and towns prostrating themselves before a tech giant in hopes they would score… [+20690 chars]",The backlash to its big office move was immediate — and it’s growing,2018-11-14T11:00:03Z,"{'id': 'the-verge', 'name': 'The Verge'}",Amazon’s HQ2 stunt could come back to haunt it,https://www.theverge.com/2018/11/14/18093726/amazon-hq2-backlash-giveaway-public-records,https://cdn.vox-cdn.com/thumbor/kjEx7eaIsWn7szN6tI6O1ZgEKe0=/0x71:1020x605/fit-in/1200x630/cdn.vox-cdn.com/assets/1153193/amazon-box-logo-stock_1020.jpg,267
69,Eustace Cryptus,"The latest Bitcoin Cash technical analysis wades through the FUD, speculation and an all-out crypto-war to figure out what’s in store for BCH price with the looming hard-fork. Bitcoin Cash Technical Analysis Bitcoin Cash (BCH) 0 0 is nice and frothy on the ex… [+2395 chars]","The latest Bitcoin Cash technical analysis wades through the FUD, speculation and an all-out crypto-war to figure out what’s in store for BCH price with the looming hard-fork. Bitcoin Cash Technical Analysis Bitcoin Cash (BCH) is nice and frothy on the expect…",2018-11-14T11:00:37Z,"{'id': None, 'name': 'Bitcoinist.com'}","Bitcoin Cash Technical Analysis: Finally, Some BCH Price Action!",https://bitcoinist.com/bitcoin-cash-technical-analysis-bch-price/,https://bitcoinist.com/wp-content/uploads/2018/11/shutterstock_1042144747.jpg,99
70,,"ALBANY, New York, November 14, 2018 /PRNewswire/ -- The global cryptocurrency market has limited number of players as the market is in its nascent stage, observes Transparency Market Research. Since last few years, Bitcoin was ruling in the global market, as … [+6290 chars]","ALBANY, New York, November 14, 2018 /PRNewswire/ -- read more",2018-11-14T11:00:45Z,"{'id': None, 'name': 'Sys-con.com'}",Cryptocurrency Market to Reach US$6.70 bn by 2025; Absence of Third-Party Intermediary Triggers Demand - TMR,http://news.sys-con.com/node/4346016,,255
71,,"ALBANY, New York, November 14, 2018 /PRNewswire/ -- The global cryptocurrency market has limited number of players as the market is in its nascent stage, observes Transparency Market Research. Since last few years, Bitcoin was ruling in the global market, as … [+6254 chars]","ALBANY, New York, November 14, 2018 /PRNewswire/ -- read more",2018-11-14T11:01:18Z,"{'id': None, 'name': 'Sys-con.com'}",Cryptocurrency Market to Reach US$6.70 bn by 2025; Absence of Third-Party Intermediary Triggers Demand - TMR,http://news.sys-con.com/node/4346038,,254
72,Guest Author,"Finbitex is a revolutionary trading platform gaining the attention of traders, mainly due to the comprehensive trading experience which they could never enjoy before. It is a well-reputed and well-established broker, dealing with a range of cryptocurrencies, … [+2809 chars]","Finbitex is a revolutionary trading platform gaining the attention of traders, mainly due to the comprehensive trading experience which they could never enjoy before. It is a well-reputed and well-established broker, dealing with a range of cryptocurrencies, …",2018-11-14T11:10:27Z,"{'id': None, 'name': 'Newsbtc.com'}",Finbitex: Crypto-Trading at Its Best,https://www.newsbtc.com/2018/11/14/finbitex-crypto-trading-at-its-best/,https://www.newsbtc.com/wp-content/uploads/2018/11/entrepreneur-2411763_1280.jpg,171
73,Mark Emem,"The Managing Director and Chairperson of the International Monetary Fund (IMF), Christine Lagarde, has called on central banks around the world to consider issuing digital currencies. According to Lagarde, the state has a role to play in injecting money to th… [+2777 chars]","The Managing Director and Chairperson of the International Monetary Fund (IMF), Christine Lagarde, has called on central banks around the world to consider issuing digital currencies. According to Lagarde, the state has a role to play in injecting money to th…",2018-11-14T11:11:21Z,"{'id': 'crypto-coins-news', 'name': 'Crypto Coins News'}",IMF Chief Lagarde: Central Banks Should ‘Consider’ Issuing Digital Currency,https://www.ccn.com/imf-chief-lagarde-central-banks-should-consider-issuing-digital-currency/,https://www.ccn.com/wp-content/uploads/2018/04/Christine-Lagarde.jpg,142
74,Sarah Kimmorley,"Good morning. 1. A “decisive, crucial step”. That’s how the EU chief Brexit negotiator has described UK Prime Minister Theresa May’s Brexit deal. His praised comes after May’s Cabinet backed the deal after ministers discussed it at length during a five-hour m… [+3969 chars]","Good morning. 1. A ""decisive, crucial step"". That's how the EU chief Brexit negotiator has described UK Prime Minister Theresa May's Brexit deal. His praised comes after May's Cabinet backed the deal after ministers discussed it at length during a five-hour m…",2018-11-14T11:19:00Z,"{'id': None, 'name': 'Businessinsider.com.au'}",10 things you need to know this morning in Australia,https://www.businessinsider.com.au/10-things-you-need-to-know-this-morning-in-australia-v11-2018-11,https://edge.alluremedia.com.au/uploads/businessinsider/2018/04/monopoly-sydney-640x360.jpg,201
75,Ian Morris,"One of Google's Twitter accounts appears to have been hacked yesterday by a Bitcoin scammer. The account belonged to the team that manages Google's professional version of Gmail, known as G Suite. A promoted Tweet read ""Google is giving 10 000 Bitcoin (BTC) t… [+2411 chars]",Google's G Suite Twitter account appears to have been hijacked by a Bitcoin scammer,2018-11-14T11:27:41Z,"{'id': 'mirror', 'name': 'Mirror'}",Google's Twitter hacked by Bitcoin scammer to promote fake 'giveaway',https://www.mirror.co.uk/tech/googles-twitter-hacked-bitcoin-scammer-13587900,https://i2-prod.mirror.co.uk/incoming/article11929526.ece/ALTERNATES/s1200/1_Bitcoin-Medals-Manufactured-At-Sakamoto-Metal.jpg,229
76,Carly.Page@incisivemedia.com(Carly Page),"GOOGLE HAS OFFICIALLY introduced the Pixel 3 and Pixel 3 XL, both of which had precisely zero surprises in store. Given the huge number of leaks building up to Google's launch, there was little left for the firm to unveil. As expected, the flagship duo sport … [+27993 chars]","Issue occurs after installing Google's latest security patch,Phones ,google pixel 3,pixel,Google,smartphones,Android",2018-11-14T11:57:00Z,"{'id': None, 'name': 'Theinquirer.net'}","Pixel 3 XL release date, specs and price: Glitch is causing users' text messages to vanish",https://www.theinquirer.net/inquirer/news/3033144/pixel-3-xl-price-release-date-specs-glitch-causes-users-text-messages-to-vanish,http://www.theinquirer.net/w-images/accd62c3-38c9-4ebe-9f39-ee428e61b1fa/3/fill/DpE61O54AAzemC-370x229.jpg,243
77,Hasan Chowdhury,"C entral banks across the world should consider issuing digital currencies, according to the head of the International Monetary Fund. At a fintech festival in Singapore, Christine Lagarde said cryptocurrencies such as Bitcoin, Ethereum and Ripple are constant… [+649 chars]","Central banks across the world should consider issuing digital currencies, according to the head of the International Monetary Fund.",2018-11-14T11:58:00Z,"{'id': 'the-telegraph', 'name': 'The Telegraph'}","Central banks should look at issuing digital currency, says IMF's Christine Lagarde",https://www.telegraph.co.uk/technology/2018/11/14/central-banks-should-look-issuing-digital-currency-says-imfs/,https://www.telegraph.co.uk/content/dam/business/2018/10/11/TELEMMGLPICT000177496673-xlarge_trans_NvBQzQNjv4Bq_SwnslUQkpHNk4h-1lw-o2qE338Y1R4t5n9NfqLSgsA.jpeg,93
78,Omkar Godbole,"Bitcoin’s (BTC) price woes may not be over just yet, as a key technical indicator is about to turn bearish for the first time in four years. On the three-day chart, the 50-candle simple moving average (SMA) looks set to cut the 200-candle SMA from above, conf… [+2446 chars]","Bitcoin’s (BTC) price woes may not be over just yet, as a specific ""death cross"" indicator is about to reoccur for the first time in four years.",2018-11-14T12:00:02Z,"{'id': None, 'name': 'Coindesk.com'}",Bitcoin Price Is Charting This ‘Death Cross’ for First Time Since 2014,https://www.coindesk.com/bitcoin-price-is-charting-this-death-cross-for-first-time-since-2014,https://www.coindesk.com/wp-content/uploads/2018/06/BTC.jpg,46
79,Joseph Young,"Over the past 12 hours, more than $8 billion was wiped out from the crypto market, as several major digital assets including Bitcoin Cash (BCH) and Stellar (XLM) suffered. For the first time in the past ten days, the price of BCH has dropped below the $500 ma… [+2678 chars]","Over the past 12 hours, more than $8 billion was wiped out from the crypto market, as several major digital assets including Bitcoin Cash (BCH) and Stellar (XLM) suffered. For the first time in the past ten days, the price of BCH has dropped below the $500 ma…",2018-11-14T12:00:27Z,"{'id': 'crypto-coins-news', 'name': 'Crypto Coins News'}",Bloodbath: Crypto Market Drops in $8B Wipeout; Bitcoin Cash Down 24.4% in 1 Week,https://www.ccn.com/bloodbath-crypto-market-drops-in-8b-wipeout-bitcoin-cash-down-24-4-in-1-week/,https://www.ccn.com/wp-content/uploads/2016/10/Rain-Umbrella.jpg,56
80,"Sedat Saka, CommunityVoice, Sedat Saka, CommunityVoice https://www.forbes.com/sites/forbestechcouncil/people/sedatsaka/","Share to facebook Share to twitter Share to linkedin As the logistics industry, and the broader business world, looks to 2019, its time to explore what the next year will bring to logistics. As the president of a logistics company, I've outlined four predicti… [+12390 chars]","No matter what happens in 2019, it’s clear that change is coming to logistics.",2018-11-14T12:15:00Z,"{'id': None, 'name': 'Forbes.com'}",Four Ways Logistics Will Change In 2019,https://www.forbes.com/sites/forbestechcouncil/2018/11/14/four-ways-logistics-will-change-in-2019/,https://thumbor.forbes.com/thumbor/600x315/https%3A%2F%2Fblogs-images.forbes.com%2Fforbestechcouncil%2Ffiles%2F2018%2F11%2Fbusiness-cargo-cargo-container-1117210-1200x800.jpg,128
81,Dominik Bosnjak,"Google's official G Suite Twitter account was hacked on Tuesday, having started promoting a Bitcoin scam. ""Google is giving 10 000 Bitcoin (BTC) to all community,"" the poorly worded tweet read, falsely claiming G Suite now also supports making payments with t… [+6231 chars]","Google's official G Suite Twitter account was hacked on Tuesday, having started promoting a Bitcoin scam. ""Google is giving 10 000 Bitcoin (BTC) to all community,"" the poorly worded tweet read, falsely claiming G",2018-11-14T12:19:34Z,"{'id': None, 'name': 'Androidheadlines.com'}",Bitcoin Scammers Hack Google's Twitter Profile To Find New Victims,https://www.androidheadlines.com/2018/11/bitcoin-scammers-google-twitter-hack-2018.html,https://d3sxrtnlxrknzf.cloudfront.net/wp-content/uploads/2018/11/Google-Logo-Hacked-Illustration-AH-Nov-14-2018.jpg,72
82,"Nathan Vardi, Forbes Staff, Nathan Vardi, Forbes Staff https://www.forbes.com/sites/nathanvardi/","While more than $600 billion of cryptocurrency wealth has been wiped out in the last several months amid a market meltdown, the man who facilitates a big chunk of the nations cryptocurrency trading has become a billionaire. Brian Armstrong, CEO of Coinbase. G… [+5315 chars]",The man who facilitates a big chunk of the nation's cryptocurrency trading has become a billionaire even as cryptocurrency prices have plunged.,2018-11-14T12:23:46Z,"{'id': None, 'name': 'Forbes.com'}","Brian Armstrong, CEO of Cryptocurrency Exchange Coinbase, Becomes A Billionaire",https://www.forbes.com/sites/nathanvardi/2018/11/14/brian-armstrong-ceo-of-cryptocurrency-exchange-coinbase-becomes-a-billionaire/,https://thumbor.forbes.com/thumbor/600x315/https%3A%2F%2Fspecials-images.forbesimg.com%2Fimageserve%2F1028811312%2F960x0.jpg,32
83,,"Goldmoney Inc. (TSX:XAU) (Goldmoney) (the Company), a precious metal financial service and technology company, today announced financial results for the second quarter ended September 30, 2018. All amounts are expressed in Canadian dollars unless otherwise no… [+18812 chars]","Goldmoney Inc. (TSX:XAU) (“Goldmoney”) (the “Company”), a precious metal financial service and technology company, today announced financial results for the second quarter ended September 30, 2018. All amounts are expressed in Canadian dollars unless otherwis…",2018-11-14T12:30:44Z,"{'id': None, 'name': 'Sys-con.com'}",Goldmoney Inc. Reports Financial Results for Second Quarter 2019,http://businesswire.sys-con.com/node/4346115,,272
84,,"Goldmoney Inc. (TSX:XAU) (Goldmoney) (the Company), a precious metal financial service and technology company, today announced financial results for the second quarter ended September 30, 2018. All amounts are expressed in Canadian dollars unless otherwise no… [+18813 chars]","Goldmoney Inc. (TSX:XAU) (“Goldmoney”) (the “Company”), a precious metal financial service and technology company, today announced financial results for the second quarter ended September 30, 2018. All amounts are expressed in Canadian dollars unless otherwis…",2018-11-14T12:30:44Z,"{'id': None, 'name': 'Sys-con.com'}",Goldmoney Inc. Reports Financial Results for Second Quarter 2019,http://news.sys-con.com/node/4346115,,273
85,Yogita Khatri,"Bitcoin rewards platform Lolli has raised $2.25 million in seed funding from investors including Bain Capital Ventures and Digital Currency Group. Also participating were Version One, Forerunner Ventures, 3K VC, SV Angel, FJ Labs, Gokul Rajaram, Alex Chung, B… [+990 chars]",Bitcoin rewards platform Lolli has raised $2.25 million in seed funding from investors including Bain Capital Ventures.,2018-11-14T12:30:53Z,"{'id': None, 'name': 'Coindesk.com'}",Bain Capital Backs $2.25 Million Round for Bitcoin Rewards Startup Lolli,https://www.coindesk.com/bain-capital-backs-2-25-million-round-for-bitcoin-rewards-startup-lolli,https://www.coindesk.com/wp-content/uploads/2018/11/Bitcoins.jpg,28
86,Sam Bourgi,"The cryptocurrency segment continues to trade under clear selling pressure, with most of the majors drifting higher for several days now. Volatility remains low, with light trading activity across the board, and even the most bullish currency, Ripple being in… [+3145 chars]","Bitcoin’s price fell below $6,200 on Wednesday, setting a new multi-week low and opening the door for a re-test of the psychologically significant $6,000 support. However, much like the previous day, BTC has exhibited wide price variance on major exchanges. B…",2018-11-14T12:34:00Z,"{'id': None, 'name': 'Hacked.com'}","Bitcoin Price Falls Below $6,200 for the First Time in a Month as Bearish Pressure Builds",https://hacked.com/bitcoin-price-falls-below-6200-for-the-first-time-in-a-month-as-bearish-pressure-builds/,https://hacked.com/wp-content/uploads/2018/09/bitcoin-6-1000x600.jpg,190
87,Christina Cozzetto,"Jon Snow is paying off a Ford Focus, slowly, and pays his credit cards in full every month. Unfortunately, he’s also dealing with the IRS about a ton of estate and gift tax he owes because even after inheriting the Watch and the North he tried to do his own t… [+4601 chars]",Davos Seaworth is a mild doomsday prepper: he has a bug-out bag with a lot of cash in it.,2018-11-14T12:50:56Z,"{'id': None, 'name': 'Thebillfold.com'}",A Song of Debts and Assets: The Financial Status of the Characters in Game of Thrones,https://www.thebillfold.com/2018/11/a-song-of-debts-and-assets-the-financial-status-of-the-characters-in-game-of-thrones/,https://www.thebillfold.com/wp-content/uploads/2018/11/Screen-Shot-2018-11-07-at-9.50.15-AM.png,175
88,Georgia Frances King,"This story is part of What Happens Next, our complete guide to understanding the future. Read more predictions about the Future of Water. Its Wednesday morning. You open your closet door, reach for your favorite cotton tee, and out gushes a wall of water. Con… [+6269 chars]","This story is part of What Happens Next, our complete guide to understanding the future. Read more predictions about the Future of Water. It’s Wednesday…",2018-11-14T13:00:03Z,"{'id': None, 'name': 'Qz.com'}",Your water footprint is just as important as your carbon footprint,https://qz.com/1396289/your-water-footprint-is-just-as-important-as-your-carbon-footprint/,https://cms.qz.com/wp-content/uploads/2018/11/phone-submerged-in-water.jpg?quality=75&strip=all&w=1400,38
89,Bitcoinist,"Finbitex represents a leading financial services provider, delivering a wide range of cryptocurrency investment products in contracts for difference (CFDs). Combining a diversified product list, comprehensive technology, and broad network, the platform aims t… [+2680 chars]","Finbitex represents a leading financial services provider, delivering a wide range of cryptocurrency investment products in contracts for difference (CFDs). Combining a diversified product list, comprehensive technology, and broad network, the platform aims t…",2018-11-14T13:00:11Z,"{'id': None, 'name': 'Bitcoinist.com'}",Finbitex Review: Innovative Cryptocurrency Trading,https://bitcoinist.com/finbitex-review-cryptocurrency-trading/,https://bitcoinist.com/wp-content/uploads/2018/11/shutterstock_587972546-980x613.jpg,174
90,Nick Chong,"Although institutional players have continued to throw money at crypto assets and up-and-coming blockchain-focused projects, reports indicate that the mining subset of this industry has faltered, and greatly at that. GPU-Powered Ethereum Mining Now Unprofitab… [+3525 chars]","Although institutional players have continued to throw money at crypto assets and up-and-coming blockchain-focused projects, reports indicate that the mining subset of this industry has faltered, and greatly at that. GPU-Powered Ethereum Mining Now Unprofitab…",2018-11-14T13:00:19Z,"{'id': None, 'name': 'Newsbtc.com'}","Mining Pools Rule, Individual Crypto Mining Deemed No Longer Viable",https://www.newsbtc.com/2018/11/14/mining-pools-rule-individual-crypto-mining-deemed-no-longer-viable/,https://www.newsbtc.com/wp-content/uploads/2018/11/gpu-mining.jpg,151
