,author,content,description,publishedAt,source,title,url,urlToImage,relevancy
501,Josh Weiss,"It's morphin' time! Children of the '90s have much to be thankful for this November, because Insight Editions is releasing Power Rangers : The Ultimate Visual History, a 253-page exploration of one of the most enduring franchises in pop culture history, celeb… [+3405 chars]","It's morphin' time! Children of the '90s have much to be thankful for this November, because Insight Editions is releasing Power Rangers : The Ultimate Visual History, a 253-page exploration of one of the most enduring franchises in pop culture history, celeb…",2018-10-29T14:01:15Z,"{'id': None, 'name': 'Syfy.com'}",Shift into turbo and check out these exclusive pages from Saban's Power Rangers: The Ultimate Visual History,https://www.syfy.com/syfywire/shift-into-turbo-and-check-out-these-exclusive-pages-from-sabans-power-rangers-the-ultimate,https://www.syfy.com/sites/syfy/files/styles/1200x680/public/2018/10/power_rangers_visual_history_costumes_page.jpg?itok=X1rn7TPc,486
502,Rosa Sanchez,"Look away Olivia Culpo, your man’s getting steamy with a gorgeous new woman! They may be going strong on social media, but the 26-year-old model and her longtime hunk, Danny Amendola may be hiding some nasty relationship issues behind the camera. As RadarOnli… [+3876 chars]","Look away Olivia Culpo, your man’s getting steamy with a gorgeous new woman! They may be going strong on social media, but the 26-year-old model and her longtime hunk, Danny Amendola may be hiding some nasty relationship issues behind the camera. As RadarOnli…",2018-10-29T14:01:58Z,"{'id': None, 'name': 'Radaronline.com'}",Cheating? Olivia Culpo’s BF Danny Amendola Gets Hot & Heavy With Bianca Peters!,https://radaronline.com/photos/olivia-culpo-boyfriend-danny-amendola-cheating-bianca-peters-miami-photos/,https://i0.heartyhosting.com/radaronline.com/wp-content/uploads/2018/10/Olivia-Culpo-Boyfriend-Cheating-Bianca-Peters-PP.jpg?fit=1200%2C788&ssl=1,354
503,socomdan,PCPartPicker part list / Price breakdown by merchant CPU: AMD - Ryzen 3 2200G 3.5GHz Quad-Core Processor ($98.49 @ SuperBiiz) Motherboard: MSI - B450-A PRO ATX AM4 Motherboard ($79.99 @ B&amp;H) Memory: G.Skill - Aegis 8GB (1 x 8GB) DDR4-3000 Memory ($63.99 @… [+1370 chars],"Hi all I need help building a starter gaming computer for under $500. 
 
Budget - $500, NO CASE 
Resolution- 1080p 
Games / Settings Desired - Probably fortnite and AAA games with med-low settings 
Any other intensive software or special things you do No 
Cou…",2018-10-29T14:02:06Z,"{'id': None, 'name': 'Mmo-champion.com'}",Gaming build for under $500,https://www.mmo-champion.com/threads/2444427-Gaming-build-for-under-500?p=50381094#post50381094,,833
504,Simon Delott,"In September, Jorge Nava reported to prison to begin serving his 2.5 year sentence. His wife, Anfisa, is still free and continues to be a full-time student. But she has shared some news that will break the hearts of many fans: she and Jorge are done with 90 D… [+3063 chars]",90 Day Fiance stars Anfisa Arkhipchenko and Jorge Nava are done with the show now that Jorge is serving his prison sentence.,2018-10-29T14:03:26Z,"{'id': None, 'name': 'Thehollywoodgossip.com'}",Anfisa and Jorge Nava: We Quit 90 Day Fiance!,https://www.thehollywoodgossip.com/2018/10/anfisa-and-jorge-nava-we-quit-90-day-fiance/,"https://the-hollywood-gossip-res.cloudinary.com/iu/s--OCUKihc8--/t_full/cs_srgb,f_auto,fl_strip_profile.lossy,q_auto:420/v1536605251/jorge-nava-and-anfisa-arkhipchenko-discuss-his-prison-sentence.png",348
505,Joel Cooper,"It's one of the most dramatic reality dating shows on TV, and now Ex On The Beach bosses are reportedly 'in talks' to sign up Katie Price for a special celebrity edition of the show. Mum-of-five Katie, 40, has dated both Kris Boyson, 29, and Alex Adderson, 25… [+2630 chars]",The former glamour model has many exes that could emerge from the ocean to 'confront her' on the show,2018-10-29T14:03:42Z,"{'id': 'mirror', 'name': 'Mirror'}",Katie Price 'in talks' for Ex On The Beach celebrity special – and she 'hopes' her famous exes will appear,https://www.mirror.co.uk/tv/tv-news/katie-price-in-talks-ex-13500261,https://i2-prod.mirror.co.uk/incoming/article13293955.ece/ALTERNATES/s1200/0_MAIN-Katie-Prices-mum-says-all-her-exes-are-out-to-destroy-her-as-she-enters-rehab.jpg,976
506,wuzzy,"Costco Wholesale [ costco.com ] has Round Brilliant 1.50 ctw VS2 Clarity, I Color Diamond 14kt White Gold Hoop Earrings for $1,399.99 Note: This deal was created from the Black Friday ad. This deal is from the combined Costco November/Black Friday ad booklet.… [+88 chars]","Hot Costco Wholesale Black Friday Deal! Costco Wholesale has Round Brilliant 1.50 ctw VS2 Clarity, I Color Diamond 14kt White Gold Hoop Earrings for $1,399.99

Note: This deal was created from the Black Friday ad.

This deal is from the",2018-10-29T14:06:51Z,"{'id': None, 'name': 'Slickdeals.net'}","Costco Wholesale Black Friday: Round Brilliant 1.50 ctw VS2 Clarity, I Color Diamond 14kt White Gold Hoop Earrings for $1,399.99",https://slickdeals.net/f/12171049-costco-wholesale-black-friday-round-brilliant-1-50-ctw-vs2-clarity-i-color-diamond-14kt-white-gold-hoop-earrings-for-1-399-99,https://static.slickdealscdn.com/attachment/1/6/6/6/1/8/7472326.attach,625
507,Ric Bucher,"Scott Cunningham/Getty Images Someone on Twitter wrote it. American-born NBA rookie Michael Porter Jr. liked it. No international player in the NBA was surprised by it. ""The most overrated person I've seen in my life,"" the tweet said in response to an ESPN po… [+10931 chars]",Someone on Twitter wrote it. American-born  NBA  rookie Michael Porter Jr. liked it. No international player in the NBA was surprised by it...,2018-10-29T14:08:07Z,"{'id': 'bleacher-report', 'name': 'Bleacher Report'}",Luka Doncic Has the Goods to Crush the NBA's Euro Bias Once and for All,https://bleacherreport.com/articles/2802775-luka-doncic-has-the-goods-to-crush-the-nbas-euro-bias-once-and-for-all,https://img.bleacherreport.net/img/images/photos/003/771/341/hi-res-4144176ed0fec1aad85130897917aba4_crop_exact.jpg?w=1200&h=1200&q=75,788
508,Reuters Editorial,"Oct 29 (Reuters) - Canada’s main stock index rebounded on Monday from a steep sell-off last week, after global markets rose partly due to relief over an unchanged credit rating on Italy. * The TSX fell 3.7 percent in the previous week, its worst week since Fe… [+1298 chars]","Canada's main stock index rebounded on Monday from a steep sell-off last week, after global markets rose partly due to relief over an unchanged credit rating on Italy.",2018-10-29T14:08:43Z,"{'id': 'reuters', 'name': 'Reuters'}",CANADA STOCKS-TSX bounces back after last week's sell-off,https://www.reuters.com/article/canada-stocks/canada-stocks-tsx-bounces-back-after-last-weeks-sell-off-idUSL3N1X952L,https://s4.reutersmedia.net/resources_v2/images/rcom-default.png,470
509,Steve Watts,Microsoft has plans to expand the Game Pass subscription service from Xbox One to PC. CEO Satya Nadella reportedly mentioned during an earnings call that bringing Game Pass to PC will help increase the strength of the Xbox brand. Ars Technica reports that Nad… [+1573 chars],Microsoft has plans to expand the Game Pass subscription service from Xbox One to PC. CEO Satya Nadella reportedly mentioned during an earnings call that bringing Game Pass to PC will help increase the strength of the Xbox brand. Ars Technica reports that Nad…,2018-10-29T14:09:00Z,"{'id': None, 'name': 'Gamespot.com'}","Xbox Game Pass Will To Expand To PC, Says Microsoft Boss",https://www.gamespot.com/articles/xbox-game-pass-will-to-expand-to-pc-says-microsoft/1100-6462831/,https://static.gamespot.com/uploads/screen_kubrick/1585/15855271/3455986-3201680-pass.jpg,416
510,Steve Watts,"Pokemon Go has gotten spooky for Halloween, but with November almost upon us Niantic has started to tease the next seasonal event. The company hinted through Twitter that November will be all about catching bugs, with a big reward for completing your marks. N… [+1599 chars]","Pokemon Go has gotten spooky for Halloween, but with November almost upon us Niantic has started to tease the next seasonal event. The company hinted through Twitter that November will be all about catching bugs, with a big reward for completing your marks. N…",2018-10-29T14:10:00Z,"{'id': None, 'name': 'Gamespot.com'}",Pokemon Go Teases Bug Field Research Tasks For Next Month,https://www.gamespot.com/articles/pokemon-go-teases-bug-field-research-tasks-for-nex/1100-6462844/,https://static.gamespot.com/uploads/screen_kubrick/1585/15855271/3456383-dqd10d3wkayu4no.jpg,418
511,Dunja Djudjic,Have you ever wondered what the world will look like in 1000 years? Conceptual artist and experimental philosopher Jonathon Keats has decided to capture it on camera. He has created a public art project that will capture the environmental change in the Lake T… [+2740 chars],Have you ever wondered what the world will look like in 1000 years? Conceptual artist and experimental philosopher Jonathon Keats has decided to capture it on camera. He has created a public art project that will capture the environmental change in the Lake T…,2018-10-29T14:10:08Z,"{'id': None, 'name': 'Diyphotography.net'}",Photographer to use a 1000-year long exposure for 3018 photo exhibition,https://www.diyphotography.net/photographer-to-use-a-1000-year-long-exposure-for-3018-photo-exhibition/,https://s23527.pcdn.co/wp-content/uploads/2018/10/millennium-camera-cover-745x419.jpg.optimal.jpg,89
512,feedfeeder,"""I may kid around about drugs, but really, I take them seriously."" - Doctor Graper","MotorIllustrated 2018 Porsche Panamera Turbo Sport Turismo Review: The World's Most Perfect Car? MotorIllustrated Let's consider the facts, shall we? It's a Porsche. Let's not beat around the bush. Audi, BMW and Mercedes make phenomenal cars and trucks. Cadil…",2018-10-29T14:12:43Z,"{'id': None, 'name': 'Slashdot.org'}",2018 Porsche Panamera Turbo Sport Turismo Review: The World's Most Perfect Car? - MotorIllustrated,https://slashdot.org/firehose.pl?op=view&amp;id=103918355,,944
513,https://www.dailymail.co.uk/home/search.html?s=&authornamef=Reuters,"Oct 29 (Reuters) - Canada's main stock index rebounded on Monday from a steep sell-off last week, after global markets rose partly due to relief over an unchanged credit rating on Italy. * The TSX fell 3.7 percent in the previous week, its worst week since Fe… [+1365 chars]","Oct 29 (Reuters) - Canada's main stock index rebounded on  Monday from a steep sell-off last week, after global markets  rose partly due to relief over an...",2018-10-29T14:13:32Z,"{'id': 'daily-mail', 'name': 'Daily Mail'}",CANADA STOCKS-TSX bounces back after last week's sell-off,https://www.dailymail.co.uk/wires/reuters/article-6329371/CANADA-STOCKS-TSX-bounces-weeks-sell-off.html,https://i.dailymail.co.uk/i/pix/m_logo_636x382px.png,615
514,Guest Author,"Traders on the NAGA Trader platform definitely have something to smile about after the NAGA Group launched its long-awaited card for use. The latest development is a result of tireless work by its creators, all in the interest of bestowing its users with all … [+2140 chars]","Traders on the NAGA Trader platform definitely have something to smile about after the NAGA Group launched its long-awaited card for use. The latest development is a result of tireless work by its creators, all in the interest of bestowing its users with all …",2018-10-29T14:13:37Z,"{'id': None, 'name': 'Newsbtc.com'}",NAGA Group Launches Its Long-Awaited Card,https://www.newsbtc.com/2018/10/29/naga-group-launches-its-long-awaited-card/,https://s3.amazonaws.com/main-newsbtc-images/2018/10/29141141/naga-card.png,512
515,Guest Author,"Traders on the NAGA Trader platform definitely have something to smile about after the NAGA Card was launched. The latest development is a result of tireless work by its creators, all in the interest of bestowing its users with all the advantages that come wi… [+2113 chars]","Traders on the NAGA Trader platform definitely have something to smile about after the NAGA Card was launched. The latest development is a result of tireless work by its creators, all in the interest of bestowing its users with all the advantages that come wi…",2018-10-29T14:13:37Z,"{'id': None, 'name': 'Newsbtc.com'}",NAGA Launches Its Long-Awaited Card,https://www.newsbtc.com/2018/10/29/naga-launches-its-long-awaited-card/,https://s3.amazonaws.com/main-newsbtc-images/2018/10/29141141/naga-card.png,455
516,Eren Sengezer,"Upbeat tone surrounding global equities boosts Wall Street. Greenback preserves strength after inflation data. After inching higher to $1235, the XAU/USD pair struggled to push higher and erased its daily gains. In the early NA session, the pair was relativel… [+1355 chars]","Upbeat tone surrounding global equities boosts Wall Street. Greenback preserves strength after inflation data. After inching higher to $1235, the XAU/USD pair struggled to push higher and erased its daily gains. In the early NA session, the pair was relativel…",2018-10-29T14:13:59Z,"{'id': None, 'name': 'Fxstreet.com'}",Gold stays in red near $1230 as Wall Street opens higher,https://www.fxstreet.com/news/gold-stays-in-red-near-1230-as-wall-street-opens-higher-201810291413,https://editorial.azureedge.net/images/Markets/Currencies/Crosses/XAUUSD/gold-bars-on-dollars-19549282_Large.jpg,183
517,Allen Farmelo,"Fifty years ago, a commercial jet began flying across the Atlantic at speeds nearly double the speed of sound. The Concord Jet was not the future of aviation; it was the promise of the Space Age realized in the present. The jet’s unmistakable shape immediatel… [+1148 chars]","Fifty years ago, a commercial jet began flying across the Atlantic at speeds nearly double the speed of sound. The Concord Jet was not the future of aviation; it was the promise of the Space Age realized in the present. The jet’s unmistakable shape immediatel…",2018-10-29T14:15:28Z,"{'id': None, 'name': 'Wornandwound.com'}",First Look: Bremont’s Supersonic 8-Day Chronometer Celebrates the Concord Jet’s 50th Anniversary,https://wornandwound.com/first-look-bremonts-supersonic-8-day-chronometer-celebrates-the-concord-jets-50th-anniversary/,https://wornandwound.com/library/uploads/2018/10/Bremont-Supersonic-Launch-7.jpg,338
518,jersharocks,"Costco Wholesale [ costco.com ] has 0.80 ctw Round Brilliant Diamond Earrings 14k White Gold for $999.99 Note: This deal was created from the Black Friday ad. VS2 clarity, I color. No limit. Valid November 23-26. In-warehouse deals start at 9am on Black Frida… [+168 chars]","Hot Costco Wholesale Black Friday Deal! Costco Wholesale has 0.80 ctw Round Brilliant Diamond Earrings 14k White Gold for $999.99

Note: This deal was created from the Black Friday ad.

VS2 clarity, I color. No limit.

Valid November 23-26.",2018-10-29T14:17:20Z,"{'id': None, 'name': 'Slickdeals.net'}",Costco Wholesale Black Friday: 0.80 ctw Round Brilliant Diamond Earrings 14k White Gold for $999.99,https://slickdeals.net/f/12171106-costco-wholesale-black-friday-0-80-ctw-round-brilliant-diamond-earrings-14k-white-gold-for-999-99,https://static.slickdealscdn.com/attachment/2/5/4/6/2/4/7472374.attach,624
519,Tyler Durden,"This morning's overnight dead-cat-bounce is once again being heralded as the beginning of the end of the carnage that investors have suffered in October. We're not holding our breaths... ""Should we buy the dip?"" ""Has it gone far enough yet?"" As former fund ma… [+3247 chars]","This morning's overnight dead-cat-bounce is once again being heralded as the beginning of the end of the carnage that investors have suffered in October. We're not holding our breaths... ""Should we buy the dip?"" ""Has it gone far enough yet?"" As former fund ma…",2018-10-29T14:18:20Z,"{'id': None, 'name': 'Zerohedge.com'}","One Trader Warns ""Extrapolation Could Ruin Your November As Well""",https://www.zerohedge.com/news/2018-10-29/one-trader-warns-extrapolation-could-ruin-your-november-well,https://www.zerohedge.com/sites/default/files/styles/max_650x650/public/2018-10/2018-10-29_6-31-07.jpg?itok=zKPuLlyF,977
520,Tanay Warerkar,"The crowning penthouse at Harlem’s Circa Central Park sold for a record $9.45 million A penthouse at Harlem’s Circa Central Park has sold for $9.45 million, setting a sales record for condos sold above West 96th Street and East 102nd Street, the Wall Street J… [+1078 chars]",The crowning penthouse at Harlem’s Circa Central Park sold for a record $9.45 million.,2018-10-29T14:19:29Z,"{'id': None, 'name': 'Curbed.com'}",Harlem penthouse sets Uptown sales record,https://ny.curbed.com/2018/10/29/18037592/harlem-condo-most-expensive-sold-uptown-central-park,https://cdn.vox-cdn.com/thumbor/gmzZProvLKhNKpbG5XySt3nnzwo=/0x129:1800x1071/fit-in/1200x630/cdn.vox-cdn.com/uploads/chorus_asset/file/13351043/13079_P_036_EH_Exterior__1_.jpg,237
521,jersharocks,"Costco Wholesale [ costco.com ] has 0.45 ctw Round Brilliant Diamond Pendant 14k White Gold for $699.99 Note: This deal was created from the Black Friday ad. VS2 Clarity, I Color. No limit. Valid November 23-26. In-warehouse deals start at 9am on Black Friday… [+168 chars]","Hot Costco Wholesale Black Friday Deal! Costco Wholesale has 0.45 ctw Round Brilliant Diamond Pendant 14k White Gold for $699.99

Note: This deal was created from the Black Friday ad.

VS2 Clarity, I Color. No limit.

Valid November 23-26.",2018-10-29T14:19:46Z,"{'id': None, 'name': 'Slickdeals.net'}",Costco Wholesale Black Friday: 0.45 ctw Round Brilliant Diamond Pendant 14k White Gold for $699.99,https://slickdeals.net/f/12171121-costco-wholesale-black-friday-0-45-ctw-round-brilliant-diamond-pendant-14k-white-gold-for-699-99,https://static.slickdealscdn.com/attachment/2/5/4/6/2/4/7472389.attach,621
522,Maxwell Barna,"Were in the thick of autumnal bliss right now. The temperatures are dropping, the rain and clouds are settling in, the leaves on the trees are turning orange, yellow, and brown, and we can feel in our bones how close we are to Peak Soup Weather. Our favorite … [+4726 chars]","We’re in the thick of autumnal bliss right now. The temperatures are dropping, the rain and clouds are settling in, the leaves on the trees are turning orange, yellow, and brown, and we can feel in our bones how close we are to Peak Soup Weather. Our favorite…",2018-10-29T14:20:02Z,"{'id': None, 'name': 'Coolmaterial.com'}",Simple Soups for Fall,https://coolmaterial.com/food-drink/best-easy-soup-recipes/,https://cmzone-vzbqbxhynotw9ion96xv.netdna-ssl.com/wp-content/uploads/2017/11/Simple-Soups-for-Fall-Header.jpg,280
523,Craig Calcaterra,"It has been less than 12 hours since the World Series ended, but the Hot Stove waits for no one and nothing. As we’ve already noted, one big potential free agent is already on the clock and dozens more are gearing up to make some pretty big decisions about th… [+3548 chars]",When can Bryce Harper sign? Our list of all of the important dates and deadlines for the 2018-19 offseason will tell you.,2018-10-29T14:20:27Z,"{'id': None, 'name': 'Nbcsports.com'}",Hot Stove season begins,https://mlb.nbcsports.com/2018/10/29/hot-stove-season-begins/,https://nbchardballtalk.files.wordpress.com/2018/10/gettyimages-1010945224-e1540822768452.jpg?w=1200,652
524,,"With a rangy set of friends from Fall Out Boy to Lil Wayne, it was obvious from the start that Tyga was not your everyday rapper from Compton. After recording a mixtape and promoting it around the city, Tyga ran into his cousin, Gym Class Heroes member Travis… [+2237 chars]",Dip (feat. Nicki Minaj) by Tyga from the album Dip (feat. Nicki Minaj) - Single,2018-10-29T14:20:52Z,"{'id': None, 'name': 'Apple.com'}",22. Dip (feat. Nicki Minaj) - Tyga,https://itunes.apple.com/us/album/dip-feat-nicki-minaj-single/1440220078?i=1440220079,https://is2-ssl.mzstatic.com/image/thumb/Music118/v4/a1/a8/27/a1a827e6-67fb-3939-8a42-f3700dd87f35/888915760994_cover.jpg/1200x630wp.png,755
525,Splendid Exchange,"As you know, once in a while, Splendid Exchange looks at seven major currency pairs in search of the evidence of popular delusions and the madness of crowds. The idea is to find anomalies and bullish or bearish divergences that will break the trend, not prolo… [+11856 chars]",The most important themes impacting global foreign exchange market right now are: U.S. earnings season and the prospect of a major trade war between Washington,2018-10-29T14:23:54Z,"{'id': None, 'name': 'Seekingalpha.com'}","October 28, 2018: Forex Weekly - Relative Valuation And Trading Opportunities",https://seekingalpha.com/article/4215386-october-28-2018-forex-weekly-relative-valuation-trading-opportunities,https://static2.seekingalpha.com/uploads/2018/10/28/48196714-15407482366911848.png,222
526,,Peter Paltchik of Israel has defeated Elmar Gasimov of Azerbaijan to take the gold medal in the men's 100-kilogram division at the Abu Dhabi Grand Slam judo tournament. It's Israel's second gold in the event. Sagi Muki made history on Sunday when he won the 8… [+113 chars],,2018-10-29T14:26:00Z,"{'id': None, 'name': 'Israelnationalnews.com'}",Another gold for Israel in Abu Dhabi Grand Slam Judo,http://www.israelnationalnews.com/News/Flash.aspx/435455,http://k6s3v6r4.ssl.hwcdn.net/pictures/799/799624.jpg,468
527,Catherine Edwards,"Between 340 and 400 people, many of them teenagers, had gathered in a building in the harbour district of Gothenburg to celebrate Halloween. A Macedonian cultural organization had rented out its premises for the night, with the external organizers telling aut… [+4827 chars]","At a Halloween party in Gothenburg in 1998, a fire started by four youths led to one of the deadliest disasters of modern Swedish history. Sixty-three young people lost their lives and many more were injured. Twenty years on from the tragedy, The Local looks …",2018-10-29T14:26:14Z,"{'id': None, 'name': 'Thelocal.se'}",The story of the biggest fire disaster in Swedish history,https://www.thelocal.se/20181029/the-biggest-fire-disaster-in-swedish-history-gothenburg-disco,https://www.thelocal.se/userdata/images/article/7745329d74e760136d772fb407825fbd9a58d5b676e3826110a66e6b0b945aee.jpg,620
528,Thema Newsroom,"The Greek athlete Aggelos Vasiliou won gold in the World Diathlon Triathlon Games held in Egypt. The Greek champion, won the gold after competing against the Czech athlete Thomas Svobinda. Aggelos Vasiliou won the title for the second consecutive year.",He won the title for the second consecutive year,2018-10-29T14:27:15Z,"{'id': None, 'name': 'Protothema.gr'}",Greek Pentathlete Aggelos Vasiliou wins Gold in Egypt Games,http://en.protothema.gr/greek-pentathlete-aggelos-vasiliou-wins-gold-in-egypt-games/,http://en.protothema.gr/wp-content/uploads/2018/10/goldgr-150x150.png,851
529,theqinra,Cool. Sad but cool. Insert itsbeen84years.gif,"Michelle Yeoh (‘Crazy Rich Asians’) would be first Asian actress nominated for an Oscar in 12 years https://t.co/D08SeHxZ7G pic.twitter.com/nLWhsdNZ8k — Gold Derby (@GoldDerby) October 28, 2018 Michelle Yeoh is getting Oscar buzz for her role in 'Crazy Rich A…",2018-10-29T14:27:34Z,"{'id': None, 'name': 'Livejournal.com'}",Michelle Yeoh (‘Crazy Rich Asians’) would be first Asian actress nominated for an Oscar in 12 years,https://ohnotheydidnt.livejournal.com/112833004.html,https://l-stat.livejournal.net/img/sign.png,193
530,Matt Norlander,"College basketball has finally come around and figured out the proper way to start its regular season. On Tuesday, Nov. 6, the sport will pull back its curtain for 2018-19 and offer up high-profile games amid its countrywide launch. Season-opening night has m… [+19329 chars]","The Blue Devils are loaded, but there's plenty of frosh talent in college hoops this season so come meet the newbies",2018-10-29T14:27:56Z,"{'id': None, 'name': 'Cbssports.com'}","College basketball rankings: Duke and Kentucky dominate the top 20 must-know, must-see and most important freshmen",https://www.cbssports.com/college-basketball/news/college-basketball-rankings-duke-and-kentucky-dominate-the-top-20-must-know-must-see-and-most-important-freshmen/,https://sportshub.cbsistatic.com/i/r/2018/08/16/0c4dd4f8-4ef7-432e-b251-03ed83e712a4/thumbnail/770x433/b57c1f7ca36b59c8260a039c9e1fea29/rj-barrett.jpg,868
531,ProtoThema.gr,"The situation is under control, police say","<div class=""entry-excerpt-in"">
<p>He won the title for the second consecutive year</p>
</div>
<div class=""entry-content"">
<div class=""mlnc-related"">
<div class=""title_bg""></div>
</div>
</div>",2018-10-29T14:28:09Z,"{'id': None, 'name': 'Protothema.gr'}",Greek Pentathlete Aggelos Vasiliou wins Gold in Egypt Games,https://www.protothema.gr/english-news/article/833935/greek-pentathlete-aggelos-vasiliou-wins-gold-in-egypt-games-english/,https://i1.prth.gr/images/640x360share/files/2018-10-29/goldgr.png,203
532,https://www.facebook.com/DailyMail,Benjamin Leigh Smith (pictured) was a British yachtsman and explorer who completed several Arctic missions in the 19th-century Benjamin Leigh Smith was a British yachtsman and explorer who was born in Surrey on 12 March 1828. He was born out of wedlock to Ann… [+2990 chars],Benjamin Leigh Smith was a British yachtsman and explorer who was born in Surrey on 12 March 1828.,2018-10-29T14:28:21Z,"{'id': 'daily-mail', 'name': 'Daily Mail'}",WHO WAS BENJAMIN LEIGH SMITH?,https://www.dailymail.co.uk/sciencetech/fb-6329411/WHO-BENJAMIN-LEIGH-SMITH.html,https://i.dailymail.co.uk/1s/2018/10/29/11/5528534-0-image-a-28_1540810805804.jpg,815
