,author,content,description,publishedAt,source,title,url,urlToImage,relevancy
0,"Munteha Nur Sonuc Karaboga, Mustafa Kemal Sezgintürk",If you are not the author of this article and you wish to reproduce material from it in a third party non-RSC publication you must formally request permission using Copyright Clearance Center. Go to our Instructions for using Copyright Clearance Center page f… [+2546 chars],"Analyst, 2018, Accepted Manuscript DOI : 10.1039/C8AN01279B, Paper Munteha Nur Sonuc Karaboga, Mustafa Kemal Sezgintürk Synuclein (SYN) alpha is a prominent key protein in Parkinson-type dementia. Measurement of the amount of this protein found in cerebrospin…",2018-10-29T00:00:00Z,"{'id': None, 'name': 'Rsc.org'}",Cerebrospinal fluid levels of synuclein alpha measured using poly-glutamic acid-modified gold nanoparticle-doped disposable neuro-biosensor system,https://pubs.rsc.org/en/content/articlelanding/2018/an/c8an01279b,,552
1,"Sean McMahon, Ashleigh v. S. Hood, John Parnell, Stephen Bowden","1. Colwell, F. S. &amp; DHondt, S. Nature and extent of the deep biosphere. Rev. Mineral. Geochem. 75, 547574 (2013). 2. McMahon, S. &amp; Parnell, J. Weighing the deep continental biosphere. FEMS Microbiol. Ecol. 87, 113120 (2014). 3. Anantharaman, K. et al.… [+8433 chars]","Red beds contain reduction spheroids that formed underground millions of years ago and whose origin remains poorly constrained. Here the authors use uranium isotopes to identify ancient fingerprints of bacteria in these features, confirming that they were pro…",2018-10-29T00:00:00Z,"{'id': None, 'name': 'Nature.com'}",Reduction spheroids preserve a uranium isotope record of the ancient deep continental biosphere,https://www.nature.com/articles/s41467-018-06974-9?utm_source=feedburner&utm_medium=feed&utm_campaign=Feed%3A+ncomms%2Frss%2Fcurrent+%28Nature+Communications+-+current%29,https://media.springernature.com/m685/springer-static/image/art%3A10.1038%2Fs41467-018-06974-9/MediaObjects/41467_2018_6974_Fig1_HTML.png,529
2,Lee Martin,"According to Songkick, the Foo Fighters have played over 1,300 concerts since 1995, traveling 1,269,259 miles by van, bus, and chartered jumbo jet. Now think about how many hours of music were performed and consider just how many people had a chance to hear t… [+12288 chars]","Using Foo Fighters live music data to create a scalable Instagram Stories series. Powered by Intel, After Effects, and Dataclay.",2018-10-29T00:00:00Z,"{'id': None, 'name': 'Medium.com'}",Rewinding Foo Fighters Touring History,https://medium.com/@leemartin/rewinding-foo-fighters-touring-history-98d248996399,https://cdn-images-1.medium.com/max/1200/1*mLid8E4oPHZt_UwHhryu0Q.jpeg,542
3,"Stefan Knecht, Hans Jørgen Aa. Jensen, Trond Saue","1. Lewis, G. N. The atom and the molecule. J. Am. Chem. Soc. 38, 762785 (1916). 2. Neidig, M. L., Clark, D. L. &amp; Martin, R. L. Covalency in f -element complexes. Coord. Chem. Rev. 257, 394406 (2013). 3. Kaltsoyannis, N. &amp; Kerridge, A. in The Chemical … [+7953 chars]","Establishing a fundamental understanding of the electronic structure of actinides remains a challenging task for both experiment and theory. Now, it is shown that for the uranium dimer, relativity and electron correlation affects not only the nature of the el…",2018-10-29T00:00:00Z,"{'id': None, 'name': 'Nature.com'}",Relativistic quantum chemical calculations show that the uranium molecule U 2 has a quadruple bond,https://www.nature.com/articles/s41557-018-0158-9,https://media.springernature.com/m685/springer-static/image/art%3A10.1038%2Fs41557-018-0158-9/MediaObjects/41557_2018_158_Figa_HTML.png,413
4,,"Managers and investors are starting to digitize their work and take advantage of analytics. Here’s an overview of the latest developments. Across private markets, managers (and some investing institutions) have been encouraging their portfolio companies to us… [+10044 chars]",Managers and investors are starting to digitize their work and take advantage of analytics. Here’s an overview of the latest developments in the private equity digital transformation.,2018-10-29T00:00:00Z,"{'id': None, 'name': 'Mckinsey.com'}",Digitizing the private markets firm,https://www.mckinsey.com/industries/private-equity-and-principal-investors/our-insights/digitizing-the-private-markets-firm,https://www.mckinsey.com/~/media/McKinsey/Industries/Private%20Equity%20and%20Principal%20Investors/Our%20Insights/Digitizing%20the%20private%20markets%20firm/Digitizing%20private%20markets%20firm_1536x1536_400.ashx,360
5,"Associated Press, By Associated Press","LOS ANGELES Hard to believe now, all these wins later, but the Alex Cora Era in Boston began with a loss. A brutal one, in fact. Opening day at Tropicana Field in late March, none of his late moves worked out as the bullpen blew a big lead in a 6-4 setback. N… [+6126 chars]","LOS ANGELES  — Hard to believe now, all these wins later, but the Alex Cora Era in Boston began with a loss. A brutal one, in fact.Opening day at Tropicana Field in late March, none of his late moves worked out as the bullpen blew a big lead in a 6-4 setback.…",2018-10-29T00:00:00Z,"{'id': None, 'name': 'Bostonherald.com'}",Cora-nation! Rookie manager leads Red Sox to championship,http://www.bostonherald.com/sports/red_sox/2018/10/cora_nation_rookie_manager_leads_red_sox_to_championship,http://www.bostonherald.com/sites/default/files/styles/full/public/media/2018/10/29/102818redsoxce051.jpg?itok=MmXoTqK8,671
6,"Soongyu Yi, Ming Zhou, Zongfu Yu, Pengyu Fan, Nader Behdad, Dianmin Lin, Ken Xingze Wang, Shanhui Fan, Mark Brongersma","1. Grothe, B., Pecka, M. &amp; McAlpine, D. Mechanisms of sound localization in mammals. Physiol. Rev. 90, 9831012 (2010). 2. Chung, S.-H., Pettigrew, A. &amp; Anson, M. Dynamics of the amphibian middle ear. Nature 272, 142147 (1978). 3. Miles, R. N., Robert,… [+3931 chars]",Two Si resonators couple through a non-Hermitian interaction to sense both the intensity and the incident angle of light with subwavelength resolution.,2018-10-29T00:00:00Z,"{'id': None, 'name': 'Nature.com'}",Subwavelength angle-sensing photodetectors inspired by directional hearing in small animals,https://www.nature.com/articles/s41565-018-0278-9,https://media.springernature.com/m685/springer-static/image/art%3A10.1038%2Fs41565-018-0278-9/MediaObjects/41565_2018_278_Fig1_HTML.png,345
7,"Soongyu Yi, Ming Zhou, Zongfu Yu, Pengyu Fan, Nader Behdad, Dianmin Lin, Ken Xingze Wang, Shanhui Fan, Mark Brongersma","1. Grothe, B., Pecka, M. &amp; McAlpine, D. Mechanisms of sound localization in mammals. Physiol. Rev. 90, 9831012 (2010). 2. Chung, S.-H., Pettigrew, A. &amp; Anson, M. Dynamics of the amphibian middle ear. Nature 272, 142147 (1978). 3. Miles, R. N., Robert,… [+3931 chars]",Two Si resonators couple through a non-Hermitian interaction to sense both the intensity and the incident angle of light with subwavelength resolution.,2018-10-29T00:00:00Z,"{'id': None, 'name': 'Nature.com'}",Subwavelength angle-sensing photodetectors inspired by directional hearing in small animals,https://www.nature.com/articles/s41565-018-0278-9?utm_source=feedburner&utm_medium=feed&utm_campaign=Feed%3A+nnano%2Frss%2Fcurrent+%28Nature+Nanotechnology+-+Issue%29,https://media.springernature.com/m685/springer-static/image/art%3A10.1038%2Fs41565-018-0278-9/MediaObjects/41565_2018_278_Fig1_HTML.png,313
8,"Zoltán Maróti, Zsolt Boldogkői, Dóra Tombácz, Michael Snyder and Tibor Kalmár",,Understanding the underlying genetic structure of human populations is of fundamental interest to both biological and social sciences. Advances in high-throughput genotyping technology have markedly improved our understanding of global patterns of human genet…,2018-10-29T00:00:00Z,"{'id': None, 'name': 'Biomedcentral.com'}",Evaluation of whole exome sequencing as an alternative to BeadChip and whole genome sequencing in human population genetic analysis,https://bmcgenomics.biomedcentral.com/articles/10.1186/s12864-018-5168-x,https://images.springer.com/sgw/journals/medium/12864.jpg,931
9,julesmckim,,,2018-10-29T00:00:00Z,"{'id': None, 'name': 'Ukclimbing.com'}",Spanish Gold,https://www.ukclimbing.com/images/dbpage.php?id=318954,https://cdn.ukc2.com/i/318954.jpg,934
10,Elly Parsons,"The 360-degree smart home hub by Hive has gone 480 with a new outdoor camera addition to its home technology collection. The launch of Hive View Outdoor marks the first time the UK-based smart home company has branched out into outdoor security, having been k… [+2189 chars]","The 360-degree smart home hub by Hive has gone 480 with a new outdoor camera addition to its home technology collection. The launch of Hive View Outdoor marks the first time the UK-based smart home company has branched out into outdoor security, having been k…",2018-10-29T00:00:00Z,"{'id': None, 'name': 'Wallpaper.com'}",Yves Béhar takes Hive outdoors with a new home security camera,https://www.wallpaper.com/lifestyle/yves-behar-hive-view-outdoor-camera,https://cdn.wallpaper.com/main/2018/10/01_hive-view-outdoor_render_-left-angle_insitu-on-white-wall_wood-panelling.jpg,282
11,communities@mercola.com (Dr. Joseph Mercola),"If there were a short list of fruits surrounded by confusing, misleading and downright incorrect nomenclature, ground cherries would be on it. There are several reasons for that: They have a long history and are well-traveled over hundreds of years, as they w… [+12146 chars]","If there were a short list of fruits surrounded by confusing, misleading and downright incorrect nomenclature, ground cherries would be on it. There are several reasons for that: They have a long history and are well-traveled over hundreds of years, as they w…",2018-10-29T00:00:00Z,"{'id': None, 'name': 'Mercola.com'}",What Are the Benefits of Ground Cherries?,https://articles.mercola.com/sites/articles/archive/2018/10/29/ground-cherries.aspx,https://media.mercola.com/ImageServer/Public/2018/October/FB/10-29-ground-cherries-2-fb.jpg,945
12,"Tae-Hyeon Park, Du-Jeon Jang",If you are not the author of this article and you wish to reproduce material from it in a third party non-RSC publication you must formally request permission using Copyright Clearance Center. Go to our Instructions for using Copyright Clearance Center page f… [+2546 chars],"Nanoscale, 2018, Advance Article DOI : 10.1039/C8NR04617D, Communication Tae-Hyeon Park, Du-Jeon Jang Hollow and porous gold nanoshells with high surface-enhanced Raman scattering efficiency have been fabricated through utilizing nanosecond laser irradiation.…",2018-10-29T00:00:00Z,"{'id': None, 'name': 'Rsc.org'}",Laser-induced fabrication of porous gold nanoshells,https://pubs.rsc.org/en/content/articlelanding/2018/nr/c8nr04617d,,138
13,"Asha Liza Liza James, Shikha Khandelwal, Arnab Dutta, Kabeer Jasuja",If you are not the author of this article and you wish to reproduce material from it in a third party non-RSC publication you must formally request permission using Copyright Clearance Center. Go to our Instructions for using Copyright Clearance Center page f… [+2546 chars],"Nanoscale, 2018, Accepted Manuscript DOI : 10.1039/C8NR06283H, Communication Asha Liza Liza James, Shikha Khandelwal, Arnab Dutta, Kabeer Jasuja We show that nanosheets obtained by exfoliating magnesium diboride bear an intrinsic ability to elicit chemical re…",2018-10-29T00:00:00Z,"{'id': None, 'name': 'Rsc.org'}",Boron based nanosheets as reducing templates in aqueous solutions: Towards novel nanohybrids with gold nanoparticles and graphene,https://pubs.rsc.org/en/content/articlelanding/2018/nr/c8nr06283h,,147
14,Matthew Everhard,"During a particularly stressful period of pastoral ministry, I began to more intentionally seek out joy in God as the dire remedy for my own frayed and threadbare heart. I had diagnosed myself as markedly joy-deficient when I searched for evidence of the frui… [+11897 chars]","During a particularly stressful period of pastoral ministry, I began to more intentionally seek out joy in God as the dire remedy for my own frayed and threadbare heart. I had diagnosed myself as markedly joy-deficient when I searched for evidence of the frui…",2018-10-29T00:02:00Z,"{'id': None, 'name': 'Desiringgod.org'}",Three Disciplines of a Happy Christian Leader: Learning from the Theologian of Joy,https://www.desiringgod.org/articles/three-disciplines-of-a-happy-christian-leader?utm_medium=feed&utm_source=feedpress.me&utm_campaign=Feed%3A+dg-articles,https://dg.imgix.net/three-disciplines-of-a-happy-christian-leader-xtjms48v-en/landscape/three-disciplines-of-a-happy-christian-leader-xtjms48v-ae674f4de175d013519d72731222786a.jpg?ts=1540240580&ixlib=rails-3.0.0&w=800&h=450&auto=format%2Ccompress&fit=min,491
15,https://www.facebook.com/DailyMailCeleb,"She's on a roll right now with a string of Hollywood movie releases. And on Sunday, Tiffany Haddish walked yet another red carpet at the premiere for her upcoming comedy Nobody's Fool. The actress and comedienne, 38, rocked a colorful jumpsuit that mixed gree… [+1203 chars]",She's on a roll right now with a string of Hollywood movie releases.,2018-10-29T00:02:25Z,"{'id': 'daily-mail', 'name': 'Daily Mail'}",Tiffany Haddish rocks colorful jumpsuit and stunning gold jewelry at Nobody's Fool premiere in NYC,https://www.dailymail.co.uk/tvshowbiz/article-6327227/Tiffany-Haddish-rocks-colorful-jumpsuit-stunning-gold-jewelry-Nobodys-Fool-premiere-NYC.html,https://i.dailymail.co.uk/1s/2018/10/29/00/5515388-0-image-a-18_1540771338973.jpg,507
16,Philip Pangalos,"The judo family in Abu Dhabi in the United Arab Emirates celebrated World Judo Day - and this year's theme was Friendship. Judo sent a message of peace to the world, with three-time world champion and Athens 2004 Olympic champion Ilias Iliadis delivering a ma… [+3680 chars]","Day two of the history-making Abu Dhabi Grand Slam produced an emotionally charged day both on and off the tatami as Israel - who were competing under their own flag for the first time in a Gulf country - and France, Georgia and the Netherlands struck gold in…",2018-10-29T00:05:39Z,"{'id': None, 'name': 'Euronews.com'}",Judo sends a message of peace to the world during the Abu Dhabi Grand Slam on World Judo Day,https://www.euronews.com/2018/10/29/judo-sends-a-message-of-peace-to-the-world-during-the-abu-dhabi-grand-slam-on-world-judo,https://static.euronews.com/articles/stories/03/40/41/76/1000x563_cmsv2_6dcdd595-8f5f-527a-8e18-345ce2e2ac95-3404176.jpg,79
17,李齐,"Peak season of Sept, Oct slumps, but analysts say pessimism wrong Every year, China's property industry looks forward to September and October, by far the busiest months for home sales. If September was gold, October was silver. Not any more, industry insider… [+178 chars]","Every year, China's property industry looks forward to September and October, by far the busiest months for home sales. If September was gold, October was silver. Not any more, industry insiders said.",2018-10-29T00:07:17Z,"{'id': None, 'name': 'Chinadaily.com.cn'}",Home sales flatter to deceive,http://www.chinadaily.com.cn/cndy/2018-10/29/content_37146824.htm,,683
18,"Keith Flamer, Contributor, Keith Flamer, Contributor https://www.forbes.com/sites/keithflamer/",Share to facebook Share to twitter Share to linkedin Le Monde sur Mesure is handcrafted from gold and diamonds. Courtesy Morreale Paris What do you get the person who has everything? A fragrance fit for royals. The worlds most expensive fragrance bottle is co… [+13762 chars],Morreale Paris creates world’s most expensive fragrance and experience for modern royals and exceptional estates.,2018-10-29T00:09:00Z,"{'id': None, 'name': 'Forbes.com'}",Is Morreale's $1.5 Million Fragrance Bottle The Next Fabergé Egg?,https://www.forbes.com/sites/keithflamer/2018/10/28/is-morreales-1-5-million-fragrance-bottle-the-next-faberge-egg/,https://thumbor.forbes.com/thumbor/600x315/https%3A%2F%2Fblogs-images.forbes.com%2Fkeithflamer%2Ffiles%2F2018%2F10%2FScreen-Shot-2018-10-28-at-5.36.47-PM-1200x896.png,107
19,,LOS ANGELES -- If the Green Bay Packers ' season ends up in ruins -- and it looks like it could be headed that way -- it might be traced to what happened in the final minutes on Sunday against the Los Angeles Rams. Or what happened at their own 1-yard line la… [+3128 chars],If the Packers' season ends up in tatters -- and it could be headed that way -- it might be traced to two key moments in their loss to the Rams.,2018-10-29T00:10:30Z,"{'id': None, 'name': 'Espn.com'}",Packers squander what could've been season-changing win over Rams,http://www.espn.com/blog/nfcnorth/post/_/id/82362/packers-waste-what-could-have-been-season-changing-win-over-rams,http://a.espncdn.com/combiner/i?img=%2Fphoto%2F2018%2F1028%2Fr454283_1296x729_16%2D9.jpg,725
20,cheba63,Costco Wholesale [ costco.com ] has Samsung Galaxy Watch - $70 Off Note: This deal was created from the Black Friday ad. Limit 5 each. Available in 42mm Stainless Steel Rose Gold with Pink Band and/or 46mm Stainless Steel Silver with Black Band. This deal is … [+236 chars],"Hot Costco Wholesale Black Friday Deal! Costco Wholesale has Samsung Galaxy Watch - $70 Off

Note: This deal was created from the Black Friday ad.

Limit 5 each. Available in 42mm Stainless Steel Rose Gold with Pink Band and/or 46mm",2018-10-29T00:11:48Z,"{'id': None, 'name': 'Slickdeals.net'}",Costco Wholesale Black Friday: Samsung Galaxy Watch - $70 Off,https://slickdeals.net/f/12168907-costco-wholesale-black-friday-samsung-galaxy-watch-70-off,https://static.slickdealscdn.com/attachment/4/1/9/9/5/9/7468972.attach,617
21,,"“Just wait until you have kids.” “Must be nice to have that kind of time.” “Yeah, I used to be in shape, too, before… them."" (The speaker points to his children while drawing a long sip of soda.) I’ve heard sentiments such as these more times than I can remem… [+12092 chars]","Working out when you have kids is like obstacle course racing on a track that never ends. But, by committing to daily movement, you give your family the gift of health and vitality. <!--paging_filter-->“Just wait until you have kids.” “Must be nice to have th…",2018-10-29T00:18:27Z,"{'id': None, 'name': 'Breakingmuscle.com'}","Parents, You Must Find Time for Fitness",https://breakingmuscle.com/fitness/parents-you-must-find-time-for-fitness,https://cdn6.omidoo.com/sites/default/files/imagecache/1200x630/images/headline/201810/shanetrotterandson.jpg,737
22,Surur,"Early this month, Microsoft announced next-generation Surface devices, the Surface Pro 6, the Surface Laptop 2 and the Surface Studio 2 at a press event. The event was limited to very few pe... Surface Laptop 2 and Surface Pro 6 now available for order in 10 … [+2264 chars]","Twitter’s Windows 10 Progressive Web App team has pushed out another update for the app, bringing along a number of improvements. The official changelog for the versionless app dated 22nd October reads: We added the ability to tag up to 10 people in a Tweet w…",2018-10-29T00:21:17Z,"{'id': None, 'name': 'Mspoweruser.com'}",Twitter PWA for Windows 10 gets another update (official changelog),https://mspoweruser.com/twitter-pwa-for-windows-10-gets-another-update-official-changelog/,https://mspoweruser.com/wp-content/uploads/2018/09/send-feedback-twitter.jpg,882
23,,LOS ANGELES -- If the Green Bay Packers ' season ends up in ruins -- and it looks like it could be headed that way -- it might be traced to what happened in the final minutes on Sunday against the Los Angeles Rams. Or what happened at their own 1-yard line la… [+3128 chars],If the Packers' season ends up in tatters -- and it could be headed that way -- it might be traced to two key moments in their loss to the Rams.,2018-10-29T00:23:28Z,"{'id': None, 'name': 'Espn.com'}",Packers waste what could have been season-changing win over Rams,http://www.espn.com/blog/green-bay-packers/post/_/id/46075/packers-waste-what-could-have-been-season-changing-win-over-rams,http://a.espncdn.com/combiner/i?img=%2Fphoto%2F2018%2F1028%2Fr454283_1296x729_16%2D9.jpg,156
24,huayting,Gold Fish Logo is an interesting project for creating your logo. - After Effects CS4 and above - Full HD (1920x1080) / 29.97 fps - No plugin required - Help documentation https://href.li/?https://videohive.net/item/gold-fish-logo/682453,VideoHive - Gold Fish Logo 682453 | 56 MB Gold Fish Logo is an interesting project for creating your logo.  VideoHive - Gold Fish Logo 682453 | 56 MB Gold Fish Logo is an interesting project,2018-10-29T00:28:53Z,"{'id': None, 'name': 'Gfxbing.com'}",VideoHive - Gold Fish Logo 682453,http://gfxbing.com/ae-footages/890749-videohive-gold-fish-logo-682453.html,https://b.radikal.ru/b35/1810/ed/e95e5de1c957.jpg,961
25,https://www.dailymail.co.uk/home/search.html?s=&authornamef=Australian+Associated+Press,"Putting more high density housing in the inner suburbs of major cities is key to unlocking economic growth, a new report has found. The Grattan Institute's 2018 report into how the states are going also recommends state governments pursue their own emissions … [+1619 chars]","Putting more high density housing in the inner suburbs of major cities is key to unlocking economic growth, a new report has found.The Grattan Institute's...",2018-10-29T00:29:05Z,"{'id': 'daily-mail', 'name': 'Daily Mail'}",More housing near cities needed: report,https://www.dailymail.co.uk/wires/aap/article-6327343/More-housing-near-cities-needed-report.html,https://i.dailymail.co.uk/i/pix/m_logo_636x382px.png,733
26,"Ilya Spivak, Sr. Currency Strategist, Ilya Spivak","CRUDE OIL &amp; GOLD TALKING POINTS: Crude oil prices aim lower as chart setup hints at major top in place Gold prices struggle for direction, technical cues hint at downswing WTO to consider US vs China complaint, US PCE inflation data due Crude oil prices r… [+2334 chars]",Crude oil prices appear to have established a major top having broken a 16-month uptrend. Gold prices may fall if US PCE inflation data tops forecasts.,2018-10-29T00:30:00Z,"{'id': None, 'name': 'Dailyfx.com'}",Crude Oil Price Chart Hints at Major Bearish Trend Reversal,https://www.dailyfx.com/forex/fundamental/daily_briefing/daily_pieces/commodities/2018/10/29/Crude-Oil-Price-Chart-Hints-at-Major-Bearish-Trend-Reversal.html,,848
27,https://www.facebook.com/DailyMailCeleb,"She's lived a life full of drama, intrigue and glamour. So Sophie Loren no doubt had plenty to talk about as she attended a question and answers session about her past at the Aldwych Theatre in London on Sunday. Hosted by Jonathan Ross, the one-off show about… [+2243 chars]","She's lived a life full of drama, intrigue and glamour.  So Sophie Loren no doubt had plenty to talk about as she attended a question and answers session about her past at the Aldwych Theatre.",2018-10-29T00:33:04Z,"{'id': 'daily-mail', 'name': 'Daily Mail'}","Sophia Loren, 84, oozes glamour in a cream trouser suit and fur stole as she hosts Q&A in London",https://www.dailymail.co.uk/tvshowbiz/article-6327241/Sophia-Loren-84-oozes-glamour-cream-trouser-suit-fur-stole-hosts-Q-London.html,https://i.dailymail.co.uk/1s/2018/10/29/00/5515548-0-image-a-66_1540772826642.jpg,972
28,https://www.facebook.com/DailyMailCeleb,Their reality show often turns into something of a circus. But it was the real deal on Sunday as Real Housewives of New York City Tinsley Mortimer and Sonja Morgan were on hand for opening night of the Big Apple Circus. The 43-year-old television personality … [+2014 chars],RHONY stars Mortimer and Sonja Morgan were on hand for opening night of the Big Apple Circus. The 43-year-old flaunted her legs in a black dress as she joined her 53-year-old co-star.,2018-10-29T00:33:36Z,"{'id': 'daily-mail', 'name': 'Daily Mail'}",Tinsley Mortimer flaunts her legs in black dress with RHONY co-star Sonja Morgan at Big Apple Circus,https://www.dailymail.co.uk/tvshowbiz/article-6327267/Tinsley-Mortimer-flaunts-legs-black-dress-RHONY-star-Sonja-Morgan-Big-Apple-Circus.html,https://i.dailymail.co.uk/1s/2018/10/29/00/5516378-0-image-a-21_1540772495544.jpg,971
29,"Western Bonime, Contributor, Western Bonime, Contributor https://www.forbes.com/sites/westernbonime/","Share to facebook Share to twitter Share to linkedin Follow me, says a fan unfurled and held vertically in front of the face. People seldom think of fans as anything other than a way to stay cool and only when it gets hot, and yet this beautiful fashion acces… [+17577 chars]","“Follow me,” says a fan unfurled and held vertically in front of the face. People seldom think of fans as anything other than a way to stay cool and only when it gets hot, and yet this beautiful two centuries old fan house has managed to attrac A listers like…",2018-10-29T00:39:00Z,"{'id': None, 'name': 'Forbes.com'}","Finding Magic In Paris At Duvelleroy, A Modern Two Century Fan House",https://www.forbes.com/sites/westernbonime/2018/10/28/finding-magic-in-paris-at-duvelleroy-a-modern-two-century-fan-house/,https://thumbor.forbes.com/thumbor/600x315/https%3A%2F%2Fi.forbesimg.com%2Fmedia%2Fassets%2Fforbes_1200x1200.jpg,250
