,author,content,description,publishedAt,source,title,url,urlToImage,relevancy
725,Stephanie Dhue,"Seven countries including Mexico, Canada and the European Union disputed U.S. tariffs on foreign steel and aluminum at a meeting of the World Trade Organization in Geneva on Monday, according to meeting documents. China asked the international trade body to r… [+2881 chars]","Seven countries — including Mexico, Canada and the European Union — disputed U.S. tariffs on foreign steel and aluminum at a meeting of the World Trade Organization in Geneva on Monday.",2018-10-29T17:41:00Z,"{'id': 'cnbc', 'name': 'CNBC'}",America's global trade war finally arrives at the WTO as members dispute US tariffs,https://www.cnbc.com/2018/10/29/americas-global-trade-war-arrives-at-wto-as-members-dispute-us-tariffs.html,https://fm.cnbc.com/applications/cnbc.com/resources/img/editorial/2018/03/27/105092099-RTS1N7FB.1910x1000.jpg,981
726,Mike Rivero,"President Donald J. Trump has taken on the Federal Reserve (Fed), saying that Fed chairman Jerome H. Powell is threatening US economic growth by further raising interest rates. Mainstream economists, the financial press and even some politicians react with in… [+5807 chars]","Granted: In good times, the Fed is more or less protected from the demands of political parties. But what about the influence from ‘special interest groups' such as the banking industry on Fed policymaking? There should hardly be any doubt that the Fed caters…",2018-10-29T17:41:15Z,"{'id': None, 'name': 'Mises.org'}",Trump is Right: The Fed is a Big Problem,https://mises.org/wire/trump-right-fed-big-problem,https://mises.org/system/files/styles/social_media_1200_x_1200/private/GettyImages-815414438.jpg?itok=foHPWDhp,445
727,The Florida Times-Union,"The college football Power 5 snobs have it all wrong, all this wishing that little brother UCF would just lose, go away, and crawl back under the Group of 5 rock from which the Knights came. Listen up, all SEC, ACC, Big Ten, Pac-12 and Big 12 holier-than-thou… [+6469 chars]","The college football Power 5 snobs have it all wrong, all this wishing that little brother UCF would just lose, go away, and crawl back under the Group of 5 rock from which the Knights came. Listen up, all SEC, ACC, Big Ten, Pac-12 and Big 12 holier-than-thou…",2018-10-29T17:43:03Z,"{'id': None, 'name': 'Jacksonville.com'}",Gene Frenette: Power 5 elitists should actually be rooting for UCF perfection,https://www.jacksonville.com/article/20181029/SPORTS/181026813,https://www.jacksonville.com/Global/images/head/nameplate/fb/jacksonville_OG.jpg,770
728,Deepak Lavania,"AGRA: Union home minister Rajnath Singh has said that ""discrimination in society on the basis of caste, religion and geographic location"" is a major hindrance in the progress of the nation and the youth have responsibility to strengthen the countrys cultural … [+2757 chars]","India News: AGRA: Union home minister Rajnath Singh has said that ""discrimination in society on the basis of caste, religion and geographic location"" is a major h.",2018-10-29T17:43:43Z,"{'id': 'the-times-of-india', 'name': 'The Times of India'}","Religious, caste discrimination hindrance to India’s progress: Rajnath Singh",https://timesofindia.indiatimes.com/india/religious-caste-discrimination-hindrance-to-indias-progress-rajnath-singh/articleshow/66421010.cms,https://static.toiimg.com/photo/msid-47529300/47529300.jpg,585
729,The Associated Press,"China is back on top in men's gymnastics. The longtime superpower surged past Russia on Monday to capture the team gold medal at the world championships in Doha, Qatar to give China its first major international title in four years. China's team total of 256.… [+1734 chars]",China is back on top in men's gymnastics. The longtime superpower surged past Russia on Monday to capture the team gold medal at the world championships to give China its first major international title in four years.,2018-10-29T17:44:34Z,"{'id': 'cbc-news', 'name': 'CBC News'}",China recaptures men's team gymnastics title,https://www.cbc.ca/sports/olympics/summer/gymnastics/world-gymnastics-championships-mens-team-1.4882568,https://i.cbc.ca/1.4882609.1540834910!/fileImage/httpImage/image.jpg_gen/derivatives/16x9_620/chaopan-lin-1180.jpg,427
730,,"C hris Rylance wins £250 for his account of meeting Queen Sofia at an historic Spanish hotel What do you do when you unexpectedly brush shoulders with a queen? On our motoring tour of northern Spain and Portugal, my wife Bridget and I were staying for two nig… [+3024 chars]",,2018-10-29T17:46:00Z,"{'id': 'the-telegraph', 'name': 'The Telegraph'}",The historic Spanish hotel where you might brush shoulders with royalty,https://www.telegraph.co.uk/travel/destinations/europe/spain/galicia/articles/brush-with-royalty-queen-sofia-santiago-de-compostela/,https://www.telegraph.co.uk/content/dam/Travel/2018/October/santiago-iStock-471248841-xlarge.jpg,224
731,,"HotUKDeals Part of Pepper - The World's Largest Deal Community HotUKDeals is a community for deal seekers. Find and share the best deals, promotional codes and vouchers from on and off the web.",£8.72 - CDKeys Great Deal here,2018-10-29T17:48:07Z,"{'id': None, 'name': 'Hotukdeals.com'}",103° - Xbox Live Gold 3 months £8.99 @ CDKeys,https://www.hotukdeals.com/deals/xbox-live-gold-3-months-899-cdkeys-3093535,https://images.hotukdeals.com/threads/thread_full_screen/default/3093535_1.jpg,155
732,Karthika Suresh Namboothiri,"* Dollar index near 10-week peak * Net short position in gold smallest since mid-July-CFTC * GRAPHIC-2018 asset returns: tmsnrt.rs/2jvdmXl (Recasts, adds comments and updates prices) By Karthika Suresh Namboothiri and Sethuraman N R BENGALURU, Oct 29 (Reuters… [+2732 chars]","Gold eased on Monday, sliding off a more than three-month peak in the previous session, pressured by a strong dollar and as investors returned to riskier assets following a recent sell-off in global stocks.",2018-10-29T17:53:54Z,"{'id': 'reuters', 'name': 'Reuters'}","PRECIOUS-Gold falls on stronger dollar, recovery in equities",https://www.reuters.com/article/global-precious/precious-gold-falls-on-stronger-dollar-recovery-in-equities-idUSL2N1X916S,https://s4.reutersmedia.net/resources_v2/images/rcom-default.png,293
733,Wendy Stokes,"Somewhere in the middle of New Mexico, theres buried treasures to be found. Seriously. Hundreds of people are on a real life treasure hunt, guided by Forrest Fenn, whos memoir, The Thrill of the Chase, includes a poem with 24 verses that apparently holds the … [+2428 chars]","Somewhere in the middle of New Mexico, there’s buried treasures to be found. Seriously. Hundreds of people are on a real life treasure hunt, guided by Forrest Fenn, … The post There’s A Mysterious Hidden Treasure Somewhere Outside Of Santa Fe, And The Clues A…",2018-10-29T17:54:10Z,"{'id': None, 'name': 'Thefrisky.com'}","There’s A Mysterious Hidden Treasure Somewhere Outside Of Santa Fe, And The Clues Are Super Cryptic",https://thefrisky.com/theres-a-mysterious-hidden-treasure-somewhere-outside-of-santa-fe-and-the-clues-are-super-cryptic/,https://thefrisky.com/wp-content/uploads/2018/10/Hidden-Treasure.jpg,269
734,Greg Joyce,"Nobody will dispute that Saquon Barkley has been a great talent through his first eight games in the NFL, but the Giants are also beginning to see what could have been. The what-ifs only get worse by the week. As Eli Manning and the Giants’ offense continue t… [+1871 chars]","Nobody will dispute that Saquon Barkley has been a great talent through his first eight games in the NFL, but the Giants are also beginning to see what could have been. The what-ifs only get worse by the week. As Eli Manning and the Giants’ offense continue t…",2018-10-29T17:54:25Z,"{'id': None, 'name': 'Nypost.com'}",Rookie QB class makes Giants’ nightmare worse by the week,https://nypost.com/2018/10/29/rookie-qb-class-makes-giants-nightmare-worse-by-the-week/,https://thenypost.files.wordpress.com/2018/10/jrj.jpg?quality=90&strip=all&w=1200,803
735,Chris Lee,"hard in real-life physics.""/&gt; Enlarge / Maybe you can detect a single molecule with pen and paper, but it's hard in real-life physics. 0 In science, there are results that are ho-hum and results that make everyone go ooooh. (There are also a few ho-hum res… [+5166 chars]",Single molecule’s one-part-in-a-trillion effect amplified to one part in five.,2018-10-29T17:55:23Z,"{'id': 'ars-technica', 'name': 'Ars Technica'}",Big transistor senses the arrival of a single molecule,https://arstechnica.com/science/2018/10/big-transistor-senses-the-arrival-of-a-single-molecule/,https://cdn.arstechnica.net/wp-content/uploads/2018/10/GettyImages-90738703-760x380.jpg,31
736,The Advocate,"My least and most favorite week of the entire college football season is here. Buckle up, kids, LSU is playing Alabama on Saturday, and if the week off is any indication, its bound to be a loud ride. I love LSU football, and because were only guaranteed 12 ga… [+3669 chars]","My least and most favorite week of the entire college football season is here. Buckle up, kids, LSU is playing Alabama on Saturday, and if the week off is any indication, it's bound to be a loud ride. I love LSU football, and because we're only guaranteed 12 …",2018-10-29T18:00:00Z,"{'id': None, 'name': 'Theadvocate.com'}",The 5 Stages of LSU-Alabama Game Week: Let's help you cope with this stressful week,https://www.theadvocate.com/baton_rouge/entertainment_life/article_21fd5bb6-d6d1-11e8-bdbc-5b21bf006e88.html,https://bloximages.newyork1.vip.townnews.com/theadvocate.com/content/tncms/assets/v3/editorial/e/4f/e4f391f7-c038-5495-ad6e-36311c47a6ed/581ea5d854150.image.jpg?resize=919%2C630,717
737,Andrei Frumusanu,Today OnePlus has revealed its half-generation refresh for 2018: The OnePlus 6T. This summer we thoroughly reviewed the OnePlus 6 and I was extremely impressed – ending up as being one of the best smartphones this year. The OnePlus 6T is an iterative update t… [+3995 chars],Today OnePlus has revealed its half-generation refresh for 2018: The OnePlus 6T. This summer we thoroughly reviewed the OnePlus 6 and I was extremely impressed – ending up as being one of the best smartphones this year. The OnePlus 6T is an iterative update t…,2018-10-29T18:00:00Z,"{'id': None, 'name': 'Anandtech.com'}",OnePlus Announces the OnePlus 6T,https://www.anandtech.com/show/13525/oneplus-announces-the-oneplus-6t,https://images.anandtech.com/doci/13525/2_678x452.jpg,115
738,Zach Honig,"While the new World of Hyatt Credit Card offers perks that certainly make it worth keeping around, including a free Category 1-4 night certificate each year, Discoverist status and 4 points per dollar spent at Hyatt hotels, it isn’t the most rewarding option … [+2902 chars]","While the new World of Hyatt Credit Card offers perks that certainly make it worth keeping around, including a free Category 1-4 night certificate each year, Discoverist status and 4 points per dollar spent at Hyatt hotels, it isn’t the most rewarding option …",2018-10-29T18:00:18Z,"{'id': None, 'name': 'Thepointsguy.com'}",Register for a $50 Statement Credit on Select Hyatt Card Purchases,http://thepointsguy.com/news/hyatt-card-50-statement-credit/,https://i0.wp.com/thepointsguy.com/wp-content/uploads/2018/10/hyatt-card-grocery-shopping.jpg?fit=1280%2C853px&ssl=1,120
739,Lambert Strether,"By Lambert Strether of Corrente. Patient readers, today’s Water Cooler will be randomly thin, because I was finishing up another worksheet on the midterms. Talk amongst yourselves! –lambert Politics 2020 “Hillary Clinton’s curious comments about 2020” [ Washi… [+10970 chars]","Today's Water Cooler: More or less open thread, plus National Cat Day.",2018-10-29T18:00:22Z,"{'id': None, 'name': 'Nakedcapitalism.com'}",2:00PM Water Cooler 10/29/2018,https://www.nakedcapitalism.com/2018/10/200pm-water-cooler-10-29-2018.html,https://www.nakedcapitalism.com/wp-content/uploads/2018/10/mushroom.jpg,409
740,One Mile at a Time,"In the interest of full disclosure, One Mile At A Time earns a referral bonus for anyone thats approved through some of the below links. These are the best publicly available offers that we have found for each card. Please check out our advertiser policy for … [+3189 chars]","I'm a big fan of the The World of Hyatt Credit Card, which was introduced this summer. The card has a $95 annual fee and offers all kinds of worthwhile perks. On the most basic level, the card comes with an anniversary free night certificate every year valid …",2018-10-29T18:00:40Z,"{'id': None, 'name': 'Onemileatatime.com'}",Hyatt Credit Card Offering Up To $50 In Statement Credits For Select Purchases,https://onemileatatime.com/hyatt-credit-card-statement-credit/,https://onemileatatime.com/wp-content/uploads/2018/10/Watermark-Supermarket.jpg,482
741,Karthika Suresh Namboothiri,"BENGALURU (Reuters) - Gold eased on Monday, sliding off a more than three-month peak in the previous session, pressured by a strong dollar and as investors returned to riskier assets following a recent sell-off in global stocks. Spot gold was down 0.6 percent… [+2489 chars]","Gold eased on Monday, sliding off a more than three-month peak in the previous session, pressured by a strong dollar and as investors returned to riskier assets following a recent sell-off in global stocks.",2018-10-29T18:00:50Z,"{'id': 'reuters', 'name': 'Reuters'}","Gold falls on stronger dollar, recovery in equities",https://in.reuters.com/article/metals-precious-gold/gold-falls-on-stronger-dollar-recovery-in-equities-idINKCN1N30P5,https://s3.reutersmedia.net/resources/r/?m=02&d=20181029&t=2&i=1319925236&w=1200&r=LYNXNPEE9S0KP,428
742,,"Zimbabwean gold miners reached record production levels this year but are now threatening to shut down operations as the cash-strapped Zimbabwean government has failed to avail foreign currency to cover production costs. By end of September, gold deliveries t… [+1847 chars]",Zimbabwean gold miners reached record production levels this year but are now threatening to shut down operations as the cash strapped Zimbabwean government has failed to avail foreign currency to cover production costs.,2018-10-29T18:01:18Z,"{'id': None, 'name': 'Fin24.com'}","Fin24.com | Zim gold miners threaten to shut down, despite record production",https://www.fin24.com/Economy/Africa/zim-gold-miners-threaten-to-shut-down-despite-record-production-20181029,http://cdn.24.co.za/files/Cms/General/d/6842/7af200d258c34a36a60f922e2680e74a.jpg,496
743,,"HotUKDeals Part of Pepper - The World's Largest Deal Community HotUKDeals is a community for deal seekers. Find and share the best deals, promotional codes and vouchers from on and off the web.",Wine rackhttps://www.johnlewis.com/john-lewis-partners-metal-wire-wine-rack-gold-4-bottles/p3227630Lunch baghttps://www.johnlewis.com/despicable-me-3-fluffy-the,2018-10-29T18:01:25Z,"{'id': None, 'name': 'Hotukdeals.com'}","108° - John Lewis - set 4 Bellini Glasses £5, Despicable me Lunch bag £4, Gold 4 bottle wine rack £4.50. £2 C & C to store",https://www.hotukdeals.com/deals/john-lewis-set-4-bellini-glasses-5-despicable-me-lunch-bag-4-gold-4-bottle-wine-rack-450-2-c-c-to-store-3093506,https://images.hotukdeals.com/threads/thread_full_screen/default/3093506_1.jpg,158
744,Pizza in Motion,Hyatt has made it a habit over the years of running promotions for holders of their co-branded credit card that reward members for holding the card. One of my favorites is a promotion they’ve run the past few years where cardmembers receive a rebate on award … [+2806 chars],World of Hyatt has a promotion for folks who hold their Visa card. Earn up to $50 cash back when you hit spending requirements in November and December. The post Save Up To $50 With Spending In Certain Categories On The World Of Hyatt Visa appeared first on P…,2018-10-29T18:01:32Z,"{'id': None, 'name': 'Boardingarea.com'}",Save Up To $50 With Spending In Certain Categories On The World Of Hyatt Visa,https://pizzainmotion.boardingarea.com/2018/10/29/save-up-to-50-with-spending-in-certain-categories-on-the-world-of-hyatt-visa/,https://pizzainmotion.boardingarea.com/wp-content/uploads/2018/06/World-of-Hyatt-CARD-ART.png,481
745,MEGHAN KENEALLY,"The latest mass shooting in America -- this time, at a synagogue in Pittsburgh -- has led to questions about whether or not more armed guards are needed in sensitive locations. Interested in Gun Control? Add Gun Control as an interest to stay up to date on th… [+8465 chars]",The idea is raised in the wake of many mass shootings.,2018-10-29T18:03:49Z,"{'id': 'abc-news', 'name': 'ABC News'}",Reports cast doubt on 'good guy with a gun' theory in mass shootings,https://abcnews.go.com/US/breaking-nra-backed-theory-good-guy-gun-stops/story?id=53360480,https://s.abcnews.com/images/Politics/wayne-lapierre-nra-cpac-02-gty-jc-180222_16x9_992.jpg,631
746,Press Trust of India,Muscat: India’s Akashdeep Singh was adjudged player of the tournament but the team had to share the Asian Champions Trophy with Pakistan after the much-anticipated summit clash was abandoned due to heavy downpour here. Heavy rain delayed the start of the fina… [+1941 chars],"India and Pakistan share ACT hockey title, Akashdeep named best player Kashmir Reader Muscat: India's Akashdeep Singh was adjudged player of the tournament but the team had to share the Asian Champions Trophy with Pakistan after the much-anticipated summit cl…",2018-10-29T18:04:40Z,"{'id': None, 'name': 'Kashmirreader.com'}","India and Pakistan share ACT hockey title, Akashdeep named best player - Kashmir Reader",https://kashmirreader.com/2018/10/29/india-and-pakistan-share-act-hockey-title-akashdeep-named-best-player/,https://kashmirreader.com/wp-content/uploads/2018/10/reader-200.jpg,242
747,Jessica Gibb,"The stars are out in force tonight for the Daily Mirrors Pride of Britain Awards 2018. More than 100 of our best-loved celebrities including music superstars, TV favourites, sporting legends and top politicians are walking the red carpet at Londons Grosvenor … [+3272 chars]","The stars unite to celebrate our nation’s unsung heroes at The Pride of Britain Awards, hosted by Carol Vorderman",2018-10-29T18:05:29Z,"{'id': 'mirror', 'name': 'Mirror'}",Danielle Lloyd and Michelle Heaton lead the stars dazzling in sequins on the Pride of Britain Awards 2018 red carpet,https://www.mirror.co.uk/3am/celebrity-news/danielle-lloyd-michelle-heaton-lead-13501328,https://i2-prod.mirror.co.uk/incoming/article13501698.ece/ALTERNATES/s1200/2_THe-Pride-of-Britain-Awards-2018.jpg,841
748,,"Jaime MacNaughtons future in law can be traced back to the time when she was locked in the trunk of a car, sweating inside a garbage bag. She was doing a scene for a TV pilot that ended up going nowhere. It marked the nadir of the theater majors quest to make… [+17327 chars]","Jaime MacNaughton’s future in law can be traced back to the time when she was locked in the trunk of a car, sweating inside a garbage bag. Fast-forward 15 years and Ms. MacNaughton, now a lawyer, is a key player in enforcing Montana’s strict laws against mega…",2018-10-29T18:06:24Z,"{'id': None, 'name': 'Yahoo.com'}",How Big Sky Country became the front line in a long battle over dark money,https://www.yahoo.com/news/big-sky-country-became-front-line-long-battle-180624220.html,https://s.yimg.com/os/mit/media/m/social/images/social_default_logo-1481777.png,792
749,Zack Whittaker,"Signal, regarded as the gold standard of end-to-end encrypted messaging apps, is rolling out a new feature that will further protect the identities of message senders. “While the service always needs to know where a message should be delivered, ideally it sho… [+2045 chars]","Signal, regarded as the gold standard of end-to-end encrypted messaging apps, is rolling out a new feature that will further protect the identities of message senders. “While the service always needs to know where a message should be delivered, ideally it sho…",2018-10-29T18:06:28Z,"{'id': 'techcrunch', 'name': 'TechCrunch'}",Signal rolls out a new privacy feature making it harder to know a sender’s identity,http://techcrunch.com/2018/10/29/signal-sealed-sender-feature-messaging-security/,https://techcrunch.com/wp-content/uploads/2018/10/GettyImages-597888146.jpg?w=600,1
750,David Krejca,"Market red flags are blooming Recent weeks have reminded investors that long-term systematic risks should not be underestimated. Even though recessions are a natural part of an economic cycle, investors, and particularly retail investors, are almost always su… [+5245 chars]",The current bull market has been already running for more than nine years. Shiller PE is on historical peaks. Smart money flow index indicates that in this mark,2018-10-29T18:06:41Z,"{'id': None, 'name': 'Seekingalpha.com'}",The End Of Cheap Money?,https://seekingalpha.com/article/4215507-end-cheap-money,https://static.seekingalpha.com/images/marketing_images/fed_us_government/sacl_us_economy_stock_exchange_american_flag.jpeg,347
751,Kairi Coe,"2 Chainz has been rapping about ""that gas"" longer than most rappers have been dropping bars, so it's only right he now has his own certified collection of marijuana-infused baked goods for sale. Recently, Tity Boi teamed with Green Street Agency to launch Gas… [+1616 chars]","Veteran rapper 2 Chainz announces the launch of his new marijuana brand, Gas Cannabis Co.",2018-10-29T18:10:14Z,"{'id': None, 'name': 'Xxlmag.com'}",2 Chainz Launches Premium Marijuana Brand,http://www.xxlmag.com/news/2018/10/2-chainz-gas-cannabis-co/,http://www.xxlmag.com/files/2018/09/2-Chainz.jpg?w=600&h=0&zc=1&s=0&a=t&q=89,369
752,David Harris (Razor),"CAUTION: SPOILERS We may have new casting news about the final season of Game of Thrones. Over the ever-useful Freefolk Reddit, EveryFckngChicken has directed attention towards the Spotlight CV of actor Toby Osmond. Osmond wrote something very interesting in … [+2533 chars]","CAUTION: SPOILERS We may have new casting news about the final season of Game of Thrones. Over the ever-useful Freefolk Reddit, EveryFckngChicken has directed attention towards the Spotlight CV of actor Toby Osmond. Osmond wrote something very interesting in …",2018-10-29T18:10:52Z,"{'id': None, 'name': 'Winteriscoming.net'}",Actor Toby Osmond to play a “royal role” in Game of Thrones season 8?,https://winteriscoming.net/2018/10/29/actor-toby-osmond-play-royal-role-game-thrones-season-8/,https://imagesvc.timeincapp.com/v3/fan/image?url=https://winteriscoming.net/files/2018/10/Screen-Shot-2018-10-29-at-12.31.08-PM.jpg&,527
753,"Asbury Park Press, Chris Jordan, Asbury Park Press","While accepting the award for favorite rap/hip-hop artist, Cardi B says she had to prove to people that she could make it after having a baby. USA TODAY 6ix9ine performs at Power 105.1's Powerhouse 2018 at Prudential Center on October 28, 2018 in Newark, New … [+3167 chars]","If you invite Tekashi 6ix9ine, he will come",2018-10-29T18:10:57Z,"{'id': None, 'name': 'App.com'}","Tekashi 6ix9ine surprises, Cardi B underwhelms at Powerhouse 2018 in Newark",https://www.app.com/story/entertainment/music/2018/10/29/tekashi-6-ix-9-ine-surprises-cardi-b-underwhelms-powerhouse-2018-newark/1809388002/?utm_source=google&utm_medium=amp&utm_campaign=speakable,"https://www.gannett-cdn.com/presto/2018/10/29/PAPP/873c6b12-503a-4fd4-8d38-d95d25f3db98-PowerhouseTekashi_6ix9ine_performs_at_Power_105.1s_Powerhouse_2018_Photo_by_Bennett_Raglin_Getty_Images_for_Power_105.1.jpg?crop=5183,2903,x0,y344&width=3200&height=1680&fit=bounds",829
754,Cynthia Ewer,"Peel potatoes and cut into 2-inch chunks. Place in 5- to 6-quart pan. Add water to cover, bring to a boil over high heat. Reduce heat to low. Simmer until the potatoes are very tender, about 20 to 25 minutes. Drain and return potatoes to the pan. Mash potatoe… [+335 chars]","Side Dish Recipes October 29, 2018 by Cynthia Ewer A little-known trick to calm holiday cooking stress? Make-ahead dishes for the freezer. Cooked and stored ahead of time, freezer side dishes free up time for the holiday cook. But can you get perfect creamy t…",2018-10-29T18:11:11Z,"{'id': None, 'name': 'Organizedhome.com'}",Freezer-Friendly Holiday Recipe: Garlic Mashed Potatoes,http://christmas.organizedhome.com/recipe/side-dishes/freezer-garlic-mashed-potatoes,http://christmas.organizedhome.com/sites/christmas.organizedhome.com/files/graphics/attached/recipe/freezer_garlic_mashed_potatoes.jpg,596
755,"OTC Markets Group - News, Filings & Corporate Actions",,"Get Stock & Bond Quotes, Trade Prices, Charts, Financials and Company News & Information for OTCQX, OTCQB and Pink Securities.",2018-10-29T18:11:46Z,"{'id': None, 'name': 'Otcmarkets.com'}",Idaho Champion Gold Mines Canada Inc. (GLDRF: Grey Market) | Idaho Champion Intersects 5.76 Grams Per Tonne Gold Over 12.65 Meters At The Baner Project,https://www.otcmarkets.com/stock/GLDRF/news?id=208469,,678
