,author,content,description,publishedAt,source,title,url,urlToImage,relevancy
249,"No Author, No Author","URAYASU, CHIBA PREF. Two-time Paralympic gold medalist Heinrich Popow instructed lower-limb amputees in the use of athletic prosthetics on Sunday, while advocating for the pure enjoyment of sports what he called life’s “best medicine.” The German, along with … [+2293 chars]","Two-time Paralympic gold medalist Heinrich Popow instructed lower-limb amputees in the use of athletic prosthetics on Sunday, while advocating for the pure enjoyment of sports...",2018-10-29T08:50:06Z,"{'id': None, 'name': 'Japantimes.co.jp'}","On Japan visit, Paralympic gold medalist Heinrich Popow shares life-changing ‘medicine’ of sports",https://www.japantimes.co.jp/news/2018/10/29/national/japan-visit-paralympic-gold-medalist-heinrich-popow-shares-life-changing-medicine-sports/,https://cdn.japantimes.2xx.jp/wp-content/uploads/2018/10/n-paralympian-a-20181030-870x780.jpg,742
250,ANIS SHIVANI,"Who Will Stand Up for Rad Cats Ethical Standards, and Who Will Check the FDAs Aggressive Tactics Against Raw Food Makers? It is the nature of this product to be contaminated and raw food is not consistent with the scope and values of this organization. The FD… [+17376 chars]","Who Will Stand Up for Rad Cat’s Ethical Standards, and Who Will Check the FDA’s Aggressive Tactics Against Raw Food Makers? “It is the nature of this product to be contaminated and raw food is not consistent with the scope and values of this organization. The…",2018-10-29T08:56:03Z,"{'id': None, 'name': 'Counterpunch.org'}",The Country’s Most Important Animal Raw Food Producer Has Just Been Put Out of Business by the FDA,https://www.counterpunch.org/2018/10/29/the-countrys-most-important-animal-raw-food-producer-has-just-been-put-out-of-business-by-the-fda/,https://www.counterpunch.org/wp-content/dropzone/2018/06/cp-og-logo.png,988
251,Niall Patrick Walsh,"Dublin is one of the worlds most beloved cities. The Irish capital welcomes over 5.6 million tourists every year from around the world, seeking out the citys red brick rows, cobblestone streets, and lush green parklands. Dublin has good reason for being on an… [+21797 chars]","Dublin is one of the world’s most beloved cities. The Irish capital welcomes over 5.6 million tourists every year from around the world, seeking out the city’s red brick rows, cobblestone streets, and lush green parklands.",2018-10-29T09:00:00Z,"{'id': None, 'name': 'Archdaily.com'}",An Architectural Guide to Dublin: 30 Things to See and Do in Ireland’s Capital,https://www.archdaily.com/904358/an-architectural-guide-to-dublin-30-things-to-see-and-do-in-irelands-capital,https://images.adsttc.com/media/images/5bd6/fd00/f197/ccaa/4a00/027c/large_jpg/shutterstock_1116656705.jpg?1540816099,531
252,https://facebook.com/9gag,"What can I do if someone is impersonating me on 9GAG? 9GAG takes safety seriously. If someone created posts/comments/accounts pretending to be you, you can tap continue and fill out the form. Make sure to provide all the requested info, including a photo of y… [+264 chars]","More memes, funny videos and pics on 9GAG",2018-10-29T09:00:01Z,"{'id': None, 'name': '9gag.com'}",This snake looks like a dragon in a pile of gold,https://9gag.com/gag/a5MPZxL/this-snake-looks-like-a-dragon-in-a-pile-of-gold,https://images-cdn.9gag.com/photo/a5MPZxL_700b.jpg,82
253,J. Money,"Saw this tweet from James Clear the other day and had to share it around: [This was first posted 4 months ago and STILL getting shares!] So true, right? Especially that first one? SO WHY AREN’T WE DOING THEM ALL??? ;) I’ll tell you why: it’s hard, haha… But s… [+5908 chars]","7 Habits That Have a High Rate of Return in Life Saw this tweet from James Clear the other day and had to share it around: [This was first posted 4 months ago and STILL getting shares!] So true, right? Especially that first one? SO WHY AREN’T WE DOING THEM AL…",2018-10-29T09:02:17Z,"{'id': None, 'name': 'Budgetsaresexy.com'}",7 Habits That Have a High Rate of Return in Life,http://www.budgetsaresexy.com/7-habits-that-have-a-high-rate-of-return-in-life/,http://www.budgetsaresexy.com/images/atomic-habits-book-clear.jpg,474
254,Barbara Feder Ostrov,"Janet Winston stands in her rose garden in Eureka, Calif. Testing revealed she is allergic to numerous substances, including linalool. Winston still can handle roses, which contain linalool, but she can't wear perfumes and cosmetic products that contain the c… [+8479 chars]",A California college professor never imagined that trying to figure out what was causing her rash could wind up costing so much.,2018-10-29T09:04:00Z,"{'id': None, 'name': 'Npr.org'}","Bill Of The Month: A $48,329 Allergy Test Is A Lot Of Scratch",https://www.npr.org/sections/health-shots/2018/10/29/660330047/bill-of-the-month-a-48-329-allergy-test-is-a-lot-of-scratch,https://media.npr.org/assets/img/2018/10/25/botm_oct_007_wide-3eee735f80332ed9e39b1c9b40b5af8484372ab3.jpg?s=1400,806
255,Shirish Nadkarni,"It was a day when seeds failed to sprout and hot favourites bit the dust. The rot at Sundays French Open World Tour Super 750 badminton championship finals began with the second match of the day, the mens doubles; and extended all the way to the two stellar s… [+5926 chars]","Chen Long looked much more like the all-conquering player of old, while the doughty, grimly determined Akane Yamaguchi outlasted the artistic but wayward defending champion Tai Tzu Ying. The post French Open 2018: Chen Long, Akane Yamaguchi upset fancied star…",2018-10-29T09:04:06Z,"{'id': None, 'name': 'Firstpost.com'}","French Open 2018: Chen Long, Akane Yamaguchi upset fancied stars; young Chinese upstarts win men’s doubles crown with elan",https://www.firstpost.com/sports/french-open-2018-chen-long-akane-yamaguchi-upset-fancied-stars-young-chinese-upstarts-win-mens-doubles-crown-with-elan-5465131.html,https://images.firstpost.com/wp-content/uploads/2018/10/Finals_Chen-Long.jpg,274
256,Dhwani Mehta,"Cautious tone on the European equities, fresh USD buying keeps the upside limited. Gravitates around hourly 200-SMA, all eyes on the US core inflation data The AUD/USD has reversed Fridays slide to 0.7020 on Monday, but fails to extend the recovery beyond the… [+926 chars]","Cautious tone on the European equities, fresh USD buying keeps the upside limited. Gravitates around hourly 200-SMA, all eyes on the US core inflation data The AUD/USD has reversed Fridays slide to 0.7020 on Monday, but fails to extend the recovery beyond the…",2018-10-29T09:06:49Z,"{'id': None, 'name': 'Fxstreet.com'}",AUD/USD fails to resist above 0.7100 once again,https://www.fxstreet.com/news/aud-usd-fails-to-resist-above-07100-once-again-201810290906,https://editorial.azureedge.net/images/Markets/Currencies/Majors/AUDUSD/australian-money-2249329_Large.jpg,327
257,David Watsky,"Like any medium for procrastination, there is an art to last-minute Halloween costume development and construction. Weve all been there, frantically duct taping beads to a white shirt in hopes that itll eventually look like something anything. If youre there … [+5838 chars]","Like any medium for procrastination, there is an art to last-minute Halloween costume development and construction. We’ve all been there, frantically duct taping beads to a white shirt in hopes that it’ll eventually look like something...anything. If you’re t…",2018-10-29T09:10:44Z,"{'id': None, 'name': 'Chowhound.com'}",The Best Last-Minute Food Costumes for Halloween,https://www.chowhound.com/food-news/210658/how-to-dress-up-as-food-for-halloween/,https://search.chow.com/thumbnail/1200/0/www.chowstatic.com/blog-media/2018/10/last-minute-food-costumes-for-halloween-chowhound.jpg,713
258,,,"Drama Series Based On The World Of The Wildly Popular Guy Ritchie Movie, Snatch. Much Like The Television Series, 'Fargo', Crackle Will Carry The Spirit Of The Setting In The Original Feature Film, While Creating A New World Born From The Original Movie. Info…",2018-10-29T09:12:04Z,"{'id': None, 'name': 'Tvunderground.org.ru'}",[ed2k] Snatch - Season 1 (english - BDRip),https://tvunderground.org.ru/index.php?show=episodes&sid=98330,,778
259,TJ Roberts,"Revenue for Enphase Energy ( ENPH ) is growing abroad, but the USA still accounts for 62% of the total ( as of last earnings call ). With strategic tariff-free manufacturing in the USA and a respectable 3.5% U.S. GDP just announced, Enphase and its partners, … [+14515 chars]",Enphase’s potential 800MW tariff-free SAM. AC Modules offer quickest revenue path for Enphase. Solar installers rapidly adopting AC Modules. Enphase partner Sol,2018-10-29T09:12:15Z,"{'id': None, 'name': 'Seekingalpha.com'}",Enphase Energy: Made In The USA,https://seekingalpha.com/article/4215312-enphase-energy-made-usa,https://static3.seekingalpha.com/uploads/2018/10/23/38410276-15403023705097911.png,644
260,Indiatimes,"The story of Dinesh Kumar, a boxer from Haryana has been a tale of tragedy, thanklessness, and disrespect towards a sportsperson. Dinesh Kumar has won 17 gold, 1 silver and 5 bronze medals at various national and international events and yet he sells kulfi to… [+1768 chars]","The state and this country need to answer this question that why his state Haryana and  the country he brought laurels have forsaken him for good. After sustaining an injury in a road accident, his father had to borrow money for his treatment. This came when …",2018-10-29T09:13:42Z,"{'id': 'the-times-of-india', 'name': 'The Times of India'}","Despite Winning 17 Golds, 1 Silver, 5 Bronze For The Country, This Boxer Is Forced To Sell Kulfis For A Living",https://www.indiatimes.com/news/india/despite-winning-17-golds-1-silver-5-bronze-for-the-country-this-boxer-is-forced-to-sell-kulfis-for-a-living-355654.html,https://media.indiatimes.in/media/facebook/2018/Oct/dinesh_kumar_boxer_1540805840_800x420.jpg,757
261,,"Janet Winston had a rash that wouldn't go away. The English professor from Eureka, Calif., always had been sensitive to ingredients in skin creams and cosmetics. This time, however, the antifungal cream she was prescribed to treat her persistent rash seemed t… [+14804 chars]","WJCT NEWS Bill Of The Month: A $48329 Allergy Test Is A Lot Of Scratch WJCT NEWS Janet Winston had a rash that wouldn't go away. The English professor from Eureka, Calif., always had been sensitive to ingredients in skin creams and cosmetics. This time, howev…",2018-10-29T09:13:48Z,"{'id': None, 'name': 'Wjct.org'}",Bill Of The Month: A $48329 Allergy Test Is A Lot Of Scratch - WJCT NEWS,http://news.wjct.org/post/bill-month-48329-allergy-test-lot-scratch,http://mediad.publicbroadcasting.net/p/shared/npr/styles/medium/nprshared/201810/660734487.jpg,721
262,"Sandra Schraff, Yu Sun, Andres Orthaber, Frank D. Pammer","Abstract Gold(I) chloride complexes of arylisocyanides derived from 9benzylidene9Hfluorene (Flu), 5benzylidene1,2,3,4tetra¬phenylcyclopentadiene (TPCp), and 5benzylidene5Hdibenzo¬[a,d]cycloheptene (Dbs) have been prepared, and the crystal structures and elect… [+360 chars]","Gold(I) chloride complexes of aryl‐isocyanides derived from 9‐benzylidene‐9H‐fluorene (Flu), 5‐benzylidene‐1,2,3,4‐tetra¬phenyl‐cyclopentadiene (TPCp), and 5‐benzylidene‐5H‐dibenzo¬[a,d]cyclo‐heptene (Dbs) have been prepared, and the crystal structures and el…",2018-10-29T09:13:49Z,"{'id': None, 'name': 'Wiley.com'}",Gold(I) Complexes of Fulvenyl‐functionalized Arylisocyanides,https://onlinelibrary.wiley.com/doi/abs/10.1002/ejic.201801031?af=R,,305
263,"Yufeng Wu, Tian Bing, Sina Witzel, Hongming Jin, Xianhai Tian, Matthias Rudolph, Frank Rominger, A. Stephen K. Hashmi","As a service to our authors and readers, this journal provides supporting information supplied by the authors. Such materials are peer reviewed and may be reorganized for online delivery, but are not copyedited or typeset. Technical support issues arising fro… [+325 chars]",The chemoselective cyclization of isocyanates with 2H‐azirine was achieved with AuBr3 as catalyst. This transfer sets the stage for the synthesis of aromatic oxazol‐ureas in a tandem process. The addition of a catalytic amount of phosphite enhances the proces…,2018-10-29T09:14:49Z,"{'id': None, 'name': 'Wiley.com'}",AuBr3‐Catalyzed Chemoselective Annulation of Isocyanates with 2H‐Azirine,https://onlinelibrary.wiley.com/doi/abs/10.1002/chem.201804765?af=R,,132
264,,"Janet Winston had a rash that wouldn't go away. The English professor from Eureka, Calif., always had been sensitive to ingredients in skin creams and cosmetics. This time, however, the antifungal cream she was prescribed to treat her persistent rash seemed t… [+8272 chars]","KPBS Bill Of The Month: A $48329 Allergy Test Is A Lot Of Scratch KPBS Janet Winston had a rash that wouldn't go away. The English professor from Eureka, Calif., always had been sensitive to ingredients in skin creams and cosmetics. This time, however, the an…",2018-10-29T09:17:54Z,"{'id': None, 'name': 'Kpbs.org'}",Bill Of The Month: A $48329 Allergy Test Is A Lot Of Scratch - KPBS,https://www.kpbs.org/news/2018/oct/29/bill-of-the-month-a-48329-allergy-test-is-a-lot/,https://kpbs.media.clients.ellingtoncms.com/assets/img/2018/10/25/botm_oct_007_wide-3eee735f80332ed9e39b1c9b40b5af8484372ab3.jpg,604
265,https://www.facebook.com/DailyMail,The 21-year-old was whipped along with her boyfriend before crowds for being caught in 'close proximity' to each other. The archaic public humiliation took place today in the city of Banda Aceh where Sharia law is strictly observed and enforced. People are fl… [+3282 chars],The 21-year-old (pictured) was whipped along with her boyfriend before crowds as they were deemed to have been in 'close proximity' to each other. The punishment took place in Banda Aceh.,2018-10-29T09:18:49Z,"{'id': 'daily-mail', 'name': 'Daily Mail'}",Young woman caned in public under Sharia law for being close to her boyfriend in Indonesia,https://www.dailymail.co.uk/news/article-6328243/Young-woman-caned-public-Sharia-law-close-boyfriend-Indonesia.html,https://i.dailymail.co.uk/1s/2018/10/29/08/5524930-0-image-a-24_1540802250311.jpg,820
266,,"Amazon has now announced a one-day Digital Day sale wherein it is offering a slew of its devices and services at discounted rates. The one-day sale will be on October 30 i.e., tomorrow, and it will include offers and deals on products from Amazon Pay, Gift Ca… [+2872 chars]","Amazon is offering 30 percent off on Echo range, Fire TV, and Kindle e-readers, and is offering up to 80 percent cashback on purchase of e-books from the store.",2018-10-29T09:28:19Z,"{'id': None, 'name': 'Ndtv.com'}","Amazon Digital Day on October 30: Deals on Echo and Kindle Devices, Cashbacks & More",https://gadgets.ndtv.com/internet/news/amazon-digital-day-october-30-echo-kindle-pay-prime-video-music-deals-1939259,https://i.gadgets360cdn.com/large/amazondigitalday_main_1540805220275.jpg,582
267,"Minna Räisänen, Eeva Heliövaara, Feda’a Al-Qaisi, Mikko Muuronen, Aleksi Eronen, Henri Liljeqvist, Martin Nieger, Marianna Kemell, Karina Moslova, Jani Hämäläinen, Kalle Lagerblom, Timo Juhani Repo","As a service to our authors and readers, this journal provides supporting information supplied by the authors. Such materials are peer reviewed and may be reorganized for online delivery, but are not copyedited or typeset. Technical support issues arising fro… [+325 chars]",Dissolution of elemental Au in organic solutions is a contemporary approach to lower environmental burden related to gold recycling. Here we describe fundamental studies on a highly efficient method for dissolution of elemental Au which is based on DMF soluti…,2018-10-29T09:29:22Z,"{'id': None, 'name': 'Wiley.com'}",Pyridinethiol‐Assisted Dissolution of Elemental Gold in Organic Solutions,https://onlinelibrary.wiley.com/doi/abs/10.1002/anie.201810447?af=R&,,67
268,Angela Cochran,"Once seen as the gateway to full open access (OA), hybrid journals have either been wildly successful or a total failure. A hybrid journal is when authors can publish a paper in a subscription journal and choose to make it OA, typically by paying an article p… [+11797 chars]",Mixing subscription content and open access content in hybrid journals has done little to accelerate the flip from subscription to OA. Angela Cochran explores the creation of mirror journals to comply with new OA mandates and supply a more sustainable model f…,2018-10-29T09:30:12Z,"{'id': None, 'name': 'Sspnet.org'}",Are Mirror Journals a Better Path to the Open Access Flip?,https://scholarlykitchen.sspnet.org/2018/10/29/are-mirror-journals-a-better-path-to-the-open-access-flip/,https://scholarlykitchen.sspnet.org/wp-content/uploads/2018/10/iStock-912712992.jpg,796
269,Gerard Lye,"The first ever paultan.org Premium Auto Car Expo (PACE), powered by Petron Blaze 100 Euro 4M, takes place this weekend, and Wheelcorp Premium is offering you a chance to capitalise on attractive deals on BMW Premium Selection vehicles. Be spoilt for choice wi… [+2854 chars]","The first ever paultan.org Premium Auto Car Expo (PACE), powered by Petron Blaze 100 Euro 4M, takes place this weekend, and Wheelcorp Premium is offering you a chance to capitalise on attractive deals on BMW […] The post paultan.org PACE 2018 – find the best …",2018-10-29T09:42:54Z,"{'id': None, 'name': 'Paultan.org'}","paultan.org PACE 2018 – find the best deals on BMW Premium Selection cars, prices start from RM65,000",https://paultan.org/2018/10/29/paultan-org-pace-2018-find-the-best-deals-on-bmw-premium-selection-cars-prices-start-from-rm65000/,https://s2.paultan.org/image/2018/10/PT_PACE_1200x628_BMW-XSeries-1200x628.jpg,346
270,"Gabe Zaldivar, Contributor, Gabe Zaldivar, Contributor https://www.forbes.com/sites/gabezaldivar/","You might not know it from a glance of the standings, but LeBron James is having a particularly promising start to the season. LeBron James #23 of the Los Angeles Lakers is lighting it up to start the season. (Photo by Christian Petersen/Getty Images) The Lak… [+4997 chars]",The numbers suggest LeBron James will be just fine with the L.A. Lakers.,2018-10-29T09:45:00Z,"{'id': None, 'name': 'Forbes.com'}",LeBron James Is Already Having A Special Kind Of Season,https://www.forbes.com/sites/gabezaldivar/2018/10/29/lebron-james-is-already-having-a-special-kind-of-season/,https://thumbor.forbes.com/thumbor/600x315/https%3A%2F%2Fblogs-images.forbes.com%2Fthumbnails%2Fblog_3807%2Fpt_3807_1377_o.jpg%3Ft%3D1540806302,144
271,,"The breathtaking 911 Turbo S that Porsche built almost entirely from its own spare parts catalogue has just sold for over $3 million. Built to highlight the ridiculous breadth of spares Porsche carries for the 993-era 911, it created unprecedented demand with… [+1362 chars]","Car Throttle Porsche's 'Brand New' 993 Turbo S Just Sold For $3.1m Car Throttle Demand for as-new retro Porsches really couldn't be higher, and this stunning one-off, air-cooled, twin-turbo 993 Turbo S has sold for silly money. Remind me later. Share Tweet Em…",2018-10-29T09:48:02Z,"{'id': None, 'name': 'Carthrottle.com'}",Porsche's 'Brand New' 993 Turbo S Just Sold For $3.1m - Car Throttle,https://www.carthrottle.com/post/porsches-brand-new-993-turbo-s-just-sold-for-31m/,https://images.cdn.circlesix.co/image/2/1200/630/5/uploads/posts/2018/10/65630c45c9e6a8fa1fb935fcbcc1743f.jpg,71
272,Reported by : Agencies,"Image Source : ANI IMAGE Dinesh Kumar: Arjuna Awardee, Asian Games medallist boxer forced to sell kulfi to make ends meet For most of his short-lived boxing career, representing India at national and international levels was Dinesh Kumar's perfect definition … [+1875 chars]","India TV Arjuna awardee, Asian Games medallist boxer forced to sell kulfi to make ends meet India TV Dinesh Kumar: Arjuna Awardee, Asian Games medallist boxer forced to sell kulfi to make ends meet. For most of his short-lived boxing career, representing Indi…",2018-10-29T09:48:56Z,"{'id': None, 'name': 'Indiatvnews.com'}","Arjuna awardee, Asian Games medallist boxer forced to sell kulfi to make ends meet - India TV",https://www.indiatvnews.com/sports/other-arjuna-awardee-asian-games-medallist-boxer-forced-to-sell-kulfi-to-make-ends-meet-477113,https://resize.indiatvnews.com/en/resize/newbucket/715_-/2018/10/dineshboxing-ani-1540806390.jpg,244
273,PTI,"New Delhi: Divij Sharan on Monday became India's new number one doubles player, overtaking veteran Rohan Bopanna by moving to 38 in the latest ATP rankings. The left-handed Sharan, who has been one of the most consistent players on the doubles circuit with pa… [+1879 chars]","News18 Divij Sharan is the New Number One Doubles Player of India News18 New Delhi: Divij Sharan on Monday became India's new number one doubles player, overtaking veteran Rohan Bopanna by moving to 38 in the latest ATP rankings. The left-handed Sharan, who h…",2018-10-29T09:48:58Z,"{'id': None, 'name': 'News18.com'}",Divij Sharan is the New Number One Doubles Player of India - News18,https://www.news18.com/news/sports/divij-sharan-is-new-number-one-doubles-player-of-india-1923411.html,https://images.news18.com/ibnlive/uploads/2018/08/Rohan-Bopann-Divij-Sharan-Asian-Games-2.jpg,364
274,Helen Reid,LONDON (Reuters) - Concern over China’s slowing economy dented U.S. stock futures and kept world stocks under pressure on Monday although European shares climbed thanks to encouraging earnings reports and relief that Italy dodged a ratings downgrade. The euro… [+3804 chars],Concern over China’s slowing economy dented U.S. stock futures and kept world stocks under pressure on Monday although European shares climbed thanks to encouraging earnings reports and relief that Italy dodged a ratings downgrade.,2018-10-29T09:49:33Z,"{'id': 'reuters', 'name': 'Reuters'}","GLOBAL MARKETS-European stocks bounce back on Italy relief, China growth worries linger",https://www.reuters.com/article/us-global-markets/european-stocks-bounce-back-on-italy-relief-china-growth-worries-linger-idUSKCN1N20W1,https://s4.reutersmedia.net/resources/r/?m=02&d=20181029&t=2&i=1319831159&w=1200&r=LYNXNPEE9S0UU,722
275,ABP News Bureau,"New Delhi: An Asian Games silver medallist in boxing, a 17-time gold medal winner and national level boxing champion, Dinesh Kumar, is now forced to sell kulfi (a kind of ice cream) on the streets of Haryana to earn his livelihood. In a most heartbreaking sto… [+1048 chars]","ABP Live Why a National level boxer was forced sell kulfi for living; Eye-watering tale of Dinesh Kumar ABP Live New Delhi: An Asian Games silver medallist in boxing, a 17-time gold medal winner and national level boxing champion, Dinesh Kumar, is now forced …",2018-10-29T09:50:13Z,"{'id': None, 'name': 'Abplive.in'}",Why a National level boxer was forced sell kulfi for living; Eye-watering tale of Dinesh Kumar - ABP Live,https://www.abplive.in/india-news/why-a-national-level-boxer-was-forced-sell-kulfi-for-living-eye-watering-tale-of-dinesh-kumar-773957,http://images.abplive.in/fbimg.php?url=https://static.abplive.in/wp-content/uploads/2018/10/29151404/Capture.jpg&dimension=600:315&action=resize&convertTo=jpeg,205
276,Brent Swancer,"Mysterious disappearances and deaths never cease to amaze. We are often left with strange clues and circumstances, scrambling for answers that may never come. In the rather formidable files of unexplained crimes we have countless such cases, which have turned… [+9226 chars]","Mysterious disappearances and deaths never cease to amaze. We are often left with strange clues and circumstances, scrambling for answers that may never come. In the rather formidable files of unexplained crimes we have countless such cases, which have turned…",2018-10-29T09:51:04Z,"{'id': None, 'name': 'Mysteriousuniverse.org'}",The Weird Unexplained Death of Blair Adams,https://mysteriousuniverse.org/2018/10/the-weird-unexplained-death-of-blair-adams/,https://mysteriousuniverse.org/wp-content/uploads/2018/10/i-was-assaulted-on-the-street-but-i-still-walk-home-alone-at-night-408-1428519902.jpg,401
277,,Bollywood Women Power! The 20th Jio MAMI Mumbai Film Festival and Oxfam India co-hosted the 'Women in Film' brunch to celebrate gender equality in cinema and women's movement in the industry to fight harassment in the workplace. The ladies present at the even… [+1057 chars],"Bollywood Women Power! | Look, who turned up for the MAMI brunch",2018-10-29T09:51:06Z,"{'id': None, 'name': 'Rediff.com'}","Look, who turned up for the MAMI brunch",http://www.rediff.com/movies/report/look-who-turned-up-for-the-mami-brunch/20181029.htm,http://im.rediff.com/movies/2018/oct/29oxfam-mami-women-in-film-brunch5.jpg,925
278,https://www.dailymail.co.uk/home/search.html?s=&authornamef=Reuters,"By Helen Reid LONDON, Oct 29 (Reuters) - Concern over China´s slowing economy dented U.S. stock futures and kept world stocks under pressure on Monday although European shares climbed thanks to encouraging earnings reports and relief that Italy dodged a ratin… [+3618 chars]","By Helen ReidLONDON, Oct 29 (Reuters) - Concern over China´s slowing  economy dented U.S. stock futures and kept world stocks under  pressure on Monday...",2018-10-29T09:53:29Z,"{'id': 'daily-mail', 'name': 'Daily Mail'}","European stocks bounce back on Italy relief, China...",https://www.dailymail.co.uk/wires/reuters/article-6328507/European-stocks-bounce-Italy-relief-China-growth-worries-linger.html,https://i.dailymail.co.uk/i/pix/m_logo_636x382px.png,813
