publish_datetime,content,href,publish_timestr,summarize,title
2019-01-08,"NEW YORK (Reuters) - An index of world stocks rose for the third straight session on Tuesday, with investors hopeful that the United States and China would strike a deal to end their months-long trade war that has hurt sentiment in financial markets. Increased risk appetite helped lift U.S. Treasury yields, while the dollar, which hit an 11-week low on Monday, rebounded as the euro weakened on concerns about a slowdown in the euro zone economy. Tuesday’s advance for stocks added to gains logged over the past two sessions following last week’s strong U.S. employment  report and comments from the Federal Reserve chief that calmed worries that interest rate hikes would hurt growth. Trade and concerns over slowing economic growth triggered a selloff at the end of 2018 that culminated in Wall Street posting its worst monthly performance in about a decade in December, driving down earnings estimates and stock valuations. On Tuesday, MSCI’s world equity index .MIWD00000PUS, which tracks shares in 47 countries, rose 0.62 percent to a more than three-week high. The United States and China will continue trade talks in Beijing for an unscheduled third day, a member of the U.S. delegation said on Tuesday. Trade talks this week in Beijing are the first face-to-face discussions since U.S. President Donald Trump and Chinese President Xi Jinping agreed in December to a 90-day truce in their trade war. Trump, in a post on Twitter on Tuesday, reiterated his recent statement that the talks with China were going well but gave no details. “You’re seeing some negotiations happen and the market is starting to think that perhaps we’ll start to see a framework evolve,” said Anik Sen, global head of equities at PineBridge Investments. The recent stocks rally has lifted the S&P 500 .SPX by about 9 percent from 20-month lows hit around Christmas. On Tuesday, the Dow Jones Industrial Average .DJI rose 241.31 points, or 1.03 percent, to 23,772.66, the S&P 500 .SPX gained 20.55 points, or 0.81 percent, to 2,570.24 and the Nasdaq Composite .IXIC added 63.63 points, or 0.93 percent, to 6,887.10. European shares hit a three-week high in a broad-based rebound on hopes of a possible trade deal between China and the United States. The pan-European STOXX 600 index  closed up 0.87 percent.  U.S. Treasury yields climbed, in line with higher U.S. stocks, on improved risk appetite and as the Treasury Department sold $38 billion in three-year notes to relatively soft demand. Benchmark 10-year notes US10YT=RR fell 8/32 in price to yield 2.7101 percent, up from 2.682 percent on Monday. The dollar rose against the euro as investors focused on the risk of a euro zone recession after data showed more signs of slowing in the region. The euro was 0.3 lower against the greenback. “The euro had its upturn halted by German data showing the third decline in as many months in a gauge of factory growth,” said Joe Manimbo, senior market analyst at Western Union Business Solutions in Washington. The improved appetite for risk and the stronger dollar weighed on gold prices. Spot gold XAU= slipped 0.3 percent to $1,284.71 per ounce.         Oil prices extended gains, supported by hopes that the U.S.-China trade talks might defuse the trade dispute, while OPEC-led supply cuts also tightened markets. Brent crude LCOc1 futures rose $1.39 to settle at $58.72 a barrel, a 2.4 percent gain. U.S. West Texas Intermediate (WTI) crude CLc1 futures rose $1.26 to settle at $49.78 a barrel, a 2.6 percent gain. Reporting by Saqib Iqbal Ahmed; Additional reporting by Gertrude Chavez-Dreyfuss in New York and Sruthi Shankar in Bangalore; Editing by Dan Grebler",https://uk.reuters.com/article/global-markets/global-markets-stocks-rise-on-u-s-china-trade-talk-hopes-idUKL1N1Z81BB,08 Jan 2019,"An index of world stocks rose
for the third straight session on Tuesday, with investors
hopeful that the United States and China would strike a deal to
end their months-long trade war that has hurt sentiment in
financial markets.",GLOBAL MARKETS-Stocks rise on U.S.-China trade talk hopes
2019-01-08,"(Corrects information on Permian holdings to 2.5 million from 1.4 million acres in final paragraph) Jan 7 (Reuters) - U.S. oil and gas producer Occidental Petroleum Corp said on Monday it expects to spend $4.4 billion to $5.3 billion this year, depending on the price of crude oil. Houston-based Oxy spent around $5 billion in 2018. The company is one of the largest producers in the Permian Basin, the biggest U.S. oil field, and made the spending announcements Monday at the Goldman Sachs Global Energy Conference. U.S. producers are under pressure from investors to rein in expenses, improve profits and return money to shareholders through dividends or share buybacks. Oxy noted in its presentation that even at a price of $40 per barrel it could maintain its dividend, keep its production level steady and not outspend its cash flow. It also said it would complete a $2 billion share repurchase program this year. At $50 crude oil, Oxy would maintain its dividend and grow oil and gas production 5 to 8 percent. Its highest 2019 oil price scenario was $60 per barrel and included spending $5 billion to $5.3 billion and boosting production 11 to 13 percent. The U.S. benchmark crude oil peaked last year at $76 per barrel but has fallen since. On Monday, West Texas Intermediate crude futures rose 56 cents to settle at $48.52 a barrel, a 1.17 percent gain. Oxy holds 2.5 million acres in the Permian Basin, the heart of the shale boom. Oxy also has assets in Columbia, Oman and Qatar, as well as midstream and chemicals businesses. (Reporting by Jennifer Hiller in Houston and Arundhati Sarkar in Bengaluru; Editing by Maju Samuel and James Dalgleish)",https://uk.reuters.com/article/occidental-capex/corrected-update-1-occidental-petroleum-sees-2019-capex-range-of-4-4-bln-5-3-bln-idUKL3N1Z75DW,08 Jan 2019,"U.S. oil and gas producer Occidental
Petroleum Corp said on Monday it expects to spend $4.4
billion to $5.3 billion this year, depending on the price of
crude oil.",CORRECTED-UPDATE 1-Occidental Petroleum sees 2019 capex range of $4.4 bln-$5.3 bln
2019-01-08,"LONDON (Reuters) - An oil trading executive was arrested on suspicion of throwing two Chihuahua dogs off a second floor balcony, a police report showed. Jerald Jeske, 51, a lawyer and head of compliance in North America for Geneva-based Mercuria Energy Group, was detained in Chicago on an accusation of aggravated cruelty to animals,  The police report, emailed to Reuters on Tuesday, said officers responded to a domestic battery call on Christmas Eve in which the victim said Jeske threw the two pets off the balcony. He was released two days later. “The 17-year-old Chihuahua passed away on the scene,” the report said, adding the fate of the second dog was unknown.  Mercuria, one of the world’s biggest energy trading firms, declined to comment on Jeske’s current employment status. But a spokesman said the firm had zero tolerance for any type of violence by employees, whether in the workplace or elsewhere. Jeske did not immediately respond to a request for comment.  Reporting By Julia Payne; Editing by Andrew Cawthorne",https://uk.reuters.com/article/executive-chihuahua/oil-executive-arrested-for-throwing-chihuahuas-off-balcony-idUKL8N1Z84G1,08 Jan 2019,"An oil trading executive was
arrested on suspicion of throwing two Chihuahua dogs off a
second floor balcony, a police report showed.",Oil executive arrested for throwing Chihuahuas off balcony
2019-01-08,"NEW DELHI, Jan 8 (Reuters) - India has begun paying Iran for oil in rupees, a senior bank official said on Tuesday, the first such payments since the United States imposed new sanctions against Tehran in November. Washington gave a six-month waiver to eight countries, including India, allowing them to import some Iranian oil. India, the world’s third biggest oil importer, wants to continue buying oil from Iran as it offers free shipping and an extended credit period, while Iran will use the rupee funds to mostly pay for imports from India. “Today we received a good amount from some oil companies,” Charan Singh, executive director at state-owned UCO Bank told Reuters. He did not disclose the names of refiners or how much had been deposited. New Delhi recently issued a notification exempting payments to the National Iranian Oil Co (NIOC) for crude oil imports from steep withholding taxes, enabling refiners to clear an estimated $1.5 billion in dues. An industry source said India’s top refiner Indian Oil Corp and Mangalore Refinery & Petrochemicals have made payments for Iranian oil imports. Neither was immediately available for comment. Iran is devising payment mechanisms including barter with trading partners like India, China and Russia following a delay in the setting up of a European Union-led special purpose vehicle to facilitate trade with Tehran, its foreign minister Javad Zarif said earlier on Tuesday. In the previous round of U.S. sanctions, India settled 45 percent of oil payments in rupees and the remainder in euros but this time it has signed deal with Iran to make all payments in rupees as New Delhi wants to fix its trade balance with Tehran. Indian imports from Iran totalled about $11 billion between April and November, with oil accounting for about 90 percent. Singh said Indian refiners had previously made payments to 15 banks, but they will now be making deposits into the accounts of only 9 Iranian lenders as one had since closed and the U.S has imposed secondary sanctions on five others. The nine banks are Saman Bank Corp., Bank Pasargad, Bank Eghtesad Novin, Karafarin Bank, Bank Samayeh, Middle East Bank, City Bank, Bank Hekmat Iranian, and Tourism Bank. (Reporting by Nidhi Verma Editing by Euan Rocha and Alexander Smith)",https://uk.reuters.com/article/india-iran-payment/exclusive-indian-refiners-pay-for-iranian-oil-in-rupees-uco-bank-executive-idUKL3N1Z842E,08 Jan 2019,"India has begun paying Iran for
oil in rupees, a senior bank official said on Tuesday, the first
such payments since the United States imposed new sanctions
against Tehran in November.",EXCLUSIVE-Indian refiners pay for Iranian oil in rupees - UCO Bank executive
2019-01-08,"WASHINGTON, Jan 8 (Reuters) - The nascent U.S. liquefied natural gas export industry has been particularly vulnerable to the U.S.-China trade war, the head of the American Petroleum Institute industry group said on Tuesday, adding that he hopes negotiators will soon resolve the dispute. Mike Sommers, the president and CEO of the American Petroleum Institute, told reporters an escalating trade dispute could harm U.S. LNG producers, as other countries move in to fill any gap. “This is a leadership vacuum that will be filled by many of the United States’ opponents,” Sommers told reporters in a teleconference about LNG from other countries filling China’s needs if the fuel does not come from the United States. The United States is the world’s fastest-growing exporter of LNG. China, the fastest-growing importer, bought about 15 percent of U.S. LNG exports in 2017, worth about $447 million. Through much of 2018, China was on track to buy just 10 percent of the exports. President Donald Trump imposed tariffs on hundreds of billions of dollars of Chinese imports last year and threatened to pressure Beijing more to change its practices on issues ranging from industrial subsidies to intellectual property and hacking. China has retaliated with its own tariffs. The trade dispute has also roiled crude oil markets since last year on worries it could harm consumer demand. Oil prices rose on Tuesday on hopes for successful negotiations. Sommers said countries that elbow their way in to supply LNG to China may not produce the fuel as environmentally responsibly as U.S. companies and in some cases they may be countries that are not favorable to Washington’s foreign policy. He did not mention any other countries but the United States has competed with Russia for LNG markets. “A lot of times energy is used as a club by rogue nations and I think (the United States) has proven itself to be a reliable supplier,” he said. Sommers said the API was encouraged that the United States and China, the world’s two largest economies, were having trade talks in Beijing that will continue for an unscheduled third day, as they look to resolve the dispute. Last month Trump and Chinese President Xi Jinping agreed to a 90-day freeze on new tariffs to advance trade talks, declaring a truce following months of escalating tensions. U.S. companies proposing new LNG export terminals, including Liquefied Natural Gas Ltd, have been hoping the agreement could help advance their projects. (Reporting by Timothy Gardner; Editing by David Gregorio)",https://uk.reuters.com/article/usa-trade-china-lng/u-s-lng-producers-face-risk-unless-trade-war-resolved-energy-group-idUKL1N1Z8119,08 Jan 2019,"The nascent U.S. liquefied
natural gas export industry has been particularly vulnerable to
the U.S.-China trade war, the head of the American Petroleum
Institute industry group said on Tuesday, adding that he hopes
negotiators will soon resolve the dispute.",U.S. LNG producers face risk unless trade war resolved -energy group
2019-01-08,"(Updates prices, adds details) * Dollar ticks up, euro hit by weak German data * Yields rise as trade deal optimism boosts risk sentiment * Oil prices up on trade talk hopes, OPEC cuts By Saqib Iqbal Ahmed NEW YORK, Jan 8 (Reuters) - An index of world stocks rose for the third straight session on Tuesday, lifted by hopes that the United States and China would strike a deal to end their months-long trade war that has hurt sentiment in financial markets. Increased risk appetite helped lift U.S. Treasury yields, while the dollar, which hit an 11-week low on Monday, rebounded as the euro weakened on concerns about a slowdown in the euro zone economy. Tuesday’s advance for stocks added to gains logged over the past two sessions following last week’s strong U.S. employment report and comments from the Federal Reserve chief that calmed worries that interest rate hikes would hurt growth. Trade and concerns over slowing economic growth triggered a selloff at the end of 2018 that culminated in Wall Street posting its worst monthly performance in about a decade in December, driving down earnings estimate and stock valuations. On Tuesday, MSCI’s world equity index, which tracks shares in 47 countries, rose 0.48 percent to a more than three-week high. The United States and China will continue trade talks in Beijing for an unscheduled third day, a member of the U.S. delegation said on Tuesday. The meetings this week are the first face-to-face talks since U.S. President Donald Trump and Chinese President Xi Jinping agreed in December to a 90-day truce in their trade war. Trump, in a post on Twitter on Tuesday, reiterated his recent statement that the talks with China were going well but gave no details. “With the U.S. and China in talks to de-escalate their trade conflict, the central bank showing a willingness to slow its tightening cycle and the economy still performing well, the markets may be looking a little more attractive,” Craig Erlam, senior market analyst at Oanda in London, wrote in a note. On Wall Street, the Dow Jones Industrial Average rose 203.87 points, or 0.87 percent, to 23,735.22, the S&P 500 gained 15.45 points, or 0.61 percent, to 2,565.14 and the Nasdaq Composite added 42.77 points, or 0.63 percent, to 6,866.24. European shares hit a three-week high in a broad-based rebound on hopes of a possible trade deal between China and the United States. The pan-European STOXX 600 rose 0.87 percent. U.S. Treasury yields rose for a third day, in line with higher U.S. stocks, on improved risk appetite, while the Treasury Department also prepared to sell new supply. Benchmark 10-year notes fell 7/32 in price on Tuesday to yield 2.705 percent, up from 2.682 percent on Monday. The dollar rose against the euro as investors focused on the risk of a euro zone recession after data showed more signs of slowing in the region. The euro was 0.27 lower against the greenback. “The euro had its upturn halted by German data showing the third decline in as many months in a gauge of factory growth,” said Joe Manimbo, senior market analyst at Western Union Business Solutions in Washington. The improved appetite for risk and the stronger dollar weighed on gold prices. Spot gold slipped 0.35 percent to $1,284.1 per ounce. Oil prices extended gains, supported by hopes that the U.S.-China trade talks might defuse the trade dispute, while OPEC-led supply cuts also tightened markets. Brent crude futures were up $1.29, or 2.25 percent, to $58.62 per barrel. U.S. West Texas Intermediate (WTI) crude oil futures climbed $1.2, or 2.47 percent, to $49.72 per barrel. Reporting by Saqib Iqbal Ahmed; Additional reporting by
Gertrude Chavez-Dreyfuss in New York and Sruthi Shankar in
Bangalore; Editing by Dan Grebler",https://uk.reuters.com/article/global-markets/global-markets-stocks-extend-gains-on-u-s-china-trade-talk-hopes-idUKL1N1Z810I,08 Jan 2019,"An index of world stocks rose
for the third straight session on Tuesday, lifted by hopes that
the United States and China would strike a deal to end their
months-long trade war that has hurt sentiment in financial
markets.",GLOBAL MARKETS-Stocks extend gains on U.S.-China trade talk hopes
2019-01-08,"SEATTLE, Jan 8 (Thomson Reuters Foundation) - On a recent winter beach walk, Washington state Governor Jay Inslee’s 5-year-old grandson beamed with delight as he spotted a crab. Protecting such moments of connection with nature are one of the motivations driving Inslee to consider running for the U.S. presidency, with action on climate change as his major campaign platform. “That type of experience in nature is what is so threatened and I want my grandkids to continue to have those experiences,” Inslee told the Thomson Reuters Foundation in a telephone interview. The Washington Democrat, from one of the country’s greenest-leaning states, would likely face a tough uphill climb to the presidency, and plenty of analysts are skeptical of his chances to win the Democratic nomination, much less the Oval Office. But Inslee, 67, believes fighting climate change should be the top priority for the White House - a dramatic shift from the views of the current occupant, who has called global warming a hoax and plans to withdraw the U.S. from the Paris Agreement on climate change. “It requires a concerted national will and the political capital of the President of the United States to put their shoulder to this wheel,” he said. “We have to do climate first.” A host of Democratic challengers to Republican President Donald Trump are expected to join the political fray this year, from U.S. Sen. Elizabeth Warren of Massachusetts to former Vice President Joe Biden. How much any of them would make action on climate change a priority in a new Democratic administration remains unclear. But Inslee believes there is an economic as well as environmental case for embarking on a “Green New Deal” that would transition the U.S. economy off fossil fuels and toward cleaner, renewable power. He likens such a change to other major historical shifts, from the United States’ build up of World War Two industrial might to the research and development program behind the Apollo space program that landed Americans on the moon. “We have to change our economy so it does not run on oil and diesel and instead runs on clean energy,” Inslee said. “That is the largest economic transition perhaps in human history, since we went from pulling a travois to having a wheel.” If done well, the governor said, decarbonizing the U.S. economy could spark plenty of new jobs in emerging clean energy industries, a view he outlined in his 2007 book Apollo’s Fire. “The number one job growth rate in America today is for solar installer and number two is for wind maintenance engineer,” he said. “These jobs are growing twice as fast as the rest of the economy.” Inslee sees his state, which he has governed since 2012, as a model of combined environmentally-friendly legislation and strong economic growth. In recent years, Washington has reviewed its energy portfolio to boost renewables and encouraged cities and towns to buy electric buses. The state has also installed a network of electric vehicle charging stations and seeded a clean energy research and development fund. Home to major companies such as Amazon.com, Microsoft and Starbucks, Washington state had the strongest economy in the United States last year, according to an analysis of 28 indicators by personal finance website WalletHub. In the current state legislative session, Inslee is pushing for 100 percent clean electricity statewide by 2045 and a clean fuel standard in line with other West Coast states. But efforts to put in place carbon pricing in the state have failed three times under his watch. Inslee has not yet officially announced his candidacy for U.S. President. But in October he started a political action committee and has raised $112,000 through November for a potential run, according to federal election filings. Last year he also made multiple visits to early primary voting states as chairperson of the Democratic Governors Association. He believes support for clean energy was a successful campaign issue in the seven governerships that Democrats won from Republicans in the 2018 midterm elections. Inslee also points to a September poll of likely Iowa Democratic caucus voters, who said restoring U.S. leadership on climate change is one of their top three issues. But a Yale University poll from last March suggested global warming still ranks 15th out of 28 issues of importance for U.S. voters nationally. Political scientists say that is likely to hinder Inslee’s prospects for taking his green campaign national. “The brutal reality is that the electorate does not care about environmental issues,” said Aseem Prakash, director of the University of Washington Center for Environmental Politics. Prakash gives Inslee little to no chance of winning the presidency but believes a bid would boost his national visibility and make him a viable candidate for a cabinet-level post, such as head of the Environmental Protection Agency. In such a role, Prakash said, “he would be able to translate a lot of policies he has been talking about into concrete outcomes.” An Inslee candidacy on a climate change platform also could encourage other Democratic candidates to talk about the issue. The former congressman remains undeterred about his likely slim chances of winning the top job. “Pollsters be damned,” he said. “You’ve got to go with your gut.” He believes combatting climate change could help unify a fractured country - and that he could be the one to push ahead the action needed now to help avoid the worst impacts of climate change and take advantages of new clean energy opportunities. “Unfortunately we’re at the eleventh hour"" in terms of addressing climate change, Inslee said. “But it can be our hour. It can be our shining hour where my state and eventually America leads the world in a clean energy economy.” (Reporting by Gregory Scruggs ; editing by Laurie Goering : (Please credit the Thomson Reuters Foundation, the charitable arm of Thomson Reuters, that covers humanitarian news, climate change, resilience, women's rights, trafficking and property rights. Visit news.trust.org/climate)",https://uk.reuters.com/article/usa-politics-inslee/feature-u-s-climate-hawk-in-chief-washington-governor-eyes-presidential-run-idUKL8N1Z82MA,08 Jan 2019,"SEATTLE, Jan 8 (Thomson Reuters Foundation) - On a recent
winter beach walk, Washington state Governor Jay Inslee’s
5-year-old grandson beamed with delight as he spotted a crab.",FEATURE-U.S. climate hawk-in-chief? Washington governor eyes presidential run
