publish_datetime,content,href,publish_timestr,summarize,title
2019-01-08,"FRANKFURT (Reuters) - BASF (BASFn.DE) is looking to shed a sizeable portfolio of assets to try to salvage a deal it struck in 2017 to buy Belgian chemicals group Solvay’s (SOLB.BR) polyamide business, people close to the matter said.  The German company is working with investment bank Lazard (LAZ.N) to find a buyer for the plastics assets, which could be valued at about 450 million euros ($515 million), including debt, the people said. Information packages were sent out to potential buyers just before Christmas, and first-round bids are expected by the end of the month, they added.  BASF and Lazard declined to comment, while Solvay was not immediately available for comment.  To try to allay concerns raised by European Union antitrust regulators, BASF offered in October to exclude parts of Solvay’s European polyamide business, including innovation capabilities, from the list of assets it plans to acquire. It also offered to exclude manufacturing assets of Solvay’s intermediate and engineering plastics business.  The European Commission has set a provisional deadline of Jan. 25 for its ruling on the planned deal.  According to people close to the matter, BASF is marketing the assets to companies that also took part in the 2017 auction for the Solvay business, including South Korea’s SK Innovation (096770.KS), China’s KingFa (600143.SS), and private equity group SK Capital, which owns peer Ascend.  The assets, with estimated core earnings of about 60 million euros and an expected enterprise value (equity plus debt) of 7-8 times that, also include engineering plastics that have whet the appetite of peers such as Lanxess (LXSG.DE), they added.  BASF is seeking to strengthen its nylon business and enhance its access to key growth markets in Asia and South America with the Solvay deal. The purchase would boosts its activities in nylon, or polyamide 6-6, a heat-resistant engineering plastic that is used in textiles and also industrial parts such as tube fittings, cooling fans and engine air ducts. For Solvay, the sale is part of its drive to divest high-volume products and focus on specific applications in aerospace, automotive and the oil and gas industries where it can achieve higher margins. EU Commissioner Margrethe Vestager said last year that as only a few manufacturers provide essential inputs to produce different nylon products, a careful assessment was needed whether the proposed acquisition would lead to higher prices. A main precursor material for polyamide 6-6 is ADN. The main suppliers of this material are Ascend as well as Butachimie, a joint venture of Solvay and Invista, a former DuPont business now held by Koch Industries.  Reporting by Arno Schuetze; Editing by Mark Potter",https://uk.reuters.com/article/solvay-ma-basf/update-1-basf-plans-to-shed-assets-to-try-to-salvage-solvay-deal-sources-idUKL8N1Z84OB,08 Jan 2019,"BASF is looking to
shed a sizeable portfolio of assets to try to salvage a deal it
struck in 2017 to buy Belgian chemicals group Solvay's
polyamide business, people close to the matter said.",UPDATE 1-BASF plans to shed assets to try to salvage Solvay deal - sources
2019-01-08,"(Updates to U.S. markets open, changes byline, dateline; previous LONDON) * Dollar ticks up, euro hit by weak German data * Yields rise as trade deal optimism boosts risk sentiment * Oil prices up on trade talk hopes, OPEC cuts By Saqib Iqbal Ahmed NEW YORK, Jan 8 (Reuters) - An index of world stocks rose for the third straight session on Tuesday, lifted by hopes that the United States and China would strike a deal to end their months-long trade war that has hurt sentiment in financial markets. Increased risk appetite helped lift U.S. Treasury yields, while the dollar, which hit an 11-week low on Monday, rebounded as the euro weakened on concerns about a slowdown in the euro zone economy. MSCI’s world equity index, which tracks shares in 47 countries, rose 0.38 percent, to a more than three- week high. The United States and China will continue trade talks in Beijing for an unscheduled third day, a member of the U.S. delegation said on Tuesday. The meetings this week are the first face-to-face talks since U.S. President Donald Trump and Chinese President Xi Jinping agreed in December to a 90-day truce in their trade war. Trump, in a post on Twitter on Tuesday, reiterated his recent statement that the talks with China were going well but gave no details. On Wall Street, rising hopes of progress in the talks lifted shares. Tuesday’s advance added to gains logged over the past two sessions, following last week’s strong U.S. employment report and comments from the Federal Reserve chief that calmed worries that interest rate hikes would hurt growth. “With the U.S. and China in talks to de-escalate their trade conflict, the central bank showing a willingness to slow its tightening cycle and the economy still performing well, the markets may be looking a little more attractive,” Craig Erlam, senior market analyst at Oanda in London, wrote in a note. The Dow Jones Industrial Average rose 138.81 points, or 0.59 percent, to 23,670.16, the S&P 500 gained 7.84 points, or 0.31 percent, to 2,557.53 and the Nasdaq Composite added 15.47 points, or 0.23 percent, to 6,838.94. European shares hit a three-week high in a broad-based rebound on hopes of a possible trade deal between China and the United States. The pan-European STOXX 600 was up 1.15 percent. U.S. Treasury yields rose for a third day, in line with higher U.S. stocks, on improved risk appetite, while the Treasury Department also prepared to sell new supply. Benchmark 10-year notes fell 7/32 in price on Tuesday to yield 2.705 percent, up from 2.682 percent on Monday. The dollar rose against the euro as investors focused on the risk of a euro zone recession after data showed more signs of slowing in the region. The euro was 0.24 lower against the greenback. “The euro had its upturn halted by German data showing the third decline in as many months in a gauge of factory growth,” said Joe Manimbo, senior market analyst at Western Union Business Solutions in Washington. The improved appetite for risk and the stronger dollar weighed on gold prices. Spot gold slipped 0.33 percent to $1,284.42 per ounce. Oil prices extended gains, supported by hopes that the U.S.-China trade talks might defuse the trade dispute, while OPEC-led supply cuts also tightened markets. Brent crude futures were up $0.82, or 1.43 percent, to $58.15 per barrel. U.S. West Texas Intermediate (WTI) crude oil futures climbed $0.87, or 1.79 percent, to $49.39 per barrel. Reporting by Saqib Iqbal Ahmed; Additional reporting by
Gertrude Chavez-Dreyfuss in New York and Sruthi Shankar in
Bangalore; Editing by Dan Grebler",https://uk.reuters.com/article/global-markets/global-markets-stocks-extend-gains-as-u-s-china-trade-hopes-build-idUKL8N1Z8454,08 Jan 2019,"An index of world stocks rose
for the third straight session on Tuesday, lifted by hopes that
the United States and China would strike a deal to end their
months-long trade war that has hurt sentiment in financial
markets.",GLOBAL MARKETS-Stocks extend gains as U.S.-China trade hopes build
2019-01-08,"MEXICO CITY, Jan 8 (Reuters) - Mexican President Andres Manuel Lopez Obrador said on Tuesday a military-assisted crackdown had dramatically reduced fuel theft and uncovered a secret pipe that was used to siphon gasoline out of one of the country’s refineries. Such fuel theft has dropped from 787 truck loads per day to 177 since thousands of soldiers were sent to state-oil company Pemex’s installations last month, Lopez Obrador said at a daily news conference. The crackdown on years of mounting fuel theft is the leftist government’s first major move against corruption and violence after taking office on Dec. 1, but risks angering consumers and hurting the economy. By closing off pipelines and refineries while it traced leakages, the government has triggered shortfalls and long lines at gas stations in at least six states, including Guanajuato, a major car-manufacturing hub in central Mexico. Criminal groups and others who have tapped pipelines have long been blamed for billions of dollars of losses to public coffers over the past few years, but Lopez Obrador said last month that far more fuel was being stolen directly from Pemex installations by an internal network of corrupt officials. Lopez Obrador said the military had discovered a 3-kilometer (1.9 mile)-long “hose” that was funneling fuel out of storage tanks at the Salamanca refinery in the central state of Guanajuato into a secret storage area. He admitted there were complaints about the shortages, but said they were not widespread, and urged an end to “panic” buying and said shortages were an issue of distribution, not supply. “This is not in vain,” Lopez Obrador said. “We are going to end corruption.” Local media showed images of tanker trucks, escorted by federal police, heading from oil-rich costal states to the country’s interior. It was not immediately clear what impact the crackdown will have on imports of fuel. Mexico is the top export destination for U.S. energy products, importing about 1.4 million barrels every day, or nearly a quarter of all U.S. overseas sales. (Reporting by Veronica Gomez and Michael O’Boyle; Editing by Frank Jack Daniel and Bernadette Baum)",https://uk.reuters.com/article/mexico-oil-theft/mexico-fuel-theft-curtailed-secret-hose-found-in-refinery-obrador-idUKL1N1Z80LO,08 Jan 2019,"Mexican President Andres
Manuel Lopez Obrador said on Tuesday a military-assisted
crackdown had dramatically reduced fuel theft and uncovered a
secret pipe that was used to siphon gasoline out of one of the
country's refineries.","Mexico fuel theft curtailed, secret 'hose' found in refinery -Obrador"
2019-01-08,"CARACAS (Reuters) - Venezuela’s opposition-run congress on Tuesday issued a resolution calling deals between state-run oil company PDVSA [PDVSA.UL] and U.S. and French companies announced this week illegal, since they had not been sent to lawmakers for approval. The body said the oilfield deals with France’s Maurel & Prom (MAUP.PA) and little-known U.S. company Erepla violated article 150 of Venezuela’s constitution, which requires that contracts signed between the state and foreign companies be approved by the National Assembly, as Venezuela’s congress is known. “They are giving concessions that violate the law,” said lawmaker Jorge Millan, mentioning the two contracts. Congress, largely stripped of its power since the opposition took it over in 2016, is unlikely to be able block the deals from going forward. But the rejection could create legal complications under a future government. Maduro is set to be inaugurated for his second consecutive term on Thursday following a May vote considered a sham by the domestic opposition and many foreign governments. A regional bloc of Latin American countries last week called on Maduro, a protege of the late Hugo Chavez, not to take office. The deals are part of Maduro’s effort to reverse a sharp decline in the OPEC nation’s crude output that has crippled its economy. Erepla said it would invest up to $500 million in three fields, while Maurel & Prom said it would invest up to $400 million for a 40 percent stake in an oilfield joint venture. PDVSA did not respond to a request for comment. Maurel & Prom did not immediately respond to a request for comment outside of normal business hours in France. A spokesman for Erepla, registered in Delaware in November and part-owned by a prominent Florida Republican donor and shipping magnate, said Venezuela’s hydrocarbons law “allows PDVSA to contract with companies like Erepla to execute field services without any additional approvals required.”   Referring to the Erepla deal during the congressional session earlier on Tuesday, Millan said that while PDVSA referred to the agreement as an oilfield service contract, “the company will be conducting oil exploration and production activities.” Maurel & Prom Chief Executive Michel Hochard said the company would act “in accordance with the instructions given” by Maduro and Oil Minister Manuel Quevedo, according to a statement attributed to him in a PDVSA press release. Reporting by Mayela Armas; Writing by Luc Cohen; Editing by Lisa Shumaker",https://uk.reuters.com/article/venezuela-oil/venezuela-congress-slams-oil-deals-with-u-s-french-companies-idUKL1N1Z81X7,08 Jan 2019,"Venezuela's opposition-run
congress on Tuesday issued a resolution calling deals between
state-run oil company PDVSA and U.S. and French
companies announced this week illegal, since they had not been
sent to lawmakers for approval.","Venezuela congress slams oil deals with U.S., French companies"
2019-01-08,"NEW YORK (Reuters) - An index of world stock markets rose for the third straight session on Tuesday, with investors hopeful that the United States and China would strike a deal to end their months-long trade war that has hurt financial markets. Increased risk appetite helped lift U.S. Treasury yields, while the dollar, which hit an 11-week low on Monday, rebounded as the euro weakened on concerns about a slowdown in the euro zone economy. Tuesday’s stocks advance added to gains logged over the past two sessions following last week’s strong U.S. employment  report and comments from the Federal Reserve chief that calmed worries that interest rate hikes would hurt growth. Trade and concerns over slowing economic growth triggered a selloff at the end of 2018 that culminated in Wall Street posting its worst monthly performance in about a decade in December, driving down earnings estimates and stock valuations. On Tuesday, MSCI’s world equity index .MIWD00000PUS, which tracks shares in 47 countries, rose 0.71 percent to a more than three-week high. Trade talks this week in Beijing are the first face-to-face discussions since U.S. President Donald Trump and Chinese President Xi Jinping agreed in December to a 90-day truce in their trade war. The United States and China will continue trade talks in Beijing for an unscheduled third day, a member of the U.S. delegation said on Tuesday. Trump, in a post on Twitter on Tuesday, reiterated his recent statement that the talks with China were going well but gave no details. “You’re seeing some negotiations happen and the market is starting to think that perhaps we’ll start to see a framework evolve,” said Anik Sen, global head of equities at PineBridge Investments. The recent stocks rally has lifted the S&P 500 .SPX by nearly 10 percent from 20-month lows hit around Christmas. On Tuesday, the Dow Jones Industrial Average .DJI rose 256.1 points, or 1.09 percent, to close at 23,787.45, the S&P 500 .SPX gained 24.72 points, or 0.97 percent, to finish at 2,574.41 and the Nasdaq Composite .IXIC added 73.53 points, or 1.08 percent, to end at 6,897.00. European shares hit a three-week high in a broad-based rebound on hopes of a possible trade deal between China and the United States. The pan-European STOXX 600 index  closed up 0.87 percent. U.S. Treasury yields climbed, in line with higher U.S. stocks, on improved risk appetite and as the Treasury Department sold $38 billion in three-year notes to relatively soft demand. Benchmark 10-year notes US10YT=RR fell 12/32 in price to yield 2.7226 percent, up from 2.682 percent on Monday. The dollar rose against the euro as investors focused on the risk of a euro zone recession after data showed more signs of slowing in the region. The euro was 0.3 lower against the greenback. “The euro had its upturn halted by German data showing the third decline in as many months in a gauge of factory growth,” said Joe Manimbo, senior market analyst at Western Union Business Solutions in Washington. The improved appetite for risk and the stronger dollar weighed on gold prices. Spot gold XAU= slipped 0.27 percent to $1,285.1 per ounce.         Oil prices extended gains, supported by hopes that the U.S.-China trade talks might defuse the trade dispute, while OPEC-led supply cuts also tightened markets. Brent crude LCOc1 futures rose $1.39 to settle at $58.72 a barrel, a 2.4 percent gain. U.S. West Texas Intermediate (WTI) crude CLc1 futures rose $1.26 to settle at $49.78 a barrel, a 2.6 percent gain. Reporting by Saqib Iqbal Ahmed; Additional reporting by Gertrude Chavez-Dreyfuss in New York and Sruthi Shankar in Bangalore; Editing by Dan Grebler",https://uk.reuters.com/article/global-markets/global-markets-stocks-rise-on-u-s-china-trade-talk-hopes-idUKL1N1Z81M4,08 Jan 2019,"An index of world stock markets
rose for the third straight session on Tuesday, with investors
hopeful that the United States and China would strike a deal to
end their months-long trade war that has hurt financial markets.",GLOBAL MARKETS-Stocks rise on U.S.-China trade talk hopes
2019-01-08,"WASHINGTON (Reuters) - U.S. emissions of carbon dioxide, the main greenhouse gas, spiked last year after falling for the previous three, as cold weather spurred natural gas demand for heating and as the economy pushed planes and trucks to guzzle fuel, an estimate released on Tuesday showed.  The Rhodium Group, an independent research group, said  emissions rose 3.4 percent in 2018, the biggest jump since 2010, when the economy bounced back from the Great Recession.  Rhodium said the boost from the world’s second-biggest carbon emitter after China could make it harder for the United States to meet reductions targets it set under the Paris Agreement in 2015. To do so, the United States would have to cut energy-related carbon emissions by 2.6 percent on average over the next seven years, a pace more than twice that achieved between 2005 and 2017. “It is certainly feasible, but will likely require a fairly significant change in policy in the very near future, and/or favorable market and technological conditions,” the group said.  The spike occurred even though 2018 brought a record number of shutdowns of power plants fired by coal, the fuel richest in carbon output when burned.  Natural gas, which emits about half the carbon of coal, replaced most of the lost coal generation. But it also served the vast majority of load growth for electricity last year, the report said.  The Trump administration, which has announced its intent to leave the 2015 Paris Agreement on climate change, is relaxing Obama-era rules on emissions from power plants and vehicles as it seeks to boost production of oil, gas and coal. The earliest the administration can leave the accord is after the 2020 presidential election.  The U.S. Environmental Protection Agency did not respond to questions about the Rhodium report, saying it would only answer queries related to the partial federal government shutdown or about environmental emergencies.  Trump administration officials have said that emissions can waiver from year to year depending on the economy, but that the country can both cut emissions and enjoy a strong economy at the same time.  Environmentalists say the Trump administration needs to speed up the transition from natural gas to renewables such as wind and solar power and energy storage.  “Coal’s sharp-dressed cousin is continuing us on a path to irreparable and costly climate damage,” said Greg Cunningham, who works on clean energy and climate at the Conservation Law Foundation. “It is imperative that we shift our clean energy transition into high gear and accelerate our clean car standards to reverse this trend.” The American Petroleum Institute, the top lobbying organization for the U.S. oil and gas industry, says it does not  take a position on forming a carbon tax, which some environmentalists, politicians in both parties and petroleum companies say would harness the power of capitalism to reduce emissions. The API backs voluntary efforts to reduce emissions.  Mike Sommers, the head of API, told reporters in a conference call that the United States can boost oil and gas and cut emissions at the same time.   Reporting by Timothy Gardner; editing by Susan Thomas and Dan Grebler",https://uk.reuters.com/article/usa-carbon-emissions/update-1-u-s-carbon-emissions-spike-in-2018-on-industry-fuel-demand-idUKL1N1Z81LA,08 Jan 2019,"U.S. emissions of carbon
dioxide, the main greenhouse gas, spiked last year after falling
for the previous three, as cold weather spurred natural gas
demand for heating and as the economy pushed planes and trucks
to guzzle fuel, an estimate released on Tuesday showed.","UPDATE 1-U.S. carbon emissions spike in 2018 on industry, fuel demand"
2019-01-08,"NEW YORK, Jan 8 (Reuters) - The U.S. Environmental Protection Agency has warned at least two lawmakers that the federal government shutdown has delayed the agency’s work on a rule allowing summer sales of higher-ethanol blends of gasoline, but that the plan could still be completed before the driving season, two sources briefed on the matter told Reuters. President Donald Trump pledged to lift the summer ban on sales of so-called E15 gasoline in the run-up to the mid-term elections, in a much-needed boost to an ethanol industry upended by trade wars and weak demand growth at home. The Trump administration hoped to have the rule published by February and approved by June, but the EPA recently told the lawmakers that the timeline will be delayed due to the government shutdown, said the sources, who spoke to Reuters on Tuesday and over the weekend. (Reporting by Jarrett Renshaw and Chris Prentice Editing by Leslie Adler)",https://uk.reuters.com/article/usa-ethanol-gasoline/epa-warns-that-u-s-government-shutdown-delaying-e15-gasoline-proposal-sources-idUKL1N1Z81IN,08 Jan 2019,"The U.S. Environmental
Protection Agency has warned at least two lawmakers that the
federal government shutdown has delayed the agency's work on a
rule allowing summer sales of higher-ethanol blends of gasoline,
but that the plan could still be completed before the driving
season, two sources briefed on the matter told Reuters.",EPA warns that U.S. government shutdown delaying E15 gasoline proposal -sources
