publish_datetime,content,href,publish_timestr,summarize,title
2018-06-12,"(Adds Breakingviews link) By Liz Hampton, Ernest Scheyder and Dmitry Zhdannikov HOUSTON/LONDON, June 12 (Reuters) - Exxon Mobil Corp is pushing deeper into energy trading, building a global cadre of experienced traders and beefing up risk-management systems to lift profit, according to executive recruiters and people familiar with the business. The development is a sea change for a company that has stood out from rivals by limiting its past activity out of concern it would be accused of market manipulation. Exxon now aims to trade around more of its growing energy assets to get the best prices for its products and increase earnings, according to an employee familiar with the matter. Expanded trading could add hundreds of millions of dollars to annual earnings from its own buying and selling of crude and fuels, but also comes with problems, including higher risk. Exxon expects to add 1 million barrels per day of output over the next several years as new oilfields and refinery expansions kick in, giving it more assets to trade. Exxon last year retained John Masek, a former trader at Swiss-based Glencore, the world’s second largest buyer and seller of petroleum, to consult on gasoline trading. Earlier this year, it poached four gasoline market specialists from refiner Phillips 66. This month, Exxon hired former BHP Billiton Plc trader Nelson Lee as an international crude trader, the people familiar with the matter said. In 2014, Lee orchestrated BHP’s first-ever crude exports by maintaining the lightly refined oil met criteria for an exportable product. The deals helped usher in the end to a U.S. prohibition on crude exports more than a year later. The company has also added crude, products and liquefied natural gas specialists to London and Singapore offices. It recently hired Paul Butcher, a trader who has worked at BP Plc , Glencore and Vitol, to advise on North Sea markets and accounting for trading transactions. “Paul is known for being a very aggressive, old school crude trader. Exxon would have never hired a risk taker of that scale in the old days. The fact that he is consulting them shows they are considering changes in trading very seriously,” said a trading house executive who knows Butcher. Phillips 66 declined to comment on the employee departures. Exxon spokesman Scott Silvestri referred questions about its trading business and recent hiring to regulatory filings, which note the historical use of financial derivatives and geographic scale to manage commodity price risks. Chief Executive Darren Woods wants to increase Exxon’s profit and appetite for risk at a measured pace, according to people who deal with Exxon. The U.S. operation runs from a trading floor at its Spring, Texas campus that has expanded to as many as 70 workers who will handle everything from Canadian crude to gasoline, jet fuel and diesel. “Trading has been a virtual four-letter word at Exxon,” said Ehud Ronn, a University of Texas finance professor who studies energy and financial risk management. Exxon has drawn most top managers from engineering backgrounds, not financial services. “A change in their trading policy would indeed be transformational.” Exxon has long lagged behind rivals BP Plc, Chevron Corp and Royal Dutch Shell Plc, which have created trading units that occasionally generate more profit than their refining businesses. During the oil price downturn of 2015-2016, companies like Shell often made more profit in refining than in oil production, also known as upstream, and often cited trading as contributing to the success of the refining division. Shell for example trades more than 8 million barrels per day or 8 percent of global production, twice the size of its own or Exxon’s output. The huge figures come partially thanks to trading barrels of third parties, which Exxon currently does on a very limited scale. Exxon would also normally hedge only cargoes going from one region to another and where crude is priced according to different benchmarks. BP and Shell would normally hedge all cargoes as well as taking sometimes a pure speculative position on the paper market to make profit, according to traders working for the firms. “Exxon still doesn’t plan to begin speculative paper trading,” said one source familiar with Exxon’s thinking. Woods faces pressure from Exxon investors to lift shares that trade at the same price as 10 years ago. He promised shareholders this year that he can double profit and increase its oil and gas output by 25 percent by 2025. The company’s expanded focus on trading brings challenges including added risk from options, swaps and other derivatives, and developing risk-management and compensation systems for the larger business. Exxon has held talks with at least two developers of risk-management software, Enuit LLC and Allegro Development Corp, people familiar with the discussions said. Both offer packages that manage logistics and measure financial exposure. The companies declined to comment on their discussions with Exxon, according to spokespeople. Exxon has also put company veteran managers in charge of overall trading and risk controls at its Spring, Texas, floor, one person familiar with its operations said, to avoid potential losses as it expands trading. “We’ve heard whispers in the market about this for a few years, so it’s great to see them finally hiring commercial talent externally,” said an executive recruiter familiar with some of the recent hires but who was not directly involved. Additional reporting by Ron Bousso in London and Henning
Gloystein in Singapore; Writing by Gary McWilliams; Editing by
Richard Pullin/Adrian Croft",https://uk.reuters.com/article/exxon-mobil-trading/exclusive-exxon-mobil-breaks-with-past-bulks-up-energy-trading-to-boost-profit-idUKL8N1TE5IS,12 Jun 2018,"Exxon Mobil Corp
is pushing deeper into energy trading, building a global cadre
of experienced traders and beefing up risk-management systems to
lift profit, according to executive recruiters and people
familiar with the business.","EXCLUSIVE-Exxon Mobil breaks with past, bulks up energy trading to boost profit"
2018-06-12,"PARIS (Reuters) - Oil and gas major Total (TOTF.PA) said on Tuesday that 3.5 percent of its petrol stations in France had run out of fuel on the second day of a blockade of refineries and fuel depots by farmers that has disrupted distribution. Farmers are protesting against France’s decision to allow Total to use imported palm oil at a biofuel plant, which would compete with biodiesel made from locally produced oilseed crops, further souring relations between the EU’s biggest farm sector and the government of President Emmanuel Macron. The blockade now concerned a total of 18 refineries and depots across France, and would continue until the farm minister agreed to some of the farmers’ demands, said the FNSEA, the country’s largest farm union, which is organising the protests. “It is really an alarm call that 3,000 farmers on 18 blocked sites have sent out to say, please listen to us and take up this message at a European level,” FNSEA President Christiane Lambert said after meeting Agriculture Minister Stephane Travert. “The negotiation is not over, we do not have what we want. But by mutual agreement we decided to meet again at the end of the day to move forward on our claims,” she added. Total, which operates 2,200 petrol stations and five of France’s seven refineries and nine depots, said the depots and four refineries were still blocked. The refineries were still operating. “There are some difficulties in supplying petrol stations particularly in Paris and the Ile-de-France region,” a Total spokesman said. Total had urged customers not to rush to petrol stations to fill their tanks, which could spark panic buying and shortages. French authorities last month gave Total permission to use palm oil as a feedstock at its La Mede biofuel refinery in southern France, infuriating farmers who grow crops such as rapeseed. Environmentalists also blame palm oil cultivation for deforestation in southeast Asia.  Total argues its plans call for using less palm oil than allowed by the authorities, offer an outlet for 50,000 tonnes of locally produced rapeseed and will develop large-scale recycling of used oil and fat. But Lambert said 50,000 tonnes was “not enough” and that the price needed to be based on producers’ costs, not on palm oil prices. “As long as we are not successful ... we will remain on the blockades,” the head of France’s young farmers group JA, Jeremy Decerle, said.     Reporting by Bate Felix and Gus Trompiz, writing by Sybille de La Hamaide; editing by David Evans",https://uk.reuters.com/article/france-palmoil-total/update-1-some-french-petrol-stations-run-dry-as-farmer-blockade-continues-idUKL8N1TE514,12 Jun 2018,"Oil and gas major Total
said on Tuesday that 3.5 percent of its petrol stations in
France had run out of fuel on the second day of a blockade of
refineries and fuel depots by farmers that has disrupted
distribution.",UPDATE 1-Some French petrol stations run dry as farmer blockade continues
2018-06-12,"(Adds quarterly numbers, description of solar market) By Nichola Groom June 12 (Reuters) - New U.S. solar installations in 2018 will stay at the same level as last year due to weakness in several major residential markets and a slowdown in big projects after a rush to beat a tax credit deadline, according to a report released on Tuesday. The zero-growth forecast came despite a 13 percent rise in the first quarter to 2.5 gigawatts, accounting for 55 percent of total U.S. generating capacity added, GTM Research said in the report commissioned by the Solar Energy Industries Association. New solar installations, which surged for much of the last decade, fell almost 30 percent in 2017 to 10.8 gigawatts because developers in 2016 completed a slew of projects ahead of a scheduled expiration of a key tax credit that ultimately was extended, the report said. Government policies that supported renewable energy and a sharp fall in the price of the technology propelled expansion. GTM raised its forecast for utility-scale installations by 2 percent to 6.6 gigawatts, noting that many developers had secured panels before import tariffs were imposed by the Trump administration this year. The tariffs will be felt mostly next year and beyond, GTM said, reducing its 2019 utility-scale forecast by 600 megawatts. This sector will grow about 5 percent in 2019, but will be flat in 2021 and 2022 due to tariff-related project delays, it added. Module prices averaged 47 cents per watt during the first quarter, 24 percent above the 38 cents average a year ago, due to the U.S. tariffs. The research firm ratcheted down its 2018 residential market outlook by 8 percent from 2.4 GW to 2.2 GW. Mature markets including Massachusetts, New York and New Jersey are expected to decline this year, GTM said. Residential solar installations fell 15 percent last year but was flat during the first quarter, a promising sign of a market recovery after a 2017 pullback by national installers like Tesla Inc, it added. Residential system prices have stagnated as the cost of acquiring customers has risen steadily over the last four quarters, GTM said. (Reporting by Nichola Groom; Editing by Cynthia Osterman and Richard Chang)",https://uk.reuters.com/article/usa-solar/update-1-no-growth-in-u-s-solar-installations-this-year-report-idUKL1N1TE12L,12 Jun 2018,"New U.S. solar installations in 2018
will stay at the same level as last year due to weakness in
several major residential markets and a slowdown in big projects
after a rush to beat a tax credit deadline, according to a
report released on Tuesday.",UPDATE 1-No growth in U.S. solar installations this year -report
2018-06-12,"(Adds demand forecast, 2018 production outlook) NEW YORK, June 12 (Reuters) - U.S. crude oil production is expected to rise by less than previously expected to 11.76 million barrels per day (bpd) next year, the U.S. Energy Information Administration said on Tuesday. In its monthly short-term energy outlook, the agency forecast that U.S. crude oil output will rise by 970,000 bpd in 2019. Last month, it expected a 1.14 million bpd year-over-year increase to 11.86 million bpd. U.S. oil production was forecast to touch a record 12 million bpd in the fourth quarter of 2019 but EIA pared its expectations, saying it was now expected to be about 11.97 million bpd. For 2018, the agency upped its production estimate to 10.79 million bpd, expecting growth of 1.44 million bpd, according to the report. It previously expected output to rise by 1.37 million bpd to 10.72 million bpd. U.S. crude production has surged over the past eight years thanks to a shale boom, driven primarily by gains in the prolific Permian basin, which stretches across West Texas and eastern New Mexico. On the demand side, the EIA expects U.S. oil consumption growth in 2018 to rise by 530,000 bpd to 20.41 million bpd compared with a previous forecast of a rise of 500,000 bpd to 20.38 million bpd. The agency also and slightly hiked its 2019 demand forecast to 20.67 million bpd from 20.64 million bpd previously. (Reporting by Devika Krishna Kumar in New York Editing by Marguerita Choy)",https://uk.reuters.com/article/usa-oil-eia-outlook/update-1-eia-cuts-u-s-crude-output-growth-forecast-for-2019-idUKL1N1TE18N,12 Jun 2018,"U.S. crude oil production is
expected to rise by less than previously expected to 11.76
million barrels per day (bpd) next year, the U.S. Energy
Information Administration said on Tuesday.",UPDATE 1-EIA cuts U.S. crude output growth forecast for 2019
2018-06-12,"SARAJEVO, June 12 (Reuters) - Fuel distributors in Bosnia’s autonomous Bosniak-Croat Federation agreed a deal with the regional government on Tuesday to cut fuel prices after drivers repeatedly blocked roads in protest against rising prices, a government minister said. The Federation government decided to take action after traffic jams disrupted life in several Bosnian cities in recent days. The decision to cut prices was also seen as a sweetener ahead of an October general election. “We have reached a consensus there will be no further hikes of fuel prices,” Federation Trade Minister Zlatan Vujovic was quoted as saying by Fena news agency after his meeting with oil distributors in the southern town of Mostar. “Fuel will be cheaper at some oil stations even from tomorrow,” said Vujovic, adding the government and the distributors had agreed on the rationalisation of operations and lower costs for distributors so that the prices could go down. Fuel prices were first increased in February after a rise in biofuel excise taxes, and there have been two further increases, lifting the price of a litre of gasoline to 2.35 Bosnian marka (1.20 euros). Officials have blamed the higher prices on global markets, where crude oil prices have been bolstered by a supply pact led by the Organization of the Petroleum Exporting Countries. The government of Bosnia’s other autonomous region, the Serb Republic, said it would discuss the problem of rising fuel prices on Thursday. Drivers have also blocked roads in major Serbian cities in recent days, protesting against prices that have risen to 1.24 euros ($1.46) for a litre of gasoline and 1.30 euros for a litre of diesel. Protesters said prices should be kept under 1 euro a litre in Bosnia and Serbia, where average monthly pay is about 400 euros. $1 = 0.8481 euros
Reporting by Daria Sito-Sucic; Editing by Mark Potter",https://uk.reuters.com/article/bosnia-fuel-prices/bosnias-fuel-distributors-agree-to-cut-prices-after-protests-idUKL8N1TE520,12 Jun 2018,"Fuel distributors in Bosnia's
autonomous Bosniak-Croat Federation agreed a deal with the
regional government on Tuesday to cut fuel prices after drivers
repeatedly blocked roads in protest against rising prices, a
government minister said.",Bosnia's fuel distributors agree to cut prices after protests
2018-06-12,"BAGHDAD, June 12 (Reuters) - Iraq’s government voted to expand production from its Nasiriya oilfield to 100,000 barrels per day, Prime Minister Haider al-Abadi said on Tuesday. “Based on the recommendation of the energy committee, cabinet voted to expand production from the Nasiriya field to 100,000 barrels per day,” Abadi said at a news conference. The oil ministry said in December that Iraq planned to increase production from the oilfield to 200,000 bpd from 90,000 bpd in the next few years without seeking assistance from international firms. (Reporting by Ahmed Aboulenein; Editing by Adrian Croft)",https://uk.reuters.com/article/iraq-oil/iraq-to-expand-nasiriya-oilfield-production-to-100000-bpd-pm-idUKB2N1SF00V,12 Jun 2018,"Iraq's government voted to
expand production from its Nasiriya oilfield to 100,000 barrels
per day, Prime Minister Haider al-Abadi said on Tuesday.","Iraq to expand Nasiriya oilfield production to 100,000 bpd -PM"
2018-06-12,"WASHINGTON, June 12 (Reuters) - Rising demand on both the domestic and overseas fronts spurred a cut in the U.S. Agriculture Department’s outlook for corn and soybean stockpiles, the government said on Tuesday. In its monthly supply and demand report, USDA pegged soybean ending stocks for the 2017/18 crop year at 505 million bushels, down from 530 million bushels a month ago. It boosted its soybean usage by crushers to 2.015 billion bushels, up 25 million bushels. For the 2018/19 marketing year, USDA estimated soybean endings stocks at 385 million bushels, down from its May estimate of 415 million bushels. The lower stocks figure was largely due to a smaller carry-in from 2017/18. Additionally, the 2018/19 crush estimate was raised by 5 million bushels. The 2018/19 stocks estimates fell below a range of analysts’ forecasts in a Reuters survey. The 2017/18 figure was below the average of estimates in the survey. High soybean meal usage was sparking demand for soybeans at processors, USDA said. On the corn front, USDA pegged 2017/18 ending stocks at 2.102 billion bushels, down 80 billion bushels from May. That was below the low end of analysts’ estimates that ranged from 2.132 billion bushels to 2.192 billion bushels. The government raised its 2017/18 corn export outlook by 75 million bushels to 2.300 billion. USDA said that corn exports in April hit a record high, topping the monthly shipping record set in November 1989. For 2018/19, corn ending stocks were seen at 1.577 billion bushels. In May, USDA pegged corn ending stocks at 1.682 billion bushels. USDA boosted its 2018/19 ethanol usage estimate to 5.675 billion bushels, up 50 million bushels from May. USDA also pegged domestic wheat ending stocks at 1.080 billion bushels for 2017/18, up 10 million bushels from May, and at 946 million bushels for 2018/19, 9 million bushels lower than May. The government raised its estimate of all U.S. wheat production for 2018/19 by 6 million bushels to 1.827 billion bushels, with slight increases seen in hard red winter wheat, soft red winter wheat and white winter wheat production. USDA also lowered its estimate of 2017/18 soybean production in Argentina to 37.00 million tonnes from 39.00 million tonnes, but raised its estimate for Brazil’s 2017/18 soybean harvest to 119.00 million tonnes from 117.00 million tonnes. It trimmed its corn harvest forecast for Brazil by 2 million tonnes to 85 million tonnes and left its estimate of Argentina’s corn production unchanged. Reporting by Mark Weinraub
Editing by Paul Simao",https://uk.reuters.com/article/usda-crops/usda-cuts-corn-soybean-stocks-view-on-strong-demand-idUKL1N1TD134,12 Jun 2018,"Rising demand on both the
domestic and overseas fronts spurred a cut in the U.S.
Agriculture Department's outlook for corn and soybean
stockpiles, the government said on Tuesday.","USDA cuts corn, soybean stocks view on strong demand"
2018-06-12,"* Graphic: World FX rates in 2018 tmsnrt.rs/2egbfVh * Dollar index dips after U.S.-North Korea summit * Broad world stock index creeps into positive territory * Trump, Kim agree on denuclearization but deal seen symbolic * Focus shifts to Fed, positive U.S. consumer data By Nick Brown NEW YORK, June 12 (Reuters) - World stock markets were little changed on Tuesday while the U.S. dollar fell slightly against an index of major currencies, as investors brushed aside a long-awaited U.S.-North Korea summit aimed at denuclearizing the Korean peninsula. U.S. President Donald Trump and North Korean leader Kim Jong Un met in Singapore, pledging to work toward complete denuclearization, while Washington committed to providing security guarantees for its old enemy. The MSCI all-country world index, which tracks shares in 47 countries, gained 0.07 percent on the day. The dollar index fell 0.04 percent, steadied in part by data on Tuesday showing U.S. consumer prices rose in May amid a slowdown in the increase of gasoline costs. The euro was up 0.06 percent to $1.1789. Investors had mixed reactions to the North Korea summit, which ended with the signing of a joint statement that gave few details on how the goals set by both sides would be achieved. “Any de-escalation is good, because in the background you always have worries about these situations,” said Old Mutual Global Investors European fund manager Ian Ormiston. Others felt the sit-down between Trump and Kim did little to change the game. “Markets are skeptical,” said Brad McMillan, chief investment officer for Commonwealth Financial in Waltham, Massachusetts. “This is more of a case of ‘we’ll believe it when we see it’, rather than actually reacting.” Buyers of equities and government bonds seemed more interested in other matters. Along with the positive U.S. inflation data, investors were focused on the kick-off of a two-day U.S. Federal Reserve meeting, at which the Fed is expected to raise interest rates, as well as meetings later this week by the European Central Bank and the Bank of Japan. “”We’re eagerly awaiting the Fed, the ECB and the BOJ, in that order,” said Gregory Anderson, global head of FX strategy at BMO Capital Markets in New York. “People are reluctant to do a whole lot ahead of that.” Futures contracts indicate a 96 percent probability the fed funds rate will be raised a quarter of a percentage point on Wednesday, according to CME Group. Benchmark 10-year U.S. Treasury notes last fell 3/32 in price to yield 2.9663 percent, from 2.957 percent late on Monday. The 30-year bond last fell 4/32 in price to yield 3.1032 percent, from 3.097 percent Monday. Wall Street’s main equity indexes were mixed but steady, with the Dow Jones Industrial Average falling 8.78 points, or 0.03 percent, to 25,313.53, the S&P 500 gaining 3.07 points, or 0.11 percent, to 2,785.07 and the Nasdaq Composite adding 28.74 points, or 0.38 percent, to 7,688.66. Twitter drove the jump on the benchmark S&P, gaining 6.25 percent in midday trading after J.P. Morgan raised its price target by $11 to $50. Tesla jumped more than 4.8 percent after Keybanc raised its estimates for Model 3 deliveries for the second quarter and full-year. In Europe, the regional FTSEurofirst 300 index lost 0.01 percent. The European Central Bank meets on Thursday, with some expecting it to provide guidance for ending its bond-buying program at the end of this year. The spread between Italian and German 10-year borrowing costs narrowed as the U.S.-North Korea summit drew to a close, following a rally on Monday after reassuring comments from Italy’s new economy minister. Oil was mixed after falling earlier in the day. Volatility subsided to its lowest in three weeks, as investors prepared for a key meeting of the OPEC producer group next week. U.S. crude rose 0.53 percent to $66.45 per barrel and Brent was last at $76.41, down 0.07 percent. In Asian equity markets, trading was volatile with Japan’s Nikkei paring early gains to close 0.3 percent higher after earlier rising as much as 0.9 percent. Additional reporting by Ritvik Carvalho, Kate Duguid and Karen
Brettell; Editing by Bernadette Baum",https://uk.reuters.com/article/global-markets/global-markets-stocks-dollar-steady-after-u-s-north-korea-summit-idUKL1N1TE12B,12 Jun 2018,"* Trump, Kim agree on denuclearization but deal seen
symbolic","GLOBAL MARKETS-Stocks, dollar steady after U.S.-North Korea summit"
