publish_datetime,content,href,publish_timestr,summarize,title
2018-03-05,"BRUSSELS (Reuters) - An EU legal opinion has rejected a European Commission proposal to extend the bloc’s internal energy market rules to regulate Russia’s planned Nord Stream 2 gas pipeline to Germany. The opinion is a blow to the EU executive’s push to stall Russia’s plan to double the gas it could pump under the Baltic Sea to Germany, bypassing traditional routes via Ukraine. The Commission fears the pipeline would undercut efforts to reduce dependence on Moscow and its support for Kiev.  The opinion, seen by Reuters, from the legal service of the Council of the European Union, the body where EU ministers meet, said applying EU rules to offshore pipelines may breach U.N. law regulating the seas. The Commission last year proposed the changes to its gas directive to make all import pipelines subject to rules that require they not be owned directly by gas suppliers, apply non-discriminatory tariffs and make capacity available to third parties. The Nord Stream 2 project, fully owned by Russia’s gas export monopoly Gazprom (GAZP.MM), is far from complying with the so-called third energy package rules. The opinion, dated March 1, said the Commission’s proposal “lacks any reasoning on the regulatory power of the Union over offshore pipelines” crossing an EU nation’s exclusive economic zone (EEZ). “The Union does not have jurisdiction to apply energy law ... which is unrelated to the economic exploitation of the EEZ, to pipelines crossing the EEZ of Member States,” the Council’s legal service said. Doing so would run counter to the United Nations Convention on the Law of the Sea as interpreted by the European Court of Justice, the document says, adding that additional analysis is needed on the matter. The Commission’s moves to regulate Nord Stream 2, including by seeking a mandate from member states to negotiate directly with the Russian government, challenges big member states, who have companies invested in the project. Five European energy firms are financing the 1,225 km (760 mile) pipeline to carry 55 billion cubic metres of gas per year: German energy groups Uniper (UN01.DE) and Wintershall (BASFn.DE), Anglo-Dutch group Shell (RDSa.L), Austria’s OMV (OMVV.VI) and France’s Engie (ENGIE.PA). Reporting by Alissa de Carbonnel @AdeCar; Editing by editing by David Evans",https://uk.reuters.com/article/eu-gazprom-nordstream/eu-legal-blow-to-bid-to-regulate-russias-nord-stream-2-pipeline-idUKL5N1QN49P,05 Mar 2018,"An EU legal opinion has
rejected a European Commission proposal to extend the bloc's
internal energy market rules to regulate Russia's planned Nord
Stream 2 gas pipeline to Germany.",EU legal blow to bid to regulate Russia's Nord Stream 2 pipeline
2018-03-05,"ISLAMABAD (Reuters) - As U.S. influence in Islamabad wanes, Pakistan’s former adversary Russia is building military, diplomatic and economic ties that could upend historic alliances in the region and open up a fast-growing gas market for Moscow’s energy companies. Russia’s embrace of Pakistan comes at a time when relations between the United States and its historical ally are unravelling over the war in Afghanistan, a remarkable turnaround from the 1980s, when Pakistan helped funnel weapons and U.S. spies across the border to aid Afghan fighters battling Soviet troops.    Though the Moscow-Islamabad rapprochement is in its infancy, and it is neighbour China that is filling the growing void left by the United States in Pakistan, a slew of energy deals and growing military cooperation promise to spark life into the Russia-Pakistan relationship that was dead for many decades.  “It is an opening,” Khurram Dastgir Khan, Pakistan’s defence minister, told Reuters. “Both countries have to work through the past to open the door to the future.” The cosier diplomatic ties have so far focused on Afghanistan, where Russia has cultivated ties to the Afghan Taliban militants who are fighting U.S. troops and have historic links to Islamabad. Moscow says it is encouraging peace negotiations.  Both Russia and Pakistan are also alarmed by the presence of Islamic State (IS) inside Afghanistan, with Moscow concerned the group’s fighters could spread towards central Asia and closer to home. In Pakistan, IS has already carried out major attacks. “We have common ground on most issues at diplomatic levels,” Pakistan’s Prime Minister Shahid Khaqan Abbasi told Reuters. “It’s a relationship that will grow substantially in the future.” During a trip to Moscow last month by Pakistan’s foreign minister, Khawaja Asif, the two countries announced plans to establish a commission on military cooperation to combat the threat of IS in the region. They also agreed to continue annual military training exercises that began in 2016 and followed the sale of four Russian attack helicopters to Pakistan, as well as the purchase of Russian engines for the Pakistan Air Force’s JF-17 fighter jets that Pakistan’s military assembles on its own soil. The detente has been watched with suspicion by Pakistan’s neighbour and arch-foe India, which broadly stood in the Soviet camp during the Cold War era. In the last two decades, the close Russia-India relationship has been underpinned by huge arms sales by Moscow to a country it calls a “strategic partner”. “If the Russians start backing the Pakistanis in a big way at the political level, then it creates a problem for us,” said Sushant Sareen, a leading expert on India’s relations to Pakistan and Afghanistan with New Delhi-based Observer Research Foundation. India’s foreign ministry did not respond to a request for comment on Russia’s ties with Pakistan, but has previously said that its own relations with Moscow have stood the test of time, and that the two nations are building up defence and energy relations, including collaboration on nuclear reactors in India.  Russian overtures to Pakistan offer a badly needed diplomatic lifeline for the South Asian nation as it faces growing friction with Western powers over its alleged links to militants. At U.S. urging, and with backing from Britain, France and Germany, a global financial watchdog, the Financial Action Task Force (FATF), last month decided to place Pakistan back on its watchlist of countries with inadequate terrorist-financing controls, potentially hurting Pakistan’s fragile economy. The U.S. move, which Islamabad angrily dismissed as an effort to “embarrass” Pakistan, followed Washington’s announcement in January to suspend $2 billion in military assistance. Asif, Pakistan’s foreign minister, said his nation made a historical error by “tilting 100 percent” to the West and was now eager build alliances closer to home with the likes of China, Russia and Turkey. “We want to correct the imbalance of our foreign policy over 70 years,” Asif told Reuters. “We are not divorcing that relationship (with the West). But we want to have a balance in our relationships, we want to be closer to our friends in our region.” Defence minister Khan said Pakistan’s military, which has historically been heavily reliant on U.S. weapons and aircraft, may have no choice but to ramp up purchases from the likes of Russia. The cooling relationship with Washington is already pushing Islamabad closer to China, which is investing about $60 billion in infrastructure in Pakistan. But analysts say Pakistan is wary of becoming overly dependent diplomatically on Beijing. Pakistan is among several nations that have been courted by Moscow after falling out with Washington, including the Philippines and Qatar, but Russia’s long-term aims for the Pakistan relationship are unclear, according to Petr Topychkanov, a senior researcher at the Stockholm International Peace Research Institute.  “It’s not very transparent, even in Russia,” he said. “There is no serious public debate, there is no detailed explanation to the Russian public about what Russia wants in Pakistan.” Russia’s foreign ministry did not immediately respond to a request for comment about Moscow’s increasingly close relations with Pakistan. Russia and Pakistan are negotiating potential energy deals worth in excess of $10 billion, according to Pakistani energy officials.  Asif said four to five huge power projects “will cement our relationship further”. Russia last month appointed an honorary council in the Pakistan’s northern Khyber Pukhtunkhwa province, where its companies are in talks to build an oil refinery and a power station. But the biggest deals focus on gas supply and infrastructure to Pakistan, one of the world’s fastest growing liquefied natural gas (LNG) import markets. “On a strategic basis, Russia is coming in very fast on the energy side,” said a senior Pakistani energy official. In October, Pakistan and Russia signed an inter-governmental agreement (IGA) on energy, paving the way for Russian state-giant Gazprom to enter negotiations to supply LNG to Pakistan. The talks are expected to conclude within three months and Gazprom is considered “one of the front-runners” to clinch a long-term supply deal, according to the Pakistani official. Based on two monthly LNG cargo deliveries, that deal would be worth about $9 billion over 15 years, he added. There is also growing confidence that a gas pipeline due to be built by Russia, stretching 1,100 km (680 miles) from Lahore to the port city of Karachi, will go ahead. U.S. sanctions against Russian state conglomerate Rostec, as well as a dispute over North-South pipeline transport fees, have held up the $2 billion project since it was signed in 2015. The North-South pipeline would be the biggest infrastructure deal by Russia since early 1970s, when Soviet engineers constructed the Pakistan Steel Mills industrial complex. A Russian company, according to defence minister Khan, is eying up a deal to take over the disused Soviet-built steel mills. Reporting by Drazen Jorgic; Additional reporting by Oksana Kobzeva in MOSCOW and Sanjeev Miglani in NEW DELHI; Editing by Alex Richardson",https://uk.reuters.com/article/pakistan-russia/with-gas-and-diplomacy-russia-embraces-cold-war-foe-pakistan-idUKL8N1QJ4PL,05 Mar 2018,"As U.S. influence in
Islamabad wanes, Pakistan's former adversary Russia is building
military, diplomatic and economic ties that could upend historic
alliances in the region and open up a fast-growing gas market
for Moscow's energy companies.","With gas and diplomacy, Russia embraces Cold War foe Pakistan"
2018-03-05," LONDON (Reuters) - Hedge funds rediscovered some of their confidence in the oil market in the final week of February, as OPEC reiterated its commitment to output restraint and benchmark prices stabilised above $60 per barrel. Hedge funds and other money managers boosted their combined net long position in the six most important futures and options contracts linked to petroleum prices by 68 million barrels in the week to Feb. 27. Portfolio managers boosted their net long position for the first time after reducing it by a total of 263 million barrels over the previous four weeks, according to records published by regulators and exchanges. Net length increased in Brent (+21 million barrels), NYMEX and ICE WTI (+18 million barrels), European gasoil (+15 million barrels), U.S. gasoline (+9 million barrels) and U.S. heating oil (+5 million barrels). The mild bout of liquidation that occurred between mid-January and the middle of February appears to have run its course without making much of a dent in hedge fund long positions (Chartbook: tmsnrt.rs/2D1lwfo). Fund managers still hold more than 11 long futures and options positions for every short across the petroleum complex, not far off the record set at the end of January. Bullish positions in crude and refined fuels remain at levels that had never been recorded before the start of this year, with fund managers holding long positions amounting to more than 1,400 million barrels. Yet few dare express a contrary bearish view. Short positions actually declined by 11 million barrels in the most recent week to just 126 million, the lowest level since June 2014, when Islamist militants were threatening the oilfields of northern Iraq. Lopsided hedge fund positioning remains an important source of downside risk to oil prices if and when fund managers try to realise some of their profits. For the time being, however, most portfolio managers seem convinced prices will rise further before the eventual correction. Global growth remains strong and oil consumption is set to increase by more than 1.5 million barrels per day for the fourth year running in 2018. Most of the excess inventories that accumulated between 2014 and 2016 have been eliminated, with oil stocks in industrialised countries now reduced close to the five-year average. Production from U.S. shale plays is rising strongly but OPEC’s willingness to sacrifice market share to support prices has convinced many investors that downside risk is limited in the near term. For now, the oil market remains locked in a bullish phase (“Why stock markets crash: critical events in complex systems”, Sornette, 2003). The bull market has survived its first test of resolve, but there will be others.  The opinions expressed here are those of the author, a columnist for Reuters. Related columns: “Hedge funds continue to exit oil but OPEC stems rout”, Reuters, Feb. 27 “Hedge funds lighten bullish positions in oil”, Reuters, Feb. 20 “Oil prices tumble as hedge funds liquidate record bullish position”, Reuters, Feb. 12 “Hedge funds pause oil buying as rally runs out of steam”, Reuters, Feb. 5 Editing by Dale Hudson",https://uk.reuters.com/article/oil-hedgefunds-kemp/column-hedge-funds-recover-nerve-after-oil-sell-off-kemp-idUKL5N1QN44S,05 Mar 2018,"Hedge funds rediscovered some of
their confidence in the oil market in the final week of
February, as OPEC reiterated its commitment to output restraint
and benchmark prices stabilised above $60 per barrel.",COLUMN-Hedge funds recover nerve after oil sell-off: Kemp
2018-03-05,"BERLIN (Reuters) - Angela Merkel does not want Germany’s national anthem to be changed, her spokesman said after a member of the chancellor’s Social Democrat (SPD) coalition partner said words such as “fatherland” and “brotherland” should be made gender neutral.  The SPD’s Kristin Rose-Moehring, equality commissioner for Germany since 2001, wrote to family ministry staff to suggest striking male-specific references in the “Song of Germany”, which has been Germany’s national anthem since 1922, media reported on Sunday. The reports surfaced shortly before the SPD announced that two-thirds of its members had voted in favour of joining an alliance with Merkel’s conservatives, with whom they have been in power since 2013. That paves the way for a new government under Merkel to start work in mid-March. Rose-Moehring proposed replacing “Vaterland” (fatherland) in the anthem with “Heimatland” (homeland) and ditching “brotherly with heart and hand” in favour of “courageously with heart and hand”.  But Merkel deems any such tweaks unnecessary. “The chancellor is very happy with our nice national anthem as it is in its traditional form and doesn’t see any need for change,” spokesman Steffen Seibert told a regular news conference on Monday. A spokesman for the family ministry said Rose-Moehring’s letter had been a personal proposal and he could not comment on it, especially as it was an internal letter to employees at the family ministry. The first stanza of the anthem, which declares “Germany, Germany above all else” - reflecting efforts to unify Germany in the 19th century - and the second, with its refrain of “German women, German loyalty, German wine and German song” were officially dropped in 1991 following reunification. Reporting by Michelle Martin and Andrea Shalal, Editing by William Maclean",https://uk.reuters.com/article/germany-anthem/merkel-rejects-plea-to-make-national-anthem-gender-neutral-idUKL5N1QN456,05 Mar 2018,"Angela Merkel does not want
Germany's national anthem to be changed, her spokesman said
after a member of the chancellor's Social Democrat (SPD)
coalition partner said words such as ""fatherland"" and
""brotherland"" should be made gender neutral.",Merkel rejects plea to make national anthem gender-neutral
2018-03-05,"LONDON, March 5 (Reuters) - The British government has delayed a decision on whether to allow a new open cast coal mine to be built in northeastern England, the developers of the project said on Monday. Northumberland County Council agreed last year that developer The Banks Group could extract 3 million tonnes of coal by cutting an open cast, or surface mine, near Druridge Bay, Highthorn but the minister for local government, Sajid Javid, called for a public enquiry. The minister was due to issue a final verdict on Monday, but The Banks Group said in a statement this had been delayed, without giving a new deadline. “We remain keen to progress our investment and job creation plans at Highthorn as soon as possible, and are therefore extremely disappointed at this further delay,” Jeannie Kielty, the group’s community relations manager, said in the statement. Officials at the Ministry of Housing, Communities and Local Government were immediately available to comment on whether the decision had been postponed. Britain plans to phase-out coal use at its power stations by 2025, and has led an international charge for other countries to do the same. Environmentalist have criticised the plans for a new mine in Britain, saying it would destroy an area of natural beauty and that extracting more coal is at odds with international pledges to reduce greenhouse gas emissions under the Paris climate pact. Proponents of the project argue it could bring much needed jobs to an economically deprived part of the country. The Banks Group says Highthorn will employ 100 people and generate almost 50 million pounds ($69 million) in related contracts and other benefits to the community. $1 = 0.7235 pounds
Reporting by Susanna Twidale
Editing by Edmund Blair",https://uk.reuters.com/article/britain-coal-mine/britain-delays-decision-on-new-coal-mine-developer-idUKL5N1QN3KF,05 Mar 2018,"The British government has
delayed a decision on whether to allow a new open cast coal mine
to be built in northeastern England, the developers of the
project said on Monday.",Britain delays decision on new coal mine – developer
2018-03-05,"* Emerging and Italian equities lead downturn * Trump’s tariff threat met with warnings of retaliation * Italian voters deliver a hung parliament * Euro falls versus yen, dollar (Updates prices, adds quotes) By Sujata Rao LONDON, March 5 (Reuters) - World shares slipped for the fifth straight day on Monday and emerging markets weakened sharply, hit by the prospect of a global trade war and political instability in Europe after Italy’s inconclusive weekend election. While most markets stabilised after sharp losses early in the day, assets considered low-risk - including gold, the yen and German bonds - remained in demand, with yields on the latter at the lowest in a month. Recent events have again put equity markets, barely recovered from their February selloff, under a cloud. The European Union, Canada and China are among those threatening to retaliate with tit-for-tat duties if U.S. President Donald Trump proceeds with hefty tariffs on steel and aluminium imports. Such a full-blown trade war could significantly damage company profits, equity returns and economic growth, all of which have benefited from the trade upswing of recent years. World shares have risen around 50 percent since early-2016. Jitters grew further after Sunday’s Italian election, where voters delivered a hung parliament, flocking to anti-immigrant and eurosceptic parties in record numbers, potentially endangering stability and wider European integration. “There is nothing in the global set-up that’s positive for equities at the moment especially as (share) prices are still out of whack with latest developments,” said Salman Ahmed, chief investment strategist at Lombard Odier Investment Managers. Wall Street, where the Dow Jones index fell 3 percent last week, was set to open weaker, futures indicated While Italian stocks remained 1 percent lower at six-month lows, broader European markets reversed opening losses to rise 0.5 percent. That left MSCI’s all-country equity index marginally in the red, though emerging equities fell 0.7 percent , near three-week lows. Ahmed said developments in Italy represented a “a medium-to-small shock” with implications for asset prices, while the risk of trade wars was a far bigger issue. “Markets are not priced for trade wars and now you are also seeing a negative reaction to the U.S. moves from Europe and Canada,” he said. “The major vulnerability is in emerging markets,” he added, referring to the developing world’s reliance on trade. Most emerging currencies weakened around 0.3-0.5 percent to the dollar  . Export-reliant Asian bourses such as Hong Kong and Seoul closed 1-2 percent lower The growth concerns pushed investors towards Bunds, with 10-year German yields falling to nearly six-week lows . Gold likewise benefited from the turbulence, rising to one-week lows. Yields on 10-year Italian government bonds jumped 10 basis points at the open, reversing some of the gains they had enjoyed in the run-up to the election but they later clawed back some losses to trade 6.5 bps higher. Yields on other lower-rated European bonds from Spain and Portugal also were up on the day . Investors noted Italy had overshadowed positive news from Germany where Social Democrats on Sunday decisively backed forming a coalition government with Chancellor Angela Merkel’s conservatives, ending a five-month stalemate. Also, unlike past crises as in 2012, Europe’s robustly growing economy was seen mitigating some political risks. “Investors still believe that politics appear less likely to upset the apple cart than only a year ago and Eurozone growth could be hitting three percent this year,” said John Taylor, fixed income portfolio manager at Alliance Bernstein in London. The euro which earlier in the day fell 0.7 percent to six-month lows versus the yen, erased some losses to stand 0.2 percent lower by 1200 GMT while against the dollar too, it rose to trade flat. The dollar meanwhile rose slightly off one-week lows against a basket of currencies and stayed a touch off November 2016 lows plumbed versus the yen immediately after Trump’s trade threats last week. Dollar traders might hold fire, however, until this Friday’s U.S. jobs data, the very dataset which triggered a selloff at the end of January by stoking expectations of faster rate rises by the Federal Reserve. Reporting by Sujata Rao; additional reporting by Swati Pandey
in Sydney; Abhinav Ramnarayan and Dhara Ranasinghe in London;
Editing by Toby Chopra",https://uk.reuters.com/article/global-markets/global-markets-trade-war-fears-italian-election-buffet-world-shares-idUKL4N1QN36X,05 Mar 2018,"* Euro falls versus yen, dollar
(Updates prices, adds quotes)","GLOBAL MARKETS-Trade war fears, Italian election buffet world shares"
2018-03-05,SPOKESMAN FOR IRAN’S ATOMIC ENERGY ORGANISATION KAMALVANDI SAYS NUCLEAR DEAL WITH MAJOR POWERS CANNOT BE RENEGOTIATED - TV,https://uk.reuters.com/article/iran-nuclear-enrichment/iran-says-can-produce-higher-enriched-uranium-in-less-than-two-days-tv-idUKL5N1QN3B5,05 Mar 2018,"Iran said on Monday it could
produce higher enriched uranium within two days if the United
States quit a 2015 nuclear deal between Tehran and six major
powers, Tehran's Arabic language al-Alam TV reported.",Iran says can produce higher enriched uranium in less than two days - TV
2018-03-05,SPOKESMAN FOR IRAN’S ATOMIC ENERGY ORGANISATION KAMALVANDI SAYS NUCLEAR DEAL WITH MAJOR POWERS CANNOT BE RENEGOTIATED - TV,https://uk.reuters.com/article/irans-nuclear-official-says-tehran-can-p/irans-nuclear-official-says-tehran-can-produce-highly-enriched-uranium-in-less-than-two-days-if-u-s-quits-nuclear-deal-tv-idUKMT1ALTL5N1QN3B51,05 Mar 2018,IRAN'S NUCLEAR OFFICIAL SAYS TEHRAN CAN PRODUCE HIGHLY ENRICHED URANIUM IN LESS THAN TWO DAYS IF U.S. QUITS NUCLEAR DEAL - TV,IRAN'S NUCLEAR OFFICIAL SAYS TEHRAN CAN PRODUCE HIGHLY ENRICHED URANIUM IN LESS THAN TWO DAYS IF U.S. QUITS NUCLEAR DEAL - TV
2018-03-05,SPOKESMAN FOR IRAN’S ATOMIC ENERGY ORGANISATION KAMALVANDI SAYS NUCLEAR DEAL WITH MAJOR POWERS CANNOT BE RENEGOTIATED - TV,https://uk.reuters.com/article/spokesman-for-irans-atomic-energy-organi/spokesman-for-irans-atomic-energy-organisation-kamalvandi-says-nuclear-deal-with-major-powers-cannot-be-renegotiated-tv-idUKMT1ALTL5N1QN3B52,05 Mar 2018,SPOKESMAN FOR IRAN'S ATOMIC ENERGY ORGANISATION KAMALVANDI SAYS NUCLEAR DEAL WITH MAJOR POWERS CANNOT BE RENEGOTIATED - TV,SPOKESMAN FOR IRAN'S ATOMIC ENERGY ORGANISATION KAMALVANDI SAYS NUCLEAR DEAL WITH MAJOR POWERS CANNOT BE RENEGOTIATED - TV
