publish_datetime,content,href,publish_timestr,summarize,title
2018-06-12,"* Utility demand, tight supply boosting fuel oil crack since April * Crack to remain elevated through summer on utility demand * Disruptions, lower crude prices could limit post-summer decline By Roslan Khasawneh SINGAPORE, June 12 (Reuters) - Asian refining margins for fuel oil are set to hold near their current strong levels through the summer as increased use of the fuel by utilities to power air conditioners for cooling and disruptions to trade flows shrink global supplies. “Robust power generation demand in the Middle East (notably Saudi Arabia) should result in lower fuel oil outflows from the region,” said Iman Nasseri, managing director of energy consultancy FGE’s Middle East office. While fuel oil markets typically strengthen during the northern hemisphere summer months, four trade sources said fuel oil margins have demonstrated additional strength this year by shrugging off sharp gains in crude oil prices, which in mid-May climbed to their highest since November 2014. The trade sources declined to be identified as they are unauthorised to speak to the media. “Fears over falling Iranian supply ... structural falls in global supply, and a strong seasonal demand uptick in the Middle East for power generation are combining to provide support,” Vienna-based consultancy JBC Energy said in a research note last week. Lower fuel oil output in Venezuela due to refinery outages and a lack of crude oil, and refinery upgrades in Russia, the Middle East, India and South Korea have all contributed to tightening global supplies of the fuel, used to generate electricity and power industrial boilers and ships. With the fuel oil surplus in the Middle East shrinking this year and next due to increased oil-fired power plant expansions, the region is projected to become a net fuel oil importer by mid-2019, though only for a short period of time, Nasseri said. Increasing Saudi Arabian power demand amid falling supply from there, the United Arab Emirates and Kuwait underpin the big shift, he said. The 180-centistoke high-sulphur fuel oil discount to Dubai crude on Monday settled at $3.21 a barrel, with Dubai crude DUB-1M-A holding above $74 a barrel. In November 2014, when Dubai crude was last at similar levels, the same fuel oil crack or margin was at a discount wider than $6 a barrel. Reflecting fuel oil’s strength, the Singapore crack was the only one to post gains over the past few weeks, with ample supplies and rising crude prices weighing on other refined fuels, including gasoline and diesel. “Fuel oil cracks should weaken as we move through (second-half 2018) as seasonal demand support wanes and destocking pressures from a highly backwardated market ... compensate for growing tightness in the fundamental balance,” JBC said. While strength in fuel oil markets subsides with the passing of peak utility demand, though, some analysts and traders see limited downside for fuel oil in the second half of the year. In addition to tightening supplies, looming U.S. sanctions on  oil exports from Iran - a major fuel oil producer with exports of about 17 million tonnes in 2017 - could further limit fuel oil outflows, mainly to Asia. Also, expectations of higher crude supplies in the second half of the year amid rising output from producers outside the Organization of the Petroleum Exporting Countries, including the United States and Russia, could weigh on crude prices, potentially lending support to fuel oil cracks. Reporting by Roslan Khasawneh; Editing by Tom Hogue",https://uk.reuters.com/article/global-fueloil/asia-fuel-oil-margins-to-be-supported-through-mid-year-on-strong-demand-idUKL3N1T837K,12 Jun 2018,"* Utility demand, tight supply boosting fuel oil crack since
April",Asia fuel oil margins to be supported through mid-year on strong demand
2018-06-12,"SHANGHAI/BEIJING, June 12 (Reuters) - Chinese truck drivers are demonstrating against higher fuel costs and the dominance of local truck hire platform Manbang which they said is squeezing incomes, a potential headache for the firm backed by SoftBank Group Corp and Alphabet Inc. Since late last week, demonstrations by truck drivers have been seen in over a dozen locations around China, according to Hong Kong-based China Labour Bulletin, which tracks labour action in mainland China. On social media, photos and videos circulated showing long lines of parked trucks adorned with banners. The demonstrations come as oil prices hit their highest level since 2014 in recent weeks, scraping $80 per barrel and stoking cost increases for businesses and consumers, especially in large oil-importing nations such as China. The truck drivers also cited a squeeze on haulage rates due to the dominance of Manbang, formally known as Full Truck Alliance Group. Manbang raised $1.9 billion in April from Japan’s Softbank and Alphabet’s venture capital fund CapitalG. The firm is often described as China’s “Uber for trucks”, in reference to U.S. ride-hailing firm Uber Technologies Inc . It runs an app that allows companies to connect with truck drivers - often independent contractors - tapping into demand for haulage in one of the world’s busiest markets for goods transport. China Labour Bulletin said that earlier in June, Manbang implemented a policy to prevent registered truck drivers and customers from contacting each other directly, to ensure transactions and haulage rates were set only via the app. Manbang, formed in a merger of haulage platforms Yun Man Man and Huo Che Bang, did not respond to requests for comment. The firm in April said 5.2 million of China’s 7 million freight trucks were members of the Full Truck Alliance Group. Demonstrations were recorded in provinces including Shandong, Sichuan, Chongqing, Anhui, Guizhou, Jiangxi, Shanghai, Hubei, Henan and Zhejiang, the labour monitor said. Banners featured slogans such as “boycott low prices” and “truckers all rise”. There were also messages threatening violence toward truck drivers who did not strike. So far, there have been no reports of any significant impact from the demonstrations. China’s truckers are not alone. On Sunday, drivers in Bosnia blocked roads to demonstrate against rising fuel prices. Reporting by Adam Jourdan and Pei Li
Editing by Christopher Cushing",https://uk.reuters.com/article/china-trucks-protests/chinese-truckers-demonstrate-over-high-fuel-costs-truck-hailing-app-manbang-idUKL4N1TE379,12 Jun 2018,"Chinese truck drivers
are demonstrating against higher fuel costs and the dominance of
local truck hire platform Manbang which they said is squeezing
incomes, a potential headache for the firm backed by SoftBank
Group Corp and Alphabet Inc.","Chinese truckers demonstrate over high fuel costs, truck-hailing app Manbang"
2018-06-12,"(Updates with fresh levels throughout, adds analyst comment) * MSCI ex-Japan up 0.15 pct, South Korea’s Kospi pares losses * Trade volatile as U.S.-North Korea summit gets underway * Dollar rises to the highest in 3 weeks against yen By Swati Pandey SYDNEY, June 12 (Reuters) - The dollar hovered near 3-week highs on Tuesday and Asian shares gained as U.S. President Donald Trump and North Korean leader Kim Jong Un signed a ‘comprehensive’ deal at a historic summit aimed at the denuclearisation of the Korean peninsula. Trump said the process of denuclearisation would happen “very, very quickly”, adding he had formed a “special bond” with Kim and the relationship with North Korea would be very different. “The letter that we’re signing is very comprehensive and I think both sides are going to be very impressed with the result,” Trump said after a “really very positive” summit meeting in Singapore. “A lot of goodwill went into this, a lot of work, a lot of preparation.” Both leaders are set to hold a press conference later. The dollar rose against the safe-haven yen, while the Korean won pared gains to stay near a recent two-week trough. Spreadbetters pointed to a firm start for Europe while E-Minis for the S&P 500 also gained 0.1 percent. Kim had earlier said the meeting was “a good prelude to peace”, just months after the two leaders traded insults and tensions spiralled in the region over the reclusive regime’s nuclear programmes. Yet, there was some unease among investors about the outcome of the talks given the tense relations between the two nations. The combatants of the 1950-53 Korean War are technically still at war, as the conflict, in which millions of people died, was concluded only with a truce. In Asian equity markets, trading was volatile with Japan’s Nikkei paring early gains to close 0.3 percent higher after earlier rising as much as 0.9 percent. MSCI’s broadest index of Asia-Pacific shares outside Japan seesawed between positive and negative territory, and was last up 0.15 percent. South Korean shares were a tad weaker while Chinese shares were buoyant after starting in the red. The blue-chip CSI 300 index jumped about 1.3 percent. “The peace on the Korean peninsula could deliver significant benefits to both North and South Korea, including potentially a re-rating for South Korean stocks,” analysts at Singapore’s DBS said in a note. “The landmark summit meeting should help to remove a major tail risk for the region’s markets and economies,” they added. “However, it would be prudent to contain excessive optimism, given the enormous gulf between the two Koreas and the costs of reunification.” Many analysts were uncertain about the overall impact on global economies and markets from the peace talks, with some pointing to a growing risk of an international trade war as a much bigger headwind to world growth. Just this past weekend, Trump upset the Group of Seven’s efforts to show a united front, choosing to back out of a previous joint communique. The action drew criticism from Germany and France, and Trump called Canadian Prime Minister Justin Trudeau “very dishonest and weak.” However, “markets are generally shrugging off the G7 trainwreck,” said Ray Attrill, head of forex strategy at National Australia Bank. Instead, they are looking ahead to a busy week. Tuesday’s North Korea summit will be followed by policy meetings of the U.S. Federal Reserve and the European Central Bank as well as a Brexit bill vote in the British parliament. The dollar was well bid on Tuesday, up 0.2 percent against a basket of major currencies. The U.S. Federal Reserve is virtually guaranteed to raise interest rates this week while investors are focused on the U.S. monetary policy outlook. On the safe haven yen, the dollar jumped to a three-week top of 110.49 in early deals. It was last at 110.37. Helping calm markets were comments from Italy’s new coalition government that it had no intention of leaving the euro zone and planned to cut debt. The euro stepped back from a three-week high of $1.1840 to be last down 0.2 percent at $1.1764. In commodities, U.S. crude was rose 10 cents to $66.20 per barrel, while Brent climbed 4 cents to $76.49. Spot gold slipped 0.2 percent to $1,297.12 an ounce. Editing by Shri Navaratnam",https://uk.reuters.com/article/global-markets/global-markets-stocks-dollar-rise-as-trump-kim-sign-comprehensive-document-at-landmark-summit-idUKL4N1TE2RW,12 Jun 2018,"* MSCI ex-Japan up 0.15 pct, South Korea's Kospi pares
losses","GLOBAL MARKETS-Stocks, dollar rise as Trump, Kim sign 'comprehensive' document at landmark summit"
2018-06-12,"(Updates with fresh levels throughout, adds analyst comment) * MSCI ex-Japan up 0.2 pct, South Korea’s Kospi reverses losses * Trade volatile as U.S.-North Korea summit gets underway * Dollar rises to the highest in 3 weeks against yen By Swati Pandey SYDNEY, June 12 (Reuters) - The dollar jumped to a 3-week top on Tuesday and Asian shares  rose as U.S. President Donald Trump said a summit meeting with North Korea’s Kim Jong Un had made “a lot of progress,” boosting hopes of a landmark deal to end a nuclear standoff on the Korean peninsula. Asked by reporters how the historic talks were going, Trump said: “A lot of progress - really very positive. I think better than anybody could have expected. Top of the line, very good. We’re going now for a signing.” He gave no further details. Kim had earlier said the meeting was “a good prelude to peace”, just months after the two leaders traded insults and tensions spiralled in the region over the reclusive regime’s nuclear programmes. Yet, there was some unease among investors about the outcome of the talks given the tense relations between the two nations. The combatants of the 1950-53 Korean War are technically still at war, as the conflict, in which millions of people died, was concluded only with a truce. The dollar rose against the safe-haven yen, while the Korean won gained 0.2 percent to edge above a recent two-week trough. E-Minis for the S&P 500 were barely changed. In Asian equity markets, trading was volatile with Japan’s Nikkei paring early gains to add 0.5 percent after earlier rising as much as 0.9 percent. MSCI’s broadest index of Asia-Pacific shares outside Japan seesawed between positive and negative territory, and was last up 0.2 percent. South Korean shares reversed losses to inched 0.1 percent higher, while Chinese shares were buoyant after starting in the red with the blue-chip jumping 0.9 percent. “The key question is whether this summit will lead to a lasting, materially positive outcome,” analysts at OCBC said in a note. “From an international relations perspective, this appears unlikely. What is perhaps more likely, is a positive opening act in a long drawn drama,” they said. “Expect a positive risk environment to persist if the summit can conclude without hiccups.” Many analysts said the bar was pretty low for what will be deemed a ‘successful’ summit, given the past failures in talks with North Korea. “So today, we have the opportunity for a historic meeting, a possible end to the Korean war, and a possible move to denuclearise, and maybe even demilitarize the Korean peninsula,” said Robert Carnell, chief economist Asia-Pacific at ING. “All of that’s great, but how can you make money from it. Well, the short answer is you probably shouldn’t even try.” Carnell said that a far bigger “existential global threat” was the ongoing tariff dispute after Trump upset the Group of Seven’s efforts to show a united front, choosing to back out of a previous joint communique. The action drew criticism from Germany and France, and Trump called Canadian Prime Minister Justin Trudeau “very dishonest and weak.” However, “markets are generally shrugging off the G7 trainwreck,” said Ray Attrill, head of forex strategy at National Australia Bank. Instead, they are looking ahead to a busy week. Tuesday’s North Korea summit will be followed by policy meetings of the U.S. Federal Reserve and the European Central Bank as well as a Brexit bill vote in the British parliament. The dollar was well bid on Tuesday, with the dollar index up 0.1 percent against a basket of major currencies. The U.S. Federal Reserve is virtually guaranteed to raise interest rates this week while investors are focused on the U.S. monetary policy outlook. On the safe haven yen, the dollar jumped to a three-week top of 110.49 in early deals. It was last at 110.23. Helping calm markets were comments from Italy’s new coalition government that it had no intention of leaving the euro zone and planned to cut debt. The euro stepped back from a three-week high of $1.1840 to be last down 0.1 percent at $1.1769. In commodities, U.S. crude was rose 14 cents to $66.24 per barrel, while Brent dipped 5 cents to $76.51. Spot gold slipped 0.2 percent to $1,297.31 an ounce. Editing by Shri Navaratnam",https://uk.reuters.com/article/global-markets/global-markets-stocks-dollar-rise-as-trump-says-us-north-korea-summit-really-very-positive-idUKL4N1TE2IM,12 Jun 2018,"* MSCI ex-Japan up 0.2 pct, South Korea's Kospi reverses
losses","GLOBAL MARKETS-Stocks, dollar rise as Trump says US-North Korea summit ""really very positive"""
2018-06-12,"HOUSTON, June 12 (Reuters) - Exxon Mobil Corp is pushing deeper into energy trading, building a global cadre of experienced traders and beefing up risk-management systems to lift profit, according to executive recruiters and people familiar with the business. The development is a sea change for a company that has stood out from rivals by limiting its past activity out of concern it would be accused of market manipulation. Exxon now aims to trade around more of its growing energy assets to get the best prices for its products and increase earnings, according to an employee familiar with the matter. Expanded trading could add hundreds of millions of dollars to annual earnings from its own buying and selling of crude and fuels, but also comes with problems, including higher risk. Exxon expects to add 1 million barrels per day of output over the next several years as new oilfields and refinery expansions kick in, giving it more assets to trade. Exxon last year retained John Masek, a former trader at Swiss-based Glencore, the world’s second largest buyer and seller of petroleum, to consult on gasoline trading. Earlier this year, it poached four gasoline market specialists from refiner Phillips 66. This month, Exxon hired former BHP Billiton Plc trader Nelson Lee as an international crude trader, the people familiar with the matter said. In 2014, Lee orchestrated BHP’s first-ever crude exports by maintaining the lightly refined oil met criteria for an exportable product. The deals helped usher in the end to a U.S. prohibition on crude exports more than a year later. The company has also added crude, products and liquefied natural gas specialists to London and Singapore offices. It recently hired Paul Butcher, a trader who has worked at BP Plc , Glencore and Vitol, to advise on North Sea markets and accounting for trading transactions. “Paul is known for being a very aggressive, old school crude trader. Exxon would have never hired a risk taker of that scale in the old days. The fact that he is consulting them shows they are considering changes in trading very seriously,” said a trading house executive who knows Butcher. Phillips 66 declined to comment on the employee departures. Exxon spokesman Scott Silvestri referred questions about its trading business and recent hiring to regulatory filings, which note the historical use of financial derivatives and geographic scale to manage commodity price risks. Chief Executive Darren Woods wants to increase Exxon’s profit and appetite for risk at a measured pace, according to people who deal with Exxon. The U.S. operation runs from a trading floor at its Spring, Texas campus that has expanded to as many as 70 workers who will handle everything from Canadian crude to gasoline, jet fuel and diesel. “Trading has been a virtual four-letter word at Exxon,” said Ehud Ronn, a University of Texas finance professor who studies energy and financial risk management. Exxon has drawn most top managers from engineering backgrounds, not financial services. “A change in their trading policy would indeed be transformational.” Exxon has long lagged behind rivals BP Plc, Chevron Corp and Royal Dutch Shell Plc, which have created trading units that occasionally generate more profit than their refining businesses. Woods faces pressure from Exxon investors to lift shares that trade at the same price as 10 years ago. He promised shareholders this year that he can double profit and increase its oil and gas output by 25 percent by 2025. The company’s expanded focus on trading brings challenges including added risk from options, swaps and other derivatives, and developing risk-management and compensation systems for the larger business. Exxon has focused on hedges that allow it to get the best prices for its products and protect it against price shifts as its cargoes move to markets. Exxon has held talks with at least two developers of risk-management software, Enuit LLC and Allegro Development Corp, people familiar with the discussions said. Both offer packages that manage logistics and measure financial exposure. The companies declined to comment on their discussions with Exxon, according to spokespeople. Exxon has also put company veteran managers in charge of overall trading and risk controls at its Spring, Texas, floor, one person familiar with its operations said, to avoid potential losses as it expands trading. “We’ve heard whispers in the market about this for a few years, so it’s great to see them finally hiring commercial talent externally,” said an executive recruiter familiar with some of the recent hires but who was not directly involved. (Additional reporting by Ron Bousso and Dmitry Zhdannikov in London and Henning Gloystein in Singapore; Writing by Gary McWilliams; Editing by Richard Pullin)",https://uk.reuters.com/article/exxon-mobil-trading/exclusive-exxon-mobil-breaks-with-past-bulks-up-energy-trading-to-boost-profit-idUKL1N1TD0OM,12 Jun 2018,"Exxon Mobil Corp is
pushing deeper into energy trading, building a global cadre of
experienced traders and beefing up risk-management systems to
lift profit, according to executive recruiters and people
familiar with the business.","EXCLUSIVE-Exxon Mobil breaks with past, bulks up energy trading to boost profit"
2018-06-12,"ASTANA, June 12 (Reuters) - Kazakhstan’s oil output in the first five months of 2018 rose 6.4 percent from the same time a year ago to 37.7 million tonnes, the Deputy Energy Minister Makhambet Dosmukhambetov said on Tuesday. Output at Tengizchevroil, owned by Chevron, ExxonMobil, Lukoil and KazMunayGaz was 12.5 million tonnes. The giant Kashagan field, developed by Eni, ExxonMobil, CNPC, Shell, Total, Inpex and KazMunayGaz, produced 5.0 million tonnes. The Karachaganak field, operated by a Shell- and Eni-led consortium, produced 5.2 million tonnes. Kazakhstan’s total oil exports from January to May rose 5.7 percent from the same time a year ago to 30.6 million tonnes, Dosmukhambetov told a government meeting. (Reporting by Raushan Nurshayeva; Writing by Olzhas Auyezov; Editing by Christian Schmollinger)",https://uk.reuters.com/article/kazakhstan-oil-output/kazakhstans-jan-may-oil-output-rises-6-4-percent-from-a-year-ago-idUKL8N1TE0EI,12 Jun 2018,"Kazakhstan's oil output in the
first five months of 2018 rose 6.4 percent from the same time a
year ago to 37.7 million tonnes, the Deputy Energy Minister
Makhambet Dosmukhambetov said on Tuesday.",Kazakhstan's Jan-May oil output rises 6.4 percent from a year ago
