publish_datetime,content,href,publish_timestr,summarize,title
2018-12-04,"(Reuters) - Xcel Energy Inc, one of the largest U.S. utilities, on Tuesday unveiled plans to accelerate its carbon reduction goals, saying it will deliver only carbon-free electricity to customers by 2050. The Minneapolis-based company said it will cut carbon emissions by 80 percent from 2005 levels by 2030, up from a previous target of 60 percent. The company has already slashed those emissions by 35 percent, it said in a statement. “We’re accelerating our carbon reduction goals because we’re encouraged by advances in technology, motivated by customers who are asking for it and committed to working with partners to make it happen,” Xcel Chief Executive Ben Fowke said in a statement. Xcel serves millions of customers in eight Western and Midwestern U.S. states. (This corrects headquarters location to Minneapolis from Denver in paragraph 2.) Reporting by Nichola Groom; editing by Jonathan Oatis",https://uk.reuters.com/article/xcel-energy-carbon/corrected-major-u-s-utility-xcel-energy-says-it-will-be-carbon-free-by-2050-idUKL1N1Y91V0,04 Dec 2018,"Xcel Energy Inc, one of the
largest U.S. utilities, on Tuesday unveiled plans to accelerate
its carbon reduction goals, saying it will deliver only
carbon-free electricity to customers by 2050.",CORRECTED-Major U.S.utility Xcel Energy says it will be carbon-free by 2050
2018-12-04,"NEW YORK (Reuters) - Global stocks tumbled on Tuesday as a flattening Treasury yield curve sparked recession warnings, while optimism sharply waned that the United States and China would quickly resolve their trade dispute.  Benchmark Treasury 10-year yield fell to its lowest point since mid-September. The spread between the 10-year yield over its two-year counterpart also shrank to the smallest since the start of the financial crisis in January 2008, signaling to some investors an approaching U.S. economic slowdown.  “Today is the perfect storm,” said RJ Grant, head of trading at Keefe, Bruyette & Woods in New York. “You’ve nothing really tangible coming out of the G20 summit. You have worries about growth.” MSCI’s gauge of stocks across the globe shed 2.16 percent, its worst performance since October 11. The Dow Jones Industrial Average fell 799.36 points, or 3.1 percent, to 25,027.07, the S&P 500 lost 90.31 points, or 3.24 percent, to 2,700.06 and the Nasdaq Composite dropped 283.09 points, or 3.8 percent, to 7,158.43. The New York Stock Exchange and Nasdaq will be closed on Wednesday, for a day of mourning for former President George H.W. Bush, who died on Friday at the age of 94. The pan-European STOXX 600 index lost 0.76 percent. On Monday, stock markets around the world got some relief  after Washington and Beijing agreed to temporarily end their trade war during talks at the G20 summit in Argentina. Upon closer scrutiny, investors said a deal between the world’s two biggest economies was far from a sure bet. “As soon as investors digested the information from the discussions they focused on the uncertainties and lack of details,” said Ryan Nauman, market strategist, Informa Financial Intelligence, Zephyr Cove, Nevada.  There was added confusion over when the 90-day truce period, during which the United States and China would hold off on imposing more tariffs, would start. Additionally, U.S. President Donald Trump on Tuesday warned he would revert to tariffs if the two sides could not resolve their differences.  “If it is, we will get it done,” Trump wrote in a Twitter post. “But if not remember, I am a Tariff Man.” Meanwhile, the flattening U.S. yield curve weighed on investors’ minds.  “The focus is now shifting to the inverted U.S. bond yield curve, which has negative connotations, while implying the U.S. economy is heading towards what was, only a few weeks ago, an improbable economic slowdown,” said Stephen Innes, head of trading for APAC at Oanda.  Comments on Tuesday by New York Fed President John Williams about the path of interest rate hikes added to the uncertainty for investors.  Williams said the U.S. central bank should expect to continue raising interest rates “over the next year or so” even while it pays close attention to possible risks highlighted by financial markets. The comments came after those from Fed chair Jerome Powell last week, which lifted stocks as they were interpreted as suggesting a less aggressive path of rate hikes.  The dollar, which started the week on a weak footing as the apparent thaw in trade tensions between the U.S. and China cooled demand for the safe-haven currency, extended its fall as investors worried about the inversion of the short end of the U.S. yield curve in bond markets.  Sterling briefly drooped to a 17-month low on the day, before recovering ground to trade little-changed, in a volatile session dominated by Brexit-related headlines. Oil prices pared some gains as fears flared that demand would stall due to a trade war between the U.S. and China, and that Russia remained a stumbling block to a deal to cut global crude supply. [O/R] Brent crude oil settled at $62.08 per barrel, or jumped up 0.63 percent. U.S. light crude was last up 30 cents at $53.25. Additional reporting by Karin Strohecker, Shreyashi Sanyal, Jessica Resnick-Ault, Lewis Krauskopf, Andrew Galbraith and Chuck Mikolajczak; Editing by Bernadette Baum and Susan Thomas",https://uk.reuters.com/article/global-markets/global-markets-global-stocks-dive-on-growth-concerns-doubts-over-trade-truce-idUKL1N1Y91XK,04 Dec 2018,"* U.S. yield inversion spreads on concerns about slowing
growth","GLOBAL MARKETS-Global stocks dive on growth concerns, doubts over trade truce"
2018-12-04,"PARIS (Reuters) - France’s prime minister on Tuesday suspended planned increases to fuel taxes for at least six months in response to weeks of sometimes violent protests, the first major U-turn by President Emmanuel Macron’s administration in 18 months in office. In announcing the decision, Prime Minister Edouard Philippe said anyone would have “to be deaf or blind” not to see or hear the roiling anger on the streets over a policy that Macron has defended as critical to combating climate change. “The French who have donned yellow vests want taxes to drop, and work to pay. That’s also what we want. If I didn’t manage to explain it, if the ruling majority didn’t manage to convince the French, then something must change,” said Philippe. “No tax is worth jeopardising the unity of the nation.” Along with the delay to the tax increases that were set for January, Philippe said the time would be used to discuss other measures to help the working poor and squeezed middle-class who rely on vehicles to get to work and go shopping.  Earlier officials had hinted at a possible increase to the minimum wage, but Philippe made no such commitment.  He warned citizens, however, that they could not expect better public services and lower taxes. “If the events of recent days have shown us one thing, it’s that the French want neither an increase in taxes or new taxes. If the tax-take falls then spending must fall, because we don’t want to pass our debts on to our children. And those debts are already sizeable,” he said. The measures will cost around 2 billion euros (£1.7 billion), but will be offset by corresponding spending cuts, a government source said. The so-called “yellow vest” movement, which started on Nov. 17 as a social-media protest group named for the high-visibility jackets all motorists in France carry in their cars, began with the aim of highlighting the squeeze on household spending brought about by Macron’s taxes on fuel. However, over the past three weeks the movement has evolved into a wider, broadbrush anti-Macron uprising, with many criticising the president for pursuing policies they say favour the rich and do nothing to help the poor.  Despite having no leader and sometimes unclear goals, the movement has drawn people of all ages and backgrounds and tapped into a growing malaise over Macron’s leadership. Over the past two days, ambulance drivers and students have joined in and launched their own protests. Two unions, CGT and FO, called lorry drivers to start a strike from December 9 while several Facebook pages were also urging new rounds of demonstrations for next Saturday.   After three weeks of rising frustration, there was scant indication Philippe’s measures would placate the “yellow vests”, who themselves are struggling to find a unified position.  “The French don’t want crumbs, they want a baguette,” ‘yellow vest’ spokesman Benjamin Cauchy told BFM, adding that the movement wanted a cancellation of the taxes. Another one, Christophe Chalencon, was more blunt: “We’re being taken for idiots,” he told Reuters, using a stronger expletive. The timing of the tax U-turn is uncomfortable for Macron. It comes as governments meet in Poland to try to agree measures to avert the most damaging consequences of global warming, an issue Macron has made a central part of his agenda. His carbon taxes were designed to address the issue.  But the scale of the protests against his policies made it almost impossible to plough ahead.  While the “yellow vest” movement was mostly peaceful to begin with, the past two weekends have seen outpourings of violence and rioting in Paris, with extreme far-right and far-left factions joining the demos.    On Saturday, the Arc de Triomphe national monument was defaced and avenues off the Champs Elysees were damaged. Cars, buildings and some cafes were torched. The unrest is estimated to have cost the economy millions, with large-scale disruption to retailers, wholesalers, the restaurant and hotel trades. In some areas, manufacturing has been hit in the run up to Christmas. Macron, a 40-year-old former investment banker and economy minister, came to office in mid-2017 promising to overhaul the economy, revitalise growth and draw foreign investment by making the nation a more attractive place to do business.  In the process he earned the tag “president of the rich” for seeming to do more to court big business and ease the tax burden on the wealthy. Discontent has steadily risen among blue-collar workers and others who feel he represents an urban “elite”. For Macron, who is sharply down in the polls and struggling to regain the initiative, a further risk is how opposition parties leverage the anger and the decision to shift course. Ahead of European Parliament elections next May, support for the far-right under Marine Le Pen and the far-left of Jean-Luc Melenchon has been rising. Macron has cast those elections as a battle between his “progressive” ideas and what he sees as their promotion of nationalist or anti-EU agendas. Le Pen was quick to point out that the six-month postponement of the fuel-tax increases took the decision beyond the European elections. Additional reporting by Marine Pennetier, Elizabeth Pineau, Richard Lough, John Irish, Matthias Blamont and Myriam Rivet; Writing by Luke Baker; Editing by Matthew Mpoke Bigg",https://uk.reuters.com/article/france-protests/update-5-macron-makes-u-turn-on-fuel-tax-increases-in-face-of-yellow-vest-protests-idUKL8N1Y919Y,04 Dec 2018,"* Decision is first major policy U-turn for Macron
(Adds truck unions call for strike on Dec 9, cost of measures)","UPDATE 5-Macron makes U-turn on fuel-tax increases in face of ""yellow vest"" protests"
2018-12-04,"(Adds Perry quote, background on OPEC meeting) By Timothy Gardner WASHINGTON, Dec 4 (Reuters) - U.S. Energy Secretary Rick Perry said on Tuesday he would soon visit Qatar and Saudi Arabia, a trip expected to occur after this week’s meeting of the Organization of the Petroleum Exporting Countries. “I’m headed to the Middle East later here to Qatar and then to the kingdom,” Perry told the annual meeting of the National Petroleum Council, a group of more than 200 company executives and analysts that advises the Department of Energy. Perry said he would make the trip during “interesting times,” but did not give specific dates. It will be his first trip to Saudi Arabia, the world’s largest oil exporter, since the killing of columnist Jamal Khashoggi in October in the Saudi consulate in Istanbul. Top U.S. senators said on Tuesday they were more certain than ever after receiving a CIA briefing that Saudi Crown Prince Mohammed bin Salman was culpable in Khashoggi’s killing. Saudi Arabia has said the prince had no prior knowledge of the killing, which has strained Saudi Arabia’s ties with the West. Qatar said this week it would leave OPEC to focus on gas production, in a swipe at Saudi Arabia, the de facto leader of the group, which is trying to show unity in tackling an oil price slide. Energy Department spokeswoman Shaylyn Hynes said Perry would “engage with his energy counterparts in the region.” Perry and Saudi Energy Minister Khalid al Falih are alumni of Texas A&M University and longtime friends. President Donald Trump, who has stood by the crown prince, has urged Saudi Arabia to keep oil output high after Washington left an international agreement on Iran’s nuclear program in May. The Trump administration reapplied sanctions on Iran’s oil exports in November, which led some analysts to worry crude prices would rise. But global economic weakness and fears of an oil glut as U.S. production rises have pushed crude oil prices down in recent weeks. OPEC and its allies are working toward a deal this week to reduce oil output by at least 1.3 million barrels per day. Russia, which has worked with OPEC recently on production agreements, has been the main stumbling block to a deal on a major cut. OPEC will meet on Thursday in Vienna, followed by talks with allies such as Russia on Friday. Reporting by Timothy Gardner; Editing by Peter Cooney",https://uk.reuters.com/article/usa-energy-perry-mideast/update-1-u-s-energy-secretary-perry-to-visit-saudi-arabia-qatar-idUKL1N1Y91GN,04 Dec 2018,"U.S. Energy Secretary Rick
Perry said on Tuesday he would soon visit Qatar and Saudi
Arabia, a trip expected to occur after this week's meeting of
the Organization of the Petroleum Exporting Countries.","UPDATE 1-U.S. Energy Secretary Perry to visit Saudi Arabia, Qatar"
2018-12-04,"WOLFSBURG, Germany (Reuters) - Volkswagen’s (VOWG_p.DE) strategy chief said on Tuesday the German carmaker’s core brand will develop its final generation of vehicles using combustion engine technology in 2026.  Volkswagen made a strategy shift toward battery-driven vehicles in the wake of a damaging diesel-emissions cheating scandal in 2015, which forced the carmaker to pay more than 27 billion euros in fines for hiding excessive pollution. “In the year 2026 will be the last product start on a combustion engine platform,” Michael Jost told the Handelsblatt automotive summit conference at Volkswagen’s headquarters in Wolfsburg, Germany. A spokesman confirmed Jost’s remarks meant that VW, Europe and China’s best selling passenger car brand, will focus on electric cars instead. VW will continue to adapt its petrol and diesel engined cars to meet environmental standards during the lifetime of those vehicles, but the German carmaker is now committed to radical steps to stop global warming, Jost said.  As a way to meet the goals of the Paris climate accord, Volkswagen has changed its car development benchmarks to include the target of radically cutting levels of carbon dioxide pollution in production as well, Jost said. Reporting by Edward Taylor; editing by David Evans",https://uk.reuters.com/article/volkswagen-emissions-combustion/vw-says-last-generation-of-combustion-engines-to-be-launched-in-2026-idUKL8N1Y96C8,04 Dec 2018,"Volkswagen's
strategy chief said on Tuesday the German carmaker's
core brand will develop its final generation of vehicles using
combustion engine technology in 2026.",VW says last generation of combustion engines to be launched in 2026
2018-12-04,"* Wall Street drops 2 pct, spooked by growth and trade worries * Confusion over timing of trade truce, China commitments * U.S. yield curve inversion raises recession concerns * Dollar weakens (Updates with close of oil market, afternoon trading) By Laila Kearney New York, Dec 4 (Reuters) - Global stocks sank and the dollar fell on Tuesday as a flattening Treasury yield curve sparked recession warnings, while optimism that the U.S. and China would quickly resolve their trade dispute dwindled. Benchmark Treasury 10-year yield fell to its lowest point since mid-September. The spread between the 10-year yield over its two-year counterpart also shrank to the smallest since the start of the financial crisis in January 2008, signalling to some investors an approaching U.S. economic slowdown. “Today is the perfect storm,” said RJ Grant, head of trading at Keefe, Bruyette & Woods in New York. “You’ve nothing really tangible coming out of the G20 summit. You have worries about growth.” The Dow Jones Industrial Average fell 701.59 points, or 2.72 percent, to 25,124.84, the S&P 500 lost 76.6 points, or 2.75 percent, to 2,713.77 and the Nasdaq Composite dropped 239.86 points, or 3.22 percent, to 7,201.65. The pan-European STOXX 600 index lost 0.76 percent and MSCI’s gauge of stocks across the globe shed 1.92 percent. On Monday, stock markets around the world got some relief after Washington and Beijing agreed to temporarily end their trade war during talks at the G20 summit in Argentina. Upon closer scrutiny, investors said a deal between the world’s two biggest economies was far from a sure bet. “As soon as investors digested the information from the discussions they focused on the uncertainties and lack of details,” said Ryan Nauman, market strategist, Informa Financial Intelligence, Zephyr Cove, Nevada. There was added confusion over when the 90-day truce period, during which the U.S. and China would hold off on imposing more tariffs, would start. Additionally, none of the commitments that U.S. officials said had been given by China - including reducing its 40 percent tariffs on autos - were agreed to in writing and specifics had yet to be hammered out. Meanwhile, the flattening U.S. yield curve weighed on investors’ minds. “The focus is now shifting to the inverted U.S. bond yield curve, which has negative connotations, while implying the U.S. economy is heading towards what was, only a few weeks ago, an improbable economic slowdown,” said Stephen Innes, head of trading for APAC at Oanda. The U.S. dollar sagged as Treasury yields fell, adding to concerns the Federal Reserve could pause in its rate-hike cycle. The greenback, which started the week on a weak footing as the apparent thaw in trade tensions between the U.S. and China cooled demand for the safe-haven currency, extended its fall as investors worried about the inversion of the short end of the U.S. yield curve in bond markets. The dollar index fell 0.07 percent, with the euro down 0.1 percent to $1.1341. Sterling briefly drooped to a 17-month low on the day, before recovering ground to trade little-changed, in a volatile session dominated by Brexit-related headlines. Oil prices pared some gains as fears flared that demand would stall due to a trade war between the U.S. and China, and that Russia remained a stumbling block to a deal to cut global crude supply. Brent crude oil settled at $62.08 per barrel, or jumped up 0.63 percent. U.S. light crude was last up 30 cents at $53.25. Additional reporting by Karin Strohecker, Shreyashi Sanyal,
Jessica Resnick-Ault, Andrew Galbraith and Chuck Mikolajczak;
Editing by Bernadette Baum and Susan Thomas",https://uk.reuters.com/article/global-markets/global-markets-global-stocks-fall-on-growth-concerns-doubts-over-trade-truce-idUKL1N1Y91OT,04 Dec 2018,"* Wall Street drops 2 pct, spooked by growth and trade
worries","GLOBAL MARKETS-Global stocks fall on growth concerns, doubts over trade truce"
2018-12-04,"HOUSTON (Reuters) - Schlumberger, the world’s largest oilfield services provider, warned on Tuesday that its fourth-quarter North America revenues will likely decline 15 percent sequentially on steeper-than-expected price declines in hydraulic fracturing. The drop in hydraulic fracturing activity this year has been “significantly larger” than expected, Patrick Schorn, executive vice president of wells at Schlumberger, said at a conference in New York, leading to a bigger decline in pricing than the company had forecast originally.  Oilfield service companies this year have been hit by a slowdown in demand as regional oil prices have fallen with transportation bottlenecks faced by producer customers. A recent drop in the U.S. benchmark crude to around $53 a barrel also has stoked concern of an oil glut next year. Schlumberger is “guiding consensus lower” through the first quarter of 2019, analysts for investment firm Raymond James wrote in a note  following Schorn’s presentation. Shares of Schlumberger were down about 2.6 percent in afternoon trading on Tuesday, at $44.62, amid a broad market decline. The stock is down roughly 44 percent since January.  Hydraulic fracturing pumps water and sand at high pressure into a well to release oil and gas trapped in shale rock. Oil producers have been pulling back on fracking and completing wells because of the pipeline bottlenecks and price weakness.  Schorn said recent price declines would likely prompt its customers to take “a more conservative” approach during the start of 2019 and that any ramp-up in international investment also could be tepid.  “Looking forward to next year, the recent volatility in oil prices has introduced more uncertainty to the outlook” for exploration and production spending in 2019, Schorn said.  Schlumberger’s North America revenue, including its Cameron International business, was $3.12 billion in the third quarter, accounting for roughly 38 percent of total revenue.  A year ago Schlumberger acquired Weatherford International’s U.S. pressure pumping business for $430 million, positioning it to better compete with rival Halliburton. Both companies have seen shares fall sharply this year amid the slowdown in hydraulic fracturing demand.  Reporting by Liz Hampton; editing by Diane Craft and Leslie Adler",https://uk.reuters.com/article/schlumberger-outlook/update-2-schlumberger-sees-lower-n-american-q4-revenues-on-drop-in-fracking-idUKL1N1Y91GB,04 Dec 2018,"Schlumberger, the world's
largest oilfield services provider, warned on Tuesday that its
fourth-quarter North America revenues will likely decline 15
percent sequentially on steeper-than-expected price declines in
hydraulic fracturing.",UPDATE 2-Schlumberger sees lower N. American Q4 revenues on drop in fracking
