publish_datetime,content,href,publish_timestr,summarize,title
2019-01-08,"MEXICO CITY, Jan 8 (Reuters) - Mexican President Andres Manuel Lopez Obrador said on Tuesday a military-assisted crackdown had dramatically reduced fuel theft and uncovered a secret pipe that was used to siphon gasoline out of one of the country’s refineries. Such fuel theft has dropped from 787 truck loads per day to 177 since thousands of soldiers were sent to state-oil company Pemex’s installations last month, Lopez Obrador said at a daily news conference. The crackdown on years of mounting fuel theft is the leftist government’s first major move against corruption and violence after taking office on Dec. 1, but risks angering consumers and hurting the economy. By closing off pipelines and refineries while it traced leakages, the government has triggered shortfalls and long lines at gas stations in at least six states, including Guanajuato, a major car-manufacturing hub in central Mexico. Criminal groups and others who have tapped pipelines have long been blamed for billions of dollars of losses to public coffers over the past few years, but Lopez Obrador said last month that far more fuel was being stolen directly from Pemex installations by an internal network of corrupt officials. Lopez Obrador said the military had discovered a 3-kilometer (1.9 mile)-long “hose” that was funneling fuel out of storage tanks at the Salamanca refinery in the central state of Guanajuato into a secret storage area. He admitted there were complaints about the shortages, but said they were not widespread, and urged an end to “panic” buying and said shortages were an issue of distribution, not supply. “This is not in vain,” Lopez Obrador said. “We are going to end corruption.” Local media showed images of tanker trucks, escorted by federal police, heading from oil-rich costal states to the country’s interior. It was not immediately clear what impact the crackdown will have on imports of fuel. Mexico is the top export destination for U.S. energy products, importing about 1.4 million barrels every day, or nearly a quarter of all U.S. overseas sales. (Reporting by Veronica Gomez and Michael O’Boyle; Editing by Frank Jack Daniel and Bernadette Baum)",https://uk.reuters.com/article/mexico-oil-theft/mexico-fuel-theft-curtailed-secret-hose-found-in-refinery-obrador-idUKL1N1Z80LO,08 Jan 2019,"Mexican President Andres
Manuel Lopez Obrador said on Tuesday a military-assisted
crackdown had dramatically reduced fuel theft and uncovered a
secret pipe that was used to siphon gasoline out of one of the
country's refineries.","Mexico fuel theft curtailed, secret 'hose' found in refinery -Obrador"
2019-01-08,"LONDON (Reuters) - BP (BP.L) said it has discovered two new oilfields in the Gulf of Mexico and has identified an additional billion barrels of oil at an existing field thanks to new seismic technology. The British company, which has only recently turned a corner following the deadly 2010 Deepwater Horizon spill, also on Tuesday announced plans to expand production at its Atlantis oilfield in the Gulf of Mexico, consolidating its status as the largest oil producer in that region. The company has put a heavy emphasis on technology and data processing capabilities in recent years in order to unlock new resources and cut costs.  The $1.3 billion (£1 billion) Atlantis Phase 3 development will include drilling eight wells and a new subsea production system that will boost BP’s production by 38,000 barrels of oil equivalent per day (boed). It is scheduled to start production in 2020. Together with the new discoveries, BP aims to grow its Gulf of Mexico production from over 300,000 boed at present to 400,000 boed by the mid 2020s. BP said that new seismic technology helped it identify an additional 1 billion barrels of oil at its Thunder Horse field within weeks, whereas previously it would have taken a year to analyse.  BP also announced oil discoveries in the Manuel and Nearly Headless Nick prospect in the Gulf. The Manuel prospect, half owned by Royal Dutch Shell (RDSa.AS), will be linked to the Na Kika platform.  “BP’s Gulf of Mexico business is key to our strategy of growing production of advantaged high-margin oil,” BP head of upstream Bernard Looney said in a statement. “And these fields are still young – only 12 percent of the hydrocarbons in place across our Gulf portfolio have been produced so far. We can see many opportunities for further development,” he added. BP said it is also considering the development of Atlantis phases 4 and 5 as well as expanding the Thunder Horse, Na Kika and Mad Dog fields. Reporting by Ron Bousso; Editing by Susan Fenton",https://uk.reuters.com/article/bp-discovery/bp-unlocks-a-billion-oil-barrels-in-gulf-of-mexico-with-new-technology-idUKL8N1Z847N,08 Jan 2019,"BP said it has discovered
two new oilfields in the Gulf of Mexico and has identified an
additional billion barrels of oil at an existing field thanks to
new seismic technology.",BP unlocks a billion oil barrels in Gulf of Mexico with new technology
2019-01-08,"BEIJING, Jan 8 (Reuters) - Trade talks between the United States and China will continue on Wednesday, U.S. delegation member Steven Winberg said on Tuesday, as the world’s two largest economies seek to resolve a bitter trade dispute. The talks are going on well so far, Winberg, who is also U.S. assistant secretary for fossil energy, told reporters in Beijing where U.S. officials were negotiating with their Chinese counterparts. The meetings are the first face-to-face talks since U.S. President Donald Trump and Chinese President Xi Jinping agreed in December to a 90-day truce in a trade war that has buffeted global financial markets. (Reporting by Dominque Patton in Beijing Writing by Lee Chyen Yee Editing by Mark Heinrich)",https://uk.reuters.com/article/usa-trade-china-talks/u-s-delegation-member-says-trade-talks-with-china-to-continue-wednesday-idUKS7N1YQ02K,08 Jan 2019,"Trade talks between the United
States and China will continue on Wednesday, U.S. delegation
member Steven Winberg said on Tuesday, as the world's two
largest economies seek to resolve a bitter trade dispute.",U.S. delegation member says trade talks with China to continue Wednesday
2019-01-08,"* World and European indexes at 3-week high * Samsung profit warning weighs on Asia * Dollar ticks up, euro hit by weak German data * Bond yields resume rise in Europe, U.S. markets * Oil stays firm in commodity markets * Graphic: World FX rates in 2019 tmsnrt.rs/2egbfVh By Marc Jones LONDON, Jan 8 (Reuters) - A strong day for Europe and a jump in Wall Street futures kept world stocks at a three-week high on Tuesday, after Asia was knocked back by a shock profit warning from tech giant Samsung. Hopes that Washington and Beijing may be moving towards a trade deal helped the mood again and also gave the dollar a lift in the currency markets after its shaky start to the year. That rise, along with the alarm from South Korea’s Samsung that it would badly miss its earnings forecasts, caused a slip in emerging markets, but Europe held its nerve — unlike last week after a similar warning from Apple. The pan-European STOXX 600 rose 1.5 percent despite some wobbles in Italy as Rome stepped in to support another of its struggling lenders. Britain’s FTSE was up 1.2 percent too as its retailers cheered rare good news about Christmas trading. “I think the market has been quite extreme in pricing recession risks, so I think we have value now in both the equity and bond markets,” SEB investment management’s global head of asset allocation Hans Peterson said. “The discussions between the U.S and China will take some time but I think the markets are prepared to move in the right direction on positive signals.” U.S. President Donald Trump tweeted ahead of the start of Wall Street trading that talks with China, which were going into a second day, were going “very well”. U.S. Commerce Secretary Wilbur Ross had predicted on Monday that Beijing and Washington could reach a trade deal that “we can live with” S&P 500 futures gained 0.8 percent following a near four percent surge on Wall Street since Friday, led by Amazon and Netflix which have been recovering some of the ground they lost during a brutal end to 2018. MSCI’s broadest index of Asia-Pacific shares ended down 0.2 percent, however. It was dragged lower by falls in South Korea due to Samsung and in China where government bond yields also saw their biggest daily gain in nine months China’s Foreign Ministry said Beijing had “good faith” to work with the United States to resolve trade friction, but many analysts doubt the two sides can reach a comprehensive agreement on all of the issues before a March deadline. “Various concerns markets had earlier are receding for now. Still, there’s no denying that U.S. (company) earnings momentum is slowing,” said Hirokazu Kabeya, chief global strategist at Daiwa Securities. “Ultimately we need to see whether upcoming earnings reports can dispel market concerns.” The dollar has its tail up, trading at 108.90 yen and $1.1431 to the euro as an unexpected fall in German industrial output for the third straight month also helped to weaken the euro zone currency. The British pound traded a tad lower at $1.2741 as British and European officials played down a report in the Daily Telegraph newspaper on plans to extend Britain’s formal Article 50 notice to withdraw from the European Union. “I wouldn’t really want to think about the possibility of extending Article 50 here and now,” said  I don’t think this is what we ought to focus on today,” German Foreign Minister Heiko Maas told journalists during a visit to Dublin. Elsewhere, the Canadian dollar hit one-month highs, having gained 2.7 percent in the past five days on gains in oil prices and on speculation the Bank of Canada will raise interest rates again this week. It last stood at 1.3272 per U.S. dollar . In the government bond markets, Europe’s yields were squeezed higher by a deluge of upcoming debt sales and the 10-year U.S. Treasuries yield bounced back to 2.70 percent, from Friday’s near one-year low of 2.543 percent. Still, its latest level is still 50 basis points below its October peak of 3.261 percent and recent caution from the head of the Federal Reserve mean futures markets are now pricing in a slim chance of a U.S. rate cut this year. Oil prices were also up again on Tuesday, supported by hopes for Sino-U.S. trade talks in Beijing and a Wall Street Journal report that Saudi Arabia is planning to cut crude exports to around 7.1 million barrels per day (bpd) by the end of January. Both U.S. West Texas Intermediate (WTI) crude futures and International Brent crude futures stayed firm at $49.45 and $58.27 per barrel, respectively, while safe-haven gold eased back to $1,283 an ounce. Reporting by Marc Jones, Editing by Jane Merriman and Alison
Williams, William Maclean",https://uk.reuters.com/article/global-markets/global-markets-stocks-rally-again-as-u-s-china-trade-hopes-build-idUKL8N1Z82Y5,08 Jan 2019,"A strong day for Europe and a jump
in Wall Street futures kept world stocks at a three-week high on
Tuesday, after Asia was knocked back by a shock profit warning
from tech giant Samsung.",GLOBAL MARKETS-Stocks rally again as U.S.-China trade hopes build
2019-01-08,"LONDON (Reuters) - Oil workers accepted an improved pay offer by the Offshore Contractors Association to 2,500 union members, the Unite union said, a move which removes the threat of strike in the British North Sea which is home to the Brent crude benchmark. “Unite Scotland’s 2,500 strong Offshore Contractors Association (OCA) membership today... confirmed they have accepted the revised pay offer following an online ballot on a 71 percent turnout,” Unite said on Twitter on Tuesday. “The two year pay deal represents a significant improvement on the initial OCA offer.” Reporting By Shadia Nasralla; Editing by Andrew Heavens",https://uk.reuters.com/article/britain-oil-strike/uk-offshore-oil-workers-accept-revised-oca-pay-offer-unite-union-idUKL8N1Z83GR,08 Jan 2019,"Oil workers accepted an improved
pay offer by the Offshore Contractors Association to 2,500 union
members, the Unite union said, a move which removes the threat
of strike in the British North Sea which is home to the Brent
crude benchmark.",UK offshore oil workers accept revised OCA pay offer -Unite union
2019-01-08,"(Repeats item issued earlier. The opinions expressed here are those of the author, a columnist for Reuters.) By Clyde Russell LAUNCESTON, Australia, Jan 8 (Reuters) - Commodity markets appear to have delivered their verdict on China’s plans to stimulate its economy, betting that Beijing’s boost to infrastructure spending will work. China’s central bank cut the amount of cash that banks have to hold as reserves for a fifth time in a year on Jan. 4, a move that will free up as much as $116 billion in new credit. The looser monetary policy announcement came two days after the national rail operator said it planned 6,800 km (4,225 miles) of new track this year, a 40 percent lift on what was laid last year. This implies a substantial hike on the 802.9 billion yuan ($117.2 billion) invested in rail in 2018, cash that will flow through to increased demand for steel, copper and also for coal used to provide energy to process ores into refined metals. Certainly, the prices of these commodities have improved in recent days, taking heart from Beijing’s stimulus, and also from some renewed optimism that progress is being made to resolve the U.S.-China trade dispute. Shanghai copper futures rose 1.2 percent from the 18-month closing low of 46,830 yuan a tonne on Jan. 4 to end at 47,380 yuan on Monday, and they extended gains in early Asian trade on Tuesday. London copper futures also rebounded from a similar 18-month low of $5,736 a tonne on Jan. 3, closing up 3.3 percent at $5,923 a tonne on Monday. Iron ore for delivery to China MT-IO-QIN62=ARG, as assessed by Argus Media, has been rising since late November, and Monday’s close of $74.80 a tonne was up 2.6 percent since Jan. 3, and almost 16 percent since the 4-month low of $64.55 on Nov. 27. The exception so far is thermal coal, with Argus Media’s assessment of cargoes at Australia’s Newcastle Port dropping to $98.40 a tonne in the week to Jan. 4 from $99.74 the prior week. However, Newcastle coal is still almost 1 percent higher than the 6-month low of $97.50 a tonne reached on Nov. 23. Thermal coal is also likely to have struggled in recent weeks given Beijing was discouraging imports in December as part of efforts to limit total 2018 imports to a level similar to those in 2017. While this failed, it did cause seaborne imports of coal to drop to 15 million tonnes in December, the lowest monthly total since February 2016, according to vessel-tracking data compiled by Refinitiv. In contrast, iron ore import volumes have held up, lending some fundamental support to recent gains in prices. China’s seaborne iron ore imports were 86.4 million tonnes in December, according to Refinitiv, up from 82.8 million in November. Imports on unwrought copper were 456,000 tonnes in November, the latest month for which official data is available, up from 420,000 the prior month, and above the average of 442,600 for the first 11 months of the year. For the recent price gains to extend into a sustained rally, it’s likely that physical import volumes will have to hold up, or grow somewhat in coming months. That means that the stimulus measures must translate to actual activity sooner rather than later, or the optimism they have created may ebb away. Of course, there are other factors that will drive short-term sentiment and commodity prices, chiefly the success or otherwise of the latest round of talks between the administration of U.S. President Donald Trump and his Chinese counterpart Xi Jinping. Recent positive comments from  U.S. Commerce Secretary Wilbur Ross notwithstanding, there is still considerable uncertainty over whether an agreement can be reached. If a deal is struck that goes some way to normalising trade between the world’s two biggest economies, then commodities should enjoy a relief rally that will add to the positive vibes created by Beijing’s stimulus. The risk is that the opposite also applies, a no deal, or worse, an escalation in the dispute, would likely snuff out any rally in commodities such as iron ore, coal and copper. Editing by Richard Pullin",https://uk.reuters.com/article/column-russell-china-commodities/column-commodity-markets-back-beijings-stimulus-await-trade-talks-russell-idUKL3N1Z8206,08 Jan 2019,"Commodity markets
appear to have delivered their verdict on China's plans to
stimulate its economy, betting that Beijing's boost to
infrastructure spending will work.","COLUMN-Commodity markets back Beijing's stimulus, await trade talks: Russell"
2019-01-08,"Jan 8 (Reuters) - Rotterdam’s Gate terminal for LNG, co-owned by Vopak and GasUnie: * Says performed a record level of 104 ship operations in 2018 * Says unloaded 8.3 million cubic metres of LNG from 54 vessels (of which 17 transshipments) * Says loaded 3.9 million cubic metres of LNG on 23 large vessels (of which 17 transshipments) and 27 small vessels * Says customers holding capacity in Gate nominated 2.5 billion cubic metres (bcm) for regasification into the GTS gas grid * On Dec.3 said it was testing market interest to increase capacity by 2 bcm per year, from current annual maximum of 12 bcm. Further company coverage: Reporting by Bart Meijer",https://uk.reuters.com/article/netherlands-gas-gateterminal/brief-rotterdams-gate-terminal-says-2018-activity-at-record-level-idUKL8N1Z83BN,08 Jan 2019,"Rotterdam's Gate terminal for LNG,
co-owned by Vopak and GasUnie:",BRIEF-Rotterdam's Gate Terminal says 2018 activity at record level
2019-01-08,"MOSCOW (Reuters) - President Vladimir Putin opened Russia’s first liquefied natural gas (LNG) floating storage and regasification unit (FSRU) on Tuesday, saying it bolsters the country’s energy security.      The Marshal Vasilevskiy FSRU has been set up in Kaliningrad, wedged between European Union members Poland and Lithuania, by Russian energy giant Gazprom (GAZP.MM) to bypass pipeline gas deliveries via Lithuania in case transit is disrupted.  Moscow’s decision to set up the FSRU was in part to reduce gas transit risks to Kaliningrad, home to a Baltic Fleet base, as the EU steps up efforts to reduce its dependency on Russia, a Kremlin-published transcript of Putin’s speech said. “In recent years we have paid much attention to energy supplies, to the energy of the region as a whole, including in connection with EU plans to remove the Baltic states from Russia’s energy ring,” Putin said. “This is their (EU countries’) business. Additional tax payers’ money will be invested into that.” Gazprom CEO Alexei Miller told the Interfax news agency that supplies to Kaliningrad from Lithuania had been completely halted on Tuesday and replaced with natural gas from the FSRU. The FSRU, the first of its kind in Russia which arrived from Singapore last month with a cargo on board to commission the LNG import facility, can provide Kaliningrad with 2.7 billion cubic meters (bcm) of gas a year, Gazprom has said. LNG is delivered by tankers, meaning it can be supplied to many markets.  Reporting by Gabrielle Tétrault-Farber; Editing by Alexander Smith",https://uk.reuters.com/article/russia-gazprom-putin-kaliningrad/putin-hails-energy-security-boost-from-russias-first-lng-floating-storage-idUKL8N1Z82PJ,08 Jan 2019,"President Vladimir Putin opened
Russia's first liquefied natural gas (LNG) floating storage and
regasification unit (FSRU) on Tuesday, saying it bolsters the
country's energy security.",Putin hails energy security boost from Russia's first LNG floating storage
2019-01-08,"LONDON (Reuters) - Turkey has resumed imports of Iranian crude oil after a one-month hiatus in November when U.S. sanctions on Iran were reimposed, trading and shipping sources said. The United States granted Turkey and other countries import waivers in early November. Turkey said it was permitted to take 3 million tonnes a year, equivalent to about 60,000 barrels per day (bpd), under the waiver. Turkey used to import about 200,000 bpd of Iranian crude before Washington announced last year that it would pull out of the 2015 Iran nuclear deal and reimpose sanctions.  Turkey had reduced its imports from Iran in the months prior to sanctions coming into force in early November. Its imports fell to zero in November. But in December Turkey took delivery of two tankers carrying Iranian crude, equivalent to about 54,000 bpd during December, according to a shipping and trading source familiar with the matter. The Solan tanker delivered into the port of Aliaga, while the Sea Topaz I discharged at Tutunciftlik. So far in January, Turkey is set to receive a cargo from the Iranian-owned tanker Sinopa, the sources and Refinitiv Eikon ship tracking showed.  Turkish officials and Tupras were not immediately available to comment. Reporting by Julia Payne; Additional reporting by Orhan Coskun in Ankara; Editing by Edmund Blair",https://uk.reuters.com/article/turkey-iran-oil/turkey-resumes-iranian-oil-imports-under-u-s-sanctions-waiver-idUKL8N1Z82LS,08 Jan 2019,"Turkey has resumed imports of
Iranian crude oil after a one-month hiatus in November when U.S.
sanctions on Iran were reimposed, trading and shipping sources
said.",Turkey resumes Iranian oil imports under U.S. sanctions waiver
2019-01-08,"LONDON (Reuters) - The London Electric Vehicle Company, which makes the city’s famous black taxis, is delaying the arrival of its first van as it now plans to work more closely with Chinese parent company Geely (0175.HK), its boss said.  LEVC was bought out of bankruptcy by the Chinese automaker in 2013, which has since opened a 325-million pound factory in central England and turned the domestic taxi producer into an exporter. The firm said in September it would be trialling its new electric van this year but Chief Executive Chris Gubbey told Reuters on Tuesday that the firm’s first commercial vehicle would now come to market “in the early 2020s.”  “On our own, we’re a relatively small player and for us to charge ahead and develop our own product and then try to maintain that and put further investment in to build off that, does not make sense,” he said. Gubbey said the decision has not been influenced by Brexit which is due to take place on March 29. Geely said on Monday it was forecasting flat sales, a sharp slowdown from 2018 as China’s giant auto market struggles with slowing economic growth and more cautious consumers.  Asked whether the decision regarding LEVC’s first commercial vehicle was linked to economising at Geely, Gubbey said: “That word hasn’t come up in the discussion.”  LEVC built 1,200 taxis at its Ansty factory last year and expects that to slightly more than double this year as the firm sells more of its electric models in both its home market and to countries such as Germany and France. However, like manufacturers across the country, the firm faces the challenge of a possible no-deal Brexit in just 80 days’ time, which could lead to tariffs, adding to costs, and customs checks, disrupting the flow of parts and vehicles. The company is talking to its logistics provider regarding the movement of European-sourced components which are predominately delivered via trucks through the port of Dover and will have a buffer of finished vehicles by the end of March.   “In terms of the export sales... we are working with our partners in terms of the potential for taking deliveries early so that they’ve got them there and they built up their own inventory a little bit earlier,” said Gubbey. Editing by Stephen Addison",https://uk.reuters.com/article/britain-taxi/london-taxi-maker-delays-arrival-of-first-van-idUKL8N1Z82BK,08 Jan 2019,"The London Electric Vehicle
Company, which makes the city's famous black taxis, is delaying
the arrival of its first van as it now plans to work more
closely with Chinese parent company Geely, its boss
said.",London taxi-maker delays arrival of first van
