publish_datetime,content,href,publish_timestr,summarize,title
2019-01-15,"LAUNCESTON, Australia (Reuters) - Anybody reading the commentary on China’s December trade figures would be left with the impression of an economy increasingly losing momentum amid a dispute with the United States. It was reasonable for analysts to zero in on the 4.4 percent drop in China’s December exports from a year earlier, a huge miss when a rise of 3 percent had been forecast. Imports also surprised on the downside, dropping 7.6 percent in December, the biggest decline since July 2016. The numbers do point to weakness in the world’s second-largest economy, and the trade dispute with the administration of U.S. President Donald Trump is getting much of the blame. The weakness in exports could be put down to the pull-forward effect in prior months as both producers and buyers stocked up ahead of the imposition of U.S. tariffs on a range of Chinese goods. The poor trade numbers also came despite efforts by Beijing to stimulate the economy in a series of measures, from looser credit to tax cuts to infrastructure spending. The trade data was grist to the mill for those taking the view that China’s economy is struggling, that the United States is “winning” the trade dispute, and that Beijing will be forced to compromise on Trump’s terms. This may well turn out to be the case, but there are also trade numbers that paint an entirely different view of the Chinese economy, namely the volume of commodity imports. Crude oil imports surged nearly 30 percent in December from the same month in 2017, reaching 10.31 million barrels per day (bpd), the second-highest monthly outcome on record. That hardly sounds like a weak outcome, even if the likely explanation is that smaller, independent refiners boosted purchases to use up 2018 import quotas before they expired. Overall, China’s 2018 crude imports rose by 10.1 percent to a record 9,24 million bpd, an increase of 846,000 bpd over 2017. Boosting annual crude imports by the equivalent of the total consumption of a country such as Netherlands cannot be construed as weak either. A history lesson on past-year crude imports, though, doesn’t say much about what’s likely to happen in 2019, but so far there is little reason to expect the imports to tail off. China is still building its strategic petroleum reserves and the sharp drop in crude prices in the previous months is likely to encourage more buying for storage. It’s not just crude oil. Imports of natural gas, by pipeline and as liquefied natural gas (LNG), hit a record high of 9.23 million tonnes in December, up 17 percent from the same month of 2017 and eclipsing the previous record high from November. That means China has imported record amounts of natural gas for two consecutive months, again, hard numbers that don’t quite tally with the view of an economy in distress.  It could be the case that energy imports are staying strong, while those of metals, which are more exposed to weakness in manufacturing, are feeling more pain. Imports of unwrought copper dropped to 429,000 tonnes in December, down 4.7 percent from the same month in 2017 and by the same margin from November. Imports in November were also weaker than in the same month in 2017, indicating some softness toward the end of the year, notwithstanding the strong 12.9 percent gain in copper imports for 2018 as a whole. Iron ore imports also look uninspiring, with December’s 86.65 million tonnes up 3 percent from the same month a year earlier, but not enough to prevent a 1 percent drop across 2018 as a whole, the first annual decline since 2010. However, China’s steel output is likely to hit a record high in 2018, with output for the first 11 months rising 6.7 percent to 857.37 million tonnes from the same period in 2017. What this shows is that China’s switch to higher-grade iron ore in order to maximise the output of blast furnaces meant steel mills were able to boost production without having to import more iron ore. Again, this is hardly a weak outcome, but likewise doesn’t shed much light on the probable trends for 2019. Coal was one commodity that looked weak in December, with imports plunging 55 percent from the same month in 2017 to just 10.23 million tonnes. But this was entirely policy driven, with Beijing putting pressure on traders to curb imports as they didn’t want total inbound coal shipments in 2018 to exceed those for 2017. Despite the slump in December, imports for the full year were up 3.9 percent to 281.23 million tonnes, a four-year high. Coal imports may remain restrained in the early months of 2019 amid an official push to use more domestic coal to boost prices for local miners. Overall, if you were to assess the Chinese economy on its commodity imports, you’d likely reach quite a different conclusion than if you focused only on the U.S. dollar value of total exports and imports. Weaker commodity prices lowered the value of imports in the latter part of 2018, but if anything, also served to boost volumes. China’s economy does appear to be losing some growth momentum, but it doesn’t seem to make much sense to look only at imports and exports from a dollar perspective, and not take volumes into account. (Graphic: China's trade and economy: tmsnrt.rs/2iO9Q6a) The opinions expressed here are those of the author, a columnist for Reuters.  Editing by Tom Hogue",https://uk.reuters.com/article/column-russell-commodities-china/column-chinas-trade-data-weak-not-if-you-look-at-commodities-russell-idUKL3N1ZF23H,15 Jan 2019,* GRAPHIC: China's trade and economy: http://tmsnrt.rs/2iO9Q6a,COLUMN-China's trade data weak? Not if you look at commodities: Russell
2019-01-15,"* Asian shares recoup early losses as cyclicals gain * Spreadbetters expect European stocks to open higher * China policymakers signal supportive measures * Pound off 2-month high ahead of UK parliament vote * Sterling implied volatilities lower compared to 2016 referendum By Hideyuki Sano TOKYO, Jan 15 (Reuters) - Asian stocks rose on Tuesday, supported by a bounce in Chinese shares amid hopes for government stimulus, while sterling braced for the vote in parliament over the British government’s plan to exit the European Union. The odds look stacked against Prime Minister Theresa May winning  approval for her deal. Voting is expected to start about 1900 GMT Tuesday. Spreadbetters expected European stocks to follow Asia’s lead and open higher, with Britain’s FTSE seen gaining 0.55 percent, Germany’s DAX 0.7 percent and France’s CAC 0.6 percent. MSCI’s broadest index of Asia-Pacific shares outside Japan recovered from early losses and advanced 1.3 percent. South Korea’s Kospi hit a one-month high and Japan’s Nikkei added 1 percent. In China, the CSI300 index of Shanghai and Shenzhen shares was up 1.7 percent amid expectations of more government policy measures to prop-up a slowing economy. China’s state planner said on Tuesday it will aim to achieve “a good start” in the first quarter for the economy in a signal of more growth-boosting steps. State television also quoted Chinese Premier Li Keqiang as saying the government is seeking to establish conditions helpful to meeting this year’s economic goals. That came after data on Monday showed China’s exports unexpectedly fell the most in two years in December, while imports also contracted sharply. Cyclical shares led the gains in Asia-Pacific, with Australian financial shares at their highest since early December while Japanese electronics and machinery makers shares rose to their best levels in six weeks. “It is interesting that cyclicals are leading the gains today. It appears some contrarian investors are starting to buy cyclicals, looking beyond the last economic slowdown,” said Nobuhiko Kuramochi, chief strategist at Mizuho Securities. “But I would suspect there will be heavy selling if we go up further, to around 2,650 in the S&P500 and 21,500 in the Nikkei,” Kuramochi added. S&P500 e-mini futures gained 0.6 percent in Asian trade. In Monday’s session on Wall Street, the S&P 500 lost 0.53 percent, with the biggest drag coming from a 0.9 percent fall in technology sector. U.S. earnings season began on a positive note on Monday as Citigroup Inc beat profit estimates. The bank’s shares rose 4.0 percent and bolstered the S&P financial sector .SPSY, which rose 0.7 percent. The British pound was expected to steal the limelight later in the day as the Britain’s parliament votes on the proposed Brexit deal. On Monday, May urged lawmakers to take a “second look” at her deal, which lawmakers are expected to reject. Such a result could produce a wide range of outcomes, from a disorderly exit from the union to a reversal of Brexit. “Markets have priced in a rejection of May’s plan and there are many scenarios after that. Still I’d think the most likely outcome is to extend the (March 29) deadline of Brexit,” said Masahiro Ichikawa, senior strategist at Sumitomo Mitsui Asset Management. Indeed, currency option markets are barely pricing in the chances of sharp moves in sterling. The pound’s one-month implied volatility stood at 12.625 percent, above the average for the past year of around 8.8 percent well off 20-percent plus levels seen in the days just before the UK referendum on June 23, 2016. The pound changed hands at $1.2909, up 0.3 percent, having hit a two-month high of $1.2930 on Monday after a report, subsequently denied, that a pro-Brexit faction of lawmakers could support May’s deal. The euro inched up 0.1 percent to $1.1480, consolidating after hitting a 12-week high of $1.1570 touched on Thursday. The dollar gained 0.5 percent on the yen to 108.685. Oil prices also rebounded on supply cuts by producer club OPEC and Russia. International Brent crude oil futures were at $59.80 per barrel, or 1.37 percent from their last close. U.S. crude futures stood at $51.22 per barrel, up 1.41 percent. Additional reporting by Shinichi Saoshiro; Editing by Shri
Navaratnam and Richard Borsuk",https://uk.reuters.com/article/global-markets/global-markets-asia-shares-up-on-hopes-for-china-stimulus-brexit-vote-awaited-idUKL3N1ZF2AD,15 Jan 2019,"* Sterling implied volatilities lower compared to 2016
referendum","GLOBAL MARKETS-Asia shares up on hopes for China stimulus, Brexit vote awaited"
2019-01-15,"SHANGHAI, Jan 15 (Reuters) - China has approved construction of one of its tallest dams, a 239-metre (784-foot) hydroelectric structure on the upstream section of its longest river, the Yangtze, the state planning agency said on Tuesday. Hydropower is a clean and renewable source of energy but large-scale construction in southwest China has sparked accusations of damage to fragile ecosystems and inadequate compensation to thousands who have lost their homes. As concern grows over the social and environmental costs of large hydroelectric dams, China has become more cautious of approving new projects in recent years. “Great importance must be attached to environmental protection and migrant resettlement work during the construction,” the state planner, the National Development and Reform Commission, said in a notice. The reservoir of the Lawa hydroelectric project will submerge nearly 12 sq miles (31 sq km) of forest and farmland on the Jinsha branch of the Yangtze on the border between Sichuan and Tibet. The project is envisaged to eventually consist of four turbines with a total capacity of 2,000 megawatts (2 gigawatts). That compares with China’s total hydropower capacity of 350 gigawatts by the end of last year, with about 270 GW contributed by large-scale projects, an industry group said last week. State power giant Huadian Group will hold a stake of 48 percent in the project, with local firms holding the rest. Planned total investment of 30.97 billion yuan ($4.59 billion) will include 2.19 billion yuan to cover the costs of relocating and compensating people displaced by construction. Industry advocates say big dams are the most efficient way of bringing electricity to remote and undeveloped regions, and China has promised to improve the way it compensates displaced residents. In its notice, the NDRC also said it would look at ways of using the new project to boost local income. It has also launched a campaign to clear up “disordered” small-scale hydropower on the Yangtze, with an audit last year putting the number of projects along the river and its tributaries at 24,100. Many new facilities are located in remote regions of Tibet, and the southwestern Sichuan and Yunnan provinces, where relocation and environmental costs can be minimised. ($1=6.7508 yuan) (Reporting by David Stanway; Editing by Clarence Fernandez)",https://uk.reuters.com/article/china-hydropower/china-approves-large-new-upstream-dam-project-on-the-yangtze-river-idUKL3N1ZF29G,15 Jan 2019,"China has approved construction
of one of its tallest dams, a 239-metre (784-foot) hydroelectric
structure on the upstream section of its longest river, the
Yangtze, the state planning agency said on Tuesday.",China approves large new upstream dam project on the Yangtze river
2019-01-15,"SYDNEY (Reuters) - Australians have been warned to avoid exerting themselves outdoors and to drink lots of water as record temperatures in parts of the country look set to linger, and even increase, over coming days. Parts of New South Wales, Australia’s most populated state, and an area of Western Australia, saw record high minimum temperatures of 33 Celsius (91 Fahrenheit) overnight. The maximum is expected to soar to more than 45C (113F) on Wednesday in parts of New South Wales, South Australia and Victoria, the Bureau of Meteorology said. “Avoid physical activity, stay well hydrated - it’s vital at this time,” said Richard Broome, director of environmental health for the New South Wales state government.      For the four-fifths of Australia’s 25 million people who live on the coast, the summer typically means lazing on the beach and watching cricket. But the unusually high temperatures add to a sense of exhaustion for a farm economy already reeling from a year of drought. “The weather is not good news for summer grain crops such as sorghum,” said Phin Ziebell, agribusiness economist, National Australia Bank. “Many east coast farmers are still reeling from the winter wheat crops, which suffered from recent drought.” Australia, the world’s fourth largest wheat exporter, saw production of the grain fall to a 10-year low this year when dry weather wilted crops. With unusually dry pasture, the danger of bush fires looms. Emergency workers were forced to battle more than 100 fires across the northeast coast late last year when unprecedented hot weather triggered a wave of blazes.   Reporting by Colin Packham; Editing by Robert Birsel",https://uk.reuters.com/article/australia-weather/australian-authorities-warn-about-heat-as-temperature-soars-idUKL3N1ZF1YE,15 Jan 2019,"Australians have been warned to
avoid exerting themselves outdoors and to drink lots of water as
record temperatures in parts of the country look set to linger,
and even increase, over coming days.",Australian authorities warn about heat as temperature soars
2019-01-15,"ABU DHABI (Reuters) - Etihad Airways plans to hike its stake in debt-laden Jet Airways (JET.NS), a person close to the Abu Dhabi carrier told Reuters late on Monday, further driving up shares of the Indian airline. Jet shares had already spiked following a CNBC TV18 report that, apart from flagging the capital infusion from Etihad, also said Jet’s founder and chairman, 69-year old Naresh Goyal, was likely to step down from the board and give up majority control.  Goyal’s penchant for control, according to people who have worked with him, has emerged as a major obstacle as the airline tries to negotiate a rescue deal, Reuters reported last month. The person who spoke to Reuters, on condition of anonymity, said Goyal was on his way out but did not clarify if that meant he was stepping down as chairman or from the board.  Jet shares jumped as much as 7 percent early on Tuesday, after spiking 16 percent on Monday. Shares are trading at the highest levels in more than a month. Etihad putting more cash into Jet is conditional on Goyal diluting his stake, another person told Reuters last month. The Abu Dhabi carrier currently owns 24 percent in Jet.  Even so, Etihad’s stake will be capped at 49 percent given foreign ownership rules in Indian airlines.  Once its stake goes past 25 percent, under the country’s capital markets regulations, Etihad will have to make an open offer to shareholders for a majority of the shares, unless it obtains a rare exemption from the market regulator. CNBC TV18, citing sources, reported on Monday that Goyal would trim his 51 percent stake to 20-25 percent and agree to voting rights on his stake being capped at 10 percent. Etihad declined to comment.  Jet on Tuesday told the Bombay Stock Exchange that it was regularly making appropriate disclosures but it was unable to comment on the reasons for the share price rise on Monday.  Goyal did not immediately respond to emails seeking comment.  Jet said on Jan. 2 it had defaulted on debt payments to a consortium of Indian banks and that it was in talks with the consortium led by State Bank of India (SBI.NS). The 25-year-old airline is facing financial difficulties and owes money to pilots, lessors and vendors. Intense pricing competition, a weak rupee and rising fuel costs weighed on Indian airlines in 2018. Last week, Reuters reported that crisis talks between Jet and aircraft lessors had failed to ease the row over late payments, prompting some lessors to explore repossessing their aircraft. Jet is due to meet with its lenders in Mumbai on Wednesday, the Business Standard reported on Tuesday. Additional reporting by Swati Bhat and Aditi Shah in Mumbai and Jamie Freed in Singapore; Editing by Louise Heavens and Himani Sarkar",https://uk.reuters.com/article/jet-airways-stocks/update-2-etihad-to-raise-stake-in-cash-strapped-jet-airways-source-idUKL3N1ZE3CH,15 Jan 2019,"* Fundraising conditional on chairman diluting stake -
source",UPDATE 2-Etihad to raise stake in cash-strapped Jet Airways - source
2019-01-15,"SHANGHAI (Reuters) - China plans to launch 100 new large-scale recycling “bases” by the end of next year, part of a campaign to make better use of its resources after extending a ban on foreign trash imports. A long manufacturing boom has saddled China with millions of tonnes of waste, much of which is buried in sprawling landfill sites or dismantled by hand in polluting backstreet workshops. It has vowed to tackle the problem by creating fully industrialized recycling bases and cutting off foreign supplies. “Large volumes of solid waste are already impacting and restricting the high-quality development of the industrial economy,” the Ministry of Industry and Information Technology said in a policy document issued late last week.       It said 50 new “comprehensive utilization” bases would deal with bulk solid waste and another 50 with industrial waste from sectors such as metals production, coal mining, construction, agriculture and forestry. The bases will tackle waste with the biggest public impact, the ministry said, citing shared bicycles, packaging, batteries and solar panels as examples. They will also promote advanced technologies, products and recycling methods, it added.  Projects or companies approved to set up shop in one of these new bases can apply for special government funding, and China will also make use of new financing mechanisms, including green bonds, the document added. China’s recyclers have profited from waste shipped in from Europe and the United States, which is better sorted and therefore cheaper to treat than domestic material.  Imports reached 60 million tonnes a year at their peak, but the government has been steadily blocking shipments since 2017. The initial 2017 ban on 24 types of imported waste, including plastic and paper, was extended at the end of 2018 to 16 new products, including scrap ships and automobile parts.  It said in December that it would also ban imports of more varieties of scrap steel, copper and aluminum from July, and another 16 products - including scrap stainless steel and titanium - will be blocked at the end of the year. Total solid waste imports fell 48 percent on the year in 2018, and China eventually aims to block all imports that have readily available domestic replacements. Many domestic recyclers have tried to move their facilities to Southeast Asia, despite tougher restrictions in Malaysia and elsewhere, and while some have started to switch to domestic feedstock, China still needs to do more to standardize and scale up the treatment of local waste. “Some items just can’t be imported anymore, including plastics ... but domestic waste and imports are handled by different people, and they are not part of the same system,” said Wang Wang, secretary general of the China Scrap Plastic Association.   Reporting by David Stanway; Editing by Joseph Radford",https://uk.reuters.com/article/china-waste/china-starts-new-recycling-drive-as-foreign-trash-ban-widens-idUKL3N1ZE20Z,15 Jan 2019,"* Focus on waste from new tech, products with big public
impact",China starts new recycling drive as foreign trash ban widens
2019-01-15,"ANCHORAGE, Alaska (Reuters) - Regulators in the U.S. state of Alaska will investigate all of the oil and natural gas wells operated by BP Plc at its Prudhoe Bay oil field after the release of a small amount of crude oil and gas from a well that had earlier been shut. The Alaska Oil and Gas Conservation Commission (AOGCC) has scheduled a Feb. 7 hearing “to assess the mechanical integrity of Prudhoe Bay wells operated by BP Exploration (Alaska), Inc.,” the agency said in a notice issued on Friday.  Last month’s leak occurred at one of 14 wells that BP had shut in 2017 following a much bigger release oil and gas then.  The most recent failure, detected on Dec. 7, released natural gas and about two gallons of crude oil, said Megan Baldino, spokeswoman for BP Exploration (Alaska) Inc. The gas release was brought under control two days later, she said. There was no oil released to the tundra and no one was injured, she said.  There are 1,780 Prudhoe Bay wells, said Baldino, adding that the company is cooperating with the AOGCC’s investigation. “BP is investigating the incident to determine the cause. We are cooperating with AOGCC’s request for more information,” she said in an email on Monday. The earlier failure, in April 2017, caused crude oil to spray over a roughly 1 acre (0.4 hectare) area and caused natural gas to vent for days before it was brought under control.  That well failure was linked to permafrost thaw. The normally frozen soil thawed, triggering movement that pushed the well up 3 to 4 feet (1.2 meters), breaking a pressure gauge that previously regulated the site, according to regulators. That sparked a North Slope-wide well review ordered by the AOGCC. In the end, BP identified and shut the 14 wells that because of an outdated and flawed design. In the aftermath of that incident, AOGCC officials concluded that the permafrost thaw was the result of the wells’ design flaw, not to climate change. However, permafrost in Prudhoe Bay, which is located on the Alaska North Slope region above the Arctic Circle, from the area near the tundra’s surface to the depths far below it, has warmed significantly since the 1980s in response to the rising temperatures in that region, according to scientists at the University of Alaska-Fairbanks. Reporting By Yereth Rosen in Anchorage, Alaska; editing by Christian Schmollinger",https://uk.reuters.com/article/bp-alaska-wells/alaska-officials-probing-bp-oil-gas-wells-at-prudhoe-bay-after-spill-idUKL1N1ZF033,15 Jan 2019,"Regulators in the U.S.
state of Alaska will investigate all of the oil and natural gas
wells operated by BP Plc at its Prudhoe Bay oil field after the
release of a small amount of crude oil and gas from a well that
had earlier been shut.","Alaska officials probing BP oil, gas wells at Prudhoe Bay after spill"
