,author,content,description,publishedAt,source,title,url,urlToImage,relevancy
155,Reuters Editorial,"WASHINGTON (Reuters) - The United States reimposes oil and financial sanctions against Iran on Monday, significantly turning up the pressure on Tehran in order to curb its missile and nuclear programs and counter its growing military and political influence i… [+2432 chars]","The United States reimposes oil and financial sanctions against Iran on Monday, significantly turning up the pressure on Tehran in order to curb its missile and nuclear programs and counter its growing military and political influence in the Middle East.",2018-11-05T05:27:06Z,"{'id': 'reuters', 'name': 'Reuters'}",U.S. ratchets up pressure on Iran with resumption of sanctions,https://ca.reuters.com/article/businessNews/idCAKCN1NA0DJ-OCABS,https://s4.reutersmedia.net/resources/r/?m=02&d=20181105&t=2&i=1322114156&w=1200&r=LYNXNPEEA408E-OCABS,555
156,Reuters,"The United States reimposed oil and financial sanctions against Iran on Monday, significantly turning up the pressure on Tehran in order to curb its missile and nuclear programs and counter its growing military and political influence in the Middle East. The … [+2302 chars]","The United States reimposed oil and financial sanctions against Iran on Monday, significantly turning up the pressure on Tehran in order to curb its missile and nuclear programs and counter its growing military and political influence in the Middle East.",2018-11-05T05:34:01Z,"{'id': 'cbc-news', 'name': 'CBC News'}",U.S. puts 'maximum pressure' on Iran as sanctions resume,https://www.cbc.ca/news/world/us-iran-sanctions-oil-financial-1.4891512,https://i.cbc.ca/1.4891517.1541395639!/fileImage/httpImage/image.jpg_gen/derivatives/16x9_620/election-2018-trump.jpg,51
157,Michael Martina,"SHANGHAI (Reuters) - China will lower import tariffs and continue to broaden market access, President Xi Jinping pledged on Monday, raising his estimate for the country’s imports in the coming years at the opening of a symbolic week-long trade expo in Shangha… [+4751 chars]","China will lower import tariffs and continue to broaden market access, President Xi Jinping pledged on Monday, raising his estimate for the country's imports in the coming years at the opening of a symbolic week-long trade expo in Shanghai.",2018-11-05T05:47:23Z,"{'id': 'reuters', 'name': 'Reuters'}","China's Xi Jinping promises lower tariffs, more imports",https://in.reuters.com/article/us-china-trade/chinas-xi-jinping-promises-lower-tariffs-more-imports-idINKCN1NA053,https://s3.reutersmedia.net/resources/r/?m=02&d=20181105&t=2&i=1322073856&w=1200&r=LYNXNPEEA4026,493
158,ETMarkets.com,Shares of ONGC were in the green early Monday after the company on Saturday reported a 61 per cent jump in its September quarter net profit as higher prices offset a drop in oil production. The scrip was 1.65 per cent up at Rs 159.95 at around 9.50 am today. … [+1169 chars],Motilal Oswal Financial Services maintained ‘Buy’ with a target price of Rs 206.,2018-11-05T05:48:04Z,"{'id': 'the-times-of-india', 'name': 'The Times of India'}",Brokerages see spike in ONGC stock post Q2 data; Should you buy?,https://economictimes.indiatimes.com/markets/stocks/news/brokerages-see-spike-in-ongc-stock-post-q2-data-should-you-buy/articleshow/66507063.cms,"https://img.etimg.com/thumb/msid-66507048,width-1070,height-580,imgsize-219482,overlay-etmarkets/photo.jpg",291
159,Reuters,Thousands of Iranians chanting Death to America rallied on Sunday to mark the anniversary of the seizure of the U.S. Embassy during the 1979 Islamic Revolution and the imminent reimposition of U.S. sanctions on Irans oil sector. Students attending the governm… [+3203 chars],Thousands of Iranians chanting “Death to America” rallied on Sunday to mark the anniversary of the seizure of the U.S. Embassy during the 1979 Islamic Revolution and the imminent reimposition of U.S. sanctions on Iran’s oil sector. Students attending the gove…,2018-11-05T05:52:15Z,"{'id': None, 'name': 'Rawstory.com'}",Iranian marchers chant ‘death to America’ on eve of Trump’s oil sanctions,https://www.rawstory.com/2018/11/iranian-marchers-chant-death-america-eve-trumps-oil-sanctions-2/,https://www.rawstory.com/wp-content/uploads/2018/11/Screen-Shot-2018-11-05-at-12.49.07-AM-800x430.png,147
160,Reuters Editorial,,"Britain's FTSE 100 index is seen opening flat at
7,094 on Monday, according to financial bookmakers. 
    
    * ROLLS ROYCE: Emirates is edging towards a deal with Rolls-Royce to
power its latest Airbus A380 superjumbos but has not yet reached a
final agreem…",2018-11-05T05:53:02Z,"{'id': 'reuters', 'name': 'Reuters'}",UK Stocks-Factors to watch on Nov 5,https://uk.reuters.com/article/britain-stocks-factors/uk-stocks-factors-to-watch-on-nov-5-idUKL4N1XG2FJ,https://s4.reutersmedia.net/resources_v2/images/rcom-default.png,574
161,Reuters Editorial,,"Britain's FTSE 100 index is seen opening flat at
7,094 on Monday, according to financial bookmakers. 
    
    * ROLLS ROYCE: Emirates is edging towards a deal with Rolls-Royce to
power its latest Airbus A380 superjumbos but has not yet reached a
final agreem…",2018-11-05T05:53:02Z,"{'id': 'reuters', 'name': 'Reuters'}",UK Stocks-Factors to watch on Nov 5,https://www.reuters.com/article/britain-stocks-factors/uk-stocks-factors-to-watch-on-nov-5-idUSL4N1XG2FJ,https://s4.reutersmedia.net/resources_v2/images/rcom-default.png,361
162,"AFP, APP, APP, APP, Zaigham Naqvi, Our Correspondent, Reuters, AFP","The US stance has already inflicted serious pain on Iranians, with the country's currency, the rial, losing more than two thirds of its value since May. PHOTO: AFP WASHINGTON DC: The United States is reimposing punitive measures targeting the Iranian oil and … [+3986 chars]","Saudi Arabia is the only country with the capacity to make up for lost Iranian oil production The post US sanctions on Iran, ‘toughest ever,’ take force Monday appeared first on The Express Tribune.",2018-11-05T05:57:52Z,"{'id': None, 'name': 'Tribune.com.pk'}","US sanctions on Iran, ‘toughest ever,’ take force Monday",https://tribune.com.pk/story/1840850/3-us-sanctions-iran-toughest-ever-take-force-monday/,https://c.tribune.com.pk/2018/11/1840850-image-1541397289-826-640x480.png,142
163,Krishnadev Calamur,"Front companies, barter deals, oil transfers on the high seas: These are just some of the methods that Iran could employ to keep its economy limping on after American sanctions targeting the country’s oil industry went into effect at midnight on Monday. Iran … [+6829 chars]",U.S. sanctions against the Islamic Republic’s oil industry have gone into effect. Tehran is already turning to some old tricks.,2018-11-05T06:00:00Z,"{'id': None, 'name': 'Theatlantic.com'}",Iran Will Continue to Try to Evade U.S. Sanctions,https://www.theatlantic.com/international/archive/2018/11/new-trump-imposed-sanctions-iran-monday/574630/,https://cdn.theatlantic.com/assets/media/img/mt/2018/11/RTR38QSX/facebook.jpg?1541089449,11
164,Bernama,"Sarawak state assembly (Wikipedia pic) KUCHING: Sarawak has proposed a budget of RM11.914 billion for 2019, the biggest to date, with a focus on rural development to stimulate economic progress. Chief Minister Abang Johari Openg said out of this amount, RM9.0… [+2353 chars]",Chief minister says allocation of RM4.3 billion for Sarawak is only 7.94% of the total development budget.,2018-11-05T06:02:07Z,"{'id': None, 'name': 'Freemalaysiatoday.com'}",Sarawak tables record budget of RM11.9 billion,https://www.freemalaysiatoday.com/category/nation/2018/11/05/sarawak-tables-record-budget-of-rm11-9-billion/,https://s3media.freemalaysiatoday.com/wp-content/uploads/2018/11/Dewan-Undangan-Negeri-Sarawak-wiki.jpg,308
165,Press Trust of India,"The Trump administration has said it is confident that ""the toughest ever"" sanctions against Iran which came into effect on Monday will have the intended effect to alter the Iranian regime's behaviour, even as it dodged a question on whether the US has firm c… [+4540 chars]",India and China -- the two biggest buyers of Iranian crude--  have so far appeared to have skipped the punitive American sanctions targeting the Iranian oil and financial sectors,2018-11-05T06:05:00Z,"{'id': None, 'name': 'Business-standard.com'}","Pompeo evasive on India, China's commitments on zero oil purchase from Iran",https://www.business-standard.com/article/international/pompeo-evasive-on-india-china-s-commitments-on-zero-oil-purchase-from-iran-118110500289_1.html,https://bsmedia.business-standard.com/_media/bs/img/article/2017-10/20/full/1508507202-1675.jpg,301
166,Nick Wadhams and Saleha Mohsin | Bloomberg,"US sanctions lifted as part of the 2015 nuclear accord with Iran snapped back at midnight New York time as President Donald Trump fulfills his vow to ramp up pressure on the Islamic Republic over its “malign” behaviour in the Middle East, its ballistic missil… [+2132 chars]","More than 700 'individuals, entities, vessels and aircraft' will be sanctioned, according to the White House",2018-11-05T06:06:00Z,"{'id': None, 'name': 'Business-standard.com'}",Sanctions are here: US snaps back embargo on Iran oil as Trump fulfills vow,https://www.business-standard.com/article/international/sanctions-are-here-us-snaps-back-embargo-on-iran-oil-as-trump-fulfills-vow-118110500291_1.html,https://bsmedia.business-standard.com/_media/bs/img/article/2018-11/03/full/1541262790-4867.jpg,370
167,Reuters,"South Korea said on Monday it has been granted a waiver to at least temporarily continue to import condensate, a super-light form of crude oil, from Iran and also still continue financial transactions with the Middle East country. Japan said it was in close c… [+1335 chars]","Oil prices fell on Monday as the start of U.S. sanctions against Iran's fuel exports was softened by waivers that will allow major buyers to still import Iranian crude, while Tehran said it would ignore Washington and continue to sell.",2018-11-05T06:07:51Z,"{'id': 'the-new-york-times', 'name': 'The New York Times'}",Oil Prices Fall as U.S. Grants Iran Sanction Waivers to Major Importers,https://www.nytimes.com/reuters/2018/11/05/business/05reuters-global-oil.html,https://static01.nyt.com/newsgraphics/images/icons/defaultPromoCrop.png,529
168,,"Akash Jain Ajcon Global Going ahead, we believe rupee movement, cues from the ongoing tussle between US and Iran, volatility in oil prices, movement of bond yields, festive sales, Q2FY19 earnings season, the outcome from (both exit polls and actual result) of… [+6517 chars]",Akash Jain of Ajcon Global said investors can gradually start building their long-term portfolio in some of the top rung stocks of which many have come down 30-40 percent in the recent fall,2018-11-05T06:14:39Z,"{'id': None, 'name': 'Moneycontrol.com'}","Market to be rangebound, but these top 3 picks could return 15-30% in Samvat 2075",https://www.moneycontrol.com/news/business/markets/market-to-be-rangebound-but-these-top-3-picks-could-return-15-30-in-samvat-2075-3127331.html,https://static-news.moneycontrol.com/static-mcnews/2017/05/BSE_Sensex_Markets_Stock_market_Dalal_street1-770x433.jpg,447
169,Neuberger Berman,"By Joseph V. Amato, President and Chief Investment Officer Equities Halloween is overbut market fears could haunt the end-of-year holiday season. At the start of this year, I was urging investors to remember that we were getting into the mature part of the bu… [+8780 chars]","By Joseph V. Amato, President and Chief Investment Officer – Equities Halloween is over…but market fears could haunt the end-of-year holiday season. At the star",2018-11-05T06:18:11Z,"{'id': None, 'name': 'Seekingalpha.com'}",Scary Times,https://seekingalpha.com/article/4218126-scary-times,https://static3.seekingalpha.com/uploads/2018/11/5/saupload_RSS_thumb2.png,558
170,,"The Indian rupee continue its downtrend as it slipped below 73 mark on Monday on foreign fund outflows. It is trading lower by 64 paise at 73.08 per dollar versus Friday's close 72.44. On Friday, rupee surged following broad weakness in the dollar and sharp f… [+711 chars]","USD-INR pair is expected to quote in the range of 73.05 and 73.60, says Motilal Oswal",2018-11-05T06:18:32Z,"{'id': None, 'name': 'Moneycontrol.com'}",Rupee trades below 73/USD; down 64 paise,https://www.moneycontrol.com/news/business/markets/rupee-trades-below-73usd-down-64-paise-3129151.html,https://static-news.moneycontrol.com/static-mcnews/2017/08/rupee-770x433.jpg,90
171,,"By Oladeinde Olawoyin The federal government illegally diverted $1.05 billion (N378 billion at N360 to a dollar) sourced from the Nigerian Liquefied Natural Gas (NLNG) dividend funds to secretly fund subsidy payment on petroleum products, PREMIUM TIMES can re… [+12297 chars]","[Premium Times] The federal government illegally diverted $1.05 billion (N378 billion at N360 to a dollar) sourced from the Nigerian Liquefied Natural Gas (NLNG) dividend funds to secretly fund subsidy payment on petroleum products, PREMIUM TIMES can report t…",2018-11-05T06:20:31Z,"{'id': None, 'name': 'Allafrica.com'}",Nigeria:Documents Show Govt Illegally Diverted U.S.$1.05 Billion NLNG Dividend,https://allafrica.com/stories/201811050087.html,https://cdn07.allafrica.com/static/images/structure/aa-logo-rgba-no-text-128x128.png,306
172,ETMarkets.com,"Crude oil prices may show a weakening bias on Monday as the US allowed waiver to eight jurisdictions from Iran sanctions. Brent crude futures, the global benchmark, were at $72.41 per barrel on Monday, down over 0.50 per cent. Washington has said it will ensu… [+5424 chars]","Brent crude futures, the global benchmark, were at $72.41 per barrel on Monday",2018-11-05T06:24:17Z,"{'id': 'the-times-of-india', 'name': 'The Times of India'}",Commodity outlook: Crude oil may turn soft on US oil waiver,https://economictimes.indiatimes.com/markets/commodities/news/commodity-outlook-crude-oil-may-turn-soft-on-us-oil-waiver/articleshow/66507570.cms,"https://img.etimg.com/thumb/msid-66507553,width-1070,height-580,imgsize-874521,overlay-etmarkets/photo.jpg",168
173,Reuters,"The Schork Report Publisher Stephen Schork on the outlook for oil. Oil prices fell on Monday as the start to U.S. sanctions against Iran's fuel exports was softened by waivers that will allow major buyers to still import Iranian crude, at least temporarily. F… [+3050 chars]",The United States said on Friday it will temporarily allow eight importers to keep buying Iranian oil.,2018-11-05T06:24:48Z,"{'id': None, 'name': 'Foxbusiness.com'}",Oil prices fall as US grants Iran sanctions waivers to major importers,https://www.foxbusiness.com/markets/oil-prices-fall-as-us-grants-iran-sanctions-waivers-to-major-importers,https://a57.foxnews.com/static.foxbusiness.com/foxbusiness.com/content/uploads/2018/02/0/0/2016-11-18T123351Z_3_LYNXMPECAH0KQ_3_COMMODITIES-SUMMIT-IRAN.jpg?ve=1&tl=1,576
174,Joanna Tan,"Iran plans to defy newly reimposed U.S. sanctions and continue to sell, Iranian President Hassan Rohani reportedly said on state TV on Monday, according to Reuters. div &gt; div.group &gt; p:first-child""&gt; On Monday, Washington reimposed sanctions on Iran i… [+255 chars]","Iran plans to defy newly reimposed U.S. sanctions  and continue to sell, Iranian President Hassan Rohani reportedly said on state TV on Monday, according to Reuters.",2018-11-05T06:26:00Z,"{'id': 'cnbc', 'name': 'CNBC'}","Iran will defy US sanctions and sell oil, President Rouhani reportedly says",https://www.cnbc.com/2018/11/05/iran-will-defy-us-sanctions-and-sell-oil-president-rouhani-reportedly-says.html,https://fm.cnbc.com/applications/cnbc.com/resources/img/editorial/2018/08/28/105419306-1535434058838gettyimages-1015477728.1910x1000.jpeg,406
175,RTÉ News,"The US has reimposed oil and financial sanctions against Iran, significantly turning up the pressure on Tehran in order to curb its missile and nuclear programs and counter its growing military and political influence in the Middle East. The move has restored… [+2191 chars]","The US has reimposed oil and financial sanctions against Iran, significantly turning up the pressure on Tehran in order to curb its missile and nuclear programs.",2018-11-05T06:27:00Z,"{'id': 'rte', 'name': 'RTE'}",US resumes sanctions against Iran,https://www.rte.ie/news/world/2018/1105/1008683-us-iran-sanctions/,https://img.rasset.ie/0010f048-1600.jpg,123
176,,"ICICI Direct's currency report on USDINR Spot Currency The rupee posted its biggest intra - day jump on Friday to end at 72. 44, capping its biggest gain in at least five - years. The slump in crude oil prices along with the sharp rally in developed currencie… [+1734 chars]",ICICI Direct expects USDINR to find meet supply pressure at higher levels. Utilise upsides in the pair to initiate short positions.,2018-11-05T06:27:28Z,"{'id': None, 'name': 'Moneycontrol.com'}",Sell USDINR; target of 72.75 - 72.65: ICICI Direct,https://www.moneycontrol.com/news/business/stocks/sell-usdinr-target-of-72-75-72-65-icici-direct-3129331.html,https://static-news.moneycontrol.com/static-mcnews/2018/09/Rupee_2018_-770x433.jpg,112
177,https://www.dailymail.co.uk/home/search.html?s=&authornamef=Reuters,"By Swati Pandey SYDNEY, Nov 5 (Reuters) - Asian stocks skidded on Monday as fears of faster rate hikes in the United States and uncertainty around the Sino-U.S. trade war deterred investment in riskier assets, while sterling briefly jumped to a two-week high … [+4026 chars]","By Swati PandeySYDNEY, Nov 5 (Reuters) - Asian stocks skidded on Monday as  fears of faster rate hikes in the United States and uncertainty  around the...",2018-11-05T06:28:37Z,"{'id': 'daily-mail', 'name': 'Daily Mail'}","Asian shares sell-off as risk sentiment sours, pound...",https://www.dailymail.co.uk/wires/reuters/article-6353485/Asian-shares-sell-risk-sentiment-sours-pound-pares-gains.html,https://i.dailymail.co.uk/i/pix/m_logo_636x382px.png,454
178,Reuters,"By Swati Pandey SYDNEY (Reuters) - Asian stocks skidded on Monday as fears of faster rate hikes in the United States and uncertainty around the Sino-U.S. trade war deterred investment in riskier assets, while sterling briefly jumped to a two-week high on hope… [+4059 chars]","SYDNEY (Reuters) - Asian stocks skidded on Monday as fears of faster rate hikes in the United States and uncertainty around the Sino-U.S. trade war deterred investment in riskier assets, while sterling briefly jumped to a two-week high on hopes of...",2018-11-05T06:30:42Z,"{'id': None, 'name': 'Business-standard.com'}","Global Markets: Asian shares sell-off as risk sentiment sours, pound pares gains",https://www.business-standard.com/article/reuters/global-markets-asian-shares-sell-off-as-risk-sentiment-sours-pound-pares-gains-118110500335_1.html,https://bsmedia.business-standard.com/_media/bs/img/article/default/1181105/full-118110500335.jpg,433
179,Swati Pandey,"SYDNEY (Reuters) - Asian stocks skidded on Monday as fears of faster rate hikes in the United States and uncertainty around the Sino-U.S. trade war deterred investment in riskier assets, while sterling briefly jumped to a two-week high on hopes of an orderly … [+3934 chars]","Asian stocks skidded on Monday as fears of faster rate hikes in the United States and uncertainty around the Sino-U.S. trade war deterred investment in riskier assets, while sterling briefly jumped to a two-week high on hopes of an orderly Brexit.",2018-11-05T06:30:42Z,"{'id': 'reuters', 'name': 'Reuters'}","Global Markets: Asian shares sell-off as risk sentiment sours, pound pares gains",https://in.reuters.com/article/global-markets/global-markets-asian-shares-sell-off-as-risk-sentiment-sours-pound-pares-gains-idINKCN1NA069,https://s4.reutersmedia.net/resources/r/?m=02&d=20181105&t=2&i=1322076434&w=1200&r=LYNXNPEEA402S,455
180,By ANNABELLE LIANG Associated Press,SINGAPORE (AP) Asian markets tumbled Monday as traders feared that President Donald Trump only reported progress in trade talks with China to score political points as the U.S. midterm elections draw near. KEEPING SCORE: Japan's Nikkei 225 index fell 1.6 perc… [+2982 chars],SINGAPORE (AP) — Asian markets tumbled Monday as traders feared that President Donald Trump only reported progress in trade talks with China to score political points as the U.S. midterm elections draw near.,2018-11-05T06:32:20Z,"{'id': 'associated-press', 'name': 'Associated Press'}",Asian shares slide on worries over US-China relations,https://apnews.com/b2c050fa3eb0445cb7eba3d70ee3197e,https://bloximages.newyork1.vip.townnews.com/roanoke.com/content/tncms/assets/v3/editorial/9/4e/94e18572-a1a9-5100-8983-001486174e60/5bdfc4d01ab73.image.jpg?resize=902%2C630,494
181,ANNABELLE LIANG,SINGAPORE (AP) Asian markets tumbled Monday as traders feared that President Donald Trump only reported progress in trade talks with China to score political points as the U.S. midterm elections draw near. KEEPING SCORE: Japan’s Nikkei 225 index fell 1.6 perc… [+2769 chars],SINGAPORE (AP) — Asian markets tumbled Monday as traders feared that President Donald Trump only reported progress in trade talks with China to score political points as the U.S. midterm elections draw near. KEEPING SCORE: Japan’s Nikkei 225 index fell 1.6 pe…,2018-11-05T06:32:20Z,"{'id': None, 'name': 'Seattletimes.com'}",Asian shares slide on worries over US-China relations,https://www.seattletimes.com/business/asian-shares-slide-on-worries-over-us-china-relations-2/,https://static.seattletimes.com/wp-content/uploads/2018/11/urn-publicid-ap-org-a1f5f5771ed7426cbda4b93b0715f8a2Hong_Kong_Financial_Markets_54214-1200x630.jpg,173
182,The Associated Press,"Asian markets tumbled Monday as traders feared that President Donald Trump only reported progress in trade talks with China to score political points as the U.S. midterm election s draw near. KEEPING SCORE: Japan 's Nikkei 225 index fell 1.6 percent at 21,898… [+2757 chars]","Get breaking national and world news, broadcast video coverage, and exclusive interviews. Find the top news online at ABC news.",2018-11-05T06:32:47Z,"{'id': 'abc-news', 'name': 'ABC News'}",Asian shares slide on worries over US-China relations,https://abcnews.go.com/Business/wireStory/asian-shares-slide-worries-us-china-relations-58969448,https://s.abcnews.com/images/Business/WireAP_bec0f669e3004a548823f1d5c03512a8_16x9_992.jpg,358
183,PTI,"WASHINGTON: The Trump administration has said it is confident that ""the toughest ever"" sanctions against Iran which came into force on Monday will have the intended effect of altering the Iranian regime's behaviour, even as it dodged a question on whether the… [+4574 chars]","Iran ban begins, US sidesteps India questionUS has asserted that the reimposed sanctions on Iran, are the toughest ever on this country.",2018-11-05T06:33:24Z,"{'id': 'the-times-of-india', 'name': 'The Times of India'}","Iran ban begins, US sidesteps India question",https://economictimes.indiatimes.com/news/economy/foreign-trade/trumps-ban-on-iran-comes-into-force-us-dodges-question-on-commitment-from-india-china/articleshow/66507631.cms,"https://img.etimg.com/thumb/msid-66507752,width-1070,height-580,imgsize-137780,overlay-economictimes/photo.jpg",47
184,By ANNABELLE LIANG Associated Press,"Asian markets tumbled Monday as traders feared that President Donald Trump only reported progress in trade talks with China to score political points as the U.S. midterm elections draw near. KEEPING SCORE: Japan's Nikkei 225 index fell 1.6 percent at 21,898.9… [+2754 chars]",Asian markets tumbled Monday as traders feared that President Donald Trump only reported progress in trade talks with China to score political points as the U.S. midterm elections draw near. … Click to Continue »,2018-11-05T06:34:10Z,"{'id': None, 'name': 'Charlotteobserver.com'}",Asian shares slide on worries over US-China relations,https://www.charlotteobserver.com/news/business/national-business/article221132840.html#storylink=rss,https://www.mcclatchy-wires.com/incoming/25kjuc/picture221131080/alternates/LANDSCAPE_1140/Hong_Kong_Financial_Markets_54214.jpg,517
185,Swati Pandey,"SYDNEY (Reuters) - Asian stocks skidded on Monday as fears of faster rate hikes in the United States and uncertainty around the Sino-U.S. trade war deterred investment in riskier assets, while sterling briefly jumped to a two-week high on hopes of an orderly … [+4024 chars]","Asian stocks skidded on Monday as fears of faster rate hikes in the United States and uncertainty around the Sino-U.S. trade war deterred investment in riskier assets, while sterling briefly jumped to a two-week high on hopes of an orderly Brexit.",2018-11-05T06:35:28Z,"{'id': 'reuters', 'name': 'Reuters'}","Asian shares sell-off as risk sentiment sours, pound pares gains",https://www.reuters.com/article/us-global-markets/asian-shares-sell-off-as-risk-sentiment-sours-pound-pares-gains-idUSKCN1N90PQ,https://s2.reutersmedia.net/resources/r/?m=02&d=20181105&t=2&i=1322103527&w=1200&r=LYNXNPEEA407H,575
186,PTI,"By: PTI | Washington | Updated: November 5, 2018 12:14:09 pm US President Donald Trump (AP Photo/Jeff Roberson) The Trump administration has said it is confident that “the toughest ever” sanctions against Iran which came into effect on Monday will have the in… [+4703 chars]","The Trump administration said it has asked these countries including Turkey, Iraq, Italy, Japan and South Korea to bring down their oil purchase to zero as soon as possible.",2018-11-05T06:35:32Z,"{'id': None, 'name': 'Indianexpress.com'}",US’ ‘toughest ever’ sanctions against Iran come into force,https://indianexpress.com/article/world/us-toughest-ever-sanctions-against-iran-come-into-force-5434556/,https://images.indianexpress.com/2018/10/trump7.jpg?w=759,184
