,author,content,description,publishedAt,source,title,url,urlToImage,relevancy
429,,"Barbara Slavin Security, Middle East Impoverishing Iran's people will only turn pro-American Middle Easterners against the United States. Trumps Iran Sanctions Undermine U.S. Interests and Values Sanctions have become an addiction for successive U.S. governme… [+5355 chars]",Impoverishing Iran's people will only turn pro-American Middle Easterners against the United States.,2018-11-05T15:36:00Z,"{'id': None, 'name': 'Yahoo.com'}",Trump’s Iran Sanctions Undermine U.S. Interests and Values,https://www.yahoo.com/news/trump-iran-sanctions-undermine-u-153600326.html,https://s.yimg.com/uu/api/res/1.2/AQ2aub33._iR6EHyfF502w--~B/aD02ODM7dz0xMDI0O3NtPTE7YXBwaWQ9eXRhY2h5b24-/http://media.zenfs.com/en-US/homerun/the_national_interest_705/03f4aa21658b836902a61cc1db93c64d,295
430,Humeyra Pamuk,"WASHINGTON/SEOUL (Reuters) - The United States snapped sanctions back in place on Monday to choke off Iran’s oil and shipping industry, while temporarily allowing top customers such as China and India to keep buying crude from the Islamic Republic. Having aba… [+3360 chars]","The United States snapped sanctions back in place on Monday to choke off Iran's oil and shipping industry, while temporarily allowing top customers such as China and India to keep buying crude from the Islamic Republic.",2018-11-05T15:36:12Z,"{'id': 'reuters', 'name': 'Reuters'}","U.S. snaps back Iran sanctions, grants oil waivers to China, seven others",https://www.reuters.com/article/us-usa-iran-sanctions-oil/u-s-snaps-back-iran-sanctions-grants-oil-waivers-to-china-seven-others-idUSKCN1NA0O8,https://s3.reutersmedia.net/resources/r/?m=02&d=20181105&t=2&i=1322270808&w=1200&r=LYNXNPEEA40O7,42
431,Achilles Research,"BP ( BP ) makes a compelling value proposition on the drop. The energy company produces high, recurring dividend income and has upside potential in a rising oil environment. BP has maintained its dividend payout during the last energy market downturn, and a d… [+4767 chars]",BP is a directional bet on higher energy prices. The energy company manages to cover its capex and dividend with organic cash flow. BP maintains considerable FC,2018-11-05T15:38:45Z,"{'id': None, 'name': 'Seekingalpha.com'}",BP: Buy The Drop,https://seekingalpha.com/article/4218207-bp-buy-drop,https://static.seekingalpha.com/uploads/2018/11/3/saupload_6abc88fef791aeff8f4934f2de2584a7.png,486
432,,"The fall in crude prices, cooling off of the benchmark bond yields and favourable turn of a few other factors has led to a pullback rally in the market; however, we are not completely out of the woods yet, said CNBC-TV18 Consulting Editor Udayan Mukherjee in … [+13224 chars]",Mukherjee noted that credit issues still linger in the system and we need to be very vigilant over the next 4-6 month to ensure that some of these issues do not blow up once again.,2018-11-05T15:40:49Z,"{'id': None, 'name': 'Moneycontrol.com'}","Udayan@Moneycontrol: Market not fully out of woods, avoid being âwedded to certain sectors, stocks#39;",https://www.moneycontrol.com/news/business/markets/udayanmoneycontrol-market-not-fully-out-of-woods-avoid-being-wedded-to-certain-sectors-stocks-3134001.html,https://static-news.moneycontrol.com/static-mcnews/2018/04/udayan_mukherjee-770x433.jpg,189
433,,"The United States vowed Monday to be ""relentless"" in countering Iran as sweeping sanctions took effect, but the Islamic republic defiantly promised to stand up to the ""bullying"" by Washington. President Donald Trump's administration nonetheless issued eight e… [+5327 chars]","The United States vowed Monday to be ""relentless"" in countering Iran as sweeping sanctions took effect, but the Islamic republic defiantly promised to stand up to the ""bullying"" by Washington.The global network of Agence France Presse cove",2018-11-05T15:42:00Z,"{'id': None, 'name': 'Afp.com'}",US vows 'relentless' sanctions as Iran defiant,https://www.afp.com/en/news/15/us-vows-relentless-sanctions-iran-defiant-doc-1ak91e4,,573
434,Associated Press,"U.S. stocks were mostly higher early Monday as Warren Buffett's Berkshire Hathaway led gains in financial companies, while energy companies rose along with the prices of oil and natural gas. Technology companies continued to struggle as Apple dropped again. A… [+3327 chars]","U.S. stocks were mostly higher early Monday as Warren Buffett's Berkshire Hathaway led gains in financial companies, while energy companies rose along with the prices of oil and natural gas. Technology companies continued to struggle as Apple dropped again. A…",2018-11-05T15:45:00Z,"{'id': None, 'name': 'Latimes.com'}","Stocks mostly rise, but Apple falls further",http://www.latimes.com/business/la-fi-markets-20181105-story.html,https://www.latimes.com/resizer/hQV3qgX6iQ7VT4LQZ1smuM7Uvdk=/1200x0/arc-anglerfish-arc2-prod-tronc.s3.amazonaws.com/public/3J3N4TISXZHBHIFPWD4SIGP73Y.jpg,402
435,,"Nov. 5 (UPI) -- Crude oil future prices rose Monday following news that the United States has issued waivers to allow Iran to continue to sell crude oil to several big buying nations, including China and India. As of 9.41 a.m. front-month WTI was up $63.77 pe… [+2076 chars]","Crude oil future prices rose Monday following news that the U.S. issued waivers that would allow Iran to continue to sell oil to China, India and other buyers.",2018-11-05T15:45:06Z,"{'id': None, 'name': 'Upi.com'}",Crude oil prices up as U.S. announces waivers from Iran sanctions,https://www.upi.com/Energy-News/2018/11/05/Crude-oil-prices-up-as-US-announces-waivers-from-Iran-sanctions/8551541429793/,https://cdnph.upi.com/sv/ph/og/upi/8551541429793/2018/1/f7c93e7de7e713f36b6cff71648c7165/v1.5/Crude-oil-prices-up-as-US-announces-waivers-from-Iran-sanctions.jpg,254
436,"Jim Collins, Contributor, Jim Collins, Contributor https://www.forbes.com/sites/jimcollins/","Natural gas prices spiked in early trading Monday, with the front-month December contract hitting $3.54 per million British Thermal Units (MMBTU.) &amp;nbsp;The December and January contracts are both trading above $3.50 and then there is a steep drop off as … [+13181 chars]","Higher natural gas prices contribute to inflation, especially in the winter, so you should make sure your portfolio benefits by including shares of natural gas producers.",2018-11-05T15:46:00Z,"{'id': None, 'name': 'Forbes.com'}",Buy Natural Gas Producers To Play The Dramatic Rally in Natgas Prices,https://www.forbes.com/sites/jimcollins/2018/11/05/buy-natural-gas-producers-to-play-the-dramatic-rally-in-natgas-prices/,https://thumbor.forbes.com/thumbor/600x315/https%3A%2F%2Fspecials-images.forbesimg.com%2Fdam%2Fimageserve%2F1057812356%2F960x0.jpg%3Ffit%3Dscale,69
437,i24NEWS,"The United States will exempt China, India and Japan from oil sanctions on Iran, Secretary of State Mike Pompeo said Monday, while vowing to be ""relentless"" in pressuring Tehran. Hours after sweeping sanctions were reimposed following the US withdrawal from a… [+4763 chars]",,2018-11-05T15:48:06Z,"{'id': None, 'name': 'I24news.tv'}",US vows 'relentless' sanctions as Iran defiant,https://www.i24news.tv/en/news/international/middle-east/187981-181105-us-vows-relentless-sanctions-as-iran-defiant,https://cdn.i24news.tv/upload/image/afp-de633f383f7940d6466e08b5bcc418861e30936b.jpg,591
438,Reuters,"Photo: Igor Grochev / Shutterstock By Humeyra Pamuk and Jane Chung WASHINGTON/SEOUL, Nov 5 (Reuters) – The United States snapped sanctions back in place on Monday to choke off Iran’s oil and shipping industry, while temporarily allowing top customers such as … [+3408 chars]","By Humeyra Pamuk and Jane Chung WASHINGTON/SEOUL, Nov 5 (Reuters) – The United States snapped sanctions back in place on Monday to choke off Iran’s oil and shipping industry, while temporarily allowing top customers such as China and India to keep buying crud…",2018-11-05T15:48:37Z,"{'id': None, 'name': 'Gcaptain.com'}",U.S. Snaps Back Iran Sanctions with Waivers to Top Oil Buyers,https://gcaptain.com/u-s-snaps-back-iran-sanctions-with-waivers-to-top-oil-buyers/,https://gcaptain.com/wp-content/uploads/2018/07/shutterstock_770451511.jpg,171
439,,"Emboldened by an OBR windfall, Britain's chancellor tossed largesse to potential Brexit problem groups and declared austerity was coming to an end. But was he fiscally reckless?",The FT's David Sheppard explains what the US sanctions mean for the worldwide oil market and the price paid for crude supplies.,2018-11-05T15:53:35Z,"{'id': 'financial-times', 'name': 'Financial Times'}",US sanctions on Iran spur oil price volatility,https://www.ft.com/video/3d2ba00d-7559-4346-b0da-fcfdf870c474,https://www.ft.com/__origami/service/image/v2/images/raw/http%3A%2F%2Fprod-upp-image-read.ft.com%2Fbea02b21-614c-49e3-90b9-fb29a13cb6c1?source=next-opengraph&fit=scale-down&width=900,60
440,MARLEY JAY,"NEW YORK — U.S. stocks are mostly higher early Monday as Warren Buffett’s Berkshire Hathaway leads gains in financial companies, while energy companies rise along with the prices of oil and natural gas. Technology companies continue to struggle as Apple drops… [+3671 chars]",The gains in the United States come after stocks recovered early losses in Euope.,2018-11-05T15:53:56Z,"{'id': None, 'name': 'Bostonglobe.com'}",US stocks are higher even as Apple sinks again,https://www.bostonglobe.com/business/2018/11/05/stocks-are-higher-even-apple-sinks-again/NSZy7jyCzta7omoFLdywKL/story.html,https://www.bostonglobe.com/rf/image_585w/Boston/2011-2020/2018/11/05/BostonGlobe.com/Business/Images/midterms-8a8d8ca6-e0f8-11e8-b759-3d88a5ce9e19.jpg,236
441,"Matthew Lee, Associated Press","WASHINGTON The Trump administration’s tough new sanctions on Iran took effect on Monday but eight major importers of Iranian oil were spared from immediate penalties. The sanctions target Iran’s energy, financial and shipping sectors and are aimed at cripplin… [+3401 chars]","The sanctions target Iran's energy, financial and shipping sectors and are aimed at crippling the country's economy following President Donald Trump's withdrawal from the 2015 nuclear deal.",2018-11-05T15:57:00Z,"{'id': None, 'name': 'Pbs.org'}",U.S. sanctions on Iran take effect,https://www.pbs.org/newshour/politics/u-s-sanctions-on-iran-take-effect,https://d3i6fh83elv35t.cloudfront.net/newshour/app/uploads/2016/02/RTX28IHX-1024x683.jpg,422
442,SA Editor Carl Surran,"Magellan Midstream Partners ( MMP +1.5% ) and Navigator Energy Services say they have launched an open season to assess customer interest in transporting various grades of light crude oil and condensate from Cushing, Okla., to Houston. MMP says the proposed V… [+508 chars]",Magellan Midstream Partners (MMP +1.5%) and Navigator Energy Services say they have launched an open season to assess customer interest in transporting various grades of light crude oil and condensate,2018-11-05T15:59:02Z,"{'id': None, 'name': 'Seekingalpha.com'}",Magellan launches open season for possible Cushing-to-Houston crude pipeline,https://seekingalpha.com/news/3405192-magellan-launches-open-season-possible-cushing-houston-crude-pipeline,https://static3.seekingalpha.com/assets/og_image_192-59bfd51c9fe6af025b2f9f96c807e46f8e2f06c5ae787b15bf1423e6c676d4db.png,162
443,"Nick Wadhams, Golnar Motevalli and Ladane Nasseri","The U.S. reimposed sanctions on Iran’s critical oil industry Monday, raising pressure on the Islamic Republic to scale back its ballistic missile program and involvement in conflicts across the Middle East. The sanctions on Iran’s energy, shipping and banking… [+5178 chars]","The U.S. reimposed sanctions on Iran’s critical oil industry Monday, raising pressure on the Islamic Republic to scale back its ballistic missile program and involvement in conflicts across the Middle East. The sanctions on Iran’s energy, shipping and banking…",2018-11-05T16:00:32Z,"{'id': None, 'name': 'Insurancejournal.com'}","U.S. Reimposes Iranian Sanctions, Hitting Insurance, Shipping, Energy, Banking",https://www.insurancejournal.com/news/international/2018/11/05/506699.htm,https://www.insurancejournal.com/img/insurancejournal-square.png,174
444,Paul Ausick,U.S. Secretary of State Mike Pompeo and Treasury Secretary Steve Mnuchin on Monday announced the reimposition of U.S. sanctions on Iran related to that country’s nuclear development program. The sanctions primarily restrict oil exports from Iran under threat … [+1976 chars],"U.S. sanctions against Iran went into effect today, six months after the Trump administration announced the sanctions. The impact on crude markets has been downgraded over the period, but prices did move a bit higher Monday.",2018-11-05T16:10:28Z,"{'id': None, 'name': '247wallst.com'}",US Reimposes Iran Sanctions; Crude Prices Move Higher,http://247wallst.com/energy-economy/2018/11/05/us-reimposes-iran-sanctions-crude-prices-move-higher/,https://s2.wp.com/wp-content/themes/vip/247wallst/images/247-50x50.png,138
445,Seeking Profits,"Units of Enterprise Products Partners ( EPD ) have spent much of the past two years stuck in a $25-$30 range, though investors have at least enjoyed a steadily increasing dividend. However while EPD units have been moving sideways, the MLP has been moving for… [+6298 chars]","EPD has slowed its distribution growth to retain more cash, enhancing future financial flexibility. EPD has made significant progress on this front, retaining $",2018-11-05T16:12:09Z,"{'id': None, 'name': 'Seekingalpha.com'}",Enterprise Products Has A Growing Distribution That Should Accelerate In Time,https://seekingalpha.com/article/4218233-enterprise-products-growing-distribution-accelerate-time,https://static3.seekingalpha.com/uploads/2018/11/3/13071522-15412785898897111.png,550
446,Star Tribune Staff,"NEW YORK Stocks that moved substantially or traded heavily Monday: Berkshire Hathaway Inc., up $9.67 to $216.24 Warren Buffett's company said its quarterly profit surged and it bought back almost $1 billion in stock. Eli Lilly and Co., up $3.39 to $110.14 The… [+855 chars]",Stocks that moved substantially or traded heavily Monday:,2018-11-05T16:15:00Z,"{'id': None, 'name': 'Startribune.com'}",Berkshire Hathaway and Lilly climb; Sysco and MGM sink,http://www.startribune.com/berkshire-hathaway-and-lilly-climb-sysco-and-mgm-sink/499707671/,http://assets.startribune.com/static/img/branding/logos/strib-social-card.png?d=1541453092,525
447,"Amiti Sen, Richa Mishra",The devil lies in the details on how much respite India and seven others have got from the US to import Iranian oil. The oil companies and Ministry for Petroleum &amp; Natural Gas are still awaiting finer details before working out their next course of action… [+2891 chars],"Exemption may come up for periodic review, exports to Iran to face scrutiny too",2018-11-05T16:24:04Z,"{'id': None, 'name': 'Thehindubusinessline.com'}",India’s continued oil imports from Iran tied to tough US conditions,https://www.thehindubusinessline.com/economy/indias-continued-oil-imports-from-iran-tied-to-tough-us-conditions/article25429442.ece,https://www.thehindubusinessline.com/economy/4almt9/article25429438.ece/ALTERNATES/LANDSCAPE_615/CRUDEOIL,247
448,newsfeedback@fool.com (Tyler Crowe),"Every part of the oil and gas business has its strengths and weaknesses. For Canadian oil sands producers, they benefit from oil sands being a long-life oil source that doesn't need a lot of money to maintain production for decades. The downside is that Canad… [+6553 chars]","Instead of being a victim of low Canadian oil prices, Suncor Energy takes full advantage of the situation with its integrated business model.",2018-11-05T16:25:00Z,"{'id': None, 'name': 'Fool.com'}",This Big Oil Company Turns Its Greatest Weakness Into a Strength,https://www.fool.com/investing/2018/11/05/this-big-oil-company-turns-its-greatest-weakness-i.aspx,https://g.foolcdn.com/image/?url=https%3A%2F%2Fg.foolcdn.com%2Feditorial%2Fimages%2F500224%2Foil-sands-4-from-suncor.jpg&h=630&w=1200&op=resize,23
449,Rodrigo Campos,"NEW YORK (Reuters) - An index of stocks on major markets were flat on Monday, following four days of a bounce-back from a 14-month low, ahead of a key vote to define the power balance in Washington and a meeting of the U.S. monetary policy makers. Oil prices … [+4276 chars]","An index of stocks on major markets were flat on Monday, following four days of a bounce-back from a 14-month low, ahead of a key vote to define the power balance in Washington and a meeting of the U.S. monetary policy makers.",2018-11-05T16:28:32Z,"{'id': 'reuters', 'name': 'Reuters'}","Stocks little changed ahead of midterms, Fed; oil up",https://www.reuters.com/article/us-global-markets/stocks-little-changed-ahead-of-midterms-fed-oil-up-idUSKCN1N90PQ,https://s1.reutersmedia.net/resources/r/?m=02&d=20181105&t=2&i=1322285330&w=1200&r=LYNXNPEEA41A1,7
450,https://www.dailymail.co.uk/home/search.html?s=&authornamef=Reuters,"By Rodrigo Campos NEW YORK, Nov 5 (Reuters) - An index of stocks on major markets were flat on Monday, following four days of a bounce-back from a 14-month low, ahead of a key vote to define the power balance in Washington and a meeting of the U.S. monetary p… [+4250 chars]","By Rodrigo CamposNEW YORK, Nov 5 (Reuters) - An index of stocks on major  markets were flat on Monday, following four days of a  bounce-back from a 14-month...",2018-11-05T16:28:41Z,"{'id': 'daily-mail', 'name': 'Daily Mail'}","Stocks little changed ahead of midterms, Fed; oil up",https://www.dailymail.co.uk/wires/reuters/article-6355253/Stocks-little-changed-ahead-midterms-Fed-oil-up.html,https://i.dailymail.co.uk/i/pix/m_logo_636x382px.png,329
451,Rodrigo Campos,"NEW YORK (Reuters) - An index of stocks on major markets were flat on Monday, following four days of a bounce-back from a 14-month low, ahead of a key vote to define the power balance in Washington and a meeting of the U.S. monetary policy makers. Oil prices … [+4419 chars]","An index of stocks on major markets were flat on Monday, following four days of a bounce-back from a 14-month low, ahead of a key vote to define the power balance in Washington and a meeting of the U.S. monetary policy makers.",2018-11-05T16:30:55Z,"{'id': 'reuters', 'name': 'Reuters'}","Global Markets: Stocks little changed ahead of midterms, Fed; oil up",https://in.reuters.com/article/global-markets/global-markets-stocks-little-changed-ahead-of-midterms-fed-oil-up-idINKCN1NA069,https://s3.reutersmedia.net/resources/r/?m=02&d=20181105&t=2&i=1322287164&w=1200&r=LYNXNPEEA41A7,352
452,By REUTERS,"X Dear Reader, As you can imagine, more people are reading The Jerusalem Post than ever before. Nevertheless, traditional business models are no longer sustainable and high-quality publications, like ours, are being forced to look for new ways to keep going. … [+2711 chars]",,2018-11-05T16:39:13Z,"{'id': 'the-jerusalem-post', 'name': 'The Jerusalem Post'}",Rouhani says Iran will break U.S. sanctions,https://www.jpost.com/Middle-East/Rouhani-says-Iran-will-break-US-sanctions-571121,"https://images.jpost.com/image/upload/f_auto,fl_lossy/t_Article2016_ControlFaceDetect/430124",285
453,John Hayward,"Rouhani compared U.S. President Donald Trump to the late Iraqi dictator Saddam Hussein, declared Iran faces a war situation, and vowed to proudly bypass the American sanctions that went into effect on November 5. I announce that we will proudly bypass your il… [+3954 chars]",Iranian President Hassan Rouhani was defiant and belligerent in the face of new U.S. sanctions in remarks aired by Iranian state television on Monday.,2018-11-05T16:45:29Z,"{'id': 'breitbart-news', 'name': 'Breitbart News'}","Rouhani Compares Trump to Saddam Hussein, Declares Iran Will 'Proudly Bypass' Sanctions",https://www.breitbart.com/national-security/2018/11/05/rouhani-compares-trump-to-saddam-hussein-declares-iran-will-proudly-bypass-sanctions/,https://media.breitbart.com/media/2018/07/wi/ap/23/53f8e2_trump-iran-35688-donald-trump-hassan-rouhani-combo-combination-two-pictures-e1532385234741.jpg,545
454,Ross J Burland,Note: All information on this page is subject to change. The use of this website constitutes acceptance of our user agreement. Please read our privacy policy and legal disclaimer. Trading foreign exchange on margin carries a high level of risk and may not be … [+1276 chars],"Analysts at Rabobank explained that today marks the start of US sanctions on Iran. Key Quotes: ""Trump stated on Friday that “our objective is to force the regime into a clear choice: either abandon its destructive behaviour or continue down the path towards e…",2018-11-05T16:47:35Z,"{'id': None, 'name': 'Fxstreet.com'}",Trump is forcing Iranian regime to economic disaster - Rabobank,https://www.fxstreet.com/news/trump-is-forcing-iranian-regime-to-economic-disaster-rabobank-201811051647,https://editorial.azureedge.net/images/Macroeconomics/Countries/Middle East/Iran/tehran-5703360_Large.jpg,159
455,AFP,A monitor displays stock market information on the floor of the New York Stock Exchange. (Bloomberg pic) NEW YORK: Wall Street stocks were mixed early Monday ahead of much-anticipated US congressional elections that will affect the course of President Donald … [+1215 chars],"The broad-based S&P 500 advanced 0.2% to 2,728.22, while the tech-rich Nasdaq Composite Index shed 0.6% to 7,313.05.",2018-11-05T16:48:35Z,"{'id': None, 'name': 'Freemalaysiatoday.com'}",US stocks mixed ahead of midterm elections,https://www.freemalaysiatoday.com/category/business/2018/11/06/us-stocks-mixed-ahead-of-midterm-elections/,https://s3media.freemalaysiatoday.com/wp-content/uploads/2018/10/nyse-bloomberg-12102018.jpg,257
456,,"WASHINGTON — The United States will exempt China, India and Japan from oil sanctions on Iran, Secretary of State Mike Pompeo said Monday, while vowing to be “relentless” in pressuring Tehran. Hours after sweeping sanctions were reimposed following the US with… [+2144 chars]","America's top diplomat defends waivers, vows to be 'relentless' in pressuring Tehran",2018-11-05T16:49:09Z,"{'id': None, 'name': 'Timesofisrael.com'}","US exempts China, India, Japan and 5 other countries from Iran oil sanctions",https://www.timesofisrael.com/us-exempts-china-india-japan-and-5-other-countries-from-iran-oil-sanctions/,https://static.timesofisrael.com/www/uploads/2018/11/000_1AL0HG-1024x640.jpg,501
457,,"WASHINGTON: The United States vowed on Monday (Nov 5) to be ""relentless"" in countering Iran as sweeping sanctions took effect, but the Islamic republic defiantly promised to stand up to the ""bullying"" by Washington. President Donald Trump's administration non… [+5386 chars]","President Donald Trump's administration issued eight exemptions from its demand on all countries to stop buying Iranian oil, the country's largest export.",2018-11-05T16:50:38Z,"{'id': None, 'name': 'Channelnewsasia.com'}",US vows 'relentless' sanctions as Iran defiant,https://www.channelnewsasia.com/news/world/us-vows-relentless-sanctions-as-iran-defiant-10900488,http://www.channelnewsasia.com/image/10900468/16x9/991/557/efaeb12a6bd54bcf1a883d4ca8ae2e07/os/mike-pompeo.jpg,183
458,The Canadian Press,"In New York, the Dow Jones industrial average was up 139.46 points at 25,410.29. The S&amp;P 500 index was up 9.77 points at 2,732.83, while the Nasdaq composite was down 60.34 points at 7,296.65. The Canadian dollar traded higher at 76.42 cents (U.S.) compar… [+357 chars]","Strength in energy stocks helped lift Canada’s main stock index higher in late-morning trading, while oil and natural gas prices also climbed higher.",2018-11-05T16:52:08Z,"{'id': None, 'name': 'Thestar.com'}","Energy sector helps lift Toronto market, U.S. stocks mixed at late morning",https://www.thestar.com/business/markets/2018/11/05/energy-sector-helps-lift-toronto-market-us-stocks-mixed-at-late-morning.html,https://images.thestar.com/j9lvf7reQYzuT0FnRVxGaNPY4Os=/1200x719/smart/filters:cb(1541441251885)/https://www.thestar.com/content/dam/thestar/business/markets/2018/11/05/energy-sector-helps-lift-toronto-market-us-stocks-mixed-at-late-morning/loon.jpg,347
459,"By MARLEY JAY, AP Markets Writer","FILE - In this Tuesday, Oct. 23, 2018, file photo trader Peter Tuchman, center, works on the floor of the New York Stock Exchange. The U.S. stock market opens at 9:30 a.m. EDT on Monday, Nov. 5. FILE - In this Tuesday, Oct. 23, 2018, file photo trader Peter T… [+4528 chars]","NEW YORK (AP) — U.S. stocks are mostly higher early Monday as Warren Buffett's Berkshire Hathaway leads gains in financial companies, while energy companies rise along with the prices of oil and natural gas. Technology companies continue to struggle as Apple …",2018-11-05T16:54:29Z,"{'id': None, 'name': 'Seattlepi.com'}",US stocks are higher as Berkshire climbs; Apple sinks again,https://www.seattlepi.com/news/article/US-stocks-are-higher-as-Berkshire-climbs-Apple-13363449.php,https://s.hdnux.com/photos/76/60/31/16451170/7/rawImage.jpg,476
