,author,content,description,publishedAt,source,title,url,urlToImage,relevancy
0,United Nations Headquarters,"Voting to extend, until 15 February 2020, the mandate of the Panel of Experts who oversee the sanctions targeting the illicit export of oil from Libya, the Security Council decided that perpetrators of gender-based violence may also be subject to the measures… [+18044 chars]","Voting to extend, until 15 February 2020, the mandate of the Panel of Experts who oversee the sanctions targeting the illicit export of oil from Libya, the Security Council decided that perpetrators of gender-based violence may also be subject to the measures.",2018-11-05T00:00:00Z,"{'id': None, 'name': 'Un.org'}","Security Council Grants Mandate Extension to Panel of Experts on Libya Sanctions, Adopting Resolution 2441 (2018) by 13 Votes, with 2 Abstentions",https://www.un.org/press/en/2018/sc13564.doc.htm,,512
1,Bloomberg,"Kelly Gilblom and Kevin Crowley Monday, November 05, 2018 (Bloomberg) -- Oil companies saw soaring profits during the third quarter as they emerge worst-in-a-generation crude slump. The main takeaway is that while results are mostly above or in line with expe… [+3621 chars]",Oil companies saw soaring profits during 3Q as they emerge worst-in-a-generation crude slump.,2018-11-05T00:00:00Z,"{'id': None, 'name': 'Rigzone.com'}",Oil Majors See Roaring Profits During 3Q,https://www.rigzone.com/news/wire/oil_majors_see_roaring_profits_during_3q-05-nov-2018-157388-article/,https://images.rigzone.com/images/news/articles/157388_582x327.png,109
2,Matthew V. Veazey,"Rigzone Staff Monday, November 05, 2018 Magellan Midstream Partners, L.P. (MMP) and Navigator Energy Services have launched a binding open season to gauge customer interest in a pipeline project to ship light crudes and condensate from Cushing, Okla., to Hous… [+1423 chars]",The proposed Voyager pipeline would extend nearly 500 miles and could be in service in late-2020.,2018-11-05T00:00:00Z,"{'id': None, 'name': 'Rigzone.com'}","New Pipeline Would Link Cushing to Houston, Possibly Corpus",https://www.rigzone.com/news/new_pipeline_would_link_cushing_to_houston_possibly_corpus-05-nov-2018-157394-article/,https://images.rigzone.com/images/news/articles/157394_582x327.png,488
3,Bloomberg,"Javier Blas &amp; Nick Wadhams Monday, November 05, 2018 (Bloomberg) -- Among the hundreds of Iranian-linked banks, companies and vessels that the U.S. slapped sanctions against on Monday was an Iranian crude oil tanker called the Sanchi. There’s one problem:… [+1329 chars]","Among the hundreds of Iranian-linked banks, companies and vessels that the US slapped sanctions against was an Iranian crude oil tanker called the Sanchi.",2018-11-05T00:00:00Z,"{'id': None, 'name': 'Rigzone.com'}",Sunken Iranian Tanker Sanchi among Ships Hit by Sanctions,https://www.rigzone.com/news/wire/sunken_iranian_tanker_sanchi_among_ships_hit_by_sanctions-05-nov-2018-157398-article/,https://images.rigzone.com/images/rz-facebook.jpg,132
4,Martin Tillier,"WTI has recently experienced one of its biggest one-month declines in several years, having lost around eighteen percent since hitting a multi-year high of $76.90 last month. There has been a perfect storm for sellers, with factors on both the supply and dema… [+3298 chars]","WTI has recently experienced one of its biggest one-month declines in several years, having lost around eighteen percent since hitting a multi-year high of $76.90 last month. There has been a perfect storm for sellers, with factors on both the supply and dema…",2018-11-05T00:00:00Z,"{'id': None, 'name': 'Oilprice.com'}",Oil Looks Set For A Rapid Bounce,https://oilprice.com/Energy/Energy-General/Oil-Looks-Set-For-A-Rapid-Bounce.html,https://d32r1sh890xpii.cloudfront.net/article/718x300/ff86d0df8dd988d0762db93aedb37bf5.jpg,367
5,"Associated Press, By Associated Press","SINGAPORE — Global stock markets were mixed on Monday as investors watched developments in the U.S-China trade war and the upcoming U.S. midterm elections. KEEPING SCORE: Britain's FTSE 100 rose 0.4 percent to 7,125 while the CAC 40 in France gained 0.2 perce… [+2479 chars]","SINGAPORE — Global stock markets were mixed on Monday as investors watched developments in the U.S-China trade war and the upcoming U.S. midterm elections.KEEPING SCORE: Britain&#39;s FTSE 100 rose 0.4 percent to 7,125 while the CAC 40 in France gained 0.2 pe…",2018-11-05T00:00:00Z,"{'id': None, 'name': 'Bostonherald.com'}",Global markets waver on worries over US-China trade dispute,http://www.bostonherald.com/business/business_markets/2018/11/global_markets_waver_on_worries_over_us_china_trade_dispute,http://www.bostonherald.com/sites/default/files/styles/full/public/media/ap/2018/11/05/ececea4f582a4e578cef5c24b5439eb5.jpg?itok=FjB-vYv3,215
6,Bloomberg,"Monday, November 05, 2018 (Bloomberg) -- Oil extended its decline to a sixth day as the U.S. defended the temporary waivers given to eight nations to keep buying Iranian crude after American sanctions against the OPEC producer snapped back on Monday. Crude in… [+2836 chars]",Oil extended its decline to a sixth day.,2018-11-05T00:00:00Z,"{'id': None, 'name': 'Rigzone.com'}",Crude Extends Decline,https://www.rigzone.com/news/wire/crude_extends_decline-05-nov-2018-157386-article/,https://images.rigzone.com/images/news/articles/157386_582x327.png,91
7,Andreas Exarheas,"Rigzone Staff Monday, November 05, 2018 UK union Unite has confirmed that the “vast majority” of its 2,500 members covered by the Offshore Contractors Association (OCA) agreement have voted for industrial action. The industrial action ballots follow the rejec… [+2406 chars]","The 'vast majority' of UK union Unite's 2,500 members covered by the Offshore Contractors Association agreement have voted for industrial action.",2018-11-05T00:00:00Z,"{'id': None, 'name': 'Rigzone.com'}",Thousands of UKCS Workers Edge Closer to Strike,https://www.rigzone.com/news/thousands_of_ukcs_workers_edge_closer_to_strike-05-nov-2018-157387-article/,https://images.rigzone.com/images/news/articles/157387_582x327.png,249
8,Matthew V. Veazey,"Rigzone Staff Monday, November 05, 2018 Crude oil futures posted mixed results Monday. The December West Texas Intermediate (WTI) crude oil price slipped by four cents Monday to settle at $63.10 a barrel. The WTI traded from a high of $64.14 down to $62.52. T… [+2595 chars]",Crude oil futures posted mixed results Monday.,2018-11-05T00:00:00Z,"{'id': None, 'name': 'Rigzone.com'}","Brent Crude, Natural Gas Post Gains",https://www.rigzone.com/news/brent_crude_natural_gas_post_gains-05-nov-2018-157400-article/,https://images.rigzone.com/images/news/articles/157400_582x327.png,102
9,Bloomberg,"Asian stocks looked set for a weak start after a reversal in US equities on Friday, amid concern over whether trade tensions with China can be mended. The pound jumped on news of further progress in Brexit negotiations. Futures pointed to losses in Japanese a… [+1103 chars]","Asian stocks look set for a weak start after a reversal in US equities on Friday, amid concern over whether trade tensions with China can be mended",2018-11-05T00:04:40Z,"{'id': None, 'name': 'Livemint.com'}","Markets today: Asian stocks set for lower open, pound jumps",https://www.livemint.com/Money/iOqgfp6ZZ53afde2gDInUP/Global-markets-today-Asian-stocks-US-stocks-China-trade.html,https://www.livemint.com/rf/Image-621x414/LiveMint/Period2/2018/11/06/Photos/Processed/hang-seng-kX4G--621x414@LiveMint.jpg,299
10,SA Transcripts,"NOW Inc. (NYSE: DNOW ) Q3 2018 Results Earnings Conference Call November 1, 2018 9:00 AM ET Executives Dave Cherechinsky - SVP and Chief Financial Officer Robert Workman - President and Chief Executive Officer Analysts Nathan Jones - Stifel David Manthey - Ba… [+50025 chars]","NOW Inc. (NYSE:DNOW) Q3 2018 Results Earnings Conference Call November 01, 2018 09:00 AM ET Executives Dave Cherechinsky - SVP and Chief Financial Officer Rober",2018-11-05T00:21:06Z,"{'id': None, 'name': 'Seekingalpha.com'}",NOW Inc. (DNOW) CEO Robert Workman on Q3 2018 Results - Earnings Call Transcript,https://seekingalpha.com/article/4218076-now-inc-dnow-ceo-robert-workman-q3-2018-results-earnings-call-transcript,https://static3.seekingalpha.com/assets/og_image_192-59bfd51c9fe6af025b2f9f96c807e46f8e2f06c5ae787b15bf1423e6c676d4db.png,551
11,https://www.dailymail.co.uk/home/search.html?s=&authornamef=Reuters,"By Henning Gloystein SINGAPORE, Nov 5 (Reuters) - Oil prices dipped on Monday as the start to U.S. sanctions against Iran's fuel exports was softened by waivers that will allow some countries to still import Iranian crude, at least temporarily. Front-month Br… [+2264 chars]","By Henning GloysteinSINGAPORE, Nov 5 (Reuters) - Oil prices dipped on Monday as  the start to U.S. sanctions against Iran's fuel exports was  softened by...",2018-11-05T00:33:40Z,"{'id': 'daily-mail', 'name': 'Daily Mail'}",Oil falls as U.S. grants Iran sanction waivers to eight...,https://www.dailymail.co.uk/wires/reuters/article-6352829/Oil-falls-U-S-grants-Iran-sanction-waivers-eight-importers.html,https://i.dailymail.co.uk/i/pix/m_logo_636x382px.png,275
12,ANNABELLE LIANG,SINGAPORE Asian markets tumbled Monday as traders feared that President Donald Trump only reported progress in trade talks with China to score political points as the U.S. midterm elections draw near. KEEPING SCORE: Japan's Nikkei 225 index fell 1.6 percent a… [+2764 chars],Asian markets tumbled Monday as traders feared that President Donald Trump only reported progress in trade talks with China to score political points as the U.S. midterm elections draw near.,2018-11-05T00:35:00Z,"{'id': None, 'name': 'Startribune.com'}",Asian shares slide on worries over US-China relations,http://www.startribune.com/asian-shares-slide-on-worries-over-us-china-relations/499607121/,http://assets.startribune.com/static/img/branding/logos/strib-social-card.png?d=1541187443,524
13,Swati Verma,"Samvat 2074 was a challenging year for equity markets. Rising interest rates and bond yields, spike in crude oil prices amid a sliding rupee, confusion over imposition of long-term capital gains tax (LTCG), rejig in parameters that define mid-and small-cap sc… [+3189 chars]","Experts say volatility is likely to continue in Samvat 2075 as well, owing to a politically heavy calendar (upcoming state elections and general elections scheduled for 2019) and macro challenges.",2018-11-05T00:35:00Z,"{'id': None, 'name': 'Business-standard.com'}",Five key factors that will impact markets in Samvat 2075,https://www.business-standard.com/article/markets/five-key-factors-that-will-impact-markets-in-samvat-2075-118110200880_1.html,https://bsmedia.business-standard.com/_media/bs/img/article/2018-02/02/full/1517564541-944.jpg,351
14,Henning Gloystein,"SINGAPORE (Reuters) - Oil prices dipped on Monday as the start to U.S. sanctions against Iran’s fuel exports was softened by waivers that will allow some countries to still import Iranian crude, at least temporarily. Front-month Brent crude futures LCOc1, the… [+2182 chars]","Oil prices dipped on Monday as the start to U.S. sanctions against Iran's fuel exports was softened by waivers that will allow some countries to still import Iranian crude, at least temporarily.",2018-11-05T00:37:36Z,"{'id': 'reuters', 'name': 'Reuters'}",Oil falls as U.S. grants Iran sanction waivers to eight importers,https://www.reuters.com/article/us-global-oil/oil-falls-as-us-grants-iran-sanction-waivers-to-eight-importers-idUSKCN1NA013,https://s3.reutersmedia.net/resources/r/?m=02&d=20181105&t=2&i=1322048133&w=1200&r=LYNXNPEEA400O,540
15,Henning Gloystein,"SINGAPORE (Reuters) - Oil prices dipped on Monday as the start to U.S. sanctions against Iran’s fuel exports was softened by waivers that will allow some countries to still import Iranian crude, at least temporarily. Front-month Brent crude futures LCOc1, the… [+2182 chars]","Oil prices dipped on Monday as the start to U.S. sanctions against Iran's fuel exports was softened by waivers that will allow some countries to still import Iranian crude, at least temporarily.",2018-11-05T00:37:36Z,"{'id': 'reuters', 'name': 'Reuters'}",Oil falls as U.S. grants Iran sanction waivers to eight importers,https://www.reuters.com/article/us-global-oil/oil-falls-as-u-s-grants-iran-sanction-waivers-to-eight-importers-idUSKCN1NA013,https://s3.reutersmedia.net/resources/r/?m=02&d=20181105&t=2&i=1322048133&w=1200&r=LYNXNPEEA400O,38
16,Henning Gloystein,"SINGAPORE (Reuters) - Oil prices dipped on Monday as the start to U.S. sanctions against Iran’s fuel exports was softened by waivers that will allow some countries to still import Iranian crude, at least temporarily. Front-month Brent crude futures LCOc1, the… [+2182 chars]","Oil prices dipped on Monday as the start to U.S. sanctions against Iran's fuel exports was softened by waivers that will allow some countries to still import Iranian crude, at least temporarily.",2018-11-05T00:37:36Z,"{'id': 'reuters', 'name': 'Reuters'}",Oil falls as U.S. grants Iran sanction waivers to eight importers,https://ca.reuters.com/article/businessNews/idCAKCN1NA013-OCABS,https://s4.reutersmedia.net/resources/r/?m=02&d=20181105&t=2&i=1322048139&w=1200&r=LYNXNPEEA400O-OCABS,541
17,,"November 5, 2018 By Henning Gloystein SINGAPORE (Reuters) – Oil prices dipped on Monday as the start to U.S. sanctions against Iran’s fuel exports was softened by waivers that will allow some countries to still import Iranian crude, at least temporarily. Fron… [+2238 chars]",By Henning Gloystein SINGAPORE - Oil prices dipped on Monday as the start to U.S. sanctions against Iran's fuel exports was softened by waivers that will allow some countries to still import,2018-11-05T00:40:35Z,"{'id': None, 'name': 'Oann.com'}",Oil falls as U.S. grants Iran sanction waivers to eight importers,https://www.oann.com/oil-falls-as-u-s-grants-iran-sanction-waivers-to-eight-importers/,,578
18,Jonathan Garber,"Here is what you need to know. Trump says his administration is ‘looking at’ whether Amazon, Facebook and Google are violating antitrust laws. President Donald Trump told the news site Axios in an interview that aired on HBO Sunday night that the European Uni… [+2409 chars]","Here is what you need to know. Trump says his administration is 'looking at' whether Amazon, Facebook and Google are violating antitrust laws.President Donald Trump told the news site Axios in an interview that aired on HBO Sunday night that the European Unio…",2018-11-05T00:47:00Z,"{'id': None, 'name': 'Businessinsider.com.au'}",10 things you need to know before the opening bell,https://www.businessinsider.com.au/stock-market-news-opening-bell-november-5-2018-2018-11,https://static.businessinsider.com/image/5be02c73d1e8441a3c236bb5-640.jpg,398
19,https://www.facebook.com/bbcnews,"Image copyright Getty Images Image caption Protesters demonstrated outside the former US embassy in Tehran on Sunday The US will unleash its ""toughest ever"" sanctions against Iran on Monday following a wave of protests across the oil-rich country. The Trump a… [+5123 chars]","Iran sees widespread protests as the Trump administration targets banking, oil and shipping.",2018-11-05T00:47:35Z,"{'id': 'bbc-news', 'name': 'BBC News'}","US unleashes ""toughest ever"" sanctions on Iran",https://www.bbc.co.uk/news/business-46092435,https://ichef.bbci.co.uk/news/1024/branded_news/95A3/production/_104170383_gettyimages-1057227202.jpg,80
20,https://www.facebook.com/bbcnews,"Image copyright Getty Images Image caption Protesters demonstrated outside the former US embassy in Tehran on Sunday The US will unleash its ""toughest ever"" sanctions against Iran on Monday following a wave of protests across the oil-rich country. The Trump a… [+5123 chars]","BBC News US unleashes ""toughest ever"" sanctions on Iran BBC News The US will unleash its ""toughest ever"" sanctions against Iran on Monday following a wave of protests across the oil-rich country. The Trump administration is reinstating all sanctions removed u…",2018-11-05T00:49:16Z,"{'id': None, 'name': 'Bbc.com'}","US unleashes ""toughest ever"" sanctions on Iran - BBC News",https://www.bbc.com/news/business-46092435,https://ichef.bbci.co.uk/news/1024/branded_news/95A3/production/_104170383_gettyimages-1057227202.jpg,113
21,Sanket Dhanorkar,"Though a section of the market is in panic mode, investors have the opportunity to make money from a lot of stocks as valuations have corrected significantly, Prashasta Seth, CEO, IIFL Asset Management Company tells ET Wealth. What is your assessment of the c… [+5097 chars]","Prashasta Seth, CEO, IIFL AMC says that investors with 3-year horizon are now getting stocks at less than half their earlier valuation, that is a big opportunity.",2018-11-05T01:00:00Z,"{'id': 'the-times-of-india', 'name': 'The Times of India'}","A section of stock market is overestimating liquidity problem: Prashasta Seth, IIFL AMC",https://economictimes.indiatimes.com/wealth/personal-finance-news/a-section-of-stock-market-is-overestimating-liquidity-problem-prashasta-seth-iifl-amc/articleshow/66486318.cms,"https://img.etimg.com/thumb/msid-66486378,width-1070,height-580,imgsize-367607,overlay-etwealth/photo.jpg",440
22,"Ben Mathis-Lilley, Ben Mathis-Lilley","In June, the Supreme Court ruled that public-sector employees who are represented by unions in collective bargaining cant be obligated to pay dues to those unions. Legal observers say that decision, in Janus v. AFSCME, could presage a similar ruling regarding… [+22922 chars]","In June, the Supreme Court ruled that public-sector employees who are represented by unions in collective bargaining can’t be obligated to pay dues to those unions. Legal observers say that decision, in Janus v. AFSCME, could presage a similar ruling regardin…",2018-11-05T01:00:08Z,"{'id': None, 'name': 'Slate.com'}","Democrats Are So, So Bad at This",https://slate.com/news-and-politics/2018/11/pelosi-schumer-democratic-messaging-is-extremely-bad.html,https://compote.slate.com/images/45bf6b11-f09a-4e61-add4-33472e649360.gif,437
23,Swati Pandey,SYDNEY (Reuters) - Sterling jumped to a two-week high on Monday on hopes Britain was inching closer to a smooth Brexit while Asian stocks started the week gingerly amid worries about tense Sino-U.S. trade relations. With just five months to go until the Brita… [+3894 chars],Sterling jumped to a two-week high on Monday on hopes Britain was inching closer to a smooth Brexit while Asian stocks started the week gingerly amid worries about tense Sino-U.S. trade relations.,2018-11-05T01:09:01Z,"{'id': 'reuters', 'name': 'Reuters'}",GLOBAL MARKETS-Sterling hits 2-week peak on smooth Brexit hopes; Asian shares wobble,https://www.reuters.com/article/us-global-markets/sterling-hits-two-week-peak-on-smooth-brexit-hopes-asian-shares-wobble-idUSKCN1N90PQ,https://s4.reutersmedia.net/resources/r/?m=02&d=20181104&t=2&i=1322027228&w=1200&r=LYNXNPEEA30M9,381
24,https://www.dailymail.co.uk/home/search.html?s=&authornamef=Reuters,"By Swati Pandey SYDNEY, Nov 5 (Reuters) - Sterling jumped to a two-week high on Monday on hopes Britain was inching closer to a smooth Brexit while Asian stocks started the week gingerly amid worries about tense Sino-U.S. trade relations. With just five month… [+3911 chars]","By Swati PandeySYDNEY, Nov 5 (Reuters) - Sterling jumped to a two-week high  on Monday on hopes Britain was inching closer to a smooth Brexit  while Asian...",2018-11-05T01:13:47Z,"{'id': 'daily-mail', 'name': 'Daily Mail'}",Sterling hits 2-week peak on smooth Brexit hopes; Asian...,https://www.dailymail.co.uk/wires/reuters/article-6352913/Sterling-hits-2-week-peak-smooth-Brexit-hopes-Asian-shares-wobble.html,https://i.dailymail.co.uk/i/pix/m_logo_636x382px.png,444
25,John Ruwitch,"(Repeats with no changes to text) By John Ruwitch and Chen Aizhu SHANGHAI/BEIJING, Nov 2 (Reuters) - China, dubbed ‘the workshop of the world’ for its sprawling supply chains and huge export capacity, is hoping to manufacture something new next week at a huge… [+4145 chars]","China, dubbed 'the workshop of the world' for its sprawling supply chains and huge export capacity, is hoping to manufacture something new next week at a huge trade fair in Shanghai next week: import orders.",2018-11-05T01:14:25Z,"{'id': 'reuters', 'name': 'Reuters'}",RPT-China hopes trade expo will highlight import clout as U.S. dispute rages,https://www.reuters.com/article/china-trade-expo/rpt-china-hopes-trade-expo-will-highlight-import-clout-as-u-s-dispute-rages-idUSL4N1XG15J,https://s4.reutersmedia.net/resources_v2/images/rcom-default.png,337
26,John Ruwitch,"(Adds product codes. No change to text.) By John Ruwitch and Chen Aizhu SHANGHAI/BEIJING, Nov 2 (Reuters) - China, dubbed ‘the workshop of the world’ for its sprawling supply chains and huge export capacity, is hoping to manufacture something new next week at… [+4152 chars]","China, dubbed 'the workshop of the world' for its sprawling supply chains and huge export capacity, is hoping to manufacture something new next week at a huge trade fair in Shanghai next week: import orders.",2018-11-05T01:19:02Z,"{'id': 'reuters', 'name': 'Reuters'}",RPT-China hopes trade expo will highlight import clout as U.S. dispute rages,https://www.reuters.com/article/china-trade-expo/rpt-china-hopes-trade-expo-will-highlight-import-clout-as-u-s-dispute-rages-idUSL4N1XG14U,https://s4.reutersmedia.net/resources_v2/images/rcom-default.png,335
27,Navneet Damani,"Gold has underperformed many assets classes over the last few months or even for last few years, and seems to be losing the safe haven title. Comex gold prices have been in a corrective mode falling from $1365 to making lows of $1160 in a span of six months. … [+3722 chars]","We expect that lack of global cues could keep volatility low for gold, but on domestic bourses, prices could continue to gain on weakness in rupee.",2018-11-05T01:22:00Z,"{'id': None, 'name': 'Business-standard.com'}",Gold is witnessing the start of the next bull run,https://www.business-standard.com/article/markets/gold-is-witnessing-the-start-of-the-next-bull-run-118110500076_1.html,https://bsmedia.business-standard.com/_media/bs/img/article/2017-10/27/full/1509050824-8735.jpg,468
28,FOX,"CAMARILLO, Calif. (AP) - The average U.S. price of regular-grade gasoline has dropped 8 cents a gallon over the past two weeks, to $2.85. Industry analyst Trilby Lundberg of the Lundberg Survey said Sunday that falling crude oil prices are the main reason for… [+228 chars]","The average U.S. price of regular-grade gasoline has dropped 8 cents a gallon over the past two weeks, to $2.85.",2018-11-05T01:22:19Z,"{'id': None, 'name': 'Ktvu.com'}",Average US price of gas drops 8 cents per gallon to $2.85,http://www.ktvu.com/news/average-us-price-of-gas-drops-8-cents-per-gallon-to-285-1,https://media.ktvu.com/media.ktvu.com/photo/2018/05/24/6%20GAS%20PRICES%20_KTVU901e_146.mxf_00.00.15.13_1527170757842.png_5576629_ver1.0_640_360.jpg,585
29,Ross J Burland,Note: All information on this page is subject to change. The use of this website constitutes acceptance of our user agreement. Please read our privacy policy and legal disclaimer. Trading foreign exchange on margin carries a high level of risk and may not be … [+1276 chars],"Analysts at ING Bank explained that the fall in benchmark crude oil prices is welcome. ""At $72/bbl, Brent sits in what I feel is the sweet spot for oil, somewhere between $65 and $75. I like this area as it is sufficiently high that the crude producers who bu…",2018-11-05T01:23:50Z,"{'id': None, 'name': 'Fxstreet.com'}",Brent at $72/bbl a sweet spot for oil - ING,https://www.fxstreet.com/news/brent-at-72-bbl-a-sweet-spot-for-oil-ing-201811050123,https://editorial.azureedge.net/images/Markets/Commodities/Energy/Oil/high-gas-prices-gm183291544-1653829_Large.jpg,115
30,"Ilya Spivak, Sr. Currency Strategist, Ilya Spivak","CRUDE OIL &amp; GOLD TALKING POINTS: Crude oil prices drop to seven-month lows on oversupply worries Gold prices pause to digest gains after Thursday’s explosive rally US midterm elections may help US Dollar, hurt commodity prices Crude oil prices fell for a … [+1968 chars]",Crude oil prices may stall after hitting a seven-month low as all eyes turn to the outcome of US midterm elections. The drop is likely to resume thereafter.,2018-11-05T01:30:00Z,"{'id': None, 'name': 'Dailyfx.com'}",Crude Oil Price Drop May Stall Before US Midterm Elections,https://www.dailyfx.com/forex/fundamental/daily_briefing/daily_pieces/commodities/2018/11/05/Crude-Oil-Price-Drop-May-Stall-Before-US-Midterm-Elections.html,,499
31,,"TGIF! And, why not we had blockbuster week. Investors have got plenty to celebrate just ahead of Diwali. The S&amp;P BSE Sensex and Nifty close higher by over 5% for the week ended November 2. D-Street registered its biggest weekly gain since May 2016. Positi… [+2705 chars]","Analysts advise traders to consider booking profits as the index heads towards 10,700 levels and waits for clearance of the said resistance.",2018-11-05T01:41:09Z,"{'id': None, 'name': 'Moneycontrol.com'}","A morning walk down Dalal Street | Traders may consider booking profits as Nifty heads towards 10,700",https://www.moneycontrol.com/news/business/markets/a-morning-walk-down-dalal-street-traders-may-consider-booking-profits-as-nifty-heads-towards-10700-3128831.html,https://static-news.moneycontrol.com/static-mcnews/2018/07/morning_walk_down_wall_street-770x433.jpg,216
