,author,content,description,publishedAt,source,title,url,urlToImage,relevancy
95,Nidhi Verma,"NEW DELHI (Reuters) - India’s Mangalore Refinery and Petrochemicals Ltd (MRPL) expects India to get a waiver from U.S. sanctions on Iranian oil exports this month, a company official said on Tuesday. The United States plans to impose new sanctions targeting I… [+1787 chars]","India's Mangalore Refinery and Petrochemicals Ltd (MRPL) expects India to get a waiver from U.S. sanctions on Iranian oil exports this month, a company official said on Tuesday.",2018-10-16T06:15:44Z,"{'id': 'reuters', 'name': 'Reuters'}",MRPL expects India to get waiver from U.S. sanctions on Iran this month: official,https://in.reuters.com/article/iran-oil-india/mrpl-expects-india-to-get-waiver-from-u-s-sanctions-on-iran-this-month-official-idINKCN1MQ0L5,https://s3.reutersmedia.net/resources/r/?m=02&d=20181016&t=2&i=1315222176&w=1200&r=LYNXNPEE9F0GK,243
96,https://www.dailymail.co.uk/home/search.html?s=&authornamef=Reuters,"By Nidhi Verma and Promit Mukherjee NEW DELHI, Oct 16 (Reuters) - India's Mangalore Refinery and Petrochemicals Ltd (MRPL) expects India to get a waiver from U.S. sanctions on Iranian oil exports this month, a company official said on Tuesday. The United Stat… [+1896 chars]","By Nidhi Verma and Promit MukherjeeNEW DELHI, Oct 16 (Reuters) - India's Mangalore Refinery and  Petrochemicals Ltd (MRPL) expects India to get a  waiver...",2018-10-16T06:17:59Z,"{'id': 'daily-mail', 'name': 'Daily Mail'}",MRPL expects India to get waiver from U.S. sanctions on...,https://www.dailymail.co.uk/wires/reuters/article-6280645/MRPL-expects-India-waiver-U-S-sanctions-Iran-month--official.html,https://i.dailymail.co.uk/i/pix/m_logo_636x382px.png,252
97,Reuters,"The United States cannot do much more to target Iranian oil exports, Iran's oil minister said on Tuesday, speaking before new U.S. sanctions kick in on November 4. ""America has done most of the things it could do, and there is not much left to do against Iran… [+784 chars]",Trump pulled out of an international nuclear deal with Iran in May and announced sanctions against the OPEC state,2018-10-16T06:18:00Z,"{'id': None, 'name': 'Business-standard.com'}",US can't do much against our oil sales: Iranian minister on sanctions,https://www.business-standard.com/article/international/us-can-t-do-much-against-our-oil-sales-iranian-minister-on-sanctions-118101600248_1.html,https://bsmedia.business-standard.com/_media/bs/img/article/2018-09/22/full/1537603928-5044.jpg,291
98,Reuters Editorial,"LONDON (Reuters) - The United States cannot do much more to target Iranian oil exports, Iran’s oil minister said on Tuesday, speaking before new U.S. sanctions kick in on Nov. 4. “America has done most of the things it could do, and there is not much left to … [+859 chars]","The United States cannot do much more to target Iranian oil exports, Iran's oil minister said on Tuesday, speaking before new U.S. sanctions kick in on Nov. 4.",2018-10-16T06:18:15Z,"{'id': 'reuters', 'name': 'Reuters'}","U.S. cannot do much more against Iran oil sales, says Iranian minister",https://in.reuters.com/article/iran-oil-usa/u-s-cannot-do-much-more-against-iran-oil-sales-says-iranian-minister-idINKCN1MQ0LF,https://s3.reutersmedia.net/resources/r/?m=02&d=20181016&t=2&i=1315222586&w=1200&r=LYNXNPEE9F0GO,202
99,The Associated Press,"A Turkish forensics teams finished a search for evidence in the Saudi Consulate in Istanbul early Tuesday morning over the disappearance and alleged slaying of Saudi writer Jamal Khashoggi, as reports circulated that the kingdom may concede the killing took p… [+5619 chars]","A Turkish forensics teams finished a search for evidence in the Saudi Consulate in Istanbul early Tuesday morning over the disappearance and alleged slaying of Saudi writer Jamal Khashoggi, as reports circulated that the kingdom may concede the killing took p…",2018-10-16T06:25:00Z,"{'id': 'cbc-news', 'name': 'CBC News'}",Top U.S. diplomat heads to Saudi Arabia over missing journalist,https://www.cbc.ca/news/world/jamal-khashoggi-mike-pompeo-saudi-arabia-journalist-1.4864507,https://i.cbc.ca/1.4864511.1539670641!/fileImage/httpImage/image.jpg_gen/derivatives/16x9_620/775242936cm024-turkey-inspe.jpg,57
100,,"India's Mangalore Refinery and Petrochemicals Ltd ( MRPL ) expects India to get a waiver from US sanctions on Iranian oil exports this month, a company official said on Tuesday. The United States plans to impose new sanctions targeting Iran's oil sector on No… [+1665 chars]",The United States plans to impose new sanctions targeting Iran#39;s oil sector on November 4 to try to stop the country#39;s involvement in conflicts in Syria and Iraq and bring Tehran to the negotiating table over its ballistic missile programme.,2018-10-16T06:25:12Z,"{'id': None, 'name': 'Moneycontrol.com'}",MRPL expects India to get waiver from US sanctions on Iran this month: Official,https://www.moneycontrol.com/news/business/mrpl-expects-india-to-get-waiver-from-us-sanctions-on-iran-this-month-official-3050211.html,https://static-news.moneycontrol.com/static-mcnews/2018/09/US-shale-oil-crude-oil-770x433.jpg,226
101,,"The United States cannot do much more to target Iranian oil exports, Iran's oil minister said on Tuesday, speaking before new U.S. sanctions kick in on November 4. ""America has done most of the things it could do, and there is not much left to do against Iran… [+784 chars]","""America has done most of the things it could do, and there is not much left to do against Iran,"" Bijan Zanganeh was quoted as saying by the semi-official ISNA news agency.",2018-10-16T06:27:13Z,"{'id': None, 'name': 'Moneycontrol.com'}","US cannot do much more against Iran oil sales, says Iranian minister",https://www.moneycontrol.com/news/world/us-cannot-do-much-more-against-iran-oil-sales-says-iranian-minister-3050221.html,https://static-news.moneycontrol.com/static-mcnews/2018/06/Trump-Iran-770x433.jpg,54
102,Ralf Rivas,,"MANILA, Philippines – The country's economic managers revised the government's medium-term macroeconomic assumptions for 2018 to 2022 to reflect ""developments at the national and global level."" The Development Budget Coordination Committee (DBCC) announced on…",2018-10-16T06:34:41Z,"{'id': None, 'name': 'Rappler.com'}","Inflation up, GDP down: Economic managers revise PH outlook",https://www.rappler.com/business/214439-economic-managers-revise-inflation-gdp-outlook-philippines-2018-2022,https://assets.rappler.com/5212A715DEED4CF092C05FC25C00117A/img/1880E8AD215F41EAA8A0B597AD832115/commonwealth-public-market-oct-08-2018-007.jpg,419
103,https://www.dailymail.co.uk/home/search.html?s=&authornamef=Press+Association,US secretary of state Mike Pompeo is set to meet King Salman in Saudi Arabia over the disappearance and alleged killing of Saudi writer Jamal Khashoggi. The meeting comes as a Turkish forensics team finished its search for evidence in the Saudi consulate in I… [+4695 chars],The journalist went missing two weeks ago at the Saudi consulate in Istanbul.,2018-10-16T06:35:00Z,"{'id': 'daily-mail', 'name': 'Daily Mail'}",Pompeo to meet Saudi king over Khashoggi disappearance,https://www.dailymail.co.uk/wires/pa/article-6280687/Pompeo-meet-Saudi-king-Khashoggi-disappearance.html,https://i.dailymail.co.uk/1s/2018/10/16/07/wire-5082290-1539671667-70_636x382.jpg,318
104,Mrunal,"Instructions Polity and International Relations (IR) Agriculture Economy: Banking, Finance, Taxation Economy: Global Reports Environment &amp; Disasters Science-Tech &amp; Public health Persons, Books, Awards, Sports Instructions Timelimit: 30 minutes. 2 Mark… [+16146 chars]","Instructions Polity and International Relations (IR) Agriculture Economy: Banking, Finance, Taxation Economy: Global Reports Environment & Disasters Science-Tech & Public health Persons, Books, Awards, Sports Instructions Timelimit: 30 minutes. 2 Marks for co…",2018-10-16T06:40:18Z,"{'id': None, 'name': 'Mrunal.org'}","[T25] UPSC Mock Round#24: Current Affairs Sep-Oct-2018: Global Huger Index, Human Capital Index, Cyclone titli, PM-AASHA & More",http://mrunal.org/2018/10/t25-upsc-mocktest-r24-pm-aasha.html,http://mrunal.org/wp-content/uploads/2018/10/t25-mcq-set24.jpg,298
105,Reuters,"The United States cannot do much more to target Iranian oil exports, Iran's oil minister said on Tuesday, speaking before new U.S. sanctions kick in on Nov. 4. ""America has done most of the things it could do, and there is not much left to do against Iran,"" B… [+780 chars]",U.S. President Donald Trump pulled out of an international nuclear deal with Iran in May and announced sanctions against the OPEC state.,2018-10-16T06:43:19Z,"{'id': 'the-times-of-india', 'name': 'The Times of India'}","US cannot do much more against Iran oil sales, says Iranian minister",https://economictimes.indiatimes.com/news/international/business/us-cannot-do-much-more-against-iran-oil-sales-says-iranian-minister/articleshow/66233775.cms,"https://img.etimg.com/thumb/msid-66233807,width-1070,height-580,imgsize-692286,overlay-economictimes/photo.jpg",237
106,,"LIC Mutual Fund is betting big on the information technology, pharmaceutical, banking, and automobile sectors, and has deployed most of its equity assets in them. The fund house believes that companies belonging to these sectors are likely to report better ea… [+8448 chars]","LIC Mutual Fund manages assets worth Rs 20,426 crore on average and is the 18th largest fund house in the country",2018-10-16T06:45:47Z,"{'id': None, 'name': 'Moneycontrol.com'}","Betting on IT, pharma, banks; cautious on telecom, NBFCs: LIC MF#39;s Sarvana Kumar",https://www.moneycontrol.com/news/business/betting-on-it-pharma-banks-cautious-on-telecom-nbfcs-lic-mfs-sarvana-kumar-3049871.html,https://static-news.moneycontrol.com/static-mcnews/2018/10/LIC2-final-770x433.png,339
107,Reuters Editorial,"NEW DELHI (Reuters) - Indian insurers are not offering coverage policies for storage of Iranian oil, an Indian Oil Corp Ltd official said, owing to impending U.S. sanctions on import of crude from Iran, which are expected to kick in on Nov. 4. “Insurance comp… [+203 chars]","Indian insurers are not offering coverage policies for storage of Iranian oil, an Indian Oil Corp Ltd official said, owing to impending U.S. sanctions on import of crude from Iran, which are expected to kick in on Nov. 4.",2018-10-16T06:49:54Z,"{'id': 'reuters', 'name': 'Reuters'}",Indian insurance companies not covering storage of Iranian oil: IOC official,https://in.reuters.com/article/energy-india-iran/indian-insurance-companies-not-covering-storage-of-iranian-oil-ioc-official-idINKCN1MQ0OI,https://s4.reutersmedia.net/resources/r/?m=02&d=20181016&t=2&i=1315230716&w=1200&r=LYNXNPEE9F0IT,157
108,"Nidhi Verma & Promit Mukherjee, Reuters","New Delhi: India’s oil demand is expected to rise by 5.8 million barrels per day (bpd) by 2040, accounting for about 40% of the overall increase in global demand during the period, OPEC’s secretary general said on during the weekend. “India is projected to se… [+1258 chars]",Global oil demand is expected to increase by 14.5 million barrels per day (bpd) from 2017 to 111.7 million bpd in 2040,2018-10-16T06:52:08Z,"{'id': None, 'name': 'Livemint.com'}",India oil demand to rise 5.8 million barrels per day by 2040: OPEC,https://www.livemint.com/Money/sYcNUBCDUzu4vn1uUeh0JJ/India-oil-demand-to-rise-58-million-barrels-per-day-by-2040.html,https://www.livemint.com/rf/Image-621x414/LiveMint/Period2/2018/10/17/Photos/Processed/oilpic-kJ7C--621x414@LiveMint-4645.jpg,164
109,,"Indian insurers are not offering coverage policies for storage of Iranian oil, an Indian Oil Corp Ltd official said, owing to impending US sanctions on import of crude from Iran, which are expected to kick in on November 4. ""Insurance companies are providing … [+108 chars]","""Insurance companies are providing for asset cover but are not covering the crude kept in storage,"" the official said on condition of anonymity.",2018-10-16T06:57:13Z,"{'id': None, 'name': 'Moneycontrol.com'}",Indian insurance companies not covering storage of Iranian oil: IOC official,https://www.moneycontrol.com/news/business/indian-insurance-companies-not-covering-storage-of-iranian-oil-ioc-official-3050431.html,https://static-news.moneycontrol.com/static-mcnews/2017/08/indian_oil-corporation_IOC-770x433.jpg,32
110,Ben Branch,"Reading time: about 2 minutes. The new Bell MX-9 MIPS Presence Helmet makes use of the revolutionary Multi-Directional Impact Protection System, a technology designed to protect the brain from traumatic injuries caused by rotational energy. What is MIPS and h… [+3950 chars]","The Bell MX-9 MIPS Presence Helmet – $159.95 USD The new Bell MX-9 MIPS Presence Helmet makes use of the revolutionary Multi-Directional Impact Protection System, a technology designed to protect the brain from traumatic injuries caused by rotational energy. …",2018-10-16T07:00:01Z,"{'id': None, 'name': 'Silodrome.com'}",The Bell MX-9 MIPS Presence Helmet – $159.95 USD,https://silodrome.com/bell-mx-9-mips-presence-helmet/,https://silodrome.com/wp-content/uploads/2018/10/Bell-MX-9-MIPS-Presence-Helmet-1.jpg,253
111,BS Web Team,An executive of state-owned Indian Oil Corporation on Tuesday said the company was hoping to raise at least $300 million under the new working capital norms within 20 days from now. IOC had last week said it would invest Rs 54.63 billion in setting up a city … [+1540 chars],"High crude oil prices could cause demand destruction for fuel products in the next few months, says an IOC executive",2018-10-16T07:07:00Z,"{'id': None, 'name': 'Business-standard.com'}",Indian Oil hopes to raise funds under new working capital norms in 20 days,https://www.business-standard.com/article/companies/indian-oil-hopes-to-raise-funds-under-new-working-capital-norms-in-20-days-118101600306_1.html,https://bsmedia.business-standard.com/_media/bs/img/article/2018-07/27/full/1532678497-0293.jpg,181
112,,"US sanctions on import of crude from Iran are expected to kick in on November 4. NEW DELHI: Insurers are not offering coverage policies for storage of Iranian oil, an Indian Oil Corp Ltd official said, owing to impending US sanctions on import of crude from I… [+384 chars]","""Insurance companies are providing for asset cover but are not covering the crude kept in storage,"" the official said on condition of anonymity.",2018-10-16T07:10:00Z,"{'id': None, 'name': 'Ndtv.com'}","No Insurance For Iran Oil, Says IOC Official, Amid Looming US Sanctions",https://www.ndtv.com/business/insurance-firms-not-offering-cover-for-storage-of-iranian-oil-amid-us-sanctions-indian-oil-official-1932798,https://i.ndtvimg.com/i/2016-01/iran-oil_650x400_41452853819.jpg,138
113,TAMER FAKAHANY,"LONDON The kingdom of Saudi Arabia has enjoyed the ultimate protected status from the United States throughout its short history. Riyadh has had a special relationship with the U.S., from President Franklin D. Roosevelt meeting Saudi Arabia's first King Abdul… [+5981 chars]",The kingdom of Saudi Arabia has enjoyed the ultimate protected status from the United States throughout its short history.,2018-10-16T07:20:00Z,"{'id': None, 'name': 'Startribune.com'}",Washington has stood by Riyadh through multiple crises,http://www.startribune.com/washington-has-stood-by-riyadh-through-multiple-crises/497676901/,http://assets.startribune.com/static/img/branding/logos/strib-social-card.png?d=1539630205,396
114,acerojano,"Oil price increase INQUIRER PHOTO / NIÑO JESUS ORBETA A “congressional action” would be needed to roll back the existing excise tax on fuel products under the Tax Reform Acceleration and Inclusion (Train), Department of Finance (DOF) Assistant Secretary Tony … [+1675 chars]","A ""congressional action"" would be needed to roll back the existing excise tax on fuel products under the Tax Reform Acceleration and Inclusion (Train), Department of Finance (DOF) Assistant Secretary Tony Lambino said Tuesday. The post Fuel excise tax rollbac…",2018-10-16T07:29:45Z,"{'id': None, 'name': 'Inquirer.net'}",Fuel excise tax rollback requires legislation – DOF exec,https://business.inquirer.net/259049/fuel-excise-tax-rollback-requires-legislation-dof-exec,https://business.inquirer.net/wp-content/blogs.dir/5/files/2018/07/20180730NJO-40-620x408.jpg,273
115,Jane Chung,"SEOUL (Reuters) - Oil prices dipped on Tuesday amid expectations of an increase in U.S. crude inventories, but signs of a fall in Iranian oil exports this month kept losses in check. International benchmark Brent crude for December delivery had fallen 6 cents… [+2848 chars]","Oil prices dipped on Tuesday amid expectations of an increase in U.S. crude inventories, but signs of a fall in Iranian oil exports this month kept losses in check.",2018-10-16T07:37:13Z,"{'id': 'reuters', 'name': 'Reuters'}",Oil prices dip amid expectations of higher U.S. inventories,https://in.reuters.com/article/global-oil/oil-prices-dip-amid-expectations-of-higher-u-s-inventories-idINKCN1MQ0D5,https://s2.reutersmedia.net/resources/r/?m=02&d=20181016&t=2&i=1315199731&w=1200&r=LYNXNPEE9F0AD,158
116,ANNABELLE LIANG,"SINGAPORE (AP) Asian markets were mostly higher on Tuesday, though Chinese benchmarks fell after the government reported inflation rose for a fourth straight month. Hopes that President Donald Trump may meet his Chinese counterpart Xi Jinping at the Group of … [+2161 chars]","SINGAPORE (AP) — Asian markets were mostly higher on Tuesday, though Chinese benchmarks fell after the government reported inflation rose for a fourth straight month. Hopes that President Donald Trump may meet his Chinese counterpart Xi Jinping at the Group o…",2018-10-16T07:37:22Z,"{'id': None, 'name': 'Seattletimes.com'}","Asian shares gain, but inflation drags on Chinese benchmarks",https://www.seattletimes.com/business/asian-shares-gain-but-inflation-drags-on-chinese-benchmarks/,https://static.seattletimes.com/wp-content/uploads/2018/10/urn-publicid-ap-org-98e04b58ebbb44eca560ecf0c16882abMalaysia_Financial_Markets_95849-1200x630.jpg,365
117,By ANNABELLE LIANG Associated Press,"SINGAPORE (AP) Asian markets were mostly higher on Tuesday, though Chinese benchmarks fell after the government reported inflation rose for a fourth straight month. Hopes that President Donald Trump may meet his Chinese counterpart Xi Jinping at the Group of … [+2374 chars]","SINGAPORE (AP) — Asian markets were mostly higher on Tuesday, though Chinese benchmarks fell after the government reported inflation rose for a fourth straight month. Hopes that President Donald Trump may meet his Chinese counterpart Xi Jinping at the Group…",2018-10-16T07:37:22Z,"{'id': 'associated-press', 'name': 'Associated Press'}","Asian shares gain, but inflation drags on Chinese benchmarks",https://apnews.com/98e04b58ebbb44eca560ecf0c16882ab,https://bloximages.newyork1.vip.townnews.com/roanoke.com/content/tncms/assets/v3/editorial/6/1d/61d0db3b-b014-5ce7-a487-da7715d6a146/5bc5ad2b846c0.image.jpg?resize=944%2C630,356
118,The Associated Press,"Asian markets were mostly higher on Tuesday, though Chinese benchmarks fell after the government reported inflation rose for a fourth straight month. Hopes that President Donald Trump may meet his Chinese counterpart Xi Jinping at the Group of 20 summit in No… [+2148 chars]","Get breaking national and world news, broadcast video coverage, and exclusive interviews. Find the top news online at ABC news.",2018-10-16T07:39:10Z,"{'id': 'abc-news', 'name': 'ABC News'}","Asian shares gain, but inflation drags on Chinese benchmarks",https://abcnews.go.com/Business/wireStory/asian-shares-gain-inflation-drags-chinese-benchmarks-58524229,https://s.abcnews.com/images/Business/WireAP_78c398ba5464408c98268931ebbaff11_16x9_992.jpg,258
119,By ANNABELLE LIANG Associated Press,"Asian markets were mostly higher on Tuesday, though Chinese benchmarks fell after the government reported inflation rose for a fourth straight month. Hopes that President Donald Trump may meet his Chinese counterpart Xi Jinping at the Group of 20 summit in No… [+2146 chars]","Asian markets were mostly higher on Tuesday, though Chinese benchmarks fell after the government reported inflation rose for a fourth straight month. Hopes that President Donald Trump may meet his … Click to Continue »",2018-10-16T07:39:14Z,"{'id': None, 'name': 'Charlotteobserver.com'}","Asian shares gain, but inflation drags on Chinese benchmarks",https://www.charlotteobserver.com/news/business/national-business/article220086140.html#storylink=rss,https://www.mcclatchy-wires.com/incoming/yrdhyv/picture220086125/alternates/LANDSCAPE_1140/Malaysia_Financial_Markets_95849.jpg,374
120,Associated Press in Riyadh,"The US secretary of state, Mike Pompeo, has arrived in Saudi Arabia for talks with King Salman over the disappearance of the journalist Jamal Khashoggi, as reports emerged that Riyadh was poised to acknowledge that Khashoggi was killed in its consulate in Ist… [+4107 chars]","Mike Pompeo to meet King Salman amid reports Riyadh may admit journalist was killed in Istanbul consulate The US secretary of state, Mike Pompeo, has arrived in Saudi Arabia for talks with King Salman over the disappearance of the journalist Jamal Khashoggi, …",2018-10-16T07:41:19Z,"{'id': 'the-guardian-au', 'name': 'The Guardian (AU)'}",Jamal Khashoggi: US secretary of state arrives in Saudi Arabia for crisis talks,https://www.theguardian.com/world/2018/oct/16/jamal-khashoggi-disappearance-mike-pompeo-saudi-arabia-salman,https://i.guim.co.uk/img/media/fa888691ce4377fb40d43bba3c1deca23626f176/0_199_3500_2100/master/3500.jpg?width=1200&height=630&quality=85&auto=format&fit=crop&crop=faces%2Centropy&bm=normal&ba=bottom%2Cleft&blend64=aHR0cHM6Ly9hc3NldHMuZ3VpbS5jby51ay9pbWFnZXMvb3ZlcmxheXMvZDM1ODZhNWVmNTc4MTc1NmQyMWEzYjYzNWU1MTcxNDEvdGctZGVmYXVsdC5wbmc&s=5cd93ceb32449227e0d689c79b35d128,8
121,https://www.dailymail.co.uk/home/search.html?s=&authornamef=Associated+Press,"SINGAPORE (AP) - Asian markets were mostly higher on Tuesday, though Chinese benchmarks fell after the government reported inflation rose for a fourth straight month. Hopes that President Donald Trump may meet his Chinese counterpart Xi Jinping at the Group o… [+3141 chars]","SINGAPORE (AP) - Asian markets were mostly higher on Tuesday, though Chinese benchmarks fell after the government reported inflation rose for a fourth...",2018-10-16T07:42:47Z,"{'id': 'daily-mail', 'name': 'Daily Mail'}","Asian shares gain, but inflation drags on Chinese...",https://www.dailymail.co.uk/wires/ap/article-6280843/Asian-shares-gain-inflation-drags-Chinese-benchmarks.html,https://i.dailymail.co.uk/1s/2018/10/16/08/wire-5083268-1539675736-272_636x382.jpg,310
122,,"The Indian rupee is trading at day's high level, up 17 paise at 73.66 per dollar on Tuesday. It opened marginally higher at 73.80 per dollar versus previous close 73.83. Yesterday, rupee consolidated in the first half of the sessions but rose in the latter ha… [+726 chars]","USD-INR pair is expected to quote in the range of 73.60 and 74.20, says Motilal Oswal.",2018-10-16T07:45:53Z,"{'id': None, 'name': 'Moneycontrol.com'}","Indian rupee at day#39;s high, gains 17 paise",https://www.moneycontrol.com/news/business/markets/indian-rupee-at-days-high-gains-17-paise-3049311.html,https://static-news.moneycontrol.com/static-mcnews/2018/09/rupee_2018-770x433.jpg,76
123,,"Consumers, including India, have expressed concerns on outlook for oil supply, said Mr Barkindo. NEW DELHI: India's oil demand is expected to rise by 5.8 million barrels per day (bpd) by 2040, accounting for about 40 per cent of the overall increase in global… [+1343 chars]","India's oil demand is expected to rise by 5.8 million barrels per day (bpd) by 2040, accounting for about 40% of the overall increase in global demand during the period, said OPEC's secretary general Mohammed Sanusi Barkindo.",2018-10-16T07:47:53Z,"{'id': None, 'name': 'Ndtv.com'}",India To See Largest Additional Oil Demand At 3.7% Per Year By 2040: OPEC,https://www.ndtv.com/business/india-to-see-largest-additional-oil-demand-by-2040-says-opec-1932823,https://c.ndtvimg.com/2018-10/ins9crq8_crude-oil-imports_625x300_16_October_18.jpg,201
124,"Karan Mehrishi, Contributor, Karan Mehrishi, Contributor https://www.forbes.com/sites/karanmehrishi/","Both the Indians and Russians had high hopes from the recent visit of President Vladimir Putin to Delhi. Surprisingly, it wasnt about the much hyped S400 Air Defense System deal signed between the countries for a whopping $5.1 billion. The chutzpah was regard… [+11799 chars]","Together, China and India can be Russia’s formidable customers - getting stable oil supplies in return. The super pipeline can therefore be the lifeline of nearly 50% of Asia’s economic activity and help shore up relations among the three regional giants sign…",2018-10-16T07:52:00Z,"{'id': None, 'name': 'Forbes.com'}",An Oil Pipeline That Can Potentially Stabilize Three Asian Powers,https://www.forbes.com/sites/karanmehrishi/2018/10/16/an-oil-pipeline-that-can-potentially-stabilize-three-asian-powers/,https://thumbor.forbes.com/thumbor/600x315/https%3A%2F%2Fi.forbesimg.com%2Fmedia%2Fassets%2Fforbes_1200x1200.jpg,30
