,author,content,description,publishedAt,source,title,url,urlToImage,relevancy
309,Lesley Wroughton,"WASHINGTON/DUBAI (Reuters) - Iran said it would defy U.S. sanctions reimposed on it by Washington on Monday, denouncing as “economic war” the U.S. attempt to curb Tehran’s missile and nuclear programs and weaken its influence in the Middle East. The U.S. move… [+4585 chars]","Iran said it would defy U.S. sanctions reimposed on it by Washington on Monday, denouncing as ""economic war"" the U.S. attempt to curb Tehran's missile and nuclear programs and weaken its influence in the Middle East.",2018-11-05T11:22:38Z,"{'id': 'reuters', 'name': 'Reuters'}",Iran says it will resist 'economic war' as U.S. revives curbs,https://www.reuters.com/article/us-usa-iran-sanctions/iran-says-it-will-resist-economic-war-as-u-s-revives-curbs-idUSKCN1NA0ZR,https://s3.reutersmedia.net/resources/r/?m=02&d=20181105&t=2&i=1322177156&w=1200&r=LYNXNPEEA40KK,8
310,https://www.dailymail.co.uk/home/search.html?s=&authornamef=Reuters,"By Lesley Wroughton and Parisa Hafezi WASHINGTON/DUBAI, Nov 5 (Reuters) - Iran said it would defy U.S. sanctions reimposed on it by Washington on Monday, denouncing as ""economic war"" the U.S. attempt to curb Tehran's missile and nuclear programs and weaken it… [+4695 chars]","By Lesley Wroughton and Parisa HafeziWASHINGTON/DUBAI, Nov 5 (Reuters) - Iran said it would defy  U.S. sanctions reimposed on it by Washington on Monday, ...",2018-11-05T11:23:39Z,"{'id': 'daily-mail', 'name': 'Daily Mail'}","Iran says it will resist ""economic war"" as US revives...",https://www.dailymail.co.uk/wires/reuters/article-6354219/Iran-says-resist-economic-war-US-revives-curbs.html,https://i.dailymail.co.uk/i/pix/m_logo_636x382px.png,346
311,Trapping Value,"Canadian oils are now trading as if they all will be out of business in the next 12 months. CVE data by YCharts The market is focusing on the extremely low pricing for Canadian oil grades. Source: Oil Sands Magazine In the current article, we will focus on wh… [+6826 chars]",Canadian energy plays have got decimated. The current situation is due to two main causes. Both will be rectified and earnings will be spectacular in 2020.,2018-11-05T11:24:26Z,"{'id': None, 'name': 'Seekingalpha.com'}",Canadian Oil Plays: The Fix Is On The Way In,https://seekingalpha.com/article/4218159-canadian-oil-plays-fix-way,https://static3.seekingalpha.com/uploads/2018/11/4/47392447-15413371302165363.png,68
312,Wendell Roelf,"CAPE TOWN (Reuters) - Nigeria’s state oil firm NNPC could sign crude-for-product deals with Shell and ExxonMobil, similar to one signed with BP last week, a senior NNPC official said on Monday. Nigerian National Petroleum Corporation (NNPC) announced last Wed… [+1749 chars]","Nigeria's state oil firm NNPC could sign crude-for-product deals with Shell and ExxonMobil, similar to one signed with BP last week, a senior NNPC official said on Monday.",2018-11-05T11:28:06Z,"{'id': 'reuters', 'name': 'Reuters'}","Nigeria's NNPC says Shell, ExxonMobil also looking at crude swaps",https://af.reuters.com/article/investingNews/idAFKCN1NA18F-OZABS,https://s4.reutersmedia.net/resources/r/?m=02&d=20181105&t=2&i=1322203069&w=1200&r=LYNXNPEEA40PO-OZABS,508
313,,"Iran s president has warned the Islamic Republic faces a war situation, as he vowed the country will sell its oil and break reimposed US sanctions. The sanctions end all economic benefits Washington granted Tehran for its 2015 nuclear deal with world powers a… [+2939 chars]","Iran’s president has warned the Islamic Republic faces a “war situation”, as he vowed the country will sell its oil and break reimposed US sanctions. The sanctions end all economic benefits Washington granted Tehran for its 2015 nuclear deal with world powers…",2018-11-05T11:38:47Z,"{'id': None, 'name': 'Yahoo.com'}",Iran president Rouhani warns Trump of 'war situation' as he vows to bypass US sanctions,https://www.yahoo.com/news/iran-president-rouhani-warns-trump-113847184.html,https://s.yimg.com/uu/api/res/1.2/PX_C5GIGQ5CEC5kf_VH4Mw--~B/aD01NzY7dz03Njg7c209MTthcHBpZD15dGFjaHlvbg--/http://media.zenfs.com/en-GB/homerun/the_independent_635/a5623a072e91df626faaffbbec25402f,136
314,"Samuel Osborne, Samuel Osborne","Iran s president has warned the Islamic Republic faces a war situation, as he vowed the country will sell its oil and break reimposed US sanctions. The sanctions end all economic benefits Washington granted Tehran for its 2015 nuclear deal with world powers a… [+3818 chars]","Islamic Republic will continue to sell oil, president says",2018-11-05T11:38:47Z,"{'id': 'independent', 'name': 'Independent'}",Iran president Rouhani warns Trump of 'war situation' as he vows to bypass US sanctions,https://www.independent.co.uk/news/world/middle-east/iran-sanctions-us-trump-oil-economy-protests-nuclear-deal-hassan-rouhani-a8617831.html,https://static.independent.co.uk/s3fs-public/thumbnails/image/2018/11/05/08/Hassan-Rouhani.jpg,333
315,Alex Lockie,"President Donald Trump's administration is due to announce the return of pre-nuclear deal sanctions on Iran on Monday, as well as sanctions on 300 additional entities. The new measures look poised to slam the country's economy while managing to keep oil price… [+3478 chars]","President Donald Trump's administration is bringing back pre-nuclear deal sanctions on Iran on Monday. Trump granted waivers to key countries that can now put money in an escrow account to buy Iranian oil, while Iran won't actually see any of the money. Oil p…",2018-11-05T11:44:44Z,"{'id': 'business-insider', 'name': 'Business Insider'}",Trump has his cake and eats it too with sanctions tanking Iran's economy and oil staying low,https://www.businessinsider.com/trumps-sanctions-tanking-irans-economy-but-keep-oil-around-72-2018-11,https://amp.businessinsider.com/images/5b55ca693b49fc2e008b459f-1136-568.png,190
316,Jonathan Garber,"AP/Alexander Zemlianichenko Here is what you need to know. Trump says his administration is 'looking at' whether Amazon, Facebook, and Google are violating antitrust laws. President Donald Trump told the news site Axios in an interview that aired on HBO on Su… [+2291 chars]","Here is what you need to know. Trump says his administration is 'looking at' whether Amazon, Facebook, and Google are violating antitrust laws. President Donald Trump told the news site Axios in an interview that aired on HBO on Sunday night that the European…",2018-11-05T11:47:00Z,"{'id': 'business-insider', 'name': 'Business Insider'}","10 things you need to know before the opening bell (SPY, SPX, QQQ, DIA, AMZN, GOOGL, FB, BRK.B)",https://markets.businessinsider.com/news/stocks/stock-market-news-opening-bell-november-5-2018-2018-11-1027690296,https://static2.businessinsider.com/image/5be02c73d1e8441a3c236bb5-2400/ap18309361934400.jpg,234
317,Jonathan Garber,"Russian soldiers dressed in Red Army World War II winter uniforms stand prior to the start of a rehearsal in Red Square, with St. Basil Cathedral in the background, in Moscow, Russia AP/Alexander Zemlianichenko Here is what you need to know. Trump says his ad… [+2454 chars]","Here is what you need to know. Trump says his administration is 'looking at' whether Amazon, Facebook and Google are violating antitrust laws. President Donald Trump told the news site Axios in an interview that aired on HBO Sunday night that the European Uni…",2018-11-05T11:47:00Z,"{'id': 'business-insider', 'name': 'Business Insider'}","10 things you need to know before the opening bell (SPY, SPX, QQQ, DIA, AMZN, GOOGL, FB, BRK.B)",https://www.businessinsider.com/stock-market-news-opening-bell-november-5-2018-2018-11,https://amp.businessinsider.com/images/5be02c838c35ab101a53e6d3-2732-1366.jpg,265
318,PTI,"The U.S. on Monday imposed the toughest ever sanctions on a defiant Iran aimed at altering the Iranian regimes behaviour, even as the Trump administration dodged a question whether it has got firm commitments from India and China to stop all oil purchases fro… [+5295 chars]","Mike Pompeo dodges question on commitment from India, China",2018-11-05T11:47:39Z,"{'id': 'the-hindu', 'name': 'The Hindu'}",U.S. imposes ‘toughest ever’ sanctions on Iran,https://www.thehindu.com/news/international/us-imposes-toughest-ever-sanctions-on-iran/article25427651.ece,https://www.thehindu.com/news/international/1dtihg/article25427650.ece/ALTERNATES/LANDSCAPE_615/VBK-ROUHANI,89
319,Asa Fitch,"Iranian President Hassan Rouhani vowed that his country would resist tough new U.S. sanctions on Irans oil and banks on Monday, as Tehran braced for a new era of political and economic isolation. Unfair sanctions are against the law, U.N. resolutions and inte… [+4616 chars]","Defiant Rouhani Promises Iran Will 'Break' New U.S. Sanctions... (Second column, 12th story, link ) Related stories: REPORT: Farrakhan Leads 'Death to America' Chant in Tehran... Advertise here",2018-11-05T11:52:37Z,"{'id': 'the-wall-street-journal', 'name': 'The Wall Street Journal'}",Defiant Rouhani Promises Iran Will 'Break' New U.S. Sanctions...,https://www.wsj.com/articles/iranian-president-promises-to-break-new-u-s-sanctions-1541413178,https://images.wsj.net/im-34741/social,37
320,"Asa Fitch, Aresu Eqbali","Iranian President Hassan Rouhani vowed that his country would resist tough new U.S. sanctions on Irans oil and banks on Monday, as Tehran braced for a new era of political and economic isolation. Unfair sanctions are against the law, U.N. resolutions and inte… [+1728 chars]","Iranian President Hassan Rouhani vowed that his country would resist tough new U.S. sanctions on Iran’s oil and banks on Monday, as Tehran braced for a new era of political and economic isolation.",2018-11-05T11:53:58Z,"{'id': 'the-wall-street-journal', 'name': 'The Wall Street Journal'}",The Wall Street Journal: Defiant Iranian president promises to ‘break’ new U.S. sanctions,https://www.wsj.com/articles/iranian-president-promises-to-break-new-u-s-sanctions/,http://s.marketwatch.com/public/resources/MWimages/MW-GX804_Iran_s_ZG_20181105065231.jpg,268
321,Tyler Durden,"Last week's four-day rally, which was driven by hopes of easing in trade tensions between the US and China, fizzled with US equity futures mixed, stocks in Europe struggling for direction and Asian shares declining on Monday as concerns over another poor Caix… [+21906 chars]","Last week's four-day rally, which was driven by hopes of easing in trade tensions between the US and China, fizzled with US equity futures mixed, stocks in Europe struggling for direction and Asian shares declining on Monday as concerns over another poor Caix…",2018-11-05T11:54:05Z,"{'id': None, 'name': 'Zerohedge.com'}","Global Stock Rally Fizzles As Trade Hopes Fade, Rate Worries Return",https://www.zerohedge.com/news/2018-11-05/global-stock-rally-fizzles-trade-hopes-fade-rate-worries-return,https://www.zerohedge.com/sites/default/files/styles/max_650x650/public/2018-11/trader%20looking%20at%20screen.jpg?itok=EiEoZaNu,523
322,Helen Reid,"LONDON (Reuters) - World stocks slipped on Monday, halting a four-day recovery rally as anxiety surrounding global trade conditions and rising U.S. interest rates dampened risk appetite. European shares managed to reverse losses in choppy trade as investors r… [+3918 chars]","World stocks slipped on Monday, halting a four-day recovery rally as anxiety surrounding global trade conditions and rising U.S. interest rates dampened risk appetite.",2018-11-05T11:55:19Z,"{'id': 'reuters', 'name': 'Reuters'}","GLOBAL MARKETS-Investors slam brakes on stocks rally as trade, Fed worries dominate",https://www.reuters.com/article/us-global-markets/investors-slam-brakes-on-stocks-rally-as-trade-fed-worries-dominate-idUSKCN1N90PQ,https://s3.reutersmedia.net/resources/r/?m=02&d=20181105&t=2&i=1322178499&w=1200&r=LYNXNPEEA40L7,399
323,Helen Reid,"LONDON (Reuters) - World stocks slipped on Monday, halting a four-day recovery rally as anxiety surrounding global trade conditions and rising U.S. interest rates dampened risk appetite. European shares managed to reverse losses in choppy trade as investors r… [+3918 chars]","World stocks slipped on Monday, halting a four-day recovery rally as anxiety surrounding global trade conditions and rising U.S. interest rates dampened risk appetite.",2018-11-05T11:57:44Z,"{'id': 'reuters', 'name': 'Reuters'}","Global Markets: Investors slam brakes on stocks rally as trade, Fed worries dominate",https://in.reuters.com/article/us-global-markets/investors-slam-brakes-on-stocks-rally-as-trade-fed-worries-dominate-idINKCN1N90PQ,https://s3.reutersmedia.net/resources/r/?m=02&d=20181105&t=2&i=1322178499&w=1200&r=LYNXNPEEA40L7,462
324,https://www.dailymail.co.uk/home/search.html?s=&authornamef=Reuters,"By Helen Reid LONDON, Nov 5 (Reuters) - World stocks slipped on Monday, halting a four-day recovery rally as anxiety surrounding global trade conditions and rising U.S. interest rates dampened risk appetite. European shares managed to reverse losses in choppy… [+3937 chars]","By Helen ReidLONDON, Nov 5 (Reuters) - World stocks slipped on Monday,  halting a four-day recovery rally as anxiety surrounding global  trade conditions and...",2018-11-05T11:58:39Z,"{'id': 'daily-mail', 'name': 'Daily Mail'}","Investors slam brakes on stocks rally as trade, Fed...",https://www.dailymail.co.uk/wires/reuters/article-6354313/Investors-slam-brakes-stocks-rally-trade-Fed-worries-dominate.html,https://i.dailymail.co.uk/i/pix/m_logo_636x382px.png,457
325,Jane Chung,"SEOUL/TOKYO (Reuters) - The United States reintroduced sanctions against Iranian oil on Monday while giving some of Washington’s closest allies exemptions that allow Tehran’s biggest customers, mostly in Asia, to keep buying crude for now. Washington has rest… [+4107 chars]","The United States reintroduced sanctions against Iranian oil on Monday while giving some of Washington's closest allies exemptions that allow Tehran's biggest customers, mostly in Asia, to keep buying crude for now.",2018-11-05T11:59:14Z,"{'id': 'reuters', 'name': 'Reuters'}","As U.S. starts oil sanctions against Iran, major buyers get waivers",https://www.reuters.com/article/us-southkorea-iran-oil/as-us-starts-oil-sanctions-against-iran-major-buyers-get-waivers-idUSKCN1NA0O8,https://s3.reutersmedia.net/resources/r/?m=02&d=20181105&t=2&i=1322210797&w=1200&r=LYNXNPEEA40O7,542
326,Lesley Wroughton,"WASHINGTON/DUBAI (Reuters) - Iran said it would defy U.S. sanctions reimposed on it by Washington on Monday, denouncing as “economic war” the U.S. attempt to curb Tehran’s missile and nuclear programs and weaken its influence in the Middle East. The U.S. move… [+4585 chars]","Iran said it would defy U.S. sanctions reimposed on it by Washington on Monday, denouncing as ""economic war"" the U.S. attempt to curb Tehran's missile and nuclear programs and weaken its influence in the Middle East.'",2018-11-05T11:59:31Z,"{'id': 'reuters', 'name': 'Reuters'}",Iran says it will resist 'economic war' as U.S. revives curbs,https://www.reuters.com/article/us-usa-iran-sanctions/iran-says-it-will-resist-economic-war-as-us-revives-curbs-idUSKCN1NA0ZR,https://s3.reutersmedia.net/resources/r/?m=02&d=20181105&t=2&i=1322177156&w=1200&r=LYNXNPEEA40KK,561
327,,"LONDON: World stocks slipped on Monday, halting a four-day recovery rally as anxiety surrounding global trade conditions and rising U.S. interest rates dampened risk appetite. European shares managed to reverse losses in choppy trade as investors readied for … [+3888 chars]","The British pound jumped to a two-week high on Monday on hopes Britain was inching closer to a smooth Brexit, while Asian stocks will likely have a nervous start amid worries about shaky Sino-U.S. trade relations.",2018-11-05T12:00:51Z,"{'id': None, 'name': 'Channelnewsasia.com'}","Investors slam brakes on stocks rally as trade, Fed worries dominate",https://www.channelnewsasia.com/news/business/investors-slam-brakes-on-stocks-rally-as-trade--fed-worries-dominate-10897594,http://www.channelnewsasia.com/image/10897592/16x9/991/557/9c6e5ae6c16c675d3e7d691c6d967ffd/nm/file-photo--british-five-pound-banknotes-are-seen-in-this-picture-illustration-1.jpg,287
328,Old_Logan,"Millions of people, including school and university students, in different cities across the country participated in massive rallies, chanting ""Down with the US"" and ""Down with Israel"" slogans to show their strong condemnation of Washington's policies against… [+10779 chars]",Iranian people and students participating in the Sunday anti-US rallies in Tehran and other cities of the country underlined their firm opposition to holding negotiations with Washington after its withdrawal from the 2015 nuclear deal and re-imposition of the…,2018-11-05T12:01:07Z,"{'id': None, 'name': 'Farsnews.com'}","Iranian People, Students Voice Strong Opposition to Renegotiations with US",http://en.farsnews.com/newstext.aspx?nn=13970813000681,,400
329,Andrew Hecht,"In the oil market, crack spreads represent the economics of processing a barrel of crude oil into oil products. The process of refining a barrel of crude oil into products requires passing the energy commodity through a catalytic cracking process which heats … [+9303 chars]","Oil backs off the highs. Cracks tell us a lot about demand. Gasoline cracks fall on seasonal factors. Distillate cracks roar. VLO is a cheap stock, and at almos",2018-11-05T12:09:00Z,"{'id': None, 'name': 'Seekingalpha.com'}",Crack Spreads Say Buy Refiners On A Scale Down Basis During The Current Sale,https://seekingalpha.com/article/4217699-crack-spreads-say-buy-refiners-scale-basis-current-sale,https://static.seekingalpha.com/images/marketing_images/oil_gas/pumping_gasoline.jpeg,388
330,buildalpha,"A different strategy for each day of the week? Sounds crazy, but is it? I have wrote about “Turnaround Tuesday” before: https://www.seeitmarket.com/tu... This simple strategy is actually at new highs since this was published over 10 months ago! But what about… [+2448 chars]","A different strategy for each day of the week? Sounds crazy, but is it?I have wrote about “Turnaround Tuesday” before: https://www.seeitmarket.com/tu...This simple strategy is actually at new highs since this was published over 10 months ago!But what about ot…",2018-11-05T12:10:01Z,"{'id': None, 'name': 'Slashdot.org'}",Buildalpha - A Strategy For Each Day of the Week,https://slashdot.org/submission/8808460/buildalpha---a-strategy-for-each-day-of-the-week,,554
331,Tom Whipple,"Editors: Tom Whipple, Steve Andrews Quotes of the Week US crude oil production reached 11.3 million barrels per day (b/d) in August 2018, up from 10.9 million b/d in July. This is the first time that monthly US production levels surpassed 11 million b/d. US c… [+34966 chars]","The plunge in oil prices, which began in early October, continued last week with New York oil futures closing Friday at $63.14, down about $14 a barrel in the past month.",2018-11-05T12:19:52Z,"{'id': None, 'name': 'Resilience.org'}",Peak Oil Review: 5 November 2018,https://www.resilience.org/stories/2018-11-05/peak-oil-review-5-november-2018/,https://www.resilience.org/wp-content/uploads/2018/03/PONR-feature-image-768.jpg,126
332,newsfeedback@fool.com (Matthew DiLallo),"What happened Shares of Occidental Petroleum Corporation ( NYSE:OXY ) plunged 19.3% in October, according to data provided by S&amp;P Global Market Intelligence, wiping away roughly $20 billion of the oil giant's market value. Weighing on the stock was its de… [+1943 chars]",A double dose of bad news weighed on the oil company last month.,2018-11-05T12:24:00Z,"{'id': None, 'name': 'Fool.com'}",Why Occidental Petroleum Corporation Plummeted Nearly 20% in October,https://www.fool.com/investing/2018/11/05/why-occidental-petroleum-corporation-plummeted-nea.aspx,https://g.foolcdn.com/image/?url=https%3A%2F%2Fg.foolcdn.com%2Feditorial%2Fimages%2F500238%2Fa-long-row-of-pumpjacks-under-the-setting-sun-with-snow-in-the-foreground.jpg&h=630&w=1200&op=resize,26
333,Tyler Durden,"Roughly six months after President Trump declared his intentions to reimpose sanctions on Iran over vague allegations that the Iranians hadn't fulfilled their obligations under the JCPOA (the Joint Comprehensive Plan of Action, otherwise known as the Iran dea… [+3481 chars]","Roughly six months after President Trump declared his intentions to reimpose sanctions on Iran over vague allegations that the Iranians hadn't fulfilled their obligations under the JCPOA (the Joint Comprehensive Plan of Action, otherwise known as the Iran dea…",2018-11-05T12:25:13Z,"{'id': None, 'name': 'Zerohedge.com'}",US Reinstates Sanctions On Iran; Eight Waivers To Be Announced Shortly,https://www.zerohedge.com/news/2018-11-05/us-reinstates-sanctions-iran-grants-8-oil-import-waivers,https://www.zerohedge.com/sites/default/files/styles/max_650x650/public/2018-11/2018.11.05iran.JPG?itok=9jUXdxks,428
334,,"WASHINGTON: The US on Monday imposed ""the toughest ever"" sanctions on a defiant Iran aimed at altering the Iranian regime's ""behaviour"", even as the Trump administration dodged a question whether it has got firm commitments from India and China to stop all oi… [+5618 chars]","India Business News: WASHINGTON: The US on Monday imposed ""the toughest ever"" sanctions on a defiant Iran aimed at altering the Iranian regime's ""behaviour"", even as the T.",2018-11-05T12:26:44Z,"{'id': 'the-times-of-india', 'name': 'The Times of India'}","As Iran sanctions kick in, US dodges question on commitment from India",https://timesofindia.indiatimes.com/business/india-business/us-sanctions-on-iran-come-into-force-pompeo-dodges-question-on-commitment-from-india-china/articleshow/66512581.cms,"https://static.toiimg.com/thumb/msid-66512750,width-1070,height-580,imgsize-178539,resizemode-6,overlay-toi_sw,pt-32,y_pad-40/photo.jpg",21
335,Annabelle Liang - The Associated Press,"By Annabelle Liang The Associated Press SINGAPORE—Global shares were mixed Monday as European shares wavered following widespread losses for Asian benchmarks. KEEPING SCORE: Britain’s FTSE 100 dropped 0.1 per cent to 7,084.73 while the CAC 40 in France edged … [+2593 chars]",Global shares were mixed Monday as European shares wavered following widespread losses for Asian benchmarks.,2018-11-05T12:32:46Z,"{'id': None, 'name': 'Thestar.com'}",Global markets waver on worries over U.S.-China trade dispute,https://www.thestar.com/business/markets/2018/11/05/global-markets-waver-on-worries-over-us-china-trade-dispute.html,https://images.thestar.com/9v_g6M-7oNTnPR5wCiFdpQ25C-g=/1200x799/smart/filters:cb(1541423624895)/https://www.thestar.com/content/dam/thestar/business/markets/2018/11/05/global-markets-waver-on-worries-over-us-china-trade-dispute/oil.jpg,430
336,Christopher Johnson,"LONDON (Reuters) - Oil prices steadied on Monday as U.S. sanctions against Iran’s fuel exports began but were softened by waivers allowing major buyers to import Iranian crude for a while, as Tehran said it would defy Washington and continue to sell. Brent cr… [+2444 chars]","Oil prices steadied on Monday as U.S. sanctions against Iran's fuel exports began but were softened by waivers allowing major buyers to import Iranian crude for a while, as Tehran said it would defy Washington and continue to sell.",2018-11-05T12:41:38Z,"{'id': 'reuters', 'name': 'Reuters'}","Oil steady as U.S. sanctions on Iran begin, Tehran defiant",https://in.reuters.com/article/us-global-oil/oil-steady-as-u-s-sanctions-on-iran-begin-tehran-defiant-idINKCN1NA013,https://s3.reutersmedia.net/resources/r/?m=02&d=20181105&t=2&i=1322048133&w=1200&r=LYNXNPEEA400O,259
337,Christopher Johnson,"LONDON (Reuters) - Oil prices steadied on Monday as U.S. sanctions against Iran’s fuel exports began but were softened by waivers allowing major buyers to import Iranian crude for a while, as Tehran said it would defy Washington and continue to sell. Brent cr… [+2444 chars]","Oil prices steadied on Monday as U.S. sanctions against Iran's fuel exports began but were softened by waivers allowing major buyers to import Iranian crude for a while, as Tehran said it would defy Washington and continue to sell.",2018-11-05T12:42:19Z,"{'id': 'reuters', 'name': 'Reuters'}","Oil steady as U.S. sanctions on Iran begin, Tehran defiant",https://www.reuters.com/article/us-global-oil/oil-steady-as-u-s-sanctions-on-iran-begin-tehran-defiant-idUSKCN1NA013,https://s3.reutersmedia.net/resources/r/?m=02&d=20181105&t=2&i=1322048133&w=1200&r=LYNXNPEEA400O,33
338,Elamin Abdelmahmoud,"I dont know if youve heard, but the midterms are tomorrow Youve almost made it through midterms season hang in there. In the lead-up to the elections, President Trumps pitch in states that he won sought to tie the Democrats to Hillary Clinton. The strategy is… [+5010 chars]","The last day before the midterms, Trump reinstates Iran sanctions, aboard the last ship saving refugees. Your BuzzFeed News newsletter, Nov. 5. View Entire Post ›",2018-11-05T12:42:59Z,"{'id': None, 'name': 'Buzzfeednews.com'}",Morning Update: Can't Believe All Politics Will End Forever Tomorrow,https://www.buzzfeednews.com/article/elaminabdelmahmoud/morning-update-cant-believe-all-politics-will-end-forever,"https://img.buzzfeed.com/buzzfeed-static/static/2018-11/5/7/enhanced/buzzfeed-prod-web-06/original-7571-1541421313-7.jpg?crop=1246:652;4,30",413
