,author,content,description,publishedAt,source,title,url,urlToImage,relevancy
188,"Paul Robinson, Market Analyst, Paul Robinson","CoT Highlights: Large speculators added aggressively to JPY short, support near Crude oil longs remain correctly bullish, 2008 t-line to test Large spec profile updates for other major futures contracts For a timelier look at sentiment in major currencies and… [+3504 chars]","There was a bit of a shuffle in the JPY contract; crude oil longs have been right, but could that soon change with long-term resistance ahead?",2018-10-01T11:30:00Z,"{'id': None, 'name': 'Dailyfx.com'}","Weekly CoT Update for USD/JPY, Crude Oil & Other Major Contracts",https://www.dailyfx.com/forex/technical/article/cot/2018/10/01/Weekly-CoT-Update-for-USDJPY-Crude-Oil-Other-Major-Contracts-PRtech.html,,174
189,Gina Heeb,"Stocks were mostly higher Monday, paring some earlier gains, after the US reached a trade deal with Mexico and Canada. The dollar and Treasury yields jumped. Here’s the scoreboard: Dow: 26,651.21 +192.9 (+0.73%) S&amp;P 500: 2,924.59 (+0.36%) AUD/USD 0.7223 -… [+2323 chars]","Stocks were mostly higher Monday, paring some earlier gains, after the US reached a trade deal with Mexico and Canada. The dollar and Treasury yields jumped. More »",2018-10-01T11:30:00Z,"{'id': None, 'name': 'Businessinsider.com.au'}",6 things Australian traders will be talking about this morning,https://www.businessinsider.com.au/6-things-australian-traders-2018-10,https://static.businessinsider.com/image/5b7d7cd12154a320008b5391-640.jpg,248
190,Mark DeCambre,"Oil futures on Monday extended a persistent uptrend with global crude prices adding to recent gains above a four-year high and U.S. oil around a three-month peak. November West Texas Intermediate crude CLX8, +0.20% the U.S. benchmark, climbed 24 cents, or 0.3… [+2242 chars]",Oil futures on Monday extended a persistent uptrend with global crude prices adding to recent gains above a four-year high and U.S. oil around a three-month peak.,2018-10-01T11:30:49Z,"{'id': None, 'name': 'Marketwatch.com'}","Oil aims to kick off start to week, month higher as Brent, WTI add to climb",https://www.marketwatch.com/story/oil-aims-to-kick-off-start-to-week-month-higher-as-brent-wti-add-to-climb-2018-10-01,http://s.marketwatch.com/public/resources/MWimages/MW-FB251_oil_ir_ZG_20161202175512.jpg,354
191,https://www.dailymail.co.uk/home/search.html?s=&authornamef=Reuters,"By Alex Lawler LONDON, Oct 1 (Reuters) - OPEC delivered only a limited increase in oil production in September, a Reuters survey has found, as a cut in Iranian shipments due to U.S. sanctions offset higher output in Libya, Saudi Arabia and Angola. The 15-memb… [+3737 chars]","By Alex LawlerLONDON, Oct 1 (Reuters) - OPEC delivered only a limited  increase in oil production in September, a Reuters survey has  found, as a cut in...",2018-10-01T11:35:47Z,"{'id': 'daily-mail', 'name': 'Daily Mail'}",OPEC oil output boost in September limited by Iran...,https://www.dailymail.co.uk/wires/reuters/article-6227029/OPEC-oil-output-boost-September-limited-Iran-losses--Reuters-survey.html,https://i.dailymail.co.uk/i/pix/m_logo_636x382px.png,244
192,https://www.dailymail.co.uk/home/search.html?s=&authornamef=Reuters,"By Reuters Published: 07:35 EDT, 1 October 2018 | Updated: 07:35 EDT, 1 October 2018 Oct 1 (Reuters) - The following table shows crude oil output by the Organization of the Petroleum Exporting Countries in millions of barrels per day (bpd) in September and Au… [+3089 chars]",Oct 1 (Reuters) - The following table shows crude oil output by the Organization of the  Petroleum Exporting Countries in millions of barrels per day (bpd)...,2018-10-01T11:35:51Z,"{'id': 'daily-mail', 'name': 'Daily Mail'}","TABLE-OPEC oil output rises by 90,000 bpd in September...",https://www.dailymail.co.uk/wires/reuters/article-6227033/TABLE-OPEC-oil-output-rises-90-000-bpd-September--Reuters-survey.html,https://i.dailymail.co.uk/i/pix/m_logo_636x382px.png,176
193,,By Allan Olingo East Africa is beginning to feel the impact of global politics as Kenya and Tanzania stop importing oil and gas from Iran in the face of United States sanctions against countries that continue to trade with Tehran. US President Donald Trump in… [+6384 chars],[East African] East Africa is beginning to feel the impact of global politics as Kenya and Tanzania stop importing oil and gas from Iran in the face of United States sanctions against countries that continue to trade with Tehran.,2018-10-01T11:36:28Z,"{'id': None, 'name': 'Allafrica.com'}","Kenya and Tanzania Fear Impact of Sanctions, Stop Tehran Oil, Gas Imports",https://allafrica.com/stories/201810010513.html,https://cdn07.allafrica.com/static/images/structure/aa-logo-rgba-no-text-128x128.png,315
194,Alex Lawler,"LONDON (Reuters) - OPEC delivered only a limited increase in oil production in September, a Reuters survey has found, as a cut in Iranian shipments due to U.S. sanctions offset higher output in Libya, Saudi Arabia and Angola. The 15-member Organization of the… [+3627 chars]","OPEC delivered only a limited increase in oil production in September, a Reuters survey has found, as a cut in Iranian shipments due to U.S. sanctions offset higher output in Libya, Saudi Arabia and Angola.",2018-10-01T11:39:27Z,"{'id': 'reuters', 'name': 'Reuters'}",OPEC oil output boost in September limited by Iran losses: Reuters survey,https://in.reuters.com/article/oil-opec-survey/opec-oil-output-boost-in-september-limited-by-iran-losses-reuters-survey-idINKCN1MB2FA,https://s4.reutersmedia.net/resources/r/?m=02&d=20181001&t=2&i=1310076670&w=1200&r=LYNXNPEE901UX,255
195,Alex Lawler,"LONDON (Reuters) - OPEC delivered only a limited increase in oil production in September, a Reuters survey has found, as a cut in Iranian shipments due to U.S. sanctions offset higher output in Libya, Saudi Arabia and Angola. The 15-member Organization of the… [+3633 chars]","OPEC delivered only a limited increase in oil production in September, a Reuters survey has found, as a cut in Iranian shipments due to U.S. sanctions offset higher output in Libya, Saudi Arabia and Angola.",2018-10-01T11:40:53Z,"{'id': 'reuters', 'name': 'Reuters'}",OPEC oil output boost in September limited by Iran losses: Reuters survey,https://www.reuters.com/article/us-oil-opec-survey/opec-oil-output-boost-in-september-limited-by-iran-losses-reuters-survey-idUSKCN1MB2FE,https://s4.reutersmedia.net/resources/r/?m=02&d=20181001&t=2&i=1310076937&w=1200&r=LYNXNPEE901UY,31
196,,"LONDON: OPEC delivered only a limited increase in oil production in September, a Reuters survey has found, as a cut in Iranian shipments due to U.S. sanctions offset higher output in Libya, Saudi Arabia and Angola. The 15-member Organization of the Petroleum … [+3685 chars]","OPEC delivered only a limited increase in oil production in September, a Reuters survey has found, as a cut in Iranian shipments due to U.S. sanctions offset higher output in Libya, Saudi Arabia and Angola.",2018-10-01T11:46:19Z,"{'id': None, 'name': 'Channelnewsasia.com'}",OPEC oil output boost in September limited by Iran losses: Reuters survey,https://www.channelnewsasia.com/news/business/opec-oil-output-boost-in-september-limited-by-iran-losses--reuters-survey-10777584,http://www.channelnewsasia.com/image/10777586/16x9/991/557/752ee6e6c4c20259fe48b86e18354d49/Cc/file-photo--a-gas-flare-on-an-oil-production-platform-in-the-soroush-oilfields-in-iran-11.jpg,103
197,Reuters Editorial,"Oct 1 (Reuters) - Stock futures pointed to a lower opening for Canada’s main stock index on Monday, with investors assessing the reworked deal that the United States and Canada clinched at the last minute to save NAFTA as a trilateral pact with Mexico. The de… [+1565 chars]","Stock futures pointed to a lower opening for Canada's main stock index on Monday, with investors assessing the reworked deal that the United States and Canada clinched at the last minute to save NAFTA as a trilateral pact with Mexico.",2018-10-01T11:46:33Z,"{'id': 'reuters', 'name': 'Reuters'}",CANADA STOCKS-TSX futures down as traders assess new NAFTA deal,https://www.reuters.com/article/canada-stocks/canada-stocks-tsx-futures-down-as-traders-assess-new-nafta-deal-idUSL4N1WH35B,https://s4.reutersmedia.net/resources_v2/images/rcom-default.png,203
198,Howard Lindzon,Elon Musk did the smart thing and settled with the SEC. He got off cheap in my opinion. For $20 million he keeps his job as CEO. The government had a great case (his tweets) and endless resources. I assume all the short sellers leaning on the stock Friday int… [+1468 chars],Elon Musk did the smart thing and settled with the SEC. He got off cheap in my opinion. For $20 million he keeps his job as CEO. The government had a great case (his tweets) and endless resources. I assume all the short sellers leaning on the stock Friday int…,2018-10-01T11:50:05Z,"{'id': None, 'name': 'Howardlindzon.com'}",Just Another Manic Market Monday,http://howardlindzon.com/just-another-manic-market-monday/,http://howardlindzon.com/wp-content/uploads/2018/10/DoMJYYVVAAAt0XF.jpg,152
199,ET Online,"India's core sector growth slipped to 4.2 per cent in August compared to 7.3 per cent in July. The eight core industries - coal, crude oil, natural gas, refinery products, fertilisers, steel, cement and electricity - grew at 5.5 per cent in the April-August p… [+337 chars]","The eight core industries - ​​​coal, crude oil, natural gas, refinery products, fertilisers, steel, cement and electricity - grew at 5.5 per cent in the April-August period vs 3 per cent in the same period last year.",2018-10-01T11:56:23Z,"{'id': 'the-times-of-india', 'name': 'The Times of India'}",Core sector growth slips to 4.2% in August,https://economictimes.indiatimes.com/news/economy/indicators/core-sector-growth-slips-to-4-2-in-august/articleshow/66029319.cms,"https://img.etimg.com/thumb/msid-66029801,width-1070,height-580,imgsize-317941,overlay-economictimes/photo.jpg",190
200,Marketplace,,"(U.S. Edition) The U.S. and Canada have managed to iron out new terms for the North American Free Trade Agreement (NAFTA) right before the U.S. imposed deadline, so now we have to learn about the letters USMCA. What do they mean? Then, we look back at the col…",2018-10-01T11:58:00Z,"{'id': None, 'name': 'Marketplace.org'}","Bob Dudley, CEO of BP, discusses the climate of the oil and energy industry",https://www.marketplace.org/shows/marketplace-morning-report/10012018-us-edition,https://www.marketplace.org/assets/social-fallback-d4e081b9fdf8c7fd0204b8cbf257aa3d53db7b925558f707600f4e30ddd18bf5.png,163
201,Andrew Hecht,"Demographics point to ever-increasing demand for food. Each quarter the world adds 19-20 million people to the global population, and with wealth growing, more people with more money around the world are competing for finite natural resources each day. While … [+27536 chars]","The soft commodities sector posts an 11.51% loss in Q3, making it the worst-performing sector. Decade lows in sugar. The lowest price since 2005 in coffee. A do",2018-10-01T12:00:00Z,"{'id': None, 'name': 'Seekingalpha.com'}",Soft Commodities Third Quarter 2018 Review And The Outlook For Q4 2018,https://seekingalpha.com/article/4209045-soft-commodities-third-quarter-2018-review-outlook-q4-2018,https://static3.seekingalpha.com/images/marketing_images/health_medical/sugar_salt_spoon_diabetes.jpeg,111
202,Vladimir Soldatkin,"* Deputy minister: Shale oil output to rise to 860,000 bpd * Western sanctions restrict shale technology * But Russian firms developing own technology * No immediate plans for Russian oil export curbs By Vladimir Soldatkin VLADIVOSTOK, Russia, Oct 1 (Reuters)… [+2179 chars]","Production of hard-to-recover oil in Russia is expected to rise by 10 percent to 43 million tonnes (860,000 barrels per day) this year, boosted by tax incentives, Russian Deputy Energy Minister Pavel Sorokin said in an interview.'",2018-10-01T12:00:00Z,"{'id': 'reuters', 'name': 'Reuters'}",Russia sees hard-to-recover oil output rising 10 percent in 2018,https://www.reuters.com/article/russia-oil-shale/russia-sees-hard-to-recover-oil-output-rising-10-percent-in-2018-idUSL8N1W63IV,https://s4.reutersmedia.net/resources_v2/images/rcom-default.png,396
203,Nick McDonell,"Nick McDonell | An excerpt adapted from The Bodies in Person: An Account of Civilian Casualties in American Wars | Blue Rider Press | September 2018 | 25 minutes (6,786 words) In the tactical operations center the general and I are watching out for innocent p… [+39166 chars]",I interviewed everyone present in the tactical operations center during a routine airstrike in Helmand Province. Without exception they believe themselves to be doing the right thing.,2018-10-01T12:00:00Z,"{'id': None, 'name': 'Longreads.com'}",The Targeting and Killing of a Helmandi Combatant,https://longreads.com/2018/10/01/the-targeting-and-killing-of-a-helmandi-combatant/,https://longreadsblog.files.wordpress.com/2018/09/war-target.jpg?w=1200,337
204,https://www.dailymail.co.uk/home/search.html?s=&authornamef=Reuters,"By Vladimir Soldatkin VLADIVOSTOK, Russia, Oct 1 (Reuters) - Production of hard-to-recover oil in Russia is expected to rise by 10 percent to 43 million tonnes (860,000 barrels per day) this year, boosted by tax incentives, Russian Deputy Energy Minister Pave… [+2041 chars]","By Vladimir SoldatkinVLADIVOSTOK, Russia, Oct 1 (Reuters) - Production of  hard-to-recover oil in Russia is expected to rise by 10 percent  to 43 million...",2018-10-01T12:01:09Z,"{'id': 'daily-mail', 'name': 'Daily Mail'}",Russia sees hard-to-recover oil output rising 10...,https://www.dailymail.co.uk/wires/reuters/article-6227115/Russia-sees-hard-recover-oil-output-rising-10-percent-2018.html,https://i.dailymail.co.uk/i/pix/m_logo_636x382px.png,237
205,Dean Popplewell,"By Dean Popplewell Monday October 1: Five things the markets are talking about Canada's loonie, the Mexican peso, along with North American stock futures have gained overnight after the US and Canada confirmed a deal to save the 'old' NAFTA, now named USMCA -… [+6908 chars]","By Dean Popplewell Monday October 1: Five things the markets are talking about Canada's loonie, the Mexican peso, along with North American stock futures have g",2018-10-01T12:04:05Z,"{'id': None, 'name': 'Seekingalpha.com'}",New NAFTA Supports Loonie,https://seekingalpha.com/article/4209118-new-nafta-supports-loonie,https://static1.seekingalpha.com/uploads/2018/10/1/saupload_BCO_USD_2018-09-30_2d_m.png,35
206,David Lazarus,"I’m Business columnist David Lazarus, and here’s a rundown of upcoming stories this week and the highlights of last week. Heads up, drivers: SoCal gas prices are climbing toward $4 a gallon, boosted in large part by a rise in worldwide crude oil prices. The a… [+6646 chars]","Welcome to California Inc., the weekly newsletter of the L.A. Times Business section. I’m Business columnist David Lazarus, and here’s a rundown of upcoming stories this week and the highlights of last week. Heads up, drivers: SoCal gas prices are climbing to…",2018-10-01T12:10:00Z,"{'id': None, 'name': 'Latimes.com'}",California Inc.: SoCal gas prices are once again nearing $4 a gallon,http://www.latimes.com/business/la-fi-lazarus-newsletter-california-inc-20181001-story.html,https://www.latimes.com/resizer/_CKVFbBFWRj2QDryaE0Zt02psu4=/1200x0/arc-anglerfish-arc2-prod-tronc.s3.amazonaws.com/public/JYPNJCQICVDV5HVRF3GNZ6F5UQ.jpg,363
207,247lee,"Despite the sharp rise in oil prices, some of the top stocks have continued to trade at less than their net asset value using current NYMEX price. With supply becoming stretched as a result of the sanctions placed on Iran and the continuing issues in Venezuel… [+2883 chars]",These four top oil exploration and production companies are all trading at a discount to the NYMEX net asset value and offer investors some very exciting potential upside.,2018-10-01T12:10:52Z,"{'id': None, 'name': '247wallst.com'}",Baird Says Large-Cap Energy Stocks Are Cheap: 4 to Buy Now,http://247wallst.com/energy-business/2018/10/01/baird-says-large-cap-energy-stocks-are-cheap-4-to-buy-now/,https://s2.wp.com/wp-content/themes/vip/247wallst/images/247-50x50.png,95
208,Press Trust of India,The growth of eight infrastructure sectors slowed down to 4.2 per cent in August against 4.4 per cent in the year-ago month on account of decline in production of crude oil and fertiliser. The output of crude oil and fertiliser dipped by 3.7 per cent and 5.3 … [+523 chars],"Coal, natural gas, and electricity production grew by 2.4 per cent, 1.1 per cent and 5.4 per cent respectively",2018-10-01T12:15:00Z,"{'id': None, 'name': 'Business-standard.com'}","Infra sector growth slows to 4.2% in Aug due to crude, fertiliser decline",https://www.business-standard.com/article/companies/infra-sector-growth-slows-to-4-2-in-aug-due-to-crude-fertiliser-decline-118100100709_1.html,https://bsmedia.business-standard.com/_media/bs/img/article/2018-09/29/full/1538240192-3062.jpg,184
209,David Scutt,"The Australian dollar traded mixed on Monday, failing to benefit from an improvement in investor sentiment and gains across most commodity markets during the session. The US and Canada stuck a last-minute deal on trade, helping to boost European and US stocks… [+3520 chars]","The Australian dollar traded mixed on Monday, failing to benefit from an improvement in investor sentiment and gains across most commodity markets during the session. More »",2018-10-01T12:19:10Z,"{'id': None, 'name': 'Businessinsider.com.au'}",The Australian dollar remains pressured despite an improvement in investor sentiment,https://www.businessinsider.com.au/fx-currency-aud-australia-dollar-usmca-rba-2018-10,https://edge.alluremedia.com.au/uploads/businessinsider/2018/02/pressure-640x360.jpg,261
210,Christopher Alessi,"A daily digest of The Wall Street Journals coverage of energy companies, commodity markets and the forces that shape them. Saudi Arabia has shelved a $200 billion plan with SoftBank Group Corp. to build the worlds largest solar power-generation project, repor… [+1227 chars]",Saudi Arabia has shelved a $200 billion plan with SoftBank Group Corp. to build the world’s largest solar power-generation project.,2018-10-01T12:20:44Z,"{'id': 'the-wall-street-journal', 'name': 'The Wall Street Journal'}",Saudi Arabia Puts on Hold Solar Project with SoftBank—Energy Journal,https://blogs.wsj.com/moneybeat/2018/10/01/energy-journal-saudi-arabia-puts-on-hold-solar-project-with-softbank/,//si.wsj.net/public/resources/images/B3-BS248_libyao_P_20180912154609.jpg,126
211,Jillian Ambrose,"O il prices have jumped to a four-year high as traders scramble to find alternative sources of crude ahead of US sanctions against Iran, which come into effect next month. With just weeks left until the sanctions are imposed, oil buyers are looking for new su… [+443 chars]","Oil prices have jumped to a four-year high as traders scramble to find alternative sources of crude ahead of US sanctions against Iran, which come into effect next month.",2018-10-01T12:25:51Z,"{'id': 'the-telegraph', 'name': 'The Telegraph'}",Oil prices reach four-year high ahead of US sanctions on Iran,https://www.telegraph.co.uk/business/2018/10/01/oil-prices-reach-four-year-high-ahead-us-sanctions-iran/,https://www.telegraph.co.uk/content/dam/business/2016/05/22/97806032_C96MYF_Old_rusty_oil_barrels_on_the_beach_of_Gili_Meno_in_Indonesia-xlarge_trans_NvBQzQNjv4BqplGOf-dgG3z4gg9owgQTXAsIcagKWDTsYii0WZbrxoU.jpg,7
212,Andrew Hecht,"Base metal prices fell by 23.43% in 2015, but in 2016 they appreciated by 26.77%. In 2017, the sector of nonferrous industrial metals was the best-performing commodities sector posting a 21.99% for the year. In Q1 2018, a corrective move from highs took the s… [+22689 chars]",Every member of the nonferrous metals sector moves lower in Q3. Lead suffers the largest loss. Zinc and nickel post double-digit percentage losses. Copper and a,2018-10-01T12:30:00Z,"{'id': None, 'name': 'Seekingalpha.com'}",Base Metals Third Quarter 2018 Review And Outlook For Q4 2018,https://seekingalpha.com/article/4209059-base-metals-third-quarter-2018-review-outlook-q4-2018,https://static3.seekingalpha.com/images/marketing_images/mining_minerals/metals_stee_.jpeg,151
213,Nishant Kumar,"NEW DELHI: A sharp bout of short covering in bank, financial, auto, IT, FMCG and metal stocks in the second half of the session helped domestic equity benchmarks end Monday’s session with decent gains. The market logged gains after three consecutive sessions … [+6386 chars]",Global cues eased after the US and Canada agreed to move ahead with the revamped NAFTA.,2018-10-01T12:30:01Z,"{'id': 'the-times-of-india', 'name': 'The Times of India'}","After Market: Bandhan bleeds; YES Bank, autos rise; airline stocks crack",https://economictimes.indiatimes.com/markets/stocks/news/after-market-bandhan-bleeds-yes-bank-autos-rise-airline-stocks-crack/articleshow/66030332.cms,"https://img.etimg.com/thumb/msid-66030386,width-1070,height-580,imgsize-129216,overlay-etmarkets/photo.jpg",349
214,Press Trust of India,New Delhi: The growth of eight infrastructure sectors slowed down to 4.2 percent in August against 4.4 percent in the year-ago month on account of decline in production of crude oil and fertiliser. Representational image. Reuters. The output of crude oil and … [+555 chars],"The output of crude oil and fertiliser dipped by 3.7 percent and 5.3 percent respectively, according to the data released by the commerce and industry ministry on Monday. The post Infrastructure sector growth slows down to 4.2% in August; decline in crude, fe…",2018-10-01T12:32:45Z,"{'id': None, 'name': 'Firstpost.com'}","Infrastructure sector growth slows down to 4.2% in August; decline in crude, fertiliser production to blame",https://www.firstpost.com/business/infrastructure-sector-growth-slows-down-to-4-2-in-august-decline-in-crude-fertiliser-production-to-blame-5295871.html,https://images.firstpost.com/wp-content/uploads/2018/02/Infra_Reuters_social.jpg,38
215,,"NEW DELHI: Oil prices are surging and Saudi Arabia has the second-highest crude oil reserve in the world, yet it is troubled with debt. Venezuela, which has more crude oil reserve than Saudi is far worse in terms of economy. Saudi on Sunday said it expects it… [+1356 chars]","Saudi on Sunday said it expects its economic spending in 2019 to climb to $295 billion, and the revenue to rise 11 per cent to $260.8 billion, signalling a deficit of more than $30 billion. Worse, the country's public debt is around 20 per cent of its GDP",2018-10-01T12:33:01Z,"{'id': 'the-times-of-india', 'name': 'The Times of India'}",Why Saudi Arabia is in debt despite surge in oil prices,https://timesofindia.indiatimes.com/business/india-business/why-saudi-arabia-is-in-debt-despite-surge-in-oil-prices/articleshow/66028563.cms,"https://static.toiimg.com/thumb/msid-66030429,width-1070,height-580,imgsize-1579361,resizemode-6,overlay-toi_sw,pt-32,y_pad-40/photo.jpg",218
216,Swati Bhat,"MUMBAI (Reuters) - The Reserve Bank of India (RBI) said on Monday it would pump 360 billion Indian rupees ($4.95 billion) into money markets in October, pledging to buy back government bonds as part of a bid to quell fears of a credit crunch cascading through… [+2248 chars]","The Reserve Bank of India (RBI) said on Monday it would pump 360 billion Indian rupees ($4.95 billion) into money markets in October, pledging to buy back government bonds as part of a bid to quell fears of a credit crunch cascading through the economy.",2018-10-01T12:34:45Z,"{'id': 'reuters', 'name': 'Reuters'}",India pumps in liquidity; bonds see profit-taking after initial rally,https://in.reuters.com/article/india-markets-cenbank/india-pumps-in-liquidity-bonds-see-profit-taking-after-initial-rally-idINKCN1MB1C9,https://s2.reutersmedia.net/resources/r/?m=02&d=20181001&t=2&i=1309956552&w=1200&r=LYNXNPEE90163,273
217,Michael Scheidt,"BATON ROUGE, La. (LOCAL 33) (FOX 44) - Drivers in Baton Rouge may have noticed a small increase in what they paid at the pump this past week. According to GasBuddy.com, local gas prices went up ""0.4 cents per gallon in the past week."" The average gas price se… [+1352 chars]",Drivers in Baton Rouge may have noticed a small increase in what they paid at the pump this past week.,2018-10-01T12:48:11Z,"{'id': None, 'name': 'Brproud.com'}",Gas prices rise slightly in the Capital City last week,https://www.brproud.com/news/local-news/gas-prices-rise-slightly-in-the-capital-city-last-week/1489500171,https://media.brproud.com/nxsglobal/brproud/photo/2018/10/01/Gas%20Prices%20Up_1538397328668.jpg_57552954_ver1.0_1280_720.jpg,406
218,https://www.dailymail.co.uk/home/search.html?s=&authornamef=Reuters,"By Amanda Cooper and Dmitry Zhdannikov LONDON, Oct 1 (Reuters) - In the oil market, balance is a difficult game. Calculating whether the 100 million barrel per day world market is likely in the months ahead to have a surplus or deficit of supply, or be balanc… [+4158 chars]","By Amanda Cooper and Dmitry ZhdannikovLONDON, Oct 1 (Reuters) - In the oil market, balance is a  difficult game. Calculating whether the 100 million barrel...",2018-10-01T12:50:48Z,"{'id': 'daily-mail', 'name': 'Daily Mail'}","GRAPHIC-Boom, bust or both? The challenge of predicting...",https://www.dailymail.co.uk/wires/reuters/article-6227253/GRAPHIC-Boom-bust-The-challenge-predicting-2019s-oil-market-balance.html,https://i.dailymail.co.uk/i/pix/m_logo_636x382px.png,220
