,author,content,description,publishedAt,source,title,url,urlToImage,relevancy
184,ETMarkets.com,"Do not see FIIs turning buyers in the Indian market in the next few months unless and until there is a dramatic change, Himanshu Srivastava, Senior Research Analyst, Morningstar Advisers India, tells ET Now. Edited excerpts: From adopting a cautious stance, i… [+3143 chars]",“DIIs looking at corrections as investment opportunity for entering and buying more into equity markets”,2018-10-16T09:51:02Z,"{'id': 'the-times-of-india', 'name': 'The Times of India'}","FII outflow could intensify in coming week: Himanshu Srivastava, Morningstar Advisers India",https://economictimes.indiatimes.com/markets/expert-view/fii-outflow-could-intensify-in-coming-week-himanshu-srivastava-morningstar-advisers-india/articleshow/66239675.cms,"https://img.etimg.com/thumb/msid-66239889,width-1070,height-580,imgsize-226153,overlay-etmarkets/photo.jpg",292
185,https://www.dailymail.co.uk/home/search.html?s=&authornamef=Reuters,"By Nidhi Verma and Promit Mukherjee NEW DELHI, Oct 16 (Reuters) - OPEC Secretary-General Mohammad Barkindo on Tuesday urged oil producing companies to increase capacities and invest more to meet future demand as spare oil capacity shrinks worldwide. Oil price… [+2920 chars]","By Nidhi Verma and Promit MukherjeeNEW DELHI, Oct 16 (Reuters) - OPEC Secretary-General  Mohammad Barkindo on Tuesday urged oil producing companies to ...",2018-10-16T09:53:02Z,"{'id': 'daily-mail', 'name': 'Daily Mail'}",OPEC urges producers to ramp up investment amid...,https://www.dailymail.co.uk/wires/reuters/article-6281287/OPEC-urges-producers-ramp-investment-amid-shrinking-spare-oil-capacity.html,https://i.dailymail.co.uk/i/pix/m_logo_636x382px.png,197
186,Geoffrey Morgan,"CALGARY — Canadian oil companies are scrambling to find places to store or ship their “distressed barrels” amid record-setting US$50-per barrel discounts, which is hitting a large proportion of their production. Calgary-based heavy oil producers have been try… [+5380 chars]",At current differentials oil-by-truck could be an economic choice for some companies,2018-10-16T09:55:53Z,"{'id': 'financial-post', 'name': 'Financial Post'}",Oilpatch scrambles to ship ‘distressed barrels’ as industry loses $100M in revenues daily,https://business.financialpost.com/commodities/oilpatch-scrambles-to-ship-distressed-barrels-as-industry-loses-100m-in-revenues-daily,https://financialpostcom.files.wordpress.com/2018/10/legislature_wrapup.jpg,308
187,Sam Meredith,"Saudi Arabia could soon take action to push oil prices lower, one analyst told CNBC Tuesday, as part of a ""settlement"" plan to alleviate diplomatic tensions with the U.S. div &gt; div.group &gt; p:first-child""&gt; It comes at a time of international outcry af… [+1151 chars]","Saudi Arabia could soon take action to push oil prices lower, one analyst told CNBC Tuesday, as part of a ""settlement"" plan to alleviate diplomatic tensions with the U.S.",2018-10-16T09:57:00Z,"{'id': 'cnbc', 'name': 'CNBC'}",Why the market should expect Saudi Arabia to send oil prices lower over journalist's disappearance,https://www.cnbc.com/2018/10/16/oil-prices-saudi-arabia-could-increase-supply-after-khashoggi-disappearance.html,https://fm.cnbc.com/applications/cnbc.com/resources/img/editorial/2018/10/16/105509262-1539682103626trumpmbs.1910x1000.jpg,307
188,"Martin Essex, MSTA, Analyst and Editor, Martin Essex, MSTA","Crude oil price, news and analysis: US-Saudi tensions have eased after US President Donald Trump said “rogue killers” may have been responsible for the death of Washington Post journalist Jamal Khashoggi. US Secretary of State Mike Pompeo is to meet Saudi Kin… [+2176 chars]",Signs of an easing in tensions between the US and Saudi Arabia over the death of Saudi journalist Jamal Khashoggi have helped weaken crude oil prices.,2018-10-16T10:00:00Z,"{'id': None, 'name': 'Dailyfx.com'}",US Crude Oil Price Dips as US-Saudi Tensions over Khashoggi Ease,https://www.dailyfx.com/forex/market_alert/2018/10/16/US-Crude-Oil-Price-Dips-as-US-Saudi-Tensions-over-Khashoggi-Ease.html,,370
189,REUTERS,NEW DELHI: Opec Secretary-General Mohammad Barkindo on Tuesday urged oil producing companies to increase capacities and invest more to meet future demand as spare oil capacity shrinks worldwide. Oil prices have rallied this year on expectations that U.S. sanc… [+2668 chars],"Brent crude breached four year highs to reach $86.74 a barrel earlier this month, the highest since 2014.",2018-10-16T10:01:52Z,"{'id': 'the-times-of-india', 'name': 'The Times of India'}",Opec urges producers to ramp up investment,https://economictimes.indiatimes.com/markets/commodities/news/opec-urges-producers-to-ramp-up-investment-amid-shrinking-spare-oil-capacity/articleshow/66240351.cms,"https://img.etimg.com/thumb/msid-66240472,width-1070,height-580,imgsize-185979,overlay-etmarkets/photo.jpg",14
190,,"(Bloomberg Opinion) -- The worlds business leaders have suddenly been stricken with a conscience. After the disappearance and suspected murder of journalist Jamal Khashoggi from the Saudi Arabian consulate in Istanbul, executives whod been lined up for the Da… [+5864 chars]","JPMorgan Chase & Co. Chief Executive Officer Jamie Dimon and his peer at Blackstone Group LP Steve Schwarzman, along with BlackRock Inc.’s Larry Fink, Uber Technologies Inc.’s Dara Khosrowshahi and Richard Branson have all sent in cancellations. Credit Suisse…",2018-10-16T10:02:04Z,"{'id': None, 'name': 'Yahoo.com'}",Just Skipping ‘Davos in the Desert’ Won’t Cut It,https://www.yahoo.com/news/just-skipping-apos-davos-desert-100204999.html,https://s.yimg.com/uu/api/res/1.2/gLu3s9xPuYOb8aWLtF9icg--~B/aD01ODI7dz0xMjAwO3NtPTE7YXBwaWQ9eXRhY2h5b24-/http://media.zenfs.com/en-US/homerun/bloomberg_politics_602/136dbafcd02f1a4276168fbe65165c6d,23
191,https://www.facebook.com/DailyMail,"Turkish police investigating the disappearance of journalist Jamal Khashoggi are 'looking into toxic materials' at the Saudi consulate, President Recep Tayyip Erdogan said today. The president said he hoped a 'reasonable opinion' would be reached as soon as p… [+15927 chars]","Jamal Khashoggi has been missing for two weeks, and Turkish investigators are now looking into 'toxic materials' at the Saudi consulate in Istanbul where he was last seen.",2018-10-16T10:02:44Z,"{'id': 'daily-mail', 'name': 'Daily Mail'}",Turkish investigators say they are 'looking into toxic materials' as part of Khashoggi murder probe,https://www.dailymail.co.uk/news/article-6281303/Turkish-investigators-say-looking-toxic-materials-Khashoggi-murder-probe.html,https://i.dailymail.co.uk/1s/2018/10/15/20/5070654-0-image-a-21_1539632270720.jpg,408
192,Press Trust of India,"New Delhi: Ahead of the US sanctions against Iran, India on Tuesday said availability of crude oil to replace lost volumes is not an issue but the ""sentiment"" around losing a big oil supplier is driving prices higher. Refusing to say if India has sought a wai… [+3932 chars]","Ahead of the US sanctions against Iran, India on Tuesday said availability of crude oil to replace lost volumes is not an issue but the ""sentiment"" around losing a big oil supplier is driving prices higher. The post US sanctions against Iran: Govt says no iss…",2018-10-16T10:02:52Z,"{'id': None, 'name': 'Firstpost.com'}","US sanctions against Iran: Govt says no issues with crude oil supplies, sentiment hurting price",https://www.firstpost.com/business/us-sanctions-against-iran-govt-says-no-issues-with-crude-oil-supplies-sentiment-hurting-price-5388191.html,https://images.firstpost.com/wp-content/uploads/2018/04/CRUDE_OIL1_social.jpg,35
193,InsightsIAS,"Insights Daily Current Affairs, 16 October 2018 Paper 2: Topic : Structure, organization and functioning of the Executive and the Judiciary Ministries and Departments of the Government; pressure groups and formal/informal associations and their role in the Po… [+18353 chars]","Insights Daily Current Affairs, 16 October 2018 Paper 2: Topic: Structure, organization and functioning of the Executive and the Judiciary Ministries and Departments of the Government; pressure groups and formal/informal associations and their role in the Pol…",2018-10-16T10:10:45Z,"{'id': None, 'name': 'Insightsonindia.com'}","Insights Daily Current Affairs, 16 October 2018",http://www.insightsonindia.com/2018/10/16/insights-daily-current-affairs-16-october-2018/,http://www.insightsonindia.com/wp-content/uploads/2018/10/Strategic-Petroleum-Reserves-300x200.jpg,71
194,PTI,"Ahead of the US sanctions against Iran, India on Tuesday said availability of crude oil to replace lost volumes is not an issue but the ""sentiment"" around losing a big oil supplier is driving prices higher. Refusing to say if India has sought a waiver of sanc… [+3898 chars]","US President Donald Trump in May withdrew from the 2015 nuclear accord with Iran, reimposing economic sanctions against the Persian Gulf nation.",2018-10-16T10:11:16Z,"{'id': 'the-times-of-india', 'name': 'The Times of India'}","US sanctions against Iran: Government says no issues with oil supplies, sentiment hurting price",https://economictimes.indiatimes.com/industry/energy/oil-gas/us-sanctions-against-iran-government-says-no-issues-with-oil-supplies-sentiment-hurting-price/articleshow/66240507.cms,"https://img.etimg.com/thumb/msid-66240492,width-1070,height-580,imgsize-663849,overlay-economictimes/photo.jpg",231
195,Reuters,"U.S. President Donald Trump cannot bring oil prices down by ""bullying"" other nations, Iran's oil minister said on Tuesday, adding that the market was suffering from short supply. U.S. sanctions on Iranian oil exports are due to kick in on Nov. 4. The U.S. adm… [+916 chars]","U.S. President Donald Trump cannot bring oil prices down by ""bullying"" other nations, Iran's oil minister said on Tuesday, adding that the market was suffering from short supply.",2018-10-16T10:18:00Z,"{'id': 'cnbc', 'name': 'CNBC'}",Iran says Trump cannot bring oil prices down by 'bullying',https://www.cnbc.com/2018/10/16/iran-says-trump-cannot-bring-oil-prices-down-by-bullying.html,https://fm.cnbc.com/applications/cnbc.com/resources/img/editorial/2018/06/26/105296122-1530049606961img_0249r.1910x1000.jpg,270
196,David Scutt,"The Australian dollar rose against the US dollar and Japanese yen on Tuesday but fell against the New Zealand and Canadian dollars as well as the British pound. The AUD/USD briefly traded at.7150, the highest level in two weeks. RBA Assistant Governor Guy Deb… [+3408 chars]","The Australian dollar continued to inch higher against the greenback on Thursday but finished mixed against the crosses, once again paying scant attention to the Jekyll and Hyde-type mood swings seen in stocks around the world.",2018-10-16T10:19:34Z,"{'id': None, 'name': 'Businessinsider.com.au'}",The Australian dollar is finding friends as risk assets rebound,https://www.businessinsider.com.au/fx-currency-aud-australia-dollar-emerging-markets-rba-2018-10,https://edge.alluremedia.com.au/uploads/businessinsider/2016/01/beeer-drinkiing-friends-640x360.jpg,328
197,Nidhi Verma,NEW DELHI (Reuters) - OPEC Secretary-General Mohammad Barkindo on Tuesday urged oil producing companies to increase capacities and invest more to meet future demand as spare oil capacity shrinks worldwide. Oil prices have rallied this year on expectations tha… [+2811 chars],OPEC Secretary-General Mohammad Barkindo on Tuesday urged oil producing companies to increase capacities and invest more to meet future demand as spare oil capacity shrinks worldwide.,2018-10-16T10:23:28Z,"{'id': 'reuters', 'name': 'Reuters'}",OPEC urges producers to ramp up investment amid shrinking spare oil capacity,https://in.reuters.com/article/energy-india-opec/opec-urges-producers-to-ramp-up-investment-amid-shrinking-spare-oil-capacity-idINKCN1MQ0FZ,https://s2.reutersmedia.net/resources/r/?m=02&d=20181016&t=2&i=1315208176&w=1200&r=LYNXNPEE9F0DI,177
198,Express Web Desk,"US President Donald Trump in May withdrew from the 2015 nuclear accord with Iran, reimposing economic sanctions against the Persian Gulf nation. Ahead of the US sanctions against Iranian oil, India on Tuesday blamed sentiments around losing a big supplier beh… [+3837 chars]","India, the world's third-biggest oil consumer, meets more than 80 per cent of its oil needs through imports. Iran is its third-largest supplier after Iraq and Saudi Arabia and meets about 10 per cent of the total needs.",2018-10-16T10:29:07Z,"{'id': None, 'name': 'Indianexpress.com'}","Sentiment around US sanction on Iran hurting prices, enough oil available in other parts of the world: Govt",https://indianexpress.com/article/india/plenty-of-oil-available-in-other-parts-of-the-world-says-govt-ahead-of-us-sanctions-against-iran/,https://images.indianexpress.com/2018/05/pradhan-759.jpg?w=759,15
199,,"The Automobile Association has warned of an eighth consecutive fuel price increase at the end of October, saying petrol could increase by 40 cents per litre, diesel by 70c/l and illuminating paraffin by 65c/l. The association, commenting on the unaudited mid-… [+2722 chars]","Based on unaudited mid-month data from the Central Energy Fund, the AA has warned of an eighth consecutive fuel price increase next month, with petrol possibly increasing by 40 cents per litre.",2018-10-16T10:37:01Z,"{'id': None, 'name': 'Fin24.com'}",Fin24.com | Motorists could see 8th fuel hike as tensions rise in Saudi Arabia,https://www.fin24.com/Economy/South-Africa/motorists-could-see-8th-fuel-hike-as-tensions-rise-in-saudi-arabia-20181016,http://cdn.24.co.za/files/Cms/General/d/7632/d181dc9a160a4d17ac9d96d07b55599f.jpg,266
200,https://www.dailymail.co.uk/home/search.html?s=&authornamef=Reuters,"By Karin Strohecker, Amanda Cooper and Ritvik Carvalho LONDON, Oct 16 (Reuters) - A rise in oil prices to four-year highs is heaping pressure on big emerging-market crude consumers such as Turkey, India, Indonesia and South Africa that are already grappling w… [+3526 chars]","By Karin Strohecker, Amanda Cooper and Ritvik CarvalhoLONDON, Oct 16 (Reuters) - A rise in oil prices to four-year  highs is heaping pressure on big...",2018-10-16T10:38:03Z,"{'id': 'daily-mail', 'name': 'Daily Mail'}",GRAPHIC-Rising oil turns up heat on vulnerable emerging...,https://www.dailymail.co.uk/wires/reuters/article-6281439/GRAPHIC-Rising-oil-turns-heat-vulnerable-emerging-economies.html,https://i.dailymail.co.uk/i/pix/m_logo_636x382px.png,195
201,Value Digger,"Both WTI and the United States Oil Fund ( USO ) associated with it hit 2-year highs a few days ago reaching $76/bbl and $16/share respectively. In contrast, the Canadian energy sector must be experiencing its darkest days. Last Friday, oil prices in Canada bo… [+14351 chars]","Activism in Canada is largely responsible for transportation constraints such as pipeline bottlenecks, hurting the Canadian economy in ways that Canadians could",2018-10-16T10:39:47Z,"{'id': None, 'name': 'Seekingalpha.com'}",WCS And Edmonton Mixed Sweet Discounts To WTI: Darkest Before Dawn,https://seekingalpha.com/article/4211815-wcs-edmonton-mixed-sweet-discounts-wti-darkest-dawn,https://static.seekingalpha.com/uploads/2018/10/15/526931-15396015151792624.png,27
202,Kate Riga,"ISTANBUL (AP) — U.S. Secretary of State Mike Pompeo met on Tuesday with Saudi Arabia’s King Salman over the disappearance and alleged slaying of Saudi writer Jamal Khashoggi, who vanished two weeks ago during a visit to the Saudi Consulate in Istanbul. Pompeo… [+6023 chars]",ISTANBUL (AP) — U.S. Secretary of State Mike Pompeo met on Tuesday with Saudi Arabia&#8217;s King Salman over the disappearance...,2018-10-16T10:43:29Z,"{'id': None, 'name': 'Talkingpointsmemo.com'}",Pompeo Meets Saudi King As Outage Mounts Over Writer’s Disappearance,https://talkingpointsmemo.com/news/pompeo-meets-saudi-king-as-anger-mounts-over-writer-disappearance,https://d15zn84cat5tp0.cloudfront.net/wp-content/uploads/2018/10/AP18289271653070.jpg,137
203,,"ISTANBUL (AP) U.S. Secretary of State Mike Pompeo arrived Tuesday in Saudi Arabia for talks with King Salman over the disappearance and alleged slaying of Saudi writer Jamal Khashoggi, who vanished two weeks ago during a visit to the Saudi Consulate in Istanb… [+5816 chars]","ISTANBUL (AP) — U.S. Secretary of State Mike Pompeo arrived Tuesday in Saudi Arabia for talks with King Salman over the disappearance and alleged slaying of Saudi writer Jamal Khashoggi, who vanished two weeks ago during a visit to the Saudi Consulate in Ista…",2018-10-16T10:44:56Z,"{'id': None, 'name': 'Yahoo.com'}",Mike Pompeo meets Saudi king over Khashoggi's disappearance,https://www.yahoo.com/news/top-us-diplomat-heads-saudi-arabia-over-khashoggi-043903743.html,https://s.yimg.com/uu/api/res/1.2/NxU4LfMba0E_iLbZNRAZ0g--~B/aD0zNjQ4O3c9NTQ3MjtzbT0xO2FwcGlkPXl0YWNoeW9u/http://media.zenfs.com/en_us/News/ap_webfeeds/522317ec913b4c3eb474aa18c3ec36d4.jpg,217
204,Reuters,Opec Secretary-General Mohammad Barkindo on Tuesday urged oil producing companies to increase capacities and invest more to meet future demand as spare oil capacity shrinks worldwide. Oil prices have rallied this year on expectations that US sanctions on Iran… [+2906 chars],Indian officials have flagged worries about the outlook for crude supply though oil producers have downplayed a potential shortfall,2018-10-16T10:45:00Z,"{'id': None, 'name': 'Business-standard.com'}","With $11 trillion needed by 2040, Opec urges producers to hike investments",https://www.business-standard.com/article/markets/with-11-trillion-needed-by-2040-opec-urges-producers-to-hike-investments-118101600606_1.html,https://bsmedia.business-standard.com/_media/bs/img/article/2018-03/14/full/1521050312-7438.jpg,83
205,Karin Strohecker,"LONDON (Reuters) - A rise in oil prices to four-year highs is heaping pressure on big emerging-market crude consumers such as Turkey, India, Indonesia and South Africa that are already grappling with current account deficits, weak currencies and rising inflat… [+3563 chars]","A rise in oil prices to four-year highs is heaping pressure on big emerging-market crude consumers such as Turkey, India, Indonesia and South Africa that are already grappling with current account deficits, weak currencies and rising inflation.",2018-10-16T10:48:50Z,"{'id': 'reuters', 'name': 'Reuters'}",Graphic: Rising oil turns up heat on vulnerable emerging economies,https://in.reuters.com/article/emerging-markets-oil/graphic-rising-oil-turns-up-heat-on-vulnerable-emerging-economies-idINKCN1MQ1EN,https://s2.reutersmedia.net/resources/r/?m=02&d=20181016&t=2&i=1315295329&w=1200&r=LYNXNPEE9F0X4,179
206,Tyler Durden,"European stocks rose thanks to a rebound in Italian assets, following a green session for Asian markets despite China closing red for the third day, as U.S. equity index futures rose 0.4% after a negative session yesterday and ahead of today's earnings deluge… [+21520 chars]","European stocks rose thanks to a rebound in Italian assets, following a green session for Asian markets despite China closing red for the third day, as U.S. equity index futures rose 0.4% after a negative session yesterday and ahead of today's earnings deluge…",2018-10-16T10:53:32Z,"{'id': None, 'name': 'Zerohedge.com'}",Global Markets Rebound As Calm Returns Ahead Of Earnings Deluge,https://www.zerohedge.com/news/2018-10-16/global-markets-rebound-calm-returns-ahead-earnings-deluge,https://www.zerohedge.com/sites/default/files/styles/max_650x650/public/2018-10/JPM%20futs.jpg?itok=xaxBQZPz,398
207,PTI,"Finance Minister Arun Jaitley Tuesday said India needs a strong and decisive leadership at the Centre to continue its high growth path and take swift decisions. Outlining the challenges for India, Jaitley said being a net buyer of oil, a rise in global crude … [+2466 chars]",Finance Minister Arun Jaitley Tuesday said India needs a strong and decisive leadership at the Centre to continue its high growth path and take swift decisions.,2018-10-16T10:59:08Z,"{'id': None, 'name': 'Businesstoday.in'}","A weak leadership at the Centre could not have handled IL&FS crisis, says Arun Jaitley",https://www.businesstoday.in/current/economy-politics/weak-leadership-centre-not-handled-ilfs-crisis-arun-jaitley/story/285374.html,https://smedia2.intoday.in/btmt/images/stories/it-conclave_505_101618044539.jpg,297
208,Saloni Goel,"NEW DELHI: Domestic equity benchmarks extended their winning streak into the third straight session on Wednesday, buoyed by expectations of good second quarter earnings. Firmness in global stocks and easing of crude oil prices below $80 a barrel also boosted … [+3835 chars]",Firmness in global stocks and easing of crude oil prices below $80 a barrel boosted sentiment.,2018-10-16T11:00:11Z,"{'id': 'the-times-of-india', 'name': 'The Times of India'}","Strength in rupee, easing oil prices lift Sensex; Nifty50 just shy of 10,600",https://economictimes.indiatimes.com/markets/stocks/news/strength-in-rupee-easing-oil-prices-lift-sensex-nifty50-just-shy-of-10600/articleshow/66242679.cms,"https://img.etimg.com/thumb/msid-66242720,width-1070,height-580,imgsize-113492,overlay-etmarkets/photo.jpg",193
209,,"US Secretary of State Mike Pompeo met on Tuesday with Saudi Arabia's King Salman over the disappearance and alleged slaying of Saudi writer Jamal Khashoggi, who vanished two weeks ago during a visit to the Saudi Consulate in Istanbul. Pompeo landed in Riyadh … [+6146 chars]",US Secretary of State Mike Pompeo met with Saudi Arabia's King Salman over the disappearance and alleged slaying of Saudi writer Jamal Khashoggi.,2018-10-16T11:02:39Z,"{'id': 'news24', 'name': 'News24'}",News24.com | Mike Pompeo meets Saudi king over Khashoggi's disappearance,https://www.news24.com/World/News/mike-pompeo-meets-saudi-king-over-khashoggis-disappearance-20181016,http://cdn.24.co.za/files/Cms/General/d/6163/290b88987dd94353af16263af698385b.jpg,375
210,,"The Indian rupee is trading higher by 27 paise at 73.56 per dollar on Tuesday. It opened marginally higher versus previous close 73.83. Yesterday, rupee consolidated in the first half of the sessions but rose in the latter half after data showed Indias trade … [+692 chars]","USD-INR pair is expected to quote in the range of 73.60 and 74.20, says Motilal Oswal.",2018-10-16T11:05:53Z,"{'id': None, 'name': 'Moneycontrol.com'}","Indian rupee at day#39;s high, gains 27 paise",https://www.moneycontrol.com/news/business/markets/indian-rupee-at-days-high-gains-27-paise-3049311.html,https://static-news.moneycontrol.com/static-mcnews/2018/09/rupee_2018-770x433.jpg,74
211,Christopher Johnson,"LONDON (Reuters) - Oil prices fell on Tuesday on evidence of higher U.S. oil production and increasing U.S. crude inventories, but reports of a fall in Iranian oil exports helped to limit losses. Brent crude was down 70 cents a barrel at $80.08 by 1100 GMT. U… [+2450 chars]","Oil prices fell on Tuesday on evidence of higher U.S. oil production and increasing U.S. crude inventories, but reports of a fall in Iranian oil exports helped to limit losses.",2018-10-16T11:12:30Z,"{'id': 'reuters', 'name': 'Reuters'}","Oil falls on U.S. shale output, expected stocks data",https://in.reuters.com/article/us-global-oil/oil-falls-on-u-s-shale-output-expected-stocks-data-idINKCN1MQ02V,https://s1.reutersmedia.net/resources/r/?m=02&d=20181016&t=2&i=1315238199&w=1200&r=LYNXNPEE9F0KA,150
212,PTI,"New Delhi: Ahead of the US sanctions against Iran, India on Tuesday said availability of crude oil to replace lost volumes was not an issue but the “sentiment” around losing a big oil supplier was driving prices higher. Refusing to say if India had sought a w… [+1992 chars]","US President Donald Trump in May withdrew from the 2015 nuclear accord with Iran, reimposing economic sanctions against the Persian Gulf nation",2018-10-16T11:12:41Z,"{'id': None, 'name': 'Livemint.com'}","US’ Iran sanction: Govt says no issues with oil supplies, sentiment hurting price",https://www.livemint.com/Politics/GdiU9nXRQ9tMYL5kn8hulL/US-Iran-sanction-Govt-says-no-issues-with-oil-supplies-se.html,https://www.livemint.com/rf/Image-621x414/LiveMint/Period2/2018/10/17/Photos/Processed/brentcrudepic-k0yD--621x414@LiveMint.jpg,119
213,,"Bulls kept the momentum going on Dalal Street for third consecutive session on Tuesday as the Sensex gained nearly 300 points and all sectoral indices ended in the green despite mixed global cues. Stable rupee and crude oil prices, and healthy start to Septem… [+3121 chars]",Federal Bank (up 7.8 percent) and South Indian Bank (up 16 percent) were prominent gainers among banks after strong September quarter earnings.,2018-10-16T11:14:33Z,"{'id': None, 'name': 'Moneycontrol.com'}",An evening walk down Dalal Street | Sensex jumps 297 pts amid stable rupee and oil prices,https://www.moneycontrol.com/news/business/markets/an-evening-walk-down-dalal-street-sensex-jumps-297-pts-amid-stable-rupee-and-oil-prices-3051931.html,https://static-news.moneycontrol.com/static-mcnews/2017/03/sensexup-770x433.jpg,51
