,author,content,description,publishedAt,source,title,url,urlToImage,relevancy
305,CLIFFORD KRAUSS and RICK GLADSTONE,"Memories of oil embargoes by Saudi Arabia and OPEC, and the gasoline lines that they caused a half century ago, are fading. Still, Saudi Arabia is an oil power with persistent influence over prices. It currently produces more than 10 percent of the worlds sup… [+1055 chars]",The Saudis have a powerful tool in their ability to raise oil prices but are loathe to use it. And they could not easily switch to China or Russia for defense.,2018-10-16T15:41:30Z,"{'id': 'the-new-york-times', 'name': 'The New York Times'}",Saudis Issued Dire Warnings Against U.S. Sanctions. But How Much Leverage Do They Have?,https://www.nytimes.com/2018/10/16/world/middleeast/saudi-khashoggi-us.html,https://static01.nyt.com/images/2018/10/17/world/17saudi-leverage1/17saudi-leverage1-facebookJumbo.jpg,1
306,,"Oct. 16 (UPI) -- The average price of a gallon of gasoline in U.S. service stations fell in mid-October by an average of two cents on-week amid declines in demand -- the first such drop in three weeks. Most states have seen price declines ""with the exception … [+2396 chars]","Average gasoline prices fell in mid-October on-week, amid declines in demand, and dropped on average two cents per gallon, in the first such drop in three weeks.",2018-10-16T15:47:21Z,"{'id': None, 'name': 'Upi.com'}",Most states see first gasoline price drop in weeks as demand declines,https://www.upi.com/Energy-News/2018/10/16/Most-states-see-first-gas-price-drop-in-weeks-as-demand-declines/7861539700798/,https://cdnph.upi.com/sv/ph/og/upi/7861539700798/2018/1/c46d85db0c9b3466c846d99fe2559311/v1.5/Most-states-see-first-gas-price-drop-in-weeks-as-demand-declines.jpg,372
307,By GANESHWARAN KANA,"PETALING JAYA: Malaysia’s budget deficit may widen to 3% of gross domestic product (GDP) in 2019, amid an expected slower economic growth of 4.5% next year, cautions AllianceDBS Research. The research house said although the government is on track to achieve … [+3119 chars]",Research house sees slower economic growth of 4.5% next year,2018-10-16T16:00:00Z,"{'id': None, 'name': 'Thestar.com.my'}",Budget deficit may widen,http://www.thestar.com.my/business/business-news/2018/10/17/budget-deficit-may-widen/,https://www.thestar.com.my/~/media/online/2015/05/06/00/13/manokaranmottainrate3.ashx/?w=620&h=413&crop=1&hash=CFC8496B65F601D6D95CD7DE7433D4739EAAE989,353
308,,"The JSE closed firmer on Tuesday as global stocks shifted their attention to earnings releases from giants such as Goldman Sachs and Morgan Stanley. Despite the Chinese mainland benchmark struggling, gains were recorded for the Nikkei and the Hang Seng which … [+2674 chars]",The JSE closed firmer on Tuesday as global stocks shifted their attention to earnings releases from giants such as Goldman Sachs and Morgan Stanley.,2018-10-16T16:00:08Z,"{'id': None, 'name': 'Fin24.com'}",Fin24.com | US corporate earnings provide catalyst for stock gains,https://www.fin24.com/Markets/Equities/us-corporate-earnings-provide-catalyst-for-stock-gains-20181016,http://cdn.24.co.za/files/Cms/General/d/1629/b087a44c0525483d89933d4ce4ee2bf5.jpg,312
309,PALAK SHAH,"Nothing is inauspicious for the BSE when it comes to grabbing the first-mover advantage over arch rival NSE. When Ashish Chauhan, MD and CEO of BSE, chose to launch commodity trading on October 1, Pitru Paksha (a 16-day lunar period avoided by most businessme… [+3084 chars]",NSE eyeing a merger with MCX; BSE focussing on hiring talent,2018-10-16T16:00:16Z,"{'id': None, 'name': 'Thehindubusinessline.com'}",BSE-NSE turf war now moves to commodity space,https://www.thehindubusinessline.com/economy/agri-business/bse-nse-turf-war-now-moves-to-commodity-space/article25241028.ece,https://www.thehindubusinessline.com/economy/agri-business/b8vwwm/article25241025.ece/ALTERNATES/LANDSCAPE_615/BL17-BSEASHISH1,364
310,Reuters Editorial,"(Reuters) - Canada’s main stock index rose on Tuesday, led by shares in the financial sector on expectations of another interest rate hike next week, after a central bank report showed business optimism at near record levels. * At 9:36 a.m. ET (13:36 GMT), th… [+1959 chars]","Canada's main stock index rose on Tuesday, led by shares in the financial sector on expectations of another interest rate hike next week, after a central bank report showed business optimism at near record levels.",2018-10-16T16:02:12Z,"{'id': 'reuters', 'name': 'Reuters'}",Main index gains driven by financial stocks on rate hike hopes,https://ca.reuters.com/article/topNews/idCAKCN1MQ1YT-OCATP,https://s3.reutersmedia.net/resources/r/?m=02&d=20181016&t=2&i=1315383246&w=1200&r=LYNXNPEE9F19C-OCATP,411
311,Devika  Krishna Kumar,NEW YORK (Reuters) - Oil prices were little changed on Tuesday as concerns about tightening global supplies ahead of U.S. sanctions on Iran faced higher U.S. shale production and inventories. The disappearance of a Saudi Arabian journalist Jamal Khashoggi in … [+2885 chars],Oil prices were little changed on Tuesday as concerns about tightening global supplies ahead of U.S. sanctions on Iran faced higher U.S. shale production and inventories.,2018-10-16T16:06:09Z,"{'id': 'reuters', 'name': 'Reuters'}",Oil steady as growth in U.S. supplies faces lower Iran exports,https://in.reuters.com/article/us-global-oil/oil-steady-as-growth-in-u-s-supplies-faces-lower-iran-exports-idINKCN1MQ02V,https://s1.reutersmedia.net/resources/r/?m=02&d=20181016&t=2&i=1315238199&w=1200&r=LYNXNPEE9F0KA,190
312,alexmark,"From Birch Gold Group This week, Your News to Know rounds up the latest news involving precious metals and the overall economy. Stories include: Gold is up on safe-haven demand amid stock sell-off, gold is ripe for a rally, and 5 charts that show why gold bel… [+5403 chars]",,2018-10-16T16:07:12Z,"{'id': None, 'name': 'Investmentwatchblog.com'}",Latest Stock Sell-Off Renews Interest in Gold as Safe-Haven,http://www.investmentwatchblog.com/latest-stock-sell-off-renews-interest-in-gold-as-safe-haven/,,248
313,https://www.facebook.com/DailyMail,President Trump pushed back on reporting Tuesday that suggested his personal business interests are tying his tongue on Saudi Arabia's alleged involvement in journalist Jamal Khasoggi's disappearance from the nation's Istanbul consulate. Trump said in a tweet… [+13357 chars],Trump is pushing back on reporting that suggested his personal business interests are tying his tongue on Saudi Arabia's alleged involvement in Jamal Khasoggi's disappearance.,2018-10-16T16:07:25Z,"{'id': 'daily-mail', 'name': 'Daily Mail'}",Trump says he has no financial interest in Saudi Arabia - but nation is a customer at his hotel,https://www.dailymail.co.uk/news/article-6282453/Trump-says-no-financial-Saudi-Arabia-nation-customer-hotel.html,https://i.dailymail.co.uk/1s/2018/10/16/16/5097226-0-image-a-2_1539705439337.jpg,368
314,The Associated Press,"___ Stocks surge, recovering some recent losses; Dow climbs 547 NEW YORK (AP) U.S. stocks rocketed to their biggest gain in six months Tuesday following strong earnings from major financial and health care companies as well as encouraging reports on the econo… [+5948 chars]","Follow the StarTribune for the news, photos and videos from the Twin Cities and beyond.",2018-10-16T16:15:00Z,"{'id': None, 'name': 'Startribune.com'}",Business Highlights,http://www.startribune.com/business-highlights/497730881/,http://assets.startribune.com/static/img/branding/logos/strib-social-card.png?d=1539630205,406
315,Gina Heeb,"Saudi Arabia has pushed back against the overwhelming evidence that it was behind the disappearance of the Washington Post journalist Jamal Khashoggi, emphasizing its ""vital role in the global economy."" And while the oil-rich country isn't likely to follow th… [+2531 chars]","There is increasing evidence Saudi Arabia was behind the disappearance of Jamal Khashoggi, a US resident who has been a critic of the crown prince. After the US threatened sanctions against Saudi Arabia, the oil-rich country seemed to hint at its ability to h…",2018-10-16T16:20:00Z,"{'id': 'business-insider', 'name': 'Business Insider'}",Saudi Arabia using the 'oil weapon option' could cause prices to soar to $150,https://www.businessinsider.com/oil-saudi-arabia-weapon-option-could-cause-price-to-soar-to-150-2018-10,https://amp.businessinsider.com/images/5bc6048fc1aa1312a41014b3-2732-1366.jpg,92
316,Gina Heeb,"AP Photo/Anis Belghoul Saudi Arabia has pushed back against the overwhelming evidence that it was behind the disappearance of the Washington Post journalist Jamal Khashoggi, emphasizing its ""vital role in the global economy."" And while the oil-rich country is… [+2554 chars]","There is increasing evidence Saudi Arabia was behind the disappearance of Jamal Khashoggi, a US resident who has been a critic of the crown prince. After the US threatened sanctions against Saudi Arabia, the oil-rich country seemed to hint at its ability to h…",2018-10-16T16:20:00Z,"{'id': 'business-insider', 'name': 'Business Insider'}",Saudi Arabia using the 'oil weapon option' could cause prices to soar to $150,https://markets.businessinsider.com/commodities/news/oil-saudi-arabia-weapon-option-could-cause-price-to-soar-to-150-2018-10-1027622334,https://static2.businessinsider.com/image/5bc6006e5eb97e11dd085579-2400/ap18266451505136.jpg,126
317,The Hindu BusinessLine,"Abhishek Law Paint-makers have hiked prices by 2.5-3 per cent since the beginning of this month. This is the second time prices have gone up in the decorative paints category this fiscal, and the third during the calendar year. Earlier hikes of around 2 per c… [+2254 chars]","While prices in the decorative segment go up by 2.5-3%, industrial paints get steeper by 6-7%",2018-10-16T16:20:48Z,"{'id': None, 'name': 'Thehindubusinessline.com'}",No rosy picture: Rising input cost forces paint makers to hike prices,https://www.thehindubusinessline.com/economy/no-rosy-picture-rising-input-cost-forces-paint-makers-to-hike-prices/article25241285.ece,https://www.thehindubusinessline.com/economy/20pw54/article25241284.ece/ALTERNATES/LANDSCAPE_615/bl17paintpots,172
318,Ben Warren,"Growing tensions between the U.S. and Saudi Arabia over the disappearance of a Saudi journalist are prompting speculation over the possibility of oil prices at $100 or even, in a stretch, $400 a barrel. The market reaction, however, remains muted, and many an… [+1091 chars]",Traders prep for US sanctions on Iranian oil exports to take full effect,2018-10-16T16:23:11Z,"{'id': None, 'name': 'Infowars.com'}",No Oil Rally Despite US-Saudi Tensions Over Missing Journalist,https://www.infowars.com/no-oil-rally-despite-us-saudi-tensions-over-missing-journalist/,https://www.infowars.com/wp-content/uploads/2018/10/101618TrumpSaudiSalman.jpg,28
319,,"LONDON: European stock markets rose on Tuesday (Oct 16) as tensions in bond markets eased and the US corporate earnings season got off to a promising start, analysts said. European equity markets benefited from an apparent fading of tensions between Italy and… [+3040 chars]","LONDON: European stock markets rose on Tuesday (Oct 16) as tensions in bond markets eased and the US corporate earnings season got off to a promising start, analysts said. European equity markets benefited from an apparent fading of tensions between Italy and…",2018-10-16T16:24:50Z,"{'id': None, 'name': 'Channelnewsasia.com'}",European stock markets advance as rate tensions ease,https://www.channelnewsasia.com/news/business/european-stock-markets-advance-as-rate-tensions-ease-10833978,http://www.channelnewsasia.com/image/8752784/16x9/991/557/858d9ec3c6bb34701a2335e83213440b/tE/london-stock-exchange-lse---2708178.jpg,117
320,Eren Sengezer,"""India’s September trade deficit, at USD 13.9bn, was a positive surprise; it was the narrowest in six months and was much better than our (and consensus) expectations of USD 17.2bn,"" note Standard Chartered analysts. Key quotes ""The narrowing was broad based … [+1381 chars]","""India’s September trade deficit, at USD 13.9bn, was a positive surprise; it was the narrowest in six months and was much better than our (and consensus) expectations of USD 17.2bn,"" note Standard Chartered analysts. Key quotes ""The narrowing was broad based …",2018-10-16T16:26:52Z,"{'id': None, 'name': 'Fxstreet.com'}",India: Trade deficit narrows at unsustainable pace - Standard Chartered,https://www.fxstreet.com/news/india-trade-deficit-narrows-at-unsustainable-pace-standard-chartered-201810161626,https://editorial.azureedge.net/images/Macroeconomics/Countries/Asia/India/destination-india-6488215_Large.jpg,87
321,Jacob Wolinsky,"Del Principe OBrien Financial Advisors commentary for the month ended September 30 2018. Dear Fellow Investors, Whether you have been our valued client for years or you are new to the Del Principe | OBrien family, allow us to thank you for your interest in ou… [+13006 chars]","Del Principe O’Brien Financial Advisors commentary for the month ended September 30 2018. Dear Fellow Investors, Whether you have been our valued client for years or you are new to the Del Principe | O’Brien family, allow us to thank […] The post Del Principe…",2018-10-16T16:30:42Z,"{'id': None, 'name': 'Valuewalk.com'}",Del Principe O’Brien Financial Advisors September 2018 Commentary,https://www.valuewalk.com/2018/10/del-principe-september-2018-commentary/,https://www.valuewalk.com/wp-content/uploads/2018/10/Del-Principe-OBrien-Financial-Advisors.jpg,367
322,Will Racke,"U.S. sanctions may inadvertently be helping Russia’s economy by boosting the price of its top export commodity and putting downward pressure on its currency, a combination that plays into the Kremlin’s hands. On one hand, impending sanctions on Iran’s energy … [+2825 chars]",Unintended consequences,2018-10-16T16:34:31Z,"{'id': None, 'name': 'Dailycaller.com'}",US Sanctions Are Doing Two Big Things To Boost Russia’s Economy,https://dailycaller.com/2018/10/16/us-sanctions-russian-economy/,https://cdn01.dailycaller.com/wp-content/uploads/2018/10/Putin-e1539706241272.jpg,97
323,Maia Wikler,"The swamps of southern Louisiana, a territory of the Atakapa-Ishak tribe, are the grounds of pipeline resistance as communities are rising to stop the Bayou Bridge pipeline (BBP). The 163-mile pipeline would transport crude oil from the Bakken oil fields of N… [+7276 chars]",One activist on the front lines of the latest pipeline resistance says she was cut from a tree where she was protesting and tased by police.,2018-10-16T16:37:38Z,"{'id': None, 'name': 'Teenvogue.com'}",Bayou Bridge Pipeline Meets Resistance from the L’eau Est La Vie Camp,https://www.teenvogue.com/story/bayou-bridge-pipeline-meets-resistance,"https://assets.teenvogue.com/photos/5bc60f964def322d79fbb175/3:2/w_1200,h_630,c_limit/fb.jpg",180
324,Mike Rivero,"By Benjamin Katzeff Silberstein Has North Korea’s economy been growing under sanctions? That’s what an economist in Pyongyang claims. In a recent interview with Kyodo (published here by Japan Times), Ri Gi Song at Pyongyang’s Institute of Economics at the Aca… [+7723 chars]","Has North Korea’s economy been growing under sanctions? That’s what an economist in Pyongyang claims. In a recent interview with Kyodo (published here by Japan Times), Ri Gi Song at Pyongyang’s Institute of Economics at the Academy of Social Sciences, claimed…",2018-10-16T16:39:47Z,"{'id': None, 'name': 'Nkeconwatch.com'}",North Korea’s economic growth – from Pyongyang’s perspective,http://www.nkeconwatch.com/2018/10/15/north-koreas-economic-growth-from-pyongyangs-perspective/,,220
325,Rodrigo Campos,"* U.S. Treasury yields little changed after last week’s run-up * Sterling up after wages post steep gains (Updates prices, comment) By Rodrigo Campos NEW YORK, Oct 16 (Reuters) - Stocks bounced back on Tuesday across the world, supported by strong earnings ex… [+3271 chars]","Stocks bounced back on Tuesday across the world, supported by strong earnings expectations, while oil prices were wobbly as evidence of higher U.S. production was overshadowed by a tighter global supply outlook as Iran prepares for U.S. sanctions.",2018-10-16T16:53:56Z,"{'id': 'reuters', 'name': 'Reuters'}",GLOBAL MARKETS-Stocks rebound with earnings in focus; oil little changed,https://www.reuters.com/article/global-markets/global-markets-stocks-rebound-with-earnings-in-focus-oil-little-changed-idUSL2N1WW14P,https://s4.reutersmedia.net/resources_v2/images/rcom-default.png,168
326,Rodrigo Campos,"NEW YORK (Reuters) - Stocks bounced back on Tuesday across the world, supported by earnings expectations, while oil prices fell on evidence of higher U.S. oil production and increasing U.S. crude inventories. European shares rallied, pulling up from Monday’s … [+3160 chars]","Stocks bounced back on Tuesday across the world, supported by earnings expectations, while oil prices fell on evidence of higher U.S. oil production and increasing U.S. crude inventories.",2018-10-16T16:55:48Z,"{'id': 'reuters', 'name': 'Reuters'}",World stocks rebound with earnings in focus; oil slips,https://www.reuters.com/article/us-global-markets/world-stocks-rebound-with-earnings-in-focus-oil-slips-idUSKCN1MQ02J,https://s3.reutersmedia.net/resources/r/?m=02&d=20181016&t=2&i=1315263916&w=1200&r=LYNXNPEE9F0R6,0
327,https://www.dailymail.co.uk/home/search.html?s=&authornamef=Reuters,"By Rodrigo Campos NEW YORK, Oct 16 (Reuters) - Stocks bounced back on Tuesday across the world, supported by strong earnings expectations, while oil prices were wobbly as evidence of higher U.S. production was overshadowed by a tighter global supply outlook a… [+3216 chars]","By Rodrigo CamposNEW YORK, Oct 16 (Reuters) - Stocks bounced back on Tuesday  across the world, supported by strong earnings expectations,  while oil prices...",2018-10-16T16:58:05Z,"{'id': 'daily-mail', 'name': 'Daily Mail'}",Stocks rebound with earnings in focus; oil little changed,https://www.dailymail.co.uk/wires/reuters/article-6282939/Stocks-rebound-earnings-focus-oil-little-changed.html,https://i.dailymail.co.uk/i/pix/m_logo_636x382px.png,223
328,Shine Jacob,"The Organization of the Petroleum Exporting Countries (Opec) has said the current market seems fine. This came a day after Prime Minister Narendra Modi raised India's pricing concerns before the cartel's representatives, asking them to review payment terms an… [+1934 chars]","Opec Secretary-General Mohammed Sanusi Barkindo said India's crude oil demand was expected to rise by 5.8 million bpd by 2040, accounting for around 40% of the global demand rise by then",2018-10-16T16:59:00Z,"{'id': None, 'name': 'Business-standard.com'}","After Modi raises India's pricing concerns, Opec says no oil supply worries",https://www.business-standard.com/article/economy-policy/after-modi-raises-india-s-pricing-concerns-opec-says-no-oil-supply-worries-118101601216_1.html,https://bsmedia.business-standard.com/_media/bs/img/article/2017-01/25/full/1485298283-3944.jpg,99
329,Rodrigo Campos,"NEW YORK (Reuters) - Stocks bounced back on Tuesday across the world, supported by strong earnings expectations, while oil prices were wobbly as evidence of higher U.S. production was overshadowed by a tighter global supply outlook as Iran prepares for U.S. s… [+3113 chars]","Stocks bounced back on Tuesday across the world, supported by strong earnings expectations, while oil prices were wobbly as evidence of higher U.S. production was overshadowed by a tighter global supply outlook as Iran prepares for U.S. sanctions.",2018-10-16T17:13:32Z,"{'id': 'reuters', 'name': 'Reuters'}",Global Markets: Stocks rebound with earnings in focus; oil little changed,https://in.reuters.com/article/global-markets/global-markets-stocks-rebound-with-earnings-in-focus-oil-little-changed-idINKCN1MQ0BJ,https://s3.reutersmedia.net/resources/r/?m=02&d=20181016&t=2&i=1315363153&w=1200&r=LYNXNPEE9F1CN,233
330,,"Trump administration officials are mulling allowing coal exports from military bases and other federal properties along the West Coast, an idea that drew swift condemnation from political leaders in the region. ""This reckless, harebrained proposal undermines … [+3487 chars]","""The men and women who serve at our military bases are there to keep our country safe, not to service an export facility for private fossil fuel companies,"" Washington Gov. Jay Inslee wrote in an emailed statement.",2018-10-16T17:15:56Z,"{'id': None, 'name': 'Stripes.com'}",Trump plan to export coal from military ports draws condemnation,https://www.stripes.com/news/us/trump-plan-to-export-coal-from-military-ports-draws-condemnation-1.552112?utm_source=feedburner&utm_medium=feed&utm_campaign=Feed%3A+starsandstripes%2Fgeneral+%28Stars+and+Stripes%29,https://www.stripes.com/polopoly_fs/1.552113.1539710047!/image/image.jpg_gen/derivatives/landscape_490/image.jpg,323
331,Investopedia,"On August 11, 2015, the Peoples Bank of China (PBOC) surprised markets with three consecutive devaluations of the yuan renminbi or yuan ( CNY ), knocking over 3% off its value. Since 2005, Chinas currency had appreciated 33% against the U.S. dollar, and the f… [+10025 chars]","The global response to, and fallout from, China's decision to devalue its currency for the first time in 20 years in 2015.",2018-10-16T17:28:00Z,"{'id': None, 'name': 'Investopedia.com'}",The Impact of China Devaluing the Yuan,https://www.investopedia.com/trading/chinese-devaluation-yuan/,https://i.investopedia.com/inv/genericcontentimages/subchannel/trading/forex-currencies/forex_170886048.jpg,215
332,Murray Gunn,"The disappearance and possible murder of Washington Post reporter Jamal Khashoggi is dominating the recent news cycle. But the resulting U.S. Saudi Arabia tensions did not cause the collapse in Saudi equities nor any move in crude oil. As is usually the case,… [+1449 chars]",The disappearance and possible murder of Washington Post reporter Jamal Khashoggi is dominating the recent news cycle. But the resulting U.S. – Saudi Arabia tensions did not cause the collapse in Saudi equities nor any move in crude oil. As […] The post Falli…,2018-10-16T17:30:28Z,"{'id': None, 'name': 'Valuewalk.com'}",Falling Markets Cause Rising Tensions,https://www.valuewalk.com/2018/10/declining-stock-markets-cause-rising-tensions/,https://www.valuewalk.com/wp-content/uploads/2018/10/Stock-markets.png,88
333,ET Bureau,"NEW DELHI: Oil cartel OPEC and allies haven’t yet kept their promise of raising oil output by one million barrels a day, oil minister Dharmendra Pradhan said, but didn’t blame supply scarcity for recent crude price trend. The Organization of Petroleum Exporti… [+2220 chars]",Pradhan said he wasn’t worried about supply shortfall due to Iran sanctions.,2018-10-16T17:33:37Z,"{'id': 'the-times-of-india', 'name': 'The Times of India'}","OPEC, allies yet to hike output by one million barrels per day: Oil Minister",https://economictimes.indiatimes.com/industry/energy/oil-gas/opec-allies-yet-to-hike-output-by-one-million-barrels-per-day-oil-minister/articleshow/66251495.cms,"https://img.etimg.com/thumb/msid-66251489,width-1070,height-580,imgsize-130459,overlay-economictimes/photo.jpg",228
334,DAVID E. SANGER,"But the key issue motivating the administration, he noted, is the close coordination needed with the Saudis as the crackdown on Iran unfolds. They cant really do it without the Saudis keeping up high production, Mr. Samore said, referring to oil. Even then, h… [+1717 chars]",A woman looks at currency exchange rates in Tehran. The Trump administration is counting on Saudi Arabia to help implement tough sanctions on Iran next month.,2018-10-16T17:41:36Z,"{'id': 'the-new-york-times', 'name': 'The New York Times'}",Khashoggi Disappearance May Disrupt Trump Administration’s Plans to Squeeze Iran,https://www.nytimes.com/2018/10/16/us/politics/khashoggi-trump-iran-sanctions.html,https://static01.nyt.com/images/2018/10/17/us/politics/17dc-diplo1/17dc-diplo1-facebookJumbo.jpg,2
335,Daniel Jones,"Sometimes, to do whats best for shareholders, you need to make a big tradeoff. Thats likely the decision that the management team at L3 Technologies ( LLL ) had come to realize when it agreed to merge with Harris Corp. ( HRS ) to create one of the largest def… [+8404 chars]",The management teams at Harris and L3 have positioned a merger between the two firms as a merger of equals. This is a peculiar way to compare the firms given th,2018-10-16T17:47:30Z,"{'id': None, 'name': 'Seekingalpha.com'}",Harris And L3 Technologies: A Merger Of Tradeoffs,https://seekingalpha.com/article/4211940-harris-l3-technologies-merger-tradeoffs,https://static.seekingalpha.com/uploads/2018/10/16/9866571-15396741346610055_origin.jpg,389
336,Utpal Bhaskar,"New Delhi: In what will boost India’s energy security efforts, global oil traders such as Vitol Group, Trafigura Group Pte. Ltd and Glencore Plc have showed interest in partnering the country for its strategic crude oil reserves. As part of India’s evolving e… [+3256 chars]","Vitol, Trafigura and Glencore are interested in filling up the existing reserve at Padur under the first phase",2018-10-16T17:49:57Z,"{'id': None, 'name': 'Livemint.com'}",Global oil traders keen on India’s strategic crude reserves,https://www.livemint.com/Industry/JYgOWiRPUK3sf4skCbvvfI/Global-oil-traders-keen-on-Indias-strategic-crude-reserves.html,https://www.livemint.com/rf/Image-621x414/LiveMint/Period2/2018/10/17/Photos/Processed/IndianOil.jpg,115
