,author,content,description,publishedAt,source,title,url,urlToImage,relevancy
312,Reuters,"By Jessica Resnick-Ault NEW YORK (Reuters) - Oil futures jumped on Monday, reaching the highest levels since November 2014, as U.S. sanctions on Iran come into force and a North American trade deal fosters growth. The United States and Canada forged a deal on… [+2680 chars]","By Jessica Resnick-Ault NEW YORK (Reuters) - Oil futures jumped on Monday, reaching the highest levels since November 2014, as U.S. sanctions on Iran come into force and a North American trade deal fosters growth. The United States and Canada forged a deal on…",2018-10-01T18:37:33Z,"{'id': None, 'name': 'Firstpost.com'}","Oil rises to 2014 highs on Iran Sanctions, NAFTA deal",https://www.firstpost.com/business/oil-rises-to-2014-highs-on-iran-sanctions-nafta-deal-5297531.html,https://images.firstpost.com/wp-content/uploads/reuters/10-2018/02/2018-10-01T025105Z_1_LYNXNPEE9014D_RTROPTP_2_OIL-ENERGY-OIL.jpg,46
313,Myra P. Saefong,"U.S. benchmark crude-oil prices marked their highest finish in almost four years on Monday. The market cheered the pending trade agreement between the U.S., Canada and Mexico, and continued to fret over declines in Iranian oil exports ahead of the U.S. sancti… [+394 chars]","U.S. benchmark crude-oil prices marked their highest finish in almost four years on Monday. The market cheered the pending trade agreement between the U.S., Canada and Mexico, and continued to fret over declines in Iranian oil exports ahead of the U.S. sancti…",2018-10-01T18:37:48Z,"{'id': None, 'name': 'Marketwatch.com'}",U.S. oil benchmark marks highest settlement since November 2014,https://www.marketwatch.com/story/us-oil-benchmark-marks-highest-settlement-since-november-2014-2018-10-01,https://mw3.wsj.net/mw5/content/logos/mw_logo_social.png,97
314,Shine Jacob,State-run Oil and Natural Gas Corporation (ONGC) is betting high on the second and third round of auctions under the Open Acreage Licensing Policy (OALP) for petroleum blocks. It has given a formal expression of interest (EoI) for seven areas in the second ro… [+2425 chars],"New Delhi, 1 October State-run Oil and Natural Gas Corporation (ONGC) is betting high on the second and third round of auctions under the Open Acreage Licensing Policy (OALP) for petroleum blocks. It has given a formal Expression of Interest (EoI) for seven a…",2018-10-01T18:38:00Z,"{'id': None, 'name': 'Business-standard.com'}","ONGC betting high on second, third round of OALP auctions, DSF-II",https://www.business-standard.com/article/companies/ongc-betting-high-on-second-third-round-of-oalp-auctions-dsf-ii-118100100844_1.html,https://bsmedia.business-standard.com/_media/bs/img/article/2017-09/28/full/1506541901-6772.jpg,252
315,SA Editor Carl Surran,"Enbridge ( ENB +2.4% ) plans to overhaul the way it awards space on its mainline pipeline system carrying Canadian oil to U.S. refiners, seeking to contract 90% of the capacity on the 2.85M bbl/day system by signing long-term deals with potential shippers in … [+915 chars]","Enbridge (ENB +2.4%) plans to overhaul the way it awards space on its mainline pipeline system carrying Canadian oil to U.S. refiners, seeking to contract 90% of the capacity on the 2.85M bbl/day sys",2018-10-01T18:41:45Z,"{'id': None, 'name': 'Seekingalpha.com'}",Bloomberg: Enbridge looking at long term pipeline deals,https://seekingalpha.com/news/3394185-bloomberg-enbridge-looking-long-term-pipeline-deals,https://static3.seekingalpha.com/assets/og_image_192-59bfd51c9fe6af025b2f9f96c807e46f8e2f06c5ae787b15bf1423e6c676d4db.png,124
316,CBC News,"Oil prices today are much higher than forecast in the 2018 Newfoundland and Labrador budget meaning a big boost to the bottom line but that won't be the main factor in any tax breaks next year, says a St. John's financial advisor. ""There's an election next ye… [+2187 chars]",The question is: should we be the grasshopper or the ant?,2018-10-01T18:49:05Z,"{'id': 'cbc-news', 'name': 'CBC News'}",Oil prices up but 2019 election biggest driver of potential tax break next year: Larry Short,https://www.cbc.ca/news/canada/newfoundland-labrador/larry-short-tax-break-oil-prices-1.4845310,https://i.cbc.ca/1.4058564.1491497662!/fileImage/httpImage/image.jpg_gen/derivatives/16x9_620/larry-short.jpg,258
317,SA Editor Clark Schultz,Airline stocks are reacting to the push higher in crude oil prices. The sector was also roughed up earlier in Europe after budget carrier Ryanair lowered its profit guidance for the year and is seeing Latin America carriers trade down on regulatory and FX con… [+437 chars],Airline stocks are reacting to the push higher in crude oil prices. The sector was also roughed up earlier in Europe after budget carrier Ryanair lowered its profit guidance for the year and is seein,2018-10-01T18:54:29Z,"{'id': None, 'name': 'Seekingalpha.com'}",Down day for global airline sector,https://seekingalpha.com/news/3394190-day-global-airline-sector,https://static3.seekingalpha.com/assets/og_image_192-59bfd51c9fe6af025b2f9f96c807e46f8e2f06c5ae787b15bf1423e6c676d4db.png,88
318,SA Editor Stephen Alpher,"WTI crude oil has added nearly another 3%, now at $75.37 per barrel, its highest intraday level since 2014. USO +2.9% That's helping the Energy Select SPDR ( XLE +1.7% ) far outperform the S&amp;P 500's 0.4% advance. What's moving oil? Take your pick, but the… [+274 chars]","WTI crude oil has added&nbsp;nearly another 3%, now at $75.37 per barrel, its highest intraday level since 2014. USO&nbsp;+2.9%That's helping the Energy Select SPDR (XLE +1.7%) far outperform the S&am",2018-10-01T18:55:02Z,"{'id': None, 'name': 'Seekingalpha.com'}",Energy names lead gains as oil surges to four-year high,https://seekingalpha.com/news/3394191-energy-names-lead-gains-oil-surges-four-year-high,https://static3.seekingalpha.com/assets/og_image_192-59bfd51c9fe6af025b2f9f96c807e46f8e2f06c5ae787b15bf1423e6c676d4db.png,89
319,Viktor Katona,"Ever since war broke out in Eastern Ukraine, the energy industry has been guessing what will happen to Ukraine’s gas transit and its transmission system. In the background, however, Ukraine’s oil sector has remained in tantalizing agony, as only one out of th… [+6409 chars]","Ever since war broke out in Eastern Ukraine, the energy industry has been guessing what will happen to Ukraine’s gas transit and its transmission system. In the background, however, Ukraine’s oil sector has remained in tantalizing agony, as only one out of th…",2018-10-01T19:00:00Z,"{'id': None, 'name': 'Oilprice.com'}",Who Will Save Ukraine’s Dying Refineries?,https://oilprice.com/Energy/Crude-Oil/Who-Will-Save-Ukraines-Dying-Refineries.html,https://d32r1sh890xpii.cloudfront.net/article/718x300/8549bb423c2c56417d391d9e9fe415ef.jpg,341
320,"Peter Hanks,, Peter Hanks","Talking Points: NAFTA will be renamed to USMCA, or United States, Mexico, and Canada The conclusion of North American trade uncertainty will be a boon for the United States on other trade war fronts USD/CAD traded lower as the two currencies climbed versus ot… [+6359 chars]","After months of negotiations, the United States, Canada, and Mexico finally reached an agreement on NAFTA. The agreement materialized on the eve of the October 1st deadline.",2018-10-01T19:00:00Z,"{'id': None, 'name': 'Dailyfx.com'}","A NAFTA Deal Sends CAD Souring, USD Less Jubilant",https://www.dailyfx.com/forex/market_alert/2018/10/01/A-NAFTA-Deal-Sends-CAD-Souring-USD-Less-Jubilant.html,,403
321,https://www.dailymail.co.uk/home/search.html?s=&authornamef=Reuters,"By Chuck Mikolajczak NEW YORK, Oct 1 (Reuters) - Wall Street kicked off the fourth quarter on a positive note on Monday, as a last-minute deal to salvage NAFTA as a trilateral pact helped ease trade concerns. Canada and Mexico accepted more restrictive commer… [+2687 chars]","By Chuck MikolajczakNEW YORK, Oct 1 (Reuters) - Wall Street kicked off the  fourth quarter on a positive note on Monday, as a last-minute  deal to salvage...",2018-10-01T19:05:54Z,"{'id': 'daily-mail', 'name': 'Daily Mail'}",US STOCKS-NAFTA replacement deal lifts Wall Street,https://www.dailymail.co.uk/wires/reuters/article-6228621/US-STOCKS-NAFTA-replacement-deal-lifts-Wall-Street.html,https://i.dailymail.co.uk/i/pix/m_logo_636x382px.png,320
322,Chuck Mikolajczak,"NEW YORK (Reuters) - Wall Street kicked off the fourth quarter on a positive note on Monday, as a last-minute deal to salvage NAFTA as a trilateral pact helped ease trade concerns. Canada and Mexico accepted more restrictive commerce in the new United States-… [+2686 chars]","Wall Street kicked off the fourth quarter on a positive note on Monday, as a last-minute deal to salvage NAFTA as a trilateral pact helped ease trade concerns.",2018-10-01T19:06:11Z,"{'id': 'reuters', 'name': 'Reuters'}",NAFTA replacement deal lifts Wall Street,https://www.reuters.com/article/us-usa-stocks/nafta-replacement-deal-lifts-wall-street-idUSKCN1MB2CA,https://s2.reutersmedia.net/resources/r/?m=02&d=20181001&t=2&i=1310160366&w=1200&r=LYNXNPEE901TE,74
323,Sputnik,The oil debate has been particularly intense lately given President Donald Trumps threatening with sanctions against countries that would continue buying Iranian oil. The issue has met a barrage of criticism across the world. Kuwait has for the first time in … [+1769 chars],The oil debate has been particularly intense lately given President Donald Trump’s threatening with sanctions against countries that would continue buying Iranian oil. The issue has met a barrage of criticism across the world.,2018-10-01T19:08:03Z,"{'id': None, 'name': 'Sputniknews.com'}",Kuwait Stops Exporting Crude Oil to US First Time in Over Two Decades,https://sputniknews.com/business/201810011068499398-kuwait-crude-oil-us/,https://cdn5.img.sputniknews.com/images/103691/73/1036917311.jpg,32
324,Badsha Chowdhury,An overview of CARBO Ceramics CARBO Ceramics ( CRR ) sells proppant products for use primarily in the hydraulic fracturing of oil and natural gas wells. A fall in ceramic proppant sales and the overhang of the last crude oil price crash has haunted CRR. On th… [+13711 chars],Base ceramic proppants sales down significantly since 2014. CRR still depends on low-margin frac sand sales. Technology-driven proppants add to CRR’s margin. CR,2018-10-01T19:08:30Z,"{'id': None, 'name': 'Seekingalpha.com'}",CARBO Ceramics: Long-Run Drivers To Beat Current Headwinds,https://seekingalpha.com/article/4209215-carbo-ceramics-long-run-drivers-beat-current-headwinds,https://static2.seekingalpha.com/images/marketing_images/oil_gas/b19industry042.jpeg,195
325,HEATHER RICHARDS Heather.Richards@trib.com,"An environmental group is trying to block one of the largest oil and gas developments on Wyoming public land due to air quality concerns. In a petition sent to the Interior Departments review board, WildEarth Guardians argues that Normally Pressured Lance a 3… [+5861 chars]",An environmental group is trying to block one of the largest oil and gas developments on Wyoming public land due to air quality concerns.,2018-10-01T19:10:00Z,"{'id': None, 'name': 'Trib.com'}",1 of Wyoming's largest oil and gas developments draws protests,https://trib.com/business/energy/wyoming-s-energy-advances-spur-protests/article_66bf4fe0-5a9e-511e-83f7-339e264700e3.html,https://bloximages.chicago2.vip.townnews.com/billingsgazette.com/content/tncms/assets/v3/editorial/d/df/ddff7db9-cf01-5e1c-8d4a-0341a9e098f7/5bb271fc84ff2.image.jpg?crop=620%2C349%2C0%2C31&resize=620%2C349&order=crop%2Cresize,362
326,,"NEW YORK: Wall Street kicked off the fourth quarter on a positive note on Monday, as a last-minute deal to salvage NAFTA as a trilateral pact helped ease trade concerns. Canada and Mexico accepted more restrictive commerce in the new United States-Mexico-Cana… [+2618 chars]","U.S. stock futures pointed to a rise on Monday after the United States and Canada clinched a last minute deal to save NAFTA as a trilateral pact with Mexico, boosting hopes for progress in talks with other countries at the start of the fourth quarter.",2018-10-01T19:10:33Z,"{'id': None, 'name': 'Channelnewsasia.com'}",NAFTA replacement deal lifts Wall Street,https://www.channelnewsasia.com/news/business/nafta-replacement-deal-lifts-wall-street-10777508,http://www.channelnewsasia.com/image/10777506/16x9/991/557/6c60a14df2a0d300fb9e7875e7763e3b/QQ/file-photo--traders-work-on-the-floor-of-the-nyse-in-new-york-2.jpg,179
327,Chuck Mikolajczak,"NEW YORK (Reuters) - Wall Street kicked off the fourth quarter on a positive note on Monday, as a last-minute deal to salvage NAFTA as a trilateral pact helped ease trade concerns. Canada and Mexico accepted more restrictive commerce in the new United States-… [+2688 chars]","Wall Street kicked off the fourth quarter on a positive note on Monday, as a last-minute deal to salvage NAFTA as a trilateral pact helped ease trade concerns.",2018-10-01T19:10:34Z,"{'id': 'reuters', 'name': 'Reuters'}",NAFTA replacement deal lifts Wall Street,https://in.reuters.com/article/usa-stocks/nafta-replacement-deal-lifts-wall-street-idINKCN1MB2T0,https://s2.reutersmedia.net/resources/r/?m=02&d=20181001&t=2&i=1310109844&w=1200&r=LYNXNPEE9025G,327
328,,"Oct. 1 (UPI) -- Crude oil prices reached levels not seen in four years Monday, with Brent prices topping $85 a barrel and WTI soaring to $75. Oil prices surged today as President Donald Trump announced a new $1.2 trillion tri-lateral trade deal with Canada an… [+2782 chars]","Brent crude oil soared to more than $84 a barrel Monday, the highest price since November 2014.",2018-10-01T19:13:41Z,"{'id': None, 'name': 'Upi.com'}",Brent prices reach four-year high while experts brace for $90 crude,https://www.upi.com/Energy-News/2018/10/01/Brent-prices-reach-four-year-high-while-experts-brace-for-90-crude/4641538412114/,https://cdnph.upi.com/sv/ph/og/upi_com/4641538412114/2018/1/4f50f3ab083af5d6a9acc19daefe6b97/v1.5/Brent-prices-reach-four-year-high-while-experts-brace-for-90-crude.jpg,191
329,Business Standard,By continuing to use this site you consent to the use of cookies on your device as described in our Cookie Policy unless you have disabled them. You can change your Cookie Settings at any time but parts of our site will not function correctly without them.,"From August to now, Indian crude oil basket has moved up by around 12%, while INR depreciated by 6%",2018-10-01T19:22:03Z,"{'id': None, 'name': 'Business-standard.com'}","Monetary policy review: RBI to hike repo rate by 25 bps in Oct, says expert",https://www.business-standard.com/article-moved?a=3&q=monetary-policy-review-rbi-to-hike-repo-rate-by-25-bps-in-oct-says-expert,,155
330,Rhik Kundu,"Mumbai: Airfares are expected to rise this quarter, tracking sharply higher crude oil prices and traditionally robust demand during the festival season. Jet fuel prices surged to the highest since March 2014 on Monday, helped also by a weakening rupee. With d… [+2314 chars]","Jet fuel prices surged to the highest since March 2014 on Monday, helped also by a weakening rupee",2018-10-01T19:22:54Z,"{'id': None, 'name': 'Livemint.com'}",Flight ticket prices head north on sky-high jet fuel prices,https://www.livemint.com/Companies/W7rVbWnXYmVUl10EnzKgnO/Flight-ticket-prices-head-north-on-skyhigh-jet-fuel-prices.html,https://www.livemint.com/rf/Image-621x414/LiveMint/Period2/2018/10/02/Photos/Processed/jet-fuel-kVSG--621x414@LiveMint.jpg,206
331,Research and Markets,"DUBLIN, Oct. 1, 2018 /PRNewswire/ -- The ""Global Cable Ties Market 2018-2022"" report has been added to ResearchAndMarkets.com's offering. The global cable ties market to grow at a CAGR of 6.71% during the period 2018-2022. Global Cable Ties Market 2018-2022, … [+3263 chars]","DUBLIN, Oct. 1, 2018 /PRNewswire/ -- The ""Global Cable Ties Market 2018-2022"" report has been added to ResearchAndMarkets.com's offering. The global cable ties market to grow at a CAGR of 6.71% during the period 2018-2022. Global Cable Ties Market 2018-2022, …",2018-10-01T19:30:00Z,"{'id': None, 'name': 'Prnewswire.com'}",Global Cable Ties (Metal and Plastic) Market 2018-2022 - RFID-Enabled Cable Ties / Innovative Bio-Polymer Cable Ties / Augmenting Demand for Efficient Cable Ties,https://www.prnewswire.com/news-releases/global-cable-ties-metal-and-plastic-market-2018-2022---rfid-enabled-cable-ties--innovative-bio-polymer-cable-ties--augmenting-demand-for-efficient-cable-ties-300721980.html,https://mma.prnewswire.com/media/539438/Research_and_Markets_Logo.jpg?p=facebook,379
332,Reuters,"By Chuck Mikolajczak NEW YORK (Reuters) - Wall Street kicked off the fourth quarter on a positive note on Monday, as a last-minute deal to salvage NAFTA as a trilateral pact helped ease trade concerns. Canada and Mexico accepted more restrictive commerce in t… [+2838 chars]","By Chuck Mikolajczak NEW YORK (Reuters) - Wall Street kicked off the fourth quarter on a positive note on Monday, as a last-minute deal to salvage NAFTA as a trilateral pact helped ease trade concerns. Canada and Mexico accepted more restrictive commerce in t…",2018-10-01T19:35:20Z,"{'id': None, 'name': 'Firstpost.com'}",NAFTA replacement deal lifts Wall Street,https://www.firstpost.com/business/nafta-replacement-deal-lifts-wall-street-5297671.html,https://images.firstpost.com/wp-content/uploads/reuters/10-2018/02/2018-10-01T133632Z_1_LYNXNPEE9025G_RTROPTP_2_USA-STOCKS.jpg,159
333,Reuters Editorial,"NEW YORK (Reuters) - Sunrise Pipeline set rates for its new crude pipeline extension from Loving County, Texas in the Permian basin to the storage hub of Cushing, Oklahoma, effective Nov. 1, according to a regulatory filing on Monday. The startup of the expan… [+1668 chars]","Sunrise Pipeline set rates for its new crude pipeline extension from Loving County, Texas in the Permian basin to the storage hub of Cushing, Oklahoma, effective Nov. 1, according to a regulatory filing on Monday.",2018-10-01T19:41:49Z,"{'id': 'reuters', 'name': 'Reuters'}",Sunrise sets rates for new Permian-to-Cushing crude line,https://www.reuters.com/article/us-usa-oil-permian-pipeline/sunrise-sets-rates-for-new-permian-to-cushing-crude-line-idUSKCN1MB3JN,https://s4.reutersmedia.net/resources_v2/images/rcom-default.png,373
334,,"DUBAI: Saudi Arabia's public prosecutor has charged a man, identified by activists as a prominent economist who once criticised plans to float shares of Saudi Aramco, with joining a terrorist organisation and meeting with foreign diplomats. Local media, inclu… [+2526 chars]","DUBAI: Saudi Arabia's public prosecutor has charged a man, identified by activists as a prominent economist who once criticised plans to float shares of Saudi Aramco, with joining a terrorist organisation and meeting with foreign diplomats. Local media, inclu…",2018-10-01T19:55:30Z,"{'id': None, 'name': 'Channelnewsasia.com'}",Saudi economist who criticised Aramco IPO charged with terrorism - activists,https://www.channelnewsasia.com/news/world/saudi-economist-who-criticised-aramco-ipo-charged-with-terrorism---activists-10779160,http://www.channelnewsasia.com/image/8695344/16x9/991/557/609aa1d555bc236155019d989012c2c5/sP/world.png,113
335,Reuters Editorial,"DUBAI (Reuters) - Saudi Arabia’s public prosecutor has charged a man, identified by activists as a prominent economist who once criticized plans to float shares of Saudi Aramco, with joining a terrorist organization and meeting with foreign diplomats. Local m… [+2487 chars]","Saudi Arabia's public prosecutor has charged a man, identified by activists as a prominent economist who once criticized plans to float shares of Saudi Aramco, with joining a terrorist organization and meeting with foreign diplomats.",2018-10-01T19:55:35Z,"{'id': 'reuters', 'name': 'Reuters'}",Saudi economist who criticized Aramco IPO charged with terrorism: activists,https://www.reuters.com/article/us-saudi-arrests/saudi-economist-who-criticized-aramco-ipo-charged-with-terrorism-activists-idUSKCN1MB3OI,https://s4.reutersmedia.net/resources_v2/images/rcom-default.png,21
336,https://www.dailymail.co.uk/home/search.html?s=&authornamef=Reuters,"DUBAI, Oct 1 (Reuters) - Saudi Arabia's public prosecutor has charged a man, identified by activists as a prominent economist who once criticised plans to float shares of Saudi Aramco, with joining a terrorist organisation and meeting with foreign diplomats. … [+2563 chars]","DUBAI, Oct 1 (Reuters) - Saudi Arabia's public prosecutor  has charged a man, identified by activists as a prominent  economist who once criticised plans to...",2018-10-01T19:55:52Z,"{'id': 'daily-mail', 'name': 'Daily Mail'}",Saudi economist who criticised Aramco IPO charged with...,https://www.dailymail.co.uk/wires/reuters/article-6228739/Saudi-economist-criticised-Aramco-IPO-charged-terrorism-activists.html,https://i.dailymail.co.uk/i/pix/m_logo_636x382px.png,260
337,The Star Online,"DUBAI (Reuters) - Saudi Arabia's public prosecutor has charged a man, identified by activists as a prominent economist who once criticised plans to float shares of Saudi Aramco, with joining a terrorist organisation and meeting with foreign diplomats. Local m… [+2493 chars]","DUBAI (Reuters) - Saudi Arabia's public prosecutor has charged a man, identified by activists as a prominent economist who once criticised plans to float shares of Saudi Aramco, with joining a terrorist organisation and meeting with foreign diplomats.",2018-10-01T19:56:09Z,"{'id': None, 'name': 'Thestar.com.my'}",Saudi economist who criticised Aramco IPO charged with terrorism - activists,http://www.thestar.com.my/news/world/2018/10/02/saudi-economist-who-criticised-aramco-ipo-charged-with-terrorism--activists/,https://cdn.thestar.com.my/Themes/img/newTsol_logo_socmedia.png?v=2018102,393
338,Guest,"By James Wilt, The Narwhal. Originally posted on The Narwhal. Canadians might imagine Burnaby as the main site of protest against the Trans Mountain oil pipeline and tanker project, the Vancouver suburb marked as it is by dozens of peaceful demonstrations, ar… [+10013 chars]","Read time: 8 mins By James Wilt, The Narwhal. Originally posted on The Narwhal. Canadians might imagine Burnaby as the main site of protest against the Trans Mountain oil pipeline and tanker project, the Vancouver suburb marked as it is by dozens of peaceful …",2018-10-01T19:59:20Z,"{'id': None, 'name': 'Desmogblog.com'}",Why Californians Are Worried About the Trans Mountain Pipeline,https://www.desmogblog.com/2018/10/01/why-californians-are-worried-about-trans-mountain-pipeline,https://www.desmogblog.com/sites/beta.desmogblog.com/files/blogimages/phillips66-protest-sign-expansion-tar-sands_Sept2018_credit-peg-hunter_creative-commons.jpg,99
339,Tsvetana Paraskova,"Russia may be pumping oil at close or above post-Soviet high levels, but because of transportation constraints, it can’t significantly increase its oil supply to Asia, where the loss of Iranian oil exports is already being felt, Russian deputy energy minister… [+1771 chars]","Russia may be pumping oil at close or above post-Soviet high levels, but because of transportation constraints, it can’t significantly increase its oil supply to Asia, where the loss of Iranian oil exports is already being felt, Russian deputy energy minister…",2018-10-01T20:00:00Z,"{'id': None, 'name': 'Oilprice.com'}",Russia Can’t Raise Oil Supply To Asia To Offset Iranian Loss,https://oilprice.com/Latest-Energy-News/World-News/Russia-Cant-Raise-Oil-Supply-To-Asia-To-Offset-Iranian-Loss.html,https://d32r1sh890xpii.cloudfront.net/news/718x300/e5f99a4d1921b5124887626dec41d4aa.jpg,73
340,Tyler Durden,"Did Trump drink Trudeau's milkshake? China is closed for golden week, and while stocks weren't trading, yuan slipped back to crucial support levels... European markets were dominated by Italiian weakness... As Italian banks collapsed... Futures markets show t… [+1871 chars]","Did Trump drink Trudeau's milkshake? China is closed for golden week, and while stocks weren't trading, yuan slipped back to crucial support levels... European markets were dominated by Italiian weakness... As Italian banks collapsed... Futures markets show t…",2018-10-01T20:01:36Z,"{'id': None, 'name': 'Zerohedge.com'}","Stocks Swoon As Trump Trade Deal Euphoria Fades, Small Caps Slammed",https://www.zerohedge.com/news/2018-10-01/stocks-swoon-trump-trade-deal-euphoria-fades-small-caps-slammed,https://www.zerohedge.com/sites/default/files/styles/max_650x650/public/2018-10/2018-10-01_12-18-54.jpg?itok=8h3ZqC-B,342
341,Paul Ausick,"October 1, 2018: Markets opened higher Monday on news that the U.S. and Canada had salvaged a trade deal at the eleventh hour on Sunday. The Nasdaq Composite began sinking early on and looks to be headed for a flat close. The energy and basic materials sector… [+1700 chars]","Boeing, UnitedHealth, American Express, and Chevron lifted the Dow index on Monday.",2018-10-01T20:01:51Z,"{'id': None, 'name': '247wallst.com'}","Boeing, Chevron Lift the Dow Monday",http://247wallst.com/investing/2018/10/01/boeing-chevron-lift-the-dow-monday/,https://s2.wp.com/wp-content/themes/vip/247wallst/images/247-50x50.png,156
