,author,content,description,publishedAt,source,title,url,urlToImage,relevancy
64,The Star Online,"KUALA LUMPUR: FGV Holdings Bhd posted net losses of RM849.25mil in the third quarter ended Sept 30, 2018,due to impairments totalling RM788mil, muchg of it was from the Asian Plantation Ltd (APL). FGV, the world's largest crude palm oil (CPO) producer, announ… [+1999 chars]","KUALA LUMPUR: FGV Holdings Bhd posted net losses of RM849.25mil in the third quarter ended Sept 30, 2018,due to impairments totalling RM788mil, muchg of it was from the Asian Plantation Ltd (APL).",2018-11-28T05:42:36Z,"{'id': None, 'name': 'Thestar.com.my'}","FGV posts Q3 net loss of RM849m net loss, mainly due to APL impairments",http://www.thestar.com.my/business/business-news/2018/11/28/fgv-posts-q3-net-loss-of-rm849m-net-loss-mainly-due-to-apl-impairments/,https://www.thestar.com.my/~/media/online/2018/08/28/10/53/fgv3.ashx/?w=620&h=413&crop=1&hash=C81AB312FA749BFE887CE02C239B8B06DC42C87D,263
65,"David Cottle, Analyst, David Cottle",Asian Stocks Talking Points: Most regional bourses managed to gain once more Hopeful trade comment from the White House clearly helped The US Dollar was supported by the latest Federal Reserve commentary Find out what retail foreign exchange investors make of… [+2986 chars],G20 meetings have under-delivered before but stock investors seem hopeful that this weekend’s Argentinian edition can at least bring a more constructive tone to trade talks,2018-11-28T05:56:00Z,"{'id': None, 'name': 'Dailyfx.com'}","Asian Stocks Still Supported By Hopes For Trump, Xi G20 Meet",https://www.dailyfx.com/forex/market_alert/2018/11/28/Asian-Stocks-Still-Supported-By-Hopes-For-Trump-Xi-G20-Meet.html,,217
66,,By Adeyemi Adepetun One area in which Nigeria and Nigerians have made critical contributions to the global economy in recent years is in information communications technology (ICT). Over 20 Nigerians are currently actively engaged at Facebook at different man… [+7368 chars],[Guardian] One area in which Nigeria and Nigerians have made critical contributions to the global economy in recent years is in information communications technology (ICT). Over 20 Nigerians are currently actively engaged at Facebook at different managerial p…,2018-11-28T06:02:06Z,"{'id': None, 'name': 'Allafrica.com'}",Nigeria: 'Why Nigeria Must Spend More On ICT Training',https://allafrica.com/stories/201811280059.html,https://cdn07.allafrica.com/static/images/structure/aa-logo-rgba-no-text-128x128.png,270
67,Brendon Lau,"Our oil and gas stocks are trying to claw back from big losses that were triggered by ongoing worries about a global oil glut. The Santos Ltd (ASX: STO) share price regained most of its earlier losses to finish the day down 0.2% at $5.59, while the Oil Search… [+3110 chars]",Most of our oil stocks including the Oil Search Limited (ASX: OSH) share price and Woodside Petroleum Limited (ASX: WPL) share price have outperformed. There're reasons to think this bounce can continue.,2018-11-28T06:05:15Z,"{'id': None, 'name': 'Fool.com.au'}",This broker has upgraded these energy stocks to “buy” following the oil market massacre,https://www.fool.com.au/2018/11/28/this-broker-has-upgraded-these-energy-stocks-to-buy-following-the-oil-market-massacre/,https://www.fool.com.au/wp-content/uploads/2018/10/Upgrade-16.9.jpg,168
68,,"By Zakariyya Adaramola, Chris Agabi, Daniel Adugbo, Francis Iloani, Latifat Opoola and Sunday Michael Ogwu The continuing meltdown in the global oil market in the last one month is threatening Nigeria's budget implementation, especially funding of capital pro… [+7207 chars]","[Daily Trust] The continuing meltdown in the global oil market in the last one month is threatening Nigeria's budget implementation, especially funding of capital projects, experts told Daily Trust yesterday.",2018-11-28T06:11:19Z,"{'id': None, 'name': 'Allafrica.com'}","Low Oil Price Threatens Nigeria Budget, Revenue",https://allafrica.com/stories/201811280074.html,https://cdn07.allafrica.com/static/images/structure/aa-logo-rgba-no-text-128x128.png,127
69,Dhwani Mehta,"The US dollar bulls took a breather in Wednesday’s Asian trades that allowed most majors to attempt a tepid bounce. However, the price-action across the fx board remained confined within tight trading ranges amid escalating US-China trade tensions, Brexit unc… [+4106 chars]","The US dollar bulls took a breather in Wednesday’s Asian trades that allowed most majors to attempt a tepid bounce. However, the price-action across the fx board remained confined within tight trading ranges amid escalating US-China trade tensions, Brexit unc…",2018-11-28T06:13:13Z,"{'id': None, 'name': 'Fxstreet.com'}","FX Today: US dollar steadies ahead of US GDP, Powell speech; UK-BOE Brexit forecasts – Up next",https://www.fxstreet.com/news/fx-today-us-dollar-steadies-ahead-of-us-gdp-powell-speech-uk-boe-brexit-forecasts-up-next-201811280613,https://editorial.azureedge.net/images/Markets/Currencies/Majors/GBPUSD/british-banknotes-14144912_Large.jpg,145
70,Reuters,"FGV pic. KUALA LUMPUR: FGV Holdings Bhd today posted its second consecutive quarterly loss on, dragged by declining crude palm oil prices and impairment charges. Net loss was RM849.3 million in the third quarter ended September, compared with a net profit of … [+416 chars]",The country's largest palm oil producer says revenue fell to RM3.19 billion.,2018-11-28T06:31:02Z,"{'id': None, 'name': 'Freemalaysiatoday.com'}",FGV posts RM849 million loss amid fall in palm oil prices,https://www.freemalaysiatoday.com/category/nation/2018/11/28/fgv-posts-rm849-million-loss-amid-fall-in-palm-oil-prices/,https://s3media.freemalaysiatoday.com/wp-content/uploads/2018/11/fgv-bangunan-fgvpic-271118-2.jpg,70
71,Alexandra Alper and Marianna Parraga,"RIO DE JANEIRO (Reuters) - Brazil has more than doubled the number of risky ship-to-ship oil transfers this year, but its monitoring of such offshore maneuvers is lax, to a point where a July 2017 collision between two tankers was not reported, according to a… [+4463 chars]","Brazil has more than doubled the number of risky ship-to-ship oil transfers this year, but its monitoring of such offshore maneuvers is lax, to a point where a July 2017 collision between two tankers was not reported, according to a Reuters review of governme…",2018-11-28T06:38:48Z,"{'id': 'reuters', 'name': 'Reuters'}",Exclusive: Brazil oil tanker collision reveals offshore regulatory gaps,https://ca.reuters.com/article/businessNews/idCAKCN1NX0J4-OCABS,https://s4.reutersmedia.net/resources/r/?m=02&d=20181128&t=2&i=1329360554&w=1200&r=LYNXNPEEAR0DY-OCABS,299
72,Sankalp Soni,"The Indian Rupee had declined to as much as 74.60 against the USD earlier this year; however, it has been recovering this month and is currently trading at about 70.82. As a result, the Market Vectors Indian Rupee/USD ETN ( INR ) has rallied by about 9.82% ov… [+4322 chars]","The INR ETF has increased by about 10% over the past 10 days. Falling oil prices are lowering import costs, thereby supporting the Indian Rupee. A dovish Fed co",2018-11-28T06:39:24Z,"{'id': None, 'name': 'Seekingalpha.com'}",What Is The Outlook For The Indian Rupee?,https://seekingalpha.com/article/4224986-outlook-indian-rupee,https://static3.seekingalpha.com/images/marketing_images/bull_bear/bear_and_bull_1.png,13
73,Deutsche Welle (www.dw.com),"An explosion at a chemical plant on Wednesday killed 22 people and injured 22 others in the city of Zhangjiakou, which is set to host the 2022 Winter Olympic Games. Public anger has grown in China following several deadly industrial accidents ranging from che… [+4817 chars]","The local government has called on citizens to stay clear of the site, saying they could disrupt emergency operations. China has been rocked by several deadly industrial accidents, sparking anger in affected communities. An explosion at a chemical plant on We…",2018-11-28T06:43:00Z,"{'id': None, 'name': 'Dw.com'}",China hit by deadly blast at chemical plant,https://www.dw.com/en/china-deadly-chemical-plant-explosion-hits-zhangjiakou/a-46481034,https://www.dw.com/image/46480848_304.jpg,214
74,Deutsche Welle (www.dw.com),"An explosion at a chemical plant on Wednesday killed 22 people and injured 22 others in the city of Zhangjiakou, which is set to host the 2022 Winter Olympic Games. Public anger has grown in China following several deadly industrial accidents ranging from che… [+4817 chars]","The local government has called on citizens to stay clear of the site, saying they could disrupt emergency operations. China has been rocked by several deadly industrial accidents, sparking anger in affected communities.",2018-11-28T06:43:00Z,"{'id': None, 'name': 'Dw.com'}",China hit by deadly blast at chemical plant,https://www.dw.com/en/china-deadly-chemical-plant-explosion-hits-zhangjiakou/a-46481034,https://www.dw.com/image/46480848_304.jpg,106
75,,"This is the verbatim transcript of Jagran Prakashan management call with analysts. Moderator: Ladies and gentlemen, good day and welcome to the Jagran Prakashan Q2 and H1 FY2019 Results Conference Call hosted by ICICI Securities Limited. As a reminder all par… [+39839 chars]",This is the verbatim transcript of Jagran Prakashan management call with analysts.,2018-11-28T06:43:59Z,"{'id': None, 'name': 'Moneycontrol.com'}",Jagran Prakashan Q2 H1 FY2019 Earnings Conference Call,https://www.moneycontrol.com/news/business/jagran-prakashan-q2-h1-fy2019-earnings-conference-call-3227781.html,https://static-news.moneycontrol.com/static-mcnews/2017/07/Earnings_Results_Finance-770x433.jpg,303
76,Reuters Editorial,(Reuters) - Shares of India’s Jet Airways Ltd rose sharply on Wednesday following a report that founder Naresh Goyal has agreed to sell his controlling stake and give up operational control of the struggling carrier. Although Goyal has been reluctant to relin… [+1433 chars],Shares of India's Jet Airways Ltd rose sharply on Wednesday following a report that founder Naresh Goyal has agreed to sell his controlling stake and give up operational control of the struggling carrier.,2018-11-28T06:49:38Z,"{'id': 'reuters', 'name': 'Reuters'}",Jet Airways shares jump on report founder to sell controlling stake,https://in.reuters.com/article/jet-airways-m-a-idINKCN1NX0K9,https://s4.reutersmedia.net/resources/r/?m=02&d=20181128&t=2&i=1329362729&w=1200&r=LYNXNPEEAR0EY,213
77,Alexandra Alper,"RIO DE JANEIRO (Reuters) - Brazil has more than doubled the number of risky ship-to-ship oil transfers this year, but its monitoring of such offshore maneuvers is lax, to a point where a July 2017 collision between two tankers was not reported, according to a… [+4463 chars]","Brazil has more than doubled the number of risky ship-to-ship oil transfers this year, but its monitoring of such offshore maneuvers is lax, to a point where a July 2017 collision between two tankers was not reported, according to a Reuters review of governme…",2018-11-28T06:49:50Z,"{'id': 'reuters', 'name': 'Reuters'}",Exclusive: Brazil oil tanker collision reveals offshore regulatory gaps,https://www.reuters.com/article/us-brazil-tankers-regulation-exclusive-idUSKCN1NX0J4,https://s4.reutersmedia.net/resources/r/?m=02&d=20181128&t=2&i=1329363843&w=1200&r=LYNXNPEEAR0DY,1
78,Alexandra Alper and Marianna Parraga,"RIO DE JANEIRO (Reuters) - Brazil has more than doubled the number of risky ship-to-ship oil transfers this year, but its monitoring of such offshore maneuvers is lax, to a point where a July 2017 collision between two tankers was not reported, according to a… [+4463 chars]","Brazil has more than doubled the number of risky ship-to-ship oil transfers this year, but its monitoring of such offshore maneuvers is lax, to a point where a July 2017 collision between two tankers was not reported, according to a Reuters review of governme…",2018-11-28T06:54:49Z,"{'id': 'reuters', 'name': 'Reuters'}",Exclusive: Brazil oil tanker collision reveals offshore regulatory gaps,https://ca.reuters.com/article/topNews/idCAKCN1NX0J4-OCATP,https://s3.reutersmedia.net/resources/r/?m=02&d=20181128&t=2&i=1329364133&w=1200&r=LYNXNPEEAR0DY-OCATP,298
79,Getty Images,"NEW DELHI: Gold prices were little changed in global markets after comments from a senior US Federal Reserve official, supporting the need of further interest rate hikes, bolstered the US dollar. Crude oil prices also edged up ahead of Opec meeting next week … [+2319 chars]",Lead can take support near Rs 132 and can face resistance near Rs 136.,2018-11-28T07:07:06Z,"{'id': 'the-times-of-india', 'name': 'The Times of India'}","Zinc, lead and nickel likely to trade lower",https://economictimes.indiatimes.com/markets/commodities/news/commodity-outlook-zinc-lead-and-nickel-likely-to-trade-lower/articleshow/66841262.cms,"https://img.etimg.com/thumb/msid-66841237,width-1070,height-580,imgsize-860862,overlay-etmarkets/photo.jpg",8
80,Reuters,Shares of Indias Jet Airways Ltd rose sharply on Wednesday following a report that founder Naresh Goyal has agreed to sell his controlling stake and give up operational control of the struggling carrier. Although Goyal has been reluctant to relinquish his con… [+1383 chars],Jet Airways' financial woes have been worsened by rising crude oil prices and intense pricing competition in the domestic aviation industry The post Jet Airways shares jump up to 9% on report of founder Naresh Goyal to sell controlling stake appeared first on…,2018-11-28T07:09:50Z,"{'id': None, 'name': 'Firstpost.com'}",Jet Airways shares jump up to 9% on report of founder Naresh Goyal to sell controlling stake,https://www.firstpost.com/business/jet-airways-shares-jump-up-to-9-on-report-of-founder-naresh-goyal-to-sell-controlling-stake-5630881.html,https://images.firstpost.com/wp-content/uploads/large_file_plugin/2018/11/1542258873_Jet_Airways_News.jpg,39
81,Reuters,Bengaluru: Shares of India’s Jet Airways Ltd rose sharply on Wednesday following a report that founder Naresh Goyal has agreed to sell his controlling stake and give up operational control of the struggling carrier. Although Goyal has been reluctant to relinq… [+1492 chars],"Although Naresh Goyal has been reluctant to relinquish his controlling stake in Jet Airways, he is said to have met all three prospective buyers—Tata Group, Etihad Airways and a consortium of Air France - KLM and Delta Air Lines",2018-11-28T07:11:19Z,"{'id': None, 'name': 'Livemint.com'}",Jet Airways shares jump on report Naresh Goyal to sell controlling stake,https://www.livemint.com/Money/r7jWstYNwxq4wv1kRY6lBL/Jet-Airways-shares-jump-on-report-Naresh-Goyal-to-sell-contr.html,https://www.livemint.com/rf/Image-621x414/LiveMint/Period2/2018/11/29/Photos/Processed/nareshgoyal-kO8B--621x414@LiveMint.jpg,125
82,Fergal Smith,"TORONTO (Reuters) - Investors see value in Toronto’s commodity-linked stock market and expect it to rebound in 2019 as the global economy continues to grow and on hopes for the price of Canadian heavy crude to recover, a Reuters poll shows. The median forecas… [+3548 chars]","Investors see value in Toronto's commodity-linked stock market and expect it to rebound in 2019 as the global economy continues to grow and on hopes for the price of Canadian heavy crude to recover, a Reuters poll shows.",2018-11-28T07:13:50Z,"{'id': 'reuters', 'name': 'Reuters'}",Toronto stock market set for rebound if oil prices recover: Reuters poll,https://ca.reuters.com/article/domesticNews/idCAKCN1NX0LO-OCADN,https://s3.reutersmedia.net/resources/r/?m=02&d=20181128&t=2&i=1329369230&w=1200&r=LYNXNPEEAR0FH-OCADN,287
83,Fergal Smith,"TORONTO (Reuters) - Investors see value in Toronto’s commodity-linked stock market and expect it to rebound in 2019 as the global economy continues to grow and on hopes for the price of Canadian heavy crude to recover, a Reuters poll shows. The median forecas… [+3548 chars]","Investors see value in Toronto's commodity-linked stock market and expect it to rebound in 2019 as the global economy continues to grow and on hopes for the price of Canadian heavy crude to recover, a Reuters poll shows.",2018-11-28T07:13:50Z,"{'id': 'reuters', 'name': 'Reuters'}",Toronto stock market set for rebound if oil prices recover: Reuters poll,https://ca.reuters.com/article/topNews/idCAKCN1NX0LO-OCATP,https://s3.reutersmedia.net/resources/r/?m=02&d=20181128&t=2&i=1329369253&w=1200&r=LYNXNPEEAR0FH-OCATP,286
84,,"The weakness seen in Q2 of financial year 2019 will continue even in Q3, predicts Gautam Trivedi, co-founder and managing partner of Nepean Capital. ""Earnings remain a big concern, Q2 earnings were weak and earnings in Q3 may also continue to be weak because … [+1751 chars]","The weakness seen in Q2 of financial year 2019 will continue even in Q3, said Gautam Trivedi, managing partner of Nepean Capital.",2018-11-28T07:14:25Z,"{'id': None, 'name': 'Moneycontrol.com'}","#39;Market has priced in a BJP loss in Rajasthan, win in Chhattisgarh#39;",https://www.moneycontrol.com/news/business/markets/market-has-priced-in-a-bjp-loss-in-rajasthan-win-in-chhattisgarh-3228491.html,https://static-news.moneycontrol.com/static-mcnews/2017/03/stocks_BSE_Nifty_Sensex__markets_bse_nse_nifty-1_1280-770x433.jpg,180
85,Swati Pandey,SYDNEY/TOKYO (Reuters) - Asian shares posted modest gains on Wednesday on hopes Beijing will take steps to support the economy and as investors tried to decipher conflicting signals on prospects for de-escalating the Sino-U.S. trade dispute. MSCI’s broadest i… [+4330 chars],Asian shares posted modest gains on Wednesday on hopes Beijing will take steps to support the economy and as investors tried to decipher conflicting signals on prospects for de-escalating the Sino-U.S. trade dispute.,2018-11-28T07:29:04Z,"{'id': 'reuters', 'name': 'Reuters'}","Global Markets: Asian shares gain on policy hopes before Trump-Xi meeting, Fed speech",https://in.reuters.com/article/us-global-markets-idINKCN1NX02A,https://s4.reutersmedia.net/resources/r/?m=02&d=20181128&t=2&i=1329290120&w=1200&r=LYNXNPEEAR02U,238
86,,"Abhishek Bansal International gold prices are hovering around $1,233-1,227 range even as fresh directions are awaited from key events such as G-20 summit and Fed meeting in December. Domestic prices are under pressure from continued strength in Indian rupee. … [+1767 chars]",Sell gold December month expiry contract on break below 30548 for target of 30207-29987 with closing stop loss above 30760,2018-11-28T07:32:02Z,"{'id': None, 'name': 'Moneycontrol.com'}","Investors to monitor Fed meet, G20 summit; here#39;s a strategy you can deploy for gold trade",https://www.moneycontrol.com/news/business/commodities/investors-to-monitor-fed-meet-g20-summit-heres-a-strategy-you-can-deploy-for-gold-trade-3225301.html,https://static-news.moneycontrol.com/static-mcnews/2018/08/gold-and-silver-bars-finance-economy-admin-900-x-506-770x433.jpg,88
87,Getty Images,Shares of India's Jet Airways Ltd rose sharply on Wednesday following a report that founder Naresh Goyal has agreed to sell his controlling stake and give up operational control of the struggling carrier. Although Goyal has been reluctant to relinquish his co… [+1355 chars],The carrier's financial woes have been worsened by rising crude oil prices.,2018-11-28T07:34:20Z,"{'id': 'the-times-of-india', 'name': 'The Times of India'}",Jet Airways shares jump on report Goyal to sell controlling stake,https://economictimes.indiatimes.com/markets/stocks/news/indias-jet-airways-shares-jump-on-report-goyal-to-sell-controlling-stake/articleshow/66841816.cms,"https://img.etimg.com/thumb/msid-66841879,width-1070,height-580,imgsize-705932,overlay-etmarkets/photo.jpg",146
88,Sandeep Kanihama,Note: All information on this page is subject to change. The use of this website constitutes acceptance of our user agreement. Please read our privacy policy and legal disclaimer. Trading foreign exchange on margin carries a high level of risk and may not be … [+1276 chars],"Analysts at Danske Bank suggest that on a day with a few data releases, the market will continue to follow any hints from US and Chinese officials ahead of the ever important trade talks at the G20 meeting in Argentina this coming weekend. Key Quotes “Market …",2018-11-28T07:41:21Z,"{'id': None, 'name': 'Fxstreet.com'}",US and China talks amongst market movers – Danske Bank,https://www.fxstreet.com/news/us-and-china-talks-amongst-market-movers-danske-bank-201811280741,https://editorial.azureedge.net/images/Macroeconomics/Countries/America/UnitedStatesofAmerica/american-flag-waving-for-a-national-holiday-in-washington-dc-63862281_Large.jpg,82
89,Reuters Editorial,"LONDON (Reuters) - Nigeria has awarded a mining contract to ten exploration and consulting companies as part of the country’s efforts to develop the sector, the mining and steel development minister said on Tuesday. Abubakar Bawa Bwari did not say how much th… [+1430 chars]","Nigeria has awarded a mining contract to ten exploration and consulting companies as part of the country's efforts to develop the sector, the mining and steel development minister said on Tuesday.",2018-11-28T07:54:03Z,"{'id': 'reuters', 'name': 'Reuters'}","Nigeria awards mining exploration contract to 10 mining, consulting firms",https://af.reuters.com/article/investingNews/idAFKCN1NX0OO-OZABS,https://s4.reutersmedia.net/resources_v2/images/rcom-default.png,293
90,Krishna V Kurup,"(Reuters) - Indian shares rose on Wednesday, boosted by IT stocks such as Infosys Ltd, while broader Asian markets were lacklustre amid conflicting signals on prospects for de-escalating the Sino-U.S. trade dispute. Meanwhile, U.S. President Donald Trump is p… [+1935 chars]","Indian shares rose on Wednesday, boosted by IT stocks such as Infosys Ltd, while broader Asian markets were lacklustre amid conflicting signals on prospects for de-escalating the Sino-U.S. trade dispute.",2018-11-28T08:28:41Z,"{'id': 'reuters', 'name': 'Reuters'}","Nifty, Sensex rise; Infosys top gainer",https://in.reuters.com/article/india-sensex-nifty-stocks-idINKCN1NX0R9,https://s3.reutersmedia.net/resources/r/?m=02&d=20181128&t=2&i=1329388356&w=1200&r=LYNXNPEEAR0IN,223
91,Haresh Menghani,"• The USD remains support by Clarida’s overnight hawkish comments. • Bullish traders seemed unaffected by a goodish rebound in oil prices. • The prelim US GDP print/Powell’s speech eyed for some fresh impetus. After yesterday's late retracement, the USD/CAD p… [+1493 chars]","• The USD remains support by Clarida’s overnight hawkish comments. • Bullish traders seemed unaffected by a goodish rebound in oil prices. • The prelim US GDP print/Powell’s speech eyed for some fresh impetus. After yesterday's late retracement, the USD/CAD p…",2018-11-28T08:32:22Z,"{'id': None, 'name': 'Fxstreet.com'}","USD/CAD sits at 5-month tops, comfortably above 1.3300 handle",https://www.fxstreet.com/news/usd-cad-sits-at-5-month-tops-comfortably-above-13300-handle-201811280832,https://editorial.azureedge.net/images/Markets/Currencies/Majors/USDCAD/global-money-economy-52533376_Large.jpg,73
92,AFP,"Investors have been cheered by hopes China and the US will reach an agreement (AFP pic) HONG KONG: Asian markets mostly rose Wednesday on hopes for a positive outcome from Donald Trump’s high-stakes trade talks with Xi Jinping, while dovish comments from the … [+4068 chars]",Wall Street provided a positive lead following soothing comments from top White House economic advisor Larry Kudlow on the chances of a trade deal when Trump and Xi meet on Saturday.,2018-11-28T08:33:59Z,"{'id': None, 'name': 'Freemalaysiatoday.com'}",Asia markets mostly up on hopes for crunch Trump-Xi trade talks,https://www.freemalaysiatoday.com/category/business/2018/11/28/asia-markets-mostly-up-on-hopes-for-crunch-trump-xi-trade-talks/,https://s3media.freemalaysiatoday.com/wp-content/uploads/2018/09/FMT-Asianmarkets19092018-AFP.jpg,186
93,,INR Vs USD: The dollar jumped to a near one-and-a-half-year high.,"The rupee lost 10 paise against the US dollar in early trade on Wednesday after the American currency gained against peers overseas and crude oil prices recovered, reported news agency Press Trust of India (PTI). However, losses in the rupee were capped as th…",2018-11-28T08:42:40Z,"{'id': None, 'name': 'Ndtv.com'}","Rupee Loses 10 Paise As Dollar, Crude Prices Gain: 10 Points",https://www.ndtv.com/business/rupee-vs-dollar-inr-vs-usd-currency-exchange-rate-rupee-loses-10-paise-as-dollar-crude-prices-gain-1-1954635,https://c.ndtvimg.com/2018-11/hfktlqa_rupee-generic-reuters_625x300_09_November_18.jpg,140
94,INTAN FARHANA ZAINUL,"KUALA LUMPUR: FGV Holdings Bhd has forecasted the crude palm oil (CPO) price to trade between RM1,900 and RM2,100 per tonne in 2019. “The high CPO stock pile would put pressure on the price,” said chairman and interim CEO Datuk Wira Azhar Abdul Hamid at FGV’s… [+220 chars]","KUALA LUMPUR: FGV Holdings Bhd has forecasted the crude palm oil (CPO) price to trade between RM1,900 and RM2,100 per tonne in 2019.",2018-11-28T09:04:55Z,"{'id': None, 'name': 'Thestar.com.my'}","FGV expects CPO price to trade at RM1,900-RM2,100 a tonne in 2019",http://www.thestar.com.my/business/business-news/2018/11/28/fgv-expects-cpo-price-to-trade-at-rm1900-rm2100-a-tonne-in-2019/,https://www.thestar.com.my/~/media/online/2017/12/01/05/15/cpo.ashx/?w=620&h=413&crop=1&hash=CB408CE170849D5E49BDB5F79A3601CA9A181DBC,185
