,author,content,description,publishedAt,source,title,url,urlToImage,relevancy
0,Bloomberg,"Robert Tuttle Wednesday, November 28, 2018 (Bloomberg) -- Canada’s lingering crude glut isn’t hindering the country’s growing oil output, according to the National Energy Board’s most recent forecast. The country’s oil production will average 4.59 million bar… [+2694 chars]","Canada's lingering crude glut isn't hindering the country's growing oil output, according to the National Energy Board's most recent forecast.",2018-11-28T00:00:00Z,"{'id': None, 'name': 'Rigzone.com'}",Canada's Output Grows Despite Pipeline Problems,https://www.rigzone.com/news/wire/canadas_output_grows_despite_pipeline_problems-28-nov-2018-157583-article/,https://images.rigzone.com/images/news/articles/157583_582x327.png,45
1,Bloomberg,"Tsuyoshi Inajima Wednesday, November 28, 2018 (Bloomberg) -- Oil climbed as the Trump administration signaled optimism a trade deal may be reached with China and an industry report indicated robust U.S. fuel demand. Futures in New York rose as much as 1.9 per… [+3340 chars]",Oil climbed as the Trump administration signaled optimism a trade deal may be reached with China and an industry report indicated robust U.S' fuel demand.,2018-11-28T00:00:00Z,"{'id': None, 'name': 'Rigzone.com'}",Oil Rises,https://www.rigzone.com/news/wire/oil_rises-28-nov-2018-157578-article/,https://images.rigzone.com/images/news/articles/157578_582x327.png,50
2,Bloomberg,"Amy Stillman Wednesday, November 28, 2018 (Bloomberg) -- Pemex has more than tripled its estimated reserves in its Ixachi field. The company now believes the onshore field in Veracruz contains 1.3 billion barrels of oil equivalent in proven, probable and poss… [+2181 chars]",Pemex has more than tripled its estimated reserves in its Ixachi field.,2018-11-28T00:00:00Z,"{'id': None, 'name': 'Rigzone.com'}",Pemex Triples Estimate for 'Most Important Onshore Field in 25 Years',https://www.rigzone.com/news/wire/pemex_triples_estimate_for_most_important_onshore_field_in_25_years-28-nov-2018-157584-article/,https://images.rigzone.com/images/news/articles/157584_582x327.png,248
3,Matthew V. Veazey,"Rigzone Staff Wednesday, November 28, 2018 At one point Wednesday, the January West Texas Intermediate (WTI) crude oil price was just seven cents above the $50 mark. After making a slight recovery, however, the WTI settled at $50.29 a barrel – a $1.27 day-on-… [+2254 chars]","At one point Wednesday, the January WTI crude oil price was just 7 cents above the $50 mark.",2018-11-28T00:00:00Z,"{'id': None, 'name': 'Rigzone.com'}",Crude Oil Slips but Gas Surges,https://www.rigzone.com/news/crude_oil_slips_but_gas_surges-28-nov-2018-157588-article/,https://images.rigzone.com/images/news/articles/157588_582x327.png,224
4,Bloomberg,"Jennifer A. Dlouhy &amp; Mario Parker Wednesday, November 28, 2018 (Bloomberg) -- The Trump administration has decided to keep waiving some oil refineries from U.S. biofuel mandates, despite pressure from ethanol advocates to end the practice, according to th… [+3656 chars]",The Trump administration has decided to keep waiving some oil refineries from US biofuel mandates.,2018-11-28T00:00:00Z,"{'id': None, 'name': 'Rigzone.com'}",EPA to Keep Exempting Refineries From Biofuel Mandates,https://www.rigzone.com/news/wire/epa_to_keep_exempting_refineries_from_biofuel_mandates-28-nov-2018-157589-article/,https://images.rigzone.com/images/rz-facebook.jpg,94
5,Irina Slav,"Three countries currently account for close to 40 percent of global crude oil production and only one of these countries is a member of the Organization of Petroleum Exporting Countries. The three are Russia, the United States, and Saudi Arabia and as their c… [+3496 chars]","Three countries currently account for close to 40 percent of global crude oil production and only one of these countries is a member of the Organization of Petroleum Exporting Countries. The three are Russia, the United States, and Saudi Arabia and as their c…",2018-11-28T00:00:00Z,"{'id': None, 'name': 'Oilprice.com'}",The Oil Powerhouses Replacing OPEC,https://oilprice.com/Energy/Crude-Oil/The-Oil-Powerhouses-Replacing-OPEC.html,https://d32r1sh890xpii.cloudfront.net/article/718x300/4d629dc6e3b12ceec7f8ff7d914f1d94.jpg,195
6,Bloomberg,"Grant Smith, Jessica Summers and Ann Koh Wednesday, November 28, 2018 (Bloomberg) -- OPEC and its allies will announce production cuts to check a slump in oil prices when they meet next week, defying pressure from U.S. President Donald Trump, according to a B… [+2817 chars]","OPEC and its allies will announce production cuts to check a slump in oil prices when they meet next week, according to a Bloomberg survey.",2018-11-28T00:00:00Z,"{'id': None, 'name': 'Rigzone.com'}",OPEC Expected to Cut Oil Output,https://www.rigzone.com/news/wire/opec_expected_to_cut_oil_output-28-nov-2018-157580-article/,https://images.rigzone.com/images/news/articles/157580_582x327.png,89
7,David Middleton,"Guest sequel by David Middleton This is sort of a sequel to Environmental Groups Claim Coal Killed 7,600 People in Europe in 2016 Cant Name Any of the Victims. Air Pollution Kills More People Than Cecil B. DeMille The World Health Organization estimates that … [+48014 chars]","Guest sequel by David Middleton This is sort of a sequel to Environmental Groups Claim Coal Killed 7,600 People in Europe in 2016… Can’t Name Any of the Victims. Air Pollution Kills More People Than Cecil B. DeMille The World Health Organization estimates tha…",2018-11-28T00:16:17Z,"{'id': None, 'name': 'Wattsupwiththat.com'}",Energy Poverty Kills More People Than Coal and Cecil B. DeMille… Combined!,https://wattsupwiththat.com/2018/11/27/energy-poverty-kills-more-people-than-coal-and-cecil-b-demille-combined/,https://4k4oijnpiu3l4c3h-zippykid.netdna-ssl.com/wp-content/uploads/2018/11/screen20shot202017-02-2820at209_13_4920am.png,197
8,Henning Gloystein,SINGAPORE (Reuters) - Oil prices rose on Wednesday ahead of an OPEC meeting next week at which the producer club is expected to decide some form of supply cut to counter an emerging glut. U.S. West Texas Intermediate (WTI) crude futures CLc1 were at $52.00 pe… [+1723 chars],Oil prices rose on Wednesday ahead of an OPEC meeting next week at which the producer club is expected to decide some form of supply cut to counter an emerging glut.,2018-11-28T00:56:48Z,"{'id': 'reuters', 'name': 'Reuters'}","Oil edges up ahead of OPEC meeting, but sentiment still cautious",https://in.reuters.com/article/global-oil-idINKCN1NX03M,https://s4.reutersmedia.net/resources/r/?m=02&d=20181128&t=2&i=1329281837&w=1200&r=LYNXNPEEAR03R,147
9,BY STEVE HARDY | shardy@theadvocate.com,ST. MARTINVILLE A testy trial over the Bayou Bridge pipeline began Tuesday with an assertion that the plaintiff's share of the land at the center of the dispute is worth only $1.11. The 162-mile Bayou Bridge will carry crude oil between Lake Charles and St. J… [+3782 chars],ST. MARTINVILLE — A testy trial over the Bayou Bridge pipeline began Tuesday with an assertion that the plaintiff's share of the land at the center of the dispute is worth only $1.11.,2018-11-28T01:03:00Z,"{'id': None, 'name': 'Theadvocate.com'}",Eminent domain trial on Bayou Bridge pipeline begins with assertion that land worth only $1.11,https://www.theadvocate.com/baton_rouge/news/environment/article_0ab74e60-f1b3-11e8-bec8-df2b30dbdacb.html,https://bloximages.newyork1.vip.townnews.com/theadvocate.com/content/tncms/assets/v3/editorial/a/bd/abddb492-8709-11e8-960e-3367cc711631/5b49595018634.image.jpg?resize=987%2C630,300
10,CL Manoj,"NEW DELHI: Reserve Bank of India governor Urjit Patel on Tuesday strongly stressed on the need to protect the autonomy of the central bank before a parliamentary panel, but stayed away from any direct criticism of the government. Patel, who appeared before th… [+2977 chars]",RBI governor says autonomy crucial to interests of depositors; Basel norms must be followed for global credibility.,2018-11-28T01:07:12Z,"{'id': 'the-times-of-india', 'name': 'The Times of India'}","RBI governor bats for autonomy, does not target government",https://economictimes.indiatimes.com/news/economy/policy/rbi-governor-bats-for-autonomy-does-not-target-government/articleshow/66837085.cms,"https://img.etimg.com/thumb/msid-66837084,width-1070,height-580,imgsize-957208,overlay-economictimes/photo.jpg",236
11,Reuters,"Oil prices have still lost almost a third of their value since early October, weighed down by an emerging supply overhang and by widespread weakness in financial markets. (Bloomberg pic) SINGAPORE: Oil prices rose on Wednesday ahead of an Opec meeting next we… [+1719 chars]","Oil prices have still lost almost a third of their value since early October, weighed down by an emerging supply overhang and by widespread weakness in financial markets.",2018-11-28T01:32:23Z,"{'id': None, 'name': 'Freemalaysiatoday.com'}","Oil edges up ahead of Opec meeting, but sentiment still cautious",https://www.freemalaysiatoday.com/category/business/2018/11/28/oil-edges-up-ahead-of-opec-meeting-but-sentiment-still-cautious/,https://s3media.freemalaysiatoday.com/wp-content/uploads/2018/11/oil-rig-bloomberg-2.jpg,77
12,Reuters,By Henning Gloystein SINGAPORE (Reuters) - Oil prices rose on Wednesday ahead of an OPEC meeting next week at which the producer club is expected to decide some form of supply cut to counter an emerging glut. U.S. West Texas Intermediate (WTI) crude futures w… [+1822 chars],"By Henning Gloystein SINGAPORE (Reuters) - Oil prices rose on Wednesday ahead of an OPEC meeting next week at which the producer club is expected to decide some form of supply cut to counter an emerging glut. The post Oil edges up ahead of OPEC meeting, but s…",2018-11-28T01:35:36Z,"{'id': None, 'name': 'Firstpost.com'}","Oil edges up ahead of OPEC meeting, but sentiment still cautious",https://www.firstpost.com/business/oil-edges-up-ahead-of-opec-meeting-but-sentiment-still-cautious-5628751.html,https://images.firstpost.com/wp-content/uploads/reuters/11-2018/28/2018-11-28T005648Z_1_LYNXNPEEAR03R_RTROPTP_2_GLOBAL-PETROLEUM.jpg,26
13,Deepshikha Sikarwar and Anandita Singh Mankotia,"NEW DELHI: A month after increasing import duties on telecom equipment, India has initiated a review of the tariffs as domestic service providers and US authorities sought a reversal, three government officials privy to the development told ET. The department… [+3180 chars]",The review will take into consideration the current macroeconomic and currency situations.,2018-11-28T01:38:28Z,"{'id': 'the-times-of-india', 'name': 'The Times of India'}",Government reviewing import duty on telecom gear,https://economictimes.indiatimes.com/industry/telecom/telecom-news/government-reviewing-import-duty-on-telecom-gear/articleshow/66837180.cms,"https://img.etimg.com/thumb/msid-66837182,width-1070,height-580,imgsize-247770,overlay-economictimes/photo.jpg",249
14,,What a day for Indian markets! Global cues suggested a muted opening but bulls managed to take control in the second half of the trading session despite muted trend seen in Asian as well as European markets. The final tally: The S&amp;P BSE Sensex rallied 159… [+3238 chars],"A rally among PSU banks, energy names as well as IT boosted the market while on the losing front, healthcare, metal, and telecom stocks some bit of selling pressure.",2018-11-28T01:39:52Z,"{'id': None, 'name': 'Moneycontrol.com'}",A morning walk down Dalal Street | Bulls to take control only if Nifty closes above 10774,https://www.moneycontrol.com/news/business/markets/a-morning-walk-down-dalal-street-bulls-to-take-control-only-if-nifty-closes-above-10774-3226251.html,https://static-news.moneycontrol.com/static-mcnews/2018/07/morning_walk_down_wall_street-770x433.jpg,57
15,JOSEPH CHIN,"KUALA LUMPUR: Blue chips extended their losses early Wednesday after Tenaga's disappointing results dragged the FBM KLCI deeper into the red. At 9.26am, the KLCI was down 3.85 points or 0.23% to 1,681.12. Turnover was 215.87 million shares valued at RM183.42m… [+1373 chars]",KUALA LUMPUR: Blue chips extended their losses early Wednesday after Tenaga's disappointing results dragged the FBM KLCI deeper into the red.,2018-11-28T01:44:31Z,"{'id': None, 'name': 'Thestar.com.my'}",Tenaga weighs on KLCI after disappointing results,http://www.thestar.com.my/business/business-news/2018/11/28/tenaga-weighs-on-klci-after-disappointing-results/,https://www.thestar.com.my/~/media/online/2017/12/15/04/33/market-jan2017.ashx/?w=620&h=413&crop=1&hash=16BD267E1A279FD82859614612A7D00F9FB47AF6,250
16,Henning Gloystein,SINGAPORE (Reuters) - Oil prices rose on Wednesday ahead of an OPEC meeting next week at which the producer club is expected to decide some form of supply cut to counter an emerging glut. U.S. West Texas Intermediate (WTI) crude futures CLc1 were at $51.88 pe… [+2228 chars],Oil prices rose on Wednesday ahead of an OPEC meeting next week at which the producer club is expected to decide some form of supply cut to counter an emerging glut.,2018-11-28T01:55:11Z,"{'id': 'reuters', 'name': 'Reuters'}","UPDATE 1-Oil prices climb ahead of OPEC, G20 meetings, but cautious mood lingers",https://www.reuters.com/article/us-global-oil-idUSKCN1NX02N,https://s2.reutersmedia.net/resources/r/?m=02&d=20181128&t=2&i=1329278660&w=1200&r=LYNXNPEEAR034,289
17,,"The market opened flat but an afternoon rally helped it gain for the second consecutive session on November 27, forming bullish candle on the daily charts. The rally was largely driven by index heavyweights Reliance Industries (up 1.66 percent), HDFC Bank (0.… [+6935 chars]",A list of important headlines from across news agencies that could help in your trade today.,2018-11-28T02:09:04Z,"{'id': None, 'name': 'Moneycontrol.com'}",What changed for the market while you were sleeping? Top 10 things to know,https://www.moneycontrol.com/news/business/markets/what-changed-for-the-market-while-you-were-sleeping-top-10-things-to-know-28-3226581.html,https://static-news.moneycontrol.com/static-mcnews/2017/03/stocks_BSE_Nifty_Sensex__bear_bull-2_1280-770x433.jpg,68
18,Reuters,Singapore: Oil prices rose on Wednesday ahead of an OPEC meeting next week at which the producer club is expected to decide some form of supply cut to counter an emerging glut. U.S. West Texas Intermediate (WTI) crude futures were at $51.88 per barrel at 0148… [+1975 chars],"The OPEC-meeting will follow a gathering by the G20 nations in Argentina this weekend, at which the US-China trade dispute as well as oil policy are expected to be discussed",2018-11-28T02:13:06Z,"{'id': None, 'name': 'Livemint.com'}","Oil prices rise ahead of OPEC meeting, but sentiment still cautious",https://www.livemint.com/Industry/B2L6e1HpLJIWkmxc44FnPO/Oil-prices-rise-ahead-of-OPEC-meeting-but-sentiment-still-c.html,https://www.livemint.com/rf/Image-621x414/LiveMint/Period2/2018/11/29/Photos/Processed/oilprices-kw5H--621x414@LiveMint.JPG,113
19,SA Transcripts,"KNOT Offshore Partners LP (NYSE: KNOP ) Q3 2018 Earnings Conference Call November 27, 2018 12:00 PM ET Executives John Costain - Chief Executive Officer &amp; Chief Financial Officer Analysts Hillary Cacanando - Wells Fargo Robert Silvera - R E Silvera &amp; … [+28228 chars]","KNOT Offshore Partners LP (NYSE:KNOP) Q3 2018 Earnings Conference Call November 27, 2018 12:00 PM ET Executives John Costain - Chief Executive Officer &amp; Chi",2018-11-28T02:23:04Z,"{'id': None, 'name': 'Seekingalpha.com'}",KNOT Offshore Partners LP (KNOP) CEO John Costain on Q3 2018 Results - Earnings Call Transcript,https://seekingalpha.com/article/4224959-knot-offshore-partners-lp-knop-ceo-john-costain-q3-2018-results-earnings-call-transcript,https://static3.seekingalpha.com/assets/og_image_192-59bfd51c9fe6af025b2f9f96c807e46f8e2f06c5ae787b15bf1423e6c676d4db.png,258
20,Ashutosh Shyam,"ET Intelligence Group: Car and bike-owners are saving big as autofuel prices head south in India. But the biggest gainers from the precipitate plunge in global crude oil rates are state-owned petrol and diesel retailers, whose marketing margins are hitting ne… [+1682 chars]",The smart recovery in marketing margins is reflected in the stock prices of the state-owned oil retailers.,2018-11-28T02:24:03Z,"{'id': 'the-times-of-india', 'name': 'The Times of India'}","As crude heads south, state oil companies rake in fat margins",https://economictimes.indiatimes.com/markets/commodities/news/as-crude-heads-south-state-oil-companies-rake-in-fat-margins/articleshow/66837459.cms,"https://img.etimg.com/thumb/msid-66837461,width-1070,height-580,imgsize-265140,overlay-etmarkets/photo.jpg",91
21,,"Oil prices rose on Wednesday ahead of an OPEC meeting next week at which the producer club is expected to decide some form of supply cut to counter an emerging glut. US West Texas Intermediate (WTI) crude futures were at $52.00 per barrel at 0027 GMT, up 44 c… [+1529 chars]","US West Texas Intermediate (WTI) crude futures were at $52.00 per barrel at 0027 GMT, up 44 cents, or 0.9 percent from their last settlement.",2018-11-28T02:36:19Z,"{'id': None, 'name': 'Moneycontrol.com'}","Oil edges up ahead of OPEC meeting, but sentiment still cautious",https://www.moneycontrol.com/news/business/commodities/oil-edges-up-ahead-of-opec-meeting-but-sentiment-still-cautious-3226661.html,https://static-news.moneycontrol.com/static-mcnews/2018/04/crude-oil-770x433.png,14
22,Getty Images,SINGAPORE: Oil prices rose on Wednesday ahead of an Opec meeting next week at which the producer club is expected to decide some form of supply cut to counter an emerging glut. US West Texas Intermediate (WTI) crude futures were at $52.00 per barrel at 0027 G… [+1544 chars],International Brent crude oil futures had yet to trade.,2018-11-28T02:39:25Z,"{'id': 'the-times-of-india', 'name': 'The Times of India'}","Oil edges up ahead of Opec meeting, but sentiment still cautious",https://economictimes.indiatimes.com/markets/commodities/news/oil-edges-up-ahead-of-opec-meeting-but-sentiment-still-cautious/articleshow/66837632.cms,"https://img.etimg.com/thumb/msid-66837667,width-1070,height-580,imgsize-874521,overlay-etmarkets/photo.jpg",80
23,,"Good morning! Here’s a lowdown on top macro triggers that may move market on Wednesday. This report was compiled from agency feeds. MP, Mizoram Assembly Election More than 5.04 crore voters of Madhya Pradesh and 7.7 lakh electors in Mizoram will be casting th… [+5833 chars]",Here’s a lowdown on top macro triggers that may move market on Wednesday.,2018-11-28T02:40:25Z,"{'id': 'the-times-of-india', 'name': 'The Times of India'}","Market Movers: All eyes on MP, Mizoram assembly elections; Trump on deal with China & Fed speech",https://economictimes.indiatimes.com/markets/stocks/news/market-movers-all-eyes-on-mp-mizoram-assembly-elections-trump-on-deal-with-china-fed-speech/articleshow/66837614.cms,"https://img.etimg.com/thumb/msid-66837650,width-1070,height-580,imgsize-204444,overlay-etmarkets/photo.jpg",215
24,newsfeedback@fool.com (Maxx Chatsko),"This time last year, investors were happily bidding up the price of Yamana Gold ( NYSE:AUY ) stock. The successful start-up of the all-important Cerro Moro mine in Argentina, which is expected to account for 13% of the company's gold production and 64% of sil… [+5289 chars]","The gold miner's most important growth project began operations on time and on budget, but it ran into unexpected headwinds courtesy of the government of Argentina.",2018-11-28T02:41:00Z,"{'id': None, 'name': 'Fool.com'}",Why Yamana Gold Is Down 30.8% So Far in 2018,https://www.fool.com/investing/2018/11/27/why-yamana-gold-is-down-308-so-far-in-2018.aspx,https://g.foolcdn.com/image/?url=https%3A%2F%2Fg.foolcdn.com%2Feditorial%2Fimages%2F502774%2Fstock-down-angry-fist.jpg&h=630&w=1200&op=resize,65
25,Reuters Editorial,"DUBAI, Nov 28 (Reuters) - Here are some factors that may affect Middle East stock markets on Wednesday. Reuters has not verified the press reports and does not vouch for their accuracy. INTERNATIONAL/REGIONAL * GLOBAL MARKETS-Asian shares tentative ahead of T… [+1840 chars]",Here are some factors that may affect Middle East stock markets on Wednesday. Reuters has not verified the press reports and does not vouch for their accuracy.',2018-11-28T02:41:12Z,"{'id': 'reuters', 'name': 'Reuters'}",MIDEAST - Factors to watch - November 28,https://www.reuters.com/article/mideast-factors-idUSL8N1Y307T,https://s4.reutersmedia.net/resources_v2/images/rcom-default.png,297
26,Joshua Gibson,Note: All information on this page is subject to change. The use of this website constitutes acceptance of our user agreement. Please read our privacy policy and legal disclaimer. Trading foreign exchange on margin carries a high level of risk and may not be … [+1276 chars],"Despite struggles with volatility, crude markets are beginning to mark in a corrective lean this week. Global oil production remains well above what demand can hope to absorb, but OPEC is expected to begin reigning in out-of-control production. After a rough …",2018-11-28T02:42:45Z,"{'id': None, 'name': 'Fxstreet.com'}","Crude setting up for a steady bullish recovery, WTI clawing back to $52.00",https://www.fxstreet.com/news/crude-setting-up-for-a-steady-bullish-recovery-wti-clawing-back-to-5200-201811280242,https://editorial.azureedge.net/images/Markets/Commodities/Energy/Oil/oil-pumps-25838229_Large.jpg,42
27,Getty Images,"NEW DELHI: Benchmark equity indices looked poised to extend their recent gains on positive global cues, but volatility may just heighten ahead of expiry of November futures and options contracts. Let's check out what might matter to Dalal Street all through t… [+3943 chars]",Let's check out what might matter to Dalal Street all through the day.,2018-11-28T02:45:58Z,"{'id': 'the-times-of-india', 'name': 'The Times of India'}",What changed your markets while you were sleeping,https://economictimes.indiatimes.com/markets/stocks/news/what-changed-markets-while-you-were-sleeping/articleshow/66837686.cms,"https://img.etimg.com/thumb/msid-66837680,width-1070,height-580,imgsize-185531,overlay-etmarkets/photo.jpg",37
28,Getty Images,SYDNEY: Asian shares dithered on Wednesday and the dollar jumped to a near 1-1/2-year top as risk assets rowed back amid conflicting signals on prospects for de-escalating the Sino-US trade dispute. MSCI 's broadest index of Asia-Pacific shares outside Japan … [+3691 chars],Japan's Nikkei gained 0.7 per cent. Chinese indices shed small early gains.,2018-11-28T02:48:28Z,"{'id': 'the-times-of-india', 'name': 'The Times of India'}","Asian shares tentative ahead of Trump-Xi meeting, Fed speech",https://economictimes.indiatimes.com/markets/stocks/news/asian-shares-tentative-ahead-of-trump-xi-meeting-fed-speech/articleshow/66837734.cms,"https://img.etimg.com/thumb/msid-66838202,width-1070,height-580,imgsize-784490,overlay-etmarkets/photo.jpg",255
29,Reuters,By Swati Pandey SYDNEY (Reuters) - Asian shares dithered on Wednesday and the dollar jumped to a near 1-1/2-year top as risk assets rowed back amid conflicting signals on prospects for de-escalating the Sino-U.S. trade dispute. MSCI's broadest index of Asia-P… [+3940 chars],SYDNEY (Reuters) - Asian shares dithered on Wednesday and the dollar jumped to a near 1-1/2-year top as risk assets rowed back amid conflicting signals on prospects for de-escalating the Sino-U.S. trade dispute.,2018-11-28T02:52:52Z,"{'id': None, 'name': 'Business-standard.com'}","Global Markets: Asian shares tentative ahead of Trump-Xi meeting, Fed speech",https://www.business-standard.com/article/reuters/global-markets-asian-shares-tentative-ahead-of-trump-xi-meeting-fed-speech-118112800117_1.html,https://bsmedia.business-standard.com/_media/bs/img/article/default/1181128/full-118112800117.jpg,231
30,,"Wednesday 02.00 GMT What you need to know Top Trump adviser sounds warning on trade progress Investors weigh G20 effect on US-China dispute Equities, forex steady ahead of summit Oil edges higher Hot topic Equity and foreign exchange markets were mostly calm … [+3761 chars]","Stocks, currencies and haven assets calm despite doubt over chance of US-China trade truce",2018-11-28T02:59:23Z,"{'id': 'financial-times', 'name': 'Financial Times'}",Asia markets hold steady as G20 approaches,https://www.ft.com/content/ff15230e-f2b4-11e8-ae55-df4bf40f9d0d,https://www.ft.com/__origami/service/image/v2/images/raw/http%3A%2F%2Fprod-upp-image-read.ft.com%2Fdd913066-ef11-11e8-8180-9cf212677a57?source=next-opengraph&fit=scale-down&width=900,133
31,"Ilya Spivak, Sr. Currency Strategist, Ilya Spivak",GOLD &amp; CRUDE OIL TALKING POINTS: Gold prices drop as Fed Vice Chair Clarida endorses policy status quo Hawkish remarks from Fed Chair Powell might see gold suffer further Crude oil price standstill may be interrupted by EIA inventory statistics Gold price… [+2547 chars],Gold prices will may continue to fall after suffering the largest drawdown in two weeks as hawkish comments from Chair Powell boost Fed rate hike bets.,2018-11-28T03:00:00Z,"{'id': None, 'name': 'Dailyfx.com'}",Gold Prices May Fall Further on Hawkish Powell Comments,https://www.dailyfx.com/forex/fundamental/daily_briefing/daily_pieces/commodities/2018/11/28/Gold-Prices-May-Fall-Further-on-Hawkish-Powell-Comments.html,,266
