,author,content,description,publishedAt,source,title,url,urlToImage,relevancy
0,Valerie Jones,"Rigzone Staff Tuesday, October 16, 2018 Throughout the years, advances in horizontal drilling and hydraulic fracturing have helped boost natural gas production in Texas. In fact, Texas leads the United States in oil and gas production and produces more than o… [+2420 chars]","A new report by the Consumer Energy Alliance finds that Texas residents saved billions of dollars, thanks to natural gas production.",2018-10-16T00:00:00Z,"{'id': None, 'name': 'Rigzone.com'}",Natural Gas Helps Texans Save Almost $60B in 10 Years,https://www.rigzone.com/news/natural_gas_helps_texans_save_almost_60b_in_10_years-16-oct-2018-157220-article/,https://images.rigzone.com/images/news/articles/157220_582x327.png,131
1,"Associated Press, By Associated Press","ISTANBUL — U.S. Secretary of State Mike Pompeo met on Tuesday with Saudi Arabia's King Salman over the disappearance and alleged slaying of Saudi writer Jamal Khashoggi, who vanished two weeks ago during a visit to the Saudi Consulate in Istanbul. Pompeo's ar… [+6212 chars]","ISTANBUL — U.S. Secretary of State Mike Pompeo met on Tuesday with Saudi Arabia&#39;s King Salman over the disappearance and alleged slaying of Saudi writer Jamal Khashoggi, who vanished two weeks ago during a visit to the Saudi Consulate in Istanbul.Pompeo&#…",2018-10-16T00:00:00Z,"{'id': None, 'name': 'Bostonherald.com'}",Mike Pompeo meets Saudi king over Khashoggi's disappearance,http://www.bostonherald.com/news/international/2018/10/mike_pompeo_meets_saudi_king_over_khashoggis_disappearance,http://www.bostonherald.com/sites/default/files/styles/full/public/media/ap/2018/10/16/999b5ee66282450c9c2ebf5b89eb79f0.jpg?itok=YG8fAZVN,171
2,Bloomberg,"Stephen Stapczynski and Dan Murtaugh Tuesday, October 16, 2018 (Bloomberg) -- The Inpex Corp.-operated Ichthys LNG export project in northern Australia may load its first natural gas cargo as soon as this week, according to people with knowledge of the ventur… [+3684 chars]","The Ichthys LNG export project in northern Australia may load its 1st natural gas cargo as soon as this week, according to people with knowledge of the venture's preliminary sales plans.",2018-10-16T00:00:00Z,"{'id': None, 'name': 'Rigzone.com'}",1st Ichthys LNG Cargo Said Possible This Week,https://www.rigzone.com/news/wire/1st_ichthys_lng_cargo_said_possible_this_week-16-oct-2018-157213-article/,https://images.rigzone.com/images/news/articles/157213_582x327.png,241
3,Bloomberg,"Dan Murtaugh &amp; Stephen Stapczynski Tuesday, October 16, 2018 (Bloomberg) -- The Inpex Corp.-operated Ichthys LNG export project in northern Australia may load its first natural gas cargo as soon as this week, according to people with knowledge of the vent… [+3687 chars]","The Ichthys LNG export project in northern Australia may load its 1st natural gas cargo as soon as this week, according to sources.",2018-10-16T00:00:00Z,"{'id': None, 'name': 'Rigzone.com'}",First Ichthys LNG Cargo Said Possible This Week,https://www.rigzone.com/news/wire/first_ichthys_lng_cargo_said_possible_this_week-16-oct-2018-157213-article/,https://images.rigzone.com/images/news/articles/157213_582x327.png,242
4,Bloomberg,"Jessica Summers Tuesday, October 16, 2018 (Bloomberg) -- Oil popped higher after an industry report showed an unexpected decline in U.S. crude inventories. Futures rose from the settlement in New York on Tuesday after the industry-funded American Petroleum In… [+2751 chars]",Oil popped higher after an industry report showed an unexpected decline in US crude inventories.,2018-10-16T00:00:00Z,"{'id': None, 'name': 'Rigzone.com'}",Oil Rises After Industry Reports Surprise US Crude Stock Draw,https://www.rigzone.com/news/wire/oil_rises_after_industry_reports_surprise_us_crude_stock_draw-16-oct-2018-157223-article/,https://images.rigzone.com/images/news/articles/157223_582x327.png,200
5,Bloomberg,"Kevin Orland &amp; Robert Tuttle Tuesday, October 16, 2018 (Bloomberg) -- Gibson Energy Inc. surged the most in more than a year after announcing a plan to build 1 million barrels of new oil-tank space in Western Canada, underscoring how the crude storage and… [+2257 chars]",Gibson Energy Inc. surged the most in more than a year after announcing a plan to build 1 million barrels of new oil-tank space in Western Canada.,2018-10-16T00:00:00Z,"{'id': None, 'name': 'Rigzone.com'}",Gibson Jumps as Canadian Crude Woes Seen Boosting Tank Provider,https://www.rigzone.com/news/wire/gibson_jumps_as_canadian_crude_woes_seen_boosting_tank_provider-16-oct-2018-157219-article/,https://images.rigzone.com/images/rz-facebook.jpg,70
6,Marketplace Staff,"As a nonprofit news organization, what matters to us is the same thing that matters to you: being a source for trustworthy, independent news that makes people smarter about business and the economy. So if Marketplace has helped you understand the economy bett… [+282 chars]","In the first half of 2018, China was the biggest buyer of U.S. crude oil. In August and September, they barely bought any. Energy reporter Rebecca Elliott wrote about the sudden drop-off in the Wall Street Journal, and we talked to her about why this happened…",2018-10-16T00:37:54Z,"{'id': None, 'name': 'Marketplace.org'}",U.S. crude oil exports to China drop to nearly zero amid trade war,https://www.marketplace.org/2018/10/15/world/trade-showdown/us-crude-oil-exports-china-drop-nearly-zero-amid-trade-war,https://www.marketplace.org/assets/social-fallback-d4e081b9fdf8c7fd0204b8cbf257aa3d53db7b925558f707600f4e30ddd18bf5.png,309
7,Reuters,"Australia will consider recognizing Jerusalem as Israel's capital and shifting its embassy there from Tel Aviv, Australia's Prime Minister said on Tuesday. The status of Jerusalem is one of the thorniest obstacles to a peace deal between Israel and the Palest… [+2428 chars]",Australia's prime minister says he is open to recognizing West Jerusalem as Israel's capital and shifting its embassy from Tel Aviv.,2018-10-16T00:42:11Z,"{'id': 'cbc-news', 'name': 'CBC News'}","Australia considering moving embassy to Jerusalem, PM says",https://www.cbc.ca/news/world/australia-embassy-israel-jerusalem-1.4864216,https://i.cbc.ca/1.4864334.1539649297!/fileImage/httpImage/image.jpg_gen/derivatives/16x9_620/96417205.jpg,53
8,Shinichi Saoshiro,"TOKYO (Reuters) - Asian stocks bounced modestly on Tuesday, gaining a toe-hold after a week of heavy losses, although increasing tensions between Saudi Arabia and the West fanned geopolitical concerns and capped gains. The disappearance earlier this month of … [+2528 chars]","Asian stocks bounced modestly on Tuesday, gaining a toe-hold after a week of heavy losses, although increasing tensions between Saudi Arabia and the West fanned geopolitical concerns and capped gains.",2018-10-16T01:11:08Z,"{'id': 'reuters', 'name': 'Reuters'}",Asia stocks bounce modestly but Saudi tensions limit gains,https://ca.reuters.com/article/businessNews/idCAKCN1MQ02J-OCABS,https://s4.reutersmedia.net/resources/r/?m=02&d=20181016&t=2&i=1315150991&w=1200&r=LYNXNPEE9F021-OCABS,410
9,,"Energy Transfer Partners LP said on Monday that a West Texas pipeline would resume operations on Saturday as planned after the pipeline spilled water with nontoxic green dye and residual crude oil near Abilene, Texas. The spill went into Button Willow Creek a… [+899 chars]","Energy Transfer Partners LP said on Monday that a West Texas pipeline would resume operations on Saturday as planned after the pipeline spilled water with nontoxic green dye and residual crude oil near Abilene, Texas. The spill went into Button …",2018-10-16T01:12:20Z,"{'id': None, 'name': 'Insurancejournal.com'}","West Texas Pipeline to Resume on Schedule After Spill, Company Says",https://www.insurancejournal.com/news/southcentral/2018/10/15/504641.htm,https://www.insurancejournal.com/img/insurancejournal-square.png,59
10,Shinichi Saoshiro,"TOKYO (Reuters) - Asian stocks bounced modestly on Tuesday, gaining a toe-hold after a week of heavy losses, although increasing tensions between Saudi Arabia and the West fanned geopolitical concerns and capped gains. The disappearance earlier this month of … [+2468 chars]","Asian stocks bounced modestly on Tuesday, gaining a toe-hold after a week of heavy losses, although increasing tensions between Saudi Arabia and the West fanned geopolitical concerns and capped gains.",2018-10-16T01:12:38Z,"{'id': 'reuters', 'name': 'Reuters'}",Asia stocks bounce modestly but Saudi tensions limit gains,https://ca.reuters.com/article/topNews/idCAKCN1MQ02J-OCATP,https://s3.reutersmedia.net/resources/r/?m=02&d=20181016&t=2&i=1315152092&w=1200&r=LYNXNPEE9F021-OCATP,409
11,Shinichi Saoshiro,"TOKYO (Reuters) - Asian stocks bounced modestly on Tuesday, gaining a toe-hold after a week of heavy losses, although increasing tensions between Saudi Arabia and the West fanned geopolitical concerns and capped gains. The disappearance earlier this month of … [+2468 chars]","Asian stocks bounced modestly on Tuesday, gaining a toe-hold after a week of heavy losses, although increasing tensions between Saudi Arabia and the West fanned geopolitical concerns and capped gains.",2018-10-16T01:12:38Z,"{'id': 'reuters', 'name': 'Reuters'}",Asia stocks bounce modestly but Saudi tensions limit gains,https://www.reuters.com/article/us-global-markets/asia-stocks-bounce-modestly-but-saudi-tensions-limit-gains-idUSKCN1MQ02J,https://s1.reutersmedia.net/resources/r/?m=02&d=20181016&t=2&i=1315151116&w=1200&r=LYNXNPEE9F021,38
12,https://www.dailymail.co.uk/home/search.html?s=&authornamef=Reuters,"By Shinichi Saoshiro TOKYO, Oct 16 (Reuters) - Asian stocks bounced modestly on Tuesday, gaining a toe-hold after a week of heavy losses, although increasing tensions between Saudi Arabia and the West fanned geopolitical concerns and capped gains. The disappe… [+2579 chars]","By Shinichi SaoshiroTOKYO, Oct 16 (Reuters) - Asian stocks bounced modestly on  Tuesday, gaining a toe-hold after a week of heavy losses,  although...",2018-10-16T01:12:57Z,"{'id': 'daily-mail', 'name': 'Daily Mail'}",Asia stocks bounce modestly but Saudi tensions limit gains,https://www.dailymail.co.uk/wires/reuters/article-6280075/Asia-stocks-bounce-modestly-Saudi-tensions-limit-gains.html,https://i.dailymail.co.uk/i/pix/m_logo_636x382px.png,289
13,Individual Trader,The two main asset classes in our portfolio are equities and precious metals. We believe in diversification in the respect that we aim to align ourselves with the main trends in each of the other asset classes. Crude oil ( USO ) is an asset class that has rea… [+3955 chars],"We are due a daily cycle low, which the Saudi Arabian news will probably result in. However, crude oil is long overdue a yearly cycle low. It's been 16 months s",2018-10-16T01:12:57Z,"{'id': None, 'name': 'Seekingalpha.com'}",Crude Oil: Only A Small Bounce Is Due,https://seekingalpha.com/article/4211776-crude-oil-small-bounce-due,https://static.seekingalpha.com/uploads/2018/10/15/932120-15396007504518316_origin.png,17
14,,"TOKYO: Asian stocks bounced modestly on Tuesday, gaining a toe-hold after a week of heavy losses, although increasing tensions between Saudi Arabia and the West fanned geopolitical concerns and capped gains. The disappearance earlier this month of a Saudi jou… [+2529 chars]","Asian stocks bounced modestly on Tuesday, gaining a toe-hold after a week of heavy losses, although increasing tensions between Saudi Arabia and the West fanned geopolitical concerns and capped gains.",2018-10-16T01:15:31Z,"{'id': None, 'name': 'Channelnewsasia.com'}",Asia stocks bounce modestly but Saudi tensions limit gains,https://www.channelnewsasia.com/news/business/asia-stocks-bounce-modestly-but-saudi-tensions-limit-gains-10831430,http://www.channelnewsasia.com/image/10831428/16x9/991/557/c2ff0d7aa887704c697fd20efba7583b/dk/people-walk-past-an-electronic-board-showing-japan-s-nikkei-average-and-japanese-yen-s-exchange-rate-against-the-u-s--dollar-outside-a-brokerage-in-tokyo-1.jpg,106
15,https://www.dailymail.co.uk/home/search.html?s=&authornamef=Reuters,"SEOUL, Oct 16 (Reuters) - Oil prices rose on Tuesday on signs of falling Iran oil exports ahead of U.S. sanctions against Tehran in November, while geopolitical tensions remain over a missing Saudi journalist. International benchmark Brent crude for December … [+2089 chars]","SEOUL, Oct 16 (Reuters) - Oil prices rose on Tuesday on  signs of falling Iran oil exports ahead of U.S. sanctions  against Tehran in November, while...",2018-10-16T01:17:57Z,"{'id': 'daily-mail', 'name': 'Daily Mail'}",Oil prices rise on signs of falling Iranian oil exports,https://www.dailymail.co.uk/wires/reuters/article-6280085/Oil-prices-rise-signs-falling-Iranian-oil-exports.html,https://i.dailymail.co.uk/i/pix/m_logo_636x382px.png,161
16,,"October 16, 2018 SEOUL (Reuters) – Oil prices rose on Tuesday on signs of falling Iran oil exports ahead of U.S. sanctions against Tehran in November, while geopolitical tensions remain over a missing Saudi journalist. International benchmark Brent crude for … [+2035 chars]","SEOUL - Oil prices rose on Tuesday on signs of falling Iran oil exports ahead of U.S. sanctions against Tehran in November, while geopolitical tensions remain over a missing Saudi journalist",2018-10-16T01:20:28Z,"{'id': None, 'name': 'Oann.com'}",Oil prices rise on signs of falling Iranian oil exports,https://www.oann.com/oil-prices-rise-on-signs-of-falling-iranian-oil-exports/,,417
17,The Star Online,"TOKYO: Asian stocks bounced modestly on Tuesday, gaining a toe-hold after a week of heavy losses, although increasing tensions between Saudi Arabia and the West fanned geopolitical concerns and capped gains. The disappearance earlier this month of a Saudi jou… [+2467 chars]","TOKYO: Asian stocks bounced modestly on Tuesday, gaining a toe-hold after a week of heavy losses, although increasing tensions between Saudi Arabia and the West fanned geopolitical concerns and capped gains",2018-10-16T01:22:22Z,"{'id': None, 'name': 'Thestar.com.my'}",Asia stocks bounce modestly but Saudi tensions limit gains,http://www.thestar.com.my/business/business-news/2018/10/16/asia-stocks-bounce-modestly-but-saudi-tensions-limit-gains/,https://www.thestar.com.my/~/media/online/2018/10/16/01/26/stocks-nikkei.ashx/?w=620&h=413&crop=1&hash=B866F60FCFD8A28C0D9830D11731423B6159735F,352
18,,What a turnaround for Indian markets on Monday. Benchmark indices managed to recoup losses and closed with gains of over 100 points on the Sensex while for Nifty it was about 40 points. Fall in crude oil prices helped Nifty regain more than 100 points from th… [+3578 chars],"9 companies will declare their results for the September quarter which include names like Federal Bank, Hero MotoCorp, Infosys, Mahindra CIE, Shakti Pumps etc. among others.",2018-10-16T01:30:47Z,"{'id': None, 'name': 'Moneycontrol.com'}","A morning walk down Dalal Street: Market to take cues from earnings; Infosys, Hero MotoCorp in focus",https://www.moneycontrol.com/news/business/markets/a-morning-walk-down-dalal-street-market-to-take-cues-from-earnings-infosys-hero-motocorp-in-focus-3049011.html,https://static-news.moneycontrol.com/static-mcnews/2018/07/morning_walk_down_wall_street-1-770x433.jpg,85
19,Bernama,"Ringgit banknotes in Kuala Lumpur. (AFP pic) KUALA LUMPUR: The ringgit strengthened against the greenback in early trade today on better demand, amidst unfavourable economic data from the United States. At 9.02am, the local unit stood at 4.1510/1540 against t… [+860 chars]","Meanwhile, the ringgit traded mostly higher against other major currencies, except the Singapore dollar, in easing to 3.0180/0213 from 3.0171/0205 at Monday's close.",2018-10-16T02:06:39Z,"{'id': None, 'name': 'Freemalaysiatoday.com'}",Ringgit opens higher on better demand,https://www.freemalaysiatoday.com/category/business/2018/10/16/ringgit-opens-higher-on-better-demand/,https://s3media.freemalaysiatoday.com/wp-content/uploads/2018/10/ringgit-afp-10102018.jpg,143
20,,"The speed of decision making in India is not good for its brand as processes have delayed BP's investment in the country, a top official of the British oil major said. BP Chief Executive Robert Dudley also highlighted that price controls were not good for the… [+2214 chars]",BP Chief Executive Robert Dudley also highlighted that price controls were not good for the oil sector and would not solve problem of high fuel prices in the long term.,2018-10-16T02:12:04Z,"{'id': None, 'name': 'Moneycontrol.com'}",Speed of decision making in India not good for its image: BP executive,https://www.moneycontrol.com/news/business/speed-of-decision-making-in-india-not-good-for-its-image-bp-executive-3048971.html,https://static-news.moneycontrol.com/static-mcnews/2018/02/BP-770x433.jpg,60
21,,Equities may see a mixed start amid lower close on the US markets and rising Asian indices. Higher crude oil prices could also weigh on benchmarks. Trends on SGX Nifty currently indicate a higher opening for the market here. The market managed to extend Frida… [+5080 chars],A look at cues from the market in India and abroad to help you with your trade.,2018-10-16T02:15:42Z,"{'id': None, 'name': 'Moneycontrol.com'}",What changed for the market while you were sleeping? 10 things to know,https://www.moneycontrol.com/news/business/markets/what-changed-for-the-market-while-you-were-sleeping-10-things-to-know-36-3049051.html,https://static-news.moneycontrol.com/static-mcnews/2018/08/NSE_PTI-662x435.jpg,65
22,The Star Online,"KUALA LUMPUR: The ringgit strengthened against the greenback in early trade today on better demand, amidst unfavourable economic data from the United States. At 9.02 am, the local unit stood at 4.1510/1540 against the US dollar from the 4.1540/1580 recorded y… [+828 chars]","KUALA LUMPUR: The ringgit strengthened against the greenback in early trade today on better demand, amidst unfavourable economic data from the United States.",2018-10-16T02:17:02Z,"{'id': None, 'name': 'Thestar.com.my'}",Ringgit higher as US retail sales disappoint,http://www.thestar.com.my/business/business-news/2018/10/16/ringgit-higher-as-us-retail-sales-disappoint/,https://www.thestar.com.my/~/media/online/2018/07/18/02/18/dollar-ringgit.ashx/?w=620&h=413&crop=1&hash=59BC7E884472AC59981533B39BACD1B8402BCD81,167
23,,"Asian stocks bounced modestly on Tuesday, gaining a toe-hold after a week of heavy losses, although increasing tensions between Saudi Arabia and the West fanned geopolitical concerns and capped gains. The disappearance earlier this month of a Saudi journalist… [+2456 chars]","MSCIâs broadest index of Asia-Pacific shares outside Japan nudged up 0.25 percent, crawling away from a 19-month trough touched on Thursday.",2018-10-16T02:17:37Z,"{'id': None, 'name': 'Moneycontrol.com'}",Asia stocks bounce modestly but Saudi tensions limit gains,https://www.moneycontrol.com/news/business/markets/asia-stocks-bounce-modestly-but-saudi-tensions-limit-gains-3049061.html,https://static-news.moneycontrol.com/static-mcnews/2017/03/asian-markets-new-770x433.jpg,72
24,ETMarkets.com,"A host of quarterly earnings, including that of IT giant Infosys and two-wheeler major Hero MotoCorp, will set the tone for the domestic market on Tuesday. Let's check out what might matter to Dalal Street during the day: Singapore trading sets stage for firm… [+3533 chars]","Asian stocks bounced modestly on Tuesday, gaining a toe-hold after a week of heavy losses.",2018-10-16T02:32:24Z,"{'id': 'the-times-of-india', 'name': 'The Times of India'}",What changed your markets while you were sleeping,https://economictimes.indiatimes.com/markets/stocks/news/what-changed-your-markets-while-you-were-sleeping/articleshow/66230925.cms,"https://img.etimg.com/thumb/msid-66230923,width-1070,height-580,imgsize-339517,overlay-etmarkets/photo.jpg",240
25,Utpal Bhaskar,"New Delhi: In what may further reduce India’s solar power tariffs, Saudi Arabia is interested in partnering with India for developing complementary supply chains as well as deploying finance and new technologies here. Also, Lightsource BP is betting big for d… [+6827 chars]",Saudi Arabia is interested in partnering with India for developing complementary supply chains as well as deploying finance and new technologies,2018-10-16T02:35:55Z,"{'id': None, 'name': 'Livemint.com'}","Saudi Arabia, BP eye major Indian solar play",https://www.livemint.com/Industry/6rWpDOk6k1yMFdIjP6NZLP/Saudi-Arabia-BP-eye-major-Indian-solar-play.html,https://www.livemint.com/rf/Image-621x414/LiveMint/Period2/2018/10/17/Photos/Processed/KhalidAlFalih-kWJF--621x414@LiveMint.JPG,128
26,FP Staff,Travancore Devaswom Board to meet stakeholders as Sabarimala reopens for pilgrims tomorrow The administrative body of the iconic Kerala temple is expected to hold a meeting with all the stakeholders today. Amid massive and continued protests over the Supreme … [+4482 chars],Union minister MJ Akbar is likely to record his statement at the Patiala high court in the criminal defamation case he has filed against journalist Priya Ramani. The post Daily Bulletin: MJ Akbar to record statement in defamation case; Travancore Devaswom Boa…,2018-10-16T02:36:26Z,"{'id': None, 'name': 'Firstpost.com'}",Daily Bulletin: MJ Akbar to record statement in defamation case; Travancore Devaswom Board to meet as Sabarimala reopens; day’s top stories,https://www.firstpost.com/india/daily-bulletin-mj-akbar-to-record-statement-in-defamation-case-travancore-devaswom-board-to-meet-as-sabarimala-reopens-days-top-stories-5384441.html,https://images.firstpost.com/wp-content/uploads/2018/10/mj-akbar-2-facebook-1280-min.jpg,156
27,ANNABELLE LIANG,"SINGAPORE Asian markets were mostly higher on Tuesday, though Chinese benchmarks fell after the government reported inflation rose for a fourth straight month. Hopes that President Donald Trump may meet his Chinese counterpart Xi Jinping at the Group of 20 su… [+2156 chars]","Asian markets were mostly higher on Tuesday, though Chinese benchmarks fell after the government reported inflation rose for a fourth straight month. Hopes that President Donald Trump may meet his Chinese counterpart Xi Jinping at the Group of 20 summit in No…",2018-10-16T02:40:00Z,"{'id': None, 'name': 'Startribune.com'}","Asian shares gain, but inflation drags on Chinese benchmarks",http://www.startribune.com/asian-shares-gain-but-inflation-drags-on-chinese-benchmarks/497660001/,http://assets.startribune.com/static/img/branding/logos/strib-social-card.png?d=1539630205,397
28,Dow Jones Newswire,"A day after a broad selloff, Asian stock markets gained in early trading Tuesday, despite modest losses on Wall Street. Japans Nikkei NIK, +0.61% was up 0.5%, led by SoftBank Group and energy and steel stocks, amid continuing concerns about U.S. trade issues.… [+2104 chars]","A day after a broad selloff, Asian stock markets gained in early trading Tuesday, despite modest losses on Wall Street.",2018-10-16T02:40:30Z,"{'id': None, 'name': 'Marketwatch.com'}","Asia Markets: Asian markets rise, driven by oil-company gains",https://www.marketwatch.com/story/asian-markets-rise-driven-by-oil-company-gains-2018-10-15,http://s.marketwatch.com/public/resources/MWimages/MW-GR815_sinope_ZG_20181015223506.jpg,7
29,Reuters,"Oil prices rose on Tuesday on signs of falling Iran oil exports ahead of U.S. sanctions against Tehran in November, while geopolitical tensions remain over a missing Saudi journalist. International benchmark Brent crude for December delivery rose 9 cents, or … [+1947 chars]","Iran's exports of crude oil averaged 1.33 million barrels per day in the first two weeks of October, according to data from Refinitiv Eikon.",2018-10-16T02:42:00Z,"{'id': 'cnbc', 'name': 'CNBC'}",Oil prices rise on signs of falling Iranian oil exports,https://www.cnbc.com/2018/10/16/oil-markets-us-sanctions-on-iran-missing-saudi-journalist-in-focus.html,https://fm.cnbc.com/applications/cnbc.com/resources/img/editorial/2016/01/05/103281417-GettyImages-462769794.1910x1000.jpg,229
30,Nandini Sanyal,Here’s a lowdown on top macro triggers that may move market on Tuesday. This report was compiled from agency feeds. PM Asks Oil Producers to Review Terms of Payment Prime Minister Narendra Modi has urged oil suppliers to review payment terms to give temporary… [+4244 chars],A look at top macro triggers that may move market on Tuesday,2018-10-16T02:42:04Z,"{'id': 'the-times-of-india', 'name': 'The Times of India'}",Market Movers: Top triggers for your day on D-Street,https://economictimes.indiatimes.com/markets/stocks/news/market-movers-pm-urges-review-of-oil-payment-terms-moodys-on-nbfcs-trade-deficit-falls-more/articleshow/66230997.cms,"https://img.etimg.com/thumb/msid-66231057,width-1070,height-580,imgsize-54652,overlay-etmarkets/photo.jpg",25
31,Reuters,"By: Reuters | Tokyo | Published: October 16, 2018 8:16:49 am People walk past an electronic board showing Japan’s Nikkei average outside a brokerage in Tokyo, Japan. Reuters/Toru Hanai Asian stocks bounced modestly on Tuesday, gaining a toe-hold after a week … [+2681 chars]",Japan's Nikkei bounced 0.3 percent following a decline of nearly 2 percent the previous day.,2018-10-16T02:46:49Z,"{'id': None, 'name': 'Indianexpress.com'}",Asia stocks bounce modestly but Saudi tensions limit gains,https://indianexpress.com/article/business/market/asia-stocks-bounce-modestly-but-saudi-tensions-limit-gains-5403787/,https://images.indianexpress.com/2018/10/nikkei-japan-reuters-759.jpg?w=759,34
